doc_id,nama_dokumen,bab,bagian,pasal,angka,ayat,isi,penjelasan
DOC032,220~PMK.01_2019.txt,,,,1,,"**Latar Belakang Pembangunan, Pengembangan dan Penerapan Sistem National Single Window.** Latar belakang dilakukannya pembangunan, pengembangan dan penerapan Sistem National Single Window di Indonesia antara lain: a. Komitmen Pemerintah Republik Indonesia terhadap kesepakatan di tingkat Regional ASEAN, yakni: 1) Kesepakatan Pemimpin Negara Anggota ASEAN dalam The Declaration of ASEAN Concord II (Bali Concord II), 7 Oktober 2003. 2) Kesepakatan Menteri Ekonomi ASEAN dalam ASEAN Agreement to Establish & Implement the ASEAN Single Window, 9 Desember 2005. 3) Kesepakatan Menteri Keuangan ASEAN dalam ASEAN Protocol to Establish and Implement the ASEAN Single Window, April 2006. 4) Kesepakatan Pemimpin Negara Anggota ASEAN dalam Declaration on the ASEAN Economic Community Blueprint, 20 November 2007. b. Kondisi kinerja pelayanan ekspor dan impor yang perlu ditingkatkan: 1) Lead time waktu penanganan barang impor dan ekspor yang masih terlalu lama (dibandingkan dengan negara anggota ASEAN lainnya). 2) Masih banyaknya titik layanan (point of services) dalam penanganan lalu lintas barang ekspor dan impor, sehingga mengakibatkan ekonomi biaya tinggi (high cost economy). 3) Tingkat validitas dan akurasi data atas transaksi dan kegiatan ekspor dan impor yang belum memadai, terutama terkait dengan data perizinan ekspor-impor. c. Kepentingan nasional untuk mengontrol lalu lintas barang antar negara. Untuk melindungi kepentingan nasional, perlu adanya kontrol terhadap lalu lintas barang ekspor-impor secara lebih baik, terutama yang terkait dengan isu terorisme, trans-national crime, drug trafficking, illegal activity, Intellectual Property Right dan perlindungan konsumen. d. Kinerja sistem pelayanan publik yang perlu ditingkatkan. Untuk meningkatkan daya saing perekonomian nasional, perlu dilakukan peningkatan kinerja sistem pelayanan publik dengan menerapkan prinsip-prinsip good governance melalui pembangunan otomasi sistem pelayanan yang terintegrasi. e. Sistem pelayanan yang belum terintegrasi menghambat kelancaran arus barang. Untuk meningkatkan kelancaran arus barang ekspor-impor, sangat dibutuhkan adanya integrasi sistem antar Instansi Pemerintah (GA) yang akan mampu meningkatkan efisiensi pelayanan keseluruhan proses ekspor-impor.",
DOC032,220~PMK.01_2019.txt,,,,2,,"**Dasar hukum Penerapan Sistem National Single Window** a. Keputusan Presiden Nomor 54 Tahun 2002 tentang Tim Koordinasi Peningkatan Arus Barang Ekspor dan Impor jo. Keputusan Presiden Nomor 24 Tahun 2005 tentang Perubahan atas Keputusan Presiden Nomor 54 Tahun 2002 tentang Tim Koordinasi Peningkatan Kelancaran Arus Barang Ekspor dan Impor. b. Instruksi Presiden Nomor 3 Tahun 2006 tentang Paket Kebijakan Perbaikan Iklim Investasi dilanjutkan dengan Instruksi Presiden Nomor 6 Tahun 2007 tentang Kebijakan Percepatan Pengembangan Sektor Riil dan Pemberdayaan Usaha Mikro, Kecil, dan Menengah dan Instruksi Presiden Nomor 5 Tahun 2008 tentang Fokus Program Ekonomi Tahun 2008-2009 berkaitan dengan Peningkatan Investasi dan Fokus Program Ekonomi. c. Peraturan Presiden Nomor 10 Tahun 2008 tentang Penggunaan Sistem Elektronik dalam rangka Indonesia National Single Window. d. Keputusan Menteri Koordinator Bidang Perekonomian Nomor 22/M.Ekon/03/2006 tentang Tim Persiapan National Single Window jo. KEP-19/M.EKON/04/2008 tentang Tim Persiapan National Single Window.",
DOC032,220~PMK.01_2019.txt,,,,3,,"**Pengertian dan Tujuan Umum** a. **Pengertian Umum ASEAN Single Window** ASEAN Single Window adalah suatu environment dimana sistem National Single Window dari negara anggota ASEAN dioperasikan dan diintegrasikan, sehingga mampu meningkatkan kinerja penanganan atas lalu lintas barang, untuk mendorong percepatan proses customs clearance. **Pengertian National Single Window** National Single Window adalah sistem yang memungkinkan dilakukannya: 1) Single submission of data and information; 2) Single and synchronous processing of data and information; and 3) Single decision-making for customs release and clearance of cargoes. b. **Tujuan Umum Penerapan Sistem National Single Window** 1) Meningkatkan kecepatan penyelesaian proses ekspor-impor melalui peningkatan efektivitas dan kinerja sistem layanan yang terintegrasi antar seluruh entitas yang terkait. 2) Meminimalisasi waktu dan biaya yang diperlukan dalam penanganan lalu lintas barang ekspor dan impor, terutama terkait dengan proses customs release and clearance of cargoes. 3) Meningkatkan validitas dan akurasi data dan informasi yang terkait dengan kegiatan ekspor dan impor. 4) Meningkatkan daya saing perekonomian nasional dan mendorong masuknya investasi. c. **Portal Indonesia National Single Window** Sistem yang akan melakukan integrasi informasi berkaitan dengan proses penanganan dokumen kepabeanan dan pengeluaran barang, yang menjamin keamanan data dan informasi serta memadukan alur dan proses informasi antar sistem internal secara otomatis, yang meliputi sistem kepabeanan, perizinan, kepelabuhanan/kebandarudaraan, dan sistem lain yang terkait dengan proses penanganan dokumen kepabeanan dan pengeluaran barang.",
DOC032,220~PMK.01_2019.txt,,,,4,,"**Visi, Misi, Strategi, dan Tujuan Umum Penerapan Sistem National Single Window** a. **Visi Penerapan Sistem National Single Window** Terwujudnya lingkungan “National Single Window” di Indonesia, yaitu layanan tunggal elektronik untuk memfasilitasi pengajuan informasi standar guna menyelesaikan semua pemenuhan persyaratan dan ketentuan, serta semua kegiatan yang terkait dengan kelancaran arus barang ekspor, impor, dan transit, dalam rangka meningkatkan daya saing nasional. b. **Misi Penerapan Sistem National Single Window** Mewujudkan suatu sistem layanan publik yang terintegrasi dalam pelayanan, pengawasan, dan penanganan atas lalu lintas barang ekspor dan impor. c. **Strategi Penerapan Sistem National Single Window** 1) Melakukan kolaborasi sistem dari seluruh entitas (instansi pemerintah, institusi lainnya, dan swasta) sebagai upaya percepatan penyelesaian proses ekspor dan impor. 2) Komitmen bersama untuk koordinasi dalam penyelarasan proses bisnis antar entitas (GA), guna meningkatkan kinerja dan efektivitas layanan yang terkait dengan ekspor-impor. 3) Menyempurnakan dan melengkapi perangkat hukum dan kelengkapan persyaratan legal lainnya, guna mendukung terwujudnya visi Indonesia National Single Window. 4) Meningkatkan kapasitas dan integritas Sumber Daya Manusia untuk mendukung penerapan prinsip-prinsip good governance dalam pelayanan ekspor dan impor. d. **Tujuan Umum Penerapan Sistem National Single Window** 1) Meningkatkan kecepatan penyelesaian proses ekspor-impor melalui peningkatan efektivitas dan kinerja sistem layanan yang terintegrasi antara seluruh entitas terkait. 2) Meminimalisasi waktu dan biaya yang diperlukan dalam penanganan lalu lintas barang ekspor dan impor, terutama terkait dengan proses customs release and clearance of cargoes. 3) Meningkatkan validitas dan akurasi data yang terkait dengan kegiatan ekspor dan impor. 4) Meningkatkan daya saing perekonomian nasional dan mendorong masuknya investasi.",
DOC032,220~PMK.01_2019.txt,,,,5,,"**Komponen Utama dan Konsep Dasar Sistem National Single Window** a. Seluruh instansi Pemerintah (GA) dan institusi pendukung lainnya (customs, instansi perizinan (GA) impor/ekspor, port operator, bank, dan instansi lainnya) bertanggung jawab untuk memasok layanan ke sistem National Single Window (NSW) sesuai dengan Service Level Arrangement (SLA) dan Standard Operating Procedures (SOP) yang telah ditetapkan. b. Pengguna Jasa yang terdiri dari pelaku usaha dan masyarakat (importir, eksportir, Perusahaan Pengurusan Jasa Kepabeanan (PPJK), Forwarder, Shipping/Air-Line, Perusahaan Transportasi, Warehousing) melakukan akses langsung melalui layanan Portal Indonesia National Single Window, untuk mendapatkan semua layanan dari seluruh instansi pemerintah dan institusi pendukung lainnya. c. Sistem National Single Window Negara lain (ASEAN) melakukan pertukaran data elektronik dan akses data bersama, melalui kendali dan tatanan sistem ASEAN Single Window di 10 (sepuluh) negara anggota ASEAN. d. Pengelola Portal Indonesia National Single Window mengelola keseluruhan sistem (feature, facility, and function) Portal Indonesia National Single Window, serta menjadi pengendali hubungan antar muka (interface) antar seluruh komponen yang terkait, di bawah kendali Tim Nasional atau Badan yang ditetapkan Pemerintah. **II. KONSEPSI SISTEM NATIONAL SINGLE WINDOW DI INDONESIA**",
DOC032,220~PMK.01_2019.txt,,,,1,,"**Model Konseptual ASEAN Single Window dan National Single Window** Model Konseptual sistem ASEAN Single Window menggambarkan penerapan Sistem National Single Window di masing-masing negara anggota ASEAN dan penggabungannya ke dalam satu sistem bersama di tingkat regional ASEAN, yang disebut sebagai sistem ASEAN Single Window. Dari gambar tersebut dapat dilihat bahwa penerapan sistem National Single Window di masing-masing negara ASEAN dan penggabungannya ke dalam sistem ASEAN Single Window, dapat dikelompokkan menjadi 2 (dua), yaitu: a. Untuk negara-negara ASEAN-6 (Brunei Darussalam, Indonesia, Malaysia, Filipina, Singapura, dan Thailand), harus sudah mengoperasikan sistem National Single Window dan mulai bergabung dengan sistem ASEAN Single Window pada tahun 2009; b. Sedangkan untuk negara-negara CLMV atau ASEAN-4 (Kamboja, Lao PDR, Myanmar, dan Vietnam), harus sudah bergabung dengan sistem ASEAN Single Window paling lambat pada akhir tahun 2012. Untuk menggambarkan model konseptual sistem National Single Window sesuai konsep yang digariskan ASEAN Single Window Technical Guide dan beberapa referensi internasional, ilustrasi yang menggambarkan antara existing-system yang ada sekarang dengan sistem National Single Window yang akan dibangun: Existing-System ————> NSW-System Dari ilustrasi tersebut di atas, dapat dijelaskan bahwa melalui Portal National Single Window akan dilakukan “Integrasi Data” antara seluruh Entitas yang terkait dengan proses ekspor-impor, sehingga pihak User yang memerlukan jasa layanan (eksportir/importir/lainnya) cukup melakukan satu kali akses ke Portal National Single Window, selanjutnya Portal yang akan meneruskan dan mendistribusikan sesuai dengan ketentuan yang telah disepakati antar entitas yang terkait ke Portal. **Topologi Portal Indonesia National Single Window** Secara teknis, model konseptual sistem National Single Window yang telah digariskan dalam ASEAN Single Window Technical Guidance diterjemahkan ke dalam topologi, arsitektur, dan desain teknis sistem National Single Window yang akan menjadi pedoman dalam pembangunan, pengembangan, dan pengoperasian sistem National Single Window. Topologi Portal National Single Window merupakan suatu bentuk topologi sistem yang menggambarkan pola keterkaitan antar seluruh Entitas yang akan tergabung ke dalam sistem National Single Window. **PERATURAN MENTERI KEUANGAN REPUBLIK INDONESIA NOMOR ... TAHUN ... TENTANG SISTEM NATIONAL SINGLE WINDOW** **DENGAN RAHMAT TUHAN YANG MAHA ESA,** **MENTERI KEUANGAN REPUBLIK INDONESIA,** a. bahwa dalam rangka meningkatkan efisiensi dan efektivitas pelayanan kegiatan ekspor dan impor, diperlukan pengembangan sistem National Single Window di Indonesia; b. bahwa pengembangan sistem National Single Window harus memperhatikan interkoneksi dan interoperabilitas antar sistem yang ada; c. bahwa untuk itu perlu ditetapkan kebijakan dasar pengembangan sistem National Single Window.",
DOC032,220~PMK.01_2019.txt,,,,1,,Undang-Undang Nomor 17 Tahun 2006 tentang Perubahan atas Undang-Undang Nomor 10 Tahun 1995 tentang Kepabeanan;,
DOC032,220~PMK.01_2019.txt,,,,2,,Peraturan Pemerintah Nomor 20 Tahun 2017 tentang Pengelolaan Barang Milik Negara;,
DOC032,220~PMK.01_2019.txt,,,,3,,Peraturan Menteri Keuangan Nomor ... Tahun ... tentang Pengelolaan Sistem Informasi di Lingkungan Kementerian Keuangan. Menetapkan: PERATURAN MENTERI KEUANGAN TENTANG SISTEM NATIONAL SINGLE WINDOW. **Pasal 1** Dalam Peraturan ini yang dimaksud dengan:,
DOC032,220~PMK.01_2019.txt,,,,1,,National Single Window adalah sistem yang mengintegrasikan seluruh proses bisnis dalam kegiatan ekspor dan impor.,
DOC032,220~PMK.01_2019.txt,,,,2,,Portal National Single Window adalah akses point bagi semua pihak yang terlibat dalam proses pelayanan kegiatan customs release and clearance of cargoes. **Pasal 2**,
DOC032,220~PMK.01_2019.txt,,,,2,1,"Desain topologi Portal National Single Window menggunakan pendekatan Single Integrated Portal, yang mengintegrasikan seluruh proses bisnis.",
DOC032,220~PMK.01_2019.txt,,,,2,2,"Pemilihan topologi ini dimaksudkan agar pengembangan dan pemeliharaan sistem terpusat dalam satu pengelola. **Pasal 3** Ketentuan dan kesepakatan dasar dalam pengembangan sistem National Single Window di Indonesia adalah sebagai berikut: a. Kewenangan setiap Entitas dalam proses layanan publik dilaksanakan sesuai dengan service-level yang disepakati. b. Perubahan kebijakan internal dilaksanakan oleh masing-masing Entitas dan harus selaras dengan kebijakan pengembangan sistem National Single Window. c. Tim Persiapan National Single Window akan menyiapkan aplikasi antar-muka antar Entitas dalam otomasi alur proses sistem. d. Entitas yang belum memiliki sistem akan disediakan fasilitas entry sesuai standar dan kebutuhan sistem. e. Perubahan, penyesuaian, dan penyempurnaan ketentuan dan prosedur yang tidak sejalan akan dilakukan. f. Penjadwalan dan tahapan kegiatan dalam penerapan sistem didasarkan pada jadwal integrasi dengan sistem ASEAN Single Window. g. Tim Persiapan bertanggung jawab atas kebijakan standar dan prosedur pengoperasian sistem. **Pasal 4**",
DOC032,220~PMK.01_2019.txt,,,,2,1,Pengembangan sistem National Single Window di Indonesia mendasarkan pada ASEAN Single Window Technical Guidance.,
DOC032,220~PMK.01_2019.txt,,,,2,2,Kebijakan umum sistem National Single Window di Indonesia mencakup sistem kepelabuhanan/kebandarudaraan. **Pasal 5** Kebijakan teknis dalam pembangunan sistem National Single Window meliputi: a. Kebijakan terhadap data dan informasi yang mengalir melalui Portal National Single Window. b. Standar komponen teknis sistem National Single Window. **Pasal 6**,
DOC032,220~PMK.01_2019.txt,,,,2,1,Tim Persiapan National Single Window telah menyepakati penggunaan acuan dan referensi standar dalam pembangunan dan pengoperasian sistem.,
DOC032,220~PMK.01_2019.txt,,,,2,2,Semua data dan informasi yang mengalir melalui Portal adalah data yang dilindungi kerahasiaannya. **Pasal 7** Prasyarat teknis penerapan sistem National Single Window mencakup: a. Ketersediaan jaringan dan sistem cadangan. b. Ketersediaan perangkat pengaman jaringan. c. Jaminan atas kehandalan jaringan. d. Otomasi proses kepabeanan dan perizinan. e. Integrasi data lintas sistem aplikasi. **Pasal 8**,
DOC032,220~PMK.01_2019.txt,,,,2,1,Pembangunan sistem National Single Window merupakan proses yang kompleks dan memerlukan upaya besar.,
DOC032,220~PMK.01_2019.txt,,,,2,2,Kegiatan pembangunan dikelompokkan dalam kegiatan teknis dan non-teknis. **Pasal 9**,
DOC032,220~PMK.01_2019.txt,,,,2,1,Penerapan sistem National Single Window di Indonesia menggunakan strategi pentahapan.,
DOC032,220~PMK.01_2019.txt,,,,2,2,Setiap tahap dilakukan implementasi sistem berdasarkan skala prioritas dan tingkat risiko. **Pasal 10**,
DOC032,220~PMK.01_2019.txt,,,,2,1,Arah pengembangan sistem National Single Window di Indonesia akan dilakukan sesuai dengan Blueprint Penerapan yang telah ditetapkan.,
DOC032,220~PMK.01_2019.txt,,,,2,2,"Pengembangan sistem akan mengakibatkan perubahan signifikan dalam proses pelayanan ekspor dan impor. **Pasal 11** Peraturan ini mulai berlaku pada tanggal ditetapkan. MENTERI KEUANGAN REPUBLIK INDONESIA, [Nama Pejabat] NIP. ... **PERATURAN MENTERI KEUANGAN REPUBLIK INDONESIA NOMOR XX/PMK.01/XXXX TENTANG SISTEM NATIONAL SINGLE WINDOW** **DENGAN RAHMAT TUHAN YANG MAHA ESA** a. bahwa untuk meningkatkan efisiensi dan efektivitas proses bisnis di bidang ekspor dan impor, diperlukan pengembangan sistem National Single Window (NSW) di Indonesia; b. bahwa pengembangan sistem NSW harus dilakukan secara bertahap dan terencana, sejalan dengan kebutuhan masyarakat usaha dan komitmen di tingkat regional ASEAN; c. bahwa untuk itu, perlu ditetapkan kebijakan yang jelas mengenai pembangunan, pengembangan, dan penerapan sistem National Single Window.",
DOC032,220~PMK.01_2019.txt,,,,1,,Undang-Undang Nomor 10 Tahun 1995 tentang Kepabeanan;,
DOC032,220~PMK.01_2019.txt,,,,2,,Undang-Undang Nomor 17 Tahun 2006 tentang Perubahan atas Undang-Undang Nomor 10 Tahun 1995 tentang Kepabeanan;,
DOC032,220~PMK.01_2019.txt,,,,3,,Peraturan Presiden Nomor 76 Tahun 2007 tentang Kebijakan Pengembangan Sistem National Single Window;,
DOC032,220~PMK.01_2019.txt,,,,4,,Peraturan Menteri Keuangan yang mengatur tentang sistem informasi dan teknologi di bidang kepabeanan. Menetapkan: PERATURAN MENTERI KEUANGAN TENTANG SISTEM NATIONAL SINGLE WINDOW. **Pasal 1** Dalam Peraturan ini yang dimaksud dengan:,
DOC032,220~PMK.01_2019.txt,,,,1,,Sistem National Single Window adalah sistem yang mengintegrasikan semua proses dan dokumen yang diperlukan dalam kegiatan ekspor dan impor.,
DOC032,220~PMK.01_2019.txt,,,,2,,Portal Indonesia National Single Window adalah platform yang digunakan untuk mengakses sistem National Single Window. **Pasal 2**,
DOC032,220~PMK.01_2019.txt,,,,2,1,Pengembangan sistem National Single Window dilakukan secara bertahap dengan mempertimbangkan skala prioritas dan risiko yang ada.,
DOC032,220~PMK.01_2019.txt,,,,2,2,Setiap tahapan pengembangan sistem harus melalui uji coba dan evaluasi untuk memastikan sistem berfungsi dengan baik. **Pasal 3** Tahapan dalam penerapan sistem National Single Window adalah sebagai berikut:,
DOC032,220~PMK.01_2019.txt,,,,1,,"**Tahapan Uji Coba Awal** a. Target waktu: paling lambat 1 (satu) bulan sebelum penerapan Implementasi Tahap Kesatu. b. Instansi pemerintah yang dilibatkan: Direktorat Jenderal Bea dan Cukai (DJBC) dan Badan Pengawas Obat dan Makanan (BPOM). c. Pelaku usaha yang dilibatkan: 10 (sepuluh) perusahaan importir jalur prioritas. d. Cakupan sistem: sistem National Single Window-Impor. e. Lokasi penerapan: Pelabuhan Tanjung Priok, Jakarta.",
DOC032,220~PMK.01_2019.txt,,,,2,,"**Implementasi Tahap Kesatu** a. Target waktu: paling lambat akhir Desember 2007. b. Instansi pemerintah yang dilibatkan: 5 (lima) GA, termasuk DJBC dan BPOM. c. Pelaku usaha yang dilibatkan: 102 (seratus dua) perusahaan importir jalur prioritas. d. Cakupan sistem: sistem National Single Window-Impor. e. Lokasi penerapan: Pelabuhan Tanjung Priok, Jakarta.",
DOC032,220~PMK.01_2019.txt,,,,3,,"**Implementasi Tahap Kedua** a. Target waktu: paling lambat akhir Juni 2008. b. Instansi pemerintah yang dilibatkan: seluruh GA yang menerbitkan perizinan impor. c. Pelaku usaha yang dilibatkan: seluruh perusahaan importir jalur prioritas dan non-prioritas. d. Cakupan sistem: sistem National Single Window-Impor dan sistem National Single Window-SeaPort. e. Lokasi penerapan: Pelabuhan Tanjung Priok, Jakarta.",
DOC032,220~PMK.01_2019.txt,,,,4,,"**Implementasi Tahap Ketiga** a. Target waktu: paling lambat akhir Desember 2008. b. Instansi pemerintah yang dilibatkan: seluruh GA perizinan impor, ekspor, seaport, dan airport. c. Pelaku usaha yang dilibatkan: seluruh pengguna Portal Indonesia National Single Window. d. Lokasi penerapan: Pelabuhan Tanjung Priok dan pelabuhan lain di luar Jakarta. **Pasal 4** Setiap perubahan dan penyempurnaan dalam pengembangan sistem National Single Window akan dirumuskan secara hati-hati oleh Tim Persiapan National Single Window bersama dengan seluruh instansi pemerintah yang terlibat dan para pelaku usaha. **Pasal 5** Peraturan ini mulai berlaku pada tanggal ditetapkan. MENTERI KEUANGAN REPUBLIK INDONESIA, (Nama Pejabat) **PERATURAN MENTERI KEUANGAN REPUBLIK INDONESIA NOMOR XX/PMK.04/XXXX TENTANG SISTEM NATIONAL SINGLE WINDOW** **DENGAN RAHMAT TUHAN YANG MAHA ESA** **MENTERI KEUANGAN REPUBLIK INDONESIA,** a. bahwa untuk meningkatkan efisiensi dan efektivitas dalam proses impor dan ekspor, perlu dibentuk Sistem National Single Window; b. bahwa Sistem National Single Window bertujuan untuk mempermudah proses pengurusan dokumen dan informasi terkait impor dan ekspor; c. bahwa berdasarkan pertimbangan sebagaimana dimaksud dalam huruf a dan huruf b, perlu menetapkan Peraturan Menteri Keuangan tentang Sistem National Single Window.",
DOC032,220~PMK.01_2019.txt,,,,1,,Undang-Undang Nomor 10 Tahun 1995 tentang Kepabeanan;,
DOC032,220~PMK.01_2019.txt,,,,2,,Undang-Undang Nomor 17 Tahun 2006 tentang Perubahan atas Undang-Undang Nomor 10 Tahun 1995 tentang Kepabeanan;,
DOC032,220~PMK.01_2019.txt,,,,3,,Peraturan Presiden Nomor 26 Tahun 2012 tentang Kebijakan Nasional Sistem Logistik;,
DOC032,220~PMK.01_2019.txt,,,,4,,Peraturan Menteri Keuangan Nomor 123/PMK.04/2012 tentang Pengelolaan Sistem Informasi Kepabeanan. **Menetapkan:** PERATURAN MENTERI KEUANGAN TENTANG SISTEM NATIONAL SINGLE WINDOW. **Pasal 1** Dalam Peraturan ini yang dimaksud dengan:,
DOC032,220~PMK.01_2019.txt,,,,1,,Sistem National Single Window adalah sistem yang mengintegrasikan seluruh proses administrasi dan informasi terkait impor dan ekspor.,
DOC032,220~PMK.01_2019.txt,,,,2,,Importir adalah pihak yang melakukan kegiatan impor barang ke dalam wilayah Indonesia.,
DOC032,220~PMK.01_2019.txt,,,,3,,"PPJK adalah Pelaku Usaha Jasa Kepabeanan yang memberikan jasa dalam proses kepabeanan. **Pasal 2** Sistem National Single Window terdiri dari beberapa komponen, antara lain:",
DOC032,220~PMK.01_2019.txt,,,,1,,**Sistem National Single Window-Impor:** Diberlakukan secara penuh (mandatory) untuk seluruh importir dan PPJK.,
DOC032,220~PMK.01_2019.txt,,,,2,,**Sistem National Single Window-Ekspor:** Akan dilakukan uji coba awal.,
DOC032,220~PMK.01_2019.txt,,,,3,,**Sistem National Single Window-SeaPort:** Akan dilakukan paralel-run di Tanjung Priok.,
DOC032,220~PMK.01_2019.txt,,,,4,,**Sistem National Single Window-AirPort:** Akan dilakukan paralel-run di Bandara Soekarno Hatta. **Pasal 3** Cakupan sistem pada tahapan implementasi tahap ketiga ini diperluas dengan menggabungkan seluruh komponen sistem ke dalam Portal Indonesia National Single Window. **Pasal 4** Lokasi penerapan sistem National Single Window pada tahapan implementasi tahap nasional ini mencakup:,
DOC032,220~PMK.01_2019.txt,,,,1,,"**Sistem National Single Window-Impor:** - Mandatory: Tanjung Priok. - Uji coba/Paralel-run: Tanjung Emas, Tanjung Perak, Bandara Soekarno Hatta, dan Belawan.",
DOC032,220~PMK.01_2019.txt,,,,2,,**Sistem National Single Window-Ekspor:** Uji coba awal di Tanjung Priok.,
DOC032,220~PMK.01_2019.txt,,,,3,,**Sistem National Single Window-SeaPort:** Paralel-run di Tanjung Priok.,
DOC032,220~PMK.01_2019.txt,,,,4,,"**Sistem National Single Window-AirPort:** Paralel-run di Bandara Soekarno Hatta. **Pasal 5** Implementasi tahap nasional ditargetkan selesai mulai April 2009 dan paling lambat pada akhir Juni 2009, dengan seluruh komponen sistem pada Portal Indonesia National Single Window diterapkan secara mandatory di 5 (lima) pelabuhan utama di Indonesia. **Pasal 6** Instansi pemerintah yang dilibatkan dalam implementasi tahap nasional ini adalah:",
DOC032,220~PMK.01_2019.txt,,,,1,,**Sistem National Single Window-Impor:** Sebanyak 15 (lima belas) instansi pemerintah perizinan impor.,
DOC032,220~PMK.01_2019.txt,,,,2,,**Sistem National Single Window-Ekspor:** Seluruh instansi pemerintah perizinan ekspor (pusat dan daerah).,
DOC032,220~PMK.01_2019.txt,,,,3,,**Sistem National Single Window-SeaPort:** Seluruh instansi pemerintah komunitas di pelabuhan laut.,
DOC032,220~PMK.01_2019.txt,,,,4,,"**Sistem National Single Window-AirPort:** Seluruh instansi pemerintah komunitas di pelabuhan udara. **Pasal 7** Pelaku usaha yang menggunakan Portal Indonesia National Single Window pada tahapan implementasi tahap nasional ini mencakup seluruh pelaku usaha yang diwajibkan menggunakan portal tersebut. **Pasal 8** Target waktu untuk penggabungan ke dalam Portal ASEAN Single Window dilakukan setelah selesainya tahapan implementasi tahap nasional, dengan target waktu pekerjaan teknis dimulai awal Juli 2009 hingga akhir Desember 2009. **Pasal 9** Cakupan data/informasi yang dipertukarkan melalui Portal ASEAN Single Window pada tahap awal adalah Certificate of Origin (CoO) antara Indonesia dengan Malaysia, dan akan diikuti oleh negara-negara ASEAN lainnya. **Pasal 10** Lokasi penerapan sistem Indonesia National Single Window dalam kegiatan ekspor dan impor akan ditetapkan lebih lanjut sesuai dengan kebutuhan nasional dan kebijakan di tingkat regional ASEAN. **Pasal 11** Peraturan ini mulai berlaku pada tanggal ditetapkan. **Pada tanggal [tanggal penetapan]** **MENTERI KEUANGAN REPUBLIK INDONESIA,** **[Nama Menteri Keuangan]** **MENTERI KEUANGAN REPUBLIK INDONESIA** **DENGAN RAHMAT TUHAN YANG MAHA ESA** **PERATURAN MENTERI KEUANGAN REPUBLIK INDONESIA** **NOMOR: [Nomor Peraturan] TAHUN [Tahun] TENTANG [Judul Peraturan]** a. bahwa untuk meningkatkan pelayanan dan pengawasan terhadap kegiatan impor, perlu ditetapkan lokasi dan jenis KPPBC (Kantor Pelayanan Pajak dan Bea Cukai) yang sesuai; b. bahwa berdasarkan pertimbangan sebagaimana dimaksud dalam huruf a, perlu menetapkan Peraturan Menteri Keuangan tentang lokasi dan jenis KPPBC;",
DOC032,220~PMK.01_2019.txt,,,,1,,Undang-Undang Nomor 10 Tahun 1995 tentang Kepabeanan;,
DOC032,220~PMK.01_2019.txt,,,,2,,Undang-Undang Nomor 17 Tahun 2006 tentang Perubahan atas Undang-Undang Nomor 10 Tahun 1995 tentang Kepabeanan;,
DOC032,220~PMK.01_2019.txt,,,,3,,Peraturan Pemerintah Nomor 20 Tahun 2017 tentang Perubahan atas Peraturan Pemerintah Nomor 85 Tahun 2007 tentang Pelaksanaan Undang-Undang Nomor 10 Tahun 1995 tentang Kepabeanan;,
