doc_id,nama_dokumen,bab,bagian,pasal,angka,ayat,isi,penjelasan
DOC032,220~PMK.01_2019.txt,,,,4,,Peraturan Menteri Keuangan Nomor [Nomor Peraturan Sebelumnya] Tahun [Tahun] tentang [Judul Peraturan Sebelumnya]; Menetapkan Peraturan Menteri Keuangan tentang lokasi dan jenis KPPBC sebagai berikut: **Pasal 1** KPPBC Tipe Madya Pabean C:,
DOC032,220~PMK.01_2019.txt,,,,1,,"Pulang Pisau, Kalimantan Tengah, mulai berlaku 31 Agustus 2018;",
DOC032,220~PMK.01_2019.txt,,,,2,,"Bontang, Kalimantan Timur, mulai berlaku 31 Agustus 2018;",
DOC032,220~PMK.01_2019.txt,,,,3,,"Sangatta, Kalimantan Timur, mulai berlaku 31 Agustus 2018;",
DOC032,220~PMK.01_2019.txt,,,,4,,"Samarinda, Kalimantan Timur, mulai berlaku 2 Juli 2018;",
DOC032,220~PMK.01_2019.txt,,,,5,,"Balikpapan, Kalimantan Timur, mulai berlaku 2 Juli 2018;",
DOC032,220~PMK.01_2019.txt,,,,6,,"Nunukan, Kalimantan Utara, mulai berlaku 31 Agustus 2018;",
DOC032,220~PMK.01_2019.txt,,,,7,,"Tarakan, Kalimantan Utara, mulai berlaku 31 Agustus 2018;",
DOC032,220~PMK.01_2019.txt,,,,8,,"Gorontalo, mulai berlaku 31 Agustus 2018;",
DOC032,220~PMK.01_2019.txt,,,,9,,"Malili, Sulawesi Selatan, mulai berlaku 31 Agustus 2018;",
DOC032,220~PMK.01_2019.txt,,,,10,,"Makassar Selatan, Sulawesi Selatan, mulai berlaku 2 Juli 2018;",
DOC032,220~PMK.01_2019.txt,,,,11,,"Parepare, Sulawesi Selatan, mulai berlaku 31 Agustus 2018;",
DOC032,220~PMK.01_2019.txt,,,,12,,"Pantoloan, Sulawesi Tengah, mulai berlaku 31 Agustus 2018;",
DOC032,220~PMK.01_2019.txt,,,,13,,"Luwuk Tengah, Sulawesi Tengah, mulai berlaku 31 Agustus 2018;",
DOC032,220~PMK.01_2019.txt,,,,14,,"Morowali, Sulawesi Tengah, mulai berlaku 31 Agustus 2018;",
DOC032,220~PMK.01_2019.txt,,,,15,,"Kendari, Sulawesi Tenggara, mulai berlaku 31 Agustus 2018;",
DOC032,220~PMK.01_2019.txt,,,,16,,"Manado, Sulawesi Utara, mulai berlaku 31 Agustus 2018;",
DOC032,220~PMK.01_2019.txt,,,,17,,"Bitung, Sulawesi Utara, mulai berlaku 2 Juli 2018;",
DOC032,220~PMK.01_2019.txt,,,,18,,"Ambon, Maluku, berlaku setelah 30 (tiga puluh) hari terhitung sejak tanggal Peraturan Menteri ini berlaku;",
DOC032,220~PMK.01_2019.txt,,,,19,,"Ternate, Maluku Utara, berlaku setelah 30 (tiga puluh) hari terhitung sejak tanggal Peraturan Menteri ini berlaku;",
DOC032,220~PMK.01_2019.txt,,,,20,,"Sorong, Papua Barat, mulai berlaku 31 Agustus 2018;",
DOC032,220~PMK.01_2019.txt,,,,21,,"Jayapura, Papua, mulai berlaku 1 Agustus 2018;",
DOC032,220~PMK.01_2019.txt,,,,22,,"Amamapare, Papua, mulai berlaku 31 Agustus 2018;",
DOC032,220~PMK.01_2019.txt,,,,23,,"Babo, Papua, mulai berlaku 31 Agustus 2018;",
DOC032,220~PMK.01_2019.txt,,,,24,,"Merauke, Papua, berlaku setelah 30 (tiga puluh) hari terhitung sejak tanggal Peraturan Menteri ini berlaku. **Pasal 2** Peraturan ini mulai berlaku pada tanggal ditetapkan. **MENTERI KEUANGAN REPUBLIK INDONESIA,** ttd. **SRI MULYANI INDRAWATI** Salinan sesuai dengan aslinya, Kepala Biro Umum, u.b. Plt. Kepala Bagian Administrasi Kementerian, ANWARI NIP 19621005 198209 2",
