doc_id,nama_dokumen,bab,bagian,pasal,angka,ayat,isi,penjelasan
DOC049,74_PMK.04_2021.txt,,,Pasal 21,1,,"Importir; Tanggal : Pos : Subpos : **Pejabat Bea dan Cukai yang Mengawasi Pengeluaran Barang** Tanda Tangan Nama : NIP : *) Coret yang tidak perlu **) Diisi dalam hal pengeluaran diawasi oleh Pejabat Bea dan Cukai --- **PETUNJUK PENGISIAN** Kop Surat diisi dengan identitas nama Kantor Pabean yang menerbitkan Surat Pemberitahuan Pengeluaran Barang (SPPB) Pelayanan Segera (Rush Handling). Untuk Kantor Pabean yang merupakan satuan kerja Kantor Pelayanan Utama hanya mengisi identitas nama satuan kerja Eselon II dan untuk Kantor Pabean yang merupakan satuan kerja Kantor Pengawasan dan Pelayanan Bea dan Cukai mengisi identitas nama satuan kerja Eselon II dan Eselon III. Pengisian kolom dalam SPPB Pelayanan Segera (Rush Handling) adalah sebagai berikut: a. **Nomor dan Tanggal Surat Pemberitahuan Pengeluaran Barang (SPPB) Pelayanan Segera (Rush Handling)** Wajib diisi oleh SKP atau Pejabat Bea dan Cukai pada kolom yang disediakan. Nomor diisi dengan data berupa nomor urutan administrasi SPPB Pelayanan Segera (Rush Handling) di masing-masing kantor pabean, yang terdiri dari 16 (enam belas) digit angka, berupa: 1) 6 (enam) digit pertama diisi dengan angka urutan administrasi SPPB Pelayanan Segera (Rush Handling); 2) 3 (tiga) digit selanjutnya diisi dengan identitas dokumen Pelayanan Segera (Rush Handling) dengan mencantumkan “/RH”; 3) 1 (satu) digit selanjutnya diisi dengan tanda hubung (hyphen) “-”; dan 4) 6 (enam) digit terakhir diisi dengan kode kantor pabean tempat penerbitan SPPB Pelayanan Segera (Rush Handling). Tanggal diisi dengan data berupa tanggal, bulan, dan tahun SPPB Pelayanan Segera (Rush Handling) diterbitkan oleh masing-masing kantor pabean. Contoh: SPPB Pelayanan Segera (Rush Handling) urutan ke-25 pada tanggal 3 Februari 2020 di KPU BC Tanjung Priok. Nomor : 000025/RH-040300 Tanggal : 03-02-2020 b. **Nomor dan Tanggal Pendaftaran Permohonan** Wajib diisi oleh SKP atau Pejabat Bea dan Cukai pada kolom yang disediakan. Nomor Pendaftaran Permohonan diisi dengan data berupa nomor urutan administrasi permohonan Pelayanan Segera (Rush Handling) di masing-masing kantor pabean, yang terdiri dari 9 (sembilan) digit berupa: 1) 6 (enam) digit pertama berupa angka urutan administrasi pendaftaran pada saat mengajukan permohonan Pelayanan Segera (Rush Handling); dan 2) 3 (tiga) digit terakhir berupa identitas dokumen Pelayanan Segera (Rush Handling) dengan mencantumkan “/RH”. Tanggal diisi dengan data berupa tanggal, bulan, dan tahun nomor pendaftaran permohonan diadministrasikan oleh masing-masing kantor pabean. Contoh: Permohonan didaftarkan di Kantor Pabean pada urutan ke-17 pada tanggal 1 Oktober 2020. Nomor Pendaftaran Permohonan : 000017/RH Tanggal : 01-10-2020 c. **Importir** Diisi oleh SKP atau Pejabat Bea dan Cukai berupa data importir yaitu pihak yang bertindak sebagai penerima barang (consignee) dalam dokumen pengangkutan barang (bill of lading, airway bill, atau dokumen pengangkutan barang lainnya). 1) **NPWP** Diisi pada kolom yang disediakan dengan data Nomor Pokok Wajib Pajak (NPWP) Importir berdasarkan data yang diberikan oleh kantor pajak kepada wajib pajak sebagai sarana dalam administrasi perpajakan yang dipergunakan sebagai tanda pengenal diri atau identitas wajib pajak dalam melaksanakan hak dan kewajiban perpajakannya. Dalam hal importir tidak memiliki NPWP, importir dapat mengisikan data KTP atau Paspor atau identitas lainnya yang merupakan tanda pengenal importir yang memuat nomor identitas, nama, jenis kelamin, umur/tanggal dan tempat lahir, dan alamat jelas Importir. 2) **Nama dan Alamat** Diisi pada kolom yang disediakan dengan nama dan alamat importir. Contoh: NPWP : 01.061.747.0-092.000 Nama : Sumber Makmur, PT Alamat : Jalan Samudera 1 No. 15, Jakarta Utara. d. **Lokasi Barang** Diisi oleh SKP atau Pejabat Bea dan Cukai pada kolom yang disediakan, berupa data tempat/lokasi pengeluaran barang impor dari kawasan pabean. Contoh: Barang impor dikeluarkan dari Kawasan Pabean pada wilayah pengawasan KPU BC Tanjung Priok melalui gate out TPS Graha Segara. Lokasi Barang : TPS Graha Segara e. **No dan Tanggal B/L atau AWB** Diisi oleh SKP atau Pejabat Bea dan Cukai pada kolom yang disediakan, berupa data nomor, tanggal, bulan, dan tahun dokumen pengangkutan barang impor dari tempat pemuatan barang di Luar Pabean ke tempat/pelabuhan tujuan akhir pengangkutan barang impor di dalam Daerah Pabean. Dokumen pengangkutan barang dapat berupa Bill of Lading (B/L), Airway Bill (AWB) atau dokumen pengangkutan barang lainnya sesuai moda transportasi yang digunakan. Dalam hal terdapat House B/L/AWB dan Master B/L/AWB, maka yang wajib diisi adalah nomor dan tanggal House B/L/AWB. Contoh: SPPB diterbitkan atas barang impor yang diangkut ke dalam daerah pabean melalui AWB Nippon Cargo Airlines Nomor V 1131-417 tanggal 24 November 2020. No. B/L atau AWB : V 1131-417 Tanggal : 24-11-2020 f. **Nomor dan Tanggal serta Pos BC 1.1** Diisi pada kolom yang disediakan dengan nomor, tanggal, bulan, dan tahun BC 1.1 serta nomor Pos BC 1.1, di mana barang impor terdaftar sesuai manifes kedatangan sarana pengangkut yang disampaikan oleh pengangkut ke Kantor Pabean. Dalam hal PIB diajukan sebelum pengangkut menyampaikan manifes kedatangan sarana pengangkut (inward manifest) ke Kantor Pabean, kolom ini dapat diisi setelah pengangkut menyampaikan inward manifest. Informasi mengenai nomor dan tanggal BC 1.1 dan nomor pos BC 1.1 dapat diperoleh dari pengangkut atau dari portal pengguna jasa DJBC. Contoh: SPPB diterbitkan atas barang yang terdaftar dalam BC 1.1 nomor 000482 tanggal 10 November 2020 pada pos 05 subpos 0501. No. BC 1.1 : 000482 Tanggal : 10-11-2020 Pos : 05 Sub Pos : 0501 g. **Jumlah Kemasan dan Berat** Wajib diisi oleh SKP atau Pejabat Bea dan Cukai pada kolom yang disediakan, dengan data berupa jumlah kemasan yang digunakan untuk mengemas barang impor dan berat kotor (bruto) keseluruhan barang impor dalam satuan kg (kilogram). Berat kotor adalah berat barang impor termasuk dengan pengemasnya. Contoh: Berat barang impor keseluruhan sejumlah 10.150 kg dengan jumlah total kemasan 120 Packages. Jumlah Kemasan : 120 PK Berat : 10.150 kg h. **Catatan Pengeluaran** Wajib diisi berupa keterangan Pejabat yang Mengawasi Pengeluaran Barang atas kondisi barang impor yang diterbitkan SPPB berdasarkan dengan jumlah dan jenis kemasan yang diberitahukan. Contoh: 1) Jumlah kemasan barang impor yang dikeluarkan dari Kawasan Pabean sesuai. Catatan Pengeluaran: TELAH DIKELUARKAN. 2) Jumlah kemasan barang impor yang dikeluarkan dari Kawasan Pabean tidak sesuai. Catatan Pengeluaran: TIDAK SESUAI. Kantor Pabean, melalui SKP atau Pejabat Bea dan Cukai, mengisi nama kota dan tanggal penerbitan SPPB, nama jelas Pejabat Pelayanan Pabean dan Pejabat Yang Mengawasi Pengeluaran Barang beserta Nomor Identitas Pegawai Negeri Sipil (NIP) pada kolom yang disediakan. Kolom ini wajib ditandasahkan oleh Pejabat Pelayanan Pabean dan Pejabat Yang Mengawasi Pengeluaran Barang tersebut. --- **INSTRUKSI PEMERIKSAAN FISIK PELAYANAN SEGERA (RUSH HANDLING)** **NOMOR :** **Nomor Pendaftaran Permohonan :** **Tanggal :** Kepada: Importir *NPWP/KTP/Paspor/Identitas Lainnya* Nama : Alamat : **Tingkat Pemeriksaan** Jumlah kemasan yang harus diperiksa : Nomor container yang diperiksa : Nomor kemasan yang diperiksa : Ajukan contoh (ya/tidak) : Ajukan foto (ya/tidak) : **(Pejabat Bea dan Cukai Pemeriksa Dokumen)** Tanda Tangan Nama : NIP : *) Coret yang tidak perlu **KEMENTERIAN KEUANGAN REPUBLIK INDONESIA** **DIREKTORAT JENDERAL BEA DAN CUKAI** **KANTOR WILAYAH/KANTOR PELAYANAN UTAMA** **KANTOR PENGAWASAN DAN PELAYANAN BEA DAN CUKAI** **LAPORAN HASIL PEMERIKSAAN FISIK PELAYANAN SEGERA (RUSH HANDLING)** Nomor Pendaftaran Permohonan: Tanggal: Hari/Tanggal: Jam Mulai Periksa: Jam Selesai Periksa: Lokasi: Jumlah Partai Barang: Nomor Peti Kemas yang Diperiksa: Kondisi Segel: Utuh/Rusak* Jumlah dan Jenis Barang yang Diperiksa: **Hasil Pemeriksaan:** | No. | Uraian Barang | Jumlah | Satuan | Spesifikasi | Keterangan | |-----|---------------|--------|--------|-------------|------------| | A   |               |        |        |             |            | | B   |               |        |        |             |            | | C   |               |        |        |             |            | Contoh: barang/foto* **Kesimpulan:** (Pejabat Bea dan Cukai Pemeriksa Fisik) Tanda Tangan: Nama: NIP: *) Coret yang tidak perlu **PETUNJUK PENGISIAN** Kop Laporan diisi dengan identitas nama Kantor Pabean yang menerbitkan Instruksi Pemeriksaan Fisik Pelayanan Segera (Rush Handling). Untuk Kantor Pabean yang merupakan satuan kerja Kantor Pelayanan Utama hanya mengisi identitas nama satuan kerja Eselon II dan untuk Kantor Pabean yang merupakan satuan kerja Kantor Pengawasan dan Pelayanan Bea dan Cukai mengisi identitas nama satuan kerja Eselon I dan Eselon III. Pengisian kolom dalam Laporan Hasil Pemeriksaan Fisik Pelayanan Segera (Rush Handling) adalah sebagai berikut: a. **Nomor dan Tanggal Pendaftaran Permohonan** Wajib diisi oleh SKP atau Pejabat Bea dan Cukai pada kolom yang disediakan. Contoh: Permohonan didaftarkan di kantor pabean pada urutan ke-37 pada tanggal 1 Oktober 2021. Nomor Pendaftaran Permohonan: 000037/RH Tanggal: 01-10-2021 b. **Detail Pemeriksaan** Wajib diisi oleh Pejabat Bea dan Cukai berupa data hari/tanggal pemeriksaan, jam mulai periksa, jam selesai periksa, dan lokasi pemeriksaan. c. **Jumlah Partai Barang** Diisi dengan jumlah partai barang Pelayanan Segera (Rush Handling). d. **Nomor Peti Kemas yang Diperiksa** Diisi dengan nomor peti kemas yang diperiksa. e. **Kondisi Segel** Diisi dengan kondisi segel, utuh atau rusak. f. **Jumlah dan Jenis Barang yang Diperiksa** Diisi dengan jumlah dan jenis barang yang diperiksa. g. **Hasil Pemeriksaan** Diisi dengan lengkap hasil pemeriksaan, berupa jumlah, jenis, dan ukuran kemasan, uraian barang, jumlah satuan barang, spesifikasi lengkap barang, negara asal, serta kesimpulan pemeriksaan fisik. Kantor Pabean, melalui SKP atau Pejabat Bea dan Cukai, mengisi nama kota dan tanggal penerbitan Laporan, Nama jelas Pejabat Pemeriksa Fisik beserta Nomor Identitas Pegawai Negeri Sipil (NIP) yang menerbitkan Laporan pada kolom yang disediakan. Kolom ini ditandatangani oleh Pejabat Pemeriksa Fisik tersebut. **B. TATA KERJA PENGELUARAN BARANG IMPOR UNTUK DIPAKAI DENGAN PELAYANAN SEGERA (RUSH HANDLING)** I. **Menggunakan Sistem Komputer Pelayanan (SKP) Pelayanan Segera (Rush Handling)**",
DOC049,74_PMK.04_2021.txt,,,Pasal 21,1,,"Importir mengakses SKP Pelayanan Segera (Rush Handling) melalui portal pengguna jasa melalui laman (website) Direktorat Jenderal Bea dan Cukai di http://www.beacukai.go.id. Importir mengajukan permohonan pengeluaran barang dengan Pelayanan Segera (Rush Handling) kepada Kantor Bea dan Cukai tempat pemasukan barang dengan memasukkan data, paling sedikit meliputi: a. NPWP/KTP/Paspor/Identitas Lainnya importir; b. Nama importir; c. Alamat importir; d. Invoice - nomor dan tanggal; e. Bill of Lading / Airway Bill - House & Master / Dokumen Pengangkutan Barang Lainnya - nomor dan tanggal; f. Nomor, tanggal, pos, dan subpos dokumen inward manifest (BC 1.1); g. Valuta; h. NDPBM; i. Nilai barang - FOB; j. Freight; k. Insurance; l. Bea Masuk; m. Cukai; n. Pajak Pertambahan Nilai (PPN); o. Pajak Penjualan Barang Mewah (PPnBM); p. Pajak Penghasilan (PPh); q. Pos Tarif / HS Code barang; r. Uraian jenis barang, merk, tipe, spesifikasi wajib; s. Negara asal barang; t. Fasilitas (jenis, nomor, dan tanggal dokumen); u. Persyaratan larangan atau pembatasan (jenis, nomor, dan tanggal dokumen); v. Tarif dan fasilitas; w. Jumlah dan jenis satuan; x. Berat bersih (Kg); y. Jumlah/jenis Kemasan; z. Nilai pabean; aa. Jumlah barang impor eksep; dan bb. Tanggal rencana kedatangan barang impor eksep. Dalam permohonan sebagaimana dimaksud pada angka 2, Importir melampirkan Dokumen Pelengkap Pabean paling sedikit berupa: a. Invoice; b. Packing list; c. Airway bill/Bill of lading/Dokumen pengangkutan barang lainnya; d. Dokumen persyaratan impor, dalam hal merupakan barang yang dibatasi impornya; dan/atau e. Keputusan mengenai pemberian fasilitas impor terkait bea masuk, cukai, Pajak Pertambahan Nilai, Pajak Penjualan Barang Mewah, dan/atau Pajak Penghasilan Pasal 22. Dalam hal permohonan disampaikan sebelum kedatangan barang impor di Kawasan Pabean atau tempat lain yang diperlakukan sama dengan TPS: a. Importir: 1) Memilih opsi “Barang Belum Datang” dalam SKP; 2) Mengisi tanggal perkiraan kedatangan barang impor; serta 3) Menyampaikan nomor, tanggal, pos, dan subpos dokumen inward manifest (BC 1.1) dalam SKP ketika barang impor telah datang di Kawasan Pabean atau tempat lain yang diperlakukan sama dengan TPS, sebelum dilakukan pemeriksaan pabean. b. Pemeriksaan pabean dilakukan setelah dokumen inward manifest (BC 1.1) disampaikan. Dalam hal selama 14 (empat belas) hari sejak tanggal perkiraan kedatangan barang impor yang disampaikan dalam permohonan Pelayanan Segera (Rush Handling) sebagaimana dimaksud pada angka 4, barang impor belum datang di Kawasan Pabean atau tempat lain yang diperlakukan sama dengan TPS, maka: a. Permohonan sebagaimana dimaksud angka 2 tidak ditindaklanjuti; dan b. SKP Pelayanan Segera (Rush Handling) mengarsipkan permohonan sebagaimana dimaksud angka 2. Terhadap permohonan Pelayanan Segera (Rush Handling) yang diajukan importir, SKP melakukan mandatory dan content check, seperti pengecekan pemenuhan NIK dalam hal importir merupakan badan usaha, pemblokiran akses kepabeanan terhadap importir dan pemeriksaan kelengkapan data permohonan. Terhadap mandatory dan content check yang dilakukan sebagaimana dimaksud pada angka 6: a. Dalam hal importir dan/atau data permohonan memenuhi mandatory dan content check, SKP meneruskan data permohonan untuk dilakukan penelitian data jenis barang impor; atau b. Dalam hal importir dan/atau data permohonan tidak memenuhi mandatory check, SKP memberikan respon penolakan dan mengembalikan permohonan kepada importir. SKP meneliti data jenis barang impor. a. Dalam hal jenis barang impor merupakan: 1) Jenazah dan abu jenazah; 2) Organ tubuh manusia, antara lain ginjal, kornea mata, atau darah; 3) Barang yang dapat merusak lingkungan antara lain bahan yang mengandung radiasi; 4) Binatang hidup; 5) Tumbuhan hidup; 6) Surat kabar dan majalah yang peka waktu; 7) Dokumen (surat); 8) Uang kertas asing (banknotes); atau 9) Vaksin atau obat-obatan untuk manusia yang bersifat peka waktu dan/atau membutuhkan penanganan khusus, SKP melakukan: 1) Penerbitan respon kepada importir untuk menyerahkan jaminan sebesar bea masuk, cukai, Pajak Pertambahan Nilai, Pajak Penjualan Barang Mewah, dan/atau Pajak Penghasilan Pasal 22 yang terutang; atau 2) Penelitian pemenuhan ketentuan larangan/pembatasan terhadap importir yang memiliki pembebasan bea masuk, cukai dan pajak dalam rangka impor atau barang impor merupakan jenazah, abu jenazah dan/atau organ tubuh. Dalam hal jenis barang impor selain sebagaimana dimaksud pada huruf a, SKP meneruskan data permohonan kepada Kepala Kantor atau Pejabat Bea dan Cukai yang ditunjuk. Kepala Kantor atau Pejabat Bea dan Cukai yang ditunjuk menerima data permohonan sebagaimana dimaksud pada huruf b dan melakukan penelitian terhadap jenis barang yang diajukan untuk mendapatkan Pelayanan Segera (Rush Handling). Hasil penelitian terhadap jenis barang sebagaimana dimaksud pada huruf c. 1) Dalam hal hasil penelitian sebagaimana dimaksud pada huruf c disetujui: a) Kepala Kantor atau Pejabat Bea dan Cukai yang ditunjuk memberikan respon persetujuan kepada importir dan mencatat alasan persetujuan tersebut dalam SKP, serta b) SKP melakukan:",
DOC049,74_PMK.04_2021.txt,,,Pasal 21,1,1,"Penerbitan respon kepada importir untuk menyerahkan jaminan sebesar bea masuk, cukai, Pajak Pertambahan Nilai, Pajak Penjualan Barang Mewah, dan/atau Pajak Penghasilan Pasal 22 yang terutang; atau",
DOC049,74_PMK.04_2021.txt,,,Pasal 21,1,2,"Penelitian pemenuhan ketentuan larangan/pembatasan terhadap importir yang memiliki pembebasan bea masuk, cukai dan pajak dalam rangka impor atau barang impor merupakan jenazah, abu jenazah dan/atau organ tubuh. 2) Dalam hal hasil penelitian sebagaimana dimaksud pada huruf c tidak disetujui, Kepala Kantor atau Pejabat Bea dan Cukai yang ditunjuk memberikan respon penolakan dengan menyebutkan alasan penolakan dan SKP menyampaikan penolakan permohonan kepada importir. Terhadap respon penyerahan jaminan sebagaimana dimaksud pada angka 8 huruf a butir 1) dan angka 8 huruf d butir 1), importir menyerahkan jaminan sebesar bea masuk, cukai, Pajak Pertambahan Nilai, Pajak Penjualan Barang Mewah, dan/atau Pajak Penghasilan Pasal 22 yang terutang dan: a. Importir menerima bukti penerimaan jaminan; dan b. SKP meneliti pemenuhan ketentuan larangan/pembatasan atas barang impor. **Penelitian pemenuhan ketentuan larangan/pembatasan atas barang impor.** a. Dalam hal barang impor yang diberitahukan dalam permohonan wajib memenuhi ketentuan larangan/pembatasan, SKP atau Pejabat Bea dan Cukai yang menangani penelitian ketentuan larangan/pembatasan melakukan penelitian terhadap dokumen yang dipersyaratkan. 1) Dalam hal hasil penelitian menunjukkan dokumen yang dipersyaratkan telah disampaikan dan sesuai, SKP atau Pejabat Bea dan Cukai yang menangani penelitian ketentuan larangan/pembatasan melalui SKP memberikan respon penerimaan permohonan berupa pencantuman data nomor dan tanggal pendaftaran urutan administrasi permohonan Pelayanan Segera (Rush Handling) di masing-masing kantor pabean. Data nomor pendaftaran terdiri dari 9 (sembilan) digit berupa: a) 6 (enam) digit pertama berupa angka urutan administrasi pendaftaran pada saat mengajukan permohonan Pelayanan Segera (Rush Handling); dan b) 3 (tiga) digit terakhir berupa identitas dokumen Pelayanan Segera (Rush Handling) dengan mencantumkan “/RH”. **Tanggal Pendaftaran** Diisi dengan data berupa tanggal, bulan dan tahun nomor pendaftaran permohonan diadministrasikan oleh masing-masing kantor pabean. Contoh: Permohonan didaftarkan di Kantor Pabean pada urutan ke-17 pada tanggal 1 Oktober 2020. Maka: Nomor Pendaftaran Permohonan: 000017/RH Tanggal: 01-10-2020. 2) Dalam hal hasil penelitian menunjukkan dokumen yang dipersyaratkan belum sesuai dan/atau belum disampaikan, SKP atau Pejabat yang menangani penelitian pemenuhan ketentuan larangan/pembatasan melalui SKP menyampaikan respon kepada importir untuk memenuhi dokumen yang dipersyaratkan. b. Dalam hal hasil penelitian menunjukkan barang tidak wajib memenuhi ketentuan larangan/pembatasan, SKP meneruskan permohonan untuk diberikan respon penerimaan permohonan berupa pencantuman data nomor dan tanggal pendaftaran kepada importir sebagaimana pada angka 10 huruf a butir 1). Pejabat Bea dan Cukai yang menangani penelitian dokumen meneliti kesesuaian Dokumen Pelengkap Pabean dengan data permohonan dan melakukan penelitian untuk memastikan kebenaran data permohonan Pelayanan Segera (Rush Handling) yang tidak diwajibkan menyerahkan jaminan. a. Dalam hal hasil penelitian menunjukkan kesesuaian, Pejabat Bea dan Cukai yang menangani penelitian dokumen menerbitkan respon kesesuaian dalam SKP dan meneruskan permohonan melalui SKP kepada Pejabat Bea dan Cukai yang menangani pemeriksaan fisik untuk dilakukan pemeriksaan fisik barang. Dalam hal hasil penelitian tidak menunjukkan kesesuaian, Pejabat Bea dan Cukai yang menangani penelitian dokumen menerbitkan respon permintaan perbaikan dan/atau respon permintaan jaminan kepada importir. Dalam hal terdapat informasi yang cukup untuk menambah jumlah jaminan dan/atau menyerahkan dokumen yang dipersyaratkan, Pejabat Bea dan Cukai yang menangani penelitian dokumen melalui SKP: 1) Memberikan catatan penyesuaian jumlah jaminan dan/atau catatan permintaan dokumen pemenuhan ketentuan larangan/pembatasan yang dipersyaratkan kepada Pejabat Bea dan Cukai yang menangani pelayanan kepabeanan untuk diproses lebih lanjut; dan 2) Menerbitkan instruksi pemeriksaan fisik kepada Pejabat Bea dan Cukai yang menangani pemeriksaan fisik untuk dilakukan pemeriksaan fisik barang dan memberikan respon pemberitahuan pemeriksaan fisik kepada importir. **Pelaksanaan pemeriksaan fisik oleh Pejabat Bea dan Cukai yang menangani pemeriksaan fisik.** a. Importir menerima nota pemberitahuan pemeriksaan fisik dan menyiapkan barang impor untuk dilakukan pemeriksaan oleh Pejabat Bea dan Cukai yang menangani pemeriksaan fisik. b. Pejabat Bea dan Cukai yang menangani pemeriksaan fisik menerima instruksi pemeriksaan fisik dan mencocokkan invoice/packing list atau hasil cetak permohonan Pelayanan Segera (Rush Handling). c. Pejabat Bea dan Cukai yang menangani pemeriksaan fisik melakukan pemeriksaan fisik. d. Pemeriksaan fisik barang dilakukan sesuai dengan ketentuan peraturan perundang-undangan. Dalam hal hasil pemeriksaan fisik menunjukkan kesesuaian... **PERATURAN MENTERI KEUANGAN REPUBLIK INDONESIA** **NOMOR XXX/PMK.04/XXXX** **TENTANG PELAYANAN SEGERA (RUSH HANDLING) ATAS PENGELUARAN BARANG IMPOR** **DENGAN RAHMAT TUHAN YANG MAHA ESA** a. bahwa dalam rangka meningkatkan pelayanan kepada importir, perlu diatur ketentuan mengenai pelayanan segera (rush handling) atas pengeluaran barang impor; b. bahwa untuk melaksanakan ketentuan sebagaimana dimaksud pada huruf a, perlu menetapkan Peraturan Menteri Keuangan tentang Pelayanan Segera (Rush Handling) atas Pengeluaran Barang Impor;",
DOC049,74_PMK.04_2021.txt,,,Pasal 21,1,,Undang-Undang Nomor 17 Tahun 2006 tentang Perubahan atas Undang-Undang Nomor 10 Tahun 1995 tentang Kepabeanan;,
DOC049,74_PMK.04_2021.txt,,,Pasal 21,2,,Peraturan Presiden Republik Indonesia Nomor 91 Tahun 2017 tentang Kebijakan Satu Peta;,
DOC049,74_PMK.04_2021.txt,,,Pasal 21,3,,Peraturan Menteri Keuangan Nomor 203/PMK.04/2017 tentang Tata Cara Pemberian Fasilitas Kepabeanan; Menetapkan: PERATURAN MENTERI KEUANGAN TENTANG PELAYANAN SEGERA (RUSH HANDLING) ATAS PENGELUARAN BARANG IMPOR. **Pasal 1** Dalam Peraturan ini yang dimaksud dengan:,
DOC049,74_PMK.04_2021.txt,,,Pasal 21,1,,Importir adalah orang atau badan hukum yang melakukan kegiatan impor barang.,
DOC049,74_PMK.04_2021.txt,,,Pasal 21,2,,Pelayanan Segera (Rush Handling) adalah pelayanan yang diberikan kepada importir untuk mempercepat proses pengeluaran barang impor.,
DOC049,74_PMK.04_2021.txt,,,Pasal 21,3,,Pejabat Bea dan Cukai adalah pegawai yang diberi tugas untuk melaksanakan tugas di bidang kepabeanan. **Pasal 2**,
DOC049,74_PMK.04_2021.txt,,,Pasal 21,3,1,Importir dapat mengajukan permohonan Pelayanan Segera (Rush Handling) kepada Pejabat Bea dan Cukai.,
DOC049,74_PMK.04_2021.txt,,,Pasal 21,3,2,Permohonan sebagaimana dimaksud pada ayat (1) harus dilengkapi dengan dokumen pelengkap pabean. **Pasal 3**,
DOC049,74_PMK.04_2021.txt,,,Pasal 21,3,1,Pejabat Bea dan Cukai yang menerima permohonan melakukan pemeriksaan fisik dan dokumen.,
DOC049,74_PMK.04_2021.txt,,,Pasal 21,3,2,"Dalam hal hasil pemeriksaan fisik menunjukkan ketidaksesuaian, Pejabat Bea dan Cukai meneruskan permohonan kepada unit pengawasan untuk dilakukan penelitian lebih lanjut. **Pasal 4**",
DOC049,74_PMK.04_2021.txt,,,Pasal 21,3,1,"Dalam hal hasil penelitian lebih lanjut menunjukkan: a. tidak terdapat pelanggaran pidana, Pejabat Bea dan Cukai meneruskan permohonan kepada Pejabat Bea dan Cukai yang menangani pelayanan kepabeanan; b. terdapat pelanggaran pidana, Pejabat Bea dan Cukai menindaklanjuti sesuai ketentuan peraturan perundang-undangan di bidang kepabeanan. **Pasal 5**",
DOC049,74_PMK.04_2021.txt,,,Pasal 21,3,1,Pejabat Bea dan Cukai yang menangani pelayanan kepabeanan menerima catatan dari Pejabat Bea dan Cukai yang menangani penelitian dokumen dan pengawasan.,
DOC049,74_PMK.04_2021.txt,,,Pasal 21,3,2,"Atas catatan tersebut, Pejabat Bea dan Cukai menerbitkan respon penyesuaian jumlah jaminan kepada importir. **Pasal 6**",
DOC049,74_PMK.04_2021.txt,,,Pasal 21,3,1,Importir menerima respon dan melakukan penyesuaian jaminan.,
DOC049,74_PMK.04_2021.txt,,,Pasal 21,3,2,Importir juga dapat menyampaikan dokumen persyaratan larangan atau pembatasan. **Pasal 7**,
DOC049,74_PMK.04_2021.txt,,,Pasal 21,3,1,"Dalam hal Kantor Pabean telah terhubung dengan Sistem Indonesia National Single Window (SINSW), penyampaian permohonan dapat dilakukan melalui sistem tersebut.",
DOC049,74_PMK.04_2021.txt,,,Pasal 21,3,2,"Dalam hal kantor pabean telah menerapkan TPS online, pelaksanaan pengeluaran barang dilaksanakan sesuai dengan peraturan yang berlaku. **Pasal 8**",
DOC049,74_PMK.04_2021.txt,,,Pasal 21,3,1,Importir mengajukan permohonan pengeluaran barang dengan Pelayanan Segera (Rush Handling) secara tertulis.,
DOC049,74_PMK.04_2021.txt,,,Pasal 21,3,2,"Dalam hal pengajuan permohonan dilakukan melalui media penyimpanan data elektronik, softcopy permohonan dan dokumen pelengkap disimpan dalam media tersebut. **Pasal 9**",
DOC049,74_PMK.04_2021.txt,,,Pasal 21,3,1,"Importir wajib melampirkan dokumen pelengkap pabean, antara lain: a. invoice; b. packing list; c. dokumen persyaratan impor. **Pasal 10**",
DOC049,74_PMK.04_2021.txt,,,Pasal 21,3,1,Pejabat Bea dan Cukai melakukan penelitian terhadap jenis barang yang dapat diberikan Pelayanan Segera (Rush Handling).,
DOC049,74_PMK.04_2021.txt,,,Pasal 21,3,2,"Dalam hal jenis barang yang diajukan memenuhi ketentuan, Pejabat Bea dan Cukai menerbitkan nota pemberitahuan persetujuan. **Pasal 11**",
DOC049,74_PMK.04_2021.txt,,,Pasal 21,3,1,Importir yang menerima nota pemberitahuan persetujuan wajib menyerahkan jaminan kepada Pejabat yang menangani perbendaharaan.,
DOC049,74_PMK.04_2021.txt,,,Pasal 21,3,2,Pejabat yang menangani perbendaharaan meneruskan permohonan kepada Pejabat Bea dan Cukai untuk dilakukan penelitian pemenuhan ketentuan larangan/pembatasan. **Pasal 12**,
DOC049,74_PMK.04_2021.txt,,,Pasal 21,3,1,Pejabat Bea dan Cukai melakukan penelitian terhadap dokumen yang dipersyaratkan.,
