doc_id,nama_dokumen,bab,bagian,pasal,angka,ayat,isi,penjelasan
DOC049,74_PMK.04_2021.txt,,,Pasal 21,3,1,"Dalam hal barang impor merupakan barang yang membutuhkan permohonan izin Kepala Kantor Pabean atau Pejabat Bea dan Cukai yang ditunjuk untuk mendapatkan Pelayanan Segera (Rush Handling) sebagaimana diatur dalam Pasal 3 ayat (1) huruf j Peraturan Menteri ini, importir wajib menyampaikan alasan atas barang impor tersebut dalam surat permohonan dengan jelas dan lengkap. **PASAL 5** Pengisian kolom dalam permohonan Pelayanan Segera (Rush Handling) adalah sebagai berikut: a. Importir - Wajib diisi data importir yaitu pihak yang bertindak sebagai penerima barang (consignee) dalam dokumen pengangkutan barang (bill of lading, airway bill, atau dokumen pengangkutan barang lainnya). 1) NPWP/KTP/Paspor/identitas lainnya - Diisi pada kolom yang disediakan dengan data Nomor Pokok Wajib Pajak (NPWP) importir berdasarkan data yang diberikan oleh kantor pajak kepada wajib pajak sebagai sarana dalam administrasi perpajakan yang dipergunakan sebagai tanda pengenal diri atau identitas wajib pajak dalam melaksanakan hak dan kewajiban perpajakannya. - Dalam hal importir tidak memiliki NPWP, importir dapat mengisikan data KTP atau Paspor atau identitas lainnya yang merupakan tanda pengenal importir yang memuat nomor identitas, nama, jenis kelamin, umur/tanggal dan tempat lahir, dan alamat jelas importir. 2) Nama dan Alamat - Diisi pada kolom yang disediakan dengan nama dan alamat importir. - Contoh: - NPWP: 01.061.747.0-092.000 - Nama: Sumber Makmur, PT - Alamat: Jalan Samudera 1 No. 15, Jakarta Utara. 3) Nomor dan Tanggal Invoice - Diisi pada kolom yang disediakan dengan nomor, tanggal, bulan, dan tahun invoice yang digunakan dalam transaksi barang impor. Dalam hal barang impor bukan merupakan obyek transaksi jual beli, wajib diisi dengan nomor, tanggal, bulan, dan tahun dokumen yang diterbitkan oleh pengirim sebagai pemberitahuan nilai barang untuk keperluan penyelesaian kewajiban pabean (for Customs purpose only) seperti proforma invoice. Dalam hal invoice lebih dari 1 (satu), kolom diisi dengan ""terlampir"". Rincian invoice selanjutnya diisi dalam lampiran surat permohonan, dengan format: **LEMBAR LANJUTAN DOKUMEN PELENGKAP PERMOHONAN PENGELUARAN BARANG IMPOR UNTUK DIPAKAI DENGAN PELAYANAN SEGERA (RUSH HANDLING)** - No. Kode Nama Dokumen Nomor dan Tanggal Dokumen **PASAL 6**",
DOC049,74_PMK.04_2021.txt,,,Pasal 21,3,1,"Tarif Bea Masuk, tarif Bea Masuk tambahan seperti Bea Masuk Anti Dumping, Bea Masuk Anti Dumping Sementara, Bea Masuk Tindakan Pengamanan, Bea Masuk Tindakan Pengamanan Sementara, Bea Masuk Imbalan, Bea Masuk Imbalan Sementara, Bea Masuk Pembalasan, Cukai, PPN, PPnBM, dan PPh; dan",
DOC049,74_PMK.04_2021.txt,,,Pasal 21,3,2,"Fasilitas pembebasan, keringanan, ditanggung pemerintah, tidak dipungut, atau penundaan pembayaran bea masuk, bea masuk tambahan, Cukai, PPN, PPnBM, dan PPh, pada tanggal pengajuan permohonan Pelayanan Segera (Rush Handling). **PASAL 7**",
DOC049,74_PMK.04_2021.txt,,,Pasal 21,3,1,Pembebanan Bea Masuk sesuai ketentuan yang berlaku.,
DOC049,74_PMK.04_2021.txt,,,Pasal 21,3,2,"Ada 2 (dua) jenis tarif/pembebanan untuk BM: a. Advalorum, yang mempergunakan % (persentase), yang dalam perhitungan nilai BM-nya = Nilai % dikalikan nilai pabeannya dalam Rupiah; b. Spesifik, yang mempergunakan nilai Rupiah per unit satuan, sehingga jumlah satuan yang diisikan pada jumlah barang adalah merupakan jumlah satuan unit, perhitungan BM-nya = Nilai Rupiah per unit satuan dikalikan dengan jumlah satuan unit. **PASAL 8**",
DOC049,74_PMK.04_2021.txt,,,Pasal 21,3,1,Diisi pembebanan Cukai sesuai ketentuan yang berlaku.,
DOC049,74_PMK.04_2021.txt,,,Pasal 21,3,2,Dalam hal barang impor bukan merupakan Barang Kena Cukai (BKC) kolom ini tidak perlu diisi.,
