doc_id,nama_dokumen,bab,bagian,pasal,angka,ayat,isi,penjelasan
DOC141,bn1050-2020.txt,BAB I,,Pasal 1,1,,"Daerah Pabean adalah wilayah Republik Indonesia yang meliputi wilayah darat, perairan, dan ruang udara di atasnya, serta tempat-tempat tertentu di Zona Ekonomi Eksklusif dan landas kontinen yang di dalamnya berlaku Undang-Undang Kepabeanan.",
DOC141,bn1050-2020.txt,BAB I,,Pasal 1,2,,"Dokumen Pelengkap Pabean adalah dokumen yang diperlukan dalam proses importasi, termasuk lembar asli SKA Form D atas barang yang diimpor, lembar asli SKA Back-to-Back, lembar asli SKA Form D Issued Retroactively, dan lembar asli SKA Form D pengganti (Certified True Copy). Lembar asli SKA Form D dan/atau DAB sebagaimana dimaksud pada ayat (2) sampai dengan ayat (9) harus masih berlaku pada saat: a. Pemberitahuan Impor Barang (PIB); b. pemberitahuan pabean impor untuk ditimbun di TPB; c. pemberitahuan pabean impor untuk ditimbun di PLB; d. PPFTZ-01 pemasukan barang ke Kawasan Bebas dari luar Daerah Pabean; atau e. pemberitahuan pabean pemasukan barang ke KEK dari luar Daerah Pabean, mendapat nomor pendaftaran dari Kantor Pabean. Untuk dapat menggunakan Tarif Preferensi sebagaimana dimaksud dalam Pasal 2, Importir, Penyelenggara/Pengusaha TPB, Penyelenggara/Pengusaha PLB, pengusaha di Kawasan Bebas, atau Badan Usaha/Pelaku Usaha KEK yang melakukan importasi dengan menggunakan skema e-Form D, wajib: a. mencantumkan kode fasilitas Persetujuan Perdagangan Barang ASEAN secara benar; dan b. mencantumkan nomor dan tanggal e-Form D secara benar pada:",
DOC141,bn1050-2020.txt,BAB I,,Pasal 13,1,,Pemberitahuan Impor Barang (PIB);,
DOC141,bn1050-2020.txt,BAB I,,Pasal 13,2,,pemberitahuan pabean impor untuk ditimbun di TPB;,
DOC141,bn1050-2020.txt,BAB I,,Pasal 13,3,,pemberitahuan pabean impor untuk ditimbun di PLB;,
DOC141,bn1050-2020.txt,BAB I,,Pasal 13,4,,PPFTZ-01 pemasukan barang ke Kawasan Bebas dari luar Daerah Pabean; atau,
DOC141,bn1050-2020.txt,BAB I,,Pasal 13,5,,"pemberitahuan pabean pemasukan barang ke KEK dari luar Daerah Pabean. Dalam hal kewajiban sebagaimana dimaksud pada ayat (1) telah dipenuhi, Importir, Penyelenggara/Pengusaha TPB, Penyelenggara/Pengusaha PLB, pengusaha di Kawasan Bebas, atau Badan Usaha/Pelaku Usaha KEK dikecualikan dari kewajiban penyerahan lembar asli SKA Form D sebagaimana dimaksud dalam Pasal 12. DAB sebagaimana dimaksud dalam Pasal 12 dapat disampaikan secara elektronik oleh Eksportir Bersertifikat kepada Kantor Pabean sesuai dengan: a. mekanisme e-Form D; atau b. hasil kesepakatan Negara Anggota. Dalam hal DAB disampaikan secara elektronik sebagaimana dimaksud pada ayat (1), pemenuhan kewajiban penyerahan lembar asli DAB sebagaimana dimaksud dalam Pasal 12, dikecualikan untuk Importir, Penyelenggara/Pengusaha TPB, Penyelenggara/Pengusaha PLB, pengusaha di Kawasan Bebas, atau Badan Usaha/Pelaku Usaha KEK. Tata cara importasi dan penelitian atas penggunaan DAB yang disampaikan secara elektronik sebagaimana dimaksud dalam ayat (1) dilaksanakan sesuai dengan: a. tata cara importasi dan penelitian atas penggunaan e-Form D; atau b. tata cara importasi dan penelitian yang diatur berdasarkan hasil kesepakatan Negara Anggota. PENELITIAN DAN PENGENAAN TARIF PREFERENSI Bagian Kesatu Penelitian SKA Form D dan/atau DAB Pejabat Bea dan Cukai di Kantor Pabean melakukan penelitian terhadap SKA Form D dan/atau DAB dalam rangka pengenaan Tarif Preferensi. Pejabat Bea dan Cukai dapat meminta informasi kepada Importir, Penyelenggara/Pengusaha TPB, Penyelenggara/Pengusaha PLB, pengusaha di Kawasan Bebas, atau Badan Usaha/Pelaku Usaha KEK, sesuai dengan ketentuan peraturan perundang-undangan di bidang kepabeanan. Terhadap pengenaan Tarif Preferensi atas barang yang diimpor dengan menggunakan SKA Form D dan/atau DAB sebagaimana dimaksud pada ayat (1), dapat dilakukan Penelitian Ulang atau Audit Kepabeanan sesuai dengan ketentuan peraturan perundang-undangan di bidang kepabeanan. Penelitian terhadap SKA Form D dan/atau DAB sebagaimana dimaksud dalam Pasal 15, meliputi: a. pemenuhan kriteria asal barang (origin criteria) sebagaimana dimaksud dalam Pasal 4; b. pemenuhan kriteria pengiriman (consignment criteria) sebagaimana dimaksud dalam Pasal 5 dan Pasal 6; c. pemenuhan ketentuan prosedural (procedural provisions) sebagaimana dimaksud dalam Pasal 7 sampai dengan Pasal 14; d. jenis, jumlah, dan klasifikasi barang yang mendapatkan Tarif Preferensi; e. besaran tarif bea masuk yang diberitahukan berdasarkan Tarif Preferensi yang ditetapkan dalam Peraturan Menteri Keuangan mengenai penetapan tarif bea masuk dalam rangka ASEAN Trade in Goods Agreement; f. kesesuaian antara data pada pemberitahuan pabean impor, dan/atau Dokumen Pelengkap Pabean dengan data pada SKA Form D dan/atau DAB; dan g. kesesuaian antara fisik barang dengan uraian barang yang diberitahukan pada pemberitahuan pabean impor, SKA Form D dan/atau DAB, dan/atau Dokumen Pelengkap Pabean. SKA Form D dan/atau DAB tetap sah dalam hal terdapat perbedaan yang bersifat minor (minor discrepancies). Perbedaan yang bersifat minor sebagaimana dimaksud pada ayat (1) meliputi: a. kesalahan pengetikan dan/atau ejaan pada SKA Form D dan/atau DAB, sepanjang dapat diketahui kebenarannya melalui Dokumen Pelengkap Pabean; b. perbedaan penggunaan centang atau silang (baik manual ataupun tercetak) pada kotak dalam SKA Form D, serta perbedaan ukuran centang atau silang tersebut; c. perbedaan kecil antara tanda tangan pada SKA Form D dan/atau DAB dengan spesimen; d. perbedaan satuan pengukuran (antara lain: satuan berat, satuan panjang) pada SKA Form D dan/atau DAB dengan Dokumen Pelengkap Pabean; e. perbedaan kecil pada ukuran kertas SKA Form D yang digunakan; f. perbedaan kecil pada warna tinta yang digunakan dalam pengisian SKA Form D; dan/atau g. kesalahan kecil pada penulisan uraian barang antara SKA Form D dan/atau DAB dengan Dokumen Pelengkap Pabean, sepanjang dapat dibuktikan bahwa barang tersebut merupakan barang yang sama. Dalam hal SKA Form D dan/atau DAB ditolak dan Tarif Preferensi tidak diberikan, maka barang yang diimpor dikenakan tarif bea masuk yang berlaku umum (Most Favoured Nation/MFN). Dengan Rahmat Tuhan Yang Maha Esa a. bahwa untuk melaksanakan ketentuan Pasal 16 ayat (1) dan ayat (2) Peraturan Menteri Keuangan Nomor 1050 Tahun 2020 tentang Ketentuan Umum dan Tata Cara Pemberian Tarif Preferensi, perlu mengatur lebih lanjut mengenai pemberitahuan penolakan SKA Form D dan/atau DAB; b. bahwa berdasarkan pertimbangan sebagaimana dimaksud dalam huruf a, perlu menetapkan Peraturan Direktur Jenderal Bea dan Cukai tentang Pemberitahuan Penolakan SKA Form D dan/atau DAB. c. Peraturan Menteri Keuangan Nomor 1050 Tahun 2020 tentang Ketentuan Umum dan Tata Cara Pemberian Tarif Preferensi. Menetapkan: Peraturan Direktur Jenderal Bea dan Cukai tentang Pemberitahuan Penolakan SKA Form D dan/atau DAB.",
DOC141,bn1050-2020.txt,BAB III,,Pasal 1,,1,Direktur di lingkungan Direktorat Jenderal Bea dan Cukai yang melaksanakan tugas dan fungsi di bidang Audit Kepabeanan dan Penelitian Ulang;,
DOC141,bn1050-2020.txt,BAB III,,Pasal 1,,2,Kepala Kantor Wilayah Direktorat Jenderal Bea dan Cukai;,
DOC141,bn1050-2020.txt,BAB III,,Pasal 1,,3,Kepala Kantor Pelayanan Utama Bea dan Cukai;,
DOC141,bn1050-2020.txt,BAB III,,Pasal 1,,4,Kepala Kantor Pengawasan dan Pelayanan Bea dan Cukai; atau,
DOC141,bn1050-2020.txt,BAB III,,Pasal 1,,5,"Pejabat Bea dan Cukai yang ditunjuk, menyampaikan pemberitahuan penolakan kepada Instansi Penerbit SKA dalam hal SKA Form D dan/atau Otoritas yang Berwenang dalam hal DAB.",
DOC141,bn1050-2020.txt,BAB III,,Pasal 1,,2,"Pemberitahuan penolakan SKA Form D dan/atau DAB sebagaimana dimaksud pada ayat (1), disampaikan secara tertulis dengan disertai copy atau pindaian SKA Form D yang telah diberikan tanda (Vv) atau (X) pada kolom 4 SKA Form D, dan/atau DAB, yang memuat pernyataan bahwa Tarif Preferensi tidak dapat diberikan serta alasan penolakan, dalam jangka waktu paling lambat 60 (enam puluh) hari terhitung sejak tanggal penolakan.",
DOC141,bn1050-2020.txt,BAB III,,Pasal 1,,3,"Pemberitahuan penolakan sebagaimana dimaksud pada ayat (1) untuk e-Form D, disampaikan secara elektronik melalui ASEAN Single Window disertai dengan alasan penolakan, dalam jangka waktu tidak lebih dari 60 (enam puluh) hari sejak tanggal penerimaan e-Form D.",
DOC141,bn1050-2020.txt,BAB III,,Pasal 1,,4,"Dalam hal sistem ASEAN Single Window atau SKP belum tersedia, terjadi gangguan, atau kegagalan sistem, pemberitahuan penolakan sebagaimana dimaksud pada ayat (3) disampaikan secara tertulis kepada Instansi Penerbit SKA yang memuat pernyataan bahwa Tarif Preferensi tidak dapat diberikan serta alasan penolakan, dalam jangka waktu paling lambat 60 (enam puluh) hari terhitung sejak tanggal penolakan. Bagian Kedua Retroactive Check dan Verification Visit",
DOC141,bn1050-2020.txt,BAB III,,Pasal 19,,1,"Terhadap SKA Form D dan/atau DAB yang diragukan keabsahan dan kebenaran isinya sebagaimana dimaksud dalam Pasal 16 ayat (5), dilakukan Permintaan Retroactive Check kepada: a. Instansi Penerbit SKA dalam hal SKA Form D; dan/atau b. Otoritas yang Berwenang dalam hal DAB, dan atas barang impor tersebut dikenakan tarif bea masuk yang berlaku umum (Most Favoured Nation/MFN).",
DOC141,bn1050-2020.txt,BAB III,,Pasal 19,,2,"Permintaan Retroactive Check sebagaimana dimaksud pada ayat (1) dapat dilakukan secara acak (random). Permintaan Retroactive Check sebagaimana dimaksud pada ayat (1) dan ayat (2), dilampiri dengan copy atau pindaian SKA Form D dan/atau DAB, dengan menyebutkan alasan keraguan, disertai dengan: a. permintaan penjelasan keabsahan dan kebenaran isi SKA Form D dan/atau DAB; dan/atau b. permintaan informasi, catatan, bukti dan/atau data-data pendukung terkait.",
DOC141,bn1050-2020.txt,BAB III,,Pasal 19,,3,Permintaan Retroactive Check sebagaimana dimaksud pada ayat (1) dan ayat (2) disampaikan oleh: a. direktur di lingkungan Direktorat Jenderal Bea dan Cukai yang melaksanakan tugas dan fungsi di bidang Audit Kepabeanan dan Penelitian Ulang; b. Kepala Kantor Wilayah Direktorat Jenderal Bea dan Cukai; c. Kepala Kantor Pelayanan Utama Bea dan Cukai; d. Kepala Kantor Pengawasan dan Pelayanan Bea dan Cukai; atau e. Pejabat Bea dan Cukai yang ditunjuk.,
DOC141,bn1050-2020.txt,BAB III,,Pasal 19,,4,"Permintaan Retroactive Check dapat dilakukan lebih dari 1 (satu) kali jika jawaban tidak disertai dengan bukti-bukti pendukung atau jawaban tidak memberikan keyakinan yang cukup bagi Pejabat Bea dan Cukai, dengan memperhatikan jangka waktu yang telah disepakati sesuai dengan Persetujuan Pembentukan Kawasan Perdagangan Bebas ASEAN.",
DOC141,bn1050-2020.txt,BAB III,,Pasal 19,,5,"SKA Form D dan/atau DAB ditolak dan Tarif Preferensi tidak diberikan apabila jawaban atas Permintaan Retroactive Check tidak disampaikan dalam jangka waktu paling lambat 90 (sembilan puluh) hari setelah tanggal diterimanya Permintaan Retroactive Check, dan/atau tidak mencukupi untuk membuktikan pemenuhan Ketentuan Asal Barang dan/atau keabsahan SKA Form D dan/atau DAB.",
DOC141,bn1050-2020.txt,BAB III,,Pasal 19,,6,"Keseluruhan proses Retroactive Check, termasuk pemberitahuan kepada Instansi Penerbit SKA dan/atau Otoritas yang Berwenang tentang penetapan diterima atau ditolaknya SKA Form D dan/atau DAB, harus diselesaikan dalam jangka waktu paling lama 180 (seratus delapan puluh) hari sejak tanggal pengiriman Permintaan Retroactive Check.",
DOC141,bn1050-2020.txt,BAB III,,Pasal 20,,1,"Direktur Jenderal atau Pejabat Bea dan Cukai yang ditunjuk dapat melakukan Verification Visit jika jawaban atas Permintaan Retroactive Check sebagaimana dimaksud dalam Pasal 19 diragukan kebenarannya dan/atau tidak mencukupi untuk membuktikan pemenuhan Ketentuan Asal Barang, dan/atau diragukan keabsahan SKA Form D dan/atau DAB.",
DOC141,bn1050-2020.txt,BAB III,,Pasal 20,,2,"Dalam rangka pelaksanaan Verification Visit sebagaimana dimaksud pada ayat (1), Direktur Jenderal atau Pejabat Bea dan Cukai yang ditunjuk menyampaikan pemberitahuan secara tertulis dengan mencantumkan informasi yang diminta kepada: a. Instansi Penerbit SKA dan/atau Otoritas yang Berwenang; b. Eksportir atau produsen yang akan dikunjungi; c. Instansi pabean atau instansi pemerintah yang relevan di Negara Anggota pengekspor; dan d. Importir atas barang yang merupakan subjek Verification Visit.",
DOC141,bn1050-2020.txt,BAB III,,Pasal 20,,3,"Pemberitahuan tertulis sebagaimana dimaksud pada ayat (2) mencantumkan informasi antara lain: a. nama dan alamat kantor yang menerbitkan permintaan Verification Visit; b. nama eksportir atau produsen yang akan dikunjungi; c. rencana tanggal pelaksanaan Verification Visit; d. tujuan dan ruang lingkup Verification Visit, termasuk referensi atas barang yang akan diverifikasi; dan e. nama dan jabatan Pejabat Bea dan Cukai dan/atau pejabat pemerintah relevan lainnya yang akan melaksanakan Verification Visit.",
DOC141,bn1050-2020.txt,BAB III,,Pasal 20,,4,Verification Visit dilaksanakan setelah mendapatkan persetujuan tertulis dari eksportir atau produsen dan/atau Instansi Penerbit SKA dan/atau Otoritas yang Berwenang.,
DOC141,bn1050-2020.txt,BAB III,,Pasal 20,,5,Verification Visit dapat ditunda dalam hal diterima pemberitahuan permintaan penundaan pelaksanaan Verification Visit dari Instansi Penerbit SKA dan/atau Otoritas yang Berwenang.,
DOC141,bn1050-2020.txt,BAB III,,Pasal 20,,6,"Verification Visit harus dilaksanakan dalam jangka waktu paling lambat 60 (enam puluh) hari sejak tanggal diterimanya permintaan Verification Visit atau dalam jangka waktu yang lebih lama, dalam hal Negara Anggota terkait menyetujui.",
DOC141,bn1050-2020.txt,BAB III,,Pasal 20,,7,"SKA Form D dan/atau DAB ditolak dan Tarif Preferensi tidak diberikan apabila: a. persetujuan tertulis sebagaimana dimaksud pada ayat (4) tidak diterima dalam jangka waktu paling lambat 30 (tiga puluh) hari setelah tanggal diterimanya pemberitahuan tertulis sebagaimana dimaksud pada ayat (2); atau b. hasil Verification Visit menunjukkan bahwa barang yang diimpor tidak memenuhi Ketentuan Asal Barang, data atau informasi yang diperoleh tidak mencukupi untuk membuktikan pemenuhan Ketentuan Asal Barang, dan/atau tidak memenuhi keabsahan SKA Form D dan/atau DAB.",
DOC141,bn1050-2020.txt,BAB III,,Pasal 20,,8,"Dalam hal berdasarkan penetapan hasil pelaksanaan Verification Visit sebagaimana dimaksud pada ayat (7) huruf b, eksportir atau produsen memberikan informasi tambahan kepada Direktur Jenderal atau Pejabat Bea dan Cukai yang ditunjuk dalam jangka waktu paling lambat 30 (tiga puluh) hari sejak tanggal diterimanya penetapan hasil Verification Visit, Pejabat Bea dan Cukai menyampaikan penetapan akhir.",
DOC141,bn1050-2020.txt,BAB III,,Pasal 20,,9,"Penetapan akhir sebagaimana dimaksud pada ayat (8), disampaikan secara tertulis kepada: a. Instansi Penerbit SKA dalam hal SKA Form D; atau b. Otoritas yang Berwenang dalam hal DAB, dalam jangka waktu paling lambat 30 (tiga puluh) hari sejak tanggal diterimanya informasi tambahan.",
DOC141,bn1050-2020.txt,BAB III,,Pasal 20,,10,"Keseluruhan proses pelaksanaan Verification Visit, termasuk pelaksanaan kunjungan, penetapan dan/atau penetapan akhir pelaksanaan Verification Visit, dan penyampaian diterima atau ditolaknya SKA Form D dan/atau DAB, harus dilakukan dalam jangka waktu paling lama 180 (seratus delapan puluh) hari sejak tanggal diterimanya persetujuan tertulis sebagaimana dimaksud pada ayat (4).",
DOC141,bn1050-2020.txt,BAB III,,Pasal 20,,11,Pelaksanaan Verification Visit dapat melibatkan kementerian dan/atau lembaga terkait. Pihak yang terlibat dalam proses Permintaan Retroactive Check dan pelaksanaan Verification Visit harus menjaga kerahasiaan informasi. Informasi sebagaimana dimaksud pada ayat (1) hanya dapat diungkapkan oleh instansi yang berwenang melakukan penelitian dan penindakan terkait Ketentuan Asal Barang. KETENTUAN SANKSI,
DOC141,bn1050-2020.txt,BAB IV,,Pasal 22,,1,"Dalam hal jawaban atas permintaan Retroactive Check, SKA Form D dan/atau DAB diduga palsu atau dipalsukan, Pejabat Bea dan Cukai melakukan penelitian lebih lanjut berdasarkan ketentuan peraturan perundang-undangan di bidang kepabeanan.",
DOC141,bn1050-2020.txt,BAB IV,,Pasal 22,,2,"Terhadap Importir, Penyelenggara/Pengusaha TPB, Penyelenggara/Pengusaha PLB, pengusaha di Kawasan Bebas sebagaimana dimaksud dalam Pasal 2 ayat (3) huruf d angka 3, atau Badan Usaha/Pelaku Usaha KEK yang menggunakan SKA Form D dan/atau DAB sebagaimana dimaksud pada ayat (1), dilakukan pemutakhiran profil dan koordinasi dengan Negara Anggota penerbit SKA Form D dan/atau DAB terkait dengan penyelesaian permasalahan tersebut sesuai dengan ketentuan yang diatur dalam Persetujuan Perdagangan Barang ASEAN.",
DOC141,bn1050-2020.txt,BAB IV,,Pasal 22,,3,"Dalam hal hasil penelitian sebagaimana dimaksud pada ayat (1) ditemukan bukti yang cukup adanya dugaan pelanggaran tindak pidana di bidang kepabeanan, Pejabat Bea dan Cukai melakukan penyidikan sesuai dengan ketentuan peraturan perundang-undangan yang berlaku.",
DOC141,bn1050-2020.txt,BAB IV,,Pasal 23,,1,"Dalam hal hasil koordinasi sebagaimana dimaksud dalam Pasal 22 ayat (2) menyatakan bahwa eksportir terlibat dalam SKA Form D dan/atau DAB sebagaimana dimaksud dalam Pasal 22 ayat (1), terhadap importasi yang berasal dari eksportir yang bersangkutan tidak diberikan Tarif Preferensi selama 2 (dua) tahun terhitung sejak eksportir dinyatakan terlibat oleh Negara Anggota penerbit SKA Form D dan/atau DAB. MONITORING DAN EVALUASI",
DOC141,bn1050-2020.txt,BAB V,,Pasal 24,,1,Kepala Kantor Wilayah Direktorat Jenderal Bea dan Cukai atau Kepala Kantor Pelayanan Utama Bea dan Cukai melakukan monitoring dan/atau evaluasi terhadap pemanfaatan SKA Form D dan/atau DAB di wilayah kerja masing-masing secara periodik.,
DOC141,bn1050-2020.txt,BAB V,,Pasal 24,,2,"Kepala Kantor Wilayah Direktorat Jenderal Bea dan Cukai atau Kepala Kantor Pelayanan Utama Bea dan Cukai menyampaikan hasil monitoring dan/atau evaluasi sebagaimana dimaksud pada ayat (1) kepada direktur yang melaksanakan tugas dan fungsi di bidang kerja sama kepabeanan internasional sebagai bahan evaluasi kebijakan pemanfaatan SKA Form D dan/atau DAB. Kawasan Bebas adalah suatu kawasan yang berada dalam wilayah hukum Negara Kesatuan Republik Indonesia yang terpisah dari Daerah Pabean sehingga bebas dari pengenaan bea masuk, Pajak Pertambahan Nilai, Pajak Penjualan atas Barang Mewah, dan cukai. Kawasan Ekonomi Khusus yang selanjutnya disingkat KEK adalah kawasan dengan batas tertentu dalam wilayah hukum Negara Kesatuan Republik Indonesia yang ditetapkan untuk menyelenggarakan fungsi perekonomian dan memperoleh fasilitas tertentu. Tempat Penimbunan Berikat yang selanjutnya disingkat TPB adalah bangunan, tempat, atau kawasan, yang memenuhi persyaratan tertentu yang digunakan untuk menimbun barang dengan tujuan tertentu, dengan mendapatkan penangguhan bea masuk. Pusat Logistik Berikat yang selanjutnya disingkat PLB adalah TPB untuk menimbun barang asal luar Daerah Pabean dan/atau barang yang berasal dari tempat lain dalam Daerah Pabean, dapat disertai dengan 1 (satu) atau lebih kegiatan sederhana dalam jangka waktu tertentu untuk dikeluarkan kembali. Tempat Lain Dalam Daerah Pabean yang selanjutnya disingkat TLDDP adalah Daerah Pabean selain Kawasan Bebas dan TPB. Importir adalah orang perseorangan atau badan hukum yang melakukan kegiatan memasukkan barang ke dalam Daerah Pabean. Penyelenggara/Pengusaha TPB adalah: a. penyelenggara kawasan berikat; b. penyelenggara kawasan berikat sekaligus pengusaha kawasan berikat; c. pengusaha di kawasan berikat merangkap penyelenggara di kawasan berikat; d. penyelenggara gudang berikat; e. penyelenggara gudang berikat sekaligus pengusaha gudang berikat. KETENTUAN LAIN-LAIN",
DOC141,bn1050-2020.txt,BAB VI,,Pasal 25,,1,"Barang impor yang berasal dari Negara Anggota dengan nilai Free-on-Board (FOB) tidak melebihi US$200.00 (dua ratus United States Dollar), dapat dikenakan Tarif Preferensi tanpa harus melampirkan SKA Form D dan/atau DAB.",
DOC141,bn1050-2020.txt,BAB VI,,Pasal 25,,2,"Pengenaan Tarif Preferensi sebagaimana dimaksud pada ayat (1) dapat diberikan, sepanjang importasi tersebut: a. bukan merupakan bagian dari 1 (satu) atau lebih importasi lainnya yang bertujuan untuk menghindari kewajiban penyerahan SKA Form D dan/atau DAB; dan b. dibuktikan dengan pernyataan dari eksportir yang menerangkan bahwa barang merupakan Barang Originating dari Negara Anggota pengekspor.",
DOC141,bn1050-2020.txt,BAB VI,,Pasal 25,,3,"Pengenaan Tarif Preferensi sebagaimana dimaksud pada ayat (1), hanya diberikan terhadap barang impor yang menggunakan dokumen Pemberitahuan Impor Barang (PIB).",
DOC141,bn1050-2020.txt,BAB VI,,Pasal 26,,1,Tarif Preferensi dapat diberikan atas barang yang dikirimkan oleh Negara Anggota pengekspor untuk tujuan pameran di Negara Anggota dan terjual pada saat atau setelah pameran.,
DOC141,bn1050-2020.txt,BAB VI,,Pasal 26,,2,"Tarif Preferensi sebagaimana dimaksud pada ayat (1), dikenakan pada saat penyerahan pemberitahuan pabean impor untuk dipakai dengan ketentuan barang impor tujuan pameran: a. telah dikirimkan ke Negara Anggota tempat pameran dilaksanakan; b. telah dipamerkan di negara sebagaimana dimaksud pada huruf a; c. telah terjual atau dipindahtangankan kepada importir di Negara Anggota pengimpor; d. dikirim pada saat atau segera setelah pameran diselenggarakan; e. dipamerkan dalam pameran dagang, pertanian atau kerajinan, atau pameran lainnya; dan f. masih dalam pengawasan otoritas kepabeanan di negara penyelenggara pameran.",
DOC141,bn1050-2020.txt,BAB VI,,Pasal 26,,3,"SKA Form D dan/atau DAB yang digunakan atas barang sebagaimana dimaksud pada ayat (1), harus memenuhi ketentuan sebagai berikut: a. pencantuman nama pameran dan alamat tempat dilaksanakannya pameran pada kolom 2 SKA Form D dan/atau pada DAB; dan b. pemberian tanda (Vv) atau (X) pada kolom 13 SKA Form D kotak “Exhibition”.",
DOC141,bn1050-2020.txt,BAB VI,,Pasal 26,,4,"Dalam hal diperlukan, Pejabat Bea dan Cukai dapat meminta dokumen pembuktian pemenuhan ketentuan sebagaimana dimaksud dalam pasal 5. Dengan Rahmat Tuhan Yang Maha Esa",
DOC141,bn1050-2020.txt,BAB VI,,Pasal 26,1,,"bahwa untuk melaksanakan ketentuan dalam Peraturan Menteri ini, perlu menetapkan ketentuan mengenai penelitian ketentuan asal barang untuk pengenaan tarif preferensi atas impor barang;",
DOC141,bn1050-2020.txt,BAB VI,,Pasal 26,2,,bahwa penelitian ketentuan asal barang untuk pengenaan tarif preferensi atas pengeluaran barang dari Kawasan Ekonomi Khusus (KEK) ke Tempat Lain Dalam Daerah Pabean (TLDDP) dilaksanakan sesuai dengan ketentuan yang tercantum dalam Lampiran huruf B angka I yang merupakan bagian tidak terpisahkan dari Peraturan Menteri ini;,
DOC141,bn1050-2020.txt,BAB VI,,Pasal 26,3,,"bahwa dalam hal telah ditetapkan dokumen pemberitahuan pabean khusus untuk KEK, penelitian ketentuan asal barang untuk pengenaan tarif preferensi atas pengeluaran barang dari KEK ke TLDDP dilaksanakan sesuai dengan ketentuan yang tercantum dalam Lampiran huruf B angka IV yang merupakan bagian tidak terpisahkan dari Peraturan Menteri ini. a. Undang-Undang Nomor 10 Tahun 1995 tentang Kepabeanan; b. Undang-Undang Nomor 17 Tahun 2006 tentang Perubahan atas Undang-Undang Nomor 10 Tahun 1995 tentang Kepabeanan; c. Peraturan Pemerintah Nomor 20 Tahun 2017 tentang Pemberian Tarif Preferensi Bea Masuk atas Barang Impor berdasarkan Perjanjian Perdagangan Internasional; d. Peraturan Menteri Keuangan Nomor 131/PMK.04/2020 tentang Tata Cara Pengenaan Tarif Bea Masuk atas Barang Impor Berdasarkan Persetujuan Perdagangan Barang ASEAN. Menetapkan Peraturan Menteri Keuangan tentang Tata Cara Penelitian Ketentuan Asal Barang untuk Pengenaan Tarif Preferensi atas Barang Impor. Penelitian ketentuan asal barang untuk pengenaan tarif preferensi atas impor barang untuk dipakai dari Tempat Penimbunan Berikat (TPB) dan Pusat Logistik Berikat (PLB) serta atas pengeluaran barang dari Kawasan Bebas ke TLDDP, dilaksanakan sesuai dengan ketentuan yang tercantum dalam Lampiran huruf B yang merupakan bagian tidak terpisahkan dari Peraturan Menteri ini. Dalam hal Surat Keterangan Asal (SKA) Form D dibatalkan oleh Instansi Penerbit SKA atau Dokumen Asal Barang (DAB) dibatalkan oleh Eksportir Bersertifikat, tarif preferensi tidak diberikan. Tata cara penyerahan SKA Form D dan/atau DAB beserta Dokumen Pelengkap Pabean selama pandemi Corona Virus Disease 2019 (COVID-19) berpedoman pada Peraturan Menteri Keuangan mengenai tata cara penyerahan Surat Keterangan Asal beserta Dokumen Pelengkap Pabean.",
DOC141,bn1050-2020.txt,BAB VI,,Pasal 30,,1,"Dalam hal terjadi keadaan kahar (force majeure), Direktur Jenderal dapat menetapkan prosedur pemberian tarif preferensi.",
