doc_id,nama_dokumen,bab,bagian,pasal,angka,ayat,isi,penjelasan
DOC142,bn1051-2015.txt,,,,7,,Keputusan Presiden Nomor 121/P Tahun 2014 tentang Pembentukan Kementerian dan Pengangkatan Menteri Kabinet Kerja Tahun 2014-2019;,
DOC142,bn1051-2015.txt,,,,8,,Peraturan Presiden Nomor 7 Tahun 2015 tentang Organisasi Kementerian Negara;,
DOC142,bn1051-2015.txt,,,,9,,Peraturan Presiden Nomor 48 Tahun 2015 tentang Kementerian Perdagangan;,
DOC142,bn1051-2015.txt,,,,10,,Peraturan Menteri Perdagangan Nomor 54/M-DAG/PER/10/2009 tentang Ketentuan Umum di Bidang Impor;,
DOC142,bn1051-2015.txt,,,,11,,Peraturan Menteri Perdagangan Nomor 31/M-DAG/PER/7/2010 tentang Organisasi dan Tata Kerja Kementerian Perdagangan sebagaimana telah diubah dengan Peraturan Menteri Perdagangan Nomor 57/M-DAG/PER/8/2012;,
DOC142,bn1051-2015.txt,,,,12,,Peraturan Menteri Perdagangan Nomor 27/M-DAG/PER/5/2012 tentang Ketentuan Angka Pengenal Importir (API) sebagaimana telah diubah beberapa kali terakhir dengan Peraturan Menteri Perdagangan Nomor 84/M-DAG/PER/12/2012; Menetapkan PERATURAN MENTERI PERDAGANGAN TENTANG LARANGAN IMPOR PAKAIAN BEKAS. Dalam Peraturan Menteri ini yang dimaksud dengan:,
DOC142,bn1051-2015.txt,,,Pasal 1,1,,Impor adalah kegiatan memasukkan barang ke dalam daerah pabean.,
DOC142,bn1051-2015.txt,,,Pasal 1,2,,"Pakaian Bekas adalah produk tekstil yang digunakan sebagai penutup tubuh manusia, yang termasuk dalam Pos Tarif/HS 6309.00.00.00.",
DOC142,bn1051-2015.txt,,,Pasal 1,3,,"Menteri adalah menteri yang menyelenggarakan urusan pemerintahan di bidang perdagangan. Pakaian Bekas dilarang untuk diimpor ke dalam wilayah Negara Kesatuan Republik Indonesia. Pakaian Bekas yang tiba di wilayah Negara Kesatuan Republik Indonesia pada atau setelah tanggal Peraturan Menteri ini berlaku wajib dimusnahkan sesuai ketentuan peraturan perundang-undangan. Importir yang melakukan pelanggaran terhadap ketentuan larangan sebagaimana dimaksud dalam Pasal 2 dikenai sanksi administratif dan sanksi lain sesuai ketentuan peraturan perundang-undangan. Ketentuan dalam Peraturan Menteri ini tidak berlaku terhadap Impor Pakaian Bekas sebagai barang pindahan. Peraturan Menteri ini mulai berlaku 2 (dua) bulan sejak tanggal diundangkan. Agar setiap orang mengetahuinya, memerintahkan pengundangan Peraturan Menteri ini dengan penempatannya dalam Berita Negara Republik Indonesia. MENTERI PERDAGANGAN REPUBLIK INDONESIA, RACHMAT GOBEL Diundangkan di Jakarta pada tanggal 14 Juli 2015 MENTERI HUKUM DAN HAK ASASI MANUSIA REPUBLIK INDONESIA, YASONNA H. LAOLY",
