doc_id,nama_dokumen,bab,bagian,pasal,angka,ayat,isi,penjelasan
DOC141,bn1050-2020.txt,,,Pasal 1,1,,bahan baku dan/atau bahan penolong berasal dari luar Daerah Pabean;,
DOC141,bn1050-2020.txt,,,Pasal 1,2,,pada saat pemasukan barang ke Kawasan Bebas telah mendapat persetujuan untuk menggunakan Tarif Preferensi; dan,
DOC141,bn1050-2020.txt,,,Pasal 1,3,,"dilakukan oleh pengusaha di Kawasan Bebas yang telah memenuhi persyaratan sebagai pengusaha yang dapat menggunakan Tarif Preferensi; atau e. pengeluaran barang dari Kawasan Ekonomi Khusus (KEK) ke TLDDP, yang pada saat pemasukan barang ke KEK telah mendapatkan persetujuan untuk menggunakan Tarif Preferensi. Pengusaha di Kawasan Bebas sebagaimana dimaksud pada Pasal 1 huruf d angka 3, harus memenuhi persyaratan sebagai berikut: a. memiliki izin usaha dari badan pengusahaan kawasan; b. melakukan pemasukan bahan baku dan/atau bahan penolong, dan sekaligus melakukan pengeluaran barang hasil produksi ke TLDDP; c. memiliki dan menerapkan sistem informasi persediaan berbasis komputer (IT Inventory) yang dapat diakses oleh Direktorat Jenderal Bea dan Cukai secara online dan realtime, dengan persetujuan Kepala Kantor Pabean yang mengawasi; d. memiliki akses kepabeanan; dan e. menyampaikan konversi bahan baku menjadi barang hasil produksi dan blueprint proses produksi yang telah mendapat persetujuan dari Kepala Kantor Pabean yang mengawasi, pada saat barang akan dikeluarkan ke TLDDP. Ketentuan Asal Barang terdiri dari: a. kriteria asal barang (origin criteria); b. kriteria pengiriman (consignment criteria); dan c. ketentuan prosedural (procedural provisions). Rincian lebih lanjut mengenai Ketentuan Asal Barang sebagaimana dimaksud pada ayat (1), tercantum dalam Lampiran huruf A yang merupakan bagian tidak terpisahkan dari Peraturan Menteri ini. Bagian Kedua Kriteria Asal Barang Kriteria asal barang (origin criteria) sebagaimana dimaksud dalam Pasal 3 ayat (1) huruf a, meliputi: a. barang yang seluruhnya diperoleh atau diproduksi di 1 (satu) Negara Anggota (wholly obtained atau produced); atau b. barang yang tidak seluruhnya diperoleh atau diproduksi di 1 (satu) Negara Anggota (not wholly obtained atau produced). Kriteria asal barang (origin criteria) sebagaimana dimaksud pada ayat (1) huruf b, meliputi: a. barang yang proses produksinya menggunakan Bahan Non-Originating dengan hasil akhir memiliki kandungan nilai regional atau Regional Value Content (RVC) yang mencapai nilai persentase paling sedikit 40% (empat puluh persen) dari nilai Free-on-Board (FOB); b. barang yang proses produksinya menggunakan Bahan Non-Originating dan seluruh Bahan Non-Originating tersebut harus mengalami perubahan klasifikasi atau Change in Tariff Classification (CTC) pada 4 (empat) digit pertama Harmonized System (HS) yang selanjutnya disebut Change in Tariff Heading (CTH); c. barang yang termasuk dalam daftar PSR sebagaimana diatur dalam Annex 3 Persetujuan Perdagangan Barang ASEAN; atau d. akumulasi. Dalam hal klasifikasi barang termasuk dalam daftar PSR sebagaimana dimaksud pada ayat (2) huruf c, kriteria asal barang harus ditetapkan berdasarkan daftar PSR dimaksud, walaupun kriteria yang terdapat pada ayat (2) huruf a atau huruf b telah terpenuhi. Bagian Ketiga Kriteria Pengiriman Kriteria pengiriman (consignment criteria) sebagaimana dimaksud dalam Pasal 3 ayat (1) huruf b meliputi: a. barang impor dikirim langsung dari Negara Anggota yang menerbitkan SKA Form D dan/atau DAB ke dalam Daerah Pabean; b. barang impor dikirim melalui Negara Anggota selain Negara Anggota pengekspor dan Negara Anggota pengimpor; atau c. barang impor dikirim melalui negara selain Negara Anggota.",
DOC141,bn1050-2020.txt,,,Pasal 5,,2,"Barang impor dapat dikirim melalui 1 (satu) atau lebih Negara Anggota selain Negara Anggota pengekspor dan Negara Anggota pengimpor sebagaimana dimaksud pada ayat (1) huruf b, atau melalui negara selain Negara Anggota sebagaimana dimaksud pada ayat (1) huruf c, untuk tujuan transit dan/atau transhipment, dengan ketentuan sebagai berikut: a. ditujukan untuk alasan geografis atau pertimbangan khusus terkait persyaratan pengangkutan; b. tidak diperdagangkan atau dikonsumsi di negara tujuan transit dan/atau transhipment; dan c. tidak mengalami proses produksi selain bongkar muat dan tindakan lain yang diperlukan untuk menjaga agar barang tetap dalam kondisi baik. Dalam hal pengiriman barang impor melalui negara selain Negara Anggota untuk tujuan transit dan/atau transhipment sebagaimana dimaksud dalam Pasal 5 ayat (2), Importir, Penyelenggara/Pengusaha TPB, Penyelenggara/Pengusaha PLB, pengusaha di Kawasan Bebas sebagaimana dimaksud dalam Pasal 2 ayat (3) huruf d angka 3, atau Badan Usaha/Pelaku Usaha KEK, harus menyerahkan dokumen berupa: a. through bill of lading atau dokumen pengangkutan lainnya yang diterbitkan di Negara Anggota pengekspor yang menunjukkan keseluruhan rute perjalanan dari Negara Anggota pengekspor, termasuk kegiatan transit dan/atau transhipment, sampai ke Daerah Pabean; b. SKA Form D yang diterbitkan oleh Instansi Penerbit SKA dan/atau DAB yang diterbitkan oleh Eksportir Bersertifikat; c. invoice dari barang yang bersangkutan, jika ada; dan d. dokumen pendukung, jika ada, yang membuktikan pemenuhan ketentuan dalam Pasal 5 ayat (2), kepada Pejabat Bea dan Cukai. Bagian Keempat Ketentuan Prosedural Ketentuan prosedural (procedural provisions) sebagaimana dimaksud dalam Pasal 3 ayat (1) huruf c terkait dengan penerbitan SKA Form D, harus memenuhi ketentuan sebagai berikut: a. diterbitkan dalam bahasa Inggris; b. menggunakan ukuran kertas ISO A4 warna putih, dengan bentuk dan format SKA Form D, termasuk halaman depan dan Overleaf Notes, sesuai dengan format pada Lampiran huruf A angka VII yang merupakan bagian tidak terpisahkan dari Peraturan Menteri ini; c. memuat nomor referensi SKA Form D; d. memuat tanda tangan pejabat yang berwenang dan stempel resmi dari Instansi Penerbit SKA secara manual atau secara elektronik; e. ditandatangani oleh pemohon (eksportir atau produsen); f. diterbitkan sebelum, pada saat, atau sampai dengan paling lambat 3 (tiga) hari sejak Tanggal Pengapalan atau Tanggal Eksportasi; g. dicantumkan kriteria asal barang (origin criteria) untuk setiap uraian barang, dalam hal SKA Form D mencantumkan lebih dari 1 (satu) uraian barang; h. dicantumkan nilai Free-on-Board (FOB) dalam hal menggunakan kriteria asal barang (origin criteria) kandungan nilai regional atau Regional Value Content (RVC); i. kolom pada SKA Form D diisi sesuai dengan ketentuan pengisian pada Overleaf Notes; j. dalam hal SKA Form D lebih dari 1 (satu) lembar, maka dapat digunakan SKA Form D atau lembar lanjutan dengan ukuran kertas A4 yang ditandatangani/diparaf dan distempel oleh Instansi Penerbit SKA, serta dicantumkan nomor referensi SKA Form D; dan k. SKA Form D berlaku selama 12 (dua belas) bulan terhitung sejak tanggal penerbitan. Dalam hal SKA Form D menggunakan: a. akumulasi, diberikan tanda (Vv) atau (X) pada kolom 13 kotak “Acumulation”; b. akumulasi parsial, diberikan tanda (V) atau (X) pada kolom 13 kotak “Partial Cumulation”. Instansi Penerbit SKA dapat menerbitkan SKA Form D lebih dari 3 (tiga) hari sejak Tanggal Pengapalan atau Tanggal Eksportasi, namun tidak melebihi jangka waktu 1 (satu) tahun sejak Tanggal Pengapalan atau Tanggal Eksportasi dengan ketentuan diberikan tanda (V) atau (X) pada kolom 13 kotak ""Issued Retroactively"". Instansi Penerbit SKA dapat menerbitkan SKA Form D pengganti terhadap SKA Form D yang hilang atau rusak, dengan harus memenuhi ketentuan sebagai berikut: a. diterbitkan sesuai dengan ketentuan prosedural SKA Form D sebagaimana dimaksud pada ayat (1) sampai dengan ayat (3); b. diberikan tanda/tulisan/cap “CERTIFIED TRUE COPY” pada kolom 12 SKA Form D pengganti; c. diterbitkan dalam jangka waktu paling lambat 1 (satu) tahun terhitung setelah tanggal penerbitan SKA Form D yang hilang atau rusak; dan d. dicantumkan tanggal penerbitan SKA Form D yang hilang atau rusak. Dalam hal SKA Form D berupa e-Form D, pemenuhan ketentuan prosedural sebagaimana dimaksud pada ayat (1) sampai dengan ayat (3) dikecualikan sebagai berikut: a. ketentuan penerbitan SKA Form D sebagaimana dimaksud pada ayat (1) huruf b, huruf d, huruf e, huruf i, dan huruf j; b. ketentuan pencantuman penggunaan tanda (Vv) atau (X) akumulasi atau akumulasi parsial pada SKA Form D sebagaimana dimaksud pada ayat (2); dan c. ketentuan penerbitan SKA Form D pengganti terhadap SKA Form D yang hilang atau rusak sebagaimana dimaksud pada ayat (4). Dalam hal terdapat kesalahan pengisian SKA Form D, koreksi atas pengisian dilakukan dengan cara: a. menerbitkan SKA Form D baru dengan memenuhi ketentuan prosedural sebagaimana dimaksud pada ayat (1) sampai dengan ayat (4); atau b. melakukan perbaikan, dengan ketentuan sebagai berikut:",
DOC141,bn1050-2020.txt,,,Pasal 7,1,,mencoret (striking out) data yang salah;,
DOC141,bn1050-2020.txt,,,Pasal 7,2,,menambahkan data yang benar; dan,
DOC141,bn1050-2020.txt,,,Pasal 7,3,,"menandasahkan dengan membubuhkan tanda tangan/paraf pejabat yang berwenang dari Instansi Penerbit SKA pada bagian yang dilakukan perbaikan. Dalam hal SKA Form D berupa e-Form D, koreksi atas kesalahan pengisian e-Form D sebagaimana dimaksud pada ayat (6), dilakukan dengan cara menerbitkan e-Form D baru dengan memenuhi ketentuan prosedural sebagaimana dimaksud pada ayat (1) sampai dengan ayat (5). Dalam hal pada bill of lading atau dokumen pengangkutan lainnya terdapat tanggal penerbitan dan tanggal dimuatnya barang ke sarana pengangkut, Tanggal Pengapalan atau Tanggal Eksportasi ditentukan pada saat tanggal dimuatnya barang ke sarana pengangkut. Ketentuan prosedural (procedural provisions) sebagaimana dimaksud dalam Pasal 3 ayat (1) huruf c terkait dengan penerbitan DAB, harus memenuhi ketentuan sebagai berikut: a. diterbitkan oleh Eksportir Bersertifikat; b. diterbitkan dalam invoice atau dalam dokumen komersial billing statement, delivery order atau packing list, memuat pernyataan Eksportir Bersertifikat yang menyatakan bahwa barang memenuhi Ketentuan Asal Barang; c. memuat uraian barang yang menjadi otorisasi Eksportir Bersertifikat, secara jelas dan detail, agar dapat diidentifikasi; d. memuat kriteria asal barang (origin criteria) untuk setiap uraian barang dalam hal DAB mencantumkan lebih dari 1 (satu) uraian barang; e. dicantumkan nilai Free-on-Board (FOB) dalam hal menggunakan kriteria asal barang (origin criteria) kandungan nilai regional atau Regional Value Content (RVC); f. memuat nama dan tanda tangan manual Eksportir Bersertifikat; g. memuat nomor referensi dan tanggal sesuai dengan nomor dan tanggal DAB; h. memuat informasi sekurang-kurangnya sebagaimana tercantum dalam List of Data Requirements pada Lampiran huruf A yang merupakan bagian tidak terpisahkan dari Peraturan Menteri ini; i. dalam hal DAB tidak mencukupi untuk menyebutkan seluruh produk, dapat digunakan halaman tambahan yang berisi informasi sebagaimana tercantum dalam List of Data Requirement; DAB berlaku selama 12 (dua belas) bulan terhitung sejak tanggal pembuatan. Negara Anggota pengekspor kedua dapat menerbitkan SKA Back-to-Back dan/atau DAB Back-to-Back berdasarkan SKA Form D dan/atau DAB yang diterbitkan oleh Negara Anggota pengekspor pertama. SKA Back-to-Back dan/atau DAB Back-to-Back sebagaimana dimaksud pada ayat (1), harus memenuhi ketentuan sebagai berikut: a. memenuhi ketentuan penerbitan sebagaimana dimaksud dalam Pasal 7; b. berisi informasi yang sama dengan SKA Form D dan/atau DAB yang diterbitkan oleh Negara Anggota pengekspor pertama, kecuali jumlah barang dan nilai Free-on-Board (FOB). BERITA NEGARA REPUBLIK INDONESIA No. 1050, 2020 KEMENKEU. Pengenaan Tarif Bea Masuk. Barang Impor Berdasarkan Persetujuan Perdagangan Barang ASEAN. Tata Cara. Pencabutan. Dengan Rahmat Tuhan Yang Maha Esa a. bahwa untuk melaksanakan ketentuan Pasal 13 ayat (2) Undang-Undang Nomor 17 Tahun 2006 tentang Perubahan atas Undang-Undang Nomor 10 Tahun 1995 tentang Kepabeanan, perlu menetapkan Peraturan Menteri Keuangan tentang Tata Cara Pengenaan Tarif Bea Masuk atas Barang Impor Berdasarkan Persetujuan Perdagangan Barang ASEAN; b. bahwa berdasarkan pertimbangan sebagaimana dimaksud dalam huruf a dan huruf b, serta untuk melaksanakan ketentuan Pasal 17 ayat (3) Undang-Undang Dasar Negara Republik Indonesia Tahun 1945, perlu melakukan penyempurnaan terhadap ketentuan sebagaimana dimaksud dalam huruf a; Menetapkan Peraturan Menteri Keuangan tentang Tata Cara Pengenaan Tarif Bea Masuk atas Barang Impor Berdasarkan Persetujuan Perdagangan Barang ASEAN.",
DOC141,bn1050-2020.txt,,,Pasal 9,,1,"Dalam hal SKA Back-to-Back dan/atau DAB Back-to-Back, ketentuan yang harus dipenuhi adalah sebagai berikut: a. total jumlah barang yang tercantum pada SKA Back-to-Back dan/atau DAB Back-to-Back tidak boleh melebihi jumlah barang yang tercantum pada SKA Form D dan/atau DAB yang diterbitkan oleh Negara Anggota pengekspor pertama; b. mencantumkan nilai Free-on-Board (FOB) barang di Negara Anggota pengekspor kedua, dalam hal menggunakan kriteria asal barang (origin criteria) kandungan nilai regional atau Regional Value Content (RVC); c. masa berlaku SKA Back-to-Back dan/atau DAB Back-to-Back tidak boleh melebihi masa berlaku SKA Form D dan/atau DAB yang diterbitkan oleh Negara Anggota pengekspor pertama; d. nama eksportir yang tercantum dalam SKA Back-to-Back dan/atau DAB Back-to-Back harus sama dengan nama Importir yang tercantum dalam SKA Form D dan/atau DAB yang diterbitkan oleh Negara Anggota pengekspor pertama; e. mencantumkan nomor referensi dan tanggal SKA Form D dan/atau DAB yang diterbitkan oleh Negara Anggota pengekspor pertama; f. dalam hal DAB Back-to-Back, barang yang terdapat dalam DAB Back-to-Back harus merupakan barang yang menjadi otorisasi Eksportir Bersertifikat.",
DOC141,bn1050-2020.txt,,,Pasal 9,,2,"Dalam hal SKA Back-to-Back: a. nomor referensi dan tanggal SKA Form D dan/atau DAB sebagaimana dimaksud pada ayat (1) huruf e, dicantumkan pada kolom 7 SKA Back-to-Back; dan b. diberikan tanda (V) atau (X) pada kolom 13 SKA Back-to-Back kotak “Back-to-Back CO”.",
DOC141,bn1050-2020.txt,,,Pasal 9,,3,Ketentuan sebagaimana dimaksud pada ayat (2) dikecualikan dalam hal SKA Back-to-Back berupa e-Form D.,
DOC141,bn1050-2020.txt,,,Pasal 9,,4,"Dalam hal informasi pada SKA Back-to-Back dan/atau DAB Back-to-Back diragukan atau tidak lengkap, Pejabat Bea dan Cukai dapat meminta Importir, Penyelenggara/Pengusaha TPB, Penyelenggara/Pengusaha PLB, pengusaha di Kawasan Bebas sebagaimana dimaksud dalam Pasal 2 ayat (3) huruf d angka 3, atau Badan Usaha/Pelaku Usaha KEK, untuk menyerahkan salinan atau pindaian SKA Form D dan/atau DAB yang diterbitkan di Negara Anggota pengekspor pertama.",
DOC141,bn1050-2020.txt,,,Pasal 10,,1,"Perusahaan lain yang berlokasi di negara ketiga atau perusahaan lain yang berlokasi di negara yang sama dengan negara tempat diterbitkannya SKA Form D dan/atau DAB, dapat menerbitkan Third Country Invoice. SKA Form D yang menggunakan Third Country Invoice sebagaimana dimaksud pada ayat (1), harus memenuhi ketentuan sebagai berikut: a. mencantumkan nama perusahaan dan negara yang menerbitkan Third Country Invoice pada kolom 7 SKA Form D; b. mencantumkan nomor Third Country Invoice atau nomor invoice asal barang, pada kolom 10 SKA Form D.",
DOC141,bn1050-2020.txt,,,Pasal 10,,2,"Dalam hal Third Country Invoice diterbitkan di negara yang berbeda dengan negara tempat diterbitkannya SKA Form D dan/atau DAB, tanda (V) atau (X) harus dicantumkan pada kolom 13 SKA Form D kotak “Third Country Invoicing”.",
DOC141,bn1050-2020.txt,,,Pasal 10,,3,"Dalam hal DAB yang menggunakan Third Country Invoice sebagaimana dimaksud pada ayat (1), Eksportir Bersertifikat membuat DAB dalam billing statement, delivery order, atau packing list.",
DOC141,bn1050-2020.txt,,,Pasal 11,,1,"Dalam hal SKA Form D berupa e-Form D, tata cara pencantuman: a. Akumulasi sebagaimana dimaksud dalam Pasal 7 ayat (2); b. Issued Retroactively sebagaimana dimaksud dalam Pasal 7 ayat (3); c. SKA Back-to-Back sebagaimana dimaksud dalam Pasal 9 ayat (3); dan d. Third Country Invoice, sebagaimana dimaksud dalam Pasal 10 ayat (2), dalam e-Form D, dilaksanakan sesuai dengan ketentuan yang tercantum dalam Lampiran huruf A yang merupakan bagian tidak terpisahkan dari Peraturan Menteri ini.",
DOC141,bn1050-2020.txt,,,Pasal 12,,1,"Untuk dapat menggunakan Tarif Preferensi sebagaimana dimaksud dalam Pasal 2, Importir wajib: a. menyerahkan lembar asli SKA Form D dan/atau lembar asli DAB; b. mencantumkan kode fasilitas Persetujuan Perdagangan Barang ASEAN pada Pemberitahuan Impor Barang (PIB) secara benar; dan c. mencantumkan nomor referensi dan tanggal SKA Form D dan/atau nomor Eksportir Bersertifikat dan tanggal DAB pada Pemberitahuan Impor Barang (PIB) secara benar.",
DOC141,bn1050-2020.txt,,,Pasal 12,,2,"Untuk Importir sebagaimana dimaksud pada ayat (1) yang termasuk dalam kategori jalur kuning atau jalur merah, penyerahan lembar asli SKA Form D dan/atau lembar asli DAB ke Kantor Pabean dilaksanakan dengan ketentuan sebagai berikut: a. untuk Kantor Pabean yang telah ditetapkan sebagai Kantor Pabean yang memberikan pelayanan kepabeanan selama 24 (dua puluh empat) jam sehari dan 7 (tujuh) hari seminggu, lembar asli SKA Form D dan/atau lembar asli DAB wajib diserahkan kepada Pejabat Bea dan Cukai di Kantor Pabean paling lambat pada pukul 12.00 pada hari berikutnya; atau b. untuk Kantor Pabean yang belum ditetapkan sebagai Kantor Pabean yang memberikan pelayanan kepabeanan selama 24 (dua puluh empat) jam sehari dan 7 (tujuh) hari seminggu, lembar asli SKA Form D dan/atau lembar asli DAB wajib diserahkan kepada Pejabat Bea dan Cukai di Kantor Pabean paling lambat pada pukul 12.00 pada hari kerja berikutnya, terhitung sejak Pemberitahuan Impor Barang (PIB) mendapatkan Surat Pemberitahuan Jalur Kuning (SPJK) atau Surat Pemberitahuan Jalur Merah (SPJM).",
DOC141,bn1050-2020.txt,,,Pasal 12,,3,"Untuk Importir sebagaimana dimaksud pada ayat (1) yang termasuk dalam kategori jalur hijau, penyerahan lembar asli SKA Form D dan/atau lembar asli DAB ke Kantor Pabean dilaksanakan dengan ketentuan sebagai berikut: a. untuk Kantor Pabean yang telah ditetapkan sebagai Kantor Pabean yang memberikan pelayanan kepabeanan selama 24 (dua puluh empat) jam sehari dan 7 (tujuh) hari seminggu, lembar asli SKA Form D dan/atau lembar asli DAB wajib diserahkan kepada Pejabat Bea dan Cukai di Kantor Pabean paling lambat 3 (tiga) hari; atau b. untuk Kantor Pabean yang belum ditetapkan sebagai Kantor Pabean yang memberikan pelayanan kepabeanan selama 24 (dua puluh empat) jam sehari dan 7 (tujuh) hari seminggu, lembar asli SKA Form D dan/atau lembar asli DAB wajib diserahkan kepada Pejabat Bea dan Cukai di Kantor Pabean paling lambat 3 (tiga) hari kerja, terhitung sejak Pemberitahuan Impor Barang (PIB) mendapatkan Surat Persetujuan Pengeluaran Barang (SPPB).",
DOC141,bn1050-2020.txt,,,Pasal 12,,4,"Untuk Importir sebagaimana dimaksud pada ayat (1) yang telah ditetapkan sebagai mitra utama kepabeanan atau Authorized Economic Operator (AEO), lembar asli SKA Form D dan/atau lembar asli DAB wajib diserahkan kepada Pejabat Bea dan Cukai di Kantor Pabean paling lambat 5 (lima) hari kerja terhitung sejak Pemberitahuan Impor Barang (PIB) mendapatkan Surat Persetujuan Pengeluaran Barang (SPPB).",
DOC141,bn1050-2020.txt,,,Pasal 12,,5,"Untuk dapat menggunakan Tarif Preferensi sebagaimana dimaksud dalam Pasal 2, Penyelenggara/Pengusaha TPB wajib: a. menyerahkan lembar asli SKA Form D dan/atau lembar asli DAB kepada Pejabat Bea dan Cukai di Kantor Pabean yang mengawasi TPB, paling lambat 3 (tiga) hari kerja terhitung sejak pemberitahuan pabean impor untuk ditimbun di TPB mendapatkan Surat Persetujuan Pengeluaran Barang (SPPB); b. menyerahkan lembar asli SKA Form D dan/atau lembar asli DAB kepada Pejabat Bea dan Cukai di Kantor Pabean yang mengawasi TPB, paling lambat 5 (lima) hari kerja terhitung sejak pemberitahuan pabean impor untuk ditimbun di TPB mendapatkan Surat Persetujuan Pengeluaran Barang (SPPB), dalam hal Penyelenggara/Pengusaha TPB telah ditetapkan sebagai mitra utama kepabeanan atau Authorized Economic Operator (AEO); c. mencantumkan kode fasilitas Persetujuan Perdagangan Barang ASEAN pada pemberitahuan pabean impor untuk ditimbun di TPB secara benar; dan d. mencantumkan nomor referensi dan tanggal SKA Form D dan/atau nomor Eksportir Bersertifikat dan tanggal DAB pada pemberitahuan pabean impor untuk ditimbun di TPB secara benar.",
DOC141,bn1050-2020.txt,,,Pasal 12,,6,"Untuk dapat menggunakan Tarif Preferensi sebagaimana dimaksud dalam Pasal 2, Penyelenggara/Pengusaha PLB wajib: a. menyerahkan lembar asli SKA Form D dan/atau lembar asli DAB kepada Pejabat Bea dan Cukai di Kantor Pabean yang mengawasi PLB, paling lambat 3 (tiga) hari kerja terhitung sejak pemberitahuan pabean impor untuk ditimbun di PLB mendapatkan Surat Persetujuan Pengeluaran Barang (SPPB); b. menyerahkan lembar asli SKA Form D dan/atau lembar asli DAB kepada Pejabat Bea dan Cukai di Kantor Pabean yang mengawasi PLB, paling lambat 5 (lima) hari kerja terhitung sejak pemberitahuan pabean impor untuk ditimbun di PLB mendapatkan Surat Persetujuan Pengeluaran Barang (SPPB), dalam hal Penyelenggara/Pengusaha PLB telah ditetapkan sebagai mitra utama kepabeanan atau Authorized Economic Operator (AEO); c. mencantumkan kode fasilitas Persetujuan Perdagangan Barang ASEAN pada pemberitahuan pabean impor untuk ditimbun di PLB secara benar; dan d. mencantumkan nomor referensi dan tanggal SKA Form D dan/atau nomor Eksportir Bersertifikat dan tanggal DAB pada pemberitahuan pabean impor untuk ditimbun di PLB secara benar.",
DOC141,bn1050-2020.txt,,,Pasal 12,,7,"Untuk dapat menggunakan Tarif Preferensi sebagaimana dimaksud dalam Pasal 2, pengusaha di Kawasan Bebas sebagaimana dimaksud dalam Pasal 2 ayat (3) huruf d angka 3, wajib: a. menyerahkan lembar asli SKA Form D dan/atau lembar asli DAB, hasil cetak PPFTZ-01 pemasukan barang ke Kawasan Bebas dari luar Daerah Pabean, kepada Pejabat Bea dan Cukai di Kantor Pabean yang melakukan penelitian dokumen, paling lambat 3 (tiga) hari kerja terhitung sejak PPFTZ-01 pemasukan barang ke Kawasan Bebas dari luar Daerah Pabean mendapatkan Surat Persetujuan Pengeluaran Barang (SPPB); b. mencantumkan kode fasilitas Persetujuan Perdagangan Barang ASEAN pada PPFTZ-01 pemasukan barang ke Kawasan Bebas dari luar Daerah Pabean secara benar; dan c. mencantumkan nomor referensi dan tanggal SKA Form D dan/atau nomor Eksportir Bersertifikat dan tanggal DAB pada PPFTZ-01 pemasukan barang ke Kawasan Bebas dari luar Daerah Pabean secara benar.",
DOC141,bn1050-2020.txt,,,Pasal 12,,8,"Untuk dapat menggunakan Tarif Preferensi sebagaimana dimaksud dalam Pasal 2, Badan Usaha/Pelaku Usaha KEK berpedoman pada ketentuan sebagaimana dimaksud pada ayat (5).",
DOC141,bn1050-2020.txt,,,Pasal 12,,9,"Dalam hal telah ditetapkan dokumen pemberitahuan pabean khusus untuk KEK, untuk dapat menggunakan Tarif Preferensi sebagaimana dimaksud dalam Pasal 2, Badan Usaha/Pelaku Usaha KEK, wajib: a. menyerahkan lembar asli SKA Form D dan/atau lembar asli DAB kepada Pejabat Bea dan Cukai di Kantor Pabean yang melakukan penelitian, paling lambat 3 (tiga) hari kerja terhitung sejak pemberitahuan pabean pemasukan barang dari luar Daerah Pabean ke KEK mendapatkan Surat Persetujuan Pengeluaran Barang (SPPB); b. menyerahkan lembar asli SKA Form D dan/atau lembar asli DAB kepada Pejabat Bea dan Cukai di Kantor Pabean yang melakukan penelitian, paling lambat 5 (lima) hari kerja terhitung sejak pemberitahuan pabean pemasukan barang dari luar Daerah Pabean ke KEK mendapatkan Surat Persetujuan Pengeluaran Barang (SPPB), dalam hal Badan Usaha/Pelaku Usaha KEK telah ditetapkan sebagai mitra utama kepabeanan atau Authorized Economic Operator (AEO); c. mencantumkan kode fasilitas Persetujuan Perdagangan Barang ASEAN pada pemberitahuan pabean pemasukan barang dari luar Daerah Pabean ke KEK secara benar; dan d. mencantumkan nomor referensi dan tanggal SKA Form D dan/atau nomor Eksportir Bersertifikat dan tanggal DAB pada pemberitahuan pabean pemasukan barang dari luar Daerah Pabean ke KEK secara benar. Importir, Penyelenggara/Pengusaha TPB, Penyelenggara/Pengusaha PLB, pengusaha di Kawasan Bebas sebagaimana dimaksud dalam Pasal 2 ayat (3) huruf d angka 3, atau Badan Usaha/Pelaku Usaha KEK, menyerahkan Dokumen Pelengkap Pabean dengan berpedoman pada ketentuan peraturan perundang-undangan di bidang kepabeanan. Dalam hal penyerahan dokumen secara elektronik telah tersedia dalam SKP, Dokumen Pelengkap Pabean sebagaimana dimaksud pada ayat (10) dapat diserahkan secara elektronik. Lembar asli SKA Form D sebagaimana dimaksud pada ayat (2) sampai dengan ayat (9) meliputi: Dengan Rahmat Tuhan Yang Maha Esa",
DOC141,bn1050-2020.txt,,,Pasal 12,1,,"bahwa untuk melaksanakan ketentuan dalam Peraturan Menteri Keuangan mengenai tata cara pengenaan tarif bea masuk atas barang impor berdasarkan persetujuan perdagangan barang ASEAN, perlu menetapkan Peraturan Menteri Keuangan tentang Tata Cara Pengenaan Tarif Bea Masuk Atas Barang Impor Berdasarkan Persetujuan Perdagangan Barang ASEAN;",
DOC141,bn1050-2020.txt,,,Pasal 12,2,,"bahwa untuk itu, perlu menetapkan ketentuan lebih lanjut mengenai dokumen yang diperlukan dalam proses importasi. d. Peraturan Menteri Keuangan Nomor 217/PMK.01/2018 tentang Organisasi dan Tata Kerja Kementerian Keuangan (Berita Negara Republik Indonesia Tahun 2018 Nomor 1862); e. Peraturan Menteri Keuangan Nomor 229/PMK.01/2019 tentang Perubahan Kedua atas Peraturan Menteri Keuangan Nomor 217/PMK.01/2018 tentang Organisasi dan Tata Kerja Kementerian Keuangan (Berita Negara Republik Indonesia Tahun 2019 Nomor 1745). Menetapkan: PERATURAN MENTERI KEUANGAN TENTANG TATA CARA PENGENAAN TARIF BEA MASUK ATAS BARANG IMPOR BERDASARKAN PERSETUJUAN PERDAGANGAN BARANG ASEAN. KETENTUAN UMUM Dalam Peraturan Menteri ini yang dimaksud dengan:",
