doc_id,nama_dokumen,bab,bagian,pasal,angka,ayat,isi,penjelasan
DOC152,bn108-2018.txt,,,Pasal 13,,1,"Perusahaan pemilik API, BUMN, dan BUMD wajib melaporkan setiap perubahan yang terkait dengan dokumen sebagaimana dimaksud dalam Pasal 11 ayat (1) huruf b, huruf c, dan huruf d.",
DOC152,bn108-2018.txt,,,Pasal 13,,2,Perusahaan sebagaimana dimaksud pada ayat (1) harus mengajukan permohonan perubahan Persetujuan Impor secara elektronik kepada Direktur Jenderal dalam hal ini Direktur Impor dengan melampirkan: a. dokumen yang mengalami perubahan sebagaimana dimaksud pada ayat (1); dan b. Persetujuan Impor.,
DOC152,bn108-2018.txt,,,Pasal 13,,3,"Atas permohonan sebagaimana dimaksud pada ayat (2), Direktur Impor menerbitkan perubahan Persetujuan Impor paling lama 2 (dua) hari kerja terhitung sejak permohonan diterima secara lengkap dan benar.",
DOC152,bn108-2018.txt,,,Pasal 13,,1,"Perusahaan pemilik API, BUMN, dan BUMD dapat mengajukan permohonan perubahan Persetujuan Impor dalam hal terdapat perubahan mengenai uraian barang, Pos Tarif/HS 8 (delapan) digit, jumlah dan satuan barang, negara asal, dan pelabuhan tujuan impor.",
DOC152,bn108-2018.txt,,,Pasal 13,,2,"Perusahaan sebagaimana dimaksud pada ayat (1) harus mengajukan permohonan perubahan Persetujuan Impor secara elektronik kepada Direktur Jenderal dalam hal ini Direktur Impor dengan melampirkan: a. Persetujuan Impor; b. Surat pernyataan bermeterai cukup dari importir mengenai alasan pengajuan permohonan perubahan Persetujuan Impor; dan c. Rekomendasi dari Menteri Pertanian atau pejabat yang ditunjuk oleh Menteri Pertanian, untuk Impor Hewan dan Produk Hewan sebagaimana tercantum dalam Lampiran II dan Lampiran II yang merupakan bagian tidak terpisahkan dari Peraturan Menteri ini; atau d. Rekomendasi dari Kepala Badan Pengawas Obat dan Makanan atau pejabat yang ditunjuk oleh Kepala Badan Pengawas Obat dan Makanan untuk Impor Produk Hewan Olahan dan Rekomendasi dari Menteri Pertanian atau pejabat yang ditunjuk oleh Menteri Pertanian, untuk Impor Produk Hewan Olahan yang masih mempunyai risiko penyebaran zoonosis sebagaimana tercantum dalam Lampiran III yang merupakan bagian tidak terpisahkan dari Peraturan Menteri ini.",
DOC152,bn108-2018.txt,,,Pasal 13,,3,"Atas permohonan sebagaimana dimaksud pada ayat (2), Direktur Impor menerbitkan perubahan Persetujuan Impor paling lama 2 (dua) hari kerja terhitung sejak permohonan diterima secara lengkap dan benar.",
DOC152,bn108-2018.txt,,,Pasal 14,,1,"Pengajuan permohonan untuk memperoleh: a. Persetujuan Ekspor sebagaimana dimaksud dalam Pasal 5; b. perubahan Persetujuan Ekspor sebagaimana dimaksud dalam Pasal 6A dan Pasal 6B; c. Persetujuan Impor sebagaimana dimaksud dalam Pasal 11; dan d. perubahan Persetujuan Impor sebagaimana dimaksud dalam Pasal 13A dan Pasal 13B, hanya dapat dilayani dengan sistem elektronik melalui http://inatrade.kemendag.go.id. Dalam hal terjadi keadaan memaksa (force majeure) yang mengakibatkan sistem elektronik tidak berfungsi, pengajuan permohonan sebagaimana dimaksud pada ayat (1) dapat disampaikan secara manual.",
DOC152,bn108-2018.txt,,,Pasal 15,,1,"Persetujuan Ekspor sebagaimana dimaksud dalam Pasal 5, perubahan Persetujuan Ekspor sebagaimana dimaksud dalam Pasal 6A dan Pasal 6B, Persetujuan Impor sebagaimana dimaksud dalam Pasal 11, dan perubahan Persetujuan Impor sebagaimana dimaksud dalam Pasal 13A dan Pasal 13B diteruskan secara elektronik dari portal INATRADE ke portal Indonesia National Single Window (INSW).",
DOC152,bn108-2018.txt,,,Pasal 15,,2,"Dalam hal Impor Hewan dan Produk Hewan dilakukan melalui pelabuhan yang belum terkoneksi dengan Indonesia National Single Window (INSW), tembusan Persetujuan Impor disampaikan secara manual kepada instansi terkait.",
DOC152,bn108-2018.txt,,,Pasal 20,,1,Pemeriksaan atas pemenuhan persyaratan impor Hewan dan/atau Produk Hewan dilakukan setelah melalui Kawasan Pabean.,
DOC152,bn108-2018.txt,,,Pasal 20,,2,Persyaratan impor sebagaimana dimaksud pada ayat (1) berupa Persetujuan Impor.,
DOC152,bn108-2018.txt,,,Pasal 20,,3,"Importir harus membuat pernyataan secara mandiri (self declaration) yang menyatakan telah memenuhi persyaratan impor Hewan dan/atau Produk Hewan sebelum barang impor tersebut digunakan, diperdagangkan, dan/atau dipindahtangankan.",
DOC152,bn108-2018.txt,,,Pasal 20,,4,Importir harus menyampaikan pernyataan sebagaimana dimaksud pada ayat (3) secara elektronik melalui http://inatrade.kemendag.go.id dengan mencantumkan nomor Pemberitahuan Impor Barang (PIB).,
DOC152,bn108-2018.txt,,,Pasal 20,,5,Importir wajib menyimpan dokumen persyaratan impor sebagaimana dimaksud pada ayat (2) dan Pemberitahuan Impor Barang (PIB) paling sedikit 5 (lima) tahun untuk keperluan pemeriksaan sebagaimana dimaksud pada ayat (1). Penangguhan permohonan Persetujuan Ekspor dan Persetujuan Impor sebagaimana dimaksud dalam Pasal 22 dan pencabutan Persetujuan Ekspor dan Persetujuan Impor sebagaimana dimaksud dalam Pasal 23 ditetapkan oleh Direktur Ekspor atau Direktur Impor atas nama Direktur Jenderal.,
DOC152,bn108-2018.txt,,,Pasal 25,,1,Eksportir yang telah dikenai sanksi pencabutan Persetujuan Ekspor tidak dapat kembali mengajukan permohonan Persetujuan Ekspor selama 1 (satu) tahun sejak tanggal pencabutan dan dimasukkan ke dalam daftar eksportir dalam pengawasan.,
DOC152,bn108-2018.txt,,,Pasal 25,,2,Importir yang telah dikenai sanksi pencabutan Persetujuan Impor tidak dapat kembali mengajukan permohonan Persetujuan Impor selama 2 (dua) tahun sejak tanggal pencabutan dan dimasukkan ke dalam daftar importir dalam pengawasan.,
DOC152,bn108-2018.txt,,,Pasal 26,,1,Perusahaan yang melakukan Ekspor atau Impor Hewan dan/atau Produk Hewan tidak sesuai dengan ketentuan dalam Peraturan Menteri ini dikenai sanksi sesuai dengan ketentuan peraturan perundang-undangan.,
DOC152,bn108-2018.txt,,,Pasal 26,,2,Hewan dan/atau Produk Hewan yang diimpor tidak sesuai dengan ketentuan dalam Peraturan Menteri ini wajib ditarik kembali dari peredaran dan dimusnahkan oleh Importir.,
DOC152,bn108-2018.txt,,,Pasal 26,,3,Biaya atas pelaksanaan penarikan kembali dari peredaran dan pemusnahan sebagaimana dimaksud pada ayat (2) ditanggung oleh Importir.,
DOC152,bn108-2018.txt,,,Pasal 27,,1,"Impor Produk Hewan Olahan dengan jumlah paling banyak 200 (dua ratus) kg untuk memenuhi kebutuhan bahan baku bagi industri kecil dan menengah, harus mendapatkan Persetujuan Impor dari Menteri.",
DOC152,bn108-2018.txt,,,Pasal 27,,2,Menteri mendelegasikan kewenangan penerbitan Persetujuan Impor sebagaimana dimaksud pada ayat (1) kepada Direktur Jenderal.,
DOC152,bn108-2018.txt,,,Pasal 27,,3,Direktur Jenderal memberikan mandat kewenangan penerbitan Persetujuan Impor sebagaimana dimaksud pada ayat (2) kepada Direktur Impor.,
DOC152,bn108-2018.txt,,,Pasal 27,,4,"Untuk mendapatkan Persetujuan Impor sebagaimana dimaksud pada ayat (1), perusahaan harus mengajukan permohonan secara elektronik kepada Menteri dalam hal ini Direktur Impor dengan melampirkan: a. API; dan b. Surat Pernyataan yang menyatakan bahwa Produk Hewan Olahan yang diimpor digunakan untuk kebutuhan bahan baku industri kecil dan menengah.",
DOC152,bn108-2018.txt,,,Pasal 31,,1,"Dalam rangka pengawasan kebijakan Impor, Direktorat Jenderal Perlindungan Konsumen dan Tertib Niaga melakukan pemeriksaan dan pengawasan secara berkala dan/atau sewaktu-waktu.",
DOC152,bn108-2018.txt,,,Pasal 31,,2,Pemeriksaan sebagaimana dimaksud pada ayat (1) dilakukan terhadap: a. persyaratan impor Hewan dan/atau Produk Hewan; dan b. dokumen pendukung Impor lain.,
DOC152,bn108-2018.txt,,,Pasal 31,,3,"Pengawasan sebagaimana dimaksud pada ayat (1) dilakukan terhadap: a. kebenaran laporan realisasi Impor; b. kesesuaian Hewan dan/atau Produk Hewan yang diimpor dengan data yang tercantum dalam Persetujuan Impor; dan c. kepatuhan atas peraturan perundang-undangan yang terkait di bidang Hewan dan/atau Produk Hewan. Dalam hal diperlukan, petunjuk teknis pelaksanaan dari Peraturan Menteri ini ditetapkan oleh Direktur Jenderal dan/atau Direktur Jenderal Perlindungan Konsumen dan Tertib Niaga sesuai dengan kewenangan masing-masing. Ketentuan dalam Lampiran I, Lampiran II, dan Lampiran III Peraturan Menteri Perdagangan Nomor 59/M-DAG/PER/8/2016 tentang Ketentuan Ekspor dan Impor Hewan dan Produk Hewan (Berita Negara Republik Indonesia Tahun 2016 Nomor 1208) sebagaimana telah diubah dengan Peraturan Menteri Perdagangan Nomor 13/M-DAG/PER/2/2017 tentang Perubahan atas Peraturan Menteri Perdagangan 59/M-DAG/PER/8/2016 tentang Ketentuan Ekspor dan Impor Hewan dan Produk Hewan (Berita Negara Republik Indonesia Tahun 2017 Nomor 366) diubah sehingga menjadi sebagaimana tercantum dalam Lampiran I, Lampiran II, dan Lampiran III yang merupakan bagian tidak terpisahkan dari Peraturan Menteri ini. Pasal II Peraturan Menteri ini mulai berlaku pada tanggal 1 Februari 2018. Agar setiap orang mengetahuinya, memerintahkan pengundangan Peraturan Menteri ini dengan penempatannya dalam Berita Negara Republik Indonesia. MENTERI PERDAGANGAN REPUBLIK INDONESIA, ttd. ENGGARTIASTO LUKITA Diundangkan di Jakarta pada tanggal 16 Januari 2018 DIREKTUR JENDERAL PERATURAN PERUNDANG-UNDANGAN KEMENTERIAN HUKUM DAN HAK ASASI MANUSIA REPUBLIK INDONESIA, ttd. WIDODO EKATJAHJANA LAMPIRAN I PERATURAN MENTERI PERDAGANGAN REPUBLIK INDONESIA NOMOR 20 TAHUN 2018 TENTANG PERUBAHAN KEDUA ATAS PERATURAN MENTERI PERDAGANGAN NOMOR 59/M-DAG/PER/8/2016 TENTANG KETENTUAN EKSPOR DAN IMPOR HEWAN DAN PRODUK HEWAN JENIS HEWAN DAN PRODUK HEWAN YANG DIBATASI EKSPORNYA NO POS TARIF/HS URAIAN BARANG KETERANGAN 1 2 3 4 01.01 Kuda, keledai, bagal dan hinnie, hidup - Kuda:",
DOC152,bn108-2018.txt,,,Pasal 32,1,,"0101.21.00 - Bibit Pacu, Tunggang, Tarik, Kaveleri, Polo dan Kesayangan 01.02 Binatang jenis lembu hidup. - Sapi:",
DOC152,bn108-2018.txt,,,Pasal 32,2,,0102.21.00 - Bibit - Kerbau:,
DOC152,bn108-2018.txt,,,Pasal 32,3,,0102.31.00 - Bibit,
DOC152,bn108-2018.txt,,,Pasal 32,4,,0102.39.00 - Lain-lain 01.03 Babi hidup,
DOC152,bn108-2018.txt,,,Pasal 32,5,,0103.10.00 - Bibit Pedaging dan Pelemak - Lain-lain:,
DOC152,bn108-2018.txt,,,Pasal 32,6,,0103.91.00 - Berat kurang dari 50 Kg,
DOC152,bn108-2018.txt,,,Pasal 32,7,,0103.92.00 - Berat 50 Kg atau lebih 01.04 Biri-biri dan kambing hidup,
DOC152,bn108-2018.txt,,,Pasal 32,8,,"0104.10.10 - Bibit Pedaging, Perah dan Woli/Bulu",
DOC152,bn108-2018.txt,,,Pasal 32,9,,0104.10.90 - Lain-lain 0104.20 - Kambing:,
DOC152,bn108-2018.txt,,,Pasal 32,10,,"0104.20.10 - Bibit Pedaging, Perah dan Bulu/Rambut",
DOC152,bn108-2018.txt,,,Pasal 32,11,,"0104.20.90 - Lain-lain 01.05 Unggas hidup, yaitu ayam dari spesies Gallus domesticus, bebek, angsa, kalkun dan ayam guinea",
DOC152,bn108-2018.txt,,,Pasal 32,12,,0105.11.10 - Ayam bibit Pedaging dan Petelur,
DOC152,bn108-2018.txt,,,Pasal 32,13,,0105.13.10 - Bebek bibit Pedaging dan Petelur,
DOC152,bn108-2018.txt,,,Pasal 32,14,,"0105.94.10 - Ayam bibit, selain ayam sabung 01.06 Binatang lainnya, hidup. - Binatang menyusui:",
DOC152,bn108-2018.txt,,,Pasal 32,15,,0106.14.00 - Kelinci dan hare Bibit Kelinci,
DOC152,bn108-2018.txt,,,Pasal 32,16,,0106.39.00 - Lain-lain Bibit Puyuh dan Bibit Merpati 05.11 Produk hewan tidak dirinci atau termasuk dalam pos lain; binatang mati dari Bab 1 atau 3. Dengan Rahmat Tuhan Yang Maha Esa,
DOC152,bn108-2018.txt,,,Pasal 32,1,,Bahwa untuk melaksanakan ketentuan dalam Peraturan Menteri Perdagangan Nomor 08/M-DAG/PER/2/2016 tentang Organisasi dan Tata Kerja Kementerian Perdagangan (Berita Negara Republik Indonesia Tahun 2017 Nomor 202);,
DOC152,bn108-2018.txt,,,Pasal 32,2,,"Bahwa untuk meningkatkan pengaturan mengenai ketentuan ekspor dan impor hewan dan produk hewan, perlu dilakukan perubahan kedua atas Peraturan Menteri Perdagangan Nomor 59/M-DAG/PER/8/2016 tentang Ketentuan Ekspor dan Impor Hewan dan Produk Hewan (Berita Negara Republik Indonesia Tahun 2016 Nomor 1208) sebagaimana telah diubah dengan Peraturan Menteri Perdagangan Nomor 13/M-DAG/PER/2/2017 tentang Perubahan atas Peraturan Menteri Perdagangan Nomor 59/M-DAG/PER/8/2016 tentang Ketentuan Ekspor dan Impor Hewan dan Produk Hewan (Berita Negara Republik Indonesia Tahun 2017 Nomor 366); e. Peraturan Menteri Perdagangan Nomor 59/M-DAG/PER/8/2016 tentang Ketentuan Ekspor dan Impor Hewan dan Produk Hewan (Berita Negara Republik Indonesia Tahun 2016 Nomor 1208); f. Peraturan Menteri Perdagangan Nomor 13/M-DAG/PER/2/2017 tentang Perubahan atas Peraturan Menteri Perdagangan Nomor 59/M-DAG/PER/8/2016 tentang Ketentuan Ekspor dan Impor Hewan dan Produk Hewan (Berita Negara Republik Indonesia Tahun 2017 Nomor 366); Menetapkan: PERATURAN MENTERI PERDAGANGAN TENTANG PERUBAHAN KEDUA ATAS PERATURAN MENTERI PERDAGANGAN NOMOR 59/M-DAG/PER/8/2016 TENTANG KETENTUAN EKSPOR DAN IMPOR HEWAN DAN PRODUK HEWAN. Pasal I Beberapa ketentuan dalam Peraturan Menteri Perdagangan Nomor 59/M-DAG/PER/8/2016 tentang Ketentuan Ekspor dan Impor Hewan dan Produk Hewan (Berita Negara Republik Indonesia Tahun 2016 Nomor 1208) sebagaimana telah diubah dengan Peraturan Menteri Perdagangan Nomor 13/M-DAG/PER/2/2017 tentang Perubahan atas Peraturan Menteri Perdagangan Nomor 59/M-DAG/PER/8/2016 tentang Ketentuan Ekspor dan Impor Hewan dan Produk Hewan (Berita Negara Republik Indonesia Tahun 2017 Nomor 366) diubah sebagai berikut: - Mani dari binatang jenis lembu; - Mani dari binatang jenis babi; - Lain-lain: Produk dari ikan atau krustasea, moluska, atau invertebrata air lainnya; binatang mati dari Bab 3. Pasal II Ketentuan lebih lanjut mengenai pelaksanaan Peraturan Menteri ini diatur dalam keputusan Menteri Perdagangan. Pasal III Peraturan Menteri ini mulai berlaku pada tanggal ditetapkan. MENTERI PERDAGANGAN REPUBLIK INDONESIA, ttd. ENGGARTIASTO LUKITA LAMPIRAN II PERATURAN MENTERI PERDAGANGAN REPUBLIK INDONESIA NOMOR 20 TAHUN 2018 TENTANG PERUBAHAN KEDUA ATAS PERATURAN MENTERI PERDAGANGAN NOMOR 59/M-DAG/PER/8/2016 TENTANG KETENTUAN EKSPOR DAN IMPOR HEWAN DAN PRODUK HEWAN JENIS HEWAN DAN PRODUK HEWAN DARI JENIS LEMBU YANG DIBATASI IMPORNYA KETERANGAN POS TARIF / URAIAN Jenis item Jenis item No HS BARANG Kategori potongan potongan daging - (inter- (nama nasional) Indonesia) 1 2 3 4 5 6 01.02 Binatang jenis lembu, hidup. - Sapi:",
DOC152,bn108-2018.txt,,,Pasal 1,1,,| 0102.21.00 --Bibit - Sapi Jantan (termasuk lembu),
DOC152,bn108-2018.txt,,,Pasal 1,2,,ex. 0102.29.19 -- Lain-lain Sapi Bakalan Jantan Berat maksimal rata-rata 450 kg,
DOC152,bn108-2018.txt,,,Pasal 1,3,,"ex. 0102.29.90 -- Lain-lain Sapi Bakalan Betina Berat maksimal rata-rata 450 kg 02.01 Daging binatang jenis lembu, segar atau dingin. - 0201.10.00 - Karkas dan setengah karkas - 0201.20.00 - Potongan daging Primer (Prime Cuts). - 0201.30.00 - Daging Potongan Tenderloin tanpa tulang (Boneless). Dalam Peraturan Menteri ini yang dimaksud dengan:",
DOC152,bn108-2018.txt,,,Pasal 1,1,,"Hewan adalah binatang atau satwa yang seluruh atau sebagian dari siklus hidupnya berada di darat, air, dan/atau udara, baik yang dipelihara maupun yang di habitatnya.",
DOC152,bn108-2018.txt,,,Pasal 1,2,,"Bibit Hewan, yang selanjutnya disebut Bibit adalah hewan yang mempunyai sifat unggul. MENTERI PERDAGANGAN REPUBLIK INDONESIA, ttd. ENGGARTIASTO LUKITA Dengan Rahmat Tuhan Yang Maha Esa",
DOC152,bn108-2018.txt,,,Pasal 1,1,,"Bahwa untuk melaksanakan ketentuan dalam peraturan perundang-undangan yang berlaku, perlu menetapkan peraturan mengenai pengaturan impor hewan dan produk hewan.",
DOC152,bn108-2018.txt,,,Pasal 1,2,,"Bahwa pengaturan ini diperlukan untuk melindungi kesehatan masyarakat dan hewan, serta menjaga kelestarian sumber daya hewan. a. Undang-Undang Nomor 18 Tahun 2009 tentang Peternakan dan Kesehatan Hewan; b. Undang-Undang Nomor 7 Tahun 2014 tentang Perdagangan; c. Peraturan Pemerintah Nomor 82 Tahun 2000 tentang Kesehatan Masyarakat Veteriner; d. Peraturan Menteri Pertanian Nomor 26 Tahun 2017 tentang Pengawasan dan Pengendalian Impor Produk Hewan. Menetapkan: PERATURAN MENTERI PERTANIAN TENTANG PENGATURAN IMPOR HEWAN DAN PRODUK HEWAN. Dalam peraturan ini yang dimaksud dengan:",
DOC152,bn108-2018.txt,,,Pasal 1,1,,"Benih Hewan adalah bahan reproduksi hewan yang dapat berupa semen, sperma, oval, telur tertunas, dan embrio.",
DOC152,bn108-2018.txt,,,Pasal 1,2,,Bakalan Ternak Ruminansia Pedaging adalah ternak ruminansia pedaging dewasa yang dipelihara selama kurun waktu tertentu hanya untuk digemukkan sampai mencapai bobot badan maksimal pada umur optimal untuk dipotong.,
DOC152,bn108-2018.txt,,,Pasal 1,3,,"Produk Hewan adalah semua bahan yang berasal dari hewan yang masih segar dan/atau telah diolah atau diproses untuk keperluan konsumsi, farmakoseutika, pertanian, dan/atau kegunaan lain bagi pemenuhan kebutuhan dan kemaslahatan manusia.",
DOC152,bn108-2018.txt,,,Pasal 1,4,,Zoonosis adalah penyakit yang dapat menular dari hewan kepada manusia atau sebaliknya.,
DOC152,bn108-2018.txt,,,Pasal 1,5,,Ekspor adalah kegiatan mengeluarkan barang dari daerah pabean.,
DOC152,bn108-2018.txt,,,Pasal 1,6,,Impor adalah kegiatan memasukkan barang ke dalam daerah pabean.,
DOC152,bn108-2018.txt,,,Pasal 1,7,,"Angka Pengenal Importir, yang selanjutnya disingkat API, adalah tanda pengenal sebagai importir.",
DOC152,bn108-2018.txt,,,Pasal 1,8,,"Label adalah setiap keterangan mengenai barang yang berbentuk gambar, tulisan, kombinasi keduanya, atau bentuk lain yang memuat informasi tentang produk dan keterangan pelaku usaha serta informasi lainnya, yang disertakan pada barang, dimasukkan ke dalam, ditempelkan/melekat pada barang, tercetak pada barang, dan/atau merupakan bagian kemasan.",
DOC152,bn108-2018.txt,,,Pasal 1,9,,Logo Tara Pangan adalah penandaan yang menunjukkan bahwa suatu kemasan pangan aman digunakan untuk pangan.,
DOC152,bn108-2018.txt,,,Pasal 1,10,,Kode Daur Ulang adalah penandaan yang menunjukkan bahwa suatu kemasan pangan dapat didaur ulang.,
DOC152,bn108-2018.txt,,,Pasal 1,11,,"Kemasan adalah wadah yang digunakan untuk mengemas dan/atau membungkus produk hewan, baik yang bersentuhan langsung maupun tidak dengan produk hewan.",
DOC152,bn108-2018.txt,,,Pasal 1,12,,Persetujuan Ekspor adalah persetujuan yang digunakan sebagai izin untuk melakukan ekspor hewan dan produk hewan.,
DOC152,bn108-2018.txt,,,Pasal 1,13,,Persetujuan Impor adalah persetujuan yang digunakan sebagai izin untuk melakukan impor hewan dan produk hewan.,
DOC152,bn108-2018.txt,,,Pasal 1,14,,Rekomendasi adalah surat keterangan yang diterbitkan oleh pejabat instansi/unit teknis terkait yang berwenang dan merupakan persyaratan diterbitkannya persetujuan ekspor dan persetujuan impor.,
DOC152,bn108-2018.txt,,,Pasal 1,15,,"Badan Usaha Milik Negara, yang selanjutnya disingkat BUMN, adalah badan usaha yang seluruh atau sebagian besar modalnya dimiliki oleh negara melalui penyertaan secara langsung yang berasal dari kekayaan negara yang dipisahkan.",
DOC152,bn108-2018.txt,,,Pasal 1,16,,"Badan Usaha Milik Daerah, yang selanjutnya disingkat BUMD, adalah badan usaha yang seluruh atau sebagian besar modalnya dimiliki oleh daerah.",
DOC152,bn108-2018.txt,,,Pasal 2,,1,Ketentuan lebih lanjut mengenai pengaturan impor hewan dan produk hewan diatur dalam peraturan menteri ini.,
DOC152,bn108-2018.txt,,,Pasal 2,,2,"Peraturan ini mulai berlaku pada tanggal ditetapkan. MENTERI PERDAGANGAN REPUBLIK INDONESIA, ttd. ENGGARTIASTO LUKITA Dengan Rahmat Tuhan Yang Maha Esa",
DOC152,bn108-2018.txt,,,Pasal 2,1,,"Bahwa untuk melaksanakan ketentuan dalam peraturan perundang-undangan di bidang perdagangan, perlu menetapkan peraturan mengenai Persetujuan Ekspor dan Persetujuan Impor.",
DOC152,bn108-2018.txt,,,Pasal 2,2,,"Bahwa untuk itu, perlu dilakukan perubahan atas ketentuan yang ada. a. Undang-Undang Nomor 7 Tahun 2014 tentang Perdagangan; b. Peraturan Pemerintah Nomor 31 Tahun 2007 tentang Kebijakan Impor; c. Peraturan Menteri Perdagangan Nomor 20 Tahun 2018 tentang Ketentuan Ekspor dan Impor Hewan dan Produk Hewan. Menetapkan: Peraturan Menteri Perdagangan tentang Perubahan atas Peraturan Menteri Perdagangan Nomor 20 Tahun 2018 tentang Ketentuan Ekspor dan Impor Hewan dan Produk Hewan. Dalam peraturan ini yang dimaksud dengan:",
DOC152,bn108-2018.txt,,,Pasal 1,1,,Menteri adalah Menteri yang menyelenggarakan urusan pemerintahan di bidang perdagangan.,
DOC152,bn108-2018.txt,,,Pasal 1,2,,"Direktur Jenderal adalah Direktur Jenderal Perdagangan Luar Negeri, Kementerian Perdagangan.",
DOC152,bn108-2018.txt,,,Pasal 1,3,,"Direktur Ekspor adalah Direktur Ekspor Produk Pertanian dan Kehutanan Direktorat Jenderal Perdagangan Luar Negeri, Kementerian Perdagangan.",
DOC152,bn108-2018.txt,,,Pasal 1,4,,"Direktur Impor adalah Direktur Impor Direktorat Jenderal Perdagangan Luar Negeri, Kementerian Perdagangan. Ketentuan ayat (2) Pasal 4 diubah sehingga Pasal 4 berbunyi sebagai berikut:",
DOC152,bn108-2018.txt,,,Pasal 2,,1,Ekspor Hewan dan/atau Produk Hewan sebagaimana dimaksud dalam Pasal 3 ayat (2) hanya dapat dilakukan oleh perusahaan yang telah mendapat Persetujuan Ekspor dari Direktur Jenderal.,
DOC152,bn108-2018.txt,,,Pasal 2,,2,Menteri mendelegasikan kewenangan penerbitan Persetujuan Ekspor sebagaimana dimaksud pada ayat (1) kepada Direktur Jenderal.,
DOC152,bn108-2018.txt,,,Pasal 2,,3,Direktur Jenderal memberikan mandat penerbitan Persetujuan Ekspor sebagaimana dimaksud pada ayat (2) kepada Direktur Ekspor. Ketentuan dalam Pasal 5 diubah sehingga berbunyi sebagai berikut:,
DOC152,bn108-2018.txt,,,Pasal 3,,1,"Untuk mendapatkan Persetujuan Ekspor sebagaimana dimaksud dalam Pasal 4, perusahaan harus mengajukan permohonan secara elektronik kepada Direktur Jenderal dalam hal ini Direktur Ekspor dengan melampirkan: a. Surat Izin Usaha Perdagangan (SIUP) atau surat izin usaha di bidang peternakan dan kesehatan hewan; b. Tanda Daftar Perusahaan (TDP); dan c. Rekomendasi dari Menteri Pertanian atau pejabat yang ditunjuk oleh Menteri Pertanian.",
DOC152,bn108-2018.txt,,,Pasal 3,,2,Direktur Ekspor atas nama Direktur Jenderal menerbitkan Persetujuan Ekspor paling lama 2 (dua) hari kerja terhitung sejak tanggal permohonan sebagaimana dimaksud pada ayat (1) diterima secara lengkap dan benar.,
DOC152,bn108-2018.txt,,,Pasal 3,,3,"Dalam hal permohonan sebagaimana dimaksud pada ayat (1) tidak lengkap dan/atau tidak benar, Direktur Ekspor atas nama Direktur Jenderal menolak untuk menerbitkan Persetujuan Ekspor.",
DOC152,bn108-2018.txt,,,Pasal 3,,4,"Persetujuan Ekspor sebagaimana dimaksud pada ayat (2) disampaikan kepada perusahaan dan tembusan disampaikan kepada instansi terkait. Di antara Pasal 6 dan Pasal 7 disisipkan 2 (dua) pasal, yakni Pasal 6A dan Pasal 6B sehingga berbunyi sebagai berikut:",
DOC152,bn108-2018.txt,,,Pasal 6,,1,Perusahaan wajib melaporkan setiap perubahan yang terkait dengan dokumen sebagaimana dimaksud dalam Pasal 5 ayat (1) huruf a dan huruf b.,
DOC152,bn108-2018.txt,,,Pasal 6,,2,Perusahaan sebagaimana dimaksud pada ayat (1) harus mengajukan permohonan perubahan Persetujuan Ekspor secara elektronik kepada Direktur Jenderal dalam hal ini Direktur Ekspor dengan melampirkan: a. dokumen yang mengalami perubahan sebagaimana dimaksud pada ayat (1); dan b. Persetujuan Ekspor.,
DOC152,bn108-2018.txt,,,Pasal 6,,3,"Atas permohonan sebagaimana dimaksud pada ayat (2), Direktur Ekspor menerbitkan perubahan Persetujuan Ekspor paling lama 2 (dua) hari kerja terhitung sejak permohonan diterima secara lengkap dan benar.",
DOC152,bn108-2018.txt,,,Pasal 6,,1,"Perusahaan dapat mengajukan permohonan perubahan Persetujuan Ekspor dalam hal terdapat perubahan mengenai uraian barang, Pos Tarif/HS 8 (delapan) digit, jumlah dan satuan barang, pelabuhan muat, dan/atau negara tujuan ekspor.",
DOC152,bn108-2018.txt,,,Pasal 6,,2,Perusahaan sebagaimana dimaksud pada ayat (1) harus mengajukan permohonan perubahan Persetujuan Ekspor secara elektronik kepada Direktur Jenderal dalam hal ini Direktur Ekspor dengan melampirkan: a. Persetujuan Ekspor; b. Surat pernyataan bermeterai cukup dari eksportir mengenai alasan pengajuan permohonan perubahan Persetujuan Ekspor; dan c. Rekomendasi dari Menteri Pertanian atau pejabat yang ditunjuk oleh Menteri Pertanian.,
DOC152,bn108-2018.txt,,,Pasal 6,,3,"Atas permohonan sebagaimana dimaksud pada ayat (2), Direktur Ekspor menerbitkan perubahan Persetujuan Ekspor paling lama 2 (dua) hari kerja terhitung sejak permohonan diterima secara lengkap dan benar. Ketentuan dalam Pasal 10 diubah sehingga berbunyi sebagai berikut:",
DOC152,bn108-2018.txt,,,Pasal 7,,1,Impor Hewan dan Produk Hewan sebagaimana dimaksud dalam Pasal 8 dan Pasal 9 hanya dapat dilakukan setelah mendapat Persetujuan Impor dari Direktur Jenderal.,
DOC152,bn108-2018.txt,,,Pasal 7,,2,Menteri mendelegasikan kewenangan penerbitan Persetujuan Impor sebagaimana dimaksud pada ayat (1) kepada Direktur Jenderal.,
DOC152,bn108-2018.txt,,,Pasal 7,,3,Direktur Jenderal memberikan mandat penerbitan Persetujuan Impor sebagaimana dimaksud pada ayat (2) kepada Direktur Impor. Ketentuan dalam Pasal 11 diubah sehingga berbunyi sebagai berikut:,
