doc_id,nama_dokumen,bab,bagian,pasal,angka,ayat,isi,penjelasan
DOC141,bn1050-2020.txt,BAB VIII,,Pasal 35,1,,"Ketentuan Pemasukan Barang ke TPB yang Menggunakan SKA Form D dan/atau DAB: a. Ketentuan pengisian dokumen Pemberitahuan Impor Barang untuk Ditimbun di TPB (BC 2.3), serta penyerahan SKA Form D dan/atau DAB, dokumen BC 2.3, dan Dokumen Pelengkap Pabean: 1) Untuk mendapatkan Tarif Preferensi, Penyelenggara/Pengusaha TPB: - Dalam hal dokumen BC 2.3 hanya menggunakan skema Persetujuan Perdagangan Barang ASEAN, wajib mencantumkan secara benar kode fasilitas 06, nomor referensi, dan tanggal SKA Form D dan/atau nomor Eksportir Bersertifikat dan tanggal DAB pada kolom 17 dan/atau kolom 34 dokumen BC 2.3. - Dalam hal dokumen BC 2.3 menggunakan skema Persetujuan Perdagangan Barang ASEAN dan fasilitas lainnya, wajib mencantumkan secara benar: a) Kode fasilitas 99 pada kolom 17 dokumen BC 2.3, serta diisi “lihat Lampiran”; dan b) Kode fasilitas 06 pada kolom 34 dokumen BC 2.3, serta nomor referensi dan tanggal SKA Form D dan/atau nomor Eksportir Bersertifikat dan tanggal DAB pada kolom 34 dokumen BC 2.3 dan pada Lembar Lampiran dokumen BC 2.3 untuk Dokumen dan Skep/Persetujuan. 2) Penyelenggara/Pengusaha TPB sebagaimana dimaksud pada angka 1): a) Wajib menyerahkan lembar asli SKA Form D dan/atau lembar asli DAB, dan hasil cetak dokumen BC 2.3 kepada Pejabat Bea dan Cukai di Kantor Pabean yang melakukan penelitian dokumen BC 2.3 paling lambat 3 (tiga) hari kerja terhitung sejak tanggal Surat Persetujuan Pengeluaran Barang (SPPB) dokumen BC 2.3. b) Khusus Penyelenggara/Pengusaha TPB yang telah ditetapkan sebagai mitra utama kepabeanan atau Authorized Economic Operator (AEO), wajib menyerahkan lembar asli SKA Form D dan/atau lembar asli DAB kepada Pejabat Bea dan Cukai di Kantor Pabean yang melakukan penelitian dokumen BC 2.3 paling lambat 5 (lima) hari kerja sejak tanggal Surat Persetujuan Pengeluaran Barang (SPPB) dokumen BC 2.3. 3) Penyelenggara/Pengusaha TPB sebagaimana dimaksud pada angka 1) menyerahkan Dokumen Pelengkap Pabean dengan berpedoman pada ketentuan peraturan perundang-undangan di bidang kepabeanan. 4) Dalam hal Penyelenggara/Pengusaha TPB sebagaimana dimaksud pada angka 1) tidak menyerahkan lembar asli SKA Form D dan/atau lembar asli DAB dan hasil cetak dokumen BC 2.3 kepada Pejabat Bea dan Cukai di Kantor Pabean yang melakukan penelitian dokumen BC 2.3 dalam jangka waktu paling lambat 3 (tiga) hari kerja sebagaimana dimaksud pada angka 2) huruf a), SKA Form D dan/atau DAB ditolak dan Tarif Preferensi tidak diberikan. 5) Dalam hal Penyelenggara/Pengusaha TPB sebagaimana dimaksud pada angka 1) yang telah ditetapkan sebagai mitra utama kepabeanan atau Authorized Economic Operator (AEO) tidak menyerahkan lembar asli SKA Form D dan/atau lembar asli DAB kepada Pejabat Bea dan Cukai di Kantor Pabean yang melakukan penelitian dokumen BC 2.3 dalam jangka waktu paling lambat 5 (lima) hari kerja sebagaimana dimaksud pada angka 2) huruf b), SKA Form D dan/atau DAB ditolak dan Tarif Preferensi tidak diberikan. b. Pejabat Bea dan Cukai di Kantor Pabean yang melakukan penelitian dokumen BC 2.3, melakukan penelitian dokumen terhadap SKA Form D dan/atau DAB, hasil cetak dokumen BC 2.3, dan/atau Dokumen Pelengkap Pabean. 1) Menerima SKA Form D dan/atau DAB, Pejabat Bea dan Cukai di Kantor Pabean yang melakukan penelitian dokumen BC 2.3 memberikan catatan pada dokumen BC 2.3 dan/atau SKP yang menerangkan bahwa SKA Form D dan/atau DAB memenuhi ketentuan untuk mendapatkan Tarif Preferensi; atau 2) Menolak SKA Form D dan/atau DAB, Pejabat Bea dan Cukai di Kantor Pabean yang melakukan penelitian dokumen BC 2.3 memberikan catatan pada dokumen BC 2.3 dan/atau SKP yang menerangkan bahwa SKA Form D dan/atau DAB tidak memenuhi ketentuan untuk mendapatkan Tarif Preferensi, serta memberikan informasi penetapan tersebut kepada Penyelenggara/Pengusaha TPB. d. Dalam hal SKA Form D dan/atau DAB ditolak sebagaimana dimaksud pada huruf c angka 2), Kepala Kantor Pabean atau Pejabat Bea dan Cukai yang ditunjuk mengirimkan pemberitahuan penolakan SKA Form D dan/atau DAB kepada Instansi Penerbit SKA dan/atau Otoritas yang Berwenang sebagaimana diatur dalam Pasal 18 Peraturan Menteri ini. e. Dalam hal SKA Form D dan/atau DAB diragukan, Kepala Kantor Pabean atau Pejabat Bea dan Cukai yang ditunjuk melakukan Permintaan Retroactive Check sebagaimana diatur dalam Pasal 19 Peraturan Menteri ini, serta memberikan catatan status konfirmasi pada dokumen BC 2.3 dan/atau SKP. f. Jika jawaban Permintaan Retroactive Check dari Instansi Penerbit SKA dan/atau Otoritas yang Berwenang memberikan keyakinan yang cukup, maka: 1) Pejabat Bea dan Cukai di Kantor Pabean yang melakukan penelitian dokumen BC 2.3 memberikan catatan pada dokumen BC 2.3 dan/atau SKP yang menerangkan bahwa SKA Form D dan/atau DAB memenuhi ketentuan untuk mendapatkan Tarif Preferensi; dan 2) Kepala Kantor Pabean atau Pejabat Bea dan Cukai yang ditunjuk mengirimkan pemberitahuan penetapan SKA Form D dan/atau DAB sebagaimana dimaksud pada angka 1) secara tertulis kepada Instansi Penerbit SKA dan/atau Otoritas yang Berwenang. SKA Form D dan/atau DAB ditolak dan Tarif Preferensi tidak diberikan jika jawaban atas Permintaan Retroactive Check tidak disampaikan dalam jangka waktu paling lambat 90 (sembilan puluh) hari setelah tanggal diterimanya Permintaan Retroactive Check, dan/atau tidak mencukupi untuk membuktikan pemenuhan Ketentuan Asal Barang. Dengan Rahmat Tuhan Yang Maha Esa",
DOC141,bn1050-2020.txt,BAB VIII,,Pasal 35,1,,"bahwa untuk melaksanakan ketentuan dalam Peraturan Menteri ini, perlu menetapkan ketentuan mengenai pengeluaran barang yang pemasukannya menggunakan SKA Form D dan/atau DAB dari TPB ke TPB lainnya;",
DOC141,bn1050-2020.txt,BAB VIII,,Pasal 35,2,,"bahwa ketentuan tersebut dimaksudkan untuk memberikan kepastian hukum dan kemudahan dalam proses pengeluaran barang. a. Undang-Undang Nomor 10 Tahun 1995 tentang Kepabeanan; b. Peraturan Pemerintah Nomor 85 Tahun 2021 tentang Perubahan atas Peraturan Pemerintah Nomor 85 Tahun 2021 tentang Kepabeanan; c. Peraturan Menteri Keuangan Nomor 182/PMK.04/2020 tentang Ketentuan Umum dan Tata Cara Kepabeanan; d. Peraturan Menteri Keuangan Nomor 1050/PMK.04/2020 tentang Ketentuan Pemberian Tarif Preferensi. Menetapkan: Peraturan Menteri Keuangan tentang Ketentuan Pengeluaran Barang yang Pemasukannya Menggunakan SKA Form D dan/atau DAB. KETENTUAN PENGELUARAN BARANG YANG PEMASUKANNYA MENGGUNAKAN SKA FORM D DAN/ATAU DAB DARI TPB KE TPB LAINNYA Ketentuan pengisian dokumen Pemberitahuan Pengeluaran Barang untuk Diangkut dari TPB ke TPB lainnya (BC 2.7) dan penyerahan dokumen BC 2.3. Untuk mendapatkan Tarif Preferensi, Penyelenggara/Pengusaha TPB wajib: a. mencantumkan secara benar nomor dan tanggal dokumen BC 2.3 yang telah mencantumkan nomor referensi dan tanggal SKA Form D dan/atau nomor Eksportir Bersertifikat dan tanggal DAB pada kolom 15b BC 2.7 dan pada kolom 2 Lembar Lampiran Data Barang dan/atau Bahan Impor dokumen BC 2.7; b. mengisi “pindah tangan” pada Tujuan Pengiriman di Header dokumen BC 2.7 Huruf D; c. mencantumkan secara benar nomor referensi dan tanggal SKA Form D dan/atau nomor Eksportir Bersertifikat dan tanggal DAB pada kolom 4 Lembar Lampiran Data Barang dan/atau Bahan Impor dokumen BC 2.7; d. menyerahkan dokumen BC 2.3 yang telah diberi catatan oleh Pejabat Bea dan Cukai di Kantor Pabean yang melakukan penelitian dokumen BC 2.3 kepada Pejabat Bea dan Cukai di Kantor Pabean yang melakukan penelitian dokumen BC 2.7, pada tanggal yang sama dengan pengajuan dokumen BC 2.7; dan e. dalam hal Penyelenggara/Pengusaha TPB tidak menyerahkan dokumen BC 2.3 yang telah diberi catatan oleh Pejabat Bea dan Cukai di Kantor Pabean yang melakukan penelitian dokumen BC 2.3 kepada Pejabat Bea dan Cukai di Kantor Pabean yang melakukan penelitian dokumen BC 2.7 sebagaimana dimaksud pada huruf d, Tarif Preferensi tidak diberikan. KETENTUAN PENGELUARAN BARANG YANG PEMASUKANNYA MENGGUNAKAN SKA FORM D DAN/ATAU DAB DARI TPB KE TLDDP (IMPOR UNTUK DIPAKAI) Ketentuan pengisian dokumen Pemberitahuan Impor Barang dari TPB untuk diimpor untuk dipakai (BC 2.5), serta penyerahan dokumen BC 2.3: a. untuk mendapatkan Tarif Preferensi, Penyelenggara/Pengusaha TPB: 1) dalam hal dokumen BC 2.5 hanya menggunakan skema Persetujuan Perdagangan Barang ASEAN, wajib mencantumkan secara benar kode fasilitas 06, nomor referensi dan tanggal SKA Form D dan/atau nomor Eksportir Bersertifikat dan tanggal DAB pada kolom 17 dan/atau kolom 29 dokumen BC 2.5; 2) dalam hal dokumen BC 2.5 menggunakan skema Persetujuan Perdagangan Barang ASEAN dan fasilitas lainnya, wajib mencantumkan secara benar: a) kode fasilitas 99 pada kolom 17 dokumen BC 2.5, serta diisi “.....(angka dan huruf) SKEP Fasilitas Impor, lihat lembar lanjutan”; dan b) kode fasilitas 06, serta nomor referensi dan tanggal SKA Form D dan/atau nomor Eksportir Bersertifikat dan tanggal DAB pada kolom 29 dokumen BC 2.5, pada Lembar Lanjutan Dokumen Pelengkap dokumen BC 2.5, dan pada Lembar Lampiran Data Barang dan/atau Bahan Impor dokumen BC 2.5; b. Penyelenggara/Pengusaha TPB sebagaimana dimaksud pada huruf a wajib menyerahkan dokumen BC 2.3 yang telah diberi catatan oleh Pejabat Bea dan Cukai di Kantor Pabean yang melakukan penelitian dokumen BC 2.3 kepada Pejabat Bea dan Cukai di Kantor Pabean yang melakukan penelitian dokumen BC 2.5, pada tanggal yang sama dengan pengajuan dokumen BC 2.5; dan c. dalam hal Penyelenggara/Pengusaha TPB sebagaimana dimaksud pada huruf a tidak menyerahkan dokumen BC 2.3 yang telah diberi catatan oleh Pejabat Bea dan Cukai di Kantor Pabean yang melakukan penelitian dokumen BC 2.3 kepada Pejabat Bea dan Cukai di Kantor Pabean yang melakukan penelitian dokumen BC 2.5 sebagaimana dimaksud pada huruf b, Tarif Preferensi tidak diberikan. KETENTUAN PROSEDURAL TERKAIT TATA CARA PENGENAAN TARIF PREFERENSI UNTUK PLB",
DOC141,bn1050-2020.txt,BAB VIII,,Pasal 35,1,,"KETENTUAN PEMASUKAN BARANG KE PLB YANG MENGGUNAKAN SKA FORM D DAN/ATAU DAB a. Ketentuan pengisian dokumen Pemberitahuan Pabean Penimbunan Barang Impor di PLB (BC 1.6), serta penyerahan SKA Form D dan/atau DAB, dokumen BC 1.6, dan Dokumen Pelengkap Pabean: 1) untuk mendapatkan Tarif Preferensi, Penyelenggara/Pengusaha PLB: a) dalam hal dokumen BC 1.6 hanya menggunakan skema Persetujuan Perdagangan Barang ASEAN, wajib mencantumkan secara benar kode fasilitas 06, nomor referensi dan tanggal SKA Form D dan/atau nomor Eksportir Bersertifikat dan tanggal DAB pada kolom 25 dan/atau kolom 35 dokumen BC 1.6; b) dalam hal dokumen BC 1.6 menggunakan skema Persetujuan Perdagangan Barang ASEAN dan fasilitas lainnya:",
DOC141,bn1050-2020.txt,BAB VIII,,Pasal 35,1,1,"tidak perlu mencantumkan kode fasilitas pada kolom 25 dokumen BC 1.6, serta diisi “.....(angka dan huruf) dokumen lainnya, lihat lembar lanjutan”; dan",
DOC141,bn1050-2020.txt,BAB VIII,,Pasal 35,1,2,"wajib mencantumkan secara benar kode fasilitas 06, serta nomor referensi dan tanggal SKA Form D dan/atau nomor Eksportir Bersertifikat dan tanggal DAB pada kolom 35 dokumen BC 1.6 dan pada Lembar Lanjutan Dokumen Pelengkap Pabean dokumen BC 1.6; 2) Penyelenggara/Pengusaha PLB sebagaimana dimaksud pada angka 1): a) wajib menyerahkan lembar asli SKA Form D dan/atau lembar asli DAB, dan hasil cetak dokumen BC 1.6 kepada Pejabat Bea dan Cukai di Kantor Pabean yang melakukan penelitian dokumen BC 1.6 paling lambat 3 (tiga) hari kerja sejak tanggal Surat Persetujuan Pengeluaran Barang (SPPB) dokumen BC 1.6; b) khusus Penyelenggara/Pengusaha TPB yang telah ditetapkan sebagai mitra utama kepabeanan atau Authorized Economic Operator (AEO), wajib menyerahkan lembar asli SKA Form D dan/atau lembar asli DAB kepada Pejabat Bea dan Cukai di Kantor Pabean yang melakukan penelitian dokumen BC 1.6 paling lambat 5 (lima) hari kerja sejak tanggal Surat Persetujuan Pengeluaran Barang (SPPB) dokumen BC 1.6; 3) Penyelenggara/Pengusaha PLB sebagaimana dimaksud pada angka 1) menyerahkan Dokumen Pelengkap Pabean dengan berpedoman pada ketentuan peraturan perundang-undangan di bidang kepabeanan; 4) dalam hal Penyelenggara/Pengusaha PLB sebagaimana dimaksud pada angka 1) tidak menyerahkan lembar asli SKA Form D dan/atau lembar asli DAB kepada Pejabat Bea dan Cukai di Kantor Pabean yang melakukan penelitian dokumen BC 1.6 dalam jangka waktu paling lambat 3 (tiga) hari kerja sebagaimana dimaksud pada angka 2) huruf a), SKA Form D dan/atau DAB ditolak dan Tarif Preferensi tidak diberikan. Bukti Asal Barang adalah dokumen pelengkap pabean yang diterbitkan oleh instansi penerbit surat keterangan asal dan/atau eksportir bersertifikat yang akan digunakan sebagai dasar pemberian Tarif Preferensi. Surat Keterangan Asal (Certificate of Origin) Persetujuan Perdagangan Barang ASEAN yang selanjutnya disebut SKA Form D adalah Bukti Asal Barang yang diterbitkan oleh instansi penerbit surat keterangan asal yang akan digunakan sebagai dasar pemberian Tarif Preferensi. Overleaf Notes adalah halaman sebalik SKA Form D yang berisi ketentuan mengenai pengisian SKA Form D dan merupakan bagian yang tidak terpisahkan dari SKA Form D. Surat Keterangan Asal Elektronik Form D yang selanjutnya disebut e-Form D adalah SKA Form D yang disusun sesuai dengan e-ATIGA Form D Process Specification and Message Implementation Guideline, dan dikirim secara elektronik antar Negara Anggota. ASEAN Wide Self Certification yang selanjutnya disebut Sertifikasi Mandiri adalah skema pernyataan asal barang yang diterbitkan oleh eksportir bersertifikat dalam bentuk invoice atau dalam bentuk dokumen komersial billing statement, delivery order, atau packing list, yang akan digunakan sebagai dasar pemberian Tarif Preferensi. Deklarasi Asal Barang yang selanjutnya disingkat DAB adalah Bukti Asal Barang yang berisi pernyataan asal barang dan dibuat oleh eksportir bersertifikat yang akan digunakan sebagai dasar pemberian Tarif Preferensi. Memorandum of Understanding among the Governments of the Participating Member States of the Association of Southeast Asian Nations (ASEAN) adalah dokumen yang berisi kesepakatan antara negara-negara anggota ASEAN mengenai kerjasama di bidang perdagangan dan investasi. Demikianlah ketentuan ini ditetapkan untuk dilaksanakan dengan sebaik-baiknya. Nama Pejabat: [Nama Pejabat] Berita Negara: [Berita Negara, jika ada] Dengan Rahmat Tuhan Yang Maha Esa",
DOC141,bn1050-2020.txt,BAB VIII,,Pasal 35,1,,"bahwa untuk melaksanakan ketentuan Pasal 2 Ayat (3) huruf d angka 3 Peraturan Menteri ini, perlu menetapkan ketentuan prosedural terkait tata cara pengenaan tarif preferensi untuk barang yang pemasukkannya menggunakan SKA Form D dan/atau DAB dari PLB ke TLDDP (impor untuk dipakai);",
DOC141,bn1050-2020.txt,BAB VIII,,Pasal 35,2,,"bahwa ketentuan pengisian dokumen Pemberitahuan Impor Barang dari PLB (BC 2.8), serta penyerahan dokumen BC 1.6, perlu diatur lebih lanjut untuk mendapatkan tarif preferensi. a. Undang-Undang Nomor 17 Tahun 2006 tentang Perubahan atas Undang-Undang Nomor 10 Tahun 1995 tentang Kepabeanan; b. Peraturan Menteri Keuangan Republik Indonesia Nomor 203/PMK.04/2019 tentang Ketentuan Umum dan Tata Cara Kepabeanan; c. Peraturan Menteri Keuangan Republik Indonesia Nomor 1050/PMK.04/2020 tentang Ketentuan Pemberian Tarif Preferensi atas Barang yang Dipasok dari Negara Anggota ASEAN. Menetapkan ketentuan pengeluaran barang yang pemasukkannya menggunakan SKA Form D dan/atau DAB dari PLB ke TLDDP (impor untuk dipakai). Ketentuan pengisian dokumen Pemberitahuan Impor Barang dari PLB (BC 2.8), serta penyerahan dokumen BC 1.6: a. Untuk mendapatkan tarif preferensi, importir: 1) Dalam hal dokumen BC 2.8 hanya menggunakan skema Persetujuan Perdagangan Barang ASEAN, wajib mencantumkan secara benar kode fasilitas 06, nomor referensi dan tanggal SKA Form D dan/atau nomor Eksportir Bersertifikat dan tanggal DAB pada kolom 22 dan/atau kolom 37 dokumen BC 2.8; 2) Dalam hal dokumen BC 2.8 menggunakan skema Persetujuan Perdagangan Barang ASEAN dan fasilitas lainnya: a) Tidak perlu mencantumkan kode fasilitas pada kolom 22 dokumen BC 2.8, serta diisi dengan angka dan huruf dokumen lainnya, lihat lembar lanjutan; b) Wajib mencantumkan secara benar kode fasilitas 06, nomor referensi dan tanggal SKA Form D dan/atau nomor Eksportir Bersertifikat dan tanggal DAB pada kolom 37 dokumen BC 2.8 dan pada Lembar Lanjutan Dokumen dan Pemenuhan Persyaratan Fasilitas dokumen BC 2.8; b. Importir sebagaimana dimaksud pada huruf a wajib menyerahkan dokumen BC 1.6 yang telah diberi catatan oleh Pejabat Bea dan Cukai di Kantor Pabean yang melakukan penelitian dokumen BC 1.6 kepada Pejabat Bea dan Cukai di Kantor Pabean yang melakukan penelitian dokumen BC 2.8, pada tanggal yang sama dengan pengajuan dokumen BC 2.8; c. Dalam hal importir sebagaimana dimaksud pada huruf a tidak menyerahkan dokumen BC 1.6 yang telah diberi catatan oleh Pejabat Bea dan Cukai di Kantor Pabean yang melakukan penelitian dokumen BC 1.6 kepada Pejabat Bea dan Cukai di Kantor Pabean yang melakukan penelitian dokumen BC 2.8, tarif preferensi tidak diberikan. Ketentuan pengeluaran barang yang pemasukkannya menggunakan SKA Form D dan/atau DAB dari PLB ke TLDDP (impor untuk dipakai): a. Barang dari Kawasan Bebas yang dikeluarkan ke TLDDP dapat diberikan tarif preferensi sepanjang dapat dibuktikan bahwa barang tersebut telah diberikan persetujuan penggunaan tarif preferensi oleh Pejabat Bea dan Cukai pada saat pemasukan barang ke Kawasan Bebas. b. Ketentuan pengisian dokumen Pemberitahuan Pabean PPFTZ-01 Pengeluaran Barang dari Kawasan Bebas ke TLDDP, serta penyerahan dokumen PPFTZ-01 pemasukan ke Kawasan Bebas: 1) Untuk mendapatkan tarif preferensi, pengusaha di Kawasan Bebas sebagaimana dimaksud dalam Pasal 2 Ayat (3) huruf d angka 3 Peraturan Menteri ini: a) Dalam hal dokumen PPFTZ-01 pengeluaran hanya menggunakan skema Persetujuan Perdagangan Barang ASEAN, wajib mencantumkan secara benar:",
DOC141,bn1050-2020.txt,BAB VIII,,Pasal 35,2,1,Nomor referensi dan tanggal SKA Form D dan/atau nomor Eksportir Bersertifikat dan tanggal DAB pada kolom 23 dokumen PPFTZ-01 pengeluaran;,
DOC141,bn1050-2020.txt,BAB VIII,,Pasal 35,2,2,"Kode fasilitas 06 pada kolom 40 dokumen PPFTZ-01 pengeluaran; b) Dalam hal dokumen PPFTZ-01 pengeluaran menggunakan skema Persetujuan Perdagangan Barang ASEAN dan fasilitas lainnya, wajib mencantumkan secara benar:",
DOC141,bn1050-2020.txt,BAB VIII,,Pasal 35,2,1,Nomor referensi dan tanggal SKA Form D dan/atau nomor Eksportir Bersertifikat dan tanggal DAB pada Lembar Lampiran Dokumen Pelengkap Pabean Lainnya;,
DOC141,bn1050-2020.txt,BAB VIII,,Pasal 35,2,2,"Kode fasilitas 06 pada kolom 40 dokumen PPFTZ-01 pengeluaran; 2) Pengusaha di Kawasan Bebas sebagaimana dimaksud pada angka 1) wajib menyerahkan dokumen PPFTZ-01 pemasukan ke Kawasan Bebas yang telah diberi catatan oleh Pejabat Bea dan Cukai di Kantor Pabean yang melakukan penelitian dokumen PPFTZ-01 pemasukan kepada Pejabat Bea dan Cukai di Kantor Pabean yang melakukan penelitian dokumen PPFTZ-01 pengeluaran, pada tanggal yang sama dengan pengajuan dokumen PPFTZ-01 pengeluaran; 3) Dalam hal barang yang tercantum dalam dokumen PPFTZ-01 pengeluaran barang dari Kawasan Bebas ke TLDDP tidak dapat dibuktikan berasal dari dokumen PPFTZ-01 pemasukan barang ke Kawasan Bebas yang telah mendapat persetujuan Pejabat Bea dan Cukai di Kantor Pabean yang melakukan penelitian dokumen PPFTZ-01 pemasukan, tarif preferensi tidak diberikan. 4) Dalam hal tarif preferensi diberikan, Pejabat Bea dan Cukai di Kantor Pabean yang melakukan penelitian dokumen PPFTZ-01 pengeluaran memberi tanda/mencatatkan jumlah barang yang dikeluarkan dalam SKP. KETENTUAN PROSEDURAL TERKAIT TATA CARA PENGENAAN TARIF PREFERENSI UNTUK KEK:",
DOC141,bn1050-2020.txt,BAB VIII,,Pasal 35,1,,"Ketentuan Pemasukan Barang ke KEK, yang Menggunakan SKA Form D dan/atau DAB: a. Ketentuan pengisian pemberitahuan pabean pemasukan barang ke KEK dari luar Daerah Pabean, serta penyerahan SKA Form D dan/atau DAB, dan Dokumen Pelengkap Pabean: 1) Untuk mendapatkan tarif preferensi, Badan Usaha/Pelaku Usaha KEK: - Wajib mencantumkan secara benar nomor referensi dan tanggal SKA Form D dan/atau nomor Eksportir Bersertifikat dan tanggal DAB pada dokumen yang relevan. Demikianlah ketentuan ini ditetapkan untuk dilaksanakan dengan sebaik-baiknya. Dengan Rahmat Tuhan Yang Maha Esa",
DOC141,bn1050-2020.txt,BAB VIII,,Pasal 35,1,,"bahwa untuk melaksanakan ketentuan Pasal 10 ayat (1) dan Pasal 11 ayat (1) Peraturan Menteri Keuangan Nomor 1050/PMK.04/2020 tentang Ketentuan Pabean di Kawasan Ekonomi Khusus, perlu menetapkan ketentuan mengenai pengeluaran barang yang pemasukkannya menggunakan SKA Form D dan/atau DAB dari KEK ke KEK lainnya, TPB, atau kawasan bebas;",
DOC141,bn1050-2020.txt,BAB VIII,,Pasal 35,2,,"bahwa untuk mendapatkan Tarif Preferensi, Badan Usaha/Pelaku Usaha KEK wajib memenuhi ketentuan yang diatur dalam peraturan perundang-undangan di bidang kepabeanan. a. Undang-Undang Nomor 17 Tahun 2006 tentang Perubahan atas Undang-Undang Nomor 10 Tahun 1995 tentang Kepabeanan; b. Peraturan Menteri Keuangan Nomor 1050/PMK.04/2020 tentang Ketentuan Pabean di Kawasan Ekonomi Khusus. Menetapkan Peraturan Menteri Keuangan tentang Ketentuan Pengeluaran Barang yang Pemasukkannya Menggunakan SKA Form D dan/atau DAB dari KEK ke KEK Lainnya, TPB, atau Kawasan Bebas. Ketentuan Pengeluaran Barang yang Pemasukkannya Menggunakan SKA Form D dan/atau DAB, dari KEK ke KEK Lainnya, TPB, atau Kawasan Bebas:",
DOC141,bn1050-2020.txt,BAB VIII,,Pasal 35,1,,"Untuk mendapatkan Tarif Preferensi, Badan Usaha/Pelaku Usaha KEK wajib: a. mencantumkan secara benar nomor dan tanggal pemberitahuan pabean pemasukan barang ke KEK dari luar Daerah Pabean yang telah mencantumkan nomor referensi dan tanggal SKA Form D dan/atau nomor Eksportir Bersertifikat dan tanggal DAB pada kolom K.1 “Pemenuhan Persyaratan/Fasilitas Impor” pada kolom K.3 “Referensi Dokumen Asal” pemberitahuan pabean pengeluaran barang dari KEK; b. mencantumkan secara benar nomor referensi dan tanggal SKA Form D dan/atau nomor Eksportir Bersertifikat dan tanggal DAB pada kolom K.1 “Pemenuhan Persyaratan/Fasilitas Impor”; c. menyerahkan pemberitahuan pabean pemasukan barang ke KEK dari luar Daerah Pabean yang telah diberi catatan pada SKP oleh Pejabat Bea dan Cukai di Kantor Pabean yang melakukan penelitian pemberitahuan pabean pemasukan barang ke KEK dari luar Daerah Pabean kepada Pejabat Bea dan Cukai di Kantor Pabean yang melakukan penelitian pemberitahuan pabean pengeluaran barang dari KEK pada tanggal yang sama dengan pengajuan pemberitahuan pabean pengeluaran barang dari KEK; d. dalam hal Badan Usaha/Pelaku Usaha KEK tidak menyerahkan pemberitahuan pabean pemasukan barang ke KEK dari luar Daerah Pabean yang telah diberi catatan pada SKP oleh Pejabat Bea dan Cukai di Kantor Pabean yang melakukan penelitian pemberitahuan pabean pemasukan barang ke KEK dari luar Daerah Pabean kepada Pejabat Bea dan Cukai di Kantor Pabean yang melakukan penelitian pemberitahuan pabean pengeluaran barang dari KEK sebagaimana dimaksud pada huruf c, Tarif Preferensi tidak diberikan. MENTERI KEUANGAN REPUBLIK INDONESIA, ttd SRI MULYANI INDRAWATI Tanggal Pengapalan atau Tanggal Eksportasi adalah tanggal bill of lading untuk moda pengangkutan laut, tanggal airway bill untuk moda pengangkutan udara, atau tanggal dokumen pengangkutan darat untuk moda pengangkutan darat. Permintaan Retroactive Check adalah permintaan yang dilakukan oleh pejabat bea dan cukai kepada Instansi Penerbit SKA dan/atau Otoritas yang Berwenang untuk mendapatkan informasi mengenai pemenuhan Ketentuan Asal Barang dan/atau keabsahan Bukti Asal Barang. Verification Visit adalah kegiatan yang dilakukan oleh pejabat bea dan cukai di negara penerbit Bukti Asal Barang untuk memperoleh data atau informasi mengenai pemenuhan Ketentuan Asal Barang dan/atau keabsahan Bukti Asal Barang. Direktur Jenderal adalah Direktur Jenderal Bea dan Cukai. Pejabat Bea dan Cukai adalah pegawai Direktorat Jenderal Bea dan Cukai yang ditunjuk dalam jabatan tertentu untuk melaksanakan tugas tertentu berdasarkan Undang-Undang Kepabeanan. TARIF PREFERENSI DAN KETENTUAN ASAL BARANG (RULES OF ORIGIN) Bagian Kesatu Tarif Preferensi Barang impor dapat dikenakan Tarif Preferensi yang besarnya dapat berbeda dari tarif bea masuk yang berlaku umum (Most Favoured Nation/MFN).",
