doc_id,nama_dokumen,bab,bagian,pasal,angka,ayat,isi,penjelasan
DOC141,bn1050-2020.txt,BAB VI,,Pasal 30,,2,"Direktur Jenderal yang menerima pelimpahan wewenang dari Menteri sebagaimana dimaksud pada ayat (1): a. wajib memperhatikan ketentuan perundang-undangan; b. bertanggung jawab secara substansi atas pelaksanaan pelimpahan wewenang yang diberikan kepada yang bersangkutan; dan c. tidak dapat melimpahkan kembali pelimpahan kewenangan yang diterima kepada pihak lainnya. Petunjuk teknis mengenai tata cara pengenaan tarif bea masuk atas barang impor berdasarkan Persetujuan Perdagangan Barang ASEAN, dapat ditetapkan oleh Direktur Jenderal. KETENTUAN PERALIHAN Pada saat Peraturan Menteri ini berlaku: a. Invoice Declaration yang diterbitkan sebelum berlakunya Peraturan Menteri ini, masih tetap berlaku dan tata cara pengenaan tarifnya dilaksanakan sesuai dengan tata cara sebagaimana tercantum dalam ASEAN Trade in Goods Agreement (Persetujuan Perdagangan Barang ASEAN); b. SKA Form D yang diterbitkan sampai dengan tanggal 20 Desember 2020 dengan menggunakan format sebagaimana tercantum dalam Lampiran huruf A angka VI Peraturan Menteri Keuangan ini, masih tetap berlaku dan tata cara pengenaan tarifnya dilaksanakan sesuai dengan tata cara sebagaimana tercantum dalam ASEAN Trade in Goods Agreement. KETENTUAN PENUTUP Ketentuan dalam Peraturan Menteri ini berlaku terhadap barang impor yang dokumen pemberitahuan pabeannya telah mendapat nomor dan tanggal pendaftaran dari Kantor Pabean tempat dipenuhinya kewajiban pabean terhitung sejak tanggal berlakunya Peraturan Menteri ini. Pada saat Peraturan Menteri ini mulai berlaku, ketentuan mengenai tata cara pengenaan tarif bea masuk atas barang impor berdasarkan skema ASEAN Trade in Goods Agreement sebagaimana diatur dalam Peraturan Menteri Keuangan Nomor 229/PMK.04/2017 tentang Tata Cara Pengenaan Tarif Bea Masuk berdasarkan Perjanjian atau Kesepakatan Internasional, dicabut dan dinyatakan tidak berlaku. Peraturan Menteri ini mulai berlaku pada tanggal 20 September 2020. Agar setiap orang mengetahuinya, memerintahkan pengundangan Peraturan Menteri ini dengan penempatannya dalam Berita Negara Republik Indonesia. MENTERI KEUANGAN REPUBLIK INDONESIA, ttd SRI MULYANI INDRAWATI Diundangkan di Jakarta pada tanggal 18 September 2020 DIREKTUR JENDERAL PERATURAN PERUNDANG-UNDANGAN KEMENTERIAN HUKUM DAN HAK ASASI MANUSIA REPUBLIK INDONESIA, ttd WIDODO EKATJAHJANA LAMPIRAN PERATURAN MENTERI KEUANGAN REPUBLIK INDONESIA NOMOR 131/PMK.04/2020 TENTANG TATA CARA PENGENAAN TARIF BEA MASUK ATAS BARANG IMPOR BERDASARKAN PERSETUJUAN PERDAGANGAN BARANG ASEAN A. KETENTUAN ASAL BARANG BERDASARKAN PERSETUJUAN PERDAGANGAN BARANG ASEAN I. KRITERIA ASAL BARANG Kriteria asal barang skema Persetujuan Perdagangan Barang ASEAN meliputi:",
DOC141,bn1050-2020.txt,BAB VIII,,Pasal 35,1,,"Barang yang seluruhnya diperoleh atau diproduksi di satu Negara Anggota (wholly obtained atau produced). Barang-barang yang dikategorikan sebagai wholly obtained atau produced adalah sebagai berikut: a. tanaman dan produk tanaman, termasuk buah-buahan, bunga, sayuran, pohon, rumput laut, jamur, dan tanaman hidup lain yang ditumbuhkan dan dipanen, dipetik atau diperoleh di satu Negara Anggota; b. binatang hidup, termasuk mamalia, burung/unggas, ikan, krustasea, moluska, reptil, bakteri, dan virus, lahir dan dibesarkan di satu Negara Anggota; c. produk yang diperoleh dari binatang hidup di satu Negara Anggota; d. hasil perburuan, perangkap, pemancingan, pertanian dan peternakan, budi daya air, pengumpulan atau penangkapan yang dilakukan di satu Negara Anggota; e. mineral dan produk alam lainnya, selain huruf a sampai huruf d, diekstraksi atau diambil dari tanah, perairan, dasar laut, atau di bawahnya; f. hasil penangkapan ikan di laut yang diambil oleh kapal yang terdaftar di Negara Anggota dan berbendera negara tersebut, dan produk lain yang diambil dari perairan, dasar laut atau di bawahnya di luar wilayah perairan teritorial Negara Anggota, sepanjang Negara Anggota memiliki hak untuk mengeksploitasi perairan, dasar laut dan di bawahnya tersebut sesuai dengan hukum internasional; g. hasil penangkapan ikan di laut dan produk laut lainnya dari laut lepas oleh kapal yang terdaftar di Negara Anggota dan berbendera Negara Anggota tersebut; h. produk yang diproses dan/atau dibuat di kapal pengolahan hasil laut (factory ship) yang terdaftar di Negara Anggota dan berbendera Negara Anggota, hanya dari produk sebagaimana dimaksud pada huruf g; i. barang yang dikumpulkan, tidak dapat lagi berfungsi sesuai fungsinya semula, tidak dapat dikembalikan kepada fungsi semula atau tidak dapat diperbaiki dan hanya cocok untuk dibuang atau digunakan sebagai bahan baku, atau untuk tujuan daur ulang; j. sisa dan scrap yang berasal dari: 1) proses produksi di satu Negara Anggota; atau 2) barang bekas yang dikumpulkan di satu Negara Anggota, sepanjang barang tersebut hanya cocok untuk diambil bahan mentahnya; dan k. barang yang diproduksi atau diperoleh di satu Negara Anggota pengekspor dari produk sebagaimana dimaksud dalam huruf a sampai huruf j. Barang yang tidak seluruhnya diperoleh atau diproduksi di satu Negara Anggota (not wholly obtained atau produced). Kriteria asal barang (origin criteria) not wholly obtained atau produced, meliputi: a. Regional Value Content (RVC) Regional Value Content (RVC) yang memenuhi kriteria asal barang berdasarkan Persetujuan Perdagangan Barang ASEAN merupakan kandungan nilai regional paling sedikit 40% dari Free-on-Board (FOB) barang yang dihasilkan, yang dihitung dengan menggunakan metode: 1) Metode Langsung (direct method) RVC = (Biaya Bahan + Biaya Tenaga Kerja + Biaya Overhead + Keuntungan) / Nilai FOB atau 2) Metode Tidak Langsung (indirect method) RVC = (Nilai FOB - Nilai Bahan, Bagian, atau Barang Non-Originating) / Nilai FOB Keterangan: 1) Biaya bahan baku ASEAN adalah nilai Cost, Insurance, and Freight (CIF) dari bahan, bagian, atau barang originating, atau yang diproduksi sendiri oleh produsen dalam proses produksi barang; 2) Nilai bahan, bagian, atau barang Non-Originating, adalah: a) nilai CIF dari nilai bahan, bagian, atau barang Non-Originating pada saat importasi; atau b) harga pasti yang pertama dibayarkan (the earliest ascertained price paid) untuk semua bahan yang tidak dapat ditentukan keasalannya di wilayah Negara Anggota di mana pengerjaan atau proses berlangsung. 3) Biaya tenaga kerja langsung meliputi upah, remunerasi, dan tunjangan-tunjangan tenaga kerja lainnya yang terkait dengan proses produksi; 4) Perhitungan biaya overhead langsung harus meliputi, namun tidak terbatas pada aset tidak bergerak (real property item) yang terkait dengan proses produksi; 5) Nilai FOB merupakan nilai Free-on-Board barang, yang dihitung dengan menjumlahkan harga bahan baku, biaya produksi, keuntungan, dan biaya lainnya; 6) Bahan Originating merupakan bahan yang memenuhi Ketentuan Asal Barang sesuai dengan Persetujuan Perdagangan Barang ASEAN; dan 7) Barang Non-Originating merupakan barang yang berasal dari luar Negara Anggota atau barang yang tidak memenuhi Ketentuan Asal Barang sesuai Persetujuan Perdagangan Barang ASEAN. Change in Tariff Heading (CTH) Barang yang proses produksinya menggunakan Bahan Non-Originating dan seluruh Bahan Non-Originating tersebut mengalami perubahan klasifikasi pada 4 digit pertama HS (pos); Product Specific Rules (PSR) 1) Barang yang termasuk dalam daftar PSR sebagaimana diatur dalam Annex 3 Persetujuan Perdagangan Barang ASEAN, yang terdiri dari: a) tunggal, yaitu subpos tarif hanya memiliki 1 (satu) kriteria asal barang; b) alternatif, yaitu subpos tarif yang memiliki lebih dari 1 (satu) kriteria asal barang yang harus dipilih salah satu; c) alternatif dan kombinasi, yaitu subpos tarif yang memiliki lebih dari satu kriteria asal barang, yang merupakan gabungan dari alternatif dan kombinasi. Demikianlah dokumen ini disusun untuk memberikan kejelasan dan kepastian hukum dalam pengenaan tarif bea masuk atas barang impor berdasarkan ketentuan yang berlaku. Dengan Rahmat Tuhan Yang Maha Esa",
DOC141,bn1050-2020.txt,BAB VIII,,Pasal 35,1,,"Bahwa untuk meningkatkan efektivitas dan efisiensi dalam pelaksanaan ketentuan asal barang dalam perdagangan internasional, perlu diatur ketentuan mengenai akumulasi dan akumulasi parsial dalam peraturan ini.",
DOC141,bn1050-2020.txt,BAB VIII,,Pasal 35,2,,Bahwa ketentuan mengenai pengisian Pemberitahuan Impor Barang (PIB) perlu disesuaikan dengan perkembangan terkini dalam perdagangan barang. a. Undang-Undang Nomor 17 Tahun 2006 tentang Perdagangan. b. Peraturan Menteri Keuangan Nomor 203/PMK.04/2019 tentang Ketentuan Umum dan Tata Cara Kepabeanan. c. Peraturan Menteri Perdagangan Nomor 50 Tahun 2020 tentang Ketentuan Asal Barang. Menetapkan Peraturan Menteri Perdagangan tentang Ketentuan Asal Barang dalam Perdagangan Internasional. I. KETENTUAN UMUM,
DOC141,bn1050-2020.txt,BAB VIII,,Pasal 35,1,,"Akumulasi Barang yang berasal dari Negara Anggota yang digunakan sebagai bahan baku untuk suatu barang jadi di Negara Anggota lain yang memenuhi Ketentuan Asal Barang untuk memperoleh Tarif Preferensi, harus dianggap sebagai barang yang berasal dari negara tempat di mana proses produksi barang jadi dilakukan.",
DOC141,bn1050-2020.txt,BAB VIII,,Pasal 35,2,,"Akumulasi Parsial a. Dalam hal nilai RVC bahan baku kurang dari 40%, nilai yang dapat diakumulasikan dalam perhitungan RVC ASEAN adalah nilai kandungan regional Negara Anggota pengekspor yang besarnya tidak kurang dari 20%. b. Dalam hal barang impor memenuhi akumulasi parsial, barang impor tidak mendapatkan Tarif Preferensi. II. KETENTUAN PROSEDURAL",
DOC141,bn1050-2020.txt,BAB VIII,,Pasal 35,1,,"Tata cara pencantuman pada e-Form D, untuk penggunaan: a. Akumulasi, yaitu dicantumkan kode “ACL” pada kolom “category code”; b. Akumulasi Parsial, yaitu dicantumkan kode “PCL” pada kolom “category code”; c. Issued Retroactively, yaitu dicantumkan kode “IRA” pada kolom “category code”; d. Back-to-Back, yaitu: 1) nilai FOB barang di Negara Anggota pengekspor kedua dicantumkan pada kolom “Value (FOB)” untuk kriteria asal barang RVC; 2) kode “BCO” dicantumkan pada kolom “category code”; e. Third Country Invoice, yaitu: 1) nama perusahaan dan negara yang menerbitkan invoice pihak ketiga dicantumkan pada kolom “Invoice Party” dan “Invoice Country”; 2) nomor invoice pihak ketiga atau nomor invoice asal barang dicantumkan pada kolom 10 e-Form D; dan 3) kode “TCI” dicantumkan pada kolom “category code”, untuk invoice pihak ketiga yang diterbitkan di negara yang berbeda dengan negara tempat diterbitkannya e-Form D.",
DOC141,bn1050-2020.txt,BAB VIII,,Pasal 35,2,,"List of Data Requirements, meliputi: a. rincian eksportir bersertifikat, meliputi nomor Eksportir Bersertifikat; b. uraian lengkap barang, meliputi: 1) detail barang, termasuk Kode HS (level 6 digit) atau kode AHTN, jumlah barang, dan jika ada, nama merk; 2) kriteria asal barang yang relevan; 3) negara asal barang; 4) nilai FOB ketika kriteria RVC digunakan; dan 5) untuk DAB Back-to-Back, meliputi nomor referensi dan tanggal SKA Form D dan/atau DAB yang diterbitkan oleh Negara Anggota pengekspor pertama, dan jika ada, nomor Eksportir Bersertifikat dari Negara Anggota pengekspor pertama. c. penandasahan oleh Eksportir Bersertifikat, meliputi: 1) sertifikasi yang menyatakan bahwa berdasarkan bukti yang diserahkan, barang yang tercantum dalam DAB telah memenuhi seluruh ketentuan yang terdapat dalam Pasal 3 ayat (1) Peraturan Menteri ini; dan 2) tanda tangan Eksportir Bersertifikat. III. KETENTUAN PENGISIAN PEMBERITAHUAN PABEAN IMPOR",
DOC141,bn1050-2020.txt,BAB VIII,,Pasal 35,1,,"Pengisian Pemberitahuan Impor Barang (BC 2.0) Untuk tujuan pengenaan Tarif Preferensi, pada Pemberitahuan Impor Barang (PIB) diisikan kode fasilitas, nomor referensi, dan tanggal SKA Form D, sebagai berikut: a. dalam hal dokumen PIB hanya menggunakan skema Persetujuan Perdagangan Barang ASEAN, kode 06, nomor referensi dan tanggal SKA Form D dan/atau nomor Eksportir Bersertifikat dan tanggal DAB, wajib dicantumkan secara benar pada Kolom 19 dan/atau Kolom 33 dokumen PIB; b. dalam hal dokumen PIB menggunakan skema Persetujuan Perdagangan Barang ASEAN dan fasilitas lainnya: 1) kode fasilitas 06 wajib dicantumkan secara benar pada Kolom 19 dokumen PIB, serta diisi “Nomor referensi dan tanggal SKA Form D dan/atau nomor Eksportir Bersertifikat dan tanggal DAB, lihat lembar lanjutan”; 2) kode fasilitas 06 wajib dicantumkan secara benar pada kolom 33 PIB, sedangkan nomor referensi dan tanggal SKA Form D dan/atau nomor Eksportir Bersertifikat dan tanggal DAB, wajib dicantumkan secara benar pada Lembar Lanjutan Dokumen dan Pemenuhan Persyaratan/Fasilitas Impor dokumen PIB. Pengisian pada dokumen Pemberitahuan Impor Barang untuk ditimbun di TPB dan dokumen Pemberitahuan Impor Barang dari TPB diatur tersendiri dalam Lampiran huruf B Angka I yang merupakan bagian tidak terpisahkan dari Peraturan Menteri ini.",
DOC141,bn1050-2020.txt,BAB VIII,,Pasal 35,3,,Pengisian pada dokumen Pemberitahuan Pabean Penimbunan Barang Impor di PLB dan dokumen Pemberitahuan Impor Barang dari PLB diatur tersendiri dalam Lampiran huruf B Angka II yang merupakan bagian tidak terpisahkan dari Peraturan Menteri ini.,
DOC141,bn1050-2020.txt,BAB VIII,,Pasal 35,4,,Pengisian pada dokumen PPFTZ-O1 diatur tersendiri dalam Lampiran huruf B Angka III yang merupakan bagian tidak terpisahkan dari Peraturan Menteri ini.,
DOC141,bn1050-2020.txt,BAB VIII,,Pasal 35,5,,Pengisian pada pemberitahuan pabean pemasukan barang ke KEK dari luar Daerah Pabean dan pemberitahuan pabean pengeluaran barang dari KEK diatur tersendiri dalam Lampiran huruf B Angka IV yang merupakan bagian tidak terpisahkan dari Peraturan Menteri ini. IV. KETENTUAN LAIN TERKAIT KETENTUAN ASAL BARANG,
DOC141,bn1050-2020.txt,BAB VIII,,Pasal 35,1,,"Proses dan pengerjaan minimal (Minimal Operations and Processes) a. Pengerjaan yang dilakukan dianggap sebagai proses minimal dan tidak dapat diperhitungkan dalam menentukan apakah suatu Barang Originating Negara Anggota apabila proses minimal tersebut bertujuan untuk: 1) memastikan barang berada dalam kondisi baik untuk keperluan penyimpanan atau pengangkutan; 2) memfasilitasi pengiriman atau pengangkutan; dan 3) keperluan pengemasan atau penyajian barang untuk dijual. b. Suatu Barang Originating dari Negara Anggota yang diekspor ke Negara Anggota lain, tetap dianggap sebagai originating Negara Anggota pertama apabila pengerjaan yang dilakukan tidak melebihi pengerjaan sebagaimana dimaksud pada huruf a.",
DOC141,bn1050-2020.txt,BAB VIII,,Pasal 35,2,,"De Minimis a. untuk barang jadi yang menggunakan kriteria asal barang CTC, Bahan Non-Originating yang nilainya tidak melebihi 10% nilai FOB barang jadinya, tidak wajib mengalami perubahan klasifikasi barang. b. untuk barang jadi yang menggunakan kriteria asal barang RVC, nilai Bahan Non-Originating sebagaimana dimaksud pada huruf a harus tetap diperhitungkan. c. Dalam hal barang impor memenuhi De Minimis, tanda (¥) atau (X) harus dicantumkan pada kotak “De Minimis” di kolom 13 SKA Form D atau pada kotak “DMS = De Minimis” e-Form D.",
DOC141,bn1050-2020.txt,BAB VIII,,Pasal 35,3,,"Perlakuan terhadap pengemas a. Pengemas untuk penjualan eceran: 1) untuk barang yang menggunakan kriteria asal barang RVC, nilai pengemas untuk penjualan eceran harus ikut dihitung sebagai komponen barang dalam RVC apabila pengemas tersebut dianggap membentuk keseluruhan barang; 2) dalam hal ketentuan huruf a tidak dapat diterapkan, pengemas untuk penjualan eceran, apabila diklasifikasikan dalam satu pos tarif dengan barangnya, tidak diperhitungkan dalam menentukan asal barang sepanjang kriteria asal barang yang digunakan adalah CTC. b. Kontainer dan pengemas yang khusus digunakan untuk tujuan pengangkutan tidak diperhitungkan untuk penentuan keasalan barang.",
DOC141,bn1050-2020.txt,BAB VIII,,Pasal 35,4,,"Aksesoris, Spare Part dan Peralatan a. untuk barang yang menggunakan kriteria asal barang CTC atau proses khusus, keasalan dari spare part, aksesoris, peralatan, dan petunjuk/manual atau informasi lainnya yang disertakan dengan barang tersebut tidak diperhitungkan dalam menentukan originating suatu barang apabila: 1) aksesoris, spare part, peralatan dan petunjuk/manual atau informasi lainnya tersebut tidak dalam invoice yang terpisah dengan barangnya; dan 2) jumlah dan nilai aksesoris, spare part, peralatan, dan instruksional atau manual informasi lainnya tersebut wajar. b. untuk barang yang menggunakan kriteria asal barang RVC, nilai dari aksesoris, spare part, peralatan, dan instruksi atau petunjuk/manual atau informasi lainnya harus diperhitungkan sesuai dengan kriteria asal barang masing-masing.",
DOC141,bn1050-2020.txt,BAB VIII,,Pasal 35,5,,"Elemen Netral Dalam menentukan apakah suatu barang merupakan Barang Originating, barang-barang di bawah ini tidak perlu ditentukan keasalan barangnya, sepanjang digunakan dalam proses produksi dan tidak tergabung dengan barang, yaitu: a. bahan bakar dan energi; b. tools, dies, dan moulds; c. spare part dan bahan yang digunakan untuk pemeliharaan peralatan dan gedung; d. pelumas, gemuk, bahan kompon dan bahan lain yang digunakan dalam proses produksi atau digunakan untuk mengoperasikan peralatan dan gedung; e. sarung tangan, kaca mata, alas kaki, pakaian, serta perlengkapan dan peralatan keamanan; f. perlengkapan, perangkat dan peralatan yang digunakan untuk menguji atau memeriksa barang; g. katalisator dan pelarut; dan h. barang lain yang tidak tergabung dengan barang yang diproduksi namun penggunaannya dapat ditunjukkan secara wajar sebagai bagian dari produksi barang tersebut.",
DOC141,bn1050-2020.txt,BAB VIII,,Pasal 35,6,,"Bahan Baku Identik dan Dapat Dipertukarkan a. Dalam hal Bahan Originating dan Bahan Non-Originating yang identik dan dapat dipertukarkan digunakan dalam proses produksi suatu barang, metode yang dapat digunakan untuk menentukan keasalan barang meliputi: 1) Pemisahan fisik Bahan Originating dan Bahan Non-Originating yang identik dan dapat dipertukarkan; 2) penggunaan prinsip akuntansi yang berlaku secara umum atas pengawasan persediaan yang diterapkan; atau 3) penggunaan metode manajemen persediaan di Negara Anggota pengekspor. b. Dalam hal metode manajemen persediaan sebagaimana dimaksud dalam huruf a angka 3) digunakan, maka metode tersebut wajib digunakan sepanjang tahun fiskal. KETENTUAN LAIN-LAIN Dalam hal Instansi Penerbit SKA menetapkan website untuk melakukan pengecekan validitas SKA Form D, informasi atas website tersebut diberitahukan dengan menggunakan mekanisme sebagaimana dimaksud dalam Pasal 31 Peraturan Menteri ini. VI. BENTUK DAN FORMAT LEMBAR ASLI SKA FORM D, SESUAI DENGAN ASEAN TRADE IN GOODS AGREEMENT (PERSETUJUAN PERDAGANGAN BARANG ASEAN) Original (Duplicate/Triplicate)",
DOC141,bn1050-2020.txt,BAB VIII,,Pasal 35,12,,"Certification This is hereby certified, on the basis of control carried out, that the declaration by the exporter is correct. 1 Member States which accept this form for the purpose of preferential treatment under the ASEAN Trade in Goods Agreement (ATIGA) or the ASEAN Industrial Cooperation (AICO) Scheme: - INDONESIA - MYANMAR - THAILAND - CAMBODIA - MALAYSIA - SINGAPORE CONDITIONS: The main conditions for admission to the preferential treatment under the ATIGA or the AICO Scheme are that goods sent to any Member States listed above must: - fall within a description of products eligible for concessions in the country of destination; - comply with the origin criteria set out in Chapter 3 of the ATIGA. ORIGIN CRITERIA: For goods that meet the origin criteria, the exporter and/or producer must indicate in Box 6 of this Form the origin criteria met, in the manner shown in the following table. Circumstances of production or manufacture in the first country named in Box 14 of this form: - Goods wholly obtained or produced in the exporting Member State satisfying Article 27 (Wholly Obtained) of the ATIGA. - Goods satisfying Article 22 (Non-wholly obtained) of the ATIGA. - Regional Value Content. - Change in Tariff Classification. - Specific Processes: Combination Criteria. - Paragraph 2 of Article 30 (Partial Cumulation). Percentage of Regional Value Content, example “40%”. The actual CTC rate, example “CC” or “CTH” or “CTSH”. The actual cumulation criterion, example “CTSH + 35%”. “PC x%”, where x would be the percentage of Regional Value Content of less than 40%, example “PC 25%”. EACH ARTICLE MUST QUALIFY & should be noted that all the goods in a consignment must qualify separately in their own right. This is of particular relevance when similar articles of different sizes or spare parts are sent. DESCRIPTION OF PRODUCTS: The description of products must be sufficiently detailed to enable the products to be identified by the Customs Officers examining them. Name of manufacturer and any trade mark should also be specified. HARMONISED SYSTEM NUMBER: The Harmonised System number shall be that of the ASEAN Harmonised Tariff Nomenclature (AHTN) Code of the importing Member State. EXPORTER: The term “Exporter” in Box 11 may include the manufacturer or the producer. FOR OFFICIAL USE: The Customs Authority of the importing Member State must indicate (v) in the relevant boxes in column 4 whether or not preferential treatment is accorded. MULTIPLE ITEMS: For multiple items declared in the same Form D, each item must also be indicated accordingly in Box 4 and the item number circled or marked appropriately. THIRD COUNTRY INVOICING: In cases where invoices are issued by a third country, the “Third Country invoicing” box should be ticked (v) and the name and address of the company issuing the invoice must be indicated in Box 2. BACK-TO-BACK CERTIFICATE OF ORIGIN: In cases of Back-to-Back CO, in accordance with Rule 11 (Back-to-back CO) of Annex 8 of the ATIGA, the “Back-to-Back CO” box should be ticked (v). EXHIBITIONS: In cases where goods are sent from the exporting Member State for exhibition in another country and sold during or after the exhibition for importation into a Member State, in accordance with Rule 22 of Annex 8 of the ATIGA, the “Exhibitions” box should be ticked (v) and the name and address of the exhibition indicated in Box 2. ISSUED RETROACTIVELY: In exceptional cases, due to involuntary errors or omissions or other valid causes, the Certificate of Origin (Form D) may be issued retroactively, in accordance with paragraph 2 of Rule 10 of Annex 8 of the ATIGA, the “Issued Retroactively” box should be ticked (v). ACCUMULATION: In cases where goods originating in a Member State are used in another Member State as materials for finished goods in accordance with paragraph 1 of Article 30 of the ATIGA, the “Accumulation” box should be ticked (v). PARTIAL CUMULATION: If the Regional Value Content of the material is less than forty percent (40%), the Certificate of Origin (Form D) may be issued for cumulation purposes, in accordance with paragraph 2 of Article 30 of the ATIGA, the “Partial Cumulation” box should be ticked (v). DE MINIMIS: If a good that does not undergo the required change in tariff classification does not exceed ten percent (10%) of the FOB value, in accordance with Article 3 of the ATIGA, the “De Minimis” box should be ticked (v). Dengan Rahmat Tuhan Yang Maha Esa",
DOC141,bn1050-2020.txt,BAB VIII,,Pasal 35,1,,"Bahwa untuk melaksanakan ketentuan dalam Undang-Undang Kepabeanan, perlu menetapkan ketentuan mengenai prosedur pengenaan tarif preferensi untuk barang yang diimpor.",
DOC141,bn1050-2020.txt,BAB VIII,,Pasal 35,2,,"Bahwa berdasarkan ketentuan tersebut, perlu diatur lebih lanjut mengenai tata cara pengisian dokumen dan pelaksanaan di lapangan. a. Undang-Undang Nomor 17 Tahun 2006 tentang Kepabeanan; b. Peraturan Menteri Keuangan Nomor 203/PMK.04/2019 tentang Pemberian Fasilitas Pabean; c. Persetujuan Perdagangan Barang ASEAN; d. Peraturan-peraturan lainnya yang terkait. Menetapkan: Ketentuan Prosedural Terkait Tata Cara Pengenaan Tarif Preferensi untuk TPB, PLB, Kawasan Bebas, dan KEK. I. Ketentuan Prosedural Terkait Tata Cara Pengenaan Tarif Preferensi untuk TPB",
