doc_id,nama_dokumen,bab,bagian,pasal,angka,ayat,isi,penjelasan
DOC177,bn1149-2022.txt,BAB I,,Pasal 26,2,,"Tidak dipungut Pajak Penghasilan Pasal 22 yang dikecualikan pada saat impornya. Dalam hal tidak terdapat pembatalan sebagaimana dimaksud dalam Pasal 24 ayat (1), penerima fasilitas atau orang yang menguasai Kendaraan Bermotor dapat mengajukan permohonan penerbitan Surat Penetapan Pembayaran Bea Masuk, Cukai, dan/atau Pajak (SPPBMCP). Dalam hal Keputusan Menteri mengenai pembebasan bea masuk atas pemindahtanganan Kendaraan Bermotor untuk keperluan Badan Internasional beserta Pejabatnya yang bertugas di Indonesia sebagaimana dimaksud dalam Pasal 23 ayat (2) telah diterbitkan, penerima pemindahtanganan Kendaraan Bermotor mengajukan permohonan penerbitan surat keterangan pengimporan Kendaraan Bermotor berupa Formulir B kepada Kepala Kantor Pelayanan Utama Bea dan Cukai atau Kepala Kantor Pengawasan dan Pelayanan Bea dan Cukai tempat pemasukan. Bagian Kesatu Permohonan Pemusnahan Untuk mendapatkan izin pemusnahan sebagaimana dimaksud dalam Pasal 15 ayat (1) huruf c, Badan Internasional mengajukan permohonan kepada Menteri melalui Kepala Kantor Wilayah Direktorat Jenderal Bea dan Cukai atau Kepala Kantor Pelayanan Utama Bea dan Cukai tempat pemasukan, setelah mendapatkan persetujuan terlebih dahulu dari: a. Menteri yang menyelenggarakan urusan pemerintahan di bidang kesekretariatan negara, dalam hal pemusnahan Kendaraan Bermotor; b. Menteri/kepala lembaga terkait selaku ketua panitia nasional kegiatan atau pejabat yang ditunjuk, dalam hal pemusnahan Kendaraan Bermotor. Kepala Kantor Wilayah Direktorat Jenderal Bea dan Cukai atau Kepala Kantor Pelayanan Utama Bea dan Cukai melakukan penelitian terhadap pemenuhan persyaratan atas permohonan sebagaimana dimaksud dalam Pasal 29 ayat (1). Berdasarkan persetujuan mengenai izin pemusnahan sebagaimana dimaksud dalam Pasal 30 ayat (2), Pejabat Bea dan Cukai yang ditunjuk melakukan pemeriksaan fisik terhadap barang yang akan dimusnahkan dan membuat laporan hasil pemeriksaan fisik. Bagian Kedua Penyelesaian Pemusnahan Direktur yang melaksanakan tugas dan fungsi di bidang fasilitas kepabeanan, Kepala Kantor Wilayah Direktorat Jenderal Bea dan Cukai, Kepala Kantor Pelayanan Utama Bea dan Cukai, atau Kepala Kantor Pengawasan dan Pelayanan Bea dan Cukai, melakukan monitoring dan evaluasi terhadap pemberian pembebasan bea masuk atas impor barang untuk keperluan Badan Internasional beserta Pejabatnya yang bertugas di Indonesia. Badan Internasional harus menyampaikan laporan realisasi impor, ekspor kembali, pemindahtanganan, dan pemusnahan kepada kementerian yang menyelenggarakan urusan pemerintahan di bidang kesekretariatan negara atau kementerian/lembaga terkait selaku ketua panitia nasional kegiatan atau pejabat yang ditunjuk.",
DOC177,bn1149-2022.txt,BAB I,,Pasal 34,,1,"Kepala Kantor Wilayah Direktorat Jenderal Bea dan Cukai, Kepala Kantor Pelayanan Utama Bea dan Cukai, atau Kepala Kantor Pengawasan dan Pelayanan Bea dan Cukai yang menerima pelimpahan wewenang dari Menteri sebagaimana dimaksud dalam Pasal 9, Pasal 17, Pasal 21, Pasal 23, dan Pasal 30: a. Wajib memperhatikan ketentuan peraturan perundang-undangan; dan b. Tidak dapat melimpahkan kembali pelimpahan kewenangan yang diterima kepada pejabat lain.",
DOC177,bn1149-2022.txt,BAB I,,Pasal 34,,2,"Dalam hal Kepala Kantor Wilayah Direktorat Jenderal Bea dan Cukai, Kepala Kantor Pelayanan Utama Bea dan Cukai, atau Kepala Kantor Pengawasan dan Pelayanan Bea dan Cukai sebagaimana dimaksud pada ayat (1) berhalangan sementara atau tetap, wewenang yang diterima dapat dilakukan oleh pejabat pelaksana harian (Plh) atau pejabat pelaksana tugas (Plt) yang ditunjuk. Ketentuan mengenai petunjuk teknis pemberian pembebasan bea masuk atas impor barang untuk keperluan Badan Internasional beserta Pejabat. Dengan Rahmat Tuhan Yang Maha Esa",
DOC177,bn1149-2022.txt,BAB I,,Pasal 35,1,,"Bahwa untuk melaksanakan ketentuan Pasal 2 ayat (1) dan Pasal 3 Peraturan Menteri ini, perlu menetapkan Peraturan Menteri Keuangan tentang Pembebasan Bea Masuk atas Impor Barang untuk Keperluan Badan Internasional Beserta Pejabatnya yang Bertugas di Indonesia.",
DOC177,bn1149-2022.txt,BAB I,,Pasal 35,2,,"Bahwa berdasarkan pertimbangan sebagaimana dimaksud dalam huruf a, perlu menetapkan Keputusan Menteri Keuangan tentang Pembebasan Bea Masuk atas Impor Barang untuk Keperluan Badan Internasional Beserta Pejabatnya yang Bertugas di Indonesia. c. Peraturan Menteri Keuangan Nomor 148/PMK.04/2015 tentang Pembebasan Bea Masuk atas Impor Barang untuk Keperluan Badan Internasional Beserta Pejabatnya yang Bertugas di Indonesia (Berita Negara Republik Indonesia Tahun 2015 Nomor 1141); d. Peraturan Menteri Keuangan Nomor 20/PMK.04/2018 tentang Perubahan atas Peraturan Menteri Keuangan Nomor 148/PMK.04/2015 tentang Pembebasan Bea Masuk atas Impor Barang untuk Keperluan Badan Internasional Beserta Pejabatnya yang Bertugas di Indonesia (Berita Negara Republik Indonesia Tahun 2018 Nomor 320). Menetapkan: Peraturan Menteri Keuangan tentang Pembebasan Bea Masuk atas Impor Barang untuk Keperluan Badan Internasional Beserta Pejabatnya yang Bertugas di Indonesia. KETENTUAN UMUM Dalam Peraturan ini yang dimaksud dengan:",
DOC177,bn1149-2022.txt,BAB I,,Pasal 1,1,,Badan Internasional adalah organisasi internasional yang dibentuk berdasarkan perjanjian internasional yang telah diratifikasi oleh Indonesia.,
DOC177,bn1149-2022.txt,BAB I,,Pasal 1,2,,Pejabat adalah orang yang ditunjuk untuk mewakili Badan Internasional dalam menjalankan tugasnya di Indonesia.,
DOC177,bn1149-2022.txt,BAB I,,Pasal 1,3,,"Kendaraan Bermotor adalah alat transportasi yang digerakkan oleh mesin, tidak termasuk kendaraan yang berjalan di atas rel, di laut, maupun di udara.",
DOC177,bn1149-2022.txt,BAB I,,Pasal 1,4,,Barang Pindahan adalah barang yang dibawa oleh Pejabat yang pindah ke Indonesia untuk menunjang tugasnya.,
DOC177,bn1149-2022.txt,BAB I,,Pasal 1,5,,Menteri adalah menteri yang menyelenggarakan urusan pemerintahan di bidang keuangan.,
DOC177,bn1149-2022.txt,BAB I,,Pasal 1,6,,Pejabat Bea dan Cukai adalah pegawai Direktorat Jenderal Bea dan Cukai yang ditunjuk untuk melaksanakan tugas tertentu berdasarkan Undang-Undang Kepabeanan.,
DOC177,bn1149-2022.txt,BAB I,,Pasal 1,7,,Orang adalah orang perseorangan atau badan hukum. PEMBEBASAN BEA MASUK,
DOC177,bn1149-2022.txt,BAB II,,Pasal 2,,1,Impor barang untuk keperluan Badan Internasional beserta Pejabatnya yang bertugas di Indonesia dapat diberikan pembebasan bea masuk.,
DOC177,bn1149-2022.txt,BAB II,,Pasal 2,,2,"Badan Internasional yang dapat diberikan pembebasan bea masuk sebagaimana dimaksud pada ayat (1) adalah Badan Internasional yang tidak menjalankan usaha atau kegiatan lain untuk memperoleh penghasilan di Indonesia. Dalam hal terdapat perjanjian internasional yang telah diratifikasi sesuai dengan ketentuan peraturan perundang-undangan mengenai perjanjian internasional, yang di dalamnya terdapat ketentuan yang mengatur mengenai pemberian pembebasan bea masuk, perlakuan kepabeanan atas impor barang untuk keperluan Badan Internasional beserta Pejabatnya mendasarkan pada ketentuan dalam perjanjian tersebut sampai dengan berakhirnya perjanjian. KETENTUAN PERALIHAN Pada saat Peraturan Menteri ini mulai berlaku:",
DOC177,bn1149-2022.txt,BAB XII,,Pasal 36,1,,"Permohonan pembebasan bea masuk atas impor barang untuk keperluan Badan Internasional beserta Pejabatnya yang bertugas di Indonesia yang telah diajukan sebelum berlakunya Peraturan Menteri ini dan belum mendapat keputusan, pemrosesan permohonan pembebasan bea masuk dilaksanakan berdasarkan Peraturan Menteri Keuangan Nomor 148/PMK.04/2015 tentang Pembebasan Bea Masuk atas Impor Barang untuk Keperluan Badan Internasional Beserta Pejabatnya yang Bertugas di Indonesia (Berita Negara Republik Indonesia Tahun 2015 Nomor 1141) sebagaimana telah diubah dengan Peraturan Menteri Keuangan Nomor 20/PMK.04/2018 tentang Perubahan atas Peraturan Menteri Keuangan Nomor 148/PMK.04/2015.",
DOC177,bn1149-2022.txt,BAB XII,,Pasal 36,2,,"Keputusan Menteri mengenai pemberian pembebasan bea masuk atas impor barang untuk keperluan Badan Internasional beserta Pejabatnya yang bertugas di Indonesia yang telah diterbitkan berdasarkan Peraturan Menteri Keuangan Nomor 148/PMK.04/2015 dinyatakan masih tetap berlaku sampai dengan berakhirnya masa berlaku Keputusan Menteri dimaksud. KETENTUAN PENUTUP Peraturan Menteri Keuangan Nomor 148/PMK.04/2015 tentang Pembebasan Bea Masuk atas Impor Barang untuk Keperluan Badan Internasional Beserta Pejabatnya yang Bertugas di Indonesia dicabut dan dinyatakan tidak berlaku. Peraturan Menteri ini mulai berlaku setelah 60 (enam puluh) hari terhitung sejak tanggal diundangkan. Agar setiap orang mengetahuinya, memerintahkan pengundangan Peraturan Menteri ini dengan penempatannya dalam Berita Negara Republik Indonesia. MENTERI KEUANGAN REPUBLIK INDONESIA, ttd SRI MULYANI INDRAWATI Diundangkan di Jakarta pada tanggal 14 November 2022 MENTERI HUKUM DAN HAK ASASI MANUSIA REPUBLIK INDONESIA, ttd YASONNA H. LAOLY LAMPIRAN PERATURAN MENTERI KEUANGAN REPUBLIK INDONESIA NOMOR 160/PMK.04/2022 TENTANG PEMBEBASAN BEA MASUK ATAS IMPOR BARANG UNTUK KEPERLUAN BADAN INTERNASIONAL BESERTA PEJABATNYA YANG BERTUGAS DI INDONESIA A. CONTOH FORMAT KEPUTUSAN MENTERI KEUANGAN MENGENAI PEMBEBASAN BEA MASUK ATAS IMPOR BARANG UNTUK KEPERLUAN BADAN INTERNASIONAL BESERTA PEJABATNYA YANG BERTUGAS DI INDONESIA KEMENTERIAN KEUANGAN REPUBLIK INDONESIA KEPUTUSAN MENTERI KEUANGAN REPUBLIK INDONESIA TENTANG MENTERI KEUANGAN REPUBLIK INDONESIA, a. Bahwa permohonan pembebasan bea masuk atas impor barang untuk keperluan Badan Internasional beserta Pejabatnya yang bertugas di Indonesia telah memenuhi syarat untuk dapat diberikan persetujuan; b. Bahwa berdasarkan pertimbangan sebagaimana dimaksud dalam huruf a, perlu menetapkan Keputusan Menteri Keuangan tentang Pembebasan Bea Masuk atas Impor Barang untuk Keperluan Badan Internasional Beserta Pejabatnya yang Bertugas di Indonesia.",
DOC177,bn1149-2022.txt,BAB XIV,,Pasal 38,1,,Undang-Undang Nomor 10 Tahun 1995 tentang Kepabeanan;,
DOC177,bn1149-2022.txt,BAB XIV,,Pasal 38,2,,Peraturan Pemerintah Nomor 20 Tahun 1997 tentang Penerimaan Negara Bukan Pajak;,
DOC177,bn1149-2022.txt,BAB XIV,,Pasal 38,3,,Peraturan Menteri Keuangan Nomor 148/PMK.04/2015 tentang Pembebasan Bea Masuk atas Impor Barang untuk Keperluan Badan Internasional;,
DOC177,bn1149-2022.txt,BAB XIV,,Pasal 38,4,,"Peraturan Menteri Keuangan Nomor 20/PMK.04/2018 tentang Perubahan atas Peraturan Menteri Keuangan Nomor 148/PMK.04/2015. Menetapkan: KEPUTUSAN MENTERI KEUANGAN TENTANG PEMBEBASAN BEA MASUK ATAS IMPOR BARANG UNTUK KEPERLUAN BADAN INTERNASIONAL BESERTA PEJABATNYA YANG BERTUGAS DI INDONESIA. KEDUA: Pelaksanaan pengimporan barang harus memenuhi ketentuan umum di bidang impor. KETIGA: Pembebasan bea masuk diberikan dengan ketentuan sebagai berikut: a. Barang impor akan digunakan untuk keperluan Badan Internasional dan tidak untuk diperjualbelikan; b. Perubahan tujuan penggunaan atau pemindahtanganan barang tidak dapat dilakukan sebelum mendapat izin dari Direktorat Jenderal Bea dan Cukai; c. Apabila syarat tersebut tidak dipenuhi, pemberian pembebasan bea masuk dicabut dan dinyatakan tidak berlaku. KEEMPAT: Menunjuk pelabuhan/bandar udara tempat pemasukan dan Kantor tempat penyelesaian kewajiban pabean atas barang impor. Keenam: Dalam hal barang impor dilakukan pemindahtanganan, berlaku ketentuan sebagaimana diatur dalam Peraturan Menteri Keuangan mengenai pembebasan bea masuk atas impor barang untuk keperluan Badan Internasional. PETUNJUK PENGISIAN",
DOC177,bn1149-2022.txt,BAB XIV,,Pasal 38,1,,Diisi nomor Keputusan Menteri mengenai pembebasan bea masuk.,
DOC177,bn1149-2022.txt,BAB XIV,,Pasal 38,2,,Diisi nama penerima fasilitas.,
DOC177,bn1149-2022.txt,BAB XIV,,Pasal 38,3,,Diisi jabatan Pejabat yang mengajukan permohonan.,
DOC177,bn1149-2022.txt,BAB XIV,,Pasal 38,4,,Diisi nama Badan Internasional.,
DOC177,bn1149-2022.txt,BAB XIV,,Pasal 38,5,,Diisi menteri yang menyelenggarakan urusan pemerintahan di bidang kesekretariatan negara.,
DOC177,bn1149-2022.txt,BAB XIV,,Pasal 38,6,,Diisi nomor dan tanggal persetujuan dari menteri.,
DOC177,bn1149-2022.txt,BAB XIV,,Pasal 38,7,,Diisi nomor dan judul Peraturan Menteri mengenai pembebasan bea masuk.,
DOC177,bn1149-2022.txt,BAB XIV,,Pasal 38,8,,Diisi nomor dan judul peraturan perundang-undangan terkait.,
DOC177,bn1149-2022.txt,BAB XIV,,Pasal 38,9,,Dipilih yang sesuai dengan ketentuan peraturan perundang-undangan di bidang perpajakan.,
DOC177,bn1149-2022.txt,BAB XIV,,Pasal 38,10,,Diisi nama tempat domisili penerima fasilitas.,
DOC177,bn1149-2022.txt,BAB XIV,,Pasal 38,11,,Diisi uraian mengenai tujuan penggunaan barang oleh penerima fasilitas.,
DOC177,bn1149-2022.txt,BAB XIV,,Pasal 38,12,,Diisi pelabuhan/bandar udara pemasukan atau pembongkaran barang.,
DOC177,bn1149-2022.txt,BAB XIV,,Pasal 38,13,,Diisi Kantor Pelayanan Utama Bea dan Cukai tempat pemasukan barang.,
DOC177,bn1149-2022.txt,BAB XIV,,Pasal 38,14,,Diisi kementerian/lembaga yang perlu diberikan salinan Keputusan Menteri.,
DOC177,bn1149-2022.txt,BAB XIV,,Pasal 38,15,,Diisi kota tempat diterbitkannya Keputusan Menteri.,
DOC177,bn1149-2022.txt,BAB XIV,,Pasal 38,16,,Diisi tanggal diterbitkannya Keputusan Menteri.,
DOC177,bn1149-2022.txt,BAB XIV,,Pasal 38,17,,Diisi Kantor Wilayah Direktorat Jenderal Bea dan Cukai yang menerbitkan Keputusan Menteri.,
DOC177,bn1149-2022.txt,BAB XIV,,Pasal 38,18,,Diisi nama pejabat yang menandatangani Keputusan Menteri.,
DOC177,bn1149-2022.txt,BAB XIV,,Pasal 38,19,,Diisi nomor urut barang yang mendapatkan pembebasan bea masuk.,
DOC177,bn1149-2022.txt,BAB XIV,,Pasal 38,20,,Diisi uraian jenis barang dan spesifikasi teknis barang.,
DOC177,bn1149-2022.txt,BAB XIV,,Pasal 38,21,,Diisi jumlah barang yang bersangkutan.,
DOC177,bn1149-2022.txt,BAB XIV,,Pasal 38,22,,Diisi satuan barang yang bersangkutan.,
DOC177,bn1149-2022.txt,BAB XIV,,Pasal 38,23,,Diisi perkiraan harga barang yang bersangkutan.,
DOC177,bn1149-2022.txt,BAB XIV,,Pasal 38,24,,Diisi negara asal barang yang bersangkutan.,
DOC177,bn1149-2022.txt,BAB XIV,,Pasal 38,25,,"Diisi pelabuhan/bandar udara tempat pemasukan atau pembongkaran barang yang bersangkutan. Dengan Rahmat Tuhan Yang Maha Esa KEPUTUSAN MENTERI KEUANGAN REPUBLIK INDONESIA NOMOR ..........1 TENTANG PERSETUJUAN EKSPOR KEMBALI KENDARAAN BERMOTOR YANG MENDAPATKAN PEMBEBASAN BEA MASUK UNTUK KEPERLUAN BADAN INTERNASIONAL BESERTA PEJABATNYA YANG BERTUGAS DI INDONESIA MILIK .......... a. bahwa sesuai dengan hasil penelitian terhadap surat permohonan, permohonan ekspor kembali Kendaraan Bermotor untuk keperluan Badan Internasional beserta Pejabatnya yang bertugas di Indonesia telah memenuhi persyaratan untuk dapat diberikan persetujuan; b. bahwa berdasarkan pertimbangan sebagaimana dimaksud dalam huruf a, perlu menetapkan Keputusan Menteri Keuangan tentang Persetujuan Ekspor Kembali Kendaraan Bermotor yang Mendapatkan Pembebasan Bea Masuk untuk Keperluan Badan Internasional beserta Pejabatnya yang Bertugas di Indonesia milik .......... a. Undang-Undang Nomor 10 Tahun 1995 tentang Kepabeanan; b. Peraturan Menteri Keuangan Nomor .......... tentang Pembebasan Bea Masuk atas Impor Barang untuk Keperluan Badan Internasional; c. Peraturan Menteri Keuangan Nomor .......... tentang Tata Cara Pemberian Pembebasan Bea Masuk. Menetapkan: KEPUTUSAN MENTERI KEUANGAN TENTANG PERSETUJUAN EKSPOR KEMBALI KENDARAAN BERMOTOR YANG MENDAPATKAN PEMBEBASAN BEA MASUK UNTUK KEPERLUAN BADAN INTERNASIONAL BESERTA PEJABATNYA YANG BERTUGAS DI INDONESIA MILIK .......... PERTAMA: Memberikan persetujuan ekspor kembali Kendaraan Bermotor yang mendapatkan pembebasan bea masuk, pembebasan Pajak Pertambahan Nilai atau Pajak Penjualan atas Barang Mewah, serta dikecualikan dari pemungutan Pajak Penghasilan Pasal 22 untuk keperluan Badan Internasional beserta Pejabatnya yang bertugas di Indonesia milik: a. Nama: .......... b. Jabatan: .......... c. Badan Internasional: .......... d. Alamat: .......... KEDUA: Terhadap barang impor sebagaimana dimaksud dalam Diktum PERTAMA yang pada waktu impor bea masuknya telah dibayar, tidak dapat diberikan restitusi. KETIGA: Keputusan Menteri ini mulai berlaku pada tanggal ditetapkan sampai dengan 60 (enam puluh) hari sejak tanggal ditetapkan. Salinan Keputusan Menteri ini disampaikan kepada:",
DOC177,bn1149-2022.txt,BAB XIV,,Pasal 38,1,,......,
DOC177,bn1149-2022.txt,BAB XIV,,Pasal 38,2,,......,
DOC177,bn1149-2022.txt,BAB XIV,,Pasal 38,3,,......,
DOC177,bn1149-2022.txt,BAB XIV,,Pasal 38,4,,......,
DOC177,bn1149-2022.txt,BAB XIV,,Pasal 38,5,,......,
DOC177,bn1149-2022.txt,BAB XIV,,Pasal 38,6,,......,
DOC177,bn1149-2022.txt,BAB XIV,,Pasal 38,7,,......,
DOC177,bn1149-2022.txt,BAB XIV,,Pasal 38,8,,......,
DOC177,bn1149-2022.txt,BAB XIV,,Pasal 38,9,,......,
DOC177,bn1149-2022.txt,BAB XIV,,Pasal 38,10,,......,
DOC177,bn1149-2022.txt,BAB XIV,,Pasal 38,11,,......,
DOC177,bn1149-2022.txt,BAB XIV,,Pasal 38,12,,......,
DOC177,bn1149-2022.txt,BAB XIV,,Pasal 38,13,,......,
DOC177,bn1149-2022.txt,BAB XIV,,Pasal 38,14,,......,
DOC177,bn1149-2022.txt,BAB XIV,,Pasal 38,15,,......,
DOC177,bn1149-2022.txt,BAB XIV,,Pasal 38,16,,......,
DOC177,bn1149-2022.txt,BAB XIV,,Pasal 38,17,,......,
DOC177,bn1149-2022.txt,BAB XIV,,Pasal 38,18,,......,
DOC177,bn1149-2022.txt,BAB XIV,,Pasal 38,19,,......,
