doc_id,nama_dokumen,bab,bagian,pasal,angka,ayat,isi,penjelasan
DOC177,bn1149-2022.txt,BAB III,,Pasal 8,24,,Diisi negara asal barang yang bersangkutan.,
DOC177,bn1149-2022.txt,BAB III,,Pasal 8,25,,Diisi nama kantor pabean tempat pemasukan barang.,
DOC177,bn1149-2022.txt,BAB III,,Pasal 8,26,,Diisi nomor pemberitahuan pabean dari barang impor terkait.,
DOC177,bn1149-2022.txt,BAB III,,Pasal 8,27,,"Diisi tanggal, bulan, dan tahun pemberitahuan pabean dari barang impor terkait. CONTOH FORMAT SURAT PENETAPAN PEMBAYARAN BEA MASUK, CUKAI, DAN/ATAU PAJAK DALAM RANGKA IMPOR KEMENTERIAN KEUANGAN REPUBLIK INDONESIA DIREKTORAT JENDERAL BEA DAN CUKAI SURAT PENETAPAN PEMBAYARAN BEA MASUK, CUKAI, DAN/ATAU PAJAK DALAM RANGKA IMPOR (SPPBMCP) Nomor: {2} Tanggal: {3} Berdasarkan Surat Izin Pemindahtanganan Nomor: {4}, ditetapkan tarif dan nilai pabean terhadap {5} atas nama: Nomor Identitas: {6} Nomor Identitas: {7} NPWP: {8} NPWP: {9} Alamat: {10} Alamat: {11} Uraian Barang Secara Lengkap Meliputi Jenis, Jumlah Dan Spesifikasi Lainnya Pos Tarif / HS: {12} Perhitungan Bea Masuk, Cukai, dan/atau Pajak Dalam Rangka Impor Bea Masuk: {13} Cukai: {14} PPN: {15} PPnBM: {16} PPh Pasal 22: {17} Denda: {18} SPPBMCP ini dibuat rangkap 3 (tiga) Rangkap ke-1 untuk Penerima Fasilitas/Penerima Pemindahtanganan Rangkap ke-2 untuk Pimpinan kementerian yang menyelenggarakan urusan pemerintahan di bidang kesekretariatan negara Rangkap ke-3 untuk Pejabat Bea dan Cukai LEMBAR LANJUTAN SPPBMCP Unit Kerja: {19} halaman {20} dari {21}. Nomor: {22} PENETAPAN PEJABAT BEA DAN CUKAI Pos Tarif / HS: {23} Uraian Barang Secara Lengkap Meliputi Jenis, Jumlah, Merek, dan Spesifikasi Lainnya NIP: {25} PETUNJUK PENGISIAN",
DOC177,bn1149-2022.txt,BAB III,,Pasal 22,1,,Diisi nama Kantor Pelayanan Utama Bea dan Cukai atau Kantor Pengawasan dan Pelayanan Bea dan Cukai tempat SPPBMCP diterbitkan.,
DOC177,bn1149-2022.txt,BAB III,,Pasal 22,2,,Diisi nomor SPPBMCP.,
DOC177,bn1149-2022.txt,BAB III,,Pasal 22,3,,Diisi tanggal pendaftaran SPPBMCP.,
DOC177,bn1149-2022.txt,BAB III,,Pasal 22,4,,Diisi nomor Surat Izin Pemindahtanganan.,
DOC177,bn1149-2022.txt,BAB III,,Pasal 22,5,,Diisi tanggal Surat Izin Pemindahtanganan.,
DOC177,bn1149-2022.txt,BAB III,,Pasal 22,6,,Diisi jenis barang impor atau jenis prosedur.,
DOC177,bn1149-2022.txt,BAB III,,Pasal 22,7,,Diisi nama importir/penerima fasilitas dan jabatan apabila ada.,
DOC177,bn1149-2022.txt,BAB III,,Pasal 22,8,,Diisi nomor identitas (KTP/Paspor/Lainnya).,
DOC177,bn1149-2022.txt,BAB III,,Pasal 22,9,,Diisi Nomor Pokok Wajib Pajak (NPWP) apabila ada.,
DOC177,bn1149-2022.txt,BAB III,,Pasal 22,10,,Diisi alamat importir/penerima fasilitas.,
DOC177,bn1149-2022.txt,BAB III,,Pasal 22,11,,Diisi nama eksportir/penerima pindah tangan.,
DOC177,bn1149-2022.txt,BAB III,,Pasal 22,12,,Diisi nomor identitas (KTP/Paspor/Lainnya).,
DOC177,bn1149-2022.txt,BAB III,,Pasal 22,13,,Diisi Nomor Pokok Wajib Pajak (NPWP) apabila ada.,
DOC177,bn1149-2022.txt,BAB III,,Pasal 22,14,,Diisi alamat eksportir/penerima fasilitas.,
DOC177,bn1149-2022.txt,BAB III,,Pasal 22,15,,Diisi dengan nomor urut.,
DOC177,bn1149-2022.txt,BAB III,,Pasal 22,16,,"Diisi hasil pemeriksaan Pejabat Bea dan Cukai mengenai jenis, jumlah, merek, tipe, ukuran, dan spesifikasi dari barang impor.",
DOC177,bn1149-2022.txt,BAB III,,Pasal 22,17,,Diisi jumlah dan jenis satuan barang yang dipergunakan.,
DOC177,bn1149-2022.txt,BAB III,,Pasal 22,18,,Diisi nilai pabean yang ditetapkan oleh Pejabat Bea dan Cukai.,
DOC177,bn1149-2022.txt,BAB III,,Pasal 22,19,,"Diisi pada kolom yang disediakan dengan penetapan Pejabat Bea dan Cukai mengenai: a. klasifikasi barang; dan b. besarnya pembebasan bea masuk, cukai, PPN, PPnBM, dan PPh Pasal 22.",
DOC177,bn1149-2022.txt,BAB III,,Pasal 22,20,,"Diisi Nilai Dasar Perhitungan Bea Masuk (NDPBM), yaitu nilai tukar yang dipergunakan sebagai dasar perhitungan bea masuk.",
DOC177,bn1149-2022.txt,BAB III,,Pasal 22,21,,"Diisi nilai pabean dalam Rupiah, yaitu hasil perkalian antara nilai pabean pada kolom angka 18 dengan NDPBM pada kolom angka 21.",
DOC177,bn1149-2022.txt,BAB III,,Pasal 22,22,,Diisi tarif bea masuk.,
DOC177,bn1149-2022.txt,BAB III,,Pasal 22,23,,Diisi tarif PPnBM.,
DOC177,bn1149-2022.txt,BAB III,,Pasal 22,24,,Diisi tarif PPh Pasal 22.,
DOC177,bn1149-2022.txt,BAB III,,Pasal 22,25,,"Diisi tarif denda, apabila terdapat denda yang dihitung dengan persen.",
DOC177,bn1149-2022.txt,BAB III,,Pasal 22,26,,Diisi jumlah bea masuk yang wajib dilunasi.,
DOC177,bn1149-2022.txt,BAB III,,Pasal 22,27,,Diisi jumlah cukai yang wajib dilunasi.,
DOC177,bn1149-2022.txt,BAB III,,Pasal 22,28,,Diisi jumlah PPN yang wajib dilunasi.,
DOC177,bn1149-2022.txt,BAB III,,Pasal 22,29,,Diisi jumlah PPnBM yang wajib dilunasi.,
DOC177,bn1149-2022.txt,BAB III,,Pasal 22,30,,Diisi dengan jumlah PPh Pasal 22 yang wajib dilunasi.,
DOC177,bn1149-2022.txt,BAB III,,Pasal 22,31,,Diisi dengan jumlah denda apabila ada.,
DOC177,bn1149-2022.txt,BAB III,,Pasal 22,32,,"Diisi dengan total jumlah bea masuk, cukai, pajak, dan denda yang wajib dilunasi.",
DOC177,bn1149-2022.txt,BAB III,,Pasal 22,33,,Diisi nama jabatan Pejabat Bea dan Cukai yang menerbitkan SPPBMCP.,
DOC177,bn1149-2022.txt,BAB III,,Pasal 22,34,,Diisi nama Pejabat Bea dan Cukai yang menerbitkan SPPBMCP.,
DOC177,bn1149-2022.txt,BAB III,,Pasal 22,35,,Diisi NIP Pejabat Bea dan Cukai yang menerbitkan SPPBMCP.,
DOC177,bn1149-2022.txt,BAB III,,Pasal 22,36,,"Diisi dengan keterangan lainnya seperti dasar hukum, ketentuan pembayaran, tanggal jatuh tempo, dan lain-lain.",
DOC177,bn1149-2022.txt,BAB III,,Pasal 22,37,,Diisi nomor halaman.,
DOC177,bn1149-2022.txt,BAB III,,Pasal 22,38,,Diisi jumlah halaman. Dengan Rahmat Tuhan Yang Maha Esa,
DOC177,bn1149-2022.txt,BAB III,,Pasal 22,1,,"Bahwa untuk melaksanakan ketentuan dalam peraturan perundang-undangan yang berlaku, perlu menetapkan kebijakan terkait pembebasan bea masuk atas impor barang untuk keperluan Badan Internasional beserta pejabatnya yang bertugas di Indonesia.",
DOC177,bn1149-2022.txt,BAB III,,Pasal 22,2,,"Bahwa untuk itu, perlu menetapkan Keputusan Menteri mengenai pembebasan bea masuk atas impor barang untuk keperluan Badan Internasional beserta pejabatnya yang bertugas di Indonesia. a. Undang-Undang Nomor 17 Tahun 2006 tentang Kepabeanan; b. Peraturan Pemerintah Nomor 10 Tahun 2021 tentang Pembebasan Bea Masuk; c. Peraturan Menteri Keuangan Nomor 203/PMK.04/2021 tentang Tata Cara Pembebasan Bea Masuk atas Impor Barang untuk Keperluan Badan Internasional; d. Peraturan Menteri Keuangan Nomor 114/PMK.04/2022 tentang Perubahan atas Peraturan Menteri Keuangan Nomor 203/PMK.04/2021. Menetapkan Keputusan Menteri mengenai pembebasan bea masuk atas impor barang untuk keperluan Badan Internasional beserta pejabatnya yang bertugas di Indonesia.",
DOC177,bn1149-2022.txt,BAB III,,Pasal 1,,1,"Dalam hal barang impor berupa Kendaraan Bermotor, rincian jenis barang sebagaimana dimaksud pada ayat (3) huruf b dan ayat (4) huruf b paling sedikit memuat jenis, merek, tipe, nomor mesin, nomor rangka, kapasitas mesin, dan tahun pembuatan kendaraan.",
DOC177,bn1149-2022.txt,BAB III,,Pasal 1,,2,Permohonan sebagaimana dimaksud pada ayat (1) disampaikan secara elektronik kepada Portal Direktorat Jenderal Bea dan Cukai melalui Sistem Indonesia National Single Window.,
DOC177,bn1149-2022.txt,BAB III,,Pasal 1,,3,Permohonan serta hasil pindaian dari dokumen asli lampiran permohonan diteruskan oleh Sistem Indonesia National Single Window ke sistem informasi kementerian yang menyelenggarakan urusan pemerintahan di bidang kesekretariatan negara atau kementerian/lembaga terkait selaku ketua panitia nasional kegiatan atau pejabat yang ditunjuk untuk mendapatkan persetujuan.,
DOC177,bn1149-2022.txt,BAB III,,Pasal 2,,1,"Dalam hal Portal Direktorat Jenderal Bea dan Cukai dan/atau Sistem Indonesia National Single Window belum dapat diterapkan atau mengalami gangguan operasional, permohonan sebagaimana dimaksud pada ayat (1), diajukan secara tertulis disertai dengan: a. lampiran permohonan dalam bentuk salinan cetak (hardcopy); dan b. hasil pindaian dari dokumen asli dalam media penyimpan data elektronik dalam bentuk salinan digital (softcopy).",
DOC177,bn1149-2022.txt,BAB III,,Pasal 3,,1,"Dalam hal permohonan sebagaimana dimaksud dalam Pasal 2 ayat (1): a. berupa Kendaraan Bermotor, Kepala Kantor Wilayah Direktorat Jenderal Bea dan Cukai atau Kepala Kantor Pelayanan Utama Bea dan Cukai; atau b. selain Kendaraan Bermotor, Kepala Kantor Pelayanan Utama Bea dan Cukai atau Kepala Kantor Pengawasan dan Pelayanan Bea dan Cukai, melakukan penelitian terhadap pemenuhan persyaratan untuk mendapatkan pembebasan bea masuk.",
DOC177,bn1149-2022.txt,BAB III,,Pasal 3,,2,"Dalam hal permohonan sebagaimana dimaksud dalam Pasal 2 ayat (1) disetujui: a. Kepala Kantor Wilayah Direktorat Jenderal Bea dan Cukai atau Kepala Kantor Pelayanan Utama Bea dan Cukai atas nama Menteri menerbitkan Keputusan Menteri mengenai pembebasan bea masuk atas impor barang untuk keperluan Badan Internasional beserta pejabatnya yang bertugas di Indonesia, dalam hal barang berupa Kendaraan Bermotor; atau b. Kepala Kantor Pelayanan Utama Bea dan Cukai atau Kepala Kantor Pengawasan dan Pelayanan Bea dan Cukai atas nama Menteri menerbitkan Keputusan Menteri mengenai pembebasan bea masuk atas impor barang untuk keperluan Badan Internasional beserta pejabatnya yang bertugas di Indonesia, dalam hal barang selain Kendaraan Bermotor.",
DOC177,bn1149-2022.txt,BAB III,,Pasal 3,,3,Keputusan Menteri sebagaimana dimaksud pada ayat (2) berlaku untuk jangka waktu paling lama 1 (satu) tahun terhitung sejak tanggal ditetapkan.,
DOC177,bn1149-2022.txt,BAB III,,Pasal 3,,4,"Dalam hal permohonan sebagaimana dimaksud dalam Pasal 2 ayat (1) tidak disetujui: a. Kepala Kantor Wilayah Direktorat Jenderal Bea dan Cukai atau Kepala Kantor Pelayanan Utama Bea dan Cukai atas nama Menteri menerbitkan surat pemberitahuan penolakan dengan menyebutkan alasan penolakan, dalam hal barang berupa Kendaraan Bermotor; atau b. Kepala Kantor Pelayanan Utama Bea dan Cukai atau Kepala Kantor Pengawasan dan Pelayanan Bea dan Cukai atas nama Menteri menerbitkan surat pemberitahuan penolakan dengan menyebutkan alasan penolakan, dalam hal barang selain Kendaraan Bermotor. Kepala Kantor Wilayah Direktorat Jenderal Bea dan Cukai, Kepala Kantor Pelayanan Utama Bea dan Cukai, atau Kepala Kantor Pengawasan dan Pelayanan Bea dan Cukai atas nama Menteri memberikan persetujuan atau penolakan atas permohonan sebagaimana dimaksud pada ayat (2) dan ayat (4), dalam jangka waktu paling lama: a. 5 (lima) jam kerja terhitung setelah permohonan diterima secara lengkap dan benar, dalam hal permohonan diajukan secara elektronik sebagaimana dimaksud dalam Pasal 2 ayat (6); dan b. 3 (tiga) hari kerja terhitung setelah permohonan diterima secara lengkap dan benar, dalam hal permohonan diajukan secara tertulis sebagaimana dimaksud dalam Pasal 2 ayat (8). Keputusan Menteri sebagaimana dimaksud pada ayat (2) dan surat pemberitahuan penolakan sebagaimana dimaksud pada ayat (4) diterbitkan dengan menggunakan contoh format sebagaimana tercantum dalam Lampiran huruf A dan Lampiran huruf B yang merupakan bagian tidak terpisahkan dari keputusan ini. MENTERI KEUANGAN REPUBLIK INDONESIA, ttd SRI MULYANI INDRAWATI Dengan Rahmat Tuhan Yang Maha Esa",
DOC177,bn1149-2022.txt,BAB III,,Pasal 5,1,,"bahwa untuk melaksanakan ketentuan peraturan perundang-undangan mengenai impor barang, perlu diatur tata laksana impor barang untuk keperluan Badan Internasional dan pejabatnya yang bertugas di Indonesia;",
DOC177,bn1149-2022.txt,BAB III,,Pasal 5,2,,"bahwa untuk itu, perlu menetapkan peraturan mengenai tata laksana impor barang untuk keperluan Badan Internasional dan pejabatnya yang bertugas di Indonesia. c. Peraturan Pemerintah Nomor 10 Tahun 2021 tentang Perubahan atas Peraturan Pemerintah Nomor 85 Tahun 2020 tentang Penyelenggaraan Kepabeanan; d. Peraturan Menteri Keuangan Nomor 203/PMK.04/2019 tentang Tata Cara Pemberitahuan dan Pembayaran Bea Masuk. Menetapkan Peraturan Menteri Keuangan tentang Tata Laksana Impor Barang untuk Keperluan Badan Internasional dan Pejabatnya yang Bertugas di Indonesia. PEMBERITAHUAN PABEAN DAN LARANGAN ATAU PEMBATASAN Tata laksana impor barang untuk keperluan Badan Internasional beserta pejabatnya yang bertugas di Indonesia, dilaksanakan sesuai dengan ketentuan peraturan perundang-undangan mengenai impor barang untuk dipakai, barang kiriman, dan barang bawaan penumpang. Impor barang untuk keperluan Badan Internasional beserta pejabatnya yang bertugas di Indonesia, dilaksanakan dengan menggunakan pemberitahuan pabean sesuai dengan ketentuan sebagaimana dimaksud pada ayat (1). Dalam hal barang impor untuk keperluan Badan Internasional beserta pejabatnya merupakan barang larangan atau pembatasan, barang impor harus memenuhi ketentuan larangan atau pembatasan sesuai dengan ketentuan peraturan perundang-undangan pada saat impor barang. Pemenuhan kewajiban pabean atas impor barang untuk keperluan Badan Internasional beserta pejabatnya, dilakukan dengan mengajukan Pemberitahuan Pabean Impor dengan mencantumkan nomor dan tanggal Keputusan Menteri sebagaimana dimaksud dalam Pasal 9 ayat (2) serta kode fasilitas 11 dalam dokumen Pemberitahuan Pabean Impor. KUOTA DAN PENYELESAIAN KEWAJIBAN KENDARAAN BERMOTOR Bagian Kesatu Kuota Atas Impor Kendaraan Bermotor Pembebasan bea masuk atas impor Kendaraan Bermotor dalam keadaan jadi (Completely Built Up/CBU) untuk keperluan kantor Badan Internasional, diberikan dengan ketentuan sebagai berikut: a. untuk perwakilan Badan Internasional di bawah Perserikatan Bangsa-Bangsa, paling banyak 2 (dua) unit; b. untuk Badan Internasional lainnya, paling banyak 1 (satu) unit. Pembebasan bea masuk atas impor Kendaraan Bermotor dalam keadaan jadi (Completely Built Up/CBU), untuk: a. kepala perwakilan Badan Internasional di bawah Perserikatan Bangsa-Bangsa, beserta pejabat setingkat Deputi; atau b. kepala Badan Internasional lainnya, diberikan paling banyak 1 (satu) unit selama bertugas di Indonesia. Untuk keperluan Kerja Sama Teknik, dapat diberikan pembebasan bea masuk atas impor Kendaraan Bermotor dalam keadaan jadi (Completely Built Up/CBU) sesuai dengan spesifikasi teknis yang diperlukan dalam pelaksanaan Kerja Sama Teknik yang ditetapkan oleh menteri yang menyelenggarakan urusan pemerintahan di bidang kesekretariatan negara. Untuk keperluan kegiatan yang diselenggarakan oleh Badan Internasional yang dihadiri oleh kepala negara dan/atau pimpinan Badan Internasional, dapat diberikan pembebasan bea masuk atas impor Kendaraan Bermotor dalam keadaan jadi (Completely Built Up/CBU) yang ditetapkan oleh menteri/kepala lembaga terkait selaku ketua panitia nasional kegiatan atau pejabat yang ditunjuk.",
