doc_id,nama_dokumen,bab,bagian,pasal,angka,ayat,isi,penjelasan
DOC177,bn1149-2022.txt,BAB XIV,,Pasal 38,20,,"...... Penetapan Badan Internasional yang berhak mendapatkan pembebasan bea masuk sebagaimana dimaksud dalam Pasal 2 ayat (2) dan penetapan Badan Internasional yang berhak mendapatkan pembebasan bea masuk sebagaimana dimaksud dalam Pasal 3, dilakukan setelah mendapatkan persetujuan terlebih dahulu dari menteri yang menyelenggarakan urusan pemerintahan di bidang kesekretariatan negara. Penetapan Badan Internasional sebagaimana dimaksud pada ayat (1) ditetapkan oleh Menteri. Barang untuk keperluan Badan Internasional beserta Pejabatnya yang diberikan pembebasan bea masuk sebagaimana dimaksud dalam Pasal 2 ayat (1), harus digunakan untuk keperluan: a. kantor Badan Internasional; b. pribadi dan/atau keluarganya termasuk Barang Pindahan; c. tenaga ahli (professional equipment); d. proyek dan non proyek dalam rangka pelaksanaan Kerja Sama Teknik; dan/atau e. kegiatan yang diselenggarakan oleh Badan Internasional yang dihadiri oleh kepala negara dan/atau pimpinan Badan Internasional. Pembebasan bea masuk atas impor barang sebagaimana dimaksud pada ayat (1) huruf b yang akan digunakan untuk keperluan Pejabat dapat diberikan sepanjang Pejabat yang bersangkutan: a. diangkat langsung oleh Badan Internasional yang bersangkutan; b. mendapatkan persetujuan dari menteri yang menyelenggarakan urusan pemerintahan di bidang kesekretariatan negara untuk menjalankan tugas atau jabatan di Indonesia; c. menjalankan pekerjaan sesuai dengan tugas pokok dan fungsi Badan Internasional; d. berdomisili dan berkedudukan di Indonesia; dan e. berkewarganegaraan asing. Pembebasan bea masuk atas Barang Pindahan berupa Kendaraan Bermotor untuk keperluan sebagaimana dimaksud pada ayat (1) huruf b hanya diberikan kepada Pejabat yang merupakan kepala Badan Internasional. Barang Pindahan dapat diberikan pembebasan bea masuk apabila diimpor dalam jangka waktu paling lama 6 (enam) bulan terhitung sejak tanggal izin tinggal diterbitkan. Barang impor yang digunakan tidak sesuai dengan tujuan pemberian pembebasan bea masuk sebagaimana dimaksud pada ayat (1), bea masuk yang terutang wajib dibayar. PETUNJUK PENGISIAN Nomor (1): diisi nomor Keputusan Menteri mengenai persetujuan ekspor kembali Kendaraan Bermotor yang mendapatkan pembebasan bea masuk untuk keperluan Badan Internasional beserta Pejabatnya yang bertugas di Indonesia. Nomor (2): diisi nama penerima fasilitas. Nomor (3): diisi jabatan Pejabat yang mengajukan permohonan. Nomor (4): diisi nama Badan Internasional. Nomor (5): diisi menteri yang menyelenggarakan urusan pemerintahan di bidang kesekretariatan negara atau menteri/kepala lembaga terkait selaku ketua panitia nasional kegiatan atau pejabat yang ditunjuk, yang memberikan persetujuan. Nomor (6): diisi nomor dan tanggal persetujuan dari menteri yang menyelenggarakan urusan pemerintahan di bidang kesekretariatan negara atau menteri/kepala lembaga terkait selaku ketua panitia nasional kegiatan atau pejabat yang ditunjuk. Nomor (7): diisi nomor dan judul Peraturan Menteri mengenai pembebasan bea masuk atas impor barang untuk keperluan Badan Internasional beserta Pejabatnya yang bertugas di Indonesia. Nomor (8): diisi nomor dan judul peraturan perundang-undangan terkait. Nomor (9): diisi nomor dan judul Keputusan Menteri mengenai pembebasan bea masuk atas impor barang untuk keperluan Badan Internasional beserta Pejabatnya yang bertugas di Indonesia yang mengajukan permohonan. Nomor (10): dipilih yang sesuai dengan ketentuan peraturan perundang-undangan di bidang perpajakan. Nomor (11): diisi nama tempat domisili penerima fasilitas. Nomor (12): diisi pihak-pihak yang perlu diberikan salinan Keputusan Menteri. Nomor (13): diisi kota tempat diterbitkannya Keputusan Menteri. Nomor (14): diisi tanggal, bulan, dan tahun diterbitkannya Keputusan Menteri. Nomor (15): diisi nama Kantor Wilayah Direktorat Jenderal Bea dan Cukai atau Kantor Pelayanan Utama Bea dan Cukai tempat pemasukan barang. Nomor (16): diisi nama pejabat yang menandatangani Keputusan Menteri. Nomor (17): diisi nomor urut 2. Nomor (18): diisi uraian jenis, merek, tipe, nomor mesin, nomor rangka, kapasitas mesin, dan tahun pembuatan Kendaraan Bermotor. Nomor (19): diisi jumlah barang. Nomor (20): diisi satuan barang. Nomor (21): diisi nilai pabean sesuai dengan pemberitahuan pabean impor. Nomor (22): diisi nomor pos tarif/HS. Nomor (23): diisi nomor Keputusan Menteri mengenai pembebasan bea masuk atas impor barang untuk keperluan Badan Internasional beserta Pejabatnya yang bertugas di Indonesia. Nomor (24): diisi tanggal Keputusan Menteri Keuangan mengenai pembebasan bea masuk atas impor barang untuk keperluan Badan Internasional beserta Pejabatnya yang bertugas di Indonesia. Nomor (25): diisi nomor urut barang pada Keputusan Menteri mengenai pembebasan bea masuk atas impor barang untuk keperluan Badan Internasional beserta Pejabatnya yang bertugas di Indonesia. Nomor (26): diisi negara asal barang. Nomor (27): diisi nama Kantor Pelayanan Utama Bea dan Cukai atau Kantor Pengawasan dan Pelayanan Bea dan Cukai tempat pemasukan barang. Nomor (28): diisi nomor pemberitahuan pabean dari barang impor terkait. Nomor (29): diisi tanggal, bulan dan tahun pemberitahuan pabean dari barang impor terkait. Dengan Rahmat Tuhan Yang Maha Esa KEPUTUSAN MENTERI KEUANGAN REPUBLIK INDONESIA TENTANG PEMBEBASAN BEA MASUK ATAS PEMINDAHTANGANAN KENDARAAN BERMOTOR UNTUK KEPERLUAN BADAN INTERNASIONAL BESERTA PEJABATNYA YANG BERTUGAS DI INDONESIA MENTERI KEUANGAN REPUBLIK INDONESIA, a. Bahwa berdasarkan permohonan pemindahtanganan Kendaraan Bermotor untuk keperluan Badan Internasional beserta Pejabatnya yang bertugas di Indonesia, telah memenuhi syarat untuk dapat diberikan persetujuan; b. Bahwa berdasarkan pertimbangan sebagaimana dimaksud dalam huruf a, perlu menetapkan Keputusan Menteri Keuangan tentang Pembebasan Bea Masuk Atas Pemindahtanganan Kendaraan Bermotor untuk Keperluan Badan Internasional beserta Pejabatnya yang bertugas di Indonesia. a. Undang-Undang Nomor 10 Tahun 1995 tentang Kepabeanan; b. Peraturan Menteri Keuangan Nomor 123/PMK.04/2020 tentang Pembebasan Bea Masuk atas Impor Barang untuk Keperluan Badan Internasional; c. Peraturan perundang-undangan lainnya yang relevan. Menetapkan: KEPUTUSAN MENTERI KEUANGAN TENTANG PEMBEBASAN BEA MASUK ATAS PEMINDAHTANGANAN KENDARAAN BERMOTOR UNTUK KEPERLUAN BADAN INTERNASIONAL BESERTA PEJABATNYA YANG BERTUGAS DI INDONESIA. KEDUA: Pembebasan bea masuk sebagaimana dimaksud dalam Diktum PERTAMA: a. Kendaraan Bermotor yang dimaksud akan digunakan untuk keperluan resmi dan tidak untuk diperjualbelikan; b. Perubahan tujuan atau pemindahtanganan Kendaraan Bermotor tidak dapat dilakukan sebelum mendapat izin dari Direktorat Jenderal Bea dan Cukai; c. Apabila syarat tersebut pada huruf a dan huruf b tidak dipenuhi atau terdapat penyalahgunaan dari Kendaraan Bermotor, pemberian pembebasan bea masuk dicabut dan dinyatakan tidak berlaku lagi; d. Terhadap Kendaraan Bermotor yang disalahgunakan dikenakan bea masuk serta pajak dalam rangka impor dan sanksi administrasi berupa denda sesuai dengan ketentuan peraturan perundang-undangan. KETIGA: Keputusan ini mulai berlaku pada tanggal ditetapkan. MENTERI KEUANGAN REPUBLIK INDONESIA, [Nama Pejabat] --- PETUNJUK PENGISIAN Nomor (1): Diisi nomor Keputusan Menteri mengenai persetujuan pemindahtanganan Kendaraan Bermotor yang mendapatkan pembebasan bea masuk untuk keperluan Badan Internasional beserta Pejabatnya yang bertugas di Indonesia. Nomor (2): Diisi nama penerima fasilitas. Nomor (3): Diisi nama pihak yang menerima pemindahtanganan Kendaraan Bermotor. Nomor (4): Diisi jabatan Pejabat yang mengajukan permohonan. Nomor (5): Diisi nama Badan Internasional. Nomor (6): Diisi menteri yang menyelenggarakan urusan pemerintahan di bidang kesekretariatan negara atau menteri/kepala lembaga terkait selaku ketua panitia nasional kegiatan atau pejabat yang ditunjuk, yang memberikan persetujuan. Nomor (7): Diisi nomor dan tanggal persetujuan dari menteri yang menyelenggarakan urusan pemerintahan di bidang kesekretariatan negara atau menteri/kepala lembaga terkait selaku ketua panitia nasional kegiatan atau pejabat yang ditunjuk. Nomor (8): Diisi nomor dan judul Peraturan Menteri mengenai pembebasan bea masuk atas impor barang untuk keperluan Badan Internasional beserta Pejabatnya yang bertugas di Indonesia. Nomor (9): Diisi nomor dan judul peraturan perundang-undangan terkait. Nomor (10): Diisi nomor dan judul Keputusan Menteri mengenai pemberian pembebasan bea masuk atas impor barang untuk keperluan Badan Internasional beserta Pejabatnya yang bertugas di Indonesia yang akan dilakukan pemindahtanganan. Nomor (11): Diisi nomor dan judul Keputusan Menteri mengenai pemberian pembebasan bea masuk kepada instansi/kementerian/pihak yang akan menerima pemindahtanganan. Nomor (12): Diisi keterangan yang sesuai dengan ketentuan peraturan perundang-undangan di bidang perpajakan. Nomor (13): Diisi nama tempat domisili penerima fasilitas. Nomor (14): Diisi nama Jabatan pihak yang menerima pemindahtanganan Kendaraan Bermotor. Nomor (15): a. Diisi nama Badan Internasional pihak yang menerima pemindahtanganan Kendaraan Bermotor, dalam hal dilakukan pemindahtanganan kepada Badan Internasional atau Pejabatnya yang bertugas di Indonesia; b. Diisi nama perwakilan negara asing pihak yang menerima pemindahtanganan Kendaraan Bermotor, dalam hal dilakukan pemindahtanganan kepada perwakilan negara asing atau pejabatnya yang bertugas di Indonesia; atau c. Diisi nomor identitas pihak yang menerima pemindahtanganan Kendaraan Bermotor berupa NIK/NPWP/dsb, dalam hal dilakukan pemindahtanganan kepada selain Badan Internasional atau perwakilan negara asing. Nomor (16): Diisi nama tempat domisili pihak yang menerima pemindahtanganan Kendaraan Bermotor. Nomor (17): Diisi pihak-pihak yang perlu diberikan salinan Keputusan Menteri. Nomor (18): Diisi kota tempat ditetapkannya Keputusan Menteri. Nomor (19): Diisi tanggal, bulan, dan tahun ditetapkannya Keputusan Menteri. Nomor (20): Diisi nama Kantor Wilayah Direktorat Jenderal Bea dan Cukai atau Kantor Pelayanan Utama Bea dan Cukai yang menerbitkan Keputusan Menteri. Nomor (21): Diisi nama pejabat yang menandatangani Keputusan Menteri. Nomor (22): Diisi nomor urut. Nomor (23): Diisi uraian jenis, merek, tipe, nomor mesin, nomor rangka, kapasitas mesin, dan tahun pembuatan Kendaraan Bermotor. Nomor (24): Diisi jumlah barang. Nomor (25): Diisi satuan barang. Nomor (26): Diisi nilai pabean sesuai dengan pemberitahuan pabean impor. Nomor (27): Diisi nomor pos tarif/HS. Nomor (28): Diisi nomor Keputusan Menteri mengenai pembebasan bea masuk atas impor barang untuk keperluan Badan Internasional beserta Pejabatnya yang bertugas di Indonesia. Nomor (29): Diisi tanggal Keputusan Menteri mengenai pembebasan bea masuk atas impor barang untuk keperluan Badan Internasional beserta Pejabatnya yang bertugas di Indonesia. Nomor (30): Diisi nomor urut barang pada Keputusan Menteri mengenai pembebasan bea masuk atas impor barang untuk keperluan Badan Internasional beserta Pejabatnya yang bertugas di Indonesia. Nomor (31): Diisi negara asal barang. Nomor (32): Diisi nama kantor pabean tempat pemasukan barang. Nomor (33): Diisi nomor pemberitahuan pabean dari barang impor terkait. Nomor (34): Diisi tanggal, bulan, dan tahun pemberitahuan pabean dari barang impor terkait. --- CONTOH FORMAT SURAT IZIN PEMINDAHTANGANAN KENDARAAN BERMOTOR DENGAN KEWAJIBAN MEMBAYAR BEA MASUK DAN/ATAU PPN ATAU PPN DAN PPNBM SERTA TIDAK DIPUNGUT PPH PASAL 22 SURAT IZIN PEMINDAHTANGANAN DENGAN KEWAJIBAN MEMBAYAR BEA MASUK DAN/ATAU PPN ATAU PPN DAN PPNBM SERTA TIDAK DIPUNGUT PPH PASAL 22 NOMOR SI- oo... a Wa Formulir B Nomor Pem. Pabean Keputusan Menteri Keuangan mengenai pembebasan bea masuk dengan disertai kewajiban membayar Bea Masuk dan/atau PPN atau PPN dan PPNBM serta tidak dipungut PPh Pasal 22, dengan perincian sebagai berikut: Kepada: Nama Nomor Identitas Alamat a.n. Menteri Keuangan Republik Indonesia",
DOC177,bn1149-2022.txt,BAB XIV,,Pasal 5,1,,Surat Izin Pemindahtanganan dengan Kewajiban Membayar Bea Masuk dan/atau PPN atau PPN dan PPNBM serta tidak dipungut PPh Pasal 22 berlaku dalam jangka 60 (enam puluh) hari sejak tanggal ditetapkan.,
DOC177,bn1149-2022.txt,BAB XIV,,Pasal 5,2,,"Apabila keberatan terhadap surat persetujuan tersebut di atas dapat mengajukan pembatalan dalam jangka waktu 30 (tiga puluh) hari sejak tanggal ditetapkan. * Diisi dalam hal barang digunakan untuk keperluan Pejabat. --- PETUNJUK PENGISIAN Nomor (1): Diisi nomor Surat Izin Pemindahtanganan dengan Kewajiban Membayar Bea Masuk dan/atau PPN atau PPN dan PPNBM serta Tidak Dipungut PPh Pasal 22. Nomor (2): Diisi nama penerima fasilitas. Nomor (3): Diisi jabatan Pejabat yang mengajukan permohonan. Nomor (4): Diisi nama Badan Internasional. Nomor (5): Diisi nama tempat domisili penerima fasilitas. Nomor (6): Diisi jenis Kendaraan Bermotor. Nomor (7): Diisi merek dan tipe Kendaraan Bermotor. Nomor (8): Diisi tahun pembuatan Kendaraan Bermotor. Nomor (9): Diisi nomor rangka Kendaraan Bermotor. Nomor (10): Diisi nomor mesin Kendaraan Bermotor. Nomor (11): Diisi kapasitas mesin Kendaraan Bermotor. Nomor (12): Diisi nomor surat keterangan pengimporan Kendaraan Bermotor berupa Formulir B atau surat keterangan lainnya. Nomor (13): Diisi tanggal, bulan, dan tahun surat keterangan pengimporan Kendaraan Bermotor berupa Formulir B atau surat keterangan lainnya. Nomor (14): Diisi nomor pemberitahuan pabean dari barang impor terkait. Nomor (15): Diisi tanggal, bulan, dan tahun pemberitahuan pabean dari barang impor terkait. Nomor (16): Diisi nomor dan tanggal Keputusan Menteri mengenai pembebasan bea masuk atas impor barang untuk keperluan Badan Internasional beserta Pejabatnya. Nomor (17): Diisi nilai pabean dalam Rupiah. Nomor (18): Diisi pos tarif/HS. Nomor (19): Diisi persentase tarif bea masuk. Nomor (20): Diisi persentase tarif cukai. Nomor (21): Diisi persentase tarif PPN. Nomor (22): Diisi persentase tarif PPnBM. Nomor (23): Diisi persentase tarif PPh Pasal 22. Nomor (24): Diisi jumlah bea masuk yang wajib dilunasi. Nomor (25): Diisi jumlah cukai yang wajib dilunasi. Nomor (26): Diisi jumlah PPN yang wajib dilunasi. Nomor (27): Diisi jumlah PPnBM yang wajib dilunasi. Nomor (28): Diisi jumlah PPh Pasal 22 yang wajib dilunasi. Nomor (29): Diisi total jumlah bea masuk, cukai, PPN, PPnBM, dan PPh Pasal 22 yang wajib dilunasi. Nomor (30): Diisi nama Orang/pemerintah pusat/pemerintah daerah/badan/lembaga yang menerima pemindahtanganan Kendaraan Bermotor. Nomor (31): Diisi nomor identitas Orang/pemerintah pusat/pemerintah daerah/badan/lembaga yang menerima pemindahtanganan Kendaraan Bermotor berupa NIK/NPWP/dsb. Nomor (32): Diisi nama tempat domisili Orang/pemerintah pusat/pemerintah daerah/badan/lembaga yang menerima pemindahtanganan Kendaraan Bermotor. Nomor (33): Diisi menteri yang menyelenggarakan urusan pemerintahan di bidang kesekretariatan negara atau menteri/kepala lembaga terkait selaku ketua panitia nasional kegiatan atau pejabat yang ditunjuk, yang memberikan persetujuan. Nomor (34): Diisi nomor dan tanggal persetujuan dari menteri yang menyelenggarakan urusan pemerintahan di bidang kesekretariatan negara atau menteri/kepala lembaga terkait selaku ketua panitia nasional kegiatan atau pejabat yang ditunjuk. Nomor (35): Diisi kota tempat ditetapkannya surat izin pemindahtanganan Kendaraan Bermotor. Nomor (36): Diisi tanggal, bulan, dan tahun ditetapkannya surat izin pemindahtanganan Kendaraan Bermotor. Nomor (37): Diisi nama Kantor Wilayah Direktorat Jenderal Bea dan Cukai atau Kantor Pelayanan Utama Bea dan Cukai yang menerbitkan surat izin pemindahtanganan Kendaraan Bermotor. Nomor (38): Diisi nama pejabat yang menandatangani surat izin pemindahtanganan Kendaraan Bermotor. Nomor (39): Diisi pihak-pihak yang perlu diberikan tembusan surat izin pemindahtanganan Kendaraan Bermotor. ---",
DOC177,bn1149-2022.txt,BAB XIV,,Pasal 6,,1,"Pembebasan bea masuk kepada Badan Internasional beserta Pejabatnya dapat diberikan setelah mendapatkan persetujuan terlebih dahulu dari: a. Menteri yang menyelenggarakan urusan pemerintahan di bidang kesekretariatan negara, dalam hal digunakan untuk keperluan sebagaimana dimaksud dalam Pasal 5 ayat (1) huruf a sampai dengan huruf d; atau b. Menteri/kepala lembaga terkait selaku ketua panitia nasional kegiatan atau pejabat yang ditunjuk, dalam hal digunakan untuk keperluan sebagaimana dimaksud dalam Pasal 5 ayat (1) huruf e.",
DOC177,bn1149-2022.txt,BAB XIV,,Pasal 6,,2,"Persetujuan sebagaimana dimaksud pada ayat (1) diterbitkan dengan memperhatikan ukuran kepatutan jumlah dan jenis barang yang diberikan fasilitas pembebasan bea masuk dengan mengacu pada jumlah Pejabat, tugas, fungsi, dan kebutuhan Badan Internasional beserta Pejabatnya. Barang impor untuk keperluan Badan Internasional beserta Pejabatnya yang telah diberikan pembebasan bea masuk sebagaimana dimaksud dalam Pasal 2 ayat (1), dapat diberikan fasilitas: a. Pembebasan Pajak Pertambahan Nilai atau Pajak Pertambahan Nilai dan Pajak Penjualan atas Barang Mewah; dan b. Dikecualikan dari pemungutan Pajak Penghasilan Pasal 22, sesuai dengan ketentuan peraturan perundang-undangan di bidang perpajakan. TATA CARA PENGAJUAN PERMOHONAN",
DOC177,bn1149-2022.txt,BAB III,,Pasal 8,,1,"Untuk memperoleh pembebasan bea masuk atas impor barang sebagaimana dimaksud dalam Pasal 5 ayat (1), Badan Internasional harus mengajukan permohonan kepada Menteri melalui: a. Kepala Kantor Wilayah Direktorat Jenderal Bea dan Cukai atau Kepala Kantor Pelayanan Utama Bea dan Cukai tempat pemasukan barang, dalam hal barang impor berupa Kendaraan Bermotor; atau b. Kepala Kantor Pelayanan Utama Bea dan Cukai atau Kepala Kantor Pengawasan dan Pelayanan Bea dan Cukai. --- CONTOH FORMAT KEPUTUSAN MENTERI KEUANGAN MENGENAI PEMBEBASAN BEA MASUK ATAS PEMINDAHTANGANAN KENDARAAN BERMOTOR UNTUK KEPERLUAN BADAN INTERNASIONAL BESERTA PEJABATNYA YANG BERTUGAS DI INDONESIA KEMENTERIAN KEUANGAN REPUBLIK INDONESIA KEPUTUSAN MENTERI KEUANGAN REPUBLIK INDONESIA TENTANG PEMBEBASAN BEA MASUK ATAS PEMINDAHTANGANAN KENDARAAN BERMOTOR UNTUK KEPERLUAN BADAN INTERNASIONAL BESERTA PEJABATNYA YANG BERTUGAS DI INDONESIA MENTERI KEUANGAN REPUBLIK INDONESIA, a. Bahwa berdasarkan permohonan pemindahtanganan Kendaraan Bermotor untuk keperluan Badan Internasional beserta Pejabatnya yang bertugas di Indonesia, telah memenuhi syarat untuk dapat diberikan persetujuan; b. Bahwa berdasarkan pertimbangan sebagaimana dimaksud dalam huruf a, perlu menetapkan Keputusan Menteri Keuangan tentang Pembebasan Bea Masuk Atas Pemindahtanganan Kendaraan Bermotor untuk Keperluan Badan Internasional beserta Pejabatnya yang bertugas di Indonesia.",
DOC177,bn1149-2022.txt,BAB III,,Pasal 8,1,,Peraturan Menteri Keuangan Nomor 123/PMK.04/2020 tentang Pembebasan Bea Masuk atas Impor Barang untuk Keperluan Badan Internasional;,
DOC177,bn1149-2022.txt,BAB III,,Pasal 8,2,,"Peraturan perundang-undangan lainnya yang relevan. Menetapkan: KEPUTUSAN MENTERI KEUANGAN TENTANG PEMBEBASAN BEA MASUK ATAS PEMINDAHTANGANAN KENDARAAN BERMOTOR UNTUK KEPERLUAN BADAN INTERNASIONAL BESERTA PEJABATNYA YANG BERTUGAS DI INDONESIA. KEDUA: Pembebasan bea masuk sebagaimana dimaksud dalam Diktum PERTAMA: a. Kendaraan Bermotor yang dimaksud akan digunakan untuk keperluan resmi dan tidak untuk diperjualbelikan; b. Perubahan tujuan atau pemindahtanganan Kendaraan Bermotor tidak dapat dilakukan sebelum mendapat izin dari Direktorat Jenderal Bea dan Cukai; c. Apabila syarat tersebut pada huruf a dan huruf b tidak dipenuhi atau terdapat penyalahgunaan dari Kendaraan Bermotor, pemberian pembebasan bea masuk dicabut dan dinyatakan tidak berlaku lagi; d. Terhadap Kendaraan Bermotor yang disalahgunakan dikenakan bea masuk serta pajak dalam rangka impor dan sanksi administrasi berupa denda sesuai dengan ketentuan peraturan perundang-undangan. KETIGA: Keputusan ini mulai berlaku pada tanggal ditetapkan. MENTERI KEUANGAN REPUBLIK INDONESIA, [Nama Pejabat] Dengan Rahmat Tuhan Yang Maha Esa KEPUTUSAN MENTERI KEUANGAN REPUBLIK INDONESIA NOMOR .......... TENTANG PERSETUJUAN PEMUSNAHAN KENDARAAN BERMOTOR YANG MENDAPATKAN PEMBEBASAN BEA MASUK UNTUK KEPERLUAN BADAN INTERNASIONAL BESERTA PEJABATNYA YANG BERTUGAS DI INDONESIA MENTERI KEUANGAN REPUBLIK INDONESIA, a. bahwa sesuai dengan hasil penelitian terhadap surat permohonan pemusnahan Kendaraan Bermotor yang telah diberikan pembebasan bea masuk untuk keperluan Badan Internasional beserta Pejabatnya yang bertugas di Indonesia telah memenuhi persyaratan untuk dapat diberikan persetujuan; b. bahwa berdasarkan pertimbangan sebagaimana dimaksud dalam huruf a, perlu menetapkan Keputusan Menteri Keuangan tentang Persetujuan Pemusnahan Kendaraan Bermotor yang Mendapatkan Pembebasan Bea Masuk untuk Keperluan Badan Internasional beserta Pejabatnya yang Bertugas di Indonesia.",
DOC177,bn1149-2022.txt,BAB III,,Pasal 8,1,,Peraturan Menteri Keuangan Nomor ......... tentang Pembebasan Bea Masuk;,
DOC177,bn1149-2022.txt,BAB III,,Pasal 8,2,,"Keputusan Menteri Keuangan Nomor ......... tentang Pembebasan Bea Masuk. Menetapkan: KEPUTUSAN MENTERI KEUANGAN TENTANG PERSETUJUAN PEMUSNAHAN KENDARAAN BERMOTOR YANG MENDAPATKAN PEMBEBASAN BEA MASUK UNTUK KEPERLUAN BADAN INTERNASIONAL BESERTA PEJABATNYA YANG BERTUGAS DI INDONESIA. PERTAMA: Memberikan persetujuan pemusnahan Kendaraan Bermotor yang mendapatkan pembebasan bea masuk, pembebasan Pajak Pertambahan Nilai atau Pajak Penjualan atas Barang Mewah, serta dikecualikan dari pemungutan Pajak Penghasilan Pasal 22 untuk keperluan Badan Internasional beserta pejabatnya yang bertugas di Indonesia, milik: a. Nama: b. Jabatan: c. Badan Internasional: d. Alamat: KEDUA: Terhadap Kendaraan Bermotor sebagaimana dimaksud dalam Diktum PERTAMA yang pada waktu impor bea masuknya telah dibayar, tidak dapat diberikan restitusi. KETIGA: Keputusan Menteri ini mulai berlaku pada tanggal ditetapkan sampai dengan 60 (enam puluh) hari sejak tanggal ditetapkan. Salinan Keputusan Menteri ini disampaikan kepada: a.n. MENTERI KEUANGAN REPUBLIK INDONESIA KEPALA ... LAMPIRAN KEPUTUSAN MENTERI KEUANGAN REPUBLIK INDONESIA PEMBEBASAN BEA MASUK ATAS PEMINDAHTANGANAN KENDARAAN BERMOTOR UNTUK KEPERLUAN BADAN INTERNASIONAL BESERTA PEJABATNYA YANG BERTUGAS DI INDONESIA DAFTAR BARANG YANG MENDAPATKAN PEMBEBASAN BEA MASUK ATAS PEMINDAHTANGANAN KENDARAAN BERMOTOR UNTUK KEPERLUAN BADAN INTERNASIONAL BESERTA PEJABATNYA YANG BERTUGAS DI INDONESIA",
DOC177,bn1149-2022.txt,BAB III,,Pasal 8,2,1,Nama:,
DOC177,bn1149-2022.txt,BAB III,,Pasal 8,2,2,Jabatan:,
DOC177,bn1149-2022.txt,BAB III,,Pasal 8,2,3,Badan Internasional:,
DOC177,bn1149-2022.txt,BAB III,,Pasal 8,2,4,Alamat: PETUNJUK PENGISIAN,
DOC177,bn1149-2022.txt,BAB III,,Pasal 8,1,,Diisi nomor Keputusan Menteri mengenai pembebasan bea masuk atas pemindahtanganan Kendaraan Bermotor untuk keperluan Badan Internasional beserta Pejabatnya yang bertugas di Indonesia.,
DOC177,bn1149-2022.txt,BAB III,,Pasal 8,2,,Diisi nama penerima fasilitas.,
DOC177,bn1149-2022.txt,BAB III,,Pasal 8,3,,Diisi jabatan Pejabat yang mengajukan permohonan.,
DOC177,bn1149-2022.txt,BAB III,,Pasal 8,4,,Diisi nama Badan Internasional.,
DOC177,bn1149-2022.txt,BAB III,,Pasal 8,5,,"Diisi menteri yang menyelenggarakan urusan pemerintahan di bidang kesekretariatan negara atau menteri/kepala lembaga terkait selaku ketua panitia nasional kegiatan atau pejabat yang ditunjuk, yang memberikan persetujuan.",
DOC177,bn1149-2022.txt,BAB III,,Pasal 8,6,,Diisi nomor dan tanggal persetujuan menteri yang menyelenggarakan urusan pemerintahan di bidang kesekretariatan negara atau menteri/kepala lembaga terkait selaku ketua panitia nasional kegiatan atau pejabat yang ditunjuk.,
DOC177,bn1149-2022.txt,BAB III,,Pasal 8,7,,Diisi nomor dan judul Peraturan Menteri mengenai pembebasan bea masuk atas impor barang untuk keperluan Badan Internasional beserta Pejabatnya yang bertugas di Indonesia.,
DOC177,bn1149-2022.txt,BAB III,,Pasal 8,8,,Diisi nomor dan judul peraturan perundang-undangan terkait.,
DOC177,bn1149-2022.txt,BAB III,,Pasal 8,9,,Dipilih yang sesuai dengan ketentuan peraturan perundang-undangan di bidang perpajakan.,
DOC177,bn1149-2022.txt,BAB III,,Pasal 8,10,,Diisi nama tempat domisili penerima fasilitas.,
DOC177,bn1149-2022.txt,BAB III,,Pasal 8,11,,Diisi uraian mengenai tujuan penggunaan barang oleh penerima fasilitas.,
DOC177,bn1149-2022.txt,BAB III,,Pasal 8,12,,Diisi Kantor Pelayanan Utama Bea dan Cukai atau Kantor Pengawasan dan Pelayanan Bea dan Cukai tempat pemasukan barang.,
DOC177,bn1149-2022.txt,BAB III,,Pasal 8,13,,"Diisi kementerian/lembaga, instansi, atau unit terkait yang perlu diberikan salinan Keputusan Menteri.",
DOC177,bn1149-2022.txt,BAB III,,Pasal 8,14,,Diisi kota tempat diterbitkannya Keputusan Menteri.,
DOC177,bn1149-2022.txt,BAB III,,Pasal 8,15,,"Diisi tanggal, bulan, dan tahun diterbitkannya Keputusan Menteri.",
DOC177,bn1149-2022.txt,BAB III,,Pasal 8,16,,Diisi nama Kantor Wilayah Direktorat Jenderal Bea dan Cukai atau Kantor Pelayanan Utama Bea dan Cukai yang menerbitkan Keputusan Menteri.,
DOC177,bn1149-2022.txt,BAB III,,Pasal 8,17,,Diisi nama pejabat yang menandatangani Keputusan Menteri.,
DOC177,bn1149-2022.txt,BAB III,,Pasal 8,18,,Diisi nomor urut barang yang mendapatkan pembebasan bea masuk.,
DOC177,bn1149-2022.txt,BAB III,,Pasal 8,19,,"Diisi uraian jenis, merek, tipe, nomor mesin, nomor rangka, kapasitas mesin, dan tahun pembuatan Kendaraan Bermotor.",
DOC177,bn1149-2022.txt,BAB III,,Pasal 8,20,,Diisi jumlah barang yang bersangkutan.,
DOC177,bn1149-2022.txt,BAB III,,Pasal 8,21,,Diisi satuan barang yang bersangkutan.,
DOC177,bn1149-2022.txt,BAB III,,Pasal 8,22,,Diisi perkiraan harga barang yang bersangkutan.,
DOC177,bn1149-2022.txt,BAB III,,Pasal 8,23,,Diisi nomor pos tarif/HS.,
