doc_id,nama_dokumen,bab,bagian,pasal,angka,ayat,isi,penjelasan
DOC206,bn1240-2022.txt,BAB I,,Pasal 33,2,,"Bahwa berdasarkan pertimbangan sebagaimana dimaksud dalam huruf a, perlu menetapkan Peraturan Menteri Keuangan tentang Pemeriksaan Pabean di Bidang Impor. a. Undang-Undang Nomor 17 Tahun 2006 tentang Perubahan atas Undang-Undang Nomor 10 Tahun 1995 tentang Kepabeanan; b. Undang-Undang Nomor 20 Tahun 2016 tentang Perubahan atas Undang-Undang Nomor 10 Tahun 1995 tentang Kepabeanan; c. Peraturan Pemerintah Nomor 28 Tahun 2008 tentang Pemberian dan Penggunaan Nomor Pendaftaran Pabean; d. Peraturan Menteri Keuangan Nomor 139/PMK.04/2007 tentang Pemeriksaan Pabean di Bidang Impor; e. Peraturan Menteri Keuangan Nomor 225/PMK.04/2015 tentang Perubahan atas Peraturan Menteri Keuangan Nomor 139/PMK.04/2007 tentang Pemeriksaan Pabean di Bidang Impor. Menetapkan: Peraturan Menteri Keuangan tentang Pemeriksaan Pabean di Bidang Impor. Dalam Peraturan Menteri ini yang dimaksud dengan:",
DOC206,bn1240-2022.txt,BAB I,,Pasal 1,1,,"Importir adalah orang perseorangan atau lembaga atau badan usaha, baik yang berbentuk badan hukum maupun bukan badan hukum yang melakukan kegiatan memasukkan barang ke dalam daerah pabean.",
DOC206,bn1240-2022.txt,BAB I,,Pasal 1,2,,Pengusaha Pengurusan Jasa Kepabeanan yang selanjutnya disingkat PPJK adalah badan usaha yang melakukan kegiatan pengurusan pemenuhan kewajiban pabean untuk dan atas kuasa Importir.,
DOC206,bn1240-2022.txt,BAB I,,Pasal 1,3,,Mitra Utama Kepabeanan yang selanjutnya disebut MITA Kepabeanan adalah Importir yang diberikan pelayanan khusus di bidang kepabeanan.,
DOC206,bn1240-2022.txt,BAB I,,Pasal 1,4,,Operator Ekonomi Bersertifikat (Authorized Economic Operator) yang selanjutnya disingkat AEO adalah operator ekonomi yang mendapat pengakuan oleh Direktorat Jenderal Bea dan Cukai sehingga mendapatkan perlakuan kepabeanan tertentu.,
DOC206,bn1240-2022.txt,BAB I,,Pasal 1,5,,Pemberitahuan Pabean Impor adalah pernyataan yang dibuat oleh Orang dalam rangka melaksanakan kewajiban pabean Impor dalam bentuk dan syarat yang ditetapkan dalam peraturan perundang-undangan di bidang kepabeanan.,
DOC206,bn1240-2022.txt,BAB I,,Pasal 1,6,,"Dokumen Pelengkap Pabean adalah semua dokumen yang digunakan sebagai pelengkap pemberitahuan pabean, misalnya invoice, packing list, bill of lading/airway bill, dokumen identifikasi barang, dokumen pemenuhan persyaratan Impor, dan dokumen lainnya yang dipersyaratkan.",
DOC206,bn1240-2022.txt,BAB I,,Pasal 1,7,,Penelitian Dokumen adalah kegiatan yang dilakukan oleh Pejabat Bea dan Cukai dan/atau sistem komputer untuk memastikan bahwa pemberitahuan pabean dibuat dengan lengkap dan benar.,
DOC206,bn1240-2022.txt,BAB I,,Pasal 1,8,,Pemeriksaan Fisik Barang adalah pemeriksaan atas barang guna memperoleh data dan penilaian yang tepat mengenai pemberitahuan atau dokumen yang diajukan.,
DOC206,bn1240-2022.txt,BAB I,,Pasal 1,9,,Instruksi Pemeriksaan adalah instruksi yang diterbitkan oleh sistem komputer pelayanan atau Pejabat Bea dan Cukai kepada Pejabat Pemeriksa Fisik untuk melaksanakan Pemeriksaan Fisik Barang.,
DOC206,bn1240-2022.txt,BAB I,,Pasal 1,10,,Laporan Hasil Pemeriksaan Fisik Barang yang selanjutnya disingkat LHP adalah laporan yang dibuat Pejabat Pemeriksa Fisik mengenai hasil Pemeriksaan Fisik Barang.,
DOC206,bn1240-2022.txt,BAB I,,Pasal 1,11,,Berita Acara Pemeriksaan Fisik Barang yang selanjutnya disebut BAP Fisik adalah berita acara mengenai proses Pemeriksaan Fisik Barang dan hal-hal lain terkait berlangsungnya Pemeriksaan Fisik Barang.,
DOC206,bn1240-2022.txt,BAB I,,Pasal 1,12,,Peti Kemas adalah peti atau kotak yang memenuhi persyaratan teknis sesuai dengan standar internasional (International Standard Organization) sebagai alat atau perangkat pengangkutan barang.,
DOC206,bn1240-2022.txt,BAB I,,Pasal 1,13,,"Alat Pemindai adalah alat yang digunakan untuk melakukan Pemeriksaan Fisik Barang dalam Peti Kemas atau kemasan dengan menggunakan teknologi sinar X (X-Ray), sinar gamma (Gamma Ray), atau teknologi pemindai lainnya.",
DOC206,bn1240-2022.txt,BAB I,,Pasal 1,14,,Sistem Komputer Pelayanan yang selanjutnya disingkat SKP adalah sistem komputer yang digunakan oleh Kantor Pabean dalam rangka pengawasan dan pelayanan kepabeanan.,
DOC206,bn1240-2022.txt,BAB I,,Pasal 1,15,,Kantor Pabean adalah kantor dalam lingkungan Direktorat Jenderal Bea dan Cukai tempat dipenuhinya kewajiban pabean sesuai dengan ketentuan peraturan perundang-undangan di bidang kepabeanan.,
DOC206,bn1240-2022.txt,BAB I,,Pasal 1,16,,Direktur Jenderal adalah Direktur Jenderal Bea dan Cukai.,
DOC206,bn1240-2022.txt,BAB I,,Pasal 1,17,,Pejabat Bea dan Cukai adalah pegawai Direktorat Jenderal Bea dan Cukai yang ditunjuk dalam jabatan tertentu untuk melaksanakan tugas tertentu berdasarkan peraturan perundang-undangan di bidang kepabeanan.,
DOC206,bn1240-2022.txt,BAB I,,Pasal 1,18,,Pejabat Pemeriksa Dokumen adalah Pejabat Bea dan Cukai yang berwenang untuk melakukan penelitian dan penetapan atas data pemberitahuan pabean.,
DOC206,bn1240-2022.txt,BAB I,,Pasal 1,19,,Pejabat Pemeriksa Fisik adalah Pejabat Bea dan Cukai yang berwenang untuk melakukan Pemeriksaan Fisik Barang dan ditunjuk secara langsung melalui sistem komputer pelayanan atau oleh Pejabat Bea dan Cukai.,
DOC206,bn1240-2022.txt,BAB I,,Pasal 1,20,,"Unit Pengawasan adalah unit kerja pada Direktorat Jenderal Bea dan Cukai yang melakukan kegiatan intelijen, penindakan, penyidikan, dan kegiatan lain dalam rangka pengawasan. Terhadap barang Import dilakukan pemeriksaan pabean. Pemeriksaan pabean sebagaimana dimaksud pada ayat (1) meliputi Penelitian Dokumen dan Pemeriksaan Fisik Barang. Pemeriksaan pabean dilakukan setelah Importir atau PPJK menyampaikan Pemberitahuan Pabean Impor atau Dokumen Pelengkap Pabean. Pemeriksaan pabean dilakukan berdasarkan Pemberitahuan Pabean Impor dan/atau Dokumen Pelengkap Pabean. Pemeriksaan pabean dilakukan secara selektif berdasarkan analisis manajemen risiko. Pemeriksaan pabean bertujuan untuk memperoleh data dan penilaian yang tepat mengenai Pemberitahuan Pabean Impor atau Dokumen Pelengkap Pabean yang diajukan. Pemeriksaan Fisik Barang dilakukan untuk: a. Memeriksa kesesuaian jumlah dan/atau jenis barang; b. Memperoleh informasi mengenai spesifikasi uraian barang yang diberitahukan secara lengkap; c. Memperoleh informasi mengenai negara asal barang dan/atau bagian dari barang; dan/atau d. Memeriksa kemungkinan adanya barang yang tidak diberitahukan dalam pemberitahuan pabean. Pemeriksaan Fisik Barang dilakukan oleh Pejabat Pemeriksa Fisik di Kantor Pabean tempat diajukannya Pemberitahuan Pabean Impor atau di Kantor Pabean yang wilayah kerjanya meliputi tempat penimbunan barang Import. Pemeriksaan Fisik Barang dilakukan di dalam: a. TPS atau tempat lain yang diperlakukan sama dengan TPS; b. TPP atau tempat lain yang berfungsi sebagai TPP; atau c. TPB. PENELITIAN DOKUMEN Penelitian Dokumen dilakukan oleh: a. SKP; dan/atau b. Pejabat Pemeriksa Dokumen. Penelitian Dokumen oleh SKP meliputi: a. Kelengkapan dan kebenaran pengisian Pemberitahuan Pabean Impor; dan b. Pemenuhan ketentuan larangan dan/atau pembatasan. Penelitian Dokumen oleh Pejabat Pemeriksa Dokumen merupakan tindak lanjut dari hasil Penelitian Dokumen oleh SKP, berdasarkan data pada SKP dan/atau Dokumen Pelengkap Pabean. Penelitian Dokumen oleh Pejabat Pemeriksa Dokumen meliputi: a. Ketepatan pemberitahuan tarif dan/atau kewajaran nilai pabean; dan b. Pemenuhan ketentuan larangan atau pembatasan, dalam hal ditemukan ketidaksesuaian pemberitahuan. Penelitian Dokumen dapat dibantu dengan sistem aplikasi yang dimodifikasi berdasarkan kecerdasan buatan (artificial intelligence) dan dianggap sebagai hasil penelitian Pejabat Bea dan Cukai. Dalam hal penelitian pemenuhan ketentuan larangan dan/atau pembatasan telah dilakukan oleh Sistem Indonesia National Single Window (SINSW), SKP tidak melakukan penelitian terhadap pemenuhan ketentuan larangan dan/atau pembatasan. SKP menunjuk Pejabat Pemeriksa Dokumen untuk melakukan Penelitian Dokumen atas Pemberitahuan Pabean Impor yang telah mendapatkan nomor pendaftaran. Dalam hal SKP mengalami gangguan atau belum dapat diterapkan, penunjukan dilakukan oleh Kepala Kantor Pabean atau Pejabat Bea dan Cukai yang ditunjuk. Dalam hal Pejabat Pemeriksa Dokumen yang ditunjuk berhalangan, dilakukan penunjukan Pejabat Pemeriksa Dokumen pengganti oleh Kepala Kantor Pabean atau Pejabat Bea dan Cukai yang ditunjuk. Pejabat Pemeriksa Dokumen melakukan Penelitian Dokumen dengan melakukan penelitian terhadap tarif dan/atau nilai pabean yang diberitahukan dalam Pemberitahuan Pabean Impor. Penelitian Dokumen dilakukan sebelum atau sesudah pengeluaran barang Import dari: a. Kawasan Pabean; b. Tempat lain yang diperlakukan sama dengan TPS; c. TPP; d. Tempat lain yang berfungsi sebagai TPP; atau e. TPB. Penelitian Dokumen dilakukan berdasarkan data Pemberitahuan Pabean Impor atau Dokumen Pelengkap Pabean. Untuk kepentingan penelitian, Pejabat Pemeriksa Dokumen dapat meminta data tambahan dan/atau keterangan dari Importir dan/atau PPJK. Dalam hal diperlukan Pemeriksaan Fisik Barang terhadap barang yang diberitahukan pada Pemberitahuan Pabean Impor, SKP atau Pejabat Pemeriksa Dokumen dapat menentukan Peti Kemas dan/atau kemasan barang yang harus diperiksa fisik oleh Pejabat Pemeriksa Fisik. Hasil Pemeriksaan Fisik Barang dituangkan dalam LHP. Dalam hal LHP belum memadai, Pejabat Pemeriksa Dokumen dapat meminta kepada Pejabat Pemeriksa Fisik untuk melakukan: a. Perekaman ulang LHP di SKP; atau b. Pemeriksaan Fisik Barang ulang dan perekaman ulang LHP di SKP. Penelitian tarif dilaksanakan sesuai dengan ketentuan peraturan perundang-undangan mengenai penetapan sistem klasifikasi barang dan pembebanan tarif bea masuk atas barang impor. Penelitian nilai pabean dilaksanakan sesuai dengan ketentuan peraturan perundang-undangan mengenai nilai pabean untuk penghitungan bea masuk. Berdasarkan hasil Penelitian Dokumen, Pejabat Pemeriksa Dokumen melakukan penetapan tarif dan/atau nilai pabean dalam jangka waktu paling lama 30 (tiga puluh) hari sejak tanggal pendaftaran Pemberitahuan Pabean Impor. Penetapan tarif dan nilai pabean dilaksanakan sesuai dengan ketentuan peraturan perundang-undangan mengenai tata cara penetapan tarif, nilai pabean, dan sanksi administrasi, serta penetapan Direktur Jenderal Bea dan Cukai atau Pejabat Bea dan Cukai. PEMERIKSAAN FISIK BARANG Bagian Kesatu Teknik dan Tingkat Pemeriksaan Pemeriksaan Fisik Barang dilakukan dengan teknik dan tingkat pemeriksaan yang disesuaikan dengan karakteristik barang dan risiko yang dihadapi. Bagian Kedua Prosedur Pemeriksaan Fisik Barang Pemeriksaan Fisik Barang dilakukan dengan prosedur sebagai berikut:",
DOC206,bn1240-2022.txt,BAB III,,Pasal 9,1,,Pejabat Pemeriksa Fisik melakukan pemeriksaan fisik terhadap barang yang diajukan berdasarkan Pemberitahuan Pabean Impor.,
DOC206,bn1240-2022.txt,BAB III,,Pasal 9,2,,"Dalam hal diperlukan, Pejabat Pemeriksa Fisik dapat meminta keterangan tambahan dari Importir atau PPJK.",
DOC206,bn1240-2022.txt,BAB III,,Pasal 9,3,,"Hasil Pemeriksaan Fisik Barang dituangkan dalam LHP yang ditandatangani oleh Pejabat Pemeriksa Fisik. KETENTUAN LAIN-LAIN Ketentuan mengenai petunjuk teknis dalam pelaksanaan Pemeriksaan Pabean di Bidang Impor ditetapkan oleh Direktur Jenderal. KETENTUAN PERALIHAN Pada saat Peraturan Menteri ini mulai berlaku, pemeriksaan pabean terhadap barang impor dalam Pemberitahuan Pabean Impor yang telah mendapatkan nomor pendaftaran sebelum berlakunya Peraturan Menteri ini dilakukan sesuai dengan ketentuan sebagaimana diatur dalam Peraturan Menteri Keuangan Nomor 139/PMK.04/2007 tentang Pemeriksaan Pabean di Bidang Impor sebagaimana telah diubah dengan Peraturan Menteri Keuangan Nomor 225/PMK.04/2015 tentang Perubahan atas Peraturan Menteri Keuangan Nomor 139/PMK.04/2007 tentang Pemeriksaan Pabean di Bidang Impor (Berita Negara Republik Indonesia Tahun 2015 Nomor 1895). KETENTUAN PENUTUP Pada saat Peraturan Menteri ini mulai berlaku, Peraturan Menteri Keuangan Nomor 139/PMK.04/2007 tentang Pemeriksaan Pabean di Bidang Impor sebagaimana telah diubah dengan Peraturan Menteri Keuangan Nomor 225/PMK.04/2015 tentang Perubahan atas Peraturan Menteri Keuangan Nomor 139/PMK.04/2007 tentang Pemeriksaan Pabean di Bidang Impor (Berita Negara Republik Indonesia Tahun 2015 Nomor 1895), dicabut dan dinyatakan tidak berlaku. Peraturan Menteri ini mulai berlaku setelah 30 (tiga puluh) hari terhitung sejak tanggal diundangkan. Agar setiap orang mengetahuinya, memerintahkan pengundangan Peraturan Menteri ini dengan penempatannya dalam Berita Negara Republik Indonesia. MENTERI KEUANGAN REPUBLIK INDONESIA, ttd SRI MULYANI INDRAWATI Diundangkan di Jakarta pada tanggal 12 Desember 2022 MENTERI HUKUM DAN HAK ASASI MANUSIA REPUBLIK INDONESIA, ttd YASONNA H. LAOLY Dengan Rahmat Tuhan Yang Maha Esa",
DOC206,bn1240-2022.txt,BAB VI,,Pasal 38,1,,bahwa untuk melaksanakan ketentuan dalam Pasal 2 ayat (2) perlu dilakukan pemeriksaan fisik barang;,
DOC206,bn1240-2022.txt,BAB VI,,Pasal 38,2,,bahwa pemeriksaan fisik barang dapat dilakukan dengan membuka kemasan barang dan/atau menggunakan Alat Pemindai;,
DOC206,bn1240-2022.txt,BAB VI,,Pasal 38,3,,bahwa pemeriksaan dengan membuka kemasan barang sebagaimana dimaksud pada ayat (1) huruf a dapat dilakukan dengan kehadiran Pejabat Pemeriksa Fisik secara langsung di tempat pemeriksaan atau melalui media elektronik;,
DOC206,bn1240-2022.txt,BAB VI,,Pasal 38,4,,bahwa pemeriksaan dengan menggunakan Alat Pemindai sebagaimana dimaksud pada ayat (1) huruf b berlaku sebagai pemeriksaan pendahuluan sebelum Pemeriksaan Fisik Barang oleh Pejabat Pemeriksa Fisik barang sebagaimana dimaksud pada ayat (1) huruf a dan/atau sebagai pengganti pemeriksaan dengan membuka kemasan sebagaimana dimaksud pada ayat (1) huruf a;,
DOC206,bn1240-2022.txt,BAB VI,,Pasal 38,5,,bahwa pemeriksaan melalui media elektronik sebagaimana dimaksud pada ayat (2) huruf b dapat dilakukan terhadap barang yang diimpor oleh Importir berstatus AEO setelah mendapat persetujuan dari Kepala Kantor Pabean atau Pejabat Bea dan Cukai yang ditunjuk atau barang lain yang dapat dilakukan pemeriksaan melalui media elektronik berdasarkan pertimbangan Kepala Kantor Pabean;,
DOC206,bn1240-2022.txt,BAB VI,,Pasal 38,6,,"bahwa pemeriksaan dengan menggunakan Alat Pemindai sebagaimana dimaksud pada ayat (3) huruf b dapat dilakukan terhadap barang impor berisiko rendah yang terkena pemeriksaan acak, barang yang diberitahukan dalam Pemberitahuan Pabean Impor yang memuat paling banyak 3 (tiga) jenis barang, barang dalam Peti Kemas berpendingin, barang peka udara, barang yang berdasarkan analisis intelijen ditetapkan untuk diperiksa dengan Alat Pemindai, atau barang lainnya yang berdasarkan pertimbangan Pejabat Bea dan Cukai dapat dilakukan Pemeriksaan dengan menggunakan Alat Pemindai;",
DOC206,bn1240-2022.txt,BAB VI,,Pasal 38,7,,"bahwa pemeriksaan dengan menggunakan Alat Pemindai sebagaimana dimaksud pada ayat (1) huruf b dikecualikan terhadap barang peka cahaya, barang mengandung zat radioaktif, barang lainnya yang karena sifatnya dapat menjadi rusak atau mengalami penurunan mutu atau fungsi dalam hal dilakukan pemindaian, barang yang harus dilakukan Pemeriksaan dengan menggunakan Alat Pemindai yang dimohonkan oleh Importir untuk tidak dilakukan Pemeriksaan dengan menggunakan Alat Pemindai dan telah mendapat persetujuan Kepala Kantor Pabean atau Pejabat Bea dan Cukai yang ditunjuk, atau barang yang harus dilakukan Pemeriksaan dengan menggunakan Alat Pemindai yang berdasarkan pertimbangan Pejabat Bea dan Cukai perlu dilakukan Pemeriksaan Fisik Barang oleh Pejabat Pemeriksa Fisik. a. Undang-Undang Nomor 17 Tahun 2006 tentang Kepabeanan; b. Peraturan Pemerintah Nomor 85 Tahun 2021 tentang Perubahan atas Peraturan Pemerintah Nomor 85 Tahun 2015 tentang Kepabeanan; c. Peraturan Menteri Keuangan Nomor 182/PMK.04/2021 tentang Ketentuan Umum dan Tata Cara Kepabeanan; d. Peraturan Menteri Keuangan Nomor 213/PMK.04/2021 tentang Tata Cara Pemeriksaan Fisik Barang. Menetapkan: a. membuka kemasan barang; dan/atau b. menggunakan Alat Pemindai. Pemeriksaan dengan membuka kemasan barang sebagaimana dimaksud pada ayat (1) huruf a dapat dilakukan dengan: a. kehadiran Pejabat Pemeriksa Fisik secara langsung di tempat pemeriksaan; atau b. melalui media elektronik. Pemeriksaan dengan menggunakan Alat Pemindai sebagaimana dimaksud pada ayat (1) huruf b berlaku sebagai: a. pemeriksaan pendahuluan sebelum Pemeriksaan Fisik Barang oleh Pejabat Pemeriksa Fisik barang sebagaimana dimaksud pada ayat (1) huruf a; dan/atau b. pengganti pemeriksaan dengan membuka kemasan sebagaimana dimaksud pada ayat (1) huruf a. Pemeriksaan melalui media elektronik sebagaimana dimaksud pada ayat (2) huruf b dapat dilakukan terhadap: a. barang yang diimpor oleh Importir berstatus AEO setelah mendapat persetujuan dari Kepala Kantor Pabean atau Pejabat Bea dan Cukai yang ditunjuk; atau b. barang lain yang dapat dilakukan pemeriksaan melalui media elektronik berdasarkan pertimbangan Kepala Kantor Pabean. Pemeriksaan dengan menggunakan Alat Pemindai sebagaimana dimaksud pada ayat (3) huruf b dapat dilakukan terhadap: a. barang impor berisiko rendah yang terkena pemeriksaan acak; b. barang yang diberitahukan dalam Pemberitahuan Pabean Impor yang memuat paling banyak 3 (tiga) jenis barang; c. barang dalam Peti Kemas berpendingin; d. barang peka udara; e. barang yang berdasarkan analisis intelijen ditetapkan untuk diperiksa dengan Alat Pemindai; atau f. barang lainnya yang berdasarkan pertimbangan Pejabat Bea dan Cukai dapat dilakukan Pemeriksaan dengan menggunakan Alat Pemindai. Pemeriksaan dengan menggunakan Alat Pemindai sebagaimana dimaksud pada ayat (1) huruf b dikecualikan terhadap: a. barang peka cahaya; b. barang mengandung zat radioaktif; c. barang lainnya yang karena sifatnya dapat menjadi rusak atau mengalami penurunan mutu atau fungsi dalam hal dilakukan pemindaian; d. barang yang harus dilakukan Pemeriksaan dengan menggunakan Alat Pemindai yang dimohonkan oleh Importir untuk tidak dilakukan Pemeriksaan dengan menggunakan Alat Pemindai dan telah mendapat persetujuan Kepala Kantor Pabean atau Pejabat Bea dan Cukai yang ditunjuk; atau e. barang yang harus dilakukan Pemeriksaan dengan menggunakan Alat Pemindai yang berdasarkan pertimbangan Pejabat Bea dan Cukai perlu dilakukan Pemeriksaan Fisik Barang oleh Pejabat Pemeriksa Fisik. Tingkat Pemeriksaan Fisik Barang sebagaimana dimaksud dalam Pasal 8 ayat (1) sebesar: a. 10% (sepuluh persen); atau b. 30% (tiga puluh persen). Tingkat pemeriksaan sebagaimana dimaksud pada ayat (1) dilaksanakan dengan ketentuan sebagai berikut: a. dalam hal barang impor dikemas dengan menggunakan Peti Kemas dan jumlah Peti Kemas yang diberitahukan dalam Pemberitahuan Pabean Impor paling banyak 5 (lima) Peti Kemas, tingkat pemeriksaan sebesar:",
DOC206,bn1240-2022.txt,BAB VI,,Pasal 9,1,,"10% (sepuluh persen) dari seluruh jumlah kemasan yang diberitahukan, untuk tingkat Pemeriksaan Fisik Barang 10% (sepuluh persen); atau",
DOC206,bn1240-2022.txt,BAB VI,,Pasal 9,2,,"30% (tiga puluh persen) dari seluruh jumlah kemasan yang diberitahukan, untuk tingkat Pemeriksaan Fisik Barang 30% (tiga puluh persen); b. dalam hal barang impor dikemas dengan menggunakan Peti Kemas dan jumlah Peti Kemas yang diberitahukan dalam Pemberitahuan Pabean Impor lebih dari 5 (lima) Peti Kemas, tingkat pemeriksaan sebesar:",
DOC206,bn1240-2022.txt,BAB VI,,Pasal 9,1,,"10% (sepuluh persen) dari seluruh jumlah Peti Kemas yang diberitahukan dengan jumlah paling sedikit 1 (satu) Peti Kemas, untuk tingkat Pemeriksaan Fisik Barang 10% (sepuluh persen); atau",
DOC206,bn1240-2022.txt,BAB VI,,Pasal 9,2,,"30% (tiga puluh persen) dari seluruh jumlah Peti Kemas yang diberitahukan dengan jumlah paling sedikit 1 (satu) Peti Kemas, untuk tingkat Pemeriksaan Fisik Barang 30% (tiga puluh persen); atau c. dalam hal barang impor dikemas dalam kemasan dengan tidak menggunakan Peti Kemas, tingkat pemeriksaan sebesar:",
DOC206,bn1240-2022.txt,BAB VI,,Pasal 9,1,,"10% (sepuluh persen) dari seluruh jumlah kemasan yang diberitahukan, untuk tingkat Pemeriksaan Fisik Barang 10% (sepuluh persen); atau",
DOC206,bn1240-2022.txt,BAB VI,,Pasal 9,2,,"30% (tiga puluh persen) dari seluruh jumlah kemasan yang diberitahukan, untuk tingkat Pemeriksaan Fisik Barang 30% (tiga puluh persen). Dalam hal berdasarkan hasil penghitungan tingkat pemeriksaan sebagaimana dimaksud pada ayat (2) huruf a dan huruf c, barang yang diperiksa kurang dari 2 (dua) kemasan, kemasan yang diperiksa paling sedikit 2 (dua) kemasan. Dalam hal Peti Kemas berjumlah 1 (satu) dan terdapat 1 (satu) kemasan, Pemeriksaan Fisik Barang dilakukan terhadap 1 (satu) kemasan tersebut. Dalam hal barang dalam kemasan yang tidak menggunakan Peti Kemas berjumlah 1 (satu), Pemeriksaan Fisik Barang dilakukan terhadap 1 (satu) kemasan tersebut. Pemeriksaan Fisik Barang dapat ditingkatkan menjadi pemeriksaan mendalam untuk mencapai tujuan sebagaimana dimaksud dalam Pasal 3 ayat (2). Pemeriksaan mendalam sebagaimana dimaksud pada ayat (1) dilakukan dalam hal: a. ditemukan jumlah dan/atau jenis barang tidak sesuai dengan dokumen yang digunakan sebagai dasar Pemeriksaan Fisik Barang; b. terdapat indikasi ketidaksesuaian jumlah dan/atau jenis barang dengan dokumen yang digunakan.",
