doc_id,nama_dokumen,bab,bagian,pasal,angka,ayat,isi,penjelasan
DOC194,bn1207-2013.txt,,,,1,,Simbol atau karakter asing yang tidak relevan dan perlu dihapus.,
DOC194,bn1207-2013.txt,,,,2,,Kesalahan ejaan yang perlu diperbaiki agar sesuai dengan ejaan yang benar dalam bahasa Indonesia.,
DOC194,bn1207-2013.txt,,,,3,,"Susunan kata atau kalimat yang tidak sesuai urutan, sehingga perlu disusun kembali agar mudah dipahami dan sesuai dengan struktur aslinya.",
DOC194,bn1207-2013.txt,,,,4,,Tabel yang harus diubah menjadi teks deskriptif tanpa menghilangkan informasi penting. Tugas Anda:,
DOC194,bn1207-2013.txt,,,,1,,Membersihkan dan merapikan teks agar dapat dipahami dengan baik serta mengikuti sistematika baku dalam peraturan perundang-undangan Indonesia.,
DOC194,bn1207-2013.txt,,,,2,,"Menjaga struktur asli dokumen agar tetap utuh dan berurutan, yaitu: - Pembukaan: ""Dengan Rahmat Tuhan Yang Maha Esa"" harus selalu berada di bagian awal dokumen. - Isi pasal-pasal harus tetap terstruktur sesuai format aslinya. - Penutup harus tetap utuh, mencakup tanggal penetapan, nama pejabat, serta berita negara (jika ada).",
DOC194,bn1207-2013.txt,,,,3,,"Jika Anda menemukan bagian yang menyerupai tabel, ubah menjadi teks deskriptif dengan format berikut: - Setiap baris tabel harus dikonversi menjadi kalimat yang jelas dan mengikuti hierarki informasi yang logis. - Jika tabel memiliki kategori utama dan subkategori, gunakan format daftar bullet points untuk menunjukkan hubungan antar kategori. - Nama kolom harus dijadikan referensi dalam penyusunan kalimat. - Tarif bea masuk harus disebutkan secara eksplisit di akhir setiap poin. Contoh konversi dari tabel ke teks deskriptif: Tabel Input (OCR): | POS/SUB POS NO. | HEADING/URAIAN BARANG | DESKRIPSI BARANG | TARIF BEA MASUK | |-----------------|----------------------|------------------|----------------| | 09.01          | Kopi, digongseng atau dihilangkan kafeinnya maupun tidak | Coffee, whether or not roasted or decaffeinated |   | | - Kopi, digongseng: | - Coffee, roasted: | |  | | 0901.21 | Tidak dihilangkan kafeinnya: | - Not decaffeinated: | 20% | | 0901.21.10.00 | Tidak ditumbuk | Unground | 20% | | 0901.21.20.00 | Ditumbuk | Ground | 20% | Output Deskriptif yang Benar: - Kopi (HS Code: 09.01) termasuk kopi yang digongseng atau dihilangkan kafeinnya. - Kopi yang digongseng dan tidak dihilangkan kafeinnya dikenakan tarif bea masuk sebesar 20%, dengan rincian: - Kopi yang tidak ditumbuk dikenakan tarif 20%. - Kopi yang ditumbuk dikenakan tarif 20%. - Kopi yang digongseng dan telah dihilangkan kafeinnya juga dikenakan tarif bea masuk sebesar 20%, dengan rincian: - Kopi yang tidak ditumbuk dikenakan tarif 20%. - Kopi yang ditumbuk dikenakan tarif 20%. Penting: - Pastikan format tetap jelas dan tidak ada informasi yang terbuang. - Gabungkan hasil cleaning ke dalam satu file, tidak perlu pemisahan antara teks biasa dan tabel. - Selesaikan sampai akhir dokumen, tidak perlu memotong atau membuang bagian mana pun dari dokumen maupun memberi output seperti ""(dan seterusnya untuk item lainnya)"". - Jangan memberikan keterangan bahwa dokumen telah dibersihkan. - Pastikan tidak ada format teks yang berantakan terutama jika mengandung barisan karakter seperti '--' atau '|' Hasil yang Diharapkan: Dokumen yang telah diperbaiki harus memiliki struktur yang lengkap, rapi, tidak ada bagian yang hilang, serta tabel yang dikonversi ke dalam teks deskriptif tanpa kehilangan informasi. BERITA NEGARA REPUBLIK INDONESIA No.1207, 2013 KEMENTERIAN PERDAGANGAN. Impor, Produk Tertentu. Perubahan. PERATURAN MENTERI PERDAGANGAN REPUBLIK INDONESIA NOMOR 61/M-DAG/PER/9/2013 TENTANG PERUBAHAN ATAS PERATURAN MENTERI PERDAGANGAN NOMOR 83/M-DAG/PER/12/2012 TENTANG KETENTUAN IMPOR PRODUK TERTENTU DENGAN RAHMAT TUHAN YANG MAHA ESA MENTERI PERDAGANGAN REPUBLIK INDONESIA, bahwa untuk meningkatkan kelancaran arus barang dan efektivitas pelaksanaan serta pengawasan impor produk tertentu, perlu melakukan perubahan terhadap beberapa ketentuan Peraturan Menteri Perdagangan Nomor 83/M-DAG/PER/12/2012 tentang Ketentuan Impor Produk Tertentu; bahwa berdasarkan pertimbangan sebagaimana dimaksud dalam huruf a, perlu menetapkan Peraturan Menteri Perdagangan tentang Perubahan Atas Peraturan Menteri Perdagangan Nomor 83/M-DAG/PER/12/2012 tentang Ketentuan Impor Produk Tertentu;",
DOC194,bn1207-2013.txt,,,,1,,Bedrijfsreglementerings Ordonnantie Tahun 1934 (Staatsblad Tahun 1938 Nomor 86);,
DOC194,bn1207-2013.txt,,,,10,,Keputusan Presiden Nomor 260 Tahun 1967 tentang Penegasan Tugas dan Tanggung Jawab Menteri Perdagangan Dalam Bidang Perdagangan Luar Negeri;,
DOC194,bn1207-2013.txt,,,,11,,Keputusan Presiden Nomor 84/P Tahun 2009 tentang Pembentukan Kabinet Indonesia Bersatu II sebagaimana telah diubah dengan Keputusan Presiden Nomor 59/P Tahun 2011;,
DOC194,bn1207-2013.txt,,,,12,,Peraturan Presiden Nomor 47 Tahun 2009 tentang Pembentukan dan Organisasi Kementerian Negara sebagaimana telah diubah beberapa kali terakhir dengan Peraturan Presiden Nomor 55 Tahun 2013;,
DOC194,bn1207-2013.txt,,,,13,,"Peraturan Presiden Nomor 24 Tahun 2010 tentang Kedudukan, Tugas, dan Fungsi Kementerian Negara serta Susunan Organisasi, Tugas, dan Fungsi Eselon I Kementerian Negara sebagaimana telah diubah beberapa kali terakhir dengan Peraturan Presiden Nomor 56 Tahun 2013;",
DOC194,bn1207-2013.txt,,,,14,,Keputusan Menteri Perindustrian dan Perdagangan Nomor 141/MPP/Kep/3/2002 tentang Nomor Pengenal Importir Khusus (NPIK) sebagaimana telah diubah dengan Peraturan Menteri Perdagangan Nomor 07/M-DAG/PER/3/2008;,
DOC194,bn1207-2013.txt,,,,15,,Peraturan Menteri Perdagangan Nomor 28/M-DAG/PER/6/2009 tentang Ketentuan Pelayanan Perijinan Ekspor dan Impor dengan Sistem Elektronik Melalui INATRADE Dalam Kerangka Indonesia National Single Window;,
DOC194,bn1207-2013.txt,,,,16,,Peraturan Menteri Perdagangan Nomor 54/M-DAG/PER/10/2009 tentang Ketentuan Umum di Bidang Impor;,
DOC194,bn1207-2013.txt,,,,17,,Peraturan Menteri Perdagangan Nomor 31/M-DAG/PER/7/2010 tentang Organisasi dan Tata Kerja Kementerian Perdagangan sebagaimana telah diubah dengan Peraturan Menteri Perdagangan Nomor 57/M-DAG/PER/8/2012;,
DOC194,bn1207-2013.txt,,,,18,,Peraturan Menteri Perdagangan Nomor 18/M-DAG/PER/3/2012 tentang Pendelegasian Wewenang Penerbitan Perijinan Kepada Koordinator dan Pelaksana Unit Pelayanan Perdagangan;,
DOC194,bn1207-2013.txt,,,,19,,Peraturan Menteri Perdagangan Nomor 27/M-DAG/PER/5/2012 tentang Ketentuan Angka Pengenal Importir (API) sebagaimana telah diubah beberapa kali terakhir dengan Peraturan Menteri Perdagangan Nomor 84/M-DAG/PER/12/2012;,
DOC194,bn1207-2013.txt,,,,20,,Peraturan Menteri Perdagangan Nomor 83/M-DAG/PER/12/2012 tentang Ketentuan Impor Produk Tertentu;,
DOC194,bn1207-2013.txt,,,,21,,Peraturan Menteri Perindustrian Nomor 24/M-IND/PER/4/2013 tentang Pemberlakuan Standar Nasional Indonesia (SNI) Mainan Secara Wajib; MENETAPKAN PERATURAN MENTERI PERDAGANGAN TENTANG PERUBAHAN ATAS PERATURAN MENTERI PERDAGANGAN NOMOR 83/M-DAG/PER/12/2012 TENTANG KETENTUAN IMPOR PRODUK TERTENTU. Pasal I Beberapa ketentuan dalam Peraturan Menteri Perdagangan Nomor 83/M-DAG/PER/12/2012 tentang Ketentuan Impor Produk Tertentu diubah sebagai berikut: Ketentuan Pasal 1 angka 4 diubah sehingga Pasal 1 berbunyi sebagai berikut: Dalam Peraturan Menteri ini yang dimaksud dengan:,
DOC194,bn1207-2013.txt,,,Pasal 1,1,,Impor adalah kegiatan memasukkan barang ke dalam daerah pabean.,
DOC194,bn1207-2013.txt,,,Pasal 1,2,,"Produk Tertentu adalah produk yang terkena ketentuan impor berdasarkan Peraturan Menteri ini yang meliputi produk makanan dan minuman, obat tradisional dan suplemen makanan, kosmetik, pakaian jadi, alas kaki, elektronika, dan mainan anak-anak.",
DOC194,bn1207-2013.txt,,,Pasal 1,3,,"Importir Terdaftar Produk Tertentu, yang selanjutnya disebut IT-Produk Tertentu adalah perusahaan yang melakukan kegiatan impor Produk Tertentu.",
DOC194,bn1207-2013.txt,,,Pasal 1,4,,Verifikasi atau penelusuran teknis impor adalah kegiatan pemeriksaan teknis atas Produk Tertentu yang dilakukan oleh surveyor.,
DOC194,bn1207-2013.txt,,,Pasal 1,5,,Surveyor adalah perusahaan survey yang mendapat otorisasi untuk melakukan verifikasi atau penelusuran teknis produk impor.,
DOC194,bn1207-2013.txt,,,Pasal 1,6,,"Unit Pelayanan Perdagangan, yang selanjutnya disingkat UPP adalah unit yang menyelenggarakan pelayanan perijinan di sektor perdagangan.",
DOC194,bn1207-2013.txt,,,Pasal 1,7,,Menteri adalah menteri yang menyelenggarakan urusan pemerintahan di bidang perdagangan.,
DOC194,bn1207-2013.txt,,,Pasal 1,8,,"Direktur Jenderal adalah Direktur Jenderal Perdagangan Luar Negeri, Kementerian Perdagangan.",
DOC194,bn1207-2013.txt,,,Pasal 1,9,,Koordinator dan Pelaksana UPP adalah Pejabat yang ditunjuk oleh Sekretaris Jenderal Kementerian Perdagangan untuk mengoordinasikan dan melaksanakan penyelenggaraan pelayanan perijinan kepada UPP.,
DOC194,bn1207-2013.txt,,,Pasal 1,10,,"Direktur adalah Direktur Impor, Direktorat Jenderal Perdagangan Luar Negeri, Kementerian Perdagangan.",
DOC194,bn1207-2013.txt,,,Pasal 6,,1,"Setiap impor Produk Tertentu oleh IT-Produk Tertentu hanya dapat dilakukan melalui pelabuhan tujuan: a. pelabuhan laut: Belawan di Medan, Tanjung Priok di Jakarta, Tanjung Emas di Semarang, Tanjung Perak di Surabaya, Soekarno Hatta di Makassar, Dumai di Dumai, Jayapura di Jayapura, Tarakan di Tarakan, dan Krueng Geukuh di Aceh Utara; dan/atau b. bandar udara: Kualanamu di Deli Serdang, Soekarno Hatta di Tangerang, Ahmad Yani di Semarang, Juanda di Surabaya, dan Hasanuddin di Makassar.",
DOC194,bn1207-2013.txt,,,Pasal 6,,2,"Impor Produk Tertentu oleh IT-Produk Tertentu yang dilakukan melalui pelabuhan laut Dumai di Dumai, pelabuhan laut Jayapura di Jayapura, dan pelabuhan laut Tarakan di Tarakan hanya untuk produk makanan dan minuman.",
DOC194,bn1207-2013.txt,,,Pasal 6,,3,"Impor Produk Tertentu oleh IT-Produk Tertentu yang dilakukan melalui pelabuhan laut Krueng Geukuh di Aceh Utara hanya untuk produk makanan dan minuman, pakaian jadi, alas kaki, dan elektronika. Ketentuan Pasal 9 ayat (1) diubah sehingga Pasal 9 berbunyi sebagai berikut:",
DOC194,bn1207-2013.txt,,,Pasal 9,,1,"Verifikasi atau penelusuran teknis impor sebagaimana dimaksud dalam Pasal 8 dilakukan terhadap impor Produk Tertentu, meliputi data atau keterangan paling sedikit mengenai: a. Negara dan pelabuhan muat; b. Waktu pengapalan; c. Pelabuhan tujuan; d. Pos Tarif/HS dan uraian barang; e. Nomor Sertifikasi Produk Penggunaan Tanda SNI (SPPT SNI) untuk Produk Tertentu yang SNI-nya diberlakukan secara wajib; dan f. Nomor Certificate of Analysis (CoA) untuk Produk Tertentu yang dipersyaratkan.",
DOC194,bn1207-2013.txt,,,Pasal 9,,2,Hasil verifikasi atau penelusuran teknis impor sebagaimana dimaksud pada ayat (1) dituangkan dalam bentuk Laporan Surveyor (LS) untuk digunakan sebagai dokumen pelengkap pabean dalam penyelesaian kepabeanan di bidang impor.,
DOC194,bn1207-2013.txt,,,Pasal 9,,3,"Atas pelaksanaan verifikasi atau penelusuran teknis impor sebagaimana dimaksud pada ayat (1), Surveyor memungut imbalan jasa dari IT-Produk Tertentu, yang besarannya ditentukan dengan memperhatikan azas manfaat.",
DOC194,bn1207-2013.txt,,,Pasal 12,,1,Perusahaan yang telah mendapatkan penetapan sebagai IT-Produk Tertentu wajib menyampaikan laporan secara tertulis atas pelaksanaan impor Produk Tertentu melalui http://inatrade.kemendag.go.id.,
DOC194,bn1207-2013.txt,,,Pasal 12,,2,Penyampaian laporan sebagaimana dimaksud pada ayat (1) dilakukan dalam hal importasinya terealisasi atau tidak terealisasi.,
DOC194,bn1207-2013.txt,,,Pasal 12,,3,"Laporan sebagaimana dimaksud pada ayat (1) disampaikan setiap 3 (tiga) bulan paling lambat tanggal 15 (lima belas) triwulan berikutnya kepada Koordinator dan Pelaksana UPP, dan Direktur.",
DOC194,bn1207-2013.txt,,,Pasal 19,,1,"Ketentuan dalam Peraturan Menteri ini tidak berlaku terhadap impor: a. Produk Tertentu yang tercakup dalam Pasal 25 ayat (1) dan Pasal 26 ayat (1) Undang-Undang Nomor 10 Tahun 1995 tentang Kepabeanan sebagaimana telah diubah dengan Undang-Undang Nomor 17 Tahun 2006; b. Produk Tertentu pakaian jadi berupa barang kiriman paling banyak 10 (sepuluh) pieces per pengiriman dan barang pribadi penumpang atau awak sarana pengangkut yang bernilai paling banyak FOB US$ 1.000,00 (seribu dolar Amerika) per orang, dengan menggunakan pesawat udara; c. Produk Tertentu elektronika berupa barang kiriman paling banyak 2 (dua) unit per pengiriman dan barang pribadi penumpang atau awak sarana pengangkut yang bernilai paling banyak FOB US$ 1.500,00 (seribu lima ratus dolar Amerika) per orang, dengan menggunakan pesawat udara; d. Produk Tertentu selain sebagaimana dimaksud pada huruf b dan c berupa barang kiriman atau barang pribadi penumpang atau awak sarana pengangkut yang bernilai paling banyak FOB US$ 1.500,00 (seribu lima ratus dolar Amerika) per orang, dengan menggunakan pesawat udara; e. Produk Tertentu untuk keperluan kegiatan operasi hulu minyak dan gas bumi, panas bumi dan mineral serta sektor energi lainnya; f. Produk Tertentu yang diimpor oleh importir produsen yang digunakan sebagai barang modal dan/atau bahan baku yang terkait dengan industrinya; dan g. Produk Tertentu yang bersifat impor sementara.",
DOC194,bn1207-2013.txt,,,Pasal 19,,2,"Impor Produk Tertentu sebagaimana dimaksud pada ayat (1) huruf b, huruf c, dan huruf d yang melebihi jumlah dan/atau nilai yang ditentukan, terhadap kelebihan jumlah dan/atau nilai Produk Tertentu dikenakan sanksi sebagaimana dimaksud dalam Pasal 18. Di antara Pasal 22 dan Pasal 23 disisipkan 1 (satu) pasal, yakni Pasal 22A sehingga berbunyi sebagai berikut: Pengecualian dari ketentuan yang diatur dalam Peraturan Menteri ini ditetapkan oleh Menteri. Di antara Pasal 23 dan Pasal 24 disisipkan 1 (satu) pasal, yakni Pasal 23A sehingga berbunyi sebagai berikut:",
DOC194,bn1207-2013.txt,,,Pasal 23,,1,LS sebagai dokumen pelengkap pabean dalam penyelesaian kepabeanan di bidang impor sebagaimana dimaksud dalam Pasal 9 ayat (2) untuk kosmetik mulai berlaku pada tanggal 1 Januari 2014.,
DOC194,bn1207-2013.txt,,,Pasal 23,,2,"LS sebagaimana dimaksud pada ayat (1) dibuktikan dengan dokumen pabean berupa manifest (BC.1.1). Lampiran Peraturan Menteri Perdagangan Nomor 83/M-DAG/PER/12/2012 tentang Ketentuan Impor Produk Tertentu diubah sehingga menjadi sebagaimana tercantum dalam Lampiran yang merupakan bagian tidak terpisahkan dari Peraturan Menteri ini. Pasal II Peraturan Menteri ini mulai berlaku pada tanggal diundangkan. Agar setiap orang mengetahuinya, memerintahkan pengundangan Peraturan Menteri ini dengan penempatannya dalam Berita Negara Republik Indonesia. MENTERI PERDAGANGAN REPUBLIK INDONESIA, GITA IRAWAN WIRJAWAN Diundangkan di Jakarta pada tanggal 7 Oktober 2013 MENTERI HUKUM DAN HAK ASASI MANUSIA REPUBLIK INDONESIA AMIR SYAMSUDIN",
