doc_id,nama_dokumen,bab,bagian,pasal,angka,ayat,isi,penjelasan
DOC234,bn1403-2013.txt,,,,4,,"Peraturan Presiden Nomor 24 Tahun 2010 tentang Kedudukan, Tugas, dan Fungsi Kementerian Negara Serta Susunan Organisasi, Tugas, dan Fungsi Eselon I Kementerian Negara sebagaimana telah beberapa kali diubah terakhir dengan Peraturan Presiden Nomor 56 Tahun 2013;",
DOC234,bn1403-2013.txt,,,,5,,Surat Keputusan Menteri Penerangan Nomor 215/KEP/MENPEN/1994 tentang Ketentuan dan Tata Cara Penyelenggaraan Usaha Perfilman sebagaimana telah diubah dengan Surat Keputusan Menteri Penerangan Nomor 21A/KEP/MENPEN/1998;,
DOC234,bn1403-2013.txt,,,,6,,"Peraturan Menteri Kebudayaan dan Pariwisata Nomor PM.55/PW.204/MKP/2008 tentang Pemanfaatan Jasa Teknik Film Dalam Negeri Dalam Kegiatan Pembuatan dan Penggandaan Film Nasional serta Penggandaan Film Impor sebagaimana telah beberapa kali diubah terakhir dengan Peraturan Menteri Pariwisata dan Ekonomi Kreatif Nomor PM.141/PW.204/MPEK/2012; Menetapkan: PERATURAN MENTERI PARIWISATA DAN EKONOMI KREATIF TENTANG PERUBAHAN KELIMA ATAS PERATURAN MENTERI KEBUDAYAAN DAN PARIWISATA NOMOR PM.55/PW.204/MKP/2008 TENTANG PEMANFAATAN JASA TEKNIK FILM DALAM NEGERI DALAM KEGIATAN PEMBUATAN DAN PENGGANDAAN FILM NASIONAL SERTA PENGGANDAAN FILM IMPOR. Pasal I Ketentuan Pasal 13 ayat (2) Peraturan Menteri Kebudayaan dan Pariwisata Nomor PM.55/PW.204/MKP/2008 Tentang Pemanfaatan Jasa Teknik Film Dalam Negeri Dalam Kegiatan Pembuatan Dan Penggandaan Film Nasional Serta Penggandaan Film Impor, yang telah beberapa kali diubah dengan:",
DOC234,bn1403-2013.txt,,,,1,,Peraturan Menteri Kebudayaan dan Pariwisata PM.11/PW.204/MKP/2009;,
DOC234,bn1403-2013.txt,,,,2,,Peraturan Menteri Kebudayaan dan Pariwisata PM.27/PW.204/MKP/2010;,
DOC234,bn1403-2013.txt,,,,3,,Peraturan Menteri Pariwisata dan Ekonomi Kreatif PM.108/PW.204/MPEK/2011;,
DOC234,bn1403-2013.txt,,,,4,,Peraturan Menteri Pariwisata dan Ekonomi Kreatif PM.141/PW.204/MPEK/2012; diubah sehingga berbunyi sebagai berikut:,
DOC234,bn1403-2013.txt,,,Pasal 13,,2,"Peraturan Menteri ini mulai berlaku pada tanggal 1 Januari 2015. Pasal II Peraturan Menteri ini mulai berlaku pada tanggal diundangkan. Agar setiap orang mengetahuinya, memerintahkan pengundangan Peraturan Menteri ini dengan penempatannya dalam Berita Negara Republik Indonesia. MENTERI PARIWISATA DAN EKONOMI KREATIF REPUBLIK INDONESIA, MARI ELKA PANGESTU Diundangkan di Jakarta pada tanggal 28 November 2013 MENTERI HUKUM DAN HAK ASASI MANUSIA REPUBLIK INDONESIA, AMIR SYAMSUDIN",
