doc_id,nama_dokumen,bab,bagian,pasal,angka,ayat,isi,penjelasan
DOC290,bn175-2017.txt,,,,1,,"Ban adalah bagian penting dari kendaraan yang diproduksi dari campuran karet alam dan/atau karet sintetis yang terpasang dan/atau tidak terpasang pada pelek yang termasuk dalam pos HS 4011, 4013, dan 8708.",
DOC290,bn175-2017.txt,,,,2,,Rekomendasi Persetujuan Impor Ban adalah surat yang memuat keterangan teknis untuk merekomendasikan persetujuan impor ban.,
DOC290,bn175-2017.txt,,,,3,,Rekomendasi Perubahan Persetujuan Impor Ban adalah surat yang memuat perubahan keterangan teknis untuk merekomendasikan perubahan terhadap persetujuan impor ban yang masih berlaku.,
DOC290,bn175-2017.txt,,,,4,,Sertifikat Produk Penggunaan Tanda Standar Nasional Indonesia (SPPT-SNI) Ban adalah Sertifikat Produk yang dikeluarkan oleh Lembaga Sertifikasi Produk kepada produsen ban yang mampu menghasilkan produk ban sesuai persyaratan SNI.,
DOC290,bn175-2017.txt,,,,5,,Importir Produsen adalah perusahaan pemegang Angka Pengenal Importir Produsen (API-P) yang melakukan importasi ban untuk digunakan dalam kegiatan usahanya dan tidak untuk diperdagangkan dan/atau dipindahtangankan.,
DOC290,bn175-2017.txt,,,,6,,Importir Umum adalah perusahaan berbadan hukum pemegang Angka Pengenal Importir Umum (API-U) yang melakukan kegiatan importasi ban ke dalam daerah pabean Indonesia untuk diperdagangkan.,
DOC290,bn175-2017.txt,,,,7,,Verifikasi adalah proses pemeriksaan kebenaran dokumen persyaratan permohonan Rekomendasi Persetujuan Impor Ban atau Rekomendasi Perubahan Persetujuan Impor Ban.,
DOC290,bn175-2017.txt,,,,8,,Direktur Jenderal adalah direktur jenderal yang melakukan pembinaan atas industri ban di Kementerian Perindustrian.,
DOC290,bn175-2017.txt,,,,9,,Direktur adalah direktur yang melakukan pembinaan atas industri ban di Kementerian Perindustrian. **Pasal 2**,
DOC290,bn175-2017.txt,,,,9,1,Importasi atas ban dilakukan setelah memperoleh persetujuan impor dari kementerian yang menyelenggarakan urusan pemerintahan di bidang perdagangan.,
DOC290,bn175-2017.txt,,,,9,2,Persetujuan impor sebagaimana dimaksud pada ayat (1) diberikan berdasarkan Rekomendasi Persetujuan Impor Ban yang diterbitkan oleh Direktur Jenderal.,
DOC290,bn175-2017.txt,,,,9,3,Importasi atas ban sebagaimana dimaksud pada ayat (1) dapat dilakukan oleh: a. Importir Produsen; atau b. Importir Umum. **Pasal 3** Pemberian Rekomendasi Persetujuan Impor Ban sebagaimana dimaksud dalam Pasal 2 ayat (2) dilakukan berdasarkan: a. kebutuhan dalam negeri; b. kinerja masa lalu dari pemohon; dan/atau c. rencana pengembangan usaha perusahaan importir. **Pasal 4**,
DOC290,bn175-2017.txt,,,,9,1,Rekomendasi Persetujuan Impor Ban sebagaimana dimaksud dalam Pasal 2 ayat (2) diberikan berdasarkan permohonan dari Importir Produsen atau Importir Umum.,
DOC290,bn175-2017.txt,,,,9,2,Permohonan sebagaimana dimaksud pada ayat (1) ditujukan kepada Direktur Jenderal dengan menggunakan formulir sebagaimana tercantum dalam Lampiran II yang merupakan bagian tidak terpisahkan dari Peraturan Menteri ini.,
DOC290,bn175-2017.txt,,,,9,3,"Permohonan yang disampaikan oleh Importir Produsen sebagaimana dimaksud pada ayat (1) wajib dilengkapi dengan: a. fotokopi akta pendirian perusahaan; b. fotokopi Izin Usaha Industri (IUI) atau izin usaha sejenis; c. fotokopi Nomor Pokok Wajib Pajak (NPWP); d. fotokopi Angka Pengenal Importir Produsen (API-P); e. fotokopi SPPT-SNI, dalam hal ban yang diimpor merupakan ban yang diberlakukan SNI wajib; dan f. daftar isian dengan menggunakan format sebagaimana tercantum dalam Lampiran II yang merupakan bagian yang tidak terpisahkan dari Peraturan Menteri ini.",
DOC290,bn175-2017.txt,,,,9,4,"Permohonan yang disampaikan oleh Importir Umum sebagaimana dimaksud pada ayat (1) wajib dilengkapi dengan: a. fotokopi akta pendirian perusahaan; b. fotokopi Surat Izin Usaha Perdagangan (SIUP); c. fotokopi NPWP; d. fotokopi Angka Pengenal Importir Umum (API-U); e. surat penunjukan dari prinsipal pemegang merek atau pabrik di luar negeri yang disahkan oleh notaris publik dan atase perdagangan negara setempat; f. fotokopi SPPT-SNI, dalam hal ban yang diimpor merupakan ban yang diberlakukan SNI wajib; dan g. daftar isian dengan menggunakan format sebagaimana tercantum dalam Lampiran II yang merupakan bagian tidak terpisahkan dari Peraturan Menteri ini. **Pasal 5** Permohonan sebagaimana dimaksud dalam Pasal 4 disampaikan kepada Direktur Jenderal melalui Unit Pelayanan Publik (UP2) Kementerian Perindustrian. Terhadap permohonan yang lengkap, UP2 menyampaikan berkas permohonan kepada Direktur Jenderal dalam jangka waktu 1 (satu) hari kerja sejak permohonan yang lengkap diterima. **Pasal 6** Direktur Jenderal melakukan verifikasi atas kebenaran dari permohonan yang disampaikan sebagaimana dimaksud dalam Pasal 5 ayat (2).",
DOC290,bn175-2017.txt,,,,9,1,"Dalam melakukan verifikasi sebagaimana dimaksud pada ayat (1), Direktur Jenderal dapat memerintahkan Direktur untuk melakukan pemeriksaan lapangan.",
DOC290,bn175-2017.txt,,,,9,2,"Dalam menentukan pemberian Rekomendasi Persetujuan Impor Ban, Direktur Jenderal dapat berkoordinasi dengan lembaga terkait atau asosiasi pelaku usaha. **Pasal 7** Terhadap permohonan yang lengkap dan benar, Direktur Jenderal menerbitkan Rekomendasi Persetujuan Impor Ban dengan format sebagaimana tercantum dalam Lampiran II yang merupakan bagian tidak terpisahkan dari Peraturan Menteri ini dalam jangka waktu 5 (lima) hari kerja setelah penyampaian permohonan sebagaimana dimaksud dalam Pasal 5 ayat (2). Rekomendasi Persetujuan Impor Ban sebagaimana dimaksud pada ayat (2) berlaku untuk jangka waktu 6 (enam) bulan sejak tanggal diterbitkan. Rekomendasi Persetujuan Impor Ban sebagaimana dimaksud pada ayat (2) digunakan untuk 1 (satu) kali pengajuan persetujuan impor. **Pasal 8**",
DOC290,bn175-2017.txt,,,,9,1,"Permohonan... **Penutup** Demikian, atas perhatian dan kerjasama Saudara kami sampaikan terima kasih. Tanggal: 20... Nama dan tanda tangan: MENTERI PERINDUSTRIAN REPUBLIK INDONESIA, ttd. AIRLANGGA HARTARTO BERITA NEGARA REPUBLIK INDONESIA No. 175, 2017. Dengan Rahmat Tuhan Yang Maha Esa a. bahwa untuk meningkatkan pengawasan dan pengendalian terhadap impor Ban, perlu diterbitkan Rekomendasi Persetujuan Impor Ban; b. bahwa penerbitan Rekomendasi Persetujuan Impor Ban harus dilakukan sesuai dengan ketentuan peraturan perundang-undangan yang berlaku; c. bahwa berdasarkan pertimbangan sebagaimana dimaksud dalam huruf a dan b, perlu menetapkan Peraturan Menteri tentang Rekomendasi Persetujuan Impor Ban. a. Undang-Undang Nomor 17 Tahun 2006 tentang Perdagangan; b. Undang-Undang Nomor 20 Tahun 2014 tentang Standardisasi dan Penilaian Kesesuaian; c. Peraturan Pemerintah Nomor 31 Tahun 2007 tentang Kebijakan Impor; d. Peraturan Menteri Perindustrian Nomor 67/M-IND/PER/8/2016 tentang Pedoman Penerbitan Pertimbangan Teknis, Rekomendasi, Surat Keterangan, dan Tanda Pendaftaran dengan Sistem Elektronik di Kementerian Perindustrian. Menetapkan: Peraturan Menteri tentang Rekomendasi Persetujuan Impor Ban.",
DOC290,bn175-2017.txt,,,Pasal 8,,1,Penerbitan Rekomendasi Persetujuan Impor Ban ditolak dalam hal: a. dokumen pendukung tidak benar; b. terdapat ketidaksesuaian antara dokumen permohonan dengan ketentuan peraturan perundang-undangan atau hasil klarifikasi; dan/atau c. dasar penetapan alokasi impor sebagaimana dimaksud dalam Pasal 3.,
DOC290,bn175-2017.txt,,,Pasal 8,,2,Penolakan penerbitan Rekomendasi Persetujuan Impor Ban sebagaimana dimaksud pada ayat (1) dilakukan oleh Direktur dalam jangka waktu 5 (lima) hari kerja setelah penyampaian permohonan sebagaimana dimaksud dalam Pasal 5 ayat (2).,
DOC290,bn175-2017.txt,,,Pasal 10,,1,Pemohon yang telah mendapatkan Rekomendasi Persetujuan Impor Ban dan telah memperoleh persetujuan impor Ban dapat mengajukan perubahan atas persetujuan impor Ban yang telah dimiliki.,
DOC290,bn175-2017.txt,,,Pasal 10,,2,"Dalam hal perubahan atas persetujuan impor dilakukan sehubungan dengan perubahan pos tarif, jenis Ban, jumlah Ban, negara asal dan pelabuhan muat, dan/atau pelabuhan tujuan impor, perubahan atas persetujuan impor diberikan berdasarkan Rekomendasi Perubahan Persetujuan Impor Ban yang diterbitkan oleh Direktur Jenderal. Permohonan atas Rekomendasi Perubahan Persetujuan Impor Ban sebagaimana dimaksud dalam Pasal 10 ayat (2) disampaikan dengan mengirimkan surat permohonan perubahan Rekomendasi yang ditujukan kepada Direktur Jenderal dengan melampirkan: a. persetujuan impor yang akan diubah; b. Kartu Kendali Impor; dan c. dokumen yang mengalami perubahan. Ketentuan penyampaian permohonan dan penerbitan Rekomendasi Persetujuan Impor Ban atau surat penolakan sebagaimana dimaksud dalam Pasal 5 sampai dengan Pasal 9 berlaku secara mutatis mutandis terhadap penerbitan atau penolakan Rekomendasi Perubahan Persetujuan Impor Ban. Rekomendasi Perubahan Persetujuan Impor Ban berlaku hingga berakhirnya masa berlaku persetujuan impor Ban yang diubah. Rekomendasi Perubahan Persetujuan Impor Ban hanya dapat diberikan 1 (satu) kali untuk masing-masing persetujuan impor Ban. Direktur Jenderal melakukan pengawasan terhadap pelaksanaan importasi Ban sesuai dengan Rekomendasi Persetujuan Impor Ban atau Rekomendasi Perubahan Persetujuan Impor Ban yang diterbitkan. Pengawasan sebagaimana dimaksud pada ayat (1) dilakukan 1 (satu) kali dalam 1 (satu) tahun dan/atau sewaktu-waktu apabila diperlukan. Apabila berdasarkan hasil pengawasan sebagaimana dimaksud dalam Pasal 13 ditemukan pelanggaran yang dilakukan oleh perusahaan pemilik Rekomendasi Persetujuan Impor Ban, Direktur Jenderal dapat menolak penerbitan Rekomendasi Persetujuan Impor Ban atau Rekomendasi Perubahan Persetujuan Impor Ban berikutnya. Pengenaan sanksi sebagaimana dimaksud pada ayat (1) tidak menghapuskan pengenaan sanksi lain sesuai dengan ketentuan peraturan perundang-undangan. Peraturan Menteri ini mulai berlaku pada tanggal diundangkan. Agar setiap orang mengetahuinya, memerintahkan pengundangan Peraturan Menteri ini dengan penempatannya dalam Berita Negara Republik Indonesia. MENTERI PERINDUSTRIAN REPUBLIK INDONESIA, ttd AIRLANGGA HARTARTO Diundangkan di Jakarta pada tanggal 27 Januari 2017 DIREKTUR JENDERAL PERATURAN PERUNDANG-UNDANGAN KEMENTERIAN HUKUM DAN HAK ASASI MANUSIA REPUBLIK INDONESIA, ttd WIDODO EKATJAHJANA",
