doc_id,nama_dokumen,bab,bagian,pasal,angka,ayat,isi,penjelasan
DOC319,bn195-2012.txt,,,,3,,Peraturan Presiden Nomor 47 Tahun 2009 tentang Pembentukan dan Organisasi Kementerian Negara sebagaimana telah diubah dengan Peraturan Presiden Republik Indonesia Nomor 76 Tahun 2011;,
DOC319,bn195-2012.txt,,,,4,,"Peraturan Presiden Nomor 24 Tahun 2010 tentang Kedudukan, Tugas, dan Fungsi Kementerian Negara serta Susunan Organisasi, Tugas, dan Fungsi Eselon I Kementerian Negara;",
DOC319,bn195-2012.txt,,,,5,,Keputusan Presiden Nomor 84/P Tahun 2009 tentang Pembentukan Kabinet Indonesia Bersatu II Periode Tahun 2009-2014 sebagaimana telah diubah dengan Keputusan Presiden Republik Indonesia Nomor 59/P Tahun 2011;,
DOC319,bn195-2012.txt,,,,6,,Peraturan Menteri Perindustrian Nomor 105/M-IND/PER/10/2010 tentang Organisasi dan Tata Kerja Kementerian Perindustrian;,
DOC319,bn195-2012.txt,,,,7,,Peraturan Menteri Perindustrian Nomor 64/M-IND/PER/7/2011 tentang Jenis-Jenis Industri Dalam Pembinaan Direktorat Jenderal dan Badan di Lingkungan Kementerian Perindustrian;,
DOC319,bn195-2012.txt,,,,8,,Peraturan Menteri Perdagangan Nomor 48/M-DAG/PER/12/2011 tentang Ketentuan Impor Barang Modal Bukan Baru; Menetapkan: PERATURAN MENTERI PERINDUSTRIAN TENTANG KETENTUAN PEMBERIAN REKOMENDASI ATAS IMPOR BARANG MODAL BUKAN BARU. Dalam Peraturan Menteri ini yang dimaksud dengan:,
DOC319,bn195-2012.txt,,,Pasal 1,1,,Perusahaan rekondisi adalah perusahaan yang telah memiliki Izin Usaha Industri rekondisi untuk memproses barang modal bukan baru menjadi produk akhir untuk tujuan ekspor dan/atau memenuhi pesanan perusahaan pemakai langsung dalam negeri.,
DOC319,bn195-2012.txt,,,Pasal 1,2,,Perusahaan remanufakturing adalah perusahaan yang telah memiliki Izin Usaha Industri remanufakturing (termasuk dalam KBLI 28240) untuk memproses komponen alat berat bukan baru menjadi produk akhir yang sesuai dengan spesifikasi teknis setara produk baru dan digaransi oleh pemegang merek untuk tujuan ekspor dan/atau memenuhi pesanan perusahaan pemakai langsung dalam negeri.,
DOC319,bn195-2012.txt,,,Pasal 1,3,,"Perusahaan pemakai langsung adalah perusahaan yang telah memiliki izin usaha yang mengimpor barang modal bukan baru untuk keperluan proses produksinya atau digunakan sendiri oleh perusahaan yang bersangkutan untuk keperluan lainnya, tidak untuk diperdagangkan.",
DOC319,bn195-2012.txt,,,Pasal 1,4,,"Barang modal bukan baru adalah barang, mesin, dan/atau alat yang digunakan sebagai modal usaha atau untuk menghasilkan sesuatu, yang masih layak pakai, atau untuk direkondisi, remanufakturing, digunakan kembali dan bukan skrap.",
DOC319,bn195-2012.txt,,,Pasal 1,5,,"Izin Usaha Industri adalah izin yang diberikan kepada industri/perusahaan untuk melakukan kegiatan industri, yang dikeluarkan oleh instansi berwenang sesuai dengan ketentuan perundang-undangan.",
DOC319,bn195-2012.txt,,,Pasal 1,6,,"Rekomendasi adalah surat yang menjelaskan bahwa: a. Perusahaan rekondisi dan perusahaan remanufakturing mampu untuk memproses barang modal bukan baru menjadi produk akhir untuk tujuan ekspor dan/atau untuk memenuhi pesanan perusahaan pemakai langsung dalam negeri; b. Perusahaan pemakai langsung yang mengimpor barang modal bukan baru dengan Pos Tarif 8901, 8902, 8903, 8904, dan 8905 yang usianya di atas 20 tahun, layak menggunakan/mengimpor barang tersebut untuk kegiatan usahanya; atau c. Perusahaan pemakai langsung yang mengimpor barang modal bukan baru dalam rangka pengembangan ekspor dan investasi, kegiatan relokasi industri (bedol pabrik), pembangunan infrastruktur, dan untuk tujuan ekspor. d. Perusahaan rekondisi yang mengimpor barang modal bukan baru dengan pos tarif 8408, 8511, 8701.20, 8704, 8705, 8706, 8707, 8708, 8716 untuk keperluan otomotif dalam rangka tujuan ekspor, pengembangan investasi dan pembangunan infrastruktur.",
DOC319,bn195-2012.txt,,,Pasal 1,7,,Pengembangan ekspor adalah peningkatan kemampuan perusahaan industri untuk mengekspor hasil produksinya.,
DOC319,bn195-2012.txt,,,Pasal 1,8,,Investasi adalah segala bentuk kegiatan penanaman modal oleh investor dalam negeri dan/atau asing untuk melakukan usaha di wilayah Negara Kesatuan Republik Indonesia.,
DOC319,bn195-2012.txt,,,Pasal 1,9,,Relokasi industri adalah pemindahan sebagian atau seluruh mesin dan peralatan dari pabrik di luar negeri ke wilayah Negara Kesatuan Republik Indonesia untuk difungsikan kembali dalam kegiatan produksi.,
DOC319,bn195-2012.txt,,,Pasal 1,10,,"Pembangunan infrastruktur adalah pembangunan sistem fisik yang terkait dengan penyediaan transportasi, air, bangunan, dan fasilitas publik lain yang diperlukan untuk memenuhi kebutuhan dasar manusia secara ekonomi dan sosial.",
DOC319,bn195-2012.txt,,,Pasal 1,11,,"Kemampuan rekondisi adalah kapasitas produksi perusahaan rekondisi, termasuk fasilitas mesin dan peralatannya sesuai dengan hasil penilaian teknis layak dan mampu untuk melakukan usaha jasa pemulihan dan perbaikan serta dapat memproses barang modal bukan baru menjadi produk akhir, termasuk kemampuan pelayanan purna jual.",
DOC319,bn195-2012.txt,,,Pasal 1,12,,"Kemampuan remanufakturing adalah kapasitas produksi perusahaan remanufakturing, termasuk fasilitas mesin dan peralatannya sesuai dengan hasil penilaian teknis layak dan mampu untuk melakukan usaha jasa pemulihan dan perbaikan serta dapat memproses komponen alat berat bukan baru menjadi produk akhir yang sesuai dengan spesifikasi teknis setara produk baru dan digaransi oleh pemegang merek, termasuk kemampuan pelayanan purna jual.",
DOC319,bn195-2012.txt,,,Pasal 1,13,,"Kemampuan Pelayanan Purna Jual adalah kemampuan perusahaan rekondisi atau perusahaan remanufakturing untuk memberikan: a. Pelayanan purna jual masa garansi berupa jaminan pemeriksaan, perbaikan dan/atau penggantian bila barang hasil rekondisi/remanufakturing tidak berfungsi; dan b. Pelayanan purna jual pasca garansi berupa jaminan perawatan berkala, perbaikan, penggantian dan ketersediaan komponen dari barang hasil rekondisi/remanufakturing.",
DOC319,bn195-2012.txt,,,Pasal 1,14,,"Survey Kemampuan Perusahaan rekondisi dan perusahaan remanufakturing adalah kegiatan penilaian terhadap kemampuan perusahaan rekondisi dan perusahaan remanufakturing, termasuk kemampuan pelayanan purna jual.",
DOC319,bn195-2012.txt,,,Pasal 1,15,,Direktur Jenderal IUBTT adalah Direktur Jenderal Industri Unggulan Berbasis Teknologi Tinggi.,
DOC319,bn195-2012.txt,,,Pasal 1,16,,"Direktorat/Direktur pembina industri adalah Direktorat/Direktur Industri Permesinan dan Alat Mesin Pertanian, Direktorat/Direktur Industri Elektronika dan Telematika, Direktorat/Direktur Industri Maritim Kedirgantaraan dan Alat Pertahanan, dan Direktorat/Direktur Industri Alat Transportasi Darat.",
DOC319,bn195-2012.txt,,,Pasal 2,,1,"Perusahaan yang dapat mengimpor barang modal bukan baru dengan rekomendasi meliputi: a. Perusahaan rekondisi dan perusahaan remanufakturing, yang mengimpor barang modal bukan baru sebagaimana tercantum dalam Lampiran Peraturan Menteri Perdagangan Nomor 48/M-DAG/PER/12/2011, yang bukan merupakan Pos Tarif/HS 8901, 8902, 8903, 8904, dan 8905; b. Perusahaan pemakai langsung yang bergerak di bidang usaha angkutan dan/atau usaha lainnya di perairan yang mengimpor barang modal bukan baru dengan Pos Tarif/HS 8901, 8902, 8903, 8904, dan 8905 yang berusia di atas 20 (dua puluh) tahun sebagaimana tercantum dalam Lampiran Peraturan Menteri Perdagangan Nomor 48/M-DAG/PER/12/2011; c. Perusahaan pemakai langsung yang mengimpor barang modal bukan baru yang tidak tercantum dalam Lampiran Peraturan Menteri Perdagangan Nomor 48/M-DAG/PER/12/2011 dengan tujuan:",
DOC319,bn195-2012.txt,,,Pasal 2,1,,pengembangan ekspor dan investasi;,
DOC319,bn195-2012.txt,,,Pasal 2,2,,relokasi industri (bedol pabrik);,
DOC319,bn195-2012.txt,,,Pasal 2,3,,pembangunan infrastruktur; atau,
DOC319,bn195-2012.txt,,,Pasal 2,4,,"untuk re-ekspor; atau d. Perusahaan rekondisi yang mengimpor barang modal bukan baru dengan Pos Tarif 8701.20, 8704, 8705, 8706, 8707, 8708, 8716 untuk keperluan otomotif yang tidak tercantum dalam Lampiran Peraturan Menteri Perdagangan Nomor 48/M-DAG/PER/12/2011 dengan tujuan untuk re-ekspor.",
DOC319,bn195-2012.txt,,,Pasal 2,4,2,"Pemberian rekomendasi sebagaimana dimaksud pada huruf a sampai dengan huruf d diatur lebih lanjut dengan Peraturan Direktur Jenderal IUBTT. Barang modal bukan baru sebagaimana dimaksud dalam Pasal 2 huruf a dengan Pos Tarif/HS 84 dan 85, huruf c, dan huruf d harus berusia maksimal 20 (dua puluh) tahun, kecuali untuk Pos Tarif/HS 8471.41.10.00 dan 8531.20.00.00 berusia maksimal 5 (lima) tahun dengan spesifikasi minimum Pentium 4 dan di kawasan berikat.",
DOC319,bn195-2012.txt,,,Pasal 4,,1,"Setiap perusahaan rekondisi, perusahaan remanufakturing atau perusahaan pemakai langsung sebagaimana dimaksud dalam Pasal 2 yang akan melakukan impor barang modal bukan baru wajib memiliki rekomendasi dari Kementerian Perindustrian.",
DOC319,bn195-2012.txt,,,Pasal 4,,2,"Rekomendasi sebagaimana dimaksud pada ayat (1) diberikan kepada: a. Perusahaan rekondisi dan perusahaan remanufakturing yang mengimpor barang modal bukan baru dengan mempertimbangkan kemampuan rekondisi, kemampuan remanufakturing, dan pelayanan purna jual dikaitkan dengan aspek pengembangan industri yang mencakup kemampuan atau kondisi dalam negeri; b. Perusahaan pemakai langsung yang mengimpor barang modal bukan baru dengan Pos Tarif/HS 8901, 8902, 8903, 8904, dan 8905 yang berusia lebih dari 20 (dua puluh) tahun, dengan mempertimbangkan kemampuan produksi dalam negeri; c. Perusahaan pemakai langsung yang mengimpor barang modal bukan baru yang tidak tercantum dalam Lampiran Peraturan Menteri Perdagangan Nomor 48/M-DAG/PER/12/2011 dengan mempertimbangkan kemampuan produksi dalam negeri; dan d. Perusahaan rekondisi yang mengimpor barang modal bukan baru dengan pos tarif 8701.20, 8704, 8705, 8706, 8707, 8708, 8716 untuk keperluan otomotif yang tidak tercantum dalam Lampiran Peraturan Menteri Perdagangan Nomor 48/M-DAG/PER/12/2011 dengan mempertimbangkan kemampuan produksi dalam negeri.",
DOC319,bn195-2012.txt,,,Pasal 4,,3,Penilaian kemampuan rekondisi dan kemampuan remanufakturing sebagaimana dimaksud pada ayat (2) huruf a dan huruf d dilakukan oleh surveyor independen yang memiliki surat izin usaha jasa survey dan menjadi anggota IFIA (International Federation of Inspection Agency).,
DOC319,bn195-2012.txt,,,Pasal 4,,4,Rekomendasi sebagaimana dimaksud pada ayat (2) diterbitkan oleh: a. Direktur Pembina industri bagi perusahaan rekondisi dan perusahaan remanufakturing sebagaimana dimaksud pada ayat (2) huruf a; dan b. Direktur Jenderal IUBTT bagi:,
DOC319,bn195-2012.txt,,,Pasal 4,1,,Perusahaan pemakai langsung sebagaimana dimaksud pada ayat (2) huruf b dan huruf c; serta,
DOC319,bn195-2012.txt,,,Pasal 4,2,,Perusahaan rekondisi sebagaimana dimaksud pada ayat (2) huruf d. Permohonan rekomendasi sebagaimana dimaksud dalam Pasal 4 disampaikan kepada Direktur Pembina industri atau Direktur Jenderal IUBTT melalui Unit Pelayanan Publik Kementerian Perindustrian dengan ketentuan bagi: a. Perusahaan rekondisi dan perusahaan remanufakturing sebagaimana dimaksud pada ayat (2) huruf a melampirkan dokumen sebagai berikut:,
DOC319,bn195-2012.txt,,,Pasal 5,1,,Salinan Izin Usaha Industri yang kegiatan usahanya melakukan rekondisi atau remanufakturing;,
DOC319,bn195-2012.txt,,,Pasal 5,2,,"Rencana impor barang modal bukan baru yang meliputi jumlah, jenis, spesifikasi teknis, nomor Pos Tarif/HS sepuluh digit, dan tahun pembuatan;",
DOC319,bn195-2012.txt,,,Pasal 5,3,,Hasil survey kemampuan perusahaan rekondisi atau perusahaan remanufakturing yang diterbitkan oleh surveyor sebagaimana dimaksud dalam Pasal 4 ayat (3);,
DOC319,bn195-2012.txt,,,Pasal 5,4,,Bukti surat permintaan dan/atau surat pernyataan bermaterai cukup dari perusahaan pemakai langsung dalam negeri; dan,
DOC319,bn195-2012.txt,,,Pasal 5,5,,"Bukti kemampuan pelayanan purna jual. b. Perusahaan pemakai langsung sebagaimana dimaksud pada ayat (2) huruf b, yang mengimpor barang modal bukan baru dengan Pos Tarif/HS 8901, 8902, 8903, 8904, dan 8905 yang berusia lebih dari 20 (dua puluh) tahun melampirkan dokumen sebagai berikut:",
DOC319,bn195-2012.txt,,,Pasal 5,1,,Salinan izin usaha yang dikeluarkan oleh instansi yang berwenang sesuai peraturan perundang-undangan;,
DOC319,bn195-2012.txt,,,Pasal 5,2,,Salinan Angka Pengenal Impor (API);,
DOC319,bn195-2012.txt,,,Pasal 5,3,,Salinan Nomor Pokok Wajib Pajak (NPWP);,
DOC319,bn195-2012.txt,,,Pasal 5,4,,"Rencana impor barang modal bukan baru yang meliputi jumlah, jenis, spesifikasi teknis, nomor Pos Tarif/HS sepuluh digit, dan tahun pembuatan; dan",
DOC319,bn195-2012.txt,,,Pasal 5,5,,Surat pernyataan bermaterai cukup yang menjelaskan bahwa barang modal bukan baru yang akan diimpor untuk salah satu tujuan sebagaimana dimaksud dalam Pasal 2 huruf c dan tidak untuk dijadikan barang skrap (scrap). c. Perusahaan pemakai langsung sebagaimana dimaksud pada ayat (2) huruf c dan/atau perusahaan rekondisi sebagaimana dimaksud pada ayat (2) huruf d yang mengimpor barang modal bukan baru yang tidak tercantum dalam Peraturan Menteri Perdagangan Nomor 48/M-DAG/PER/12/2011 melampirkan dokumen sebagai berikut:,
DOC319,bn195-2012.txt,,,Pasal 5,1,,Salinan izin usaha yang dikeluarkan oleh instansi yang berwenang sesuai peraturan perundang-undangan;,
DOC319,bn195-2012.txt,,,Pasal 5,2,,Salinan Angka Pengenal Impor (API);,
DOC319,bn195-2012.txt,,,Pasal 5,3,,Salinan Nomor Pokok Wajib Pajak (NPWP);,
DOC319,bn195-2012.txt,,,Pasal 5,4,,"Rencana impor barang modal bukan baru yang meliputi jumlah, jenis, spesifikasi teknis, nomor Pos Tarif/HS sepuluh digit, dan tahun pembuatan; dan",
DOC319,bn195-2012.txt,,,Pasal 5,5,,"Surat pernyataan bermaterai cukup yang menjelaskan bahwa barang modal bukan baru yang akan diimpor untuk salah satu tujuan sebagaimana dimaksud dalam Pasal 2 huruf c dan tidak untuk dijadikan barang skrap (scrap) yang dilengkapi dengan dokumen pendukung. Paling lambat 5 (lima) hari kerja sejak diterima permohonan sebagaimana dimaksud dalam Pasal 5 secara lengkap dan benar, Direktur Jenderal IUBTT atau Direktur Pembina industri menerbitkan rekomendasi atau menolak permohonan rekomendasi. Perusahaan yang tidak memiliki rekomendasi dari Kementerian Perindustrian sebagaimana dimaksud dalam Pasal 4 dilarang untuk diberikan persetujuan impor barang modal bukan baru. Direktorat Pembina industri melakukan monitoring dan evaluasi kemampuan perusahaan rekondisi yang telah memperoleh rekomendasi sebagaimana dimaksud dalam Pasal 4 ayat (2). Dengan Rahmat Tuhan Yang Maha Esa a. bahwa untuk melaksanakan ketentuan Pasal 4 ayat (3) Peraturan Menteri Perindustrian Nomor 195 Tahun 2012 tentang Rekondisi dan Remanufaktur, perlu menetapkan ketentuan dan pedoman teknis pelaksanaan survey kemampuan rekondisi dan kemampuan remanufakturing; b. bahwa berdasarkan pertimbangan sebagaimana dimaksud dalam huruf a, perlu menetapkan Peraturan Menteri Perindustrian tentang Ketentuan dan Pedoman Teknis Pelaksanaan Survey Kemampuan Rekondisi dan Kemampuan Remanufakturing. d. Peraturan Menteri Perindustrian Nomor 195 Tahun 2012 tentang Rekondisi dan Remanufaktur. Menetapkan: Peraturan Menteri Perindustrian tentang Ketentuan dan Pedoman Teknis Pelaksanaan Survey Kemampuan Rekondisi dan Kemampuan Remanufakturing. Dalam Peraturan Menteri ini yang dimaksud dengan:",
DOC319,bn195-2012.txt,,,Pasal 1,1,,Survey kemampuan rekondisi adalah kegiatan untuk menilai kemampuan perusahaan dalam melakukan rekondisi produk.,
DOC319,bn195-2012.txt,,,Pasal 1,2,,"Survey kemampuan remanufakturing adalah kegiatan untuk menilai kemampuan perusahaan dalam melakukan remanufaktur produk. Ketentuan dan pedoman teknis pelaksanaan survey kemampuan rekondisi dan kemampuan remanufakturing sebagaimana dimaksud dalam Pasal 1 diatur dengan Peraturan Direktur Jenderal IUBTT. Peraturan Menteri ini mulai berlaku sejak tanggal diundangkan dan berakhir pada tanggal 31 Desember 2013. Agar setiap orang mengetahuinya, memerintahkan pengundangan Peraturan Menteri ini dengan penempatannya dalam Berita Negara Republik Indonesia. MENTERI PERINDUSTRIAN REPUBLIK INDONESIA, MOHAMAD S. HIDAYAT Diundangkan di Jakarta pada tanggal 13 Februari 2012 MENTERI HUKUM DAN HAK ASASI MANUSIA REPUBLIK INDONESIA, AMIR SYAMSUDIN",
