doc_id,nama_dokumen,bab,bagian,pasal,angka,ayat,isi,penjelasan
DOC325,bn198-2022.txt,,,,1,,Nomor 213/PMK.010/2017 tentang Perubahan atas Peraturan Menteri Keuangan Nomor 6/PMK.010/2017 tentang Penetapan Sistem Klasifikasi Barang dan Pembebanan Tarif Bea Masuk atas Barang Impor (Berita Negara Republik Indonesia Tahun 2017 Nomor 1979);,
DOC325,bn198-2022.txt,,,,2,,Nomor 17/PMK.010/2018 tentang Perubahan Kedua atas Peraturan Menteri Keuangan Nomor 6/PMK.010/2017 tentang Penetapan Sistem Klasifikasi Barang dan Pembebanan Tarif Bea Masuk atas Barang Impor (Berita Negara Republik Indonesia Tahun 2018 Nomor 277); dan,
DOC325,bn198-2022.txt,,,,3,,"Nomor 17/PMK.010/2020 tentang Perubahan Ketiga atas Peraturan Menteri Keuangan Nomor 6/PMK.010/2017 tentang Penetapan Sistem Klasifikasi Barang dan Pembebanan Tarif Bea Masuk atas Barang Impor (Berita Negara Republik Indonesia Tahun 2020 Nomor 238), diubah sebagai berikut:",
DOC325,bn198-2022.txt,,,,1,,"Catatan Bab 98 yang tercantum dalam Lampiran I Peraturan Menteri Keuangan Nomor 17/PMK.010/2020 tentang Perubahan Ketiga atas Peraturan Menteri Keuangan Nomor 6/PMK.010/2017 tentang Penetapan Sistem Klasifikasi Barang dan Pembebanan Tarif Bea Masuk atas Barang Impor, diubah sehingga menjadi sebagaimana tercantum dalam Lampiran I yang merupakan bagian tidak terpisahkan dari Peraturan Menteri ini.",
DOC325,bn198-2022.txt,,,,2,,"Struktur klasifikasi barang dan pembebanan tarif bea masuk atas barang impor pada Bab 98 yang tercantum dalam Lampiran II Peraturan Menteri Keuangan Nomor 17/PMK.010/2020 tentang Perubahan Ketiga atas Peraturan Menteri Keuangan Nomor 6/PMK.010/2017 tentang Penetapan Sistem Klasifikasi Barang dan Pembebanan Tarif Bea Masuk atas Barang Impor, diubah sehingga struktur klasifikasi barang dan pembebanan tarif bea masuk atas barang impor pada Bab 98 menjadi sebagaimana tercantum dalam Lampiran II yang merupakan bagian tidak terpisahkan dari Peraturan Menteri ini. Pasal II Catatan Bab 98 sebagaimana dimaksud dalam Pasal I angka 1 serta struktur klasifikasi barang dan pembebanan tarif bea masuk sebagaimana dimaksud dalam Pasal I angka 2, merupakan bagian dari sistem klasifikasi dan pembebanan tarif bea masuk atas barang impor sebagaimana diatur dalam Peraturan Menteri Keuangan Nomor 6/PMK.010/2017 tentang Penetapan Sistem Klasifikasi Barang dan Pembebanan Tarif Bea Masuk atas Barang Impor (Berita Negara Republik Indonesia Tahun 2017 Nomor 176) sebagaimana telah beberapa kali diubah terakhir dengan Peraturan Menteri Keuangan Nomor 17/PMK.010/2020 tentang Perubahan Ketiga atas Peraturan Menteri Keuangan Nomor 6/PMK.010/2017 tentang Penetapan Sistem Klasifikasi Barang dan Pembebanan Tarif Bea Masuk atas Barang Impor (Berita Negara Republik Indonesia Tahun 2020 Nomor 238). Pengenaan tarif bea masuk sebagaimana dimaksud dalam Pasal I angka 2, berlaku atas impor barang yang dokumen pemberitahuan pabean impornya. Dengan Rahmat Tuhan Yang Maha Esa",
DOC325,bn198-2022.txt,,,,1,,"Bahwa untuk melaksanakan ketentuan Pasal 12 ayat (2) Peraturan Menteri Keuangan Nomor 6/PMK.010/2017 tentang Klasifikasi Barang dan Pembebanan Tarif Bea Masuk atas Barang Impor, perlu dilakukan perubahan atas ketentuan tersebut.",
DOC325,bn198-2022.txt,,,,2,,"Bahwa berdasarkan pertimbangan sebagaimana dimaksud dalam huruf a, perlu menetapkan Peraturan Menteri Keuangan tentang Perubahan atas Peraturan Menteri Keuangan Nomor 6/PMK.010/2017 tentang Klasifikasi Barang dan Pembebanan Tarif Bea Masuk atas Barang Impor. c. Peraturan Presiden Nomor 91 Tahun 2017 tentang Kebijakan Satu Peta; d. Peraturan Menteri Keuangan Nomor 6/PMK.010/2017 tentang Klasifikasi Barang dan Pembebanan Tarif Bea Masuk atas Barang Impor. Menetapkan: PERATURAN MENTERI KEUANGAN TENTANG PERUBAHAN ATAS PERATURAN MENTERI KEUANGAN NOMOR 6/PMK.010/2017 TENTANG KLASIFIKASI BARANG DAN PEMBEBANAN TARIF BEA MASUK ATAS BARANG IMPOR. Peraturan Menteri ini mulai berlaku setelah 7 (tujuh) hari terhitung sejak tanggal diundangkan. Agar setiap orang mengetahuinya, memerintahkan pengundangan Peraturan Menteri ini dengan penempatannya dalam Berita Negara Republik Indonesia. MENTERI KEUANGAN REPUBLIK INDONESIA, ttd. SRI MULYANI INDRAWATI Diundangkan di Jakarta pada tanggal 22 Februari 2022 DIREKTUR JENDERAL PERATURAN PERUNDANG-UNDANGAN KEMENTERIAN HUKUM DAN HAK ASASI MANUSIA REPUBLIK INDONESIA, ttd. BENNY RIYANTO LAMPIRAN I PERATURAN MENTERI KEUANGAN REPUBLIK INDONESIA NOMOR 13/PMK.010/2022 PERUBAHAN KEEMPAT ATAS PERATURAN MENTERI KEUANGAN NOMOR 6/PMK.010/2017 TENTANG KLASIFIKASI BARANG DAN PEMBEBANAN TARIF BEA MASUK ATAS BARANG IMPOR CATATAN BAGIAN, CATATAN BAB, DAN CATATAN SUBPOS BAB 98 Ketentuan Khusus Untuk Industri Alat Transportasi Catatan:",
DOC325,bn198-2022.txt,,,,1,,"Kecuali jika konteksnya menentukan lain, terhadap pos 98.01 dan pos 98.02 tidak berlaku: a. Ketentuan Umum Menginterpretasi Sistem (KUMHS); dan b. Catatan yang ditetapkan untuk pos 01.01 sampai dengan pos 97.06. (a) Ketentuan mengenai persyaratan impor barang dari subpos 9801.40 sampai dengan 9801.80 diatur dalam Peraturan Menteri Perindustrian Nomor 23 Tahun 2021 tentang Industri Kendaraan Bermotor Roda Empat atau Lebih sebagaimana telah diubah dengan Peraturan Menteri Perindustrian Nomor 37 Tahun 2021 tentang Perubahan atas Peraturan Menteri Perindustrian Nomor 23 Tahun 2021 tentang Industri Kendaraan Bermotor Roda Empat atau Lebih. (b) Ketentuan mengenai persyaratan impor barang pada subpos 9801.90 diatur dalam Peraturan Menteri Perindustrian Nomor 23 Tahun 2021 tentang Industri Kendaraan Bermotor Roda Empat atau Lebih sebagaimana telah diubah dengan Peraturan Menteri Perindustrian Nomor 37 Tahun 2021 tentang Perubahan atas Peraturan Menteri Perindustrian Nomor 23 Tahun 2021 tentang Industri Kendaraan Bermotor Roda Empat atau Lebih dan/atau Peraturan Menteri Perindustrian Nomor 28 Tahun 2020 tentang Industri Kendaraan Bermotor Berbasis Baterai Dalam Keadaan Terurai Lengkap dan Keadaan Terurai Tidak Lengkap. (c) Ketentuan mengenai persyaratan impor barang dari pos 98.02 diatur dalam Peraturan Menteri Perindustrian Nomor 59/M-IND/PER/5/2010 tentang Industri Kendaraan Bermotor. Untuk keperluan pos 98.01, berlaku ketentuan sebagai berikut: a. Perusahaan industri kendaraan bermotor roda empat atau lebih yang dapat menggunakan Bab 98 ditetapkan oleh menteri yang bertanggung jawab di bidang perindustrian atau pejabat yang ditunjuk. b. Kendaraan bermotor meliputi kendaraan bermotor dari subpos 8701.20, pos 87.02, pos 87.03, dan pos 87.04. c. Sasis dilengkapi dengan mesin dan/atau motor listrik, untuk kendaraan dari Pos 87.02 jenis bus adalah sasis yang sudah dilengkapi dengan mesin dan/atau motor listrik namun belum dilengkapi bodi/kabin sebagaimana dimaksud dalam pos 87.06. Pos 98.01 hanya meliputi kendaraan bermotor yang: a. diimpor oleh perusahaan industri kendaraan bermotor roda empat atau lebih; b. dilengkapi dengan persetujuan dari pejabat yang ditunjuk oleh menteri yang bertanggung jawab di bidang perindustrian; dan c. memenuhi ketentuan yang diatur dalam Peraturan Menteri Perindustrian Nomor 23 Tahun 2021 tentang Industri Kendaraan Bermotor Roda Empat atau Lebih sebagaimana telah diubah dengan Peraturan Menteri Perindustrian Nomor 37 Tahun 2021 tentang Perubahan atas Peraturan Menteri Perindustrian Nomor 23 Tahun 2021 tentang Industri Kendaraan Bermotor Roda Empat atau Lebih dan/atau Peraturan Menteri Perindustrian Nomor 28 Tahun 2020 tentang Industri Kendaraan Bermotor Berbasis Baterai Dalam Keadaan Terurai Lengkap dan Keadaan Terurai Tidak Lengkap. Pos 98.02 hanya meliputi kendaraan bermotor yang: a. diimpor oleh perusahaan industri komponen; dan b. memenuhi ketentuan yang diatur dalam Peraturan Menteri Perindustrian Nomor 59/M-IND/PER/5/2010 tentang Industri Kendaraan Bermotor. Istilah “Completely Knocked Down” dalam subpos 8701.20, pos 87.02, pos 87.03, dan pos 87.04, hanya berlaku untuk kendaraan bermotor yang: a. dilengkapi persetujuan dari pejabat yang ditunjuk oleh menteri yang bertanggung jawab di bidang perindustrian; dan b. memenuhi ketentuan yang diatur dalam Peraturan Menteri Perindustrian Nomor 23 Tahun 2021 tentang Industri Kendaraan Bermotor Roda Empat atau Lebih sebagaimana telah diubah dengan Peraturan Menteri Perindustrian Nomor 37 Tahun 2021 tentang Perubahan atas Peraturan Menteri Perindustrian Nomor 23 Tahun 2021 tentang Industri Kendaraan Bermotor Roda Empat atau Lebih dan/atau Peraturan Menteri Perindustrian Nomor 28 Tahun 2020 tentang Industri Kendaraan Bermotor Berbasis Baterai Dalam Keadaan Terurai Lengkap dan Keadaan Terurai Tidak Lengkap. (a) Istilah “Completely Knocked Down” untuk kendaraan bermotor roda dua dan roda tiga dari subpos 8711.10 sampai dengan subpos 8711.50, hanya berlaku untuk impor yang memenuhi ketentuan sebagaimana diatur dalam Peraturan Menteri Perindustrian Nomor 59/M-IND/PER/5/2010 tentang Industri Kendaraan Bermotor. (b) Istilah “Completely Knocked Down” untuk kendaraan bermotor roda dua dan roda tiga pada subpos 8703.80, subpos 8704.90, dan subpos 8711.60 hanya berlaku untuk impor yang: (i) dilengkapi dengan persetujuan dari pejabat yang ditunjuk oleh menteri yang bertanggung jawab di bidang perindustrian; dan (ii) memenuhi ketentuan sebagaimana diatur dalam Peraturan Menteri Perindustrian Nomor 59/M-IND/PER/5/2010 tentang Industri Kendaraan Bermotor dan/atau Peraturan Menteri Perindustrian Nomor 28 Tahun 2020 tentang Industri Kendaraan Bermotor Berbasis Baterai Dalam Keadaan Terurai Lengkap dan Keadaan Terurai Tidak Lengkap. Kendaraan bermotor atau komponen kendaraan bermotor yang tidak diatur atau tidak memenuhi ketentuan dalam Bab ini, diklasifikasikan pada pos tarif masing-masing yang sesuai dalam Bab 1 sampai dengan Bab 97.",
