doc_id,nama_dokumen,bab,bagian,pasal,angka,ayat,isi,penjelasan
DOC348,bn228-2009.txt,,,,1,,Bedrijfsreglementerings Ordonnantie 1934 (Staatsblad Tahun 1938 Nomor 86);,
DOC348,bn228-2009.txt,,,,3,,Undang-Undang Republik Indonesia Nomor 7 Tahun 1994 tentang Pengesahan Agreement Establishing The World Trade Organization; Menetapkan: PERATURAN MENTERI PERDAGANGAN REPUBLIK INDONESIA TENTANG KETENTUAN IMPOR BESI ATAU BAJA. DAFTAR BESI ATAU BAJA YANG HANYA DAPAT DIIMPOR OLEH IP-BESI ATAU BAJA ATAU IT-BESI ATAU BAJA:,
DOC348,bn228-2009.txt,,,,1,,"Produk canai lantaian dari besi atau baja bukan paduan, dengan lebar 600 mm atau lebih, dicanai panas, tidak dipalut, tidak disepuh atau tidak dilapisi: - Dalam gulungan, tidak dikerjakan lebih lanjut selain dicanai panas, dengan pola relief: - Dengan ketebalan 4,75 mm atau lebih: Tarif bea masuk 20%. - Gulungan untuk dicanai ulang: Tarif bea masuk 20%. - Lain-lain: Tarif bea masuk 20%. - Dengan ketebalan 3 mm atau lebih tetapi kurang dari 4,75 mm: Tarif bea masuk 20%. - Dengan ketebalan kurang dari 3 mm: Tarif bea masuk 20%. - Lain-lain, dalam gulungan, tidak dikerjakan lebih lanjut selain dicanai panas: - Dengan ketebalan melebihi 10 mm: Tarif bea masuk 20%. - Dengan ketebalan 4,75 mm atau lebih tetapi tidak melebihi 10 mm: Tarif bea masuk 20%. - Dengan ketebalan 3 mm atau lebih tetapi kurang dari 4,75 mm: Tarif bea masuk 20%. - Dengan ketebalan kurang dari 3 mm: Tarif bea masuk 20%. - Tidak dalam gulungan, tidak dikerjakan lebih lanjut selain dicanai panas, dengan pola relief: - Lain-lain, tidak dalam gulungan, tidak dikerjakan lebih lanjut selain dicanai panas: - Dengan ketebalan melebihi 10 mm: Tarif bea masuk 20%. - Dengan ketebalan 4,75 mm atau lebih tetapi tidak melebihi 10 mm: Tarif bea masuk 20%. - Dengan ketebalan 3 mm atau lebih tetapi kurang dari 4,75 mm: Tarif bea masuk 20%. - Dengan ketebalan kurang dari 3 mm: Tarif bea masuk 20%. - Lain-lain: Tarif bea masuk 20%.",
DOC348,bn228-2009.txt,,,,2,,"Produk canai lantaian dari besi atau baja bukan paduan, dengan lebar 600 mm atau lebih, dicanai secara dingin (cold-reduced), tidak dipalut, tidak disepuh atau tidak dilapisi: - Dalam gulungan, tidak dikerjakan lebih lanjut selain dicanai dingin (cold-reduced): - Dengan ketebalan melebihi 1 mm tetapi kurang dari 3 mm: Tarif bea masuk 20%. - Dengan lebar sampai dengan 1.250 mm, untuk yang permukaannya dibersihkan maupun tidak: Tarif bea masuk 20%. - Dengan ketebalan 0,5 mm atau lebih tetapi tidak melebihi 1 mm: Tarif bea masuk 20%. - Dengan lebar sampai dengan 1.250 mm, untuk yang permukaannya dibersihkan maupun tidak: Tarif bea masuk 20%. - Dengan ketebalan kurang dari 0,5 mm: - Tin-mill blackplate: Tarif bea masuk 20%. - Mengandung karbon kurang dari 0,6% menurut beratnya dan dengan ketebalan 0,17 mm atau kurang: Tarif bea masuk 20%. - Tidak dalam gulungan, tidak dikerjakan lebih lanjut selain dicanai dingin (cold-reduced): - Dengan ketebalan melebihi 1 mm tetapi kurang dari 3 mm: Tarif bea masuk 20%. - Dengan lebar sampai dengan 1.250 mm, untuk yang permukaannya dibersihkan maupun tidak: Tarif bea masuk 20%. - Dengan ketebalan 0,5 mm atau lebih tetapi tidak melebihi 1 mm: Tarif bea masuk 20%. - Dengan lebar sampai dengan 1.250 mm, untuk yang permukaannya dibersihkan maupun tidak: Tarif bea masuk 20%. - Dengan ketebalan kurang dari 0,5 mm: - Mengandung karbon kurang dari 0,6% menurut beratnya dan dengan ketebalan 0,17 mm atau kurang: Tarif bea masuk 20%.",
DOC348,bn228-2009.txt,,,,3,,"Produk canai lantaian dari besi atau baja bukan paduan, dengan lebar 600 mm atau lebih, dipalut, disepuh atau dilapisi: - Disepuh atau dilapisi dengan timah: - Dengan ketebalan kurang dari 0,5 mm: - Mengandung karbon 0,6% atau lebih menurut beratnya: Tarif bea masuk 20%. - Lain-lain: Tarif bea masuk 20%. - Disepuh atau dilapisi secara lain dengan seng: - Bergelombang: Tarif bea masuk 20%. - Dengan ketebalan tidak melebihi 1,2 mm: Tarif bea masuk 20%. - Mengandung karbon kurang dari 0,6% menurut beratnya dan dengan ketebalan 1,5 mm atau kurang: Tarif bea masuk 20%. - Lain-lain: Tarif bea masuk 20%. - Disepuh atau dilapisi dengan aluminium: - Disepuh atau dilapisi dengan paduan aluminium-seng: - Mengandung karbon kurang dari 0,6% menurut beratnya dan dengan ketebalan 1,5 mm atau kurang: Tarif bea masuk 20%. - Lain-lain: Tarif bea masuk 20%. - Dicat, dipernis atau dilapisi dengan plastik: - Mengandung karbon kurang dari 0,6% menurut beratnya dan dengan ketebalan 1,5 mm atau kurang: Tarif bea masuk 20%. - Lain-lain: Tarif bea masuk 20%.",
DOC348,bn228-2009.txt,,,,4,,"Produk canai lantaian dari besi atau baja bukan paduan, dengan lebar kurang dari 600 mm, tidak dipalut, tidak disepuh atau tidak dilapisi: - Tidak dikerjakan lebih lanjut selain dicanai panas: - Dicanai keempat sisinya atau dilewatkan pada kotak tertutup, dengan lebar melebihi 150 mm dan ketebalan tidak kurang dari 4 mm, tidak dalam gulungan dan tanpa pola relief: - Simpai dan strip, dengan lebar melebihi 150 mm tetapi tidak melebihi 400 mm: Tarif bea masuk 20%. - Bergelombang, mengandung karbon kurang dari 0,6% menurut beratnya: Tarif bea masuk 20%. - Lain-lain: Tarif bea masuk 20%. - Lain-lain, dengan ketebalan 4,75 mm atau lebih: - Simpai dan strip, dengan lebar tidak melebihi 400 mm: Tarif bea masuk 20%. - Bergelombang, mengandung karbon kurang dari 0,6% menurut beratnya: Tarif bea masuk 20%. - Lain-lain: Tarif bea masuk 20%. Tanggal Penetapan: [Tanggal Penetapan] Nama Pejabat: [Nama Pejabat] Berita Negara: [Berita Negara] Dengan Rahmat Tuhan Yang Maha Esa",
DOC348,bn228-2009.txt,,,,1,,"Bahwa untuk melaksanakan ketentuan dalam peraturan perundang-undangan yang berlaku, perlu menetapkan peraturan mengenai ketentuan tarif bea masuk atas barang impor.",
DOC348,bn228-2009.txt,,,,2,,"Bahwa untuk itu, perlu adanya pengaturan yang jelas dan terperinci mengenai jenis barang dan tarif yang dikenakan. c. Keputusan Menteri Perindustrian dan Perdagangan Republik Indonesia Nomor 229/MPP/Kep/7/1997 tentang Ketentuan Umum Di Bidang Impor; Menetapkan: Peraturan Menteri Perdagangan Republik Indonesia tentang Ketentuan Tarif Bea Masuk atas Barang Impor.",
DOC348,bn228-2009.txt,,,Pasal 1,,1,"Barang-barang yang dikenakan tarif bea masuk adalah sebagai berikut: - Manganese steel (HS Code: 7214.91.20.20) dikenakan tarif bea masuk sebesar 75%. - Lain-lain (HS Code: 7214.91.20.90) dikenakan tarif bea masuk sesuai ketentuan yang berlaku. - Besi beton (HS Code: 7214.99.10.10) dikenakan tarif bea masuk sesuai ketentuan yang berlaku. - Batang poros dari manganese steel (HS Code: 7214.99.10.20) dikenakan tarif bea masuk sesuai ketentuan yang berlaku. - Lain-lain (HS Code: 7214.99.10.90) dikenakan tarif bea masuk sesuai ketentuan yang berlaku. - Batang dan batang kecil lainnya dari besi atau baja bukan paduan (HS Code: 7215.10.00.00) dikenakan tarif bea masuk sesuai ketentuan yang berlaku. - Dari baja free cutting, tidak dikerjakan lebih lanjut selain cold-formed atau cold-finished (HS Code: 7215.50) dikenakan tarif bea masuk sesuai ketentuan yang berlaku. - Mengandung karbon 0,6% atau lebih menurut beratnya, selain penampang silang lingkaran (HS Code: 7215.50.10.00) dikenakan tarif bea masuk sesuai ketentuan yang berlaku. - Lain-lain (HS Code: 7215.50.90.00) dikenakan tarif bea masuk sesuai ketentuan yang berlaku. - Manganese steel atau batang poros, mengandung karbon kurang dari 0,6% menurut beratnya (HS Code: 7215.90.00.10) dikenakan tarif bea masuk sesuai ketentuan yang berlaku. - Lain-lain, mengandung karbon kurang dari 0,6% menurut beratnya (HS Code: 7215.90.00.20) dikenakan tarif bea masuk sesuai ketentuan yang berlaku. - Angle, shape dan section, dari besi atau baja bukan paduan (HS Code: 7216.10.00.00) dikenakan tarif bea masuk sesuai ketentuan yang berlaku. - U atau H section, tidak dikerjakan lebih lanjut selain dicanai panas, ditarik panas atau diekstrusi, dengan tinggi kurang dari 80 mm (HS Code: 7216.31.00.00) dikenakan tarif bea masuk sesuai ketentuan yang berlaku. - L atau T section, tidak dikerjakan lebih lanjut selain dicanai panas, ditarik panas atau diekstrusi, dengan tinggi kurang dari 80 mm (HS Code: 7216.40.00.00) dikenakan tarif bea masuk sesuai ketentuan yang berlaku. - Angle, shape dan section lainnya, tidak dikerjakan lebih lanjut selain dicanai panas, ditarik panas atau diekstrusi (HS Code: 7216.50) dikenakan tarif bea masuk sesuai ketentuan yang berlaku. - Kawat besi atau baja bukan paduan (HS Code: 7217.10) dikenakan tarif bea masuk sesuai ketentuan yang berlaku. - Tidak disepuh atau tidak dilapisi, dipoles maupun tidak (HS Code: 7217.10.10.00) dikenakan tarif bea masuk sesuai ketentuan yang berlaku. - Mengandung karbon kurang dari 0,25% menurut beratnya (HS Code: 7217.10.10.00) dikenakan tarif bea masuk sesuai ketentuan yang berlaku. - Mengandung karbon 0,25% atau lebih tetapi kurang dari 0,6% menurut beratnya (HS Code: 7217.10.22) dikenakan tarif bea masuk sesuai ketentuan yang berlaku. - Lain-lain (HS Code: 7217.10.22.90) dikenakan tarif bea masuk sesuai ketentuan yang berlaku. - Lain-lain (HS Code: 7217.10.29.00) dikenakan tarif bea masuk sesuai ketentuan yang berlaku. - Disepuh atau dilapisi dengan seng (HS Code: 7217.20) dikenakan tarif bea masuk sesuai ketentuan yang berlaku. - Mengandung karbon kurang dari 0,25% menurut beratnya (HS Code: 7217.20.10.00) dikenakan tarif bea masuk sesuai ketentuan yang berlaku. - Mengandung karbon 0,25% atau lebih tetapi kurang dari 0,45% menurut beratnya (HS Code: 7217.20.20.00) dikenakan tarif bea masuk sesuai ketentuan yang berlaku. - Lain-lain (HS Code: 7217.20.91.00) dikenakan tarif bea masuk sesuai ketentuan yang berlaku. - Lain-lain (HS Code: 7217.20.99.00) dikenakan tarif bea masuk sesuai ketentuan yang berlaku. Peraturan ini mulai berlaku pada tanggal ditetapkan. Menteri Perdagangan Republik Indonesia. Dengan Rahmat Tuhan Yang Maha Esa",
DOC348,bn228-2009.txt,,,Pasal 2,1,,Bahwa untuk melaksanakan ketentuan dalam Peraturan Menteri Perdagangan Republik Indonesia Nomor 01/M-DAG/PER/3/2005 tentang Organisasi dan Tata Kerja Departemen Perdagangan sebagaimana telah diubah beberapa kali terakhir dengan Peraturan Menteri Perdagangan Republik Indonesia Nomor 34/M-DAG/PER/8/2007;,
DOC348,bn228-2009.txt,,,Pasal 2,2,,Bahwa untuk melaksanakan ketentuan dalam Peraturan Menteri Perdagangan Republik Indonesia Nomor 31/M-DAG/PER/7/2007 tentang Angka Pengenal Importir (API); a. Undang-Undang Nomor 10 Tahun 1995 tentang Kepabeanan; b. Undang-Undang Nomor 7 Tahun 1994 tentang Pengesahan Agreement Establishing the World Trade Organization (WTO); c. Peraturan Pemerintah Nomor 31 Tahun 2007 tentang Kebijakan Impor; d. Peraturan Menteri Perdagangan Republik Indonesia Nomor 01/M-DAG/PER/3/2005 tentang Organisasi dan Tata Kerja Departemen Perdagangan; e. Peraturan Menteri Perdagangan Republik Indonesia Nomor 34/M-DAG/PER/8/2007 tentang Perubahan atas Peraturan Menteri Perdagangan Republik Indonesia Nomor 01/M-DAG/PER/3/2005; f. Peraturan Menteri Perdagangan Republik Indonesia Nomor 31/M-DAG/PER/7/2007 tentang Angka Pengenal Importir (API); Menetapkan: PERATURAN MENTERI PERDAGANGAN REPUBLIK INDONESIA TENTANG KETENTUAN IMPOR BESI ATAU BAJA. Dalam Peraturan Menteri ini yang dimaksud dengan:,
DOC348,bn228-2009.txt,,,Pasal 1,1,,Besi atau Baja adalah produk Besi atau Baja yang dihasilkan dari proses peleburan dan dikerjakan lebih lanjut melalui proses canai panas atau canai dingin.,
DOC348,bn228-2009.txt,,,Pasal 1,2,,"Importir Produsen Besi atau Baja, selanjutnya disebut IP-Besi atau Baja, adalah perusahaan produsen Besi atau Baja dan perusahaan produsen yang menggunakan produk Besi atau Baja yang mendapat pengakuan dari Direktur Jenderal atas nama Menteri dan disetujui untuk mengimpor sendiri produk Besi atau Baja yang diperuntukkan semata-mata hanya untuk kebutuhan produksinya sendiri.",
DOC348,bn228-2009.txt,,,Pasal 1,3,,"Importir Terdaftar Besi atau Baja, selanjutnya disebut IT-Besi atau Baja adalah perusahaan yang ditetapkan oleh Direktur Jenderal atas nama Menteri untuk mengimpor produk Besi atau Baja untuk disalurkan kepada perusahaan produsen yang tidak berstatus sebagai IP-Besi atau Baja.",
DOC348,bn228-2009.txt,,,Pasal 1,4,,Verifikasi atau Penelusuran Teknis Impor adalah kegiatan pemeriksaan teknis atas produk Besi atau Baja yang dilakukan di pelabuhan muat barang oleh surveyor.,
DOC348,bn228-2009.txt,,,Pasal 1,5,,Surveyor adalah perusahaan survey yang mendapat otorisasi untuk melakukan verifikasi penelusuran teknis barang impor.,
DOC348,bn228-2009.txt,,,Pasal 1,6,,Menteri adalah Menteri Perdagangan.,
DOC348,bn228-2009.txt,,,Pasal 1,7,,"Direktur Jenderal adalah Direktur Jenderal Perdagangan Luar Negeri, Departemen Perdagangan. Besi atau Baja hanya dapat diimpor oleh IP-Besi atau Baja atau IT-Besi atau Baja. Besi atau Baja sebagaimana dimaksud pada ayat (1), tercantum dalam Lampiran I yang merupakan bagian tidak terpisahkan dari Peraturan Menteri ini. Untuk memperoleh pengakuan sebagai IP-Besi atau Baja atau penetapan IT-Besi atau Baja sebagaimana dimaksud dalam Pasal 2 ayat (1), perusahaan mengajukan permohonan kepada Direktur Jenderal, dengan melampirkan dokumen: a. Angka Pengenal Importir (API): 1) Angka Pengenal Importir Produsen/Angka Pengenal Importir Terbatas (API-P/API-T) untuk perusahaan sebagai IP-Besi atau Baja; atau 2) Angka Pengenal Importir Umum (API-U) untuk perusahaan sebagai IT-Besi atau Baja; b. Tanda Daftar Perusahaan (TDP); c. Nomor Pokok Wajib Pajak (NPWP); d. Nomor Identitas Kepabeanan (NIK); e. Rencana Impor Barang (RIB) dalam 1 (satu) tahun yang mencakup: jenis barang, klasifikasi barang/Pos Tarif/HS 10 (sepuluh) digit, jumlah, dan pelabuhan tujuan; dan f. Pertimbangan teknis dari Direktur Jenderal Industri Logam, Mesin, Tekstil dan Aneka, Departemen Perindustrian; Pengakuan sebagai IP-Besi atau Baja atau penetapan IT-Besi atau Baja sebagaimana dimaksud pada ayat (1) berlaku untuk 1 (satu) tahun dan dapat diperpanjang. Perpanjangan sebagaimana dimaksud pada ayat (2) dilakukan dengan melampirkan dokumen: a. Rencana Impor Barang (RIB) dalam 1 (satu) tahun yang mencakup: jenis barang, klasifikasi barang/Pos Tarif/HS 10 (sepuluh) digit, jumlah, dan pelabuhan tujuan; dan b. Pertimbangan teknis dari Direktur Jenderal Industri Logam, Mesin, Tekstil dan Aneka, Departemen Perindustrian, apabila jenis dan/atau jumlah barang yang akan diimpor melebihi tahun sebelumnya. Direktur Jenderal atas nama Menteri menerbitkan pengakuan sebagai IP-Besi atau Baja atau penetapan sebagai IT-Besi atau Baja paling lama dalam waktu 7 (tujuh) hari kerja terhitung sejak permohonan diterima dengan lengkap dan benar.",
DOC348,bn228-2009.txt,,,Pasal 5,,1,Setiap impor Besi atau Baja oleh IP-Besi atau Baja atau IT-Besi atau Baja harus dilakukan verifikasi atau penelusuran teknis impor terlebih dahulu oleh Surveyor di pelabuhan muat sebelum dikapalkan.,
DOC348,bn228-2009.txt,,,Pasal 5,,2,"Verifikasi atau penelusuran teknis impor oleh Surveyor sebagaimana dimaksud pada ayat (1) mencakup jenis barang, klasifikasi barang/Pos Tarif/HS 10 (sepuluh) digit, jumlah, dan pelabuhan tujuan.",
DOC348,bn228-2009.txt,,,Pasal 5,,3,Hasil verifikasi atau penelusuran teknis impor oleh Surveyor sebagaimana dimaksud pada ayat (1) dituangkan ke dalam bentuk Laporan Surveyor (LS) untuk digunakan sebagai dokumen pelengkap pabean dalam penyelesaian kepabeanan di bidang impor.,
DOC348,bn228-2009.txt,,,Pasal 5,,4,Seluruh beban biaya verifikasi atau penelusuran teknis impor yang dilakukan oleh Surveyor sebagaimana dimaksud pada ayat (1) ditanggung oleh IP-Besi atau Baja atau IT-Besi atau Baja. Dengan Rahmat Tuhan Yang Maha Esa,
DOC348,bn228-2009.txt,,,Pasal 5,1,,"Bahwa untuk melaksanakan ketentuan dalam peraturan perundang-undangan di bidang impor, perlu menetapkan peraturan mengenai verifikasi atau penelusuran teknis impor besi atau baja.",
DOC348,bn228-2009.txt,,,Pasal 5,2,,Bahwa besi atau baja yang diimpor perlu dilakukan verifikasi atau penelusuran teknis untuk menjamin kualitas dan keamanan produk yang masuk ke Indonesia. a. Undang-Undang Nomor 10 Tahun 1995 tentang Kepabeanan; b. Undang-Undang Nomor 5 Tahun 1999 tentang Larangan Praktek Monopoli dan Persaingan Usaha Tidak Sehat; c. Peraturan Pemerintah Nomor 31 Tahun 2007 tentang Kebijakan Impor; d. Peraturan Menteri Perdagangan Nomor 08/M-DAG/PER/2/2009 tentang Verifikasi atau Penelusuran Teknis Impor Besi atau Baja. Menetapkan: Peraturan Menteri Perdagangan tentang Verifikasi atau Penelusuran Teknis Impor Besi atau Baja. Dalam Peraturan Menteri ini yang dimaksud dengan:,
DOC348,bn228-2009.txt,,,Pasal 1,1,,Besi atau Baja adalah semua jenis besi dan baja yang termasuk dalam pos tarif yang diatur dalam peraturan perundang-undangan.,
DOC348,bn228-2009.txt,,,Pasal 1,2,,IP-Besi atau Baja adalah Importir Produk Besi atau Baja yang telah mendapatkan pengakuan dari Menteri.,
DOC348,bn228-2009.txt,,,Pasal 1,3,,IT-Besi atau Baja adalah Importir Terdaftar Produk Besi atau Baja.,
DOC348,bn228-2009.txt,,,Pasal 2,,1,"Besi atau baja yang diimpor oleh IP-Besi atau Baja di bidang industri otomotif dan komponennya, industri elektronika dan komponennya, serta industri galangan kapal dan komponennya dikecualikan dari ketentuan verifikasi atau penelusuran teknis impor.",
DOC348,bn228-2009.txt,,,Pasal 2,,2,Besi atau baja yang diimpor dan telah dilakukan verifikasi atau penelusuran teknis impor berdasarkan fasilitas Bea Masuk Ditanggung Pemerintah (BM-DTP) juga dikecualikan.,
DOC348,bn228-2009.txt,,,Pasal 2,,3,"Besi atau baja yang diimpor untuk keperluan industri di Kawasan Perdagangan Bebas dan Pelabuhan Bebas serta Kawasan Berikat juga dikecualikan. Pelaksanaan verifikasi atau penelusuran teknis impor sebagaimana dimaksud dalam Pasal 5 ayat (1) dilakukan oleh Surveyor yang ditetapkan oleh Menteri. Surveyor yang ditetapkan sebagaimana dimaksud pada ayat (1) harus memenuhi persyaratan sebagai berikut: a. Memiliki Surat Izin Usaha Jasa Survey (SIUJS); b. Berpengalaman sebagai Surveyor minimal 5 (lima) tahun; c. Memiliki cabang atau perwakilan dan/atau afiliasi di luar negeri dan memiliki jaringan untuk mendukung efektivitas pelayanan verifikasi; d. Mempunyai rekam jejak (track records) di bidang pengelolaan kegiatan verifikasi impor. Surveyor sebagaimana dimaksud pada ayat (1) wajib melaksanakan verifikasi atau penelusuran teknis impor sesuai dengan ketentuan sebagaimana dimaksud dalam Pasal 5 ayat (2) dan menyampaikan laporan rekapitulasi kegiatan Verifikasi dan Penelusuran Teknis Impor Besi atau Baja oleh IP-Besi atau Baja dan IT-Besi atau Baja kepada Direktur Jenderal setiap 3 (tiga) bulan pada tanggal 15 bulan berikutnya. IP-Besi atau Baja dan IT-Besi atau Baja wajib menyampaikan laporan secara tertulis kepada Direktur Jenderal setiap 3 (tiga) bulan terhitung sejak tanggal diterbitkannya pengakuan sebagai IP-Besi atau Baja atau penetapan sebagai IT-Besi atau Baja. Penyampaian laporan sebagaimana dimaksud pada ayat (1) dilakukan baik importasinya terealisasi maupun tidak terealisasi. Laporan sebagaimana dimaksud pada ayat (1) disampaikan melalui http://inatrade.depdag.go.id dengan bentuk laporan sebagaimana tercantum dalam Lampiran II yang merupakan bagian tidak terpisahkan dari Peraturan Menteri ini. IP-Besi atau Baja atau IT-Besi atau Baja yang melanggar ketentuan sebagaimana dimaksud dalam Pasal 7 ayat (1) sebanyak 2 (dua) kali dikenakan sanksi administratif berupa pencabutan IP-Besi atau Baja atau IT-Besi atau Baja. Ketentuan dalam Peraturan Menteri ini tidak berlaku terhadap importasi besi atau baja berdasarkan perjanjian bilateral antara Pemerintah Republik Indonesia dengan Pemerintah negara lain yang memuat ketentuan mengenai impor besi atau baja. LS sebagai dokumen yang harus disampaikan oleh IP-Besi atau Baja atau IT-Besi atau Baja yang digunakan sebagai dokumen pelengkap pabean dalam penyelesaian kepabeanan di bidang impor sebagaimana dimaksud dalam Pasal 5 ayat (3) mulai berlaku pada tanggal 1 April 2009, dibuktikan dengan dokumen pabean berupa manifest (BC.1.1). Ketentuan lebih lanjut dari Peraturan Menteri ini ditetapkan oleh Direktur Jenderal.",
DOC348,bn228-2009.txt,,,Pasal 12,,1,Pelaksanaan Peraturan Menteri ini dievaluasi setiap 3 (tiga) bulan yang dimulai sejak tanggal pemberlakuan.,
DOC348,bn228-2009.txt,,,Pasal 12,,2,"Hasil evaluasi sebagaimana dimaksud pada ayat (1) merupakan bahan pertimbangan untuk mencabut atau memperpanjang pemberlakuan Peraturan Menteri ini. Peraturan Menteri ini mulai berlaku sejak tanggal ditetapkan dan berakhir pada tanggal 31 Desember 2010. Agar setiap orang mengetahuinya, memerintahkan pengumuman Peraturan Menteri ini dengan menempatkan dalam Berita Negara Republik Indonesia. MENTERI PERDAGANGAN REPUBLIK INDONESIA, MARI ELKA PANGESTU Diundangkan di Jakarta pada tanggal 3 Agustus 2009 MENTERI HUKUM DAN HAK ASASI MANUSIA REPUBLIK INDONESIA, ANDI MATTALATTA LAMPIRAN PERATURAN MENTERI PERDAGANGAN REPUBLIK INDONESIA NOMOR: 08/M-DAG/PER/2/2009 TANGGAL: 18 Februari 2009",
DOC348,bn228-2009.txt,,,Pasal 13,1,,Lampiran I: Daftar Besi atau Baja Yang Hanya Dapat Diimpor oleh IP-Besi atau Baja atau IT-Besi atau Baja.,
DOC348,bn228-2009.txt,,,Pasal 13,2,,Lampiran II: Laporan Realisasi Impor Produk Besi atau Baja.,
