doc_id,nama_dokumen,bab,bagian,pasal,angka,ayat,isi,penjelasan
DOC349,bn228-2014.txt,,,,3,,Peraturan Presiden Nomor 47 Tahun 2009 tentang Pembentukan dan Organisasi Kementerian Negara sebagaimana telah beberapa kali diubah terakhir dengan Peraturan Presiden Nomor 91 Tahun 2011;,
DOC349,bn228-2014.txt,,,,4,,"Peraturan Presiden Nomor 24 Tahun 2010 tentang Kedudukan, Tugas dan Fungsi Kementerian Negara serta Susunan Organisasi, Tugas dan Fungsi Eselon I Kementerian Negara sebagaimana telah beberapa kali diubah terakhir dengan Peraturan Presiden Nomor 92 Tahun 2011;",
DOC349,bn228-2014.txt,,,,5,,Keputusan Presiden Nomor 84/P Tahun 2009 tentang Pembentukan Kabinet Indonesia Bersatu II Periode Tahun 2009-2014 sebagaimana telah diubah dengan Keputusan Presiden Nomor 59/P Tahun 2011;,
DOC349,bn228-2014.txt,,,,6,,Peraturan Menteri Perindustrian Nomor 105/M-IND/PER/10/2010 tentang Organisasi dan Tata Kerja Kementerian Perindustrian;,
DOC349,bn228-2014.txt,,,,7,,Peraturan Menteri Perindustrian Nomor 64/M-IND/PER/7/2011 tentang Jenis-Jenis Industri Dalam Pembinaan Direktorat Jenderal dan Badan di Lingkungan Kementerian Perindustrian;,
DOC349,bn228-2014.txt,,,,8,,Peraturan Menteri Perdagangan Nomor 75/M-DAG/PER/12/2013 tentang Ketentuan Impor Barang Modal Bukan Baru; Menetapkan: PERATURAN MENTERI PERINDUSTRIAN TENTANG KETENTUAN PEMBERIAN REKOMENDASI ATAS IMPOR BARANG MODAL BUKAN BARU. Dalam Peraturan Menteri ini yang dimaksud dengan:,
DOC349,bn228-2014.txt,,,Pasal 1,1,,Perusahaan Rekondisi adalah perusahaan yang telah memiliki Izin Usaha Industri rekondisi untuk memproses Barang Modal Bukan Baru menjadi produk akhir untuk tujuan ekspor dan/atau memenuhi pesanan Perusahaan Pemakai Langsung dalam negeri.,
DOC349,bn228-2014.txt,,,Pasal 1,2,,Perusahaan Remanufakturing adalah perusahaan yang telah memiliki Izin Usaha Industri remanufakturing (termasuk dalam KBLI 28240) untuk memproses komponen alat berat bukan baru menjadi produk akhir yang sesuai dengan spesifikasi teknis setara dengan produk baru dan digaransi oleh pemegang merek untuk tujuan ekspor dan/atau memenuhi pesanan Perusahaan Pemakai Langsung dalam negeri.,
DOC349,bn228-2014.txt,,,Pasal 1,3,,"Perusahaan Pemakai Langsung adalah perusahaan yang telah memiliki izin usaha yang mengimpor Barang Modal Bukan Baru untuk keperluan proses produksinya atau digunakan sendiri oleh perusahaan yang bersangkutan untuk keperluan lainnya tidak dalam proses produksi, serta tidak dapat diperjualbelikan maupun dipindahtangankan.",
DOC349,bn228-2014.txt,,,Pasal 1,4,,"Barang Modal Bukan Baru adalah barang, mesin, dan/atau alat yang digunakan sebagai modal usaha atau untuk menghasilkan sesuatu, yang masih layak pakai, atau untuk direkondisi, remanufakturing, digunakan kembali dan bukan skrap.",
DOC349,bn228-2014.txt,,,Pasal 1,5,,"Izin Usaha Industri adalah izin yang diberikan kepada perusahaan industri untuk melakukan kegiatan industri, yang diterbitkan oleh instansi berwenang sesuai dengan ketentuan perundang-undangan.",
DOC349,bn228-2014.txt,,,Pasal 1,6,,Rekomendasi adalah pertimbangan teknis untuk melakukan importasi Barang Modal Bukan Baru.,
DOC349,bn228-2014.txt,,,Pasal 1,7,,Pengembangan Ekspor adalah peningkatan kemampuan perusahaan industri untuk mengekspor hasil produksinya.,
DOC349,bn228-2014.txt,,,Pasal 1,8,,Investasi adalah segala bentuk kegiatan penanaman modal oleh investor dalam negeri dan/atau asing untuk melakukan usaha di wilayah Negara Kesatuan Republik Indonesia.,
DOC349,bn228-2014.txt,,,Pasal 1,9,,Relokasi Industri adalah pemindahan sebagian atau seluruh mesin dan peralatan dari pabrik di luar negeri ke wilayah Negara Kesatuan Republik Indonesia untuk difungsikan kembali dalam kegiatan produksi.,
DOC349,bn228-2014.txt,,,Pasal 1,10,,"Pembangunan Infrastruktur adalah pembangunan sistem fisik yang terkait dengan penyediaan transportasi, air, bangunan, dan fasilitas publik lain yang diperlukan untuk memenuhi kebutuhan dasar manusia secara ekonomi dan sosial.",
DOC349,bn228-2014.txt,,,Pasal 1,11,,"Kemampuan Rekondisi adalah kapasitas produksi Perusahaan Rekondisi, termasuk fasilitas mesin dan peralatannya sesuai dengan hasil penilaian teknis layak dan mampu untuk melakukan usaha jasa pemulihan dan perbaikan, serta dapat memproses Barang Modal Bukan Baru menjadi produk akhir, termasuk Kemampuan Pelayanan Purna Jual.",
DOC349,bn228-2014.txt,,,Pasal 1,12,,"Kemampuan Remanufakturing adalah kapasitas produksi Perusahaan Remanufakturing, termasuk fasilitas mesin dan peralatannya sesuai dengan hasil penilaian teknis layak dan mampu untuk melakukan usaha jasa pemulihan dan perbaikan serta dapat memproses komponen alat berat bukan baru menjadi produk akhir yang sesuai dengan spesifikasi teknis setara dengan produk baru dan digaransi oleh pemegang merek, termasuk Kemampuan Pelayanan Purna Jual.",
DOC349,bn228-2014.txt,,,Pasal 1,13,,"Kemampuan Pelayanan Purna Jual adalah kemampuan Perusahaan Rekondisi atau Perusahaan Remanufakturing untuk memberikan: a. pelayanan purna jual masa garansi berupa jaminan pemeriksaan, perbaikan dan/atau penggantian bila barang hasil rekondisi/remanufakturing tidak berfungsi; dan b. pelayanan purna jual pasca garansi berupa jaminan perawatan berkala, perbaikan, penggantian, dan ketersediaan komponen dari barang hasil rekondisi/remanufakturing.",
DOC349,bn228-2014.txt,,,Pasal 1,14,,"Survey Kemampuan Perusahaan Rekondisi dan Perusahaan Remanufakturing adalah kegiatan penilaian terhadap kemampuan Perusahaan Rekondisi dan Perusahaan Remanufakturing, termasuk kemampuan pelayanan purna jual.",
DOC349,bn228-2014.txt,,,Pasal 1,15,,Direktur Jenderal adalah Direktur Jenderal Industri Unggulan Berbasis Teknologi Tinggi.,
DOC349,bn228-2014.txt,,,Pasal 1,16,,"Direktur Pembina Industri adalah Direktur Industri Alat Transportasi Darat, Direktur Industri Maritim, Kedirgantaraan, dan Alat Pertahanan, Direktur Industri Elektronika dan Telematika, Direktur Industri Permesinan dan Alat Mesin Pertanian, dan Direktur Pembina Industri terkait di lingkungan Kementerian Perindustrian. Perusahaan yang akan mengimpor Barang Modal Bukan Baru yang harus memperoleh Rekomendasi dari Kementerian Perindustrian adalah sebagai berikut: a. Perusahaan Rekondisi yang mengimpor Barang Modal Bukan Baru sebagaimana tercantum dalam Lampiran Peraturan Menteri Perdagangan Nomor 75/M-DAG/PER/12/2013, selain Pos Tarif/HS 8901, 8902, 8903, 8904, dan 8905; b. Perusahaan Remanufakturing yang mengimpor Barang Modal Bukan Baru sebagaimana tercantum dalam Lampiran Peraturan Menteri Perdagangan Nomor 75/M-DAG/PER/12/2013, selain Pos Tarif/HS 8901, 8902, 8903, 8904, dan 8905; c. Perusahaan Pemakai Langsung yang akan mengimpor Barang Modal Bukan Baru dengan Pos Tarif/HS 84, 85, 8901, 8902, 8903, 8904, dan 8905 yang berusia di atas 20 (dua puluh) tahun sebagaimana tercantum dalam Lampiran Peraturan Menteri Perdagangan Nomor 75/M-DAG/PER/12/2013; d. Perusahaan Pemakai Langsung yang akan mengimpor Barang Modal Bukan Baru yang tidak tercantum dalam Lampiran Peraturan Menteri Perdagangan Nomor 75/M-DAG/PER/12/2013 dengan tujuan:",
DOC349,bn228-2014.txt,,,Pasal 2,1,,Pengembangan Ekspor dan Investasi;,
DOC349,bn228-2014.txt,,,Pasal 2,2,,Relokasi Industri; atau,
DOC349,bn228-2014.txt,,,Pasal 2,3,,"Pembangunan Infrastruktur. e. Perusahaan Rekondisi yang akan mengimpor Barang Modal Bukan Baru dengan pos tarif 8701.20, 8704, 8705, 8706, 8707, 8708, 8716 untuk keperluan otomotif yang tidak tercantum dalam Lampiran Peraturan Menteri Perdagangan Nomor 75/M-DAG/PER/12/2013 dengan mempertimbangkan kemampuan industri dalam negeri.",
DOC349,bn228-2014.txt,,,Pasal 2,3,2,Rekomendasi sebagaimana dimaksud pada ayat (1) berlaku selama 6 (enam) bulan sejak tanggal diterbitkan.,
DOC349,bn228-2014.txt,,,Pasal 2,3,3,"Ketentuan lebih lanjut mengenai pemberian rekomendasi sebagaimana dimaksud pada ayat (1) diatur dengan Peraturan Direktur Jenderal. Barang Modal Bukan Baru sebagaimana dimaksud dalam Pasal 2 ayat (1) huruf a, huruf b dengan Pos Tarif/HS 84 dan 85, dan huruf c harus berusia paling lama 20 (dua puluh) tahun, kecuali untuk Pos Tarif/HS 8471.41.10.00 dan 8471.50.10.00 dengan spesifikasi paling rendah Core 2 Duo atau yang setara, serta Pos Tarif/HS 8528.51.20.00 hanya untuk monitor jenis LCD atau LED dengan usia paling lama 5 (lima) tahun dan berlokasi di kawasan berikat.",
DOC349,bn228-2014.txt,,,Pasal 4,,1,"Penilaian kemampuan rekondisi dan kemampuan remanufakturing sebagaimana dimaksud dalam Pasal 2 ayat (1) huruf a dan huruf b, dilakukan oleh surveyor independen yang memiliki surat izin usaha jasa survey dan menjadi anggota International Federation of Inspection Agency (IFIA).",
DOC349,bn228-2014.txt,,,Pasal 4,,2,Rekomendasi sebagaimana dimaksud dalam Pasal 2 ayat (1) diterbitkan oleh:,
DOC349,bn228-2014.txt,,,Pasal 4,1,,Direktur Jenderal IUBTT bagi Perusahaan Pemakai Langsung sebagaimana dimaksud pada Pasal 2 ayat (1) huruf c dan huruf d;,
DOC349,bn228-2014.txt,,,Pasal 4,2,,Perusahaan Rekondisi sebagaimana dimaksud pada Pasal 2 ayat (1) huruf e;,
DOC349,bn228-2014.txt,,,Pasal 4,3,,Direktur Pembina Industri bagi Perusahaan Rekondisi dan/atau Perusahaan Remanufakturing sebagaimana dimaksud dalam Pasal 2 ayat (1) huruf a dan huruf b. Permohonan Rekomendasi sebagaimana dimaksud dalam Pasal 2 disampaikan kepada Direktur Jenderal atau Direktur Pembina Industri melalui Unit Pelayanan Publik Kementerian Perindustrian dengan ketentuan: a. Perusahaan Rekondisi melampirkan dokumen sebagai berikut:,
DOC349,bn228-2014.txt,,,Pasal 5,1,,fotokopi Izin Usaha Industri yang kegiatan usahanya melakukan rekondisi;,
DOC349,bn228-2014.txt,,,Pasal 5,2,,fotokopi Angka Pengenal Impor (API);,
DOC349,bn228-2014.txt,,,Pasal 5,3,,fotokopi Nomor Pokok Wajib Pajak (NPWP);,
DOC349,bn228-2014.txt,,,Pasal 5,4,,"rencana impor Barang Modal Bukan Baru yang meliputi jumlah, jenis, spesifikasi teknis, nomor Pos Tarif/HS sepuluh digit, tahun pembuatan, pelabuhan muat, dan pelabuhan tujuan;",
DOC349,bn228-2014.txt,,,Pasal 5,5,,hasil survey kemampuan Perusahaan Rekondisi yang diterbitkan oleh Surveyor sebagaimana dimaksud dalam Pasal 4 ayat (1);,
DOC349,bn228-2014.txt,,,Pasal 5,6,,fotokopi kartu kendali/realisasi impor terakhir; dan,
DOC349,bn228-2014.txt,,,Pasal 5,7,,bukti kepemilikan bengkel rekondisi. b. Perusahaan Remanufakturing melampirkan dokumen sebagai berikut:,
DOC349,bn228-2014.txt,,,Pasal 5,1,,fotokopi Izin Usaha Industri yang kegiatan usahanya melakukan remanufakturing;,
DOC349,bn228-2014.txt,,,Pasal 5,2,,"rencana impor Barang Modal Bukan Baru yang meliputi jumlah, jenis, spesifikasi teknis, nomor Pos Tarif/HS sepuluh digit, tahun pembuatan, pelabuhan muat, dan pelabuhan tujuan;",
DOC349,bn228-2014.txt,,,Pasal 5,3,,hasil survey kemampuan Perusahaan Remanufakturing yang diterbitkan oleh Surveyor sebagaimana dimaksud dalam Pasal 4 ayat (1);,
DOC349,bn228-2014.txt,,,Pasal 5,4,,fotokopi kartu kendali/realisasi impor terakhir; dan,
DOC349,bn228-2014.txt,,,Pasal 5,5,,"bukti kepemilikan bengkel remanufakturing. c. Perusahaan Pemakai Langsung yang mengimpor Barang Modal Bukan Baru dengan Pos Tarif/HS 84, 85, 8901, 8902, 8903, 8904, dan 8905 yang berusia lebih dari 20 (dua puluh) tahun melampirkan dokumen sebagai berikut:",
DOC349,bn228-2014.txt,,,Pasal 5,1,,fotokopi izin usaha yang dikeluarkan oleh instansi yang berwenang sesuai peraturan perundang-undangan;,
DOC349,bn228-2014.txt,,,Pasal 5,2,,fotokopi Angka Pengenal Impor (API);,
DOC349,bn228-2014.txt,,,Pasal 5,3,,fotokopi Nomor Pokok Wajib Pajak (NPWP);,
DOC349,bn228-2014.txt,,,Pasal 5,4,,"rencana impor Barang Modal Bukan Baru yang meliputi jumlah, jenis, fungsi, spesifikasi teknis, nomor Pos Tarif/HS sepuluh digit, tahun pembuatan, pelabuhan muat, pelabuhan tujuan, dan laporan produksi 2 (dua) tahun terakhir Barang Modal Bukan Baru; dan",
DOC349,bn228-2014.txt,,,Pasal 5,5,,surat pernyataan bermaterai cukup yang menjelaskan bahwa Barang Modal Bukan Baru yang akan diimpor digunakan untuk salah satu tujuan sebagaimana dimaksud dalam Pasal 2 ayat (1) huruf c dan tidak untuk dijadikan barang skrap (scrap). d. Perusahaan Pemakai Langsung sebagaimana dimaksud dalam Pasal 2 ayat (1) huruf d yang mengimpor Barang Modal Bukan Baru yang tidak tercantum dalam Peraturan Menteri Perdagangan Nomor 75/M-DAG/PER/12/2013 melampirkan dokumen sebagai berikut:,
DOC349,bn228-2014.txt,,,Pasal 5,1,,fotokopi Izin Usaha Industri yang dikeluarkan oleh instansi yang berwenang sesuai peraturan perundang-undangan;,
DOC349,bn228-2014.txt,,,Pasal 5,2,,fotokopi Angka Pengenal Impor (API);,
DOC349,bn228-2014.txt,,,Pasal 5,3,,fotokopi Nomor Pokok Wajib Pajak (NPWP);,
DOC349,bn228-2014.txt,,,Pasal 5,4,,"rencana impor Barang Modal Bukan Baru yang meliputi jumlah, jenis, spesifikasi teknis, nomor Pos Tarif/HS sepuluh digit, tahun pembuatan, pelabuhan muat dan pelabuhan tujuan Barang Modal Bukan Baru; dan",
DOC349,bn228-2014.txt,,,Pasal 5,5,,"surat pernyataan bermaterai cukup yang menjelaskan bahwa Barang Modal Bukan Baru yang akan diimpor untuk salah satu tujuan sebagaimana dimaksud dalam Pasal 2 huruf c dan tidak untuk dijadikan barang skrap (scrap) yang dilengkapi dengan dokumen pendukung. e. Perusahaan Rekondisi yang akan mengimpor Barang Modal Bukan Baru dengan pos tarif 8701.20, 8704, 8705, 8706, 8707, 8708, 8716 untuk keperluan otomotif yang tidak tercantum dalam Peraturan Menteri Perdagangan Nomor 75/M-DAG/PER/12/2013 melampirkan dokumen sebagai berikut:",
DOC349,bn228-2014.txt,,,Pasal 5,1,,fotokopi Izin Usaha Industri yang dikeluarkan oleh instansi yang berwenang sesuai peraturan perundang-undangan;,
DOC349,bn228-2014.txt,,,Pasal 5,2,,fotokopi Angka Pengenal Impor (API);,
DOC349,bn228-2014.txt,,,Pasal 5,3,,fotokopi Nomor Pokok Wajib Pajak (NPWP);,
DOC349,bn228-2014.txt,,,Pasal 5,4,,"rencana impor Barang Modal Bukan Baru yang meliputi jumlah, jenis, spesifikasi teknis, nomor Pos Tarif/HS sepuluh digit, tahun pembuatan, pelabuhan muat dan pelabuhan tujuan Barang Modal Bukan Baru;",
DOC349,bn228-2014.txt,,,Pasal 5,5,,hasil survey kemampuan Perusahaan Rekondisi yang diterbitkan oleh Surveyor sebagaimana dimaksud dalam Pasal 4 ayat (1);,
DOC349,bn228-2014.txt,,,Pasal 5,6,,fotokopi kartu kendali/realisasi impor terakhir; dan,
DOC349,bn228-2014.txt,,,Pasal 5,7,,"bukti kepemilikan bengkel rekondisi. Direktur Jenderal atau Direktur Pembina Industri menerbitkan Rekomendasi atau menolak permohonan Rekomendasi paling lambat 5 (lima) hari kerja sejak diterima permohonan sebagaimana dimaksud dalam Pasal 5 secara lengkap dan benar. Direktorat Pembina Industri melakukan monitoring dan evaluasi terhadap Perusahaan Rekondisi dan/atau Perusahaan Remanufakturing maupun Perusahaan Pemakai Langsung yang telah memperoleh Rekomendasi. Ketentuan lebih lanjut mengenai pelaksanaan Peraturan Menteri ini diatur dengan Peraturan Direktur Jenderal. Demikianlah ketentuan ini ditetapkan untuk dilaksanakan. MENTERI PERINDUSTRIAN REPUBLIK INDONESIA, [Nama Pejabat] Dengan Rahmat Tuhan Yang Maha Esa",
DOC349,bn228-2014.txt,,,Pasal 8,1,,"bahwa untuk melaksanakan ketentuan Pasal 4 ayat (1) Peraturan Menteri ini, perlu diatur ketentuan lebih lanjut mengenai pedoman teknis pelaksanaan penilaian kemampuan rekondisi dan kemampuan remanufakturing;",
DOC349,bn228-2014.txt,,,Pasal 8,2,,"bahwa dengan demikian, perlu menetapkan Peraturan Menteri tentang Pedoman Teknis Pelaksanaan Penilaian Kemampuan Rekondisi dan Kemampuan Remanufakturing. a. Undang-Undang Nomor 3 Tahun 2014 tentang Perindustrian; b. Peraturan Pemerintah Nomor 24 Tahun 2014 tentang Pelaksanaan Undang-Undang Nomor 3 Tahun 2014 tentang Perindustrian; c. Peraturan Menteri Perindustrian Nomor 14 Tahun 2015 tentang Penilaian Kemampuan Rekondisi dan Kemampuan Remanufakturing. Menetapkan: PERATURAN MENTERI PERINDUSTRIAN TENTANG PEDOMAN TEKNIS PELAKSANAAN PENILAIAN KEMAMPUAN REKONDISI DAN KEMAMPUAN REMANUFATURING. Dalam Peraturan Menteri ini yang dimaksud dengan:",
DOC349,bn228-2014.txt,,,Pasal 1,1,,Kemampuan Rekondisi adalah kemampuan untuk memperbaiki dan mengembalikan fungsi suatu barang agar dapat digunakan kembali.,
DOC349,bn228-2014.txt,,,Pasal 1,2,,"Kemampuan Remanufakturing adalah kemampuan untuk memproduksi kembali suatu barang dengan menggunakan komponen yang telah diproses ulang. Ketentuan lebih lanjut mengenai pedoman teknis pelaksanaan penilaian kemampuan rekondisi dan kemampuan remanufakturing sebagaimana dimaksud dalam Pasal 4 ayat (1) diatur dengan Peraturan Direktur Jenderal. Peraturan Menteri ini mulai berlaku pada tanggal diundangkan dan berakhir pada tanggal 31 Desember 2016. Agar setiap orang mengetahuinya, memerintahkan pengundangan Peraturan Menteri ini dengan penempatannya dalam Berita Negara Republik Indonesia. MENTERI PERINDUSTRIAN REPUBLIK INDONESIA, MOHAMAD S. HIDAYAT Diundangkan di Jakarta pada tanggal 17 Februari 2014 MENTERI HUKUM DAN HAK ASASI MANUSIA REPUBLIK INDONESIA, AMIR SYAMSUDIN",
