doc_id,nama_dokumen,bab,bagian,pasal,angka,ayat,isi,penjelasan
DOC387,bn324-2020.txt,,,,1,,"Di antara Pasal 37 dan Pasal 38 disisipkan 1 (satu) pasal, yakni Pasal 37A sehingga berbunyi sebagai berikut:",
DOC387,bn324-2020.txt,,,Pasal 37,,1,Ketentuan dalam Peraturan Menteri ini tidak berlaku terhadap Impor Barang Modal Dalam Keadaan Tidak Baru sebagaimana tercantum dalam Lampiran VI yang merupakan bagian tidak terpisahkan dari Peraturan Menteri ini.,
DOC387,bn324-2020.txt,,,Pasal 37,,2,Impor Barang Modal Dalam Keadaan Tidak Baru sebagaimana dimaksud pada ayat (1) harus memperoleh rekomendasi dari Ketua Pelaksana Gugus Tugas Percepatan Penanganan Corona Virus Disease 2019 (Covid-19) atau pejabat yang ditunjuk.,
DOC387,bn324-2020.txt,,,Pasal 37,,3,Ketentuan sebagaimana dimaksud pada ayat (1) dan ayat (2) berlaku sampai dengan tanggal 30 Juni 2020.,
DOC387,bn324-2020.txt,,,Pasal 37,2,,"Di antara Pasal 43 dan Pasal 44 disisipkan 1 (satu) pasal, yakni Pasal 43A sehingga berbunyi sebagai berikut:",
DOC387,bn324-2020.txt,,,Pasal 43,,1,"Pada saat Peraturan Menteri ini mulai berlaku, Barang Modal Dalam Keadaan Tidak Baru sebagaimana dimaksud dalam Pasal 37A yang dikapalkan dari pelabuhan muat paling lambat tanggal 30 Juni 2020 dikecualikan dari: a. Persetujuan Impor; dan b. Laporan Surveyor, sebagaimana diatur dalam Peraturan Menteri Perdagangan Nomor 118 Tahun 2018 tentang Ketentuan Impor Barang Modal Dalam Keadaan Tidak Baru (Berita Negara Republik Indonesia Tahun 2018 Nomor 1703) sebagaimana telah diubah dengan Peraturan Menteri Perdagangan Nomor 76 Tahun 2019 tentang Perubahan atas Peraturan Menteri Perdagangan Nomor 118 Tahun 2018 tentang Ketentuan Impor Barang Modal Dalam Keadaan Tidak Baru (Berita Negara Republik Indonesia Tahun 2019 Nomor 1245).",
DOC387,bn324-2020.txt,,,Pasal 43,,2,Pengapalan Barang Modal Dalam Keadaan Tidak Baru sebagaimana dimaksud pada ayat (1) dibuktikan dengan Bill of Lading atau Air Waybill.,
DOC387,bn324-2020.txt,,,Pasal 43,3,,"Ketentuan dalam Lampiran Peraturan Menteri Perdagangan Nomor 118 Tahun 2018 tentang Ketentuan Impor Barang Modal Dalam Keadaan Tidak Baru (Berita Negara Republik Indonesia Tahun 2018 Nomor 1703) sebagaimana telah diubah dengan Peraturan Menteri Perdagangan Nomor 76 Tahun 2019 tentang Perubahan atas Peraturan Menteri Perdagangan Nomor 118 Tahun 2018 tentang Ketentuan Impor Barang Modal Dalam Keadaan Tidak Baru (Berita Negara Republik Indonesia Tahun 2019 Nomor 1245) ditambahkan 1 (satu) angka yakni angka VI sehingga menjadi sebagaimana tercantum dalam Lampiran yang merupakan bagian tidak terpisahkan dari Peraturan Menteri ini. Pasal II Peraturan Menteri ini mulai berlaku pada tanggal diundangkan. Agar setiap orang mengetahuinya, memerintahkan pengundangan Peraturan Menteri ini dengan penempatannya dalam Berita Negara Republik Indonesia. MENTERI PERDAGANGAN REPUBLIK INDONESIA, ttd AGUS SUPARMANTO Diundangkan di Jakarta pada tanggal 2 April 2020 DIREKTUR JENDERAL PERATURAN PERUNDANG-UNDANGAN KEMENTERIAN HUKUM DAN HAK ASASI MANUSIA REPUBLIK INDONESIA, ttd WIDODO EKATJAHJANA LAMPIRAN VI PERATURAN MENTERI PERDAGANGAN REPUBLIK INDONESIA NOMOR 37 TAHUN 2020 TENTANG PERUBAHAN KEDUA ATAS PERATURAN MENTERI PERDAGANGAN NOMOR 118 TAHUN 2018 TENTANG KETENTUAN IMPOR BARANG MODAL DALAM KEADAAN TIDAK BARU BARANG MODAL DALAM KEADAAN TIDAK BARU YANG DAPAT DIIMPOR DALAM RANGKA PENANGANAN COVID-19 - Peralatan mekano-terapi; aparatus pijit; aparatus penguji kecerdasan psikologis; aparatus terapi ozon, terapi oksigen, terapi aerosol, nafas buatan atau pernapasan terapeutik lainnya. - Aparatus terapi ozon, terapi oksigen, terapi aerosol, nafas buatan atau aparatus pernafasan terapeutik lainnya (HS Code: 9019.20.00). - Peralatan nafas dan masker gas lainnya, tidak termasuk masker pelindung yang tidak mempunyai bagian mekanis maupun filter yang dapat diganti (HS Code: 9020.00.00).",
