doc_id,nama_dokumen,bab,bagian,pasal,angka,ayat,isi,penjelasan
DOC398,bn340-2022.txt,,,Pasal 2,1,,"Changchun Dahe Bio Technology Development Co., Ltd. - 24,61%",
DOC398,bn340-2022.txt,,,Pasal 2,2,,"Changchun Dacheng Industrial Group Huicheng International Co., Ltd - 24,61%",
DOC398,bn340-2022.txt,,,Pasal 2,3,,"Eppen Biotech - 14,65%",
DOC398,bn340-2022.txt,,,Pasal 2,4,,"Meihua Group International Trading (Hongkong) Limited - 6,02%",
DOC398,bn340-2022.txt,,,Pasal 2,5,,"Xinjiang Meihua Amino Acid Co., Ltd. - 6,02%",
DOC398,bn340-2022.txt,,,Pasal 2,6,,"Jilin Meihua Amino Acid Co., Ltd - 6,02%",
DOC398,bn340-2022.txt,,,Pasal 2,7,,"Perusahaan Lainnya - 33,20% Pengenaan Bea Masuk Antidumping sebagaimana dimaksud dalam Pasal 1 merupakan: a. tambahan atas bea masuk umum (Most Favoured Nation) yang telah dikenakan; atau b. tambahan atas bea masuk preferensi berdasarkan skema perjanjian atau kesepakatan internasional yang berlaku yang telah dikenakan, dalam hal impor dilakukan dari negara yang termasuk dalam skema perjanjian atau kesepakatan internasional dimaksud dan memenuhi ketentuan dalam skema perjanjian atau kesepakatan internasional. Dalam hal ketentuan dalam skema perjanjian atau kesepakatan internasional tidak terpenuhi, pengenaan Bea Masuk Antidumping atas importasi dari negara yang termasuk dalam skema perjanjian atau kesepakatan internasional sebagaimana dimaksud pada ayat (1) huruf b merupakan tambahan atas bea masuk umum (Most Favoured Nation). Besaran Bea Masuk Antidumping sebagaimana dimaksud dalam Pasal 2 berlaku sepenuhnya terhadap barang impor lisin, ester dan garamnya untuk pakan ternak (feed grade) yang: a. dokumen pemberitahuan pabean impornya telah mendapat nomor pendaftaran dari Kantor Pabean tempat penyelesaian kewajiban pabean, dalam hal penyelesaian kewajiban pabean dilakukan dengan pengajuan pemberitahuan pabean; atau b. tarif dan nilai pabeannya ditetapkan oleh Kantor Pabean tempat penyelesaian kewajiban pabean, dalam hal penyelesaian kewajiban pabean dilakukan tanpa pengajuan pemberitahuan pabean. Barang impor berupa lisin, ester dan garamnya yang diimpor dari Republik Rakyat Tiongkok selain yang digunakan sebagai bahan pakan ternak (feed grade) pada pos tarif ex 2922.41.00 tidak dikenakan Bea Masuk Antidumping, yang wajib dibuktikan dengan menyerahkan Surat Keterangan Impor dari Badan Pengawas Obat dan Makanan. Importir wajib menyerahkan Surat Keterangan Impor sebagaimana dimaksud pada ayat (1) paling lambat pada saat penyerahan pemberitahuan pabean impor atau dokumen lain yang sejenis sebagaimana pada Pasal 4 ayat (1) huruf b dan ayat (2). Dalam hal Importir tidak menyerahkan Surat Keterangan Impor dalam waktu sebagaimana dimaksud pada ayat (2), dikenakan Bea Masuk Antidumping. Peraturan Menteri ini berlaku selama 5 (lima) tahun terhitung sejak berlakunya Peraturan Menteri ini. Peraturan Menteri ini mulai berlaku setelah 21 (dua puluh satu) hari terhitung sejak tanggal diundangkan. Agar setiap orang mengetahuinya, memerintahkan pengundangan Peraturan Menteri ini dengan penempatannya dalam Berita Negara Republik Indonesia. MENTERI KEUANGAN REPUBLIK INDONESIA, ttd SRI MULYANI INDRAWATI Diundangkan di Jakarta pada tanggal 30 Maret 2022 DIREKTUR JENDERAL PERATURAN PERUNDANG-UNDANGAN KEMENTERIAN HUKUM DAN HAK ASASI MANUSIA REPUBLIK INDONESIA, ttd BENNY RIYANTO",
