doc_id,nama_dokumen,bab,bagian,pasal,angka,ayat,isi,penjelasan
DOC397,bn34-2011.txt,,,,5,,Keputusan Presiden Nomor 56/P Tahun 2010;,
DOC397,bn34-2011.txt,,,,6,,"Keputusan Menteri Keuangan Nomor 580/KMK.04/2003 Tentang Tatalaksana Kemudahan Impor Tujuan Ekspor dan Pengawasannya sebagaimana telah beberapa kali diubah terakhir dengan Peraturan Menteri Keuangan Nomor 111/PMK.010/2006; Menetapkan: PERATURAN MENTERI KEUANGAN TENTANG PERUBAHAN KETIGA ATAS KEPUTUSAN MENTERI KEUANGAN NOMOR 580/KMK.04/2003 TENTANG TATALAKSANA KEMUDAHAN IMPOR TUJUAN EKSPOR DAN PENGAWASANNYA. Pasal I Keputusan Menteri Keuangan Nomor 580/KMK.04/2003 tentang Tatalaksana Kemudahan Impor Tujuan Ekspor dan Pengawasannya yang telah beberapa kali diubah dengan Peraturan Menteri Keuangan: a. Nomor 36/PMK.04/2005; b. Nomor 111/PMK.010/2006, diubah sebagai berikut:",
DOC397,bn34-2011.txt,,,,1,,"Ketentuan Pasal 13 ayat (1) dan ayat (3) diubah, dan ditambahkan satu ayat yakni ayat (4), sehingga Pasal 13 berbunyi sebagai berikut:",
DOC397,bn34-2011.txt,,,Pasal 13,,1,"Terhadap penjualan ke Daerah Pabean Indonesia Lainnya (DPIL) atas hasil produksi sampingan, sisa hasil produksi, hasil produksi yang rusak dan bahan baku yang rusak, yang bahan bakunya berasal dari impor, perusahaan wajib membayar: a. Bea Masuk (BM) sebesar: 1) 5% (lima persen) dikali harga jual, apabila tarif bahan bakunya 5% (lima persen) atau lebih. 2) Tarif yang berlaku dikali harga jual apabila tarif bahan bakunya kurang dari 5% (lima persen). b. Cukai sesuai dengan ketentuan tarif yang berlaku; dan c. Pajak Pertambahan Nilai (PPN) dan Pajak Penjualan atas Barang Mewah (PPnBM) yang semula tidak dipungut dengan dasar pengenaan pajak sebesar harga jual.",
DOC397,bn34-2011.txt,,,Pasal 13,,2,Terhadap barang-barang sebagaimana dimaksud pada ayat (1) sebelum dijual ke DPIL dilakukan pemeriksaan oleh Pejabat.,
DOC397,bn34-2011.txt,,,Pasal 13,,3,"Dalam hal hasil produksi sampingan, sisa hasil produksi, hasil produksi yang rusak dan bahan baku yang rusak, yang seharusnya ada di perusahaan tidak dapat dipertanggungjawabkan, selain membayar: a. Bea Masuk dan/atau Cukai, dikenakan juga denda sebesar 100% (seratus persen) dari Bea Masuk dan/atau Cukai yang seharusnya dibayar, serta bunga sesuai peraturan perundang-undangan di bidang kepabeanan dan/atau cukai; b. PPN dan PPnBM, dikenakan juga sanksi sesuai peraturan perundang-undangan di bidang perpajakan. Terhadap penjualan ke DPIL atas hasil produksi sampingan, sisa hasil produksi, hasil produksi yang rusak, dan bahan baku yang rusak sebagaimana dimaksud pada ayat (1), perusahaan wajib memungut PPN dan PPnBM.",
DOC397,bn34-2011.txt,,,Pasal 13,2,,"Diantara Pasal 26 dan Pasal 27 disisipkan 1 (satu) Pasal, yakni Pasal 26A yang berbunyi sebagai berikut: Yang dimaksud dengan Daerah Pabean Indonesia Lainnya (DPIL) dalam Peraturan Menteri Keuangan ini adalah tempat lain dalam daerah pabean sesuai peraturan perundang-undangan di bidang kepabeanan. Pasal II Peraturan Menteri Keuangan ini mulai berlaku pada tanggal diundangkan. Agar setiap orang mengetahuinya, memerintahkan pengundangan Peraturan Menteri Keuangan ini dengan penempatannya dalam Berita Negara Republik Indonesia. MENTERI KEUANGAN REPUBLIK INDONESIA, AGUS D. W. MARTOWARDOJO Diundangkan di Jakarta pada tanggal 24 Januari 2011 MENTERI HUKUM DAN HAK ASASI MANUSIA REPUBLIK INDONESIA, PATRIALIS AKBAR",
