doc_id,nama_dokumen,bab,bagian,pasal,angka,ayat,isi,penjelasan
DOC400,bn345-2010.txt,,,Pasal 3,1,,Tarif bea masuk dalam rangka ATIGA yang lebih rendah dari tarif bea masuk umum hanya diberlakukan terhadap barang impor yang dilengkapi Surat Keterangan Asal (Form D) yang telah ditandatangani oleh pejabat berwenang di negara ASEAN bersangkutan;,
DOC400,bn345-2010.txt,,,Pasal 3,2,,Importir wajib mencantumkan kode fasilitas ATIGA dan nomor referensi Surat Keterangan Asal (Form D) pada pemberitahuan impor barang; dan,
DOC400,bn345-2010.txt,,,Pasal 3,3,,"Surat Keterangan Asal (Form D) lembar asli wajib disampaikan oleh importir pada saat pengajuan pemberitahuan impor barang pada Kantor Pabean di pelabuhan pemasukan. Dengan berlakunya Peraturan Menteri Keuangan ini, terhadap impor barang yang pengajuan pemberitahuan impor barangnya telah mendapatkan nomor pendaftaran pada Kantor Pabean di pelabuhan pemasukan, berlaku ketentuan sebagai berikut:",
DOC400,bn345-2010.txt,,,Pasal 4,1,,"Impor barang yang mendapatkan nomor pendaftaran pemberitahuan impor barang sampai dengan tanggal 30 Juni 2010, menggunakan Surat Keterangan Asal (Form D) dalam rangka skema Common Effective Preferential Tariff (CEPT);",
DOC400,bn345-2010.txt,,,Pasal 4,2,,"Impor barang yang mendapatkan nomor pendaftaran pemberitahuan impor barang mulai tanggal 1 Juli 2010 sampai dengan tanggal 6 November 2010, dapat menggunakan Surat Keterangan Asal (Form D) dalam rangka skema CEPT atau Surat Keterangan Asal (Form D) dalam rangka ATIGA. Pada saat Peraturan Menteri Keuangan ini mulai berlaku, ketentuan mengenai penetapan tarif bea masuk sebagaimana diatur dalam:",
DOC400,bn345-2010.txt,,,Pasal 5,1,,Peraturan Menteri Keuangan Nomor 125/PMK.010/2006 tentang Penetapan Tarif Bea Masuk Atas Barang Impor Produk-Produk Tertentu Dalam Rangka Skema Common Effective Preferential Tariff (CEPT);,
DOC400,bn345-2010.txt,,,Pasal 5,2,,Peraturan Menteri Keuangan Nomor 129/PMK.011/2007 tentang Penetapan Tarif Bea Masuk Atas Barang Impor Dalam Rangka Skema Common Effective Preferential Tariff (CEPT) sebagaimana diubah dengan Peraturan Menteri Keuangan Nomor 127/PMK.011/2008;,
DOC400,bn345-2010.txt,,,Pasal 5,3,,"Peraturan Menteri Keuangan Nomor 247/PMK.011/2009 tentang Perubahan Klasifikasi Dan Penetapan Tarif Bea Masuk Atas Barang Impor Produk-Produk Tertentu Dalam Rangka Skema Common Effective Preferential Tariff (CEPT), dicabut dan dinyatakan tidak berlaku. Direktur Jenderal Bea dan Cukai diinstruksikan untuk melaksanakan ketentuan dalam Peraturan Menteri Keuangan ini. Peraturan Menteri Keuangan ini mulai berlaku pada tanggal diundangkan dan mempunyai daya laku surut terhitung sejak tanggal 1 Januari 2010. Agar setiap orang mengetahuinya, memerintahkan pengundangan Peraturan Menteri Keuangan ini dengan penempatannya dalam Berita Negara Republik Indonesia. MENTERI KEUANGAN REPUBLIK INDONESIA, AGUS D. W. MARTOWARDOJO Diundangkan di Jakarta pada tanggal 13 Juli 2010 MENTERI HUKUM DAN HAK ASASI MANUSIA REPUBLIK INDONESIA, PATRIALIS AKBAR Ket: Lampiran Peraturan ini dapat dilihat di www.djpp.depkumham.go.id atau www.depkeu.go.id",
