doc_id,nama_dokumen,bab,bagian,pasal,angka,ayat,isi,penjelasan
DOC449,bn422-2011.txt,,,,5,,Keputusan Presiden Nomor 56/P Tahun 2010;,
DOC449,bn422-2011.txt,,,,6,,Peraturan Menteri Keuangan Nomor 63/PMK.05/2010 tentang Mekanisme Pelaksanaan dan Pertanggungjawaban Atas Bea Masuk Ditanggung Pemerintah;,
DOC449,bn422-2011.txt,,,,7,,Peraturan Menteri Keuangan Nomor 261/PMK.011/2010 tentang Bea Masuk Ditanggung Pemerintah Atas Impor Barang dan Bahan Untuk Memproduksi Barang dan/atau Jasa Guna Kepentingan Umum dan Peningkatan Daya Saing Industri Sektor Tertentu Untuk Tahun Anggaran 2011; Menetapkan: PERATURAN MENTERI KEUANGAN TENTANG BEA MASUK DITANGGUNG PEMERINTAH ATAS IMPOR BARANG DAN BAHAN GUNA PEMBUATAN PERALATAN TELEKOMUNIKASI UNTUK TAHUN ANGGARAN 2011. Dalam Peraturan Menteri Keuangan ini yang dimaksud dengan:,
DOC449,bn422-2011.txt,,,Pasal 1,1,,Perusahaan adalah perusahaan yang termasuk dalam industri dengan kegiatan utama membuat peralatan telekomunikasi.,
DOC449,bn422-2011.txt,,,Pasal 1,2,,"Barang dan Bahan Untuk Industri Pembuatan Peralatan Telekomunikasi yang selanjutnya disebut Barang dan Bahan adalah barang jadi, barang setengah jadi dan/atau bahan baku, termasuk komponen untuk diolah, dirakit, atau dipasang, guna pembuatan peralatan telekomunikasi oleh Perusahaan.",
DOC449,bn422-2011.txt,,,Pasal 2,,1,Bea Masuk Ditanggung Pemerintah diberikan atas impor Barang dan Bahan sebagaimana tercantum dalam Lampiran Peraturan Menteri Keuangan ini yang merupakan bagian tidak terpisahkan dari Peraturan Menteri Keuangan ini.,
DOC449,bn422-2011.txt,,,Pasal 2,,2,Bea Masuk Ditanggung Pemerintah sebagaimana dimaksud pada ayat (1) merupakan belanja subsidi pajak ditanggung pemerintah sebagaimana dimaksud dalam Peraturan Menteri Keuangan mengenai mekanisme pelaksanaan dan pertanggungjawaban atas Bea Masuk Ditanggung Pemerintah.,
DOC449,bn422-2011.txt,,,Pasal 2,,3,"Bea Masuk Ditanggung Pemerintah tidak diberikan terhadap: a. Barang dan Bahan yang dikenakan tarif umum bea masuk sebesar 0% (nol persen); b. Barang dan Bahan yang dikenakan tarif bea masuk sebesar 0% (nol persen) berdasarkan perjanjian atau kesepakatan internasional; c. Barang dan Bahan yang dikenakan Bea Masuk Anti Dumping/Bea Masuk Anti Dumping Sementara, Bea Masuk Tindakan Pengamanan/Bea Masuk Tindakan Pengamanan Sementara, Bea Masuk Imbalan, Bea Masuk Tindakan Pembalasan; d. Barang dan Bahan yang diimpor ke dalam Kawasan Berikat menggunakan dokumen Pemberitahuan Pabean Impor dengan mendapat penangguhan bea masuk dan pajak dalam rangka impor; dan/atau e. Barang dan Bahan yang diimpor dalam rangka pemanfaatan fasilitas Kemudahan Impor Tujuan Ekspor.",
DOC449,bn422-2011.txt,,,Pasal 2,,4,"Bea Masuk Ditanggung Pemerintah sebagaimana dimaksud pada ayat (1), diberikan dengan pagu anggaran sebesar Rp6.450.000.000,00 (enam miliar empat ratus lima puluh juta rupiah).",
DOC449,bn422-2011.txt,,,Pasal 2,,5,"Menteri Keuangan selaku Bendahara Umum Negara sebagai Pengguna Anggaran Bagian Anggaran Bendahara Umum Negara menetapkan Direktur Jenderal Industri Unggulan Berbasis Teknologi Tinggi, Kementerian Perindustrian selaku Kuasa Pengguna Anggaran untuk melaksanakan pembayaran belanja subsidi pajak ditanggung pemerintah.",
DOC449,bn422-2011.txt,,,Pasal 2,,6,"Alokasi anggaran Bea Masuk Ditanggung Pemerintah dengan pagu sebagaimana dimaksud pada ayat (4) untuk Perusahaan, ditetapkan oleh Kuasa Pengguna Anggaran sebagaimana dimaksud pada ayat (5).",
DOC449,bn422-2011.txt,,,Pasal 3,,1,"Untuk memperoleh Bea Masuk Ditanggung Pemerintah sebagaimana dimaksud dalam Pasal 2 ayat (1), Perusahaan mengajukan permohonan kepada Direktur Jenderal Bea dan Cukai dengan dilampiri Rencana Impor Barang yang telah disetujui dan ditandasahkan oleh Direktur Jenderal Industri Unggulan Berbasis Teknologi Tinggi, Kementerian Perindustrian.",
DOC449,bn422-2011.txt,,,Pasal 3,,2,"Rencana Impor Barang sebagaimana dimaksud pada ayat (1), paling sedikit memuat elemen data sebagai berikut: - nomor dan tanggal Rencana Impor Barang; - nama Perusahaan; - Nomor Pokok Wajib Pajak; - alamat; - kantor pabean tempat pemasukan barang; - uraian, jenis dan spesifikasi teknis barang; - pos tarif (HS); - jumlah/satuan barang; - perkiraan harga impor; - negara asal; - perkiraan bea masuk yang ditanggung pemerintah; dan - pimpinan Perusahaan.",
DOC449,bn422-2011.txt,,,Pasal 4,,1,"Atas permohonan sebagaimana dimaksud dalam Pasal 3 ayat (1), Direktur Jenderal Bea dan Cukai memberikan persetujuan atau penolakan dalam jangka waktu paling lama 14 (empat belas) hari terhitung sejak permohonan diterima secara lengkap.",
DOC449,bn422-2011.txt,,,Pasal 4,,2,Persetujuan sebagaimana dimaksud pada ayat (1) dapat berupa persetujuan sebagian atau persetujuan seluruhnya atas Barang dan Bahan yang tercantum dalam Rencana Impor Barang yang dilampirkan pada permohonan yang diajukan Perusahaan sebagaimana dimaksud dalam Pasal 3.,
DOC449,bn422-2011.txt,,,Pasal 4,,3,"Dalam hal permohonan sebagaimana dimaksud dalam Pasal 3 ayat (1) disetujui sebagian atau seluruhnya, Direktur Jenderal Bea dan Cukai atas nama Menteri Keuangan menerbitkan Keputusan Menteri Keuangan mengenai Bea Masuk Ditanggung Pemerintah atas impor Barang dan Bahan guna pembuatan peralatan telekomunikasi oleh industri pembuatan peralatan telekomunikasi.",
DOC449,bn422-2011.txt,,,Pasal 4,,4,"Dalam hal permohonan sebagaimana dimaksud dalam Pasal 3 ayat (1) ditolak, Direktur Jenderal Bea dan Cukai atas nama Menteri Keuangan menyampaikan surat pemberitahuan penolakan kepada Perusahaan dengan menyebutkan alasan penolakan.",
DOC449,bn422-2011.txt,,,Pasal 5,,1,"Atas realisasi impor Bea Masuk Ditanggung Pemerintah yang pelaksanaannya didasarkan pada Keputusan Menteri Keuangan sebagaimana dimaksud dalam Pasal 4 ayat (3), Kantor Pengawasan dan Pelayanan Bea dan Cukai atau Kantor Pelayanan Utama Bea dan Cukai setempat membubuhkan cap ""BEA MASUK DITANGGUNG PEMERINTAH BERDASARKAN PERATURAN MENTERI KEUANGAN NOMOR 112/PMK.011/2011"" pada semua lembar Pemberitahuan Pabean Impor.",
DOC449,bn422-2011.txt,,,Pasal 5,,2,"Pemberitahuan Pabean Impor sebagaimana dimaksud pada ayat (1), dipakai sebagai dasar untuk pencatatan penerimaan Bea Masuk Ditanggung Pemerintah dan dialokasikan sebagai belanja subsidi pajak dalam jumlah yang sama.",
DOC449,bn422-2011.txt,,,Pasal 6,,1,"Dalam hal terdapat perbedaan antara Barang dan Bahan yang akan diimpor dengan daftar Barang dan Bahan yang terdapat dalam Keputusan Menteri Keuangan sebagaimana dimaksud dalam Pasal 4 ayat (3), Perusahaan dapat mengajukan permohonan perubahan Keputusan Menteri Keuangan.",
DOC449,bn422-2011.txt,,,Pasal 6,,2,"Permohonan sebagaimana dimaksud pada ayat (1), diajukan kepada Direktur Jenderal Bea dan Cukai dilampiri dengan Rencana Impor Barang Perubahan yang telah disetujui dan ditandasahkan oleh Direktur Jenderal Industri Unggulan Berbasis Teknologi Tinggi, Kementerian Perindustrian.",
DOC449,bn422-2011.txt,,,Pasal 7,,1,"Atas permohonan sebagaimana dimaksud dalam Pasal 6, Direktur Jenderal Bea dan Cukai memberikan persetujuan atau penolakan dalam jangka waktu paling lama 14 (empat belas) hari terhitung sejak permohonan diterima secara lengkap.",
DOC449,bn422-2011.txt,,,Pasal 7,,2,Persetujuan atas permohonan perubahan Keputusan Menteri Keuangan sebagaimana dimaksud pada ayat (1) dapat berupa persetujuan sebagian atau persetujuan seluruhnya.,
DOC449,bn422-2011.txt,,,Pasal 7,,3,"Dalam hal permohonan sebagaimana dimaksud dalam Pasal 6 disetujui sebagian atau seluruhnya, Direktur Jenderal Bea dan Cukai atas nama Menteri Keuangan menerbitkan Keputusan Menteri Keuangan mengenai Bea Masuk Ditanggung Pemerintah atas impor Barang dan Bahan guna pembuatan peralatan telekomunikasi oleh industri pembuatan peralatan telekomunikasi.",
DOC449,bn422-2011.txt,,,Pasal 7,,4,"Dalam hal permohonan sebagaimana dimaksud dalam Pasal 6 ditolak, Direktur Jenderal Bea dan Cukai atas nama Menteri Keuangan menyampaikan surat pemberitahuan penolakan kepada Perusahaan dengan menyebutkan alasan penolakan. Pelaksanaan dan pertanggungjawaban atas Bea Masuk Ditanggung Pemerintah sebagaimana dimaksud dalam Pasal 2, dilaksanakan sesuai dengan ketentuan dalam Peraturan Menteri Keuangan yang mengatur mengenai mekanisme pelaksanaan dan pertanggungjawaban atas Bea Masuk Ditanggung Pemerintah.",
DOC449,bn422-2011.txt,,,Pasal 9,,1,"Terhadap Barang dan Bahan yang memperoleh Bea Masuk Ditanggung Pemerintah, wajib digunakan oleh Perusahaan yang bersangkutan guna pembuatan peralatan telekomunikasi dan tidak dapat dipindahtangankan kepada pihak lain.",
DOC449,bn422-2011.txt,,,Pasal 9,,2,"Atas penyalahgunaan ketentuan sebagaimana dimaksud pada ayat (1), Perusahaan diwajibkan membayar bea masuk yang seharusnya dibayar ditambah dengan bunga sebesar 2% (dua persen) per bulan paling lama 24 (dua puluh empat) bulan sejak dilakukan realisasi impor Bea Masuk Ditanggung Pemerintah sebagaimana dimaksud dalam Pasal 5 ayat (1). Peraturan Menteri Keuangan ini mulai berlaku pada tanggal diundangkan sampai dengan tanggal 31 Desember 2011. Agar setiap orang mengetahuinya, memerintahkan pengundangan Peraturan Menteri Keuangan ini dengan penempatannya dalam Berita Negara Republik Indonesia. Diundangkan di Jakarta pada tanggal 18 Juli 2011 MENTERI HUKUM DAN HAK ASASI MANUSIA REPUBLIK INDONESIA, PATRIALIS AKBAR LAMPIRAN PERATURAN MENTERI KEUANGAN NOMOR 112/PMK.011/2011 TENTANG BEA MASUK DITANGGUNG PEMERINTAH ATAS IMPOR BARANG DAN BAHAN GUNA PEMBUATAN PERALATAN TELEKOMUNIKASI UNTUK TAHUN ANGGARAN 2011. DAFTAR BARANG DAN BAHAN GUNA PEMBUATAN PERALATAN TELEKOMUNIKASI YANG MENDAPAT BEA MASUK DITANGGUNG PEMERINTAH. MASUK DITANGGUNG PEMERINTAH UNTUK TAHUN ANGGARAN 2011 TERMASUK",
DOC449,bn422-2011.txt,,,Pasal 10,1,,"Subrack untuk Modul Penyearah: Terbuat dari besi atau baja, dengan kode pos 7326.90.90.00.",
DOC449,bn422-2011.txt,,,Pasal 10,2,,"Modul Penyearah: Input AC 100-240V, output DC 12V<V<60V, daya output 750W<W<6000W, arus output 10A<A<120A, dengan kode pos 8504.40.30.00.",
DOC449,bn422-2011.txt,,,Pasal 10,3,,"Baterai Akumulator Listrik: Jenis timbal asam lainnya untuk keperluan telekomunikasi, dengan spesifikasi 2-12V dan kapasitas 30-2300AH, kode pos 8507.20.90.00.",
DOC449,bn422-2011.txt,,,Pasal 10,4,,"Pengendali Penyearah: Tegangan suplai 18-60 VDC, rentang operasi -25 hingga 70 °C, dilengkapi dengan tampilan LCD, keypad 4-6 tombol, indikator: daya menyala, alarm kritis/utama, alarm minor, kode pos 9032.89.39.00.",
DOC449,bn422-2011.txt,,,Pasal 10,5,,"Papan Input Output: Input DC 16-60 VDC, suhu -25 hingga 70 °C, 3 input arus, 2 input suhu, 6 output relay alarm, 6 input digital pengguna, kode pos 9032.90.30.00.",
DOC449,bn422-2011.txt,,,Pasal 10,6,,"Tabung Pelepasan Gas: Pelindung sirkuit listrik dengan tegangan tidak melebihi 1.000 Volt, kode pos 8536.30.00.00.",
DOC449,bn422-2011.txt,,,Pasal 10,7,,"Relay Persinyalan Kereta Api: Relay persinyalan khusus untuk kereta api, kode pos 8608.00.20.00.",
DOC449,bn422-2011.txt,,,Pasal 10,8,,"Mesin Penggerak Wessel: Tegangan AC atau DC, baik 1 atau 3 fase, tipe: 110 V, 380 V (mesin titik atau kunci titik dan detektor geser), kode pos 8608.00.20.00. www.djpp.kemenkumham.go.id",
