doc_id,nama_dokumen,bab,bagian,pasal,angka,ayat,isi,penjelasan
DOC469,bn455-2012.txt,,,,4,,Keputusan Presiden Nomor 56/P Tahun 2010; Memperhatikan:,
DOC469,bn455-2012.txt,,,,1,,Surat Menteri Perdagangan Nomor 404/M-DAG/SD/3/2012 tanggal 9 Maret 2012 perihal Usulan Penetapan Pengenaan Bea Masuk Anti Dumping Terhadap Impor Produk Keramik dari Republik Rakyat Tiongkok;,
DOC469,bn455-2012.txt,,,,2,,Surat Menteri Perdagangan Nomor 127.1/M-DAG/SD/1/2012 tanggal 25 Januari 2012 perihal Usulan Pengenaan Bea Masuk Anti Dumping Terhadap Impor Produk Keramik dari Republik Rakyat Tiongkok;,
DOC469,bn455-2012.txt,,,,3,,"Laporan Akhir Komite Anti Dumping Indonesia tentang Penyelidikan Anti Dumping Atas Impor Perangkat Makan dari Keramik (Ceramic Tableware) Pos Tarif No. 6911.10.00.00, 6911.90.00.00 dan 6912.00.00.00 Yang Berasal dari Republik Rakyat Tiongkok; Menetapkan: PERATURAN MENTERI KEUANGAN TENTANG PENGENAAN BEA MASUK ANTI DUMPING TERHADAP IMPOR PRODUK KERAMIK BERUPA PERANGKAT MAKAN, PERANGKAT DAPUR, PERALATAN RUMAH TANGGA LAINNYA, DAN PERALATAN TOILET, DARI REPUBLIK RAKYAT TIONGKOK. Terhadap impor produk keramik dari Republik Rakyat Tiongkok berupa: a. Perangkat makan dan perangkat dapur dari porselin atau tanah liat cina yang termasuk dalam pos tarif 6911.10.00.00; b. Perlengkapan rumah tangga lainnya dan peralatan toilet dari porselin atau tanah liat cina yang termasuk dalam pos tarif 6911.90.00.00; dan c. Perangkat makan, perangkat dapur, perlengkapan rumah tangga lainnya dan peralatan toilet dari keramik, selain dari porselin atau tanah liat cina yang termasuk dalam pos tarif 6912.00.00.00, dikenakan Bea Masuk Anti Dumping sebesar 87% (delapan puluh tujuh persen).",
DOC469,bn455-2012.txt,,,Pasal 2,,1,Pengenaan Bea Masuk Anti Dumping sebagaimana dimaksud dalam Pasal 1 merupakan tambahan bea masuk yang dipungut berdasarkan skema tarif Bea Masuk Preferensi untuk eksportir dan/atau produsen pada perusahaan yang berasal dari negara-negara yang memiliki kerjasama perdagangan dengan Indonesia.,
DOC469,bn455-2012.txt,,,Pasal 2,,2,"Dalam hal skema tarif Bea Masuk Preferensi sebagaimana dimaksud pada ayat (1) tidak terpenuhi, Bea Masuk Anti Dumping sebagaimana dimaksud dalam Pasal 1 merupakan tambahan Bea Masuk yang dipungut berdasarkan Bea Masuk Umum/Most Favoured Nation (MFN). Tarif Bea Masuk Anti Dumping sebagaimana dimaksud dalam Pasal 1 berlaku sepenuhnya terhadap barang impor yang dokumen pemberitahuan pabean impornya telah mendapat nomor pendaftaran dari Kantor Pabean tempat pelabuhan pemasukan sejak tanggal berlakunya Peraturan Menteri ini.",
DOC469,bn455-2012.txt,,,Pasal 4,1,,Peraturan Menteri ini berlaku selama 5 (lima) tahun terhitung mulai sejak tanggal berlakunya Peraturan Menteri ini.,
DOC469,bn455-2012.txt,,,Pasal 4,2,,"Peraturan Menteri ini mulai berlaku pada tanggal diundangkan. Agar setiap orang mengetahuinya, memerintahkan pengundangan Peraturan Menteri ini dengan penempatannya dalam Berita Negara Republik Indonesia. MENTERI KEUANGAN REPUBLIK INDONESIA, AGUS D.W. MARTOWARDOJO Diundangkan di Jakarta pada tanggal 25 April 2012 MENTERI HUKUM DAN HAK ASASI MANUSIA REPUBLIK INDONESIA, AMIR SYAMSUDIN",
