doc_id,nama_dokumen,bab,bagian,pasal,angka,ayat,isi,penjelasan
DOC491,bn516-2013.txt,,,,1,,"Peraturan Menteri Keuangan Nomor 150/PMK.011/2012 Tentang Pengenaan Bea Masuk Anti Dumping Terhadap Impor Produk Canai Lantaian Dari Besi Atau Baja Bukan Paduan Tidak Dalam Gulungan Dari Negara Republik Rakyat Tiongkok, Singapura, dan Ukraina;",
DOC491,bn516-2013.txt,,,,2,,"Surat Menteri Perdagangan Nomor 1343/M-DAG/SD/8/2012 tanggal 15 Agustus 2012 Perihal Rekomendasi Pengenaan Bea Masuk Anti Dumping Terhadap Impor Hot Rolled Plate yang berasal dari Republik Rakyat Tiongkok, Singapura, dan Ukraina; Menetapkan: PERATURAN MENTERI KEUANGAN TENTANG PERUBAHAN ATAS PERATURAN MENTERI KEUANGAN NOMOR 150/PMK.011/2012 TENTANG PENGENAAN BEA MASUK ANTI DUMPING TERHADAP IMPOR PRODUK CANAI LANTAIAN DARI BESI ATAU BAJA BUKAN PADUAN TIDAK DALAM GULUNGAN DARI NEGARA REPUBLIK RAKYAT TIONGKOK, SINGAPURA, DAN UKRAINA. Pasal I Ketentuan dalam Pasal 2 Peraturan Menteri Keuangan Nomor 150/PMK.011/2012 Tentang Pengenaan Bea Masuk Anti Dumping Terhadap Impor Produk Canai Lantaian Dari Besi Atau Baja Bukan Paduan Tidak Dalam Gulungan Dari Negara Republik Rakyat Tiongkok, Singapura, dan Ukraina, diubah sehingga berbunyi sebagai berikut: Besaran Bea Masuk Anti Dumping sebagaimana dimaksud dalam Pasal 1 ditetapkan sebagai berikut: - Besaran Bea Masuk Anti Dumping dalam Persentase (%):",
DOC491,bn516-2013.txt,,,Pasal 2,1,,"Republik Rakyat Tiongkok: 10,47%",
DOC491,bn516-2013.txt,,,Pasal 2,2,,"Singapura: 12,50%",
DOC491,bn516-2013.txt,,,Pasal 2,3,,"Ukraina: 12,33% Pasal II Peraturan Menteri ini mulai berlaku pada tanggal diundangkan. Agar setiap orang mengetahuinya, memerintahkan pengundangan Peraturan Menteri ini dengan penempatannya dalam Berita Negara Republik Indonesia. MENTERI KEUANGAN REPUBLIK INDONESIA, AGUS D.W. MARTOWARDOJO Diundangkan di Jakarta pada tanggal 1 April 2013 MENTERI HUKUM DAN HAK ASASI MANUSIA REPUBLIK INDONESIA, AMIR SYAMSUDIN",
