doc_id,nama_dokumen,bab,bagian,pasal,angka,ayat,isi,penjelasan
DOC506,bn539-2012.txt,,,,2,,Keputusan Presiden Nomor 56/P Tahun 2010;,
DOC506,bn539-2012.txt,,,,3,,Peraturan Menteri Keuangan Nomor 176/PMK.011/2009 tentang Pembebasan Bea Masuk Atas Impor Mesin Serta Barang Dan Bahan Untuk Pembangunan Atau Pengembangan Industri Dalam Rangka Penanaman Modal; **PERATURAN MENTERI KEUANGAN TENTANG PERUBAHAN ATAS PERATURAN MENTERI KEUANGAN NOMOR 176/PMK.011/2009 TENTANG PEMBEBASAN BEA MASUK ATAS IMPOR MESIN SERTA BARANG DAN BAHAN UNTUK PEMBANGUNAN ATAU PENGEMBANGAN INDUSTRI DALAM RANGKA PENANAMAN MODAL.** **Pasal I** Beberapa ketentuan dalam Peraturan Menteri Keuangan Nomor 176/PMK.011/2009 tentang Pembebasan Bea Masuk Atas Impor Mesin Serta Barang Dan Bahan Untuk Pembangunan Atau Pengembangan Industri Dalam Rangka Penanaman Modal diubah sebagai berikut:,
DOC506,bn539-2012.txt,,,,1,,"Ketentuan ayat (1) Pasal 5 diubah, sehingga berbunyi sebagai berikut:",
DOC506,bn539-2012.txt,,,,1,1,"Perusahaan yang melakukan Pembangunan sebagaimana dimaksud dalam Pasal 3 ayat (3) atau Pengembangan sebagaimana dimaksud dalam Pasal 4 ayat (3), sepanjang menggunakan Mesin produksi dalam negeri paling sedikit 30% (tiga puluh persen) dari total nilai Mesin, dapat diberikan pembebasan bea masuk sebagaimana dimaksud dalam Pasal 2 ayat (1) atas impor Barang dan Bahan untuk keperluan produksi/keperluan tambahan produksi selama 4 (empat) tahun sesuai kapasitas terpasang, dengan jangka waktu pengimporan selama 4 (empat) tahun terhitung sejak berlakunya keputusan pembebasan bea masuk. Penggunaan dan komposisi Mesin produksi dalam negeri sebagaimana dimaksud pada ayat (1), dinyatakan oleh menteri yang bertanggung jawab di bidang perindustrian atau pejabat yang ditunjuk.",
DOC506,bn539-2012.txt,,,,2,,"Di antara Pasal 5 dan Pasal 6 disisipkan 1 (satu) pasal, yakni Pasal 5A yang berbunyi sebagai berikut:",
DOC506,bn539-2012.txt,,,,2,1,"Terhadap Perusahaan yang telah memperoleh fasilitas sebagaimana dimaksud dalam Pasal 5 ayat (1) tetapi belum merealisasikan seluruh importasi Barang dan Bahan dalam jangka waktu 4 (empat) tahun dikarenakan adanya ketentuan tata niaga impor berupa kuota impor berdasarkan peraturan menteri yang bertanggung jawab di bidang perdagangan, dapat diberikan perpanjangan jangka waktu importasi selama 1 (satu) tahun sejak diterbitkan keputusan persetujuan perpanjangan, dengan jumlah sebesar sisa alokasi impor yang belum direalisasikan. Perpanjangan jangka waktu importasi sebagaimana dimaksud pada ayat (1) hanya diberikan untuk 1 (satu) kali. Pemberian perpanjangan jangka waktu importasi sebagaimana dimaksud pada ayat (1), dengan memperhitungkan jumlah Barang dan Bahan guna kebutuhan produksi selama 1 (satu) tahun dan memperhatikan penetapan alokasi kuota yang diberikan oleh menteri yang bertanggung jawab di bidang perdagangan. Fasilitas pembebasan bea masuk sebagaimana dimaksud dalam Pasal 3, Pasal 4, dan Pasal 5, berlaku juga untuk industri perakitan kendaraan bermotor termasuk industri komponen kendaraan bermotor.",
DOC506,bn539-2012.txt,,,Pasal 7,,1,"Untuk mendapatkan fasilitas pembebasan bea masuk atas impor Mesin dan/atau Barang dan Bahan untuk Pembangunan industri, Perusahaan mengajukan permohonan yang ditandatangani oleh pimpinan Perusahaan kepada Kepala Badan Koordinasi Penanaman Modal.",
DOC506,bn539-2012.txt,,,Pasal 7,,2,"Permohonan untuk mendapatkan fasilitas pembebasan bea masuk atas impor Mesin sebagaimana dimaksud pada ayat (1), harus dilampiri dengan: a. Akta pendirian Perusahaan; b. Surat Persetujuan Penanaman Modal; c. Nomor Pokok Wajib Pajak (NPWP) dan tanda terima pengajuan sebagai Pengusaha Kena Pajak; d. Nomor Identitas Kepabeanan (NIK); e. Angka Pengenal Impor (API/APIT/API-P); f. Daftar Mesin meliputi jumlah, jenis, spesifikasi teknis secara rinci per pelabuhan tempat pemasukan; dan g. Uraian ringkas proses produksi bagi industri yang menghasilkan barang atau uraian ringkas kegiatan usaha bagi industri jasa.",
DOC506,bn539-2012.txt,,,Pasal 7,,3,"Permohonan untuk mendapatkan fasilitas pembebasan bea masuk atas impor Barang dan Bahan sebagaimana dimaksud pada ayat (1), harus dilampiri dengan: a. Surat pernyataan dari instansi teknis terkait yang berisi keterangan tentang komposisi Mesin telah memenuhi persyaratan sebagaimana dimaksud dalam Pasal 5 ayat (2), dalam hal Perusahaan menggunakan Mesin produksi buatan dalam negeri; b. Daftar Barang dan Bahan meliputi jumlah, jenis, spesifikasi teknis secara rinci per pelabuhan tempat pemasukan; dan c. Pemberitahuan pabean impor Mesin atau faktur pembelian Mesin dalam negeri atas Pembangunan sebagaimana dimaksud dalam Pasal 3.",
DOC506,bn539-2012.txt,,,Pasal 8,,1,"Untuk mendapatkan fasilitas pembebasan bea masuk atas impor Mesin dan/atau Barang dan Bahan untuk Pengembangan industri, Perusahaan mengajukan permohonan yang ditandatangani oleh pimpinan Perusahaan kepada Kepala Badan Koordinasi Penanaman Modal.",
DOC506,bn539-2012.txt,,,Pasal 8,,2,"Permohonan untuk mendapatkan fasilitas pembebasan bea masuk atas impor Mesin sebagaimana dimaksud pada ayat (1), harus dilampiri dengan: a. Akta pendirian Perusahaan; b. Surat Persetujuan Penanaman Modal; c. Nomor Pokok Wajib Pajak (NPWP) dan pengukuhan sebagai Pengusaha Kena Pajak; d. Daftar Mesin meliputi jumlah, jenis, spesifikasi teknis secara rinci per pelabuhan tempat pemasukan; e. Nomor Identitas Kepabeanan (NIK); f. Angka Pengenal Impor (API/APIT/API-P); dan g. Uraian ringkas proses produksi bagi industri yang menghasilkan barang atau uraian ringkas kegiatan usaha bagi industri jasa.",
DOC506,bn539-2012.txt,,,Pasal 8,,3,"Permohonan untuk mendapatkan fasilitas pembebasan bea masuk atas impor Barang dan Bahan sebagaimana dimaksud pada ayat (1) harus dilampiri dengan: a. Surat pernyataan dari instansi teknis terkait yang berisi keterangan tentang komposisi Mesin telah memenuhi persyaratan sebagaimana dimaksud dalam Pasal 5 ayat (2), dalam hal Perusahaan menggunakan Mesin produksi buatan dalam negeri; b. Daftar Barang dan Bahan meliputi jumlah, jenis, spesifikasi teknis secara rinci per pelabuhan tempat pemasukan; dan c. Pemberitahuan pabean impor Mesin atau faktur pembelian Mesin dalam negeri atas Pengembangan sebagaimana dimaksud dalam Pasal 4.",
DOC506,bn539-2012.txt,,,Pasal 8,6,,"Di antara ayat (1) dan ayat (2) Pasal 9 disisipkan 1 (satu) ayat yakni ayat (1a), ayat (2) dan ayat (4) Pasal 9 diubah, di antara ayat (4) dan ayat (5) Pasal 9 disisipkan 1 (satu) ayat yakni ayat (4a), dan ayat (5) Pasal 9 dihapus, sehingga Pasal 9 berbunyi sebagai berikut:",
DOC506,bn539-2012.txt,,,Pasal 9,,1,"Atas permohonan sebagaimana dimaksud dalam Pasal 7 dan Pasal 8, Kepala Badan Koordinasi Penanaman Modal atas nama Menteri memberikan persetujuan atau penolakan. (1a) Persetujuan atau penolakan sebagaimana dimaksud pada ayat (1), diberikan paling lambat 7 (tujuh) hari kerja sejak permohonan diterima secara lengkap.",
DOC506,bn539-2012.txt,,,Pasal 9,,2,"Dalam hal permohonan disetujui, Kepala Badan Koordinasi Penanaman Modal atas nama Menteri menerbitkan keputusan pembebasan bea masuk beserta lampirannya berupa daftar yang paling sedikit memuat jumlah, jenis, spesifikasi, dan perkiraan harga dari Mesin dan/atau Barang dan Bahan yang diberikan pembebasan bea masuk secara rinci per pelabuhan tempat pemasukan.",
DOC506,bn539-2012.txt,,,Pasal 9,,3,"Dalam hal permohonan ditolak, Kepala Badan Koordinasi Penanaman Modal atas nama Menteri membuat surat penolakan permohonan dengan menyebutkan alasan penolakan.",
DOC506,bn539-2012.txt,,,Pasal 9,,4,Salinan keputusan pembebasan bea masuk beserta lampiran sebagaimana dimaksud pada ayat (2) antara lain ditujukan kepada Direktur Jenderal Bea dan Cukai dan Kepala Kantor Pabean tempat pemasukan barang. (4a) Salinan keputusan pembebasan bea masuk beserta lampiran sebagaimana dimaksud pada ayat (4) harus dikirimkan oleh Badan Koordinasi Penanaman Modal kepada Direktur Jenderal Bea dan Cukai dan Kepala Kantor Pabean tempat pemasukan barang dalam jangka waktu paling lambat 7 (tujuh) hari sejak keputusan pembebasan bea masuk diterbitkan.,
DOC506,bn539-2012.txt,,,Pasal 9,,5,"Dihapus. Di antara Pasal 9 dan Pasal 10 disisipkan 1 (satu) pasal, yakni Pasal 9A yang berbunyi sebagai berikut: Penerbitan keputusan pembebasan bea masuk oleh Kepala Badan Koordinasi Penanaman Modal atas nama Menteri sebagaimana dimaksud dalam Pasal 9 ayat (2), dilakukan berdasarkan pendelegasian wewenang sebagaimana diatur dalam Peraturan Presiden Nomor 27 Tahun 2009 tentang Pelayanan Terpadu Satu Pintu Di Bidang Penanaman Modal. Perusahaan yang mendapatkan pembebasan bea masuk harus menyampaikan laporan realisasi impor kepada Kepala Badan Koordinasi Penanaman Modal paling lambat 7 (tujuh) hari kerja setelah realisasi impor. Dalam hal Perusahaan tidak memenuhi ketentuan mengenai penyampaian laporan realisasi impor sebagaimana dimaksud pada ayat (1), Perusahaan tersebut dapat dikenai sanksi administratif yang ketentuannya diatur dengan Peraturan Kepala Badan Koordinasi Penanaman Modal. Mesin sebagaimana dimaksud dalam Pasal 3 dan Pasal 4, dapat dilakukan Pemindahtanganan setelah digunakan paling singkat selama 2 (dua) tahun sejak tanggal pemberitahuan pabean impor. Ketentuan jangka waktu Pemindahtanganan sebagaimana dimaksud pada ayat (1) tidak berlaku dalam hal: a. terjadi Keadaan Darurat (force majeure); b. Mesin diekspor kembali; atau c. Mesin dilakukan Pemindahtanganan kepada Perusahaan yang mendapatkan fasilitas pembebasan bea masuk untuk Pembangunan atau Pengembangan industri dalam rangka Penanaman Modal. Pemindahtanganan Mesin sebagaimana dimaksud pada ayat (1) dan ayat (2) dilakukan setelah mendapatkan izin dari Direktur Jenderal Bea dan Cukai atas nama Menteri. Terhadap Pemindahtanganan sebagaimana dimaksud pada ayat (1) yang dilakukan dalam jangka waktu paling singkat 2 (dua) tahun dan paling lama 5 (lima) tahun, mengakibatkan batalnya fasilitas pembebasan bea masuk yang diberikan dan Perusahaan wajib membayar bea masuk yang terutang. Dibebaskan dari kewajiban membayar bea masuk yang terutang sebagaimana dimaksud pada ayat (4) dalam hal: a. Pemindahtanganan Mesin dilakukan setelah jangka waktu 5 (lima) tahun sejak tanggal pemberitahuan pabean impor; atau b. Pemindahtanganan Mesin dilakukan sesuai ketentuan sebagaimana dimaksud pada ayat (2). Dalam hal Pemindahtanganan Mesin dilakukan tidak sesuai ketentuan sebagaimana dimaksud pada ayat (3), Perusahaan wajib membayar: a. bea masuk yang terutang atas Mesin asal impor; dan b. sanksi administrasi berupa denda sesuai ketentuan peraturan perundang-undangan di bidang kepabeanan. Ketentuan mengenai pembebasan bea masuk dari kewajiban membayar bea masuk sebagaimana dimaksud pada ayat (4) tidak berlaku terhadap Mesin dalam hal terjadi Keadaan Darurat (force majeure) namun Mesin tersebut masih mempunyai nilai ekonomis. Pembayaran bea masuk sebagaimana dimaksud pada ayat (7) berdasarkan harga penyerahan dengan tarif: a. jika tarif bea masuknya sebesar 5% (lima persen) atau lebih dikenakan tarif 5% (lima persen); atau b. jika tarif bea masuknya di bawah 5% (lima persen) dikenakan tarif sesuai jenis barang. Dengan Rahmat Tuhan Yang Maha Esa",
DOC506,bn539-2012.txt,,,Pasal 14,1,,"bahwa untuk meningkatkan investasi dan mendorong pertumbuhan ekonomi, perlu adanya pengaturan mengenai pembebasan bea masuk atas impor Mesin dan/atau Barang dan Bahan dalam rangka Penanaman Modal;",
DOC506,bn539-2012.txt,,,Pasal 14,2,,"bahwa berdasarkan pertimbangan sebagaimana dimaksud pada huruf a, perlu menetapkan Peraturan Menteri tentang Pembebasan Bea Masuk atas Impor Mesin dan/atau Barang dan Bahan dalam rangka Penanaman Modal. a. Undang-Undang Nomor 17 Tahun 2006 tentang Perubahan atas Undang-Undang Nomor 10 Tahun 1995 tentang Kepabeanan; b. Undang-Undang Nomor 25 Tahun 2007 tentang Penanaman Modal; c. Peraturan Presiden Nomor 91 Tahun 2017 tentang Percepatan Pelaksanaan Berusaha; d. Peraturan Menteri Keuangan Nomor 203/PMK.04/2017 tentang Tata Cara Pemberian Fasilitas Pembebasan Bea Masuk. Menetapkan: Peraturan Menteri tentang Pembebasan Bea Masuk atas Impor Mesin dan/atau Barang dan Bahan dalam rangka Penanaman Modal.",
DOC506,bn539-2012.txt,,,Pasal 15,,1,"Kepala Badan Koordinasi Penanaman Modal menyampaikan laporan secara tertulis yaitu: a. laporan mengenai persetujuan pemberian fasilitas pembebasan bea masuk; dan b. laporan mengenai realisasi impor Mesin dan/atau Barang dan Bahan, kepada Menteri melalui Kepala Badan Kebijakan Fiskal dengan tembusan kepada Direktur Jenderal Bea dan Cukai c.q. Direktur Fasilitas Kepabeanan.",
DOC506,bn539-2012.txt,,,Pasal 15,,2,"Laporan sebagaimana dimaksud pada ayat (1) disampaikan setiap 6 (enam) bulan, yaitu untuk semester pertama pada bulan Juli tahun berjalan dan untuk semester kedua pada bulan Januari tahun berikutnya.",
DOC506,bn539-2012.txt,,,Pasal 15,,3,"Laporan sebagaimana dimaksud pada ayat (1) huruf a, merupakan daftar pemberian pembebasan bea masuk dalam periode semester yang bersangkutan yang paling sedikit memuat elemen data sebagai berikut: a. Nomor dan tanggal Persetujuan Penanaman Modal atau Persetujuan Perluasan; b. Nama Perusahaan dan Nomor Pokok Wajib Pajak; c. Jenis sektor industri; d. Nilai Penanaman Modal; e. Nomor dan tanggal Surat Keputusan Pembebasan Bea Masuk; f. Uraian umum jenis Mesin dan/atau Barang dan Bahan yang akan diimpor; dan g. Perkiraan jumlah nilai pabean rencana impor Mesin dan/atau Barang dan Bahan. (3a) Laporan sebagaimana dimaksud pada ayat (1) huruf b, paling sedikit memuat jumlah, jenis, spesifikasi, dan harga dari Mesin dan/atau Barang dan Bahan yang diberikan pembebasan bea masuk secara rinci per pelabuhan tempat pemasukan.",
DOC506,bn539-2012.txt,,,Pasal 15,,4,"Pelaksanaan Peraturan Menteri ini akan dievaluasi secara periodik dengan memperhatikan laporan sebagaimana dimaksud pada ayat (1). Di antara Pasal 17 dan Pasal 18 disisipkan 1 (satu) pasal, yakni Pasal 17A yang berbunyi sebagai berikut: Pemindahtanganan atas Mesin dan/atau Barang dan Bahan yang telah mendapatkan fasilitas pembebasan bea masuk dalam rangka Penanaman Modal sebelum berlakunya Peraturan Menteri ini, diselesaikan berdasarkan ketentuan sebagaimana diatur dalam Peraturan Menteri ini. Pasal II Dengan berlakunya Peraturan Menteri ini, terhadap Perusahaan yang jangka waktu importasi Barang dan Bahan yang mendapatkan fasilitas pembebasan bea masuk sebagaimana dimaksud dalam Pasal 5 ayat (1) telah habis masa berlakunya dan Perusahaan telah menyampaikan permohonan perpanjangan sebelum berlakunya Peraturan Menteri ini, dapat diberikan perpanjangan jangka waktu importasi sebagaimana dimaksud dalam Pasal 5A dengan jumlah sebesar sisa alokasi impor yang belum direalisasikan, setelah diterbitkan keputusan persetujuan perpanjangan. Peraturan Menteri ini mulai berlaku setelah 30 (tiga puluh) hari sejak tanggal diundangkan.",
