doc_id,nama_dokumen,bab,bagian,pasal,angka,ayat,isi,penjelasan
DOC535,bn62-2011.txt,,,,4,,Keputusan Presiden Nomor 56/P Tahun 2010;,
DOC535,bn62-2011.txt,,,,5,,"Peraturan Menteri Keuangan Nomor 228/PMK.05/2010 tentang Mekanisme Pelaksanaan dan Pertanggungjawaban atas Pajak Ditanggung Pemerintah; Menetapkan: PERATURAN MENTERI KEUANGAN TENTANG PAJAK PERTAMBAHAN NILAI DITANGGUNG PEMERINTAH ATAS IMPOR BARANG UNTUK KEGIATAN USAHA HULU EKSPLORASI MINYAK DAN GAS BUMI SERTA KEGIATAN USAHA EKSPLORASI PANAS BUMI UNTUK TAHUN ANGGARAN 2011. Pajak Pertambahan Nilai terutang atas impor barang yang dipergunakan untuk kegiatan usaha hulu eksplorasi minyak dan gas bumi serta kegiatan usaha eksplorasi panas bumi oleh pengusaha di bidang kegiatan usaha hulu minyak dan gas bumi atau pengusaha di bidang kegiatan usaha panas bumi, ditanggung Pemerintah. Pajak Pertambahan Nilai ditanggung Pemerintah sebagaimana dimaksud pada ayat (1) merupakan belanja subsidi pajak ditanggung Pemerintah sebagaimana dimaksud dalam Peraturan Menteri Keuangan mengenai mekanisme pelaksanaan dan pertanggungjawaban atas pajak ditanggung Pemerintah. Pajak Pertambahan Nilai ditanggung Pemerintah sebagaimana dimaksud pada ayat (1) diberikan pagu anggaran sebagaimana ditetapkan dalam Undang-Undang Nomor 10 Tahun 2010 tentang Anggaran Pendapatan dan Belanja Negara Tahun Anggaran 2011 beserta perubahannya. Pajak Pertambahan Nilai ditanggung Pemerintah sebagaimana dimaksud dalam Pasal 1 diberikan terhadap barang yang nyata-nyata dipergunakan untuk kegiatan usaha hulu eksplorasi minyak dan gas bumi serta kegiatan usaha eksplorasi panas bumi dengan ketentuan sebagai berikut: a. barang tersebut belum dapat diproduksi di dalam negeri; b. barang tersebut sudah diproduksi di dalam negeri namun belum memenuhi spesifikasi yang dibutuhkan; atau c. barang tersebut sudah diproduksi di dalam negeri namun jumlahnya belum mencukupi kebutuhan industri. Kegiatan usaha hulu eksplorasi minyak dan gas bumi sebagaimana dimaksud pada ayat (1) adalah kegiatan yang bertujuan memperoleh informasi mengenai kondisi geologi untuk menemukan dan memperoleh perkiraan cadangan minyak dan gas bumi di wilayah yang ditentukan. Kegiatan usaha eksplorasi panas bumi sebagaimana dimaksud pada ayat (1) adalah rangkaian kegiatan yang meliputi penyelidikan geologi, geofisika, geokimia, pengeboran uji, dan pengeboran sumur eksplorasi yang bertujuan untuk memperoleh dan menambah informasi kondisi geologi bawah permukaan guna menemukan dan mendapatkan perkiraan potensi panas bumi. Pengusaha sebagaimana dimaksud dalam Pasal 1 ayat (1) meliputi: a. Pengusaha di bidang kegiatan usaha hulu minyak dan gas bumi yang mengikat kontrak kerjasama dengan Pemerintah Republik Indonesia setelah berlakunya Undang-Undang Nomor 22 Tahun 2001 tentang Minyak dan Gas Bumi. b. Pengusaha di bidang kegiatan usaha panas bumi yang telah mengikat kontrak dengan Pemerintah Republik Indonesia atau mendapat Izin Usaha Pertambangan Panas Bumi setelah tanggal 31 Desember 1994, atau pengusaha di bidang panas bumi yang mendapatkan penugasan untuk melakukan survei pendahuluan dari Pemerintah Republik Indonesia. Barang sebagaimana dimaksud dalam Pasal 1 ayat (1) adalah barang-barang yang tercantum dalam Pemberitahuan Pabean Impor yang telah mendapatkan nomor pendaftaran dari Kantor Pengawasan dan Pelayanan Bea dan Cukai atau Kantor Pelayanan Utama Bea dan Cukai pelabuhan pemasukan sejak berlakunya Peraturan Menteri Keuangan ini.",
DOC535,bn62-2011.txt,,,Pasal 5,,1,"Permohonan untuk mendapatkan Pajak Pertambahan Nilai ditanggung Pemerintah atas impor barang yang dipergunakan untuk kegiatan usaha hulu eksplorasi minyak dan gas bumi sebagaimana dimaksud dalam Pasal 2 ayat (2) diajukan kepada Direktur Jenderal Bea dan Cukai dilampiri dengan Rencana Impor Barang (RIB) yang telah disetujui dan ditandatangani oleh Direktur Jenderal Minyak dan Gas Bumi, Kementerian Energi dan Sumber Daya Mineral, memperhatikan ketentuan sebagaimana dimaksud dalam Pasal 2 ayat (1).",
DOC535,bn62-2011.txt,,,Pasal 5,,2,"Permohonan untuk mendapatkan Pajak Pertambahan Nilai ditanggung Pemerintah atas impor barang yang dipergunakan untuk kegiatan usaha eksplorasi panas bumi sebagaimana dimaksud dalam Pasal 2 ayat (3) diajukan kepada Direktur Jenderal Bea dan Cukai dilampiri dengan Rencana Impor Barang (RIB) yang telah disetujui dan ditandatangani oleh Direktur Jenderal Energi Baru, Terbarukan dan Konservasi Energi, Kementerian Energi dan Sumber Daya Mineral, memperhatikan ketentuan sebagaimana dimaksud dalam Pasal 2 ayat (1).",
DOC535,bn62-2011.txt,,,Pasal 5,,3,"RIB sebagaimana dimaksud pada ayat (1) atau ayat (2) paling sedikit memuat elemen data sebagai berikut: a. Nomor dan Tanggal RIB; b. Nama Perusahaan Kontraktor; c. Nomor Pokok Wajib Pajak (NPWP); d. Alamat; e. Dasar Kontrak; f. Wilayah Kontrak; g. Kantor Pabean Tempat Pemasukan Barang; h. Pos Tarif; i. Uraian Barang; j. Negara Asal Barang; k. Jumlah/Satuan Barang; l. Perkiraan Harga/Nilai Impor; m. Jenis Kegiatan (eksplorasi atau eksploitasi); dan n. Pimpinan Perusahaan Kontraktor. Permohonan sebagaimana dimaksud pada ayat (1) atau ayat (2) diajukan bersama-sama dalam 1 (satu) RIB dengan pengajuan permohonan pembebasan bea masuk sebagaimana dimaksud dalam Peraturan Menteri Keuangan Nomor 177/PMK.01/2007 tentang Pembebasan Bea Masuk atas Impor Barang untuk Kegiatan Usaha Hulu Minyak dan Gas Bumi serta Panas Bumi beserta perubahannya. Direktorat Jenderal Bea dan Cukai setelah menerima dokumen sebagaimana dimaksud dalam Pasal 5, selanjutnya membubuhkan cap ""PPN DITANGGUNG PEMERINTAH EKS PMK/PMK.011/2011"" pada semua lembar Pemberitahuan Pabean Impor dan Surat Setoran Pajak. Salinan RIB sebagaimana dimaksud dalam Pasal 5 ayat (1) atau ayat (2) disampaikan kepada: a. Direktur Jenderal Minyak dan Gas Bumi, Kementerian Energi dan Sumber Daya Mineral, dan Kepala Badan Pelaksana Kegiatan Usaha Hulu Minyak dan Gas Bumi untuk bidang usaha hulu minyak dan gas bumi; dan b. Direktur Jenderal Energi Baru, Terbarukan dan Konservasi Energi, Kementerian Energi dan Sumber Daya Mineral untuk bidang usaha panas bumi. Direktur Jenderal Bea dan Cukai menyampaikan Daftar Jumlah Pajak ditanggung Pemerintah setiap triwulan kepada Direktur Jenderal Pajak c.q. Direktur Potensi Kepatuhan dan Penerimaan selaku Kuasa Pengguna Anggaran untuk belanja subsidi Pajak Ditanggung Pemerintah, paling lambat akhir bulan berikutnya setelah berakhirnya triwulan.",
DOC535,bn62-2011.txt,,,Pasal 6,,4,"Berdasarkan Daftar Jumlah Pajak Ditanggung Pemerintah sebagaimana dimaksud pada ayat (3), Direktur Jenderal Pajak c.q. Direktur Potensi Kepatuhan dan Penerimaan memerintahkan kepada Pejabat Pembuat Komitmen dan Pejabat Penandatangan Surat Perintah Membayar sesuai tugasnya masing-masing untuk: a. membuat Surat Permintaan Pembayaran atas realisasi belanja subsidi pajak ditanggung pemerintah; b. membuat Surat Perintah Membayar; dan c. menyampaikan Surat Perintah Membayar kepada Kantor Pelayanan Perbendaharan Negara, Direktorat Jenderal Perbendaharaan Negara untuk mendapatkan Surat Perintah Pencairan Dana sebagai pelaksanaan pengeluaran Anggaran Pendapatan dan Belanja Negara untuk subsidi Pajak Ditanggung Pemerintah. Direktur Jenderal Pajak dan Direktur Jenderal Bea dan Cukai diinstruksikan untuk melaksanakan ketentuan dalam Peraturan Menteri Keuangan ini. Peraturan Menteri Keuangan ini mulai berlaku pada tanggal diundangkan sampai dengan tanggal 31 Desember 2011. Agar setiap orang mengetahuinya, memerintahkan pengundangan Peraturan Menteri Keuangan ini dengan penempatannya dalam Berita Negara Republik Indonesia. MENTERI KEUANGAN REPUBLIK INDONESIA, AGUS D. W. MARTOWARDOJO Diundangkan di Jakarta pada tanggal 17 Februari 2011 MENTERI HUKUM DAN HAK ASASI MANUSIA REPUBLIK INDONESIA, PATRIALIS AKBAR",
