doc_id,nama_dokumen,bab,bagian,pasal,angka,ayat,isi,penjelasan
DOC548,bn642-2013.txt,BAB I,,Pasal 1,1,,Impor Produk Hortikultura adalah serangkaian kegiatan memasukkan produk hortikultura dari luar negeri ke dalam wilayah kepabeanan negara Republik Indonesia.,
DOC548,bn642-2013.txt,BAB I,,Pasal 1,2,,Tempat Pemasukan adalah pelabuhan laut dan bandar udara yang ditetapkan oleh Menteri sebagai tempat pemasukan.,
DOC548,bn642-2013.txt,BAB I,,Pasal 1,3,,Produk Hortikultura adalah semua hasil yang berasal dari tanaman hortikultura yang masih segar atau telah diolah.,
DOC548,bn642-2013.txt,BAB I,,Pasal 1,4,,Rekomendasi Impor Produk Hortikultura yang selanjutnya disebut RIPH adalah Surat yang diterbitkan oleh Menteri Pertanian atau pejabat yang ditunjuk dan merupakan persyaratan diterbitkannya Persetujuan Impor.,
DOC548,bn642-2013.txt,BAB I,,Pasal 1,5,,Usaha Hortikultura adalah semua kegiatan untuk menghasilkan produk dan/atau menyelenggarakan jasa yang berkaitan dengan hortikultura.,
DOC548,bn642-2013.txt,BAB I,,Pasal 1,6,,"Importir Produsen Produk Hortikultura, selanjutnya disebut IP-Produk Hortikultura adalah perusahaan industri yang menggunakan Produk Hortikultura sebagai bahan baku atau bahan penolong pada proses produksi sendiri dan tidak memperdagangkan atau memindahtangankan kepada pihak lain.",
DOC548,bn642-2013.txt,BAB I,,Pasal 1,7,,"Importir Terdaftar Produk Hortikultura, yang selanjutnya disebut IT-Produk Hortikultura adalah perusahaan yang melakukan impor Produk Hortikultura untuk keperluan kegiatan usaha dengan memperdagangkan dan/atau memindahtangankan kepada pihak lain.",
DOC548,bn642-2013.txt,BAB I,,Pasal 1,8,,"Direktur Jenderal adalah Direktur Jenderal Pengolahan dan Pemasaran Hasil Pertanian, Kementerian Pertanian. Peraturan ini dimaksudkan sebagai dasar hukum dalam penerbitan RIPH yang menjadi persyaratan diterbitkannya persetujuan impor. Peraturan ini bertujuan untuk: a. meningkatkan efektivitas dan efisiensi pengelolaan impor produk hortikultura; dan b. memberikan kepastian dalam pelayanan penerbitan RIPH. PERSYARATAN DAN TATA CARA PENERBITAN REKOMENDASI IMPOR PRODUK HORTIKULTURA Bagian Kesatu Umum",
DOC548,bn642-2013.txt,BAB II,,Pasal 4,,1,Impor Produk Hortikultura dilakukan oleh perusahaan setelah mendapat persetujuan impor dari Menteri Perdagangan atau pejabat yang ditunjuk.,
DOC548,bn642-2013.txt,BAB II,,Pasal 4,,2,Persetujuan impor sebagaimana dimaksud pada ayat (1) diterbitkan setelah mendapat RIPH dari Menteri Pertanian.,
DOC548,bn642-2013.txt,BAB II,,Pasal 5,,1,Penerbitan RIPH sebagaimana dimaksud dalam Pasal 4 ayat (2) pelaksanaannya dilimpahkan kepada Direktur Jenderal atas nama Menteri Pertanian.,
DOC548,bn642-2013.txt,BAB II,,Pasal 5,,2,"RIPH sebagaimana dimaksud pada ayat (1) diterbitkan dalam bentuk surat sesuai format-1, format-2, format-3 dan/atau format-4 seperti tercantum dalam Lampiran I yang merupakan bagian tidak terpisahkan dari Peraturan ini.",
DOC548,bn642-2013.txt,BAB II,,Pasal 5,,3,RIPH paling sedikit memuat: - nomor RIPH; - nama dan alamat Perusahaan; - nama dan alamat Direktur Utama perusahaan; - nomor dan tanggal surat permohonan; - nama produk; - pos tarif/HS Produk Hortikultura; - volume; - waktu pemasukan; - lokasi Industri (untuk bahan industri); - negara asal; dan - tempat pemasuk.,
DOC548,bn642-2013.txt,BAB II,,Pasal 6,,1,"Produk hortikultura yang dapat diberikan RIPH meliputi produk hortikultura segar untuk konsumsi, segar untuk bahan baku industri, olahan untuk bahan baku industri dan olahan untuk konsumsi, seperti tercantum dalam Lampiran II yang merupakan bagian tidak terpisahkan dari Peraturan ini.",
DOC548,bn642-2013.txt,BAB II,,Pasal 6,,2,Produk Hortikultura sebagaimana dimaksud pada ayat (1) untuk konsumsi pangan harus memenuhi keamanan pangan yang diatur dengan Peraturan tersendiri.,
DOC548,bn642-2013.txt,BAB II,,Pasal 6,,3,Produk Hortikultura yang pertama kali diimpor ke dalam wilayah negara Republik Indonesia dapat dilakukan setelah Analisis Risiko Impor (Impor Risk Analysis) sesuai dengan prosedur peraturan perkarantinaan. Bagian Kedua Persyaratan Penerbitan Rekomendasi Impor Produk Hortikultura RIPH diterbitkan dengan persyaratan administrasi sebagai berikut: a. Produk Hortikultura segar untuk konsumsi meliputi: - IT-Produk Hortikultura dari Kementerian Perdagangan. - Angka Pengenal Importir Umum (API-U). - Pernyataan tidak memasukkan produk hortikultura yang melebihi 6 (enam) bulan setelah panen. b. Produk Hortikultura segar dan olahan untuk bahan baku industri meliputi: - Surat pertimbangan teknis dari Kementerian Perindustrian. - Angka Pengenal Importir Produsen (API-P). c. Produk Hortikultura olahan untuk konsumsi meliputi: - IT-Produk Hortikultura dari Kementerian Perdagangan; - Surat persetujuan pemasukan dari Badan Pengawas Obat dan Makanan. - Angka Pengenal Importir Umum (API-U). Penerbitan RIPH untuk produk segar konsumsi selain memenuhi persyaratan administrasi sebagaimana dimaksud pada ayat (1) huruf a harus dilengkapi dengan persyaratan teknis sebagai berikut: a. keterangan registrasi kebun/lahan usaha atau sertifikat GAP; b. registrasi packing house yang diterbitkan oleh instansi yang berwenang dari negara asal; c. memiliki sarana penyimpanan dan distribusi produk hortikultura yang sesuai dengan karakter dan jenis produk. Persyaratan teknis sebagaimana dimaksud pada ayat (2) huruf a dan b diterjemahkan dalam Bahasa Indonesia. Bagian Ketiga Tata Cara Penerbitan Rekomendasi Impor Produk Hortikultura Penerbitan RIPH dilakukan berdasarkan surat dari Menteri Perdagangan atau pejabat yang ditunjuk dengan dilengkapi persyaratan yang sebagaimana dimaksud dalam Pasal 7. Surat sebagaimana dimaksud pada ayat (1) paling sedikit dilengkapi informasi: a. nama produk; b. pos tarif/HS Produk Hortikultura; c. volume; d. waktu pemasukan; e. negara asal; f. tempat pemasukan. Surat sebagaimana dimaksud pada ayat (2) untuk produk hortikultura segar dan/atau olahan untuk bahan baku industri dilengkapi dengan informasi lokasi industri. Pengajuan permohonan untuk memperoleh RIPH hanya dapat dilayani dengan sistem elektronik secara online melalui portal web yang ditentukan. Portal web sebagaimana dimaksud pada ayat (1) adalah sistem aplikasi berbasis web yang dikembangkan untuk pelayanan penerbitan RIPH. Direktur Jenderal setelah menerima surat Menteri Perdagangan atau pejabat yang ditunjuk sebagaimana dimaksud dalam Pasal 8 ayat (1) dalam jangka waktu paling lama 7 (tujuh) hari kerja telah selesai memeriksa kelengkapan persyaratan RIPH sebagaimana dimaksud dalam Pasal 7.,
DOC548,bn642-2013.txt,BAB II,,Pasal 10,,2,"Dalam hal hasil pemeriksaan dokumen dinyatakan lengkap, diterbitkan RIPH.",
DOC548,bn642-2013.txt,BAB II,,Pasal 10,,3,"Dalam hal hasil pemeriksaan dokumen dinyatakan tidak lengkap, dokumen dikembalikan.",
DOC548,bn642-2013.txt,BAB II,,Pasal 11,,1,RIPH dalam satu tahun diterbitkan 2 (dua) kali yang berlaku untuk periode Januari sampai dengan Juni dan Juli sampai dengan Desember.,
DOC548,bn642-2013.txt,BAB II,,Pasal 11,,2,Penerbitan RIPH sebagaimana dimaksud pada ayat (1) untuk periode Januari sampai dengan Juni selambat-lambatnya diterbitkan akhir Desember tahun sebelumnya.,
DOC548,bn642-2013.txt,BAB II,,Pasal 11,,3,Penerbitan RIPH sebagaimana dimaksud pada ayat (1) untuk periode Juli sampai dengan Desember selambat-lambatnya diterbitkan akhir Juni tahun berjalan.,
DOC548,bn642-2013.txt,BAB II,,Pasal 11,,4,"Penerbitan RIPH sebagaimana dimaksud pada ayat (1) untuk produk hortikultura segar untuk bahan baku industri, olahan untuk bahan baku industri, dan olahan untuk konsumsi diterbitkan 1 (satu) kali dalam 1 (satu) periode untuk 1 (satu) perusahaan.",
DOC548,bn642-2013.txt,BAB II,,Pasal 12,,1,Dalam mengelola kebijakan mengenai RIPH Direktur Jenderal dibantu oleh Tim RIPH.,
DOC548,bn642-2013.txt,BAB II,,Pasal 12,,2,"Keanggotaan Tim RIPH sebagaimana dimaksud pada ayat (1) berasal dari wakil unsur Kementerian Koordinator Bidang Perekonomian, Kementerian Pertanian, Kementerian Perdagangan, Kementerian Perindustrian, Badan Perencanaan Pembangunan Nasional, Badan Pusat Statistik, Badan Pengawas Obat dan Makanan, dan Instansi/Lembaga terkait yang diperlukan.",
DOC548,bn642-2013.txt,BAB II,,Pasal 12,,3,"Pembentukan susunan keanggotaan dan tugas Tim RIPH sebagaimana dimaksud pada ayat (1) ditetapkan dengan Keputusan Menteri. KETENTUAN PENUTUP Dalam hal terjadi keadaan memaksa (force majeur) yang mengakibatkan sistem online tidak berfungsi, pengajuan permohonan RIPH dapat dilakukan secara manual. Peraturan ini tidak berlaku untuk barang bawaan penumpang pesawat udara atau kapal laut, serta pelintas batas negara yang dimaksudkan untuk pemenuhan konsumsi sendiri dan jumlahnya tidak melebihi dari 10 (sepuluh) kilogram per orang. Dengan berlakunya Peraturan Menteri Pertanian ini maka Peraturan Menteri Pertanian Nomor 60/Permentan/OT.140/9/2012 tentang Rekomendasi Impor Produk Hortikultura dicabut dan dinyatakan tidak berlaku lagi. Peraturan Menteri Pertanian ini mulai berlaku pada tanggal diundangkan. Agar setiap orang mengetahuinya, memerintahkan pengundangan Peraturan Menteri Pertanian ini dengan penempatannya dalam Berita Negara Republik Indonesia. MENTERI PERTANIAN REPUBLIK INDONESIA, SUSWONO Diundangkan di Jakarta pada tanggal 25 April 2013 MENTERI HUKUM DAN HAK ASASI MANUSIA REPUBLIK INDONESIA, AMIR SYAMSUDIN",
