doc_id,nama_dokumen,bab,bagian,pasal,angka,ayat,isi,penjelasan
DOC568,bn71-2018.txt,,,,1,,Undang-Undang Nomor 7 Tahun 2014 tentang Perdagangan;,
DOC568,bn71-2018.txt,,,,2,,Peraturan Presiden Nomor 44 Tahun 2016 tentang Daftar Investasi;,
DOC568,bn71-2018.txt,,,,3,,"Peraturan Menteri Perdagangan Nomor 87/M-DAG/PER/10/2015 tentang Ketentuan Impor Produk Tertentu (Berita Negara Republik Indonesia Tahun 2015 Nomor 1553) sebagaimana telah diubah beberapa kali terakhir dengan Peraturan Menteri Perdagangan Nomor 94 Tahun 2017 tentang Perubahan Ketiga atas Peraturan Menteri Perdagangan Nomor 87/M-DAG/PER/10/2015 tentang Ketentuan Impor Produk Tertentu (Berita Negara Republik Indonesia Tahun 2017 Nomor 1894); **Menetapkan:** Peraturan Menteri Perdagangan tentang Perubahan Keempat atas Peraturan Menteri Perdagangan Nomor 87/M-DAG/PER/10/2015 tentang Ketentuan Impor Produk Tertentu. **Pasal I** Beberapa ketentuan dalam Peraturan Menteri Perdagangan Nomor 87/M-DAG/PER/10/2015 tentang Ketentuan Impor Produk Tertentu (Berita Negara Republik Indonesia Tahun 2015 Nomor 1553) sebagaimana telah diubah beberapa kali terakhir dengan Peraturan Menteri Perdagangan Nomor 94 Tahun 2017 tentang Perubahan Ketiga atas Peraturan Menteri Perdagangan Nomor 87/M-DAG/PER/10/2015 tentang Ketentuan Impor Produk Tertentu (Berita Negara Republik Indonesia Tahun 2017 Nomor 1894), diubah sebagai berikut: **Pasal 1** Dalam Peraturan Menteri ini yang dimaksud dengan:",
DOC568,bn71-2018.txt,,,Pasal 1,1,,"Produk Tertentu adalah produk yang dibatasi impornya berdasarkan Peraturan Menteri ini yang meliputi produk makanan dan minuman, obat tradisional dan suplemen kesehatan, kosmetik dan perbekalan kesehatan rumah tangga, pakaian jadi dan barang tekstil sudah jadi lainnya, alas kaki, elektronik, dan mainan anak-anak.",
DOC568,bn71-2018.txt,,,Pasal 1,2,,Impor adalah kegiatan memasukkan barang ke dalam daerah pabean.,
DOC568,bn71-2018.txt,,,Pasal 1,3,,Verifikasi atau penelusuran teknis impor adalah penelitian dan pemeriksaan barang impor yang dilakukan oleh surveyor.,
DOC568,bn71-2018.txt,,,Pasal 1,4,,Surveyor adalah perusahaan survey yang mendapat otorisasi untuk melakukan verifikasi atau penelusuran teknis barang impor.,
DOC568,bn71-2018.txt,,,Pasal 1,5,,"Kawasan Pabean adalah kawasan dengan batas-batas tertentu di pelabuhan laut, bandar udara, atau tempat lain yang ditetapkan untuk lalu lintas barang yang sepenuhnya berada di bawah pengawasan Direktorat Jenderal Bea dan Cukai.",
DOC568,bn71-2018.txt,,,Pasal 1,6,,Menteri adalah menteri yang menyelenggarakan urusan pemerintahan di bidang perdagangan.,
DOC568,bn71-2018.txt,,,Pasal 1,7,,"Direktur Jenderal adalah Direktur Jenderal Perdagangan Luar Negeri, Kementerian Perdagangan. Di antara Pasal 9 dan Pasal 10 disisipkan 1 (satu) pasal, yakni Pasal 9A yang berbunyi sebagai berikut: **Pasal 9A**",
DOC568,bn71-2018.txt,,,Pasal 1,1,,Pemeriksaan atas pemenuhan persyaratan impor produk tertentu dilakukan setelah melalui kawasan pabean.,
DOC568,bn71-2018.txt,,,Pasal 1,2,,Persyaratan impor sebagaimana dimaksud pada ayat (1) berupa Laporan Surveyor.,
DOC568,bn71-2018.txt,,,Pasal 1,3,,"Importir harus membuat pernyataan secara mandiri (self declaration) yang menyatakan telah memenuhi persyaratan impor produk tertentu sebelum barang impor tersebut digunakan, diperdagangkan, dan/atau dipindahtangankan.",
DOC568,bn71-2018.txt,,,Pasal 1,4,,Importir harus menyampaikan pernyataan sebagaimana dimaksud pada ayat (3) secara elektronik melalui http://inatrade.kemendag.go.id dengan mencantumkan nomor Pemberitahuan Impor Barang (PIB).,
DOC568,bn71-2018.txt,,,Pasal 1,5,,"Importir wajib menyimpan dokumen persyaratan impor sebagaimana dimaksud pada ayat (2) dan Pemberitahuan Impor Barang (PIB) paling sedikit 5 (lima) tahun untuk keperluan pemeriksaan sebagaimana dimaksud pada ayat (1). Di antara Pasal 15 dan Pasal 16 disisipkan 1 (satu) pasal, yakni Pasal 15A yang berbunyi sebagai berikut: **Pasal 15A**",
DOC568,bn71-2018.txt,,,Pasal 1,1,,Perusahaan yang melakukan impor produk tertentu tidak sesuai dengan ketentuan dalam Peraturan Menteri ini dikenai sanksi sesuai dengan ketentuan peraturan perundang-undangan.,
DOC568,bn71-2018.txt,,,Pasal 1,2,,Produk tertentu yang diimpor tidak sesuai dengan ketentuan dalam Peraturan Menteri ini wajib ditarik kembali dari peredaran dan dimusnahkan oleh importir.,
DOC568,bn71-2018.txt,,,Pasal 1,3,,Biaya atas pelaksanaan penarikan kembali dari peredaran dan pemusnahan sebagaimana dimaksud pada ayat (2) ditanggung oleh importir. **Pasal 18**,
DOC568,bn71-2018.txt,,,Pasal 18,1,,Direktorat Jenderal Perlindungan Konsumen dan Tertib Niaga melakukan pemeriksaan dan pengawasan secara berkala dan/atau sewaktu-waktu.,
DOC568,bn71-2018.txt,,,Pasal 18,2,,Pemeriksaan sebagaimana dimaksud pada ayat (1) dilakukan terhadap: a. persyaratan impor produk tertentu; dan b. dokumen pendukung impor lain.,
DOC568,bn71-2018.txt,,,Pasal 18,3,,"Pengawasan sebagaimana dimaksud pada ayat (1) dilakukan terhadap: a. kebenaran laporan realisasi impor; b. kesesuaian produk tertentu yang diimpor dengan data yang tercantum dalam Laporan Surveyor; dan c. kepatuhan atas peraturan perundang-undangan yang terkait di bidang impor produk tertentu. **Pasal 21** Dalam hal diperlukan, petunjuk teknis pelaksanaan dari Peraturan Menteri ini ditetapkan oleh Direktur Jenderal dan/atau Direktur Jenderal Perlindungan Konsumen dan Tertib Niaga sesuai dengan kewenangan masing-masing. **Pasal II** Peraturan Menteri ini mulai berlaku pada tanggal 1 Februari 2018. Agar setiap orang mengetahuinya, memerintahkan pengundangan Peraturan Menteri ini dengan penempatannya dalam Berita Negara Republik Indonesia. pada tanggal 10 Januari 2018 MENTERI PERDAGANGAN REPUBLIK INDONESIA, ttd. ENGGARTIASTO LUKITA Diundangkan di Jakarta pada tanggal 12 Januari 2018 DIREKTUR JENDERAL PERATURAN PERUNDANG-UNDANGAN KEMENTERIAN HUKUM DAN HAK ASASI MANUSIA REPUBLIK INDONESIA, ttd. WIDODO EKATJAHJANA",
