doc_id,nama_dokumen,bab,bagian,pasal,angka,ayat,isi,penjelasan
DOC590,bn741-2018.txt,,,,3,,Peraturan Menteri Kelautan dan Perikanan Nomor 56/PERMEN-KP/2014 tentang Pengelolaan Sumber Daya Perikanan Berkelanjutan. Menetapkan: PERATURAN MENTERI KELAUTAN DAN PERIKANAN TENTANG PENGELOMPOKAN DAN PENGENAAN TARIF BEA MASUK TERHADAP IKAN. **PASAL 1** Dalam peraturan ini yang dimaksud dengan:,
DOC590,bn741-2018.txt,,,,1,,Ikan adalah semua jenis ikan yang termasuk dalam kelompok hewan akuatik yang dapat dimakan.,
DOC590,bn741-2018.txt,,,,2,,"Tarif bea masuk adalah tarif yang dikenakan atas barang yang diimpor ke dalam wilayah pabean Republik Indonesia. **PASAL 2** Pengelompokan ikan berdasarkan sistem klasifikasi HS (Harmonized System) sebagai berikut: | No. HS 2017 | Uraian 2017 | Keterangan | |-------------|-------------|------------| | 0303.57.00  | Todak (Xiphias gladius) | Swordfish | | 0303.59.10  | Makarel Indian (Rastrelliger kanagurta) | Makarel Indian | | 0303.59.20  | Bawal putih (Pampus spp.) | Pomfrets | | 0303.59.90  | Lain-lain | Lainnya/Other Fish | | 0303.81.00  | Dogfish dan hiu lainnya | Dogfish and Other Sharks | | 0303.82.00  | Pari dan skates (Rajidae) | Skates/Rays and Skates | | 0303.83.00  | Toothfish (Dissostichus spp.) | Toothfish | | 0303.84.00  | Seabass (Dicentrarchus spp.) | Seabass | | 0303.89.11  | Kerapu | Groupers | | 0304.31.00  | Tilapia (Oreochromis spp.) | Tilapias | | 0304.41.00  | Salmon Pasifik (Oncorhynchus spp.) | Trout and Salmon | **PASAL 3** Ketentuan lebih lanjut mengenai pengelompokan dan pengenaan tarif bea masuk terhadap ikan diatur dalam lampiran yang merupakan bagian tidak terpisahkan dari peraturan ini. **PASAL 4** Peraturan ini mulai berlaku pada tanggal ditetapkan. **MENTERI KELAUTAN DAN PERIKANAN** **[Nama Pejabat]** **NIP [Nomor Induk Pegawai]** Demikianlah peraturan ini disusun untuk memberikan kejelasan dan kepastian hukum dalam pengelolaan impor ikan di Indonesia. **PERATURAN TENTANG IMPOR IKAN DAN KRUSTASEA** **DENGAN RAHMAT TUHAN YANG MAHA ESA** a. bahwa untuk melaksanakan ketentuan peraturan perundang-undangan di bidang impor ikan dan krustasea, perlu menetapkan peraturan mengenai jenis-jenis ikan dan krustasea yang dapat diimpor ke Indonesia; b. bahwa untuk kepentingan tersebut, perlu dilakukan pengaturan mengenai klasifikasi dan deskripsi ikan serta krustasea yang diimpor;",
DOC590,bn741-2018.txt,,,,1,,Undang-Undang Nomor 17 Tahun 2006 tentang Perdagangan;,
DOC590,bn741-2018.txt,,,,2,,Undang-Undang Nomor 18 Tahun 2012 tentang Pangan;,
DOC590,bn741-2018.txt,,,,3,,Peraturan Menteri Perdagangan Republik Indonesia Nomor 20 Tahun 2019 tentang Ketentuan Umum di Bidang Perdagangan. Menetapkan: PERATURAN TENTANG IMPOR IKAN DAN KRUSTASEA. **PASAL 1** **KETENTUAN UMUM** Dalam peraturan ini yang dimaksud dengan:,
DOC590,bn741-2018.txt,,,,1,,"Ikan adalah semua jenis ikan yang hidup di perairan, baik air tawar maupun air laut.",
DOC590,bn741-2018.txt,,,,2,,"Krustasea adalah hewan laut yang memiliki cangkang keras, termasuk udang, kepiting, dan lobster. **PASAL 2** **JENIS-JENIS IKAN DAN KRUSTASEA YANG DAPAT DIIMPOR**",
DOC590,bn741-2018.txt,,,,1,,"Ikan beku: a. Todak (Xiphias gladius) b. Toothfish (Dissostichus spp.) c. Tilapia (Oreochromis spp.), catfish (Pangasius spp., Silurus spp., Clarias spp., Ictalurus spp.), ikan mas (Cyprinus spp., Carassius spp., Ctenopharyngodon idellus, Hypophthalmichthys spp., Cirrhinus spp., Mylopharyngodon piceus, Catla catla, Labeo spp., Osteochilus hasselti, Leptobarbus hoeveni, Megalobrama spp.), sidat (Anguilla spp.), Nile perch (Lates niloticus) dan gabus (Channa spp.) d. Alaska pollack (Theragra chalcogramma) e. Ikan dari keluarga Bregmacerotidae, Euclichthyidae, Gadidae, Macrouridae, Melanonidae, Merlucciidae, Moridae dan Muraenolepididae, selain dari Alaska pollack. f. Dogfish dan hiu lainnya. g. Pari dan skates (Rajidae). h. Lain-lain.",
DOC590,bn741-2018.txt,,,,2,,"Ikan dikeringkan, diasinkan atau dalam air garam; ikan diasapi, dimasak maupun tidak sebelum atau selama proses pengasapan; tepung, tepung kasar dan pellet dari ikan, layak untuk dikonsumsi manusia: a. Tepung, tepung kasar dan pelet dari ikan yang layak untuk dikonsumsi manusia. b. Hati, telur dan sperma dari ikan, dikeringkan, diasapi, diasinkan atau dalam air garam. c. Fillet ikan, dikeringkan, diasinkan atau dalam air garam, tetapi tidak diasapi.",
DOC590,bn741-2018.txt,,,,3,,"Krustasea, berkulit maupun tidak, hidup, segar, dingin, beku, dikeringkan, diasinkan atau dalam air garam; krustasea diasapi, dimasak maupun tidak sebelum atau selama proses pengasapan; tepung, tepung kasar dan pellet dari krustasea, layak untuk dikonsumsi manusia. **PASAL 3** **KETENTUAN PENUTUP** Peraturan ini mulai berlaku pada tanggal ditetapkan. **PEJABAT YANG MENETAPKAN** (Nama Pejabat) (Jabatan) (Nama Lembaga) **Catatan:** - Semua jenis ikan dan krustasea yang disebutkan di atas harus memenuhi standar keamanan dan kualitas yang ditetapkan oleh peraturan perundang-undangan yang berlaku. - Pengimpor wajib melaporkan jenis dan jumlah ikan serta krustasea yang diimpor kepada instansi terkait. **PERATURAN IMPOR NO. 741 TAHUN 2018** **DENGAN RAHMAT TUHAN YANG MAHA ESA** a. bahwa untuk melaksanakan ketentuan dalam peraturan perundang-undangan di bidang impor, perlu menetapkan peraturan mengenai impor barang tertentu; b. bahwa barang-barang yang akan diimpor harus memenuhi ketentuan yang berlaku dan layak untuk dikonsumsi manusia; c. bahwa untuk itu perlu dilakukan pengaturan lebih lanjut mengenai jenis dan klasifikasi barang yang diimpor.",
DOC590,bn741-2018.txt,,,,1,,Undang-Undang Nomor 17 Tahun 2006 tentang Perdagangan;,
DOC590,bn741-2018.txt,,,,2,,Peraturan Pemerintah Nomor 85 Tahun 2015 tentang Kebijakan Impor;,
DOC590,bn741-2018.txt,,,,3,,Peraturan Menteri Perdagangan Nomor 31 Tahun 2016 tentang Ketentuan Umum di Bidang Impor. Menetapkan: PERATURAN MENTERI PERDAGANGAN TENTANG IMPOR BARANG TERTENTU. **PASAL 1**,
DOC590,bn741-2018.txt,,,,3,1,"Jenis barang yang dapat diimpor meliputi: a. Udang dan udang besar air dingin (Pandalus spp, Crangon crangon); b. Lobster Norwegia (Nephrops norvegicus); c. Kepiting dan rajungan.",
DOC590,bn741-2018.txt,,,,3,2,Klasifikasi barang impor berdasarkan kode HS adalah sebagai berikut: - 0306.35 - Udang dan udang besar air dingin: - 0306.35.30 - Segar atau dingin. - 0306.36 - Udang dan udang besar lainnya: - 0306.36.33 - Udang galah (Macrobrachium rosenbergii). - 0306.36.39 - Lain-lain. - 0306.91 - Lobster karang dan udang laut besar lainnya: - 0306.91.21 - Diasapi. - 0306.91.29 - Lain-lain. - 0306.93 - Kepiting: - 0306.93.21 - Diasapi. - 0306.93.29 - Lain-lain. **PASAL 2**,
DOC590,bn741-2018.txt,,,,3,1,Barang yang diimpor harus dalam kemasan kedap udara untuk penjualan eceran.,
DOC590,bn741-2018.txt,,,,3,2,Barang yang tidak memenuhi ketentuan akan ditolak dan tidak dapat diimpor. **PASAL 3**,
DOC590,bn741-2018.txt,,,,3,1,Setiap pelanggaran terhadap ketentuan dalam peraturan ini akan dikenakan sanksi sesuai dengan ketentuan perundang-undangan yang berlaku.,
DOC590,bn741-2018.txt,,,,3,2,"Peraturan ini mulai berlaku pada tanggal ditetapkan. **MENTERI PERDAGANGAN REPUBLIK INDONESIA** [Nama Pejabat] [NIP Pejabat] **Catatan:** - Semua klasifikasi barang di atas harus disesuaikan dengan ketentuan yang berlaku dan dapat diperbarui sesuai dengan perkembangan di lapangan. - Pastikan semua dokumen dan izin terkait impor barang telah dilengkapi sebelum melakukan proses impor. **PERATURAN MENTERI PERDAGANGAN REPUBLIK INDONESIA NOMOR 2018 TAHUN 741 TENTANG IMPOR** DENGAN RAHMAT TUHAN YANG MAHA ESA, MENTERI PERDAGANGAN REPUBLIK INDONESIA, a. bahwa untuk melaksanakan ketentuan dalam peraturan perundang-undangan yang berlaku, perlu menetapkan peraturan mengenai impor; b. bahwa berdasarkan pertimbangan sebagaimana dimaksud dalam huruf a, perlu menetapkan peraturan menteri perdagangan tentang impor;",
DOC590,bn741-2018.txt,,,,1,,Undang-Undang Nomor 7 Tahun 2014 tentang Perdagangan;,
DOC590,bn741-2018.txt,,,,2,,Peraturan Presiden Nomor 112 Tahun 2018 tentang Penetapan Kebijakan Impor;,
DOC590,bn741-2018.txt,,,,3,,Peraturan Menteri Perdagangan Nomor 36 Tahun 2019 tentang Ketentuan Umum dan Tata Cara Impor; Menetapkan: PERATURAN MENTERI PERDAGANGAN TENTANG IMPOR. **Pasal 1**,
DOC590,bn741-2018.txt,,,,3,1,Ketentuan umum mengenai impor barang diatur sebagai berikut: a. Barang yang dapat diimpor terdiri dari:,
DOC590,bn741-2018.txt,,,,1,,"Bulu babi (Strongylocentrotus spp., Paracentrotus lividus, Loxechinus albus, Echichinus esculentus): - 0308.19.20 - Diasapi - 0308.21.20 - Segar atau dingin - 0308.22.00 - Beku - 0308.29.20 - Dikeringkan, diasinkan atau dalam air garam - 0308.29.30 - Diasapi",
DOC590,bn741-2018.txt,,,,2,,"Ubur-ubur (Rhopilema spp.): - 0308.30.20 - Hidup - 0308.30.30 - Beku - 0308.30.40 - Dikeringkan, diasinkan atau dalam air garam - 0308.30.50 - Diasapi",
DOC590,bn741-2018.txt,,,,3,,"Invertebrata air lainnya: - 0308.90.20 - Segar atau dingin - 0308.90.30 - Beku - 0308.90.40 - Dikeringkan, diasinkan atau dalam air garam - 0308.90.50 - Diasapi - 0308.90.90 - Lain-lain b. Kacang karob, rumput laut dan ganggang lainnya, bit gula dan tebu, segar, dingin, beku atau dikeringkan, ditumbuk maupun tidak; kulit keras buah dan kernel serta produk nabati lainnya (termasuk akar chicory yang tidak digongseng dari varietas Cichorium intybus sativum) dari jenis yang terutama digunakan untuk konsumsi manusia, tidak dirinci atau termasuk dalam pos lainnya. **Pasal 2**",
DOC590,bn741-2018.txt,,,,3,1,Rumput laut dan ganggang lainnya yang layak untuk dikonsumsi manusia: a. 1212.21.11 - Eucheuma spinosum b. 1212.21.12 - Eucheuma cottonii c. 1212.21.13 - Gracilaria spp. d. 1212.21.14 - Gelidium spp. e. 1212.21.15 - Sargassum spp. f. 1212.21.19 - Lain-lain g. 1212.21.90 - Lain-lain,
DOC590,bn741-2018.txt,,,,3,2,"Segar, didinginkan atau dikeringkan, dari jenis yang digunakan dalam pencelupan, penyamakan, wewangian, farmasi, atau untuk insektisida, fungisida, atau tujuan serupa. **Pasal 3**",
DOC590,bn741-2018.txt,,,,3,1,"Sap dan ekstrak nabati; zat pektik, pektinat dan pektat; agar-agar dan lendir serta bahan pengental lainnya, dimodifikasi maupun tidak, berasal dari produk nabati. a. 1302.31.00 - Agar-agar b. 1302.39.11 - Karaginan, bubuk, semi-murni c. 1302.39.12 - Karaginan, bubuk, murni d. 1302.39.19 - Lain-lain e. 1302.39.90 - Lain-lain **Pasal 4**",
DOC590,bn741-2018.txt,,,,3,1,"Lemak dan minyak serta fraksinya, dari ikan atau binatang laut menyusui, dimurnikan maupun tidak, tetapi tidak dimodifikasi secara kimia. a. 1504.10.20 - Fraksi padat b. 1504.10.90 - Lain-lain c. 1504.20.10 - Fraksi padat d. 1504.20.90 - Lain-lain pada tanggal 2018 MENTERI PERDAGANGAN REPUBLIK INDONESIA, ttd. ENGGARTIASTO LUKITA",
