doc_id,nama_dokumen,bab,bagian,pasal,angka,ayat,isi,penjelasan
DOC591,bn743-2018.txt,,,,1,,"bahwa dengan Peraturan Menteri Pertanian Nomor 38/PERMENTAN/HR.060/11/2017 tentang Rekomendasi Impor Produk Hortikultura, telah diatur Rekomendasi Impor Produk Hortikultura;",
DOC591,bn743-2018.txt,,,,2,,bahwa pelayanan pemberian Rekomendasi Impor Produk Hortikultura perlu mengikuti perkembangan perdagangan dunia;,
DOC591,bn743-2018.txt,,,,3,,"bahwa berdasarkan pertimbangan sebagaimana maksud dalam huruf a dan huruf b, perlu menetapkan Peraturan Menteri Pertanian tentang Perubahan atas Peraturan Menteri Pertanian Nomor 38/PERMENTAN/HR.060/11/2017 tentang Rekomendasi Impor Produk Hortikultura;",
DOC591,bn743-2018.txt,,,,12,,Peraturan Menteri Pertanian Nomor 09/PERMENTAN/OT.140/2/2009 tentang Persyaratan dan Tata Cara Tindakan Karantina Tumbuhan Terhadap Pemasukan Media Pembawa Organisme Pengganggu Tumbuhan Karantina ke dalam Wilayah Negara Republik Indonesia (Berita Negara Republik Indonesia Tahun 2009 Nomor 35);,
DOC591,bn743-2018.txt,,,,13,,Peraturan Menteri Pertanian Nomor 93/PERMENTAN/OT.140/12/2011 tentang Jenis Organisme Pengganggu Tumbuhan Karantina (Berita Negara Republik Indonesia Tahun 2012 Nomor 6) sebagaimana telah diubah dengan Peraturan Menteri Pertanian Nomor 51/PERMENTAN/KR.010/9/2015 tentang Perubahan atas Peraturan Menteri Pertanian Nomor 93/PERMENTAN/OT.140/12/2011 tentang Jenis Organisme Pengganggu Tumbuhan Karantina (Berita Negara Republik Indonesia Tahun 2015 Nomor 1432);,
DOC591,bn743-2018.txt,,,,14,,"Peraturan Menteri Pertanian Nomor 94/PERMENTAN/OT.140/12/2011 tentang Tempat Pemasukan dan Pengeluaran Media Pembawa Penyakit Hewan Karantina dan Organisme Pengganggu Tumbuhan Karantina (Berita Negara Republik Indonesia Tahun 2012 Nomor 7) sebagaimana telah beberapa kali diubah, terakhir dengan Peraturan Menteri Pertanian Nomor 35/PERMENTAN/KR.020/9/2017 tentang Perubahan Kedua atas Peraturan Menteri Pertanian Nomor 94/PERMENTAN/OT.140/12/2011 tentang Tempat Pemasukan dan Pengeluaran Media Pembawa Penyakit Hewan Karantina dan Organisme Pengganggu Tumbuhan Karantina (Berita Negara Republik Indonesia Tahun 2017 Nomor 1370);",
DOC591,bn743-2018.txt,,,,15,,Peraturan Menteri Pertanian Nomor 42/PERMENTAN/OT.140/6/2012 tentang Tindakan Karantina Tumbuhan untuk Pemasukan Buah Segar dan Sayuran Buah Segar ke dalam Wilayah Negara Republik Indonesia (Berita Negara Republik Indonesia Tahun 2012 Nomor 631);,
DOC591,bn743-2018.txt,,,,16,,Peraturan Menteri Pertanian Nomor 43/PERMENTAN/OT.140/6/2012 tentang Tindakan Karantina Tumbuhan untuk Pemasukan Sayuran Umbi Lapis Segar ke dalam Wilayah Negara Republik Indonesia (Berita Negara Republik Indonesia Tahun 2012 Nomor 632) sebagaimana telah diubah dengan Peraturan Menteri Pertanian Nomor 20/PERMENTAN/KR.040/6/2017 tentang Perubahan atas Peraturan Menteri Pertanian Nomor 43/PERMENTAN/OT.140/6/2012 tentang Tindakan Karantina Tumbuhan untuk Pemasukan Sayuran Umbi Lapis Segar ke dalam Wilayah Negara Republik Indonesia (Berita Negara Republik Indonesia Tahun 2017 Nomor 788);,
DOC591,bn743-2018.txt,,,,17,,Peraturan Menteri Pertanian Nomor 43/PERMENTAN/OT.010/8/2015 tentang Organisasi dan Tata Kerja Kementerian Pertanian (Berita Negara Republik Indonesia Tahun 2015 Nomor 1243);,
DOC591,bn743-2018.txt,,,,18,,Peraturan Menteri Perdagangan Nomor 70/M-DAG/PER/9/2015 tentang Angka Pengenal Importir (Berita Negara Republik Indonesia Tahun 2015 Nomor 1516);,
DOC591,bn743-2018.txt,,,,19,,Peraturan Menteri Pertanian Nomor 55/PERMENTAN/KR.040/11/2016 tentang Pengawasan Keamanan Pangan Terhadap Pemasukan Pangan Segar Asal Tumbuhan (Berita Negara Republik Indonesia Tahun 2016 Nomor 1757);,
DOC591,bn743-2018.txt,,,,20,,Peraturan Menteri Pertanian Nomor 38/PERMENTAN/HR.060/11/2017 tentang Rekomendasi Impor Produk Hortikultura (Berita Negara Republik Indonesia Tahun 2017 Nomor 1674); **Menetapkan:** **PERATURAN MENTERI PERTANIAN TENTANG PERUBAHAN ATAS PERATURAN MENTERI PERTANIAN NOMOR 38/PERMENTAN/HR.060/11/2017 TENTANG REKOMENDASI IMPOR PRODUK HORTIKULTURA.** **Pasal I** Beberapa ketentuan dalam Peraturan Menteri Pertanian Nomor 38/PERMENTAN/HR.060/11/2017 tentang Rekomendasi Impor Produk Hortikultura (Berita Negara Republik Indonesia Tahun 2017 Nomor 1674) diubah sebagai berikut:,
DOC591,bn743-2018.txt,,,,1,,Pasal 6 dihapus. **Pasal 9**,
DOC591,bn743-2018.txt,,,Pasal 9,1,1,Pertimbangan produksi Hortikultura sebagaimana dimaksud dalam Pasal 5 huruf a ditetapkan oleh Direktur Jenderal.,
DOC591,bn743-2018.txt,,,Pasal 9,1,2,Direktur Jenderal dalam menetapkan pertimbangan produksi Hortikultura sebagaimana dimaksud pada ayat (1) berdasarkan usulan dari kelompok kerja yang dibentuk oleh Direktur Jenderal.,
DOC591,bn743-2018.txt,,,Pasal 9,1,3,Pertimbangan produksi Hortikultura sebagaimana dimaksud pada ayat (1) disampaikan kepada Menteri yang menyelenggarakan urusan pemerintahan di bidang perdagangan. **Pasal 10**,
DOC591,bn743-2018.txt,,,Pasal 10,1,1,Pelaku Usaha dapat mengajukan permohonan RIPH sewaktu-waktu.,
DOC591,bn743-2018.txt,,,Pasal 10,1,2,Permohonan RIPH sebagaimana dimaksud pada ayat (1) dilakukan dalam hari kerja.,
DOC591,bn743-2018.txt,,,Pasal 10,1,3,Permohonan RIPH untuk tahun berjalan dapat diajukan pada bulan November tahun sebelumnya.,
DOC591,bn743-2018.txt,,,Pasal 10,4,,"Pasal 11 dihapus. **Pasal 12** Apabila Pelaku Usaha melakukan perubahan RIPH, RIPH sebelumnya tidak berlaku.",
DOC591,bn743-2018.txt,,,Pasal 12,6,,"Ketentuan Pasal 18 ayat (1) huruf g dihapus dan huruf h diubah, sehingga Pasal 18 berbunyi sebagai berikut: **Pasal 18**",
DOC591,bn743-2018.txt,,,Pasal 12,6,1,"Persyaratan administrasi untuk Pelaku Usaha dan BUMN sebagaimana dimaksud dalam Pasal 12 meliputi: a. akte pendirian perusahaan, dan perubahannya yang terakhir; b. Nomor Pokok Wajib Pajak (NPWP); c. Kartu Tanda Penduduk (KTP) pimpinan perusahaan; d. keterangan domisili perusahaan; e. API-U untuk umum; f. API-P untuk industri; g. surat pernyataan menggunakan produk impor hortikultura sesuai dengan perizinannya bagi pelaku usaha pemilik API-P, sesuai dengan Format-2; h. laporan rekapitulasi realisasi impor Produk Hortikultura waktu impor sebelumnya bagi yang pernah melakukan impor Produk Hortikultura, sesuai dengan Format-3; dan i. surat pernyataan bermaterai yang menyatakan dokumen yang disampaikan benar dan sah, sesuai dengan Format-4.",
DOC591,bn743-2018.txt,,,Pasal 12,6,2,"Selain memenuhi persyaratan sebagaimana dimaksud pada ayat (1), permohonan RIPH untuk impor produk bawang putih disertai: a. surat pernyataan kesanggupan untuk pengembangan penanaman bawang putih di dalam negeri, sesuai dengan Format-5; b. surat pernyataan rencana penanaman bawang putih yang diketahui oleh Kepala Dinas daerah kabupaten/kota yang menyelenggarakan urusan pemerintahan di bidang pertanian, sesuai dengan Format-6; dan c. laporan realisasi penanaman bawang putih di dalam negeri bagi yang telah merealisasikan penanaman dengan diketahui oleh Kepala Dinas daerah kabupaten/kota yang menyelenggarakan urusan pemerintahan di bidang pertanian, sesuai dengan Format-7.",
DOC591,bn743-2018.txt,,,Pasal 12,7,,"Ketentuan ayat (3) Pasal 22 diubah, sehingga Pasal 22 berbunyi sebagai berikut: **Pasal 22**",
DOC591,bn743-2018.txt,,,Pasal 12,7,1,Persyaratan teknis sebagaimana dimaksud dalam Pasal 17 meliputi: a. Produk Hortikultura segar harus memenuhi ketentuan keamanan Pangan Segar Asal Tumbuhan (PSAT) sesuai dengan ketentuan peraturan perundang-undangan; b. Produk Hortikultura segar yang pertama kali dimasukkan dari negara asal harus dilengkapi hasil analisa risiko organisme pengganggu tumbuhan karantina dari Badan Karantina Pertanian; c. sertifikat penerapan budi daya yang baik (Good Agriculture Practices/GAP) atau sertifikat setara lainnya yang diakui secara internasional dan masih berlaku sampai akhir waktu impor dilakukan; d. registrasi bangsal penanganan pascapanen (packing house) yang diterbitkan oleh instansi yang berwenang dari negara asal yang masih berlaku sampai akhir waktu impor dilakukan; e. surat keterangan dari eksportir negara asal mengenai kapasitas produksi dari kebun/lahan usaha yang telah diregistrasi atau disertifikasi penerapan budi daya yang baik (Good Agriculture Practices/GAP); dan f. Produk Hortikultura yang dapat diimpor memenuhi karakteristik yang ditentukan.,
DOC591,bn743-2018.txt,,,Pasal 12,7,2,"Persyaratan teknis sebagaimana dimaksud pada ayat (1) huruf c, huruf d, dan huruf e, diterjemahkan ke dalam bahasa Indonesia.",
DOC591,bn743-2018.txt,,,Pasal 12,7,3,Ketentuan lebih lanjut mengenai karakteristik sebagaimana dimaksud pada ayat (1) huruf f ditetapkan oleh Direktur Jenderal atas nama Menteri dalam bentuk Keputusan Menteri.,
DOC591,bn743-2018.txt,,,Pasal 12,8,,"Ketentuan ayat (3) Pasal 26 diubah, sehingga Pasal 26 berbunyi sebagai berikut: **Pasal 26**",
DOC591,bn743-2018.txt,,,Pasal 12,8,1,Direktur Jenderal setelah menerima permohonan sebagaimana dimaksud dalam Pasal 25 huruf a melakukan verifikasi dan validasi persyaratan teknis dalam jangka waktu paling lama 5 (lima) hari kerja.,
DOC591,bn743-2018.txt,,,Pasal 12,8,2,"Apabila hasil verifikasi dan validasi sebagaimana dimaksud pada ayat (1): a. sesuai dengan persyaratan teknis, diterbitkan RIPH sesuai dengan Format-11; atau b. tidak sesuai dengan persyaratan teknis, ditolak.",
DOC591,bn743-2018.txt,,,Pasal 12,8,3,RIPH yang diterbitkan sebagaimana dimaksud pada ayat (2) huruf a disampaikan kepada Pelaku Usaha dan portal Indonesia National Single Window (INSW) melalui Kepala Pusat PVTPP.,
DOC591,bn743-2018.txt,,,Pasal 12,8,4,Penolakan sebagaimana dimaksud pada ayat (2) huruf b disampaikan kepada Pelaku Usaha melalui Kepala Pusat PVTPP disertai alasan penolakan secara daring (online).,
DOC591,bn743-2018.txt,,,Pasal 12,9,,"Di antara Pasal 26 dan Pasal 27 disisipkan 1 (satu) pasal, yakni Pasal 26A sehingga berbunyi sebagai berikut: **Pasal 26A** RIPH sebagaimana dimaksud dalam Pasal 26 ayat (2) huruf a, berlaku 1 (satu) tahun takwim.",
DOC591,bn743-2018.txt,,,Pasal 12,10,,"Ketentuan Pasal 32 ditambah 1 (satu) ayat, sehingga Pasal 32 berbunyi sebagai berikut: **Pasal 32**",
DOC591,bn743-2018.txt,,,Pasal 12,10,1,Pelaku Usaha yang melakukan Impor Produk Hortikultura bawang putih sebagaimana dimaksud dalam Pasal 7 wajib melakukan pengembangan penanaman bawang putih di dalam negeri.,
DOC591,bn743-2018.txt,,,Pasal 12,10,2,Pengembangan penanaman bawang putih sebagaimana dimaksud pada ayat (1) dapat dilakukan sendiri atau kerjasama dengan kelompok tani.,
DOC591,bn743-2018.txt,,,Pasal 12,10,3,Ketentuan mengenai pengembangan penanaman bawang putih di dalam negeri sebagaimana dimaksud pada ayat (1) ditetapkan lebih lanjut dalam Keputusan Direktur Jenderal.,
DOC591,bn743-2018.txt,,,Pasal 12,11,,"Pasal 37 ayat (1) dihapus, sehingga Pasal 37 berbunyi sebagai berikut: **Pasal 37**",
DOC591,bn743-2018.txt,,,Pasal 12,11,1,Dihapus.,
DOC591,bn743-2018.txt,,,Pasal 12,11,2,"Pelaku Usaha yang melanggar ketentuan sebagaimana dimaksud dalam Pasal 18 ayat (1) huruf h, dikenakan sanksi tidak diberikan RIPH untuk 1 (satu) tahun dan menarik Produk Hortikultura dari peredaran.",
DOC591,bn743-2018.txt,,,Pasal 12,11,3,"Pelaku Usaha yang melanggar ketentuan sebagaimana dimaksud dalam Pasal 18 ayat (2) huruf a, huruf b, dan huruf c, Pasal 32 ayat (1), Pasal 33 ayat (2), dan/atau Pasal 36 ayat (3) dikenakan sanksi: a. pengurangan volume impor bawang putih oleh Menteri yang menyelenggarakan urusan pemerintahan di bidang perdagangan berdasarkan usul Menteri; dan/atau b. tidak diberikan RIPH untuk bawang putih paling lama 2 (dua) tahun apabila melanggar 2 (dua) kali berturut-turut. **MENTERI PERTANIAN REPUBLIK INDONESIA,** **[Nama Menteri]** **NIP. [Nomor Induk Pegawai]** **PERATURAN MENTERI PERTANIAN REPUBLIK INDONESIA NOMOR 24/PERMENTAN/HR.060/5/2018 TENTANG PERUBAHAN ATAS PERATURAN MENTERI PERTANIAN NOMOR 38/PERMENTAN/HR.060/11/2017 TENTANG REKOMENDASI IMPOR PRODUK HORTIKULTURA** DENGAN RAHMAT TUHAN YANG MAHA ESA a. bahwa untuk meningkatkan pengawasan terhadap impor produk hortikultura, perlu dilakukan perubahan atas ketentuan yang diatur dalam Peraturan Menteri Pertanian Nomor 38/PERMENTAN/HR.060/11/2017 tentang Rekomendasi Impor Produk Hortikultura; b. bahwa berdasarkan pertimbangan sebagaimana dimaksud dalam huruf a, perlu menetapkan Peraturan Menteri Pertanian tentang Perubahan atas Peraturan Menteri Pertanian Nomor 38/PERMENTAN/HR.060/11/2017 tentang Rekomendasi Impor Produk Hortikultura;",
DOC591,bn743-2018.txt,,,Pasal 12,1,,Undang-Undang Nomor 18 Tahun 2012 tentang Pangan;,
DOC591,bn743-2018.txt,,,Pasal 12,2,,Undang-Undang Nomor 13 Tahun 2010 tentang Hortikultura;,
DOC591,bn743-2018.txt,,,Pasal 12,3,,Peraturan Pemerintah Nomor 28 Tahun 2004 tentang Keamanan Pangan;,
DOC591,bn743-2018.txt,,,Pasal 12,4,,"Peraturan Menteri Pertanian Nomor 38/PERMENTAN/HR.060/11/2017 tentang Rekomendasi Impor Produk Hortikultura; Menetapkan: PERATURAN MENTERI PERTANIAN TENTANG PERUBAHAN ATAS PERATURAN MENTERI PERTANIAN NOMOR 38/PERMENTAN/HR.060/11/2017 TENTANG REKOMENDASI IMPOR PRODUK HORTIKULTURA. **Pasal I** Pelaku Usaha dan Lembaga Sosial yang melanggar ketentuan Pasal 22 ayat (1) huruf f, dikenakan sanksi sesuai dengan ketentuan peraturan perundang-undangan bidang kepabeanan.",
DOC591,bn743-2018.txt,,,Pasal 39,2,,"Pelaku Usaha yang melanggar ketentuan sebagaimana dimaksud dalam Pasal 29, dikenakan sanksi tidak diberikan RIPH paling lama 2 (dua) tahun.",
DOC591,bn743-2018.txt,,,Pasal 39,3,,"Pelaku Usaha yang melanggar ketentuan sebagaimana dimaksud dalam Pasal 30, dikenakan sanksi tidak diberikan RIPH paling lama 1 (satu) tahun untuk Produk Hortikultura yang tidak direalisasikan impornya.",
DOC591,bn743-2018.txt,,,Pasal 39,4,,"Lampiran III Peraturan Menteri Pertanian Nomor 38/PERMENTAN/HR.060/11/2017 tentang Rekomendasi Impor Produk Hortikultura (Berita Negara Republik Indonesia Tahun 2017 Nomor 1674) Nomor 2 (dua) Format-2 dan Nomor 11 (sebelas) Format-11 diubah sebagaimana tercantum dalam Lampiran yang merupakan bagian tidak terpisahkan dari Peraturan Menteri ini. **Pasal II** Peraturan Menteri ini mulai berlaku pada tanggal diundangkan. Agar setiap orang mengetahuinya, memerintahkan pengundangan Peraturan Menteri ini dengan penempatannya dalam Berita Negara Republik Indonesia. MENTERI PERTANIAN REPUBLIK INDONESIA, ttd AMRAN SULAIMAN Diundangkan di Jakarta pada tanggal 6 Juni 2018 DIREKTUR JENDERAL PERATURAN PERUNDANG-UNDANGAN KEMENTERIAN HUKUM DAN HAK ASASI MANUSIA REPUBLIK INDONESIA, ttd WIDODO EKATJAHJANA **LAMPIRAN PERATURAN MENTERI PERTANIAN REPUBLIK INDONESIA NOMOR 24/PERMENTAN/HR.060/5/2018 TENTANG PERUBAHAN ATAS PERATURAN MENTERI PERTANIAN NOMOR 38/PERMENTAN/HR.060/11/2017 TENTANG REKOMENDASI IMPOR PRODUK HORTIKULTURA** Ditanda Tangani | No | Kode | Tentang | Oleh | |----|------|---------|------| | 2  | Format - 2 | Surat pernyataan menggunakan produk impor Hortikultura sesuai dengan perizinannya bagi Pelaku Usaha pemilik API-P | Pelaku Usaha | | 11 | Format - 11 | Rekomendasi Impor Produk Hortikultura | Direktur Jenderal | **Format-2** **KOP SURAT** **SURAT PERNYATAAN MENGGUNAKAN PRODUK IMPOR HORTIKULTURA SESUAI DENGAN PERIZINANNYA** Kami yang bertandatangan di bawah ini: Nama: Jabatan: Perusahaan: No. API-P: Alamat: Dengan ini menyatakan bahwa produk yang diimpor hanya digunakan sebagai bahan baku produksi atau bahan penolong untuk kebutuhan produksi industri yang kami miliki dan tidak akan memperdagangkan dan/atau memindahtangankan produk yang diimpor kepada pihak lain. Apabila di kemudian hari ternyata melanggar atau pernyataan ini tidak benar, maka kami siap menerima sanksi sesuai dengan ketentuan yang berlaku. Demikian surat pernyataan ini kami buat dengan sebenarnya untuk dipergunakan sebagaimana mestinya. Tempat, Tanggal Yang Membuat Pernyataan, Materai Rp. 6.000,- Pemohon **Format-11** **KOP SURAT** Nomor: Lampiran: Hal: Rekomendasi Impor Produk Hortikultura Yth. Direktur Jenderal Kementerian Perdagangan di Jakarta Sehubungan dengan surat Nomor ....... tanggal ..... hal permohonan Rekomendasi Impor Produk Hortikultura (RIPH) ..... atas nama PT/CV ...., dengan mempertimbangkan Peraturan Menteri Pertanian Nomor .... dan Peraturan Menteri Perdagangan Nomor ...., kami pada prinsipnya dapat memberikan Rekomendasi Impor Produk Hortikultura (RIPH) oleh PT/CV ..... dengan Produk Hortikultura yang diimpor sebagai berikut: | No | Nama Produk | Pos Tarif/HS | Negara Asal | Pemasukan (Bulan) | |----|-------------|--------------|--------------|-------------------| | 1. |             |              |              |                   | | 2. |             |              |              |                   | | 3. |             |              |              |                   | | 4. |             |              |              |                   | | 5. |             |              |              |                   | | Dst |           |              |              |                   | Rekomendasi ini berlaku sejak diterbitkan. Atas perhatian dan kerja sama Saudara disampaikan terima kasih. a.n. Menteri Pertanian Direktur Jenderal Hortikultura,",
