doc_id,nama_dokumen,bab,bagian,pasal,angka,ayat,isi,penjelasan
DOC590,bn741-2018.txt,,,,1,,"Hasil Perikanan adalah ikan termasuk yang ditangani, diolah, dan/atau dijadikan produk akhir yang berupa ikan segar, ikan beku, dan olahan lainnya.",
DOC590,bn741-2018.txt,,,,2,,"Angka Pengenal Importir, yang selanjutnya disingkat API adalah tanda pengenal sebagai importir.",
DOC590,bn741-2018.txt,,,,3,,"Angka Pengenal Importir Produsen, yang selanjutnya disingkat API-P adalah tanda pengenal sebagai importir produsen.",
DOC590,bn741-2018.txt,,,,4,,"Angka Pengenal Importir Umum, yang selanjutnya disingkat API-U adalah tanda pengenal sebagai importir umum.",
DOC590,bn741-2018.txt,,,,5,,Persetujuan Impor adalah persetujuan yang digunakan sebagai izin untuk melakukan impor Hasil Perikanan.,
DOC590,bn741-2018.txt,,,,6,,Rekomendasi adalah surat keterangan tertulis yang berisi penjelasan teknis mengenai Hasil Perikanan yang akan diimpor.,
DOC590,bn741-2018.txt,,,,7,,Verifikasi atau Penelusuran Teknis adalah penelitian dan pemeriksaan barang impor yang dilakukan oleh Surveyor.,
DOC590,bn741-2018.txt,,,,8,,Surveyor adalah perusahaan survey yang mendapat otorisasi untuk melakukan verifikasi atau penelusuran teknis barang impor.,
DOC590,bn741-2018.txt,,,,9,,Menteri adalah menteri yang menyelenggarakan urusan pemerintahan di bidang perdagangan.,
DOC590,bn741-2018.txt,,,,10,,"Direktur Jenderal adalah Direktur Jenderal Perdagangan Luar Negeri, Kementerian Perdagangan. **Pasal 2** Hasil Perikanan yang dapat diimpor merupakan hasil perikanan yang digunakan untuk memenuhi kebutuhan bahan baku industri, bahan penolong industri, dan selain untuk memenuhi kebutuhan bahan baku dan bahan penolong industri. Jenis hasil perikanan yang dibatasi impornya sebagaimana tercantum dalam Lampiran yang merupakan bagian tidak terpisahkan dari Peraturan Menteri ini. **Pasal 3** Rencana kebutuhan Hasil Perikanan asal impor ditentukan dalam rapat koordinasi antar kementerian/lembaga terkait yang diselenggarakan oleh kementerian yang menyelenggarakan urusan pemerintahan di bidang koordinasi perekonomian. **Pasal 4**",
DOC590,bn741-2018.txt,,,,10,1,Impor Hasil Perikanan untuk memenuhi kebutuhan bahan baku dan/atau bahan penolong industri sebagaimana dimaksud dalam Pasal 2 ayat (1) hanya dapat dilakukan oleh perusahaan pemilik API-P dan perusahaan pemilik API-U setelah mendapat Persetujuan Impor dari Menteri.,
DOC590,bn741-2018.txt,,,,10,2,"Impor Hasil Perikanan selain untuk memenuhi kebutuhan bahan baku dan bahan penolong industri sebagaimana dimaksud dalam Pasal 2 ayat (1) hanya dapat dilakukan oleh Badan Usaha Milik Negara, Badan Usaha Milik Daerah, dan/atau badan usaha milik swasta setelah mendapat Persetujuan Impor dari Menteri.",
DOC590,bn741-2018.txt,,,,10,3,Menteri dapat memberikan mandat penerbitan Persetujuan Impor sebagaimana dimaksud pada ayat (1) dan ayat (2) kepada Direktur Jenderal. **Pasal 5**,
DOC590,bn741-2018.txt,,,,10,1,"Untuk mendapat Persetujuan Impor sebagaimana dimaksud dalam Pasal 4 ayat (1), perusahaan pemilik API-P harus mengajukan permohonan secara elektronik kepada Direktur Jenderal, dengan melampirkan hasil pindai (scan) asli: a. Izin Usaha Industri atau izin usaha lain yang sejenis dari kementerian teknis/lembaga pemerintah non kementerian/instansi yang membidangi usaha tersebut; b. API-P bagi perusahaan yang melakukan kegiatan usaha di bidang industri yang menggunakan bahan baku atau bahan penolong Hasil Perikanan; c. Surat pernyataan bermeterai cukup yang memuat keterangan mengenai rencana impor yang meliputi jumlah, pelabuhan muat, pelabuhan tujuan, negara asal, sesuai dengan kebutuhan riil industri dan tidak untuk diperdagangkan dan/atau dipindahtangankan kepada pihak lain; d. Bukti penguasaan tempat penyimpanan berpendingin (cold storage); e. Bukti penguasaan alat transportasi berpendingin; dan f. Rekomendasi dari Menteri Perindustrian atau pejabat yang ditunjuk.",
DOC590,bn741-2018.txt,,,,10,2,"Untuk mendapat Persetujuan Impor sebagaimana dimaksud dalam Pasal 4 ayat (1), perusahaan pemilik API-U harus mengajukan permohonan secara elektronik kepada Direktur Jenderal, dengan melampirkan hasil pindai (scan) asli: a. API-U; b. Rencana distribusi atas Hasil Perikanan yang akan diimpor untuk memenuhi kebutuhan bahan baku dan/atau bahan penolong bagi industri pengolahan ikan termasuk pemindangan yang tidak melaksanakan importasi Hasil Perikanan sendiri yang dibuktikan dengan kontrak pemesanan; dan c. Rekomendasi dari Menteri Perindustrian atau pejabat yang ditunjuk.",
DOC590,bn741-2018.txt,,,,10,3,"Untuk mendapat Persetujuan Impor sebagaimana dimaksud dalam Pasal 4 ayat (2), Badan Usaha Milik Negara, Badan Usaha Milik Daerah, dan/atau badan usaha milik swasta harus mengajukan permohonan secara elektronik kepada Direktur Jenderal, dengan melampirkan hasil pindai (scan) asli: a. Angka Pengenal Importir (API); b. Rencana penyaluran/distribusi/penjualan produk yang diolah menggunakan Hasil Perikanan yang diimpor oleh pemegang API; dan c. Rekomendasi dari Menteri Kelautan dan Perikanan atau pejabat yang ditunjuk.",
DOC590,bn741-2018.txt,,,,10,4,"Rekomendasi sebagaimana dimaksud pada ayat (1), ayat (2), dan ayat (3) memuat keterangan paling sedikit mengenai Pos Tarif/HS, standar mutu Hasil Perikanan, jumlah yang dapat diimpor, tempat pemasukan, dan waktu pemasukan.",
DOC590,bn741-2018.txt,,,,10,5,"Atas permohonan sebagaimana dimaksud pada ayat (1), ayat (2), dan ayat (3), Direktur Jenderal menerbitkan Persetujuan Impor paling lama 5 (lima) hari kerja, terhitung sejak permohonan diterima secara lengkap dan benar.",
DOC590,bn741-2018.txt,,,,10,6,"Dalam hal permohonan sebagaimana dimaksud pada ayat (1), ayat (2), dan ayat (3) tidak lengkap dan benar, Direktur Jenderal menyampaikan pemberitahuan penolakan paling lama 5 (lima) hari kerja terhitung sejak permohonan diterima. **Pasal 6** Kementerian Perindustrian dan Kementerian Kelautan dan Perikanan menyampaikan Rekomendasi sebagaimana dimaksud dalam Pasal 5 ayat (1), ayat (2), dan ayat (3) secara elektronik melalui http://inatrade.kemendag.go.id. Dalam hal terjadi keadaan memaksa (force majeure) yang mengakibatkan sistem elektronik melalui http://inatrade.kemendag.go.id tidak berfungsi, Rekomendasi sebagaimana dimaksud pada ayat (1) disampaikan secara manual. **Pasal 7** Persetujuan Impor sebagaimana dimaksud dalam Pasal 5 ayat (4) berlaku paling lama 1 (satu) tahun. **Pasal 8** Persetujuan Impor sebagaimana dimaksud dalam Pasal 7 memuat data dan keterangan paling sedikit mengenai:",
DOC590,bn741-2018.txt,,,,1,,jumlah Hasil Perikanan;,
DOC590,bn741-2018.txt,,,,2,,jenis Hasil Perikanan dan Pos Tarif/HS;,
DOC590,bn741-2018.txt,,,,3,,pelabuhan muat;,
DOC590,bn741-2018.txt,,,,4,,negara asal;,
DOC590,bn741-2018.txt,,,,5,,pelabuhan tujuan; dan,
DOC590,bn741-2018.txt,,,,6,,"masa berlaku Persetujuan Impor. **Pasal 9** Importir Hasil Perikanan wajib melaporkan setiap perubahan yang terkait dengan dokumen sebagaimana dimaksud dalam Pasal 5 ayat (1) huruf a sampai dengan huruf e, Pasal 5 ayat (2) huruf a dan huruf b, dan Pasal 5 ayat (3) huruf a dan huruf b, dan mengajukan permohonan perubahan Persetujuan Impor. Importir Hasil Perikanan dapat mengajukan perubahan Persetujuan Impor dalam hal terdapat perubahan mengenai jumlah, jenis dan Pos Tarif/HS, pelabuhan muat, negara asal, dan pelabuhan tujuan. Untuk memperoleh perubahan Persetujuan Impor sebagaimana dimaksud pada ayat (1) dan ayat (2), Importir Hasil Perikanan harus mengajukan permohonan secara elektronik kepada Direktur Jenderal, dengan melampirkan hasil pindai (scan) asli: a. dokumen yang mengalami perubahan sebagaimana dimaksud pada ayat (1); b. Persetujuan Impor; dan c. Rekomendasi dari Menteri Perindustrian atau pejabat yang ditunjuk, untuk permohonan perubahan Persetujuan Impor dalam rangka pemenuhan kebutuhan bahan baku dan bahan penolong industri; atau d. Rekomendasi dari Menteri Kelautan dan Perikanan atau pejabat yang ditunjuk, untuk permohonan perubahan Persetujuan Impor dalam rangka selain pemenuhan kebutuhan bahan baku dan bahan penolong industri. Atas permohonan sebagaimana dimaksud pada ayat (3), Direktur Jenderal menerbitkan perubahan Persetujuan Impor paling lama 5 (lima) hari kerja terhitung sejak permohonan diterima secara lengkap dan benar. **Pasal 10** Pengajuan permohonan untuk memperoleh: a. Persetujuan Impor sebagaimana dimaksud dalam Pasal 7; dan b. Perubahan Persetujuan Impor sebagaimana dimaksud dalam Pasal 9, hanya dapat dilayani dengan sistem elektronik melalui http://inatrade.kemendag.go.id. Dalam hal terjadi keadaan memaksa (force majeure) yang mengakibatkan sistem elektronik melalui http://inatrade.kemendag.go.id tidak berfungsi, pengajuan permohonan sebagaimana dimaksud pada ayat (1) disampaikan secara manual. **Pasal 11** Perusahaan pemilik API-P dilarang memperdagangkan dan/atau memindahtangankan Hasil Perikanan yang telah diimpornya kepada pihak lain. **Pasal 12**",
DOC590,bn741-2018.txt,,,,6,1,Setiap pelaksanaan Impor Hasil Perikanan oleh Importir Hasil Perikanan harus terlebih dahulu dilakukan Verifikasi atau Penelusuran Teknis di negara muat barang.,
DOC590,bn741-2018.txt,,,,6,2,"Pelaksanaan Verifikasi atau Penelusuran Teknis sebagaimana dimaksud pada ayat (1) dilakukan oleh Surveyor yang ditetapkan oleh Menteri. **Pasal 13** Untuk dapat ditetapkan sebagai pelaksana Verifikasi atau Penelusuran Teknis Impor Hasil Perikanan sebagaimana dimaksud dalam Pasal 12 ayat (2), Surveyor harus memenuhi persyaratan sebagai berikut: a. memiliki Surat Izin Usaha Jasa Survey (SIUJS); b. berpengalaman sebagai Surveyor paling sedikit 5 (lima) tahun; c. memiliki cabang atau perwakilan dan/atau afiliasi di luar negeri dan memiliki jaringan untuk mendukung efektivitas pelayanan Verifikasi atau Penelusuran Teknis; dan d. mempunyai rekam jejak (track records) yang baik di bidang pengelolaan kegiatan Verifikasi atau Penelusuran Teknis impor. **Pasal 14** Verifikasi atau Penelusuran Teknis sebagaimana dimaksud dalam Pasal 12 ayat (1) dilakukan oleh Surveyor yang ditetapkan oleh Menteri. **PERATURAN MENTERI PERDAGANGAN REPUBLIK INDONESIA** **NOMOR 66 TAHUN 2018** **TENTANG** **KETENTUAN IMPOR HASIL PERIKANAN** DENGAN RAHMAT TUHAN YANG MAHA ESA, Menteri Perdagangan Republik Indonesia, a. bahwa untuk melaksanakan ketentuan dalam peraturan perundang-undangan di bidang impor hasil perikanan, perlu menetapkan Peraturan Menteri tentang Ketentuan Impor Hasil Perikanan; b. bahwa berdasarkan pertimbangan sebagaimana dimaksud pada huruf a, perlu menetapkan Peraturan Menteri ini.",
DOC590,bn741-2018.txt,,,,1,,Undang-Undang Nomor 7 Tahun 2014 tentang Perdagangan;,
DOC590,bn741-2018.txt,,,,2,,Undang-Undang Nomor 45 Tahun 2009 tentang Perikanan;,
DOC590,bn741-2018.txt,,,,3,,Peraturan Pemerintah Nomor 85 Tahun 2015 tentang Sistem Perizinan Berusaha Terintegrasi Secara Elektronik;,
DOC590,bn741-2018.txt,,,,4,,Peraturan Menteri Perdagangan Nomor 20 Tahun 2017 tentang Ketentuan Umum dan Tata Cara Pemberian Izin Usaha Perdagangan. Menetapkan: PERATURAN MENTERI TENTANG KETENTUAN IMPOR HASIL PERIKANAN. **Pasal 1** Dalam Peraturan Menteri ini yang dimaksud dengan:,
DOC590,bn741-2018.txt,,,,1,,Hasil Perikanan adalah semua produk yang berasal dari kegiatan penangkapan ikan dan budidaya ikan.,
DOC590,bn741-2018.txt,,,,2,,Importir Hasil Perikanan adalah pihak yang melakukan kegiatan impor hasil perikanan.,
DOC590,bn741-2018.txt,,,,3,,Sertifikat Kesehatan Ikan adalah dokumen yang menyatakan bahwa hasil perikanan yang diimpor memenuhi syarat kesehatan.,
DOC590,bn741-2018.txt,,,,4,,Verifikasi atau Penelusuran Teknis adalah kegiatan pemeriksaan terhadap hasil perikanan yang diimpor. **Pasal 2**,
DOC590,bn741-2018.txt,,,,4,1,"Hasil perikanan yang diimpor oleh importir hasil perikanan, meliputi sertifikat kesehatan ikan atau produk pengolahan ikan yang ditandatangani oleh pejabat atau otoritas yang berwenang di negara asal, bagi yang dipersyaratkan dan data atau keterangan sesuai dengan ketentuan peraturan perundang-undangan.",
DOC590,bn741-2018.txt,,,,4,2,Hasil verifikasi atau penelusuran teknis sebagaimana dimaksud pada ayat (1) dituangkan dalam bentuk Laporan Surveyor (LS).,
DOC590,bn741-2018.txt,,,,4,3,LS sebagaimana dimaksud pada ayat (2) harus memuat pernyataan kebenaran atas hasil verifikasi atau penelusuran teknis dan menjadi tanggung jawab penuh surveyor.,
DOC590,bn741-2018.txt,,,,4,4,"Atas pelaksanaan verifikasi atau penelusuran teknis sebagaimana dimaksud pada ayat (1), surveyor memungut imbalan jasa dari importir hasil perikanan yang besarannya ditentukan dengan memperhatikan azas manfaat. **Pasal 15**",
DOC590,bn741-2018.txt,,,,4,1,Pemeriksaan atas pemenuhan persyaratan impor hasil perikanan dilakukan setelah melalui kawasan pabean.,
DOC590,bn741-2018.txt,,,,4,2,Persyaratan impor sebagaimana dimaksud pada ayat (1) berupa: a. Persetujuan impor; dan b. Laporan surveyor.,
DOC590,bn741-2018.txt,,,,4,3,"Importir harus membuat pernyataan secara mandiri (self declaration) yang menyatakan telah memenuhi persyaratan impor hasil perikanan sebelum barang impor tersebut digunakan, diperdagangkan, dan/atau dipindahtangankan.",
DOC590,bn741-2018.txt,,,,4,4,Importir harus menyampaikan pernyataan sebagaimana dimaksud pada ayat (3) secara elektronik melalui http://inatrade.kemendag.go.id dengan mencantumkan nomor Pemberitahuan Impor Barang (PIB).,
DOC590,bn741-2018.txt,,,,4,5,Importir wajib menyimpan dokumen persyaratan impor sebagaimana dimaksud pada ayat (2) dan Pemberitahuan Impor Barang (PIB) paling sedikit 5 (lima) tahun untuk keperluan pemeriksaan sebagaimana dimaksud pada ayat (1). **Pasal 16**,
DOC590,bn741-2018.txt,,,,4,1,"Importir hasil perikanan wajib menyampaikan laporan pelaksanaan impor hasil perikanan kepada Direktur Jenderal Perdagangan Luar Negeri, dalam hal ini Direktur Impor, Kementerian Perdagangan, setiap bulan paling lambat tanggal 15 (lima belas) bulan berikutnya, dengan tembusan disampaikan kepada: a. Direktur Jenderal Industri Agro, Kementerian Perindustrian; dan b. Direktur Jenderal Penguatan Daya Saing Produk Kelautan dan Perikanan, Kementerian Kelautan dan Perikanan.",
DOC590,bn741-2018.txt,,,,4,2,Laporan sebagaimana dimaksud pada ayat (1) disampaikan secara online melalui http://inatrade.kemendag.go.id dan melampirkan hasil pindai (scan) Kartu Kendali Realisasi Impor yang telah diparaf dan dicap oleh petugas Bea dan Cukai. **Pasal 17** Surveyor sebagaimana dimaksud dalam Pasal 12 ayat (2) wajib menyampaikan laporan tertulis mengenai pelaksanaan verifikasi atau penelusuran teknis impor hasil perikanan kepada Direktur Jenderal setiap bulan paling lambat tanggal 15 (lima belas) bulan berikutnya. **Pasal 18**,
DOC590,bn741-2018.txt,,,,4,1,Persetujuan impor dibekukan apabila importir hasil perikanan: a. tidak melaksanakan kewajiban penyampaian laporan sebagaimana dimaksud dalam Pasal 16 sebanyak 2 (dua) kali; dan/atau b. sedang dalam proses penyidikan atas dugaan tindak pidana yang berkaitan dengan penyalahgunaan persetujuan impor.,
DOC590,bn741-2018.txt,,,,4,2,"Pembekuan persetujuan impor dapat diaktifkan kembali setelah importir hasil perikanan: a. memenuhi kewajiban penyampaian laporan sebagaimana dimaksud dalam Pasal 16 dalam waktu 2 (dua) bulan sejak persetujuan impor dibekukan; dan/atau b. tidak terbukti melakukan tindak pidana yang berkaitan dengan penyalahgunaan persetujuan impor. **Pasal 19** Persetujuan impor dicabut apabila importir hasil perikanan: a. melanggar ketentuan larangan memperdagangkan dan/atau memindahtangankan hasil perikanan kepada pihak lain sebagaimana dimaksud dalam Pasal 11; b. tidak melaksanakan kewajiban penyampaian laporan sebagaimana dimaksud dalam Pasal 16 setelah melebihi batas waktu 2 (dua) bulan sejak persetujuan impor dibekukan; c. terbukti menyampaikan data dan/atau keterangan yang tidak benar dalam permohonan persetujuan impor, setelah persetujuan impor diterbitkan; d. mengubah, menambah, dan/atau mengganti isi yang tercantum dalam persetujuan impor; dan/atau e. dinyatakan bersalah oleh pengadilan atas tindak pidana yang berkaitan dengan penyalahgunaan persetujuan impor. **Pasal 20** Pembekuan dan pengaktifan kembali persetujuan impor sebagaimana dimaksud dalam Pasal 18 dan pencabutan persetujuan impor sebagaimana dimaksud dalam Pasal 19 dilakukan oleh Direktur Jenderal. **Pasal 21** Penetapan sebagai surveyor pelaksana verifikasi atau penelusuran teknis impor hasil perikanan sebagaimana dimaksud dalam Pasal 12 ayat (2) dicabut apabila surveyor: a. tidak melaksanakan kewajiban penyampaian laporan sebagaimana dimaksud dalam Pasal 17 sebanyak 2 (dua) kali; dan/atau b. melakukan pelanggaran dalam pelaksanaan kegiatan verifikasi atau penelusuran teknis impor hasil perikanan. **Pasal 22** Pencabutan penetapan sebagai surveyor pelaksana verifikasi atau penelusuran teknis impor hasil perikanan sebagaimana dimaksud dalam Pasal 21 ditetapkan oleh Menteri. **Pasal 23** Pelanggaran terhadap ketentuan dalam Peraturan Menteri ini dapat dikenai sanksi lain berdasarkan ketentuan peraturan perundang-undangan. **Pasal 24**",
DOC590,bn741-2018.txt,,,,4,1,Direktorat Jenderal Perdagangan Luar Negeri dan Direktorat Jenderal Perlindungan Konsumen dan Tertib Niaga melakukan pengawasan secara berkala dan/atau sewaktu-waktu.,
DOC590,bn741-2018.txt,,,,4,2,Pemeriksaan sebagaimana dimaksud pada ayat (1) dilakukan terhadap: a. persyaratan impor hasil perikanan; dan b. dokumen pendukung impor lain.,
DOC590,bn741-2018.txt,,,,4,3,"Pengawasan sebagaimana dimaksud pada ayat (1) dilakukan terhadap: a. kebenaran laporan realisasi impor; b. kesesuaian hasil perikanan yang diimpor dengan data yang tercantum dalam persetujuan impor; dan c. kepatuhan atas peraturan perundang-undangan yang terkait di bidang impor hasil perikanan. **Pasal 25** Hasil perikanan asal luar daerah pabean yang dimasukkan ke kawasan perdagangan bebas dan pelabuhan bebas, kawasan ekonomi khusus, dan tempat penimbunan berikat selain kawasan berikat dan pusat logistik berikat, tetap berlaku ketentuan peraturan menteri ini. Hasil perikanan asal luar daerah pabean yang dimasukkan ke kawasan berikat dan pusat logistik berikat dikecualikan dari ketentuan peraturan menteri ini. Hasil perikanan asal luar daerah pabean yang dikeluarkan dari kawasan berikat dan pusat logistik berikat ke tempat lain dalam daerah pabean berlaku ketentuan persetujuan impor dan verifikasi atau penelusuran teknis impor. Verifikasi atau penelusuran teknis impor hasil perikanan asal luar daerah pabean sebagaimana dimaksud pada ayat (3) dilakukan di kawasan berikat dan pusat logistik berikat. **Pasal 26** Ketentuan dalam peraturan menteri ini tidak berlaku terhadap impor hasil perikanan yang merupakan: a. barang perwakilan negara asing; b. barang keperluan pemerintah; c. barang contoh dengan berat paling banyak 25 (dua puluh lima) kilogram; d. barang pribadi penumpang dengan berat paling banyak 25 (dua puluh lima) kilogram; dan e. barang untuk keperluan penelitian dengan mempertimbangkan surat keterangan dari instansi terkait. **Pasal 27** Pelaksanaan impor hasil perikanan selain tunduk pada ketentuan peraturan menteri ini juga tunduk pada ketentuan peraturan perundang-undangan lain mengenai hasil perikanan. **Pasal 28** Pengecualian dari ketentuan yang diatur dalam peraturan menteri ini ditetapkan oleh Menteri dengan mempertimbangkan ketersediaan dan kebutuhan hasil perikanan di dalam negeri serta usulan dari instansi terkait. **Pasal 29** Peraturan menteri ini mulai berlaku pada tanggal diundangkan. Agar setiap orang mengetahuinya, memerintahkan pengundangan peraturan menteri ini dengan penempatannya dalam Berita Negara Republik Indonesia. MENTERI PERDAGANGAN REPUBLIK INDONESIA, ttd ENGGARTIASTO LUKITA Diundangkan di Jakarta pada tanggal 6 Juni 2018 DIREKTUR JENDERAL PERATURAN PERUNDANG-UNDANGAN KEMENTERIAN HUKUM DAN HAK ASASI MANUSIA REPUBLIK INDONESIA, ttd WIDODO EKATJAHJANA **LAMPIRAN** **PERATURAN MENTERI PERDAGANGAN REPUBLIK INDONESIA NOMOR 66 TAHUN 2018 TENTANG KETENTUAN IMPOR HASIL PERIKANAN** **JENIS-JENIS KOMODITAS PERIKANAN YANG DIBATASI IMPORNYA** | No. HS 2017 | Uraian 2017 | KETERANGAN | |-------------|-------------|------------| | 03.02       | Ikan, segar atau dingin, tidak termasuk potongan ikan tanpa tulang dan daging ikan lainnya dari pos 03.04. | | |             | - Salmon (salmonidae), tidak termasuk sisa ikan yang dapat dimakan dari subpos 0302.91 sampai dengan 0302.99: | | | 0302.11.00  | Trout (Salmo trutta, Oncorhynchus mykiss, Oncorhynchus clarki, Oncorhynchus aguabonita, Oncorhynchus gilae, Oncorhyncus apache dan Oncorhynchus chrysogaster) | TROUT DAN SALMON/TROUT AND SALMON | | 0302.13.00  | - Salmon Pasifik (Oncorhynchus nerka, Oncorhynchus gorbuscha, Oncorhynchus keta, Oncorhynchus tschawytscha, Oncorhynchus kisutc, Oncorhynchus masou dan Oncorhynchus rhodurus) | TROUT DAN SALMON/TROUT AND SALMON | | 0302.14.00  | - Salmon Atlantik (Salmo salar) dan salmon Danube (Hucho hucho) | TROUT DAN SALMON/TROUT AND SALMON | | 0302.19.00  | - Lain-lain | | |             | - Ikan pipih (Pleuronectidae, Bothidae, Cynoglossidae, Soleidae, Scophthalmidae dan Citharidae), tidak termasuk sisa ikan yang dapat dimakan dari subpos 0302.91 sampai dengan 0302.99: | | | 0302.21.00  | Halibut (Hippoglossus hippoglossoides, Hippoglossus stenolepis) | HALIBUT/HALIBUT | | 0302.22.00  | - Plaice (Pleuronectes platessa) | PLAICE/PLAICE | | 0302.23.00  | - Sole (Solea spp.) | SOLE/SOLE | | 0302.24.00  | - Turbots (Psetta maxima) | TURBOTS | | 0302.29.00  | - Lain-lain | LAINNYA/OTHER FLAT FISH | |             | - Tuna (dari genus Thunnus), cakalang atau stripe-bellied bonito (Euthynnus (Katsuwonus) pelamis), tidak termasuk sisa ikan yang dapat dimakan dari subpos 0302.91 sampai dengan 0302.99: | | | 0302.31.00  | - Albacore atau tuna sirip panjang (Thunnus alalunga) | TUNA, TONGKOL, CAKALANG/TUNAS, TONGGOL, SKIPJACK | | 0302.35.00  | - Tuna sirip kuning (Thunnus albacares) | TUNA, TONGKOL, CAKALANG/TUNAS, TONGGOL, SKIPJACK | | 0302.39.00  | - Lain-lain | TUNA, TONGKOL, CAKALANG/TUNAS, TONGGOL, SKIPJACK | **(Tabel dilanjutkan sesuai dengan data yang ada)** **PERATURAN IMPOR IKAN** **DENGAN RAHMAT TUHAN YANG MAHA ESA** a. bahwa untuk melaksanakan ketentuan dalam peraturan perundang-undangan terkait impor ikan, perlu menetapkan peraturan mengenai jenis ikan yang dapat diimpor; b. bahwa jenis ikan yang dapat diimpor harus sesuai dengan ketentuan yang berlaku dan tidak termasuk sisa ikan yang dapat dimakan dari subpos yang ditentukan; c. bahwa untuk itu, perlu adanya pengaturan yang jelas mengenai klasifikasi dan deskripsi jenis ikan yang diimpor.",
DOC590,bn741-2018.txt,,,,1,,Undang-Undang Nomor 17 Tahun 2006 tentang Perdagangan;,
DOC590,bn741-2018.txt,,,,2,,Undang-Undang Nomor 18 Tahun 2012 tentang Pangan;,
DOC590,bn741-2018.txt,,,,3,,Peraturan Menteri Kelautan dan Perikanan Nomor 56/PERMEN-KP/2014 tentang Pengawasan dan Pengendalian Impor Produk Perikanan. Menetapkan Peraturan tentang Jenis Ikan yang Dapat Diimpor. **PASAL 1** Jenis ikan yang dapat diimpor terdiri dari:,
DOC590,bn741-2018.txt,,,,1,,**Ikan Laut:** - Bawal/Pomfrets - Ikan layar Indo-Pasifik/Indo-Pacific Sailfish - Marlin - Makerel Indian (Rastrelliger spp.) - Dan jenis ikan lainnya,
DOC590,bn741-2018.txt,,,,2,,"**Ikan Cod:** - Cod (Gadus morhua, Gadus ogac, Gadus macrocephalus)",
DOC590,bn741-2018.txt,,,,3,,**Ikan Haddock:** - Haddock (Melanogrammus aeglefinus),
DOC590,bn741-2018.txt,,,,4,,**Ikan Coalfish:** - Coalfish (Pollachius virens),
DOC590,bn741-2018.txt,,,,5,,"**Ikan Hake:** - Hake (Merluccius spp., Urophycis spp.)",
DOC590,bn741-2018.txt,,,,6,,**Ikan Alaska Pollack:** - Alaska Pollack (Theragra chalcogramma),
DOC590,bn741-2018.txt,,,,7,,"**Ikan Blue Whitings:** - Blue Whitings (Micromesistius poutassou, Micromesistius australis)",
DOC590,bn741-2018.txt,,,,8,,"**Ikan Lain-lain:** - Tilapia (Oreochromis spp.) - Catfish (Pangasius spp., Silurus spp., Clarias spp., Ictalurus spp.) - Ikan mas (Cyprinus spp., Carassius spp., Ctenopharyngodon idellus, Hypophthalmichthys spp., Cirrhinus spp., Mylopharyngodon piceus, Catla catla, Labeo spp., Osteochilus hasselti, Leptobarbus hoeveni, Megalobrama spp.) - Sidat (Anguilla spp.) - Nile perch (Lates niloticus) - Gabus (Channa spp.)",
DOC590,bn741-2018.txt,,,,9,,"**Ikan Pipih:** - Halibut (Reinhardtius hippoglossoides, Hippoglossus hippoglossus, Hippoglossus stenolepis) - Plaice (Pleuronectes platessa) - Sole (Solea spp.) - Turbots (Psetta maxima)",
DOC590,bn741-2018.txt,,,,10,,**Ikan Tuna:** - Tuna sirip panjang (Thunnus alalunga) - Tuna sirip kuning (Thunnus albacares) - Tuna mata besar (Thunnus obesus) - Tuna sirip biru Atlantik (Thunnus thynnus) - Tuna sirip biru Pasifik (Thunnus orientalis) - Tuna sirip biru Selatan (Thunnus maccoyii),
DOC590,bn741-2018.txt,,,,11,,"**Ikan Herring:** - Herring (Clupea harengus, Clupea pallasii) - Sarden (Sardina pilchardus, Sardinops spp.) - Sardinella (Sardinella spp.) - Brisling atau sprats (Sprattus sprattus) **PASAL 2** Ketentuan lebih lanjut mengenai jenis ikan yang dapat diimpor akan diatur dalam peraturan menteri terkait. **MENTERI KELAUTAN DAN PERIKANAN** **(Nama Pejabat)** **(Tanda Tangan)** **(Cap Resmi)** **www.peraturan.go.id** **2018, No.741** **PERATURAN IMPOR IKAN** **DENGAN RAHMAT TUHAN YANG MAHA ESA** a. bahwa untuk melaksanakan ketentuan mengenai impor ikan, perlu menetapkan peraturan yang mengatur tentang pengelompokan dan pengenaan tarif bea masuk terhadap ikan; b. bahwa pengelompokan dan pengenaan tarif bea masuk tersebut perlu disesuaikan dengan ketentuan yang berlaku di tingkat internasional; c. bahwa berdasarkan pertimbangan sebagaimana dimaksud dalam huruf a dan b, perlu menetapkan peraturan menteri tentang pengelompokan dan pengenaan tarif bea masuk terhadap ikan.",
DOC590,bn741-2018.txt,,,,2,,Peraturan Pemerintah Nomor 10 Tahun 2012 tentang Pengelolaan Sumber Daya Perikanan;,
