doc_id,nama_dokumen,bab,bagian,pasal,angka,ayat,isi,penjelasan
DOC631,bn842-2019.txt,,,Pasal 25,1,,"**Pengisian Pemberitahuan Impor Barang BC 2.0** Untuk tujuan pengenaan Tarif Preferensi, pada PIB diisikan kode Tarif Preferensi, nomor referensi dan tanggal SKA Form E sebagai berikut: a. Dalam hal PIB hanya menggunakan skema ACFTA, kode 54, nomor referensi dan tanggal SKA Form E wajib dicantumkan pada kolom 19 dan/atau kolom 33 PIB; b. Dalam hal PIB menggunakan skema ACFTA dan fasilitas kepabeanan, kode 54 wajib dicantumkan pada kolom 33 PIB sedangkan nomor referensi dan tanggal SKA Form E wajib dicantumkan pada Lembar Lampiran Dokumen Dan Pemenuhan Persyaratan/Fasilitas Impor PIB; c. Pengisian pada PIB untuk ditimbun di TPB dan/atau PIB dari TPB diatur tersendiri dalam Lampiran II Huruf B Peraturan Menteri Keuangan Nomor 229/PMK.04/2017 tentang Tata Cara Pengenaan Tarif Bea Masuk atas Barang Impor Berdasarkan Perjanjian atau Kesepakatan Internasional; d. Pengisian pada Pemberitahuan Pabean Pemasukan Barang Impor untuk ditimbun di PLB dan/atau PIB dari PLB diatur tersendiri dalam Lampiran I Huruf B Peraturan Menteri Keuangan Nomor 229/PMK.04/2017 tentang Tata Cara Pengenaan Tarif Bea Masuk atas Barang Impor Berdasarkan Perjanjian atau Kesepakatan Internasional; e. Pengisian pada PPFTZ-01 diatur tersendiri dalam Lampiran II Huruf C Peraturan Menteri Keuangan Nomor 229/PMK.04/2017 tentang Tata Cara Pengenaan Tarif Bea Masuk atas Barang Impor Berdasarkan Perjanjian atau Kesepakatan Internasional. **IV. KETENTUAN LAIN TERKAIT KETENTUAN ASAL BARANG**",
DOC631,bn842-2019.txt,,,Pasal 25,1,,**Proses dan Pengerjaan Minimal** Pengerjaan yang dilakukan berikut ini dianggap sebagai proses minimal dan tidak dapat diperhitungkan dalam menentukan apakah suatu barang Originating Negara Anggota. Proses minimal tersebut adalah proses yang bertujuan untuk: a. Memastikan barang berada dalam kondisi baik untuk keperluan penyimpanan atau pengangkutan; b. Memfasilitasi pengiriman atau pengangkutan; dan c. Keperluan pengemasan (tidak termasuk proses enkapsulasi dalam industri elektronik) atau penyajian barang untuk dijual.,
DOC631,bn842-2019.txt,,,Pasal 25,2,,"**De Minimis** Dalam hal suatu barang tidak memenuhi persyaratan kriteria asal barang CTC sesuai dengan romawi I angka 1.c, nilai bahan baku Non-Originating yang tidak wajib mengalami perubahan tarif klasifikasi adalah: a. Untuk barang selain dari Bab 50 sampai dengan Bab 63 Harmonized System, bahan baku Non-Originating yang nilainya tidak melebihi 10% (sepuluh persen) nilai FOB barang jadinya; b. Untuk barang dari Bab 50 sampai dengan Bab 63 Harmonized System, bahan baku Non-Originating yang beratnya tidak melebihi 10% (sepuluh persen) berat barang jadinya atau yang nilainya tidak melebihi 10% (sepuluh persen) nilai FOB barang jadinya.",
DOC631,bn842-2019.txt,,,Pasal 25,3,,"**Perlakuan terhadap Kemasan** a. Pengemas untuk keperluan pengangkutan dan pengapalan suatu barang tidak diperhitungkan dalam menentukan keasalan suatu barang; b. Pengemas untuk penjualan eceran, apabila diklasifikasikan dalam satu pos tarif dengan barangnya, tidak diperhitungkan dalam menentukan asal barang sepanjang kriteria asal barang yang digunakan adalah CTC; c. Dalam hal barang menggunakan kriteria asal barang RVC, nilai pengemas untuk penjualan eceran harus ikut diperhitungkan sebagai Originating maupun Non-Originating dalam penghitungan RVC.",
DOC631,bn842-2019.txt,,,Pasal 25,4,,"**Aksesoris, Spare Parts, dan Peralatan** a. Untuk keperluan penentuan asal suatu barang, aksesoris, spare part, dan peralatan yang disajikan bersama barang harus dianggap sebagai bagian dari barang tersebut dalam hal: 1) Aksesoris, spare part, dan peralatan yang disajikan bersama barang tidak dalam invoice yang terpisah dengan barangnya; dan 2) Jumlah dan nilai dari aksesoris, spare part, dan peralatan merupakan sesuatu yang umum disajikan dengan barangnya. b. Dalam hal suatu barang menggunakan kriteria origin CTC, nilai aksesoris, spare part, dan peralatan yang disajikan bersama barang tidak diperhitungkan dalam penentuan keasalan suatu barang; c. Dalam hal suatu barang menggunakan kriteria origin RVC, nilai aksesoris, spare part, dan peralatan yang disajikan bersama barang harus turut diperhitungkan sebagai Originating maupun Non-Originating dalam perhitungan RVC.",
DOC631,bn842-2019.txt,,,Pasal 25,5,,"**Elemen Netral (Neutral Elements)** Untuk menentukan keasalan suatu barang, barang-barang di bawah ini tidak perlu diperhitungkan dalam penentuan keasalan suatu barang: a. Bahan bakar, energi, katalisator, dan pelarut; b. Perlengkapan, perangkat dan peralatan yang digunakan untuk menguji atau memeriksa barang; c. Sarung tangan, kacamata, alas kaki, pakaian, serta perlengkapan dan peralatan keamanan; d. Tools, dies, dan moulds; e. Spare part dan bahan yang digunakan untuk pemeliharaan peralatan dan gedung; f. Pelumas, gemuk, bahan kompon dan bahan lain yang digunakan dalam proses produksi atau digunakan untuk mengoperasikan peralatan dan gedung; dan g. Barang lain yang tidak tergabung dengan barang tetapi digunakan dalam produksi barang tersebut, yang cukup dapat ditunjukkan sebagai bagian dari produksi.",
DOC631,bn842-2019.txt,,,Pasal 25,6,,"**Bahan Baku Identik dan Dapat Dipertukarkan** Dalam hal bahan baku Originating dan Non-Originating yang identik dan dapat dipertukarkan digunakan dalam proses produksi suatu barang, metode yang dapat digunakan untuk menentukan keasalan barang meliputi: a. Pemisahan fisik bahan baku; atau b. Metode manajemen persediaan berdasarkan standar akuntansi yang berlaku di Negara Anggota tersebut. Dalam hal keputusan metode manajemen persediaan telah diambil maka metode tersebut wajib digunakan sepanjang tahun fiskal.",
DOC631,bn842-2019.txt,,,Pasal 25,7,,**Asas Timbal Balik (Resiprositas) dalam Rangka ACFTA** Dalam rangka ACFTA berlaku asas timbal balik (resiprositas) sehingga atas importasi beberapa jenis barang yang berasal dari negara China diberlakukan tarif resiprositas yang besarnya dapat sebesar tarif bea masuk MFN atau besaran tertentu sebagaimana tercantum dalam Peraturan Menteri Keuangan mengenai penetapan tarif bea masuk dalam rangka ASEAN-China Free Trade Area (ACFTA). **VII. BENTUK DAN FORMAT SKA FORM E** Original (Duplicate/Triplicate) Reference No.,
DOC631,bn842-2019.txt,,,Pasal 25,1,,"Products consigned from (Exporter’s business name, address, country) ASEAN-CHINA FREE TRADE AREA PREFERENTIAL TARIFF CERTIFICATE OF ORIGIN (Combined Declaration and Certificate)",
DOC631,bn842-2019.txt,,,Pasal 25,2,,"Products consigned to (Consignee’s name, address, country) Issued in (Country) See Overleaf Notes",
DOC631,bn842-2019.txt,,,Pasal 25,3,,Means of transport and route (as far as known) Departure date Vessel's name/ Aircraft etc. Port of Discharge,
DOC631,bn842-2019.txt,,,Pasal 25,7,,"Number and type of packages, description of products (including quantity where appropriate and HS number in six digit code)",
DOC631,bn842-2019.txt,,,Pasal 25,10,,"Number, date of Invoices (see Overleaf Notes)",
DOC631,bn842-2019.txt,,,Pasal 25,11,,"Declaration by the exporter The undersigned hereby declares that the above details and statement are correct; that all the products were produced in (Country) and that they comply with the origin requirements specified for these products in the Rules of Origin for the ACFTA for the products exported to (Importing Country) Place and date, signature and stamp of certifying authority Place and date, signature of authorised signatory 13. o Issued Retroactively o Movement Certificate o Third Party Invoicing **OVERLEAF NOTES**",
DOC631,bn842-2019.txt,,,Pasal 25,1,,Parties which accept this form for the purpose of preferential treatment under the ASEAN-China Free Trade Area (ACFTA): BRUNEI DARUSSALAM CAMBODIA CHINA INDONESIA LAOS MALAYSIA MYANMAR PHILIPPINES SINGAPORE THAILAND VIETNAM,
DOC631,bn842-2019.txt,,,Pasal 25,2,,"CONDITIONS: The main conditions for admission to the preferential treatment under the ACFTA are that products sent to any Parties listed above: **PERATURAN MENTERI REPUBLIK INDONESIA TENTANG KETENTUAN ASAL BARANG DALAM RANGKA ASEAN-KOREA FREE TRADE AREA (AKFTA)** DENGAN RAHMAT TUHAN YANG MAHA ESA a. bahwa dalam rangka meningkatkan kerjasama ekonomi antara Negara Anggota ASEAN dan Korea Selatan, perlu ditetapkan ketentuan asal barang dalam skema AKFTA; b. bahwa untuk melaksanakan ketentuan sebagaimana dimaksud pada huruf a, perlu menetapkan peraturan menteri tentang ketentuan asal barang dalam rangka AKFTA;",
DOC631,bn842-2019.txt,,,Pasal 25,1,,Undang-Undang Nomor 7 Tahun 2014 tentang Perdagangan;,
DOC631,bn842-2019.txt,,,Pasal 25,2,,Peraturan Pemerintah Nomor 34 Tahun 2011 tentang Penyelenggaraan Perdagangan Internasional;,
DOC631,bn842-2019.txt,,,Pasal 25,3,,Peraturan Menteri Perdagangan Nomor 82 Tahun 2017 tentang Ketentuan Umum dan Tata Cara Penerbitan Surat Keterangan Asal (SKA);,
DOC631,bn842-2019.txt,,,Pasal 25,4,,Ketentuan-ketentuan lain yang relevan. Menetapkan: PERATURAN MENTERI TENTANG KETENTUAN ASAL BARANG DALAM RANGKA ASEAN-KOREA FREE TRADE AREA (AKFTA). **Pasal 1** Ketentuan asal barang dalam skema AKFTA meliputi:,
DOC631,bn842-2019.txt,,,Pasal 25,1,,Barang yang seluruhnya diperoleh atau diproduksi di satu Negara Anggota (Wholly Obtained atau Produced);,
DOC631,bn842-2019.txt,,,Pasal 25,2,,"Barang yang tidak seluruhnya diperoleh atau diproduksi di satu Negara Anggota (Not Wholly Obtained atau Produced), meliputi: a. General Rules 1) Regional Value Content (RVC) paling sedikit 40% (empat puluh persen) dari nilai FOB; atau 2) Change in Tariff Heading (CTH), yaitu perubahan pada 4 (empat) digit pertama pada HS (pos). b. Product Specific Rules (PSR) Dalam hal klasifikasi barang termasuk dalam daftar PSR sebagaimana diatur dalam Appendix 2 AKFTA, maka kriteria asal barang harus ditetapkan berdasarkan kolom Origin Conferring Criteria daftar PSR dimaksud, walaupun butir 1) telah terpenuhi. c. Perlakuan untuk Barang Tertentu (Treatment for Certain Goods) d. Akumulasi **Pasal 2** Barang-barang yang dikategorikan sebagai Wholly Obtained atau Produced adalah sebagai berikut:",
DOC631,bn842-2019.txt,,,Pasal 25,1,,"Tanaman dan produk tanaman yang tumbuh, dipanen, dipetik atau dikumpulkan di satu Negara Anggota;",
DOC631,bn842-2019.txt,,,Pasal 25,2,,"Binatang hidup, lahir, dan dibesarkan di satu Negara Anggota;",
DOC631,bn842-2019.txt,,,Pasal 25,3,,Produk yang diperoleh dari binatang hidup sebagaimana dimaksud pada huruf b;,
DOC631,bn842-2019.txt,,,Pasal 25,4,,"Hasil perburuan, perangkap, pemancingan, budidaya air, pengumpulan atau penangkapan, yang dilakukan di satu Negara Anggota;",
DOC631,bn842-2019.txt,,,Pasal 25,5,,"Mineral dan produk alam lainnya, yang tidak termasuk pada huruf a sampai huruf d, diekstraksi atau diambil dari tanah, perairan, dasar laut atau di bawahnya;",
DOC631,bn842-2019.txt,,,Pasal 25,6,,"Hasil penangkapan ikan di laut yang diambil oleh kapal yang terdaftar di Negara Anggota dan berbendera negara tersebut, dan produk lain yang diambil dari perairan, dasar laut atau di bawah dasar laut di luar perairan teritorial Negara Anggota, dengan ketentuan bahwa Negara Anggota memiliki hak untuk mengeksploitasi perairan, dasar laut dan bawah laut tersebut sesuai dengan hukum internasional;",
DOC631,bn842-2019.txt,,,Pasal 25,7,,Hasil penangkapan ikan di laut dan produk laut lainnya dari laut lepas oleh kapal yang terdaftar di Negara Anggota dan berbendera Negara Anggota tersebut;,
DOC631,bn842-2019.txt,,,Pasal 25,8,,"Produk yang diproses dan/atau dibuat di kapal pengolahan hasil laut (factory ship) yang terdaftar di Negara Anggota dan berbendera Negara Anggota, hanya dari produk sebagaimana dimaksud pada huruf g;",
DOC631,bn842-2019.txt,,,Pasal 25,9,,Barang yang diambil dari luar angkasa yang diambil oleh satu Negara Anggota;,
DOC631,bn842-2019.txt,,,Pasal 25,10,,"Barang yang dikumpulkan, tidak dapat lagi berfungsi sesuai fungsinya semula, tidak dapat dipakai atau diperbaiki atau dikembalikan kepada fungsi semula dan hanya cocok untuk dibuang atau diambil bagiannya untuk dijadikan bahan baku, atau untuk tujuan daur ulang;",
DOC631,bn842-2019.txt,,,Pasal 25,11,,"Sisa dan scrap yang berasal dari: a. Proses produksi di satu Negara Anggota; atau b. Barang bekas yang dikumpulkan di satu Negara Anggota, yang hanya cocok untuk dijadikan bahan baku;",
DOC631,bn842-2019.txt,,,Pasal 25,12,,Barang yang diproduksi atau diperoleh di satu Negara Anggota hanya dari produk sebagaimana dimaksud pada huruf a sampai huruf k. **Pasal 3** Kriteria asal barang dalam kolom 4 Daftar PSR terdiri dari:,
DOC631,bn842-2019.txt,,,Pasal 25,1,,"Tunggal, yaitu suatu subpos tarif hanya memiliki 1 (satu) kriteria asal barang. Contoh: 2006.00 (RVC45);",
DOC631,bn842-2019.txt,,,Pasal 25,2,,"Alternatif, yaitu suatu subpos tarif yang memiliki lebih dari 1 (satu) kriteria asal barang yang harus dipilih salah satu. Contoh: 2008.93 (CC or RVC40);",
DOC631,bn842-2019.txt,,,Pasal 25,3,,"Kombinasi, yaitu suatu subpos tarif yang memiliki lebih dari 1 (satu) kriteria asal barang yang harus dipenuhi seluruhnya. Contoh: 1517.10 (CC provided that it has RVC 40);",
DOC631,bn842-2019.txt,,,Pasal 25,4,,"Alternatif dan kombinasi, yaitu suatu subpos tarif yang memiliki lebih dari satu kriteria asal barang, yang merupakan gabungan dari alternatif dan kombinasi. Contoh: 6101.20 (CC provided that the good is both cut and sewn in the territory of any Party; or RVC40). **Pasal 4** Ketentuan pengiriman langsung, tarif preferensi dapat diberikan apabila barang memenuhi kriteria pengiriman langsung dan barang dikirim langsung dari wilayah Negara Anggota pengekspor ke Negara Anggota pengimpor. **Pasal 5** Ketentuan penerbitan SKA Form AK meliputi:",
DOC631,bn842-2019.txt,,,Pasal 25,1,,Ukuran kertas A4 sesuai dengan bentuk dan format SKA Form AK dalam lampiran ini;,
DOC631,bn842-2019.txt,,,Pasal 25,2,,Pengisian lembar lanjutan dalam hal terdapat beberapa jenis barang pada satu SKA Form AK;,
DOC631,bn842-2019.txt,,,Pasal 25,3,,Penandatanganan SKA Form AK oleh pemohon/eksportir;,
DOC631,bn842-2019.txt,,,Pasal 25,4,,"Penerbitan SKA Form AK sebelum, pada saat, atau paling lambat 3 (tiga) hari kerja sejak Tanggal Pengapalan atau Tanggal Eksportasi. **Pasal 6** Ketentuan penelitian retroactive check dan verification visit dilaksanakan dengan ketentuan:",
DOC631,bn842-2019.txt,,,Pasal 25,1,,Permintaan retroactive check harus melampirkan copy atau pindaian SKA Form AK terkait dan mencantumkan alasan yang menyebabkan SKA Form AK diragukan;,
DOC631,bn842-2019.txt,,,Pasal 25,2,,"Keseluruhan proses retroactive check termasuk pemberitahuan kepada Instansi Penerbit SKA Form AK di Negara Anggota pengekspor. **Pasal 7** Peraturan ini mulai berlaku pada tanggal ditetapkan. [Pejabat yang menetapkan] [Posisi Pejabat] [Instansi terkait] **PERATURAN MENTERI KEUANGAN REPUBLIK INDONESIA NOMOR 842 TAHUN 2019 TENTANG TATA CARA PENGENALAN TARIF BEA MASUK ATAS BARANG IMPOR BERDASARKAN PERJANJIAN ATAU KESPEKATAN INTERNASIONAL** **DENGAN RAHMAT TUHAN YANG MAHA ESA** **MENTERI KEUANGAN REPUBLIK INDONESIA,** a. bahwa dalam rangka implementasi ASEAN-Korea Free Trade Area (AKFTA), perlu diatur tata cara pengenaan tarif bea masuk atas barang impor berdasarkan perjanjian atau kesepakatan internasional; b. bahwa untuk melaksanakan ketentuan sebagaimana dimaksud dalam huruf a, perlu menetapkan Peraturan Menteri Keuangan tentang Tata Cara Pengenaan Tarif Bea Masuk atas Barang Impor Berdasarkan Perjanjian atau Kesepakatan Internasional;",
DOC631,bn842-2019.txt,,,Pasal 25,2,,Peraturan Pemerintah Nomor 10 Tahun 2012 tentang Pengenaan Tarif Bea Masuk atas Barang Impor Berdasarkan Perjanjian atau Kesepakatan Internasional;,
DOC631,bn842-2019.txt,,,Pasal 25,3,,Peraturan Menteri Keuangan Nomor 229/PMK.04/2017 tentang Tata Cara Pengenaan Tarif Bea Masuk atas Barang Impor Berdasarkan Perjanjian atau Kesepakatan Internasional; Menetapkan: PERATURAN MENTERI KEUANGAN TENTANG TATA CARA PENGENALAN TARIF BEA MASUK ATAS BARANG IMPOR BERDASARKAN PERJANJIAN ATAU KESPEKATAN INTERNASIONAL. **Pasal 1** Ketentuan Umum Dalam Peraturan Menteri ini yang dimaksud dengan:,
DOC631,bn842-2019.txt,,,Pasal 25,1,,SKA Form AK adalah Surat Keterangan Asal Form AK yang diterbitkan oleh instansi yang berwenang di Negara Anggota untuk barang yang berasal dari Negara Anggota.,
DOC631,bn842-2019.txt,,,Pasal 25,2,,Verification Visit adalah kunjungan verifikasi yang dilakukan oleh Negara Anggota pengimpor untuk memastikan keaslian barang. **Pasal 2** Prosedur Permintaan Retroactive Check,
DOC631,bn842-2019.txt,,,Pasal 25,1,,Permintaan Retroactive Check harus diselesaikan dalam waktu 6 (enam) bulan sejak dikirimkannya Permintaan Retroactive Check.,
DOC631,bn842-2019.txt,,,Pasal 25,2,,Jawaban atas Permintaan Retroactive Check harus diterima oleh Pejabat Bea Cukai dalam jangka waktu 2 (dua) bulan sejak diterimanya Permintaan Retroactive Check.,
DOC631,bn842-2019.txt,,,Pasal 25,3,,"Permintaan Retroactive Check dalam rangka AKFTA hanya ditujukan kepada Korea Customs Service, dengan alamat: - Korea Customs Service - Government Complex Daejeon - 920 Dunsan-dong, Seo-gu, Daejeon, Korea 302-701 - Tel: +82 42 481 3221-7 - Fax: +82 42 481 7791 - Email: ft@customs.go.kr",
DOC631,bn842-2019.txt,,,Pasal 25,4,,Website untuk melakukan pengecekan SKA Form AK yaitu: - http://cert.korcham.net/search/index.htm - http://www.customs.go.kr **Pasal 3** Ketentuan Verification Visit,
DOC631,bn842-2019.txt,,,Pasal 25,1,,"Negara Anggota pengimpor harus: a. Mengirimkan pemberitahuan tertulis kepada: 1) Eksportir dan/atau produsen yang akan dikunjungi; 2) Instansi Penerbit SKA Form AK di Negara Anggota pengekspor; 3) Instansi pabean Negara Anggota pengekspor; 4) Importir barang terkait SKA Form AK yang akan diverifikasi. b. Pemberitahuan tertulis sebagaimana dimaksud pada huruf a angka 1) harus mencantumkan informasi antara lain: 1) Nama eksportir/produsen yang akan dikunjungi; 2) Rencana tanggal pelaksanaan Verification Visit; 3) Rencana ruang lingkup Verification Visit, termasuk keterangan lain yang mendukung penjelasan atas barang yang akan diverifikasi; 4) Nama dan jabatan pejabat yang melaksanakan Verification Visit. c. Memperoleh persetujuan tertulis dari eksportir/produsen. Dalam hal persetujuan tertulis tidak diperoleh dalam jangka waktu 30 (tiga puluh) hari sejak diterimanya pemberitahuan, SKA Form AK dinyatakan ditolak. d. Instansi Penerbit SKA Form AK yang menerima pemberitahuan Verification Visit dapat menunda permintaan Verification Visit dengan memberitahukan kepada Negara Anggota pengimpor dalam jangka waktu 15 (lima belas) hari sejak diterimanya pemberitahuan. Verification Visit harus dilakukan dalam jangka waktu 60 (enam puluh) hari sejak diterimanya persetujuan tertulis, atau dalam jangka waktu yang lebih lama jika Negara Anggota terkait menyetujui. e. Dalam hal barang terkait dinyatakan memenuhi ketentuan asal barang, SKA Form AK dinyatakan diterima. Penetapan diterima atau ditolaknya SKA Form AK dilakukan dalam jangka waktu maksimal 6 (enam) bulan yang dihitung sejak hari pertama Verification Visit dilakukan. **Pasal 4** Ketentuan Pengisian Pemberitahuan Pabean Impor dalam Rangka AKFTA",
DOC631,bn842-2019.txt,,,Pasal 25,1,,"Ketentuan Pengisian Pemberitahuan Impor Barang (PIB) BC 2.0 untuk tujuan pengenaan Tarif Preferensi, pada PIB diisikan kode Tarif Preferensi, nomor referensi, dan tanggal SKA Form AK sebagai berikut: a. Dalam hal PIB hanya menggunakan skema AKFTA, kode 55, nomor referensi, dan tanggal SKA Form AK wajib dicantumkan pada kolom 19 dan/atau kolom 33 PIB. b. Dalam hal PIB menggunakan skema AKFTA dan fasilitas kepabeanan, kode 55 wajib dicantumkan pada kolom 33 PIB sedangkan nomor referensi dan tanggal SKA Form AK dicantumkan pada Lembar Lampiran Dokumen dan Pemenuhan Persyaratan/Fasilitas Impor PIB.",
DOC631,bn842-2019.txt,,,Pasal 25,2,,Pengisian pada PIB untuk ditimbun di TPB dan/atau PIB dari TPB diatur tersendiri dalam Lampiran II huruf B Peraturan Menteri Keuangan Nomor 229/PMK.04/2017 tentang Tata Cara Pengenaan Tarif Bea Masuk atas Barang Impor Berdasarkan Perjanjian atau Kesepakatan Internasional.,
DOC631,bn842-2019.txt,,,Pasal 25,3,,Pengisian pada Pemberitahuan Pabean Pemasukan Barang Impor untuk ditimbun di PLB dan/atau PIB dari PLB diatur tersendiri dalam Lampiran II huruf B Peraturan Menteri Keuangan Nomor 229/PMK.04/2017 tentang Tata Cara Pengenaan Tarif Bea Masuk atas Barang Impor Berdasarkan Perjanjian atau Kesepakatan Internasional.,
DOC631,bn842-2019.txt,,,Pasal 25,4,,Pengisian pada PPFTZ-01 diatur tersendiri dalam Lampiran II huruf C Peraturan Menteri Keuangan Nomor 229/PMK.04/2017 tentang Tata Cara Pengenaan Tarif Bea Masuk atas Barang Impor Berdasarkan Perjanjian atau Kesepakatan Internasional. **Pasal 5** Ketentuan Lain Terkait Ketentuan Asal Barang,
