doc_id,nama_dokumen,bab,bagian,pasal,angka,ayat,isi,penjelasan
DOC631,bn842-2019.txt,,,Pasal 25,6,,pengisian kolom-kolom lainnya pada SKA Form P sesuai dengan Overleaf Notes;,
DOC631,bn842-2019.txt,,,Pasal 25,7,,perbaikan atau pembetulan kesalahan penulisan dalam SKA Form P dilakukan dengan mencoret (striking out) pada data yang salah dan membuat perbaikan atau pembetulan yang diperlukan;,
DOC631,bn842-2019.txt,,,Pasal 25,8,,tanda/tulisan/cap “CERTIFIED TRUE COPY” pada SKA pengganti dimuat di kolom 13. **IV. PENELITIAN RETROACTIVE CHECK DAN VERIFICATION VISIT**,
DOC631,bn842-2019.txt,,,Pasal 25,1,,"Permintaan Retroactive Check Permintaan Retroactive Check dilaksanakan dengan ketentuan: a. melampirkan copy atau hasil pindaian SKA Form P terkait dan menyatakan alasan yang menyebabkan SKA Form P diragukan kecuali dalam hal Permintaan Retroactive Check dilakukan secara acak (random) dan disertai dengan permintaan informasi, catatan, bukti atau data-data pendukung yang diperlukan untuk membuktikan keasalan barang; b. jawaban atas Permintaan Retroactive Check harus diterima dalam jangka waktu paling lama 60 (enam puluh) hari setelah diterimanya Permintaan Retroactive Check.",
DOC631,bn842-2019.txt,,,Pasal 25,2,,"Verification Visit Verification Visit dilaksanakan dengan ketentuan: a. mengirimkan permintaan secara tertulis kepada Ministry of National Economy of the State of Palestine untuk menyepakati bersama atas rencana pelaksanaan Verification Visit; b. Verification Visit harus dilakukan dalam jangka waktu 60 (enam puluh) hari setelah diterimanya permintaan tertulis; c. proses verifikasi, termasuk proses Permintaan Retroactive Check dan pelaksanaan Verification Visit, harus dilaksanakan dan hasilnya dikomunikasikan kepada Ministry of National Economy of the State of Palestine paling lama dalam jangka waktu 180 (seratus delapan puluh) hari sejak tanggal pengiriman Permintaan Retroactive Check; d. dalam hal jawaban atas Permintaan Retroactive Check atau Verification Visit tidak mencukupi dan/atau tidak diterima dalam jangka waktu sebagaimana dimaksud pada butir 1.b, butir 2.b, dan butir 2.c, maka SKA Form P dinyatakan ditolak dan Tarif Preferensi tidak dapat diberikan. **V. KETENTUAN PENGISIAN PEMBERITAHUAN PABEAN IMPOR**",
DOC631,bn842-2019.txt,,,Pasal 25,1,,"Pengisian Pemberitahuan Impor Barang BC 2.0 Untuk tujuan pengenaan Tarif Preferensi pada PIB/BC 2.0 wajib diisikan kode Tarif Preferensi, nomor referensi dan tanggal SKA Form P sebagai berikut: a. dalam hal PIB hanya menggunakan skema Memorandum Saling Pengertian antara Pemerintah Republik Indonesia dan Pemerintah Negara Palestina tentang Fasilitasi Perdagangan Produk Tertentu yang Berasal dari Wilayah Palestina, kode 62, nomor referensi, dan tanggal SKA Form P, wajib dicantumkan pada kolom 19 dan/atau kolom 33 PIB; b. dalam hal PIB menggunakan skema Memorandum Saling Pengertian antara Pemerintah Republik Indonesia dan Pemerintah Negara Palestina tentang Fasilitasi Perdagangan Produk Tertentu yang Berasal dari Wilayah Palestina dan fasilitas kepabeanan, kode 62 wajib dicantumkan pada kolom 33 PIB, sedangkan nomor referensi dan tanggal SKA Form P wajib dicantumkan pada Lembar Lampiran Dokumen Dan Pemenuhan Persyaratan/Fasilitas Impor PIB. Pengisian pada PIB untuk ditimbun di TPB dan/atau PIB dari TPB diatur tersendiri dalam Lampiran II Peraturan Menteri Keuangan Nomor 842 Tahun 2019. **PERATURAN MENTERI KEUANGAN REPUBLIK INDONESIA NOMOR 229/PMK.04/2017 TENTANG TATA CARA PENGENAAN TARIF BEA MASUK ATAS BARANG IMPOR BERDASARKAN PERJANJIAN ATAU KESEPAKATAN INTERNASIONAL** **DENGAN RAHMAT TUHAN YANG MAHA ESA** a. bahwa untuk melaksanakan ketentuan dalam peraturan perundang-undangan mengenai pengenaan tarif bea masuk atas barang impor berdasarkan perjanjian atau kesepakatan internasional, perlu diatur tata cara pengenaan tarif bea masuk tersebut; b. bahwa berdasarkan pertimbangan sebagaimana dimaksud dalam huruf a, perlu menetapkan Peraturan Menteri Keuangan tentang Tata Cara Pengenaan Tarif Bea Masuk atas Barang Impor Berdasarkan Perjanjian atau Kesepakatan Internasional;",
DOC631,bn842-2019.txt,,,Pasal 25,3,,Peraturan Pemerintah Nomor 10 Tahun 2012 tentang Pengenaan Bea Masuk atas Barang Impor Berdasarkan Perjanjian atau Kesepakatan Internasional;,
DOC631,bn842-2019.txt,,,Pasal 25,4,,"Peraturan Menteri Keuangan Nomor 229/PMK.04/2017 tentang Tata Cara Pengenaan Tarif Bea Masuk atas Barang Impor Berdasarkan Perjanjian atau Kesepakatan Internasional. Menetapkan: PERATURAN MENTERI KEUANGAN TENTANG TATA CARA PENGENAAN TARIF BEA MASUK ATAS BARANG IMPOR BERDASARKAN PERJANJIAN ATAU KESEPAKATAN INTERNASIONAL. **PASAL 1** Pengisian pada Pemberitahuan Pabean Impor untuk Ditimbun di PLB dan/atau PIB dari PLB diatur tersendiri dalam Lampiran II Peraturan Menteri Keuangan ini. **PASAL 2** Pengisian pada PPFTZ-01 diatur tersendiri dalam Lampiran II Peraturan Menteri Keuangan ini. **VI. KETENTUAN LAIN TERKAIT KRITERIA ASAL BARANG** **1. Proses dan Pengerjaan Minimal** Proses atau pengerjaan di bawah ini, baik satu proses atau dikombinasi dengan proses lain, harus dianggap sebagai proses minimal dan tidak diperhitungkan dalam penentuan originating barang, yaitu: a. pengawetan produk untuk menjaganya dalam kondisi baik untuk keperluan pengangkutan atau penyimpanan; b. perubahan kemasan, atau penguraian dan perakitan kemasan; c. pembersihan sederhana, termasuk penghilangan oksida, minyak, cat, atau pelapisan lainnya; d. pengecatan dan pemolesan sederhana; e. kalibrasi atau tes sederhana; f. pengupasan, pemutihan sebagian maupun seluruhnya, pemolesan dan pengglasiran serealia dan beras; g. penajaman, penggilingan, pengirisan atau pemotongan sederhana; h. pengemasan dalam botol, kaleng, termos, tas, koper, kotak, pemasangan pada kartu atau papan dan proses pengemasan sederhana lainnya; i. pencetakan atau pemasangan tanda, label, logo dan tanda pembeda lainnya pada produk atau kemasannya; j. pencampuran produk secara sederhana, baik yang sejenis maupun tidak; k. perakitan sederhana bagian dari produk untuk membentuk suatu produk jadi. **2. De Minimis** a. Dalam hal suatu barang jadi menggunakan kriteria asal barang CTC, bahan non-originating yang nilainya tidak melebihi 10% (sepuluh persen) nilai Ex-works barang jadinya, tidak wajib mengalami perubahan klasifikasi barang. b. Dalam hal suatu barang jadi menggunakan kriteria nilai tambah, nilai bahan non-originating sebagaimana pada huruf a harus tetap diperhitungkan. **3. Perlakuan terhadap Kemasan dan Bahan Pengemas** a. Dalam hal barang menggunakan kriteria nilai tambah, nilai pengemas dan bahan pengemas untuk penjualan eceran harus diperhitungkan dalam menilai keasalan barang jadi, dalam hal kemasan tersebut dianggap sebagai pembentuk keseluruhan barang jadi. b. Dalam hal ketentuan dalam huruf a tidak diterapkan, kemasan dan bahan pengemas tidak diperhitungkan dalam penentuan keasalan barang jadi. c. Kontainer dan bahan pengemas yang khusus digunakan untuk tujuan pengangkutan tidak diperhitungkan dalam penentuan keasalan barang jadi. **4. Aksesoris, Spare Parts, dan Peralatan** Keasalan aksesoris, spare parts, peralatan dan buku petunjuk atau informasi lainnya yang disertakan bersama dengan barang utamanya tidak diperhitungkan dalam penentuan keasalan barang, sepanjang aksesoris, spare parts, peralatan dan buku petunjuk atau informasi lainnya tersebut diklasifikasikan dan dikenakan bea masuk berdasarkan barang utama di Indonesia. **VII. BENTUK DAN FORMAT SKA FORM P**",
DOC631,bn842-2019.txt,,,Pasal 25,1,,Nama dan Alamat Eksportir,
DOC631,bn842-2019.txt,,,Pasal 25,2,,Nama dan Alamat Penerima,
DOC631,bn842-2019.txt,,,Pasal 25,3,,Nama dan Alamat Produsen,
DOC631,bn842-2019.txt,,,Pasal 25,4,,Sarana transportasi dan rute (sejauh yang diketahui),
DOC631,bn842-2019.txt,,,Pasal 25,5,,Tanggal Keberangkatan,
DOC631,bn842-2019.txt,,,Pasal 25,6,,Untuk Penggunaan Resmi Saja,
DOC631,bn842-2019.txt,,,Pasal 25,7,,Tanda dan nomor pada kemasan,
DOC631,bn842-2019.txt,,,Pasal 25,8,,Kriteria Asal,
DOC631,bn842-2019.txt,,,Pasal 25,9,,Berat Kotor,
DOC631,bn842-2019.txt,,,Pasal 25,10,,Nomor dan tanggal faktur **J. KETENTUAN ASAL BARANG DALAM RANGKA INDONESIA-CHILE COMPREHENSIVE ECONOMIC PARTNERSHIP AGREEMENT (IC-CEPA)** **I. KRITERIA ASAL BARANG**,
DOC631,bn842-2019.txt,,,Pasal 25,1,,"Kriteria asal barang dalam rangka skema IC-CEPA meliputi: a. barang yang seluruhnya diperoleh atau diproduksi di wilayah satu Negara Anggota (Wholly Obtained atau Produced); b. barang yang diproduksi di wilayah Negara Anggota yang seluruh bahan bakunya menggunakan bahan originating Negara Anggota (Produced Exclusively); c. barang yang diproduksi di wilayah Negara Anggota menggunakan bahan non-originating yang memenuhi Product Specific Rules (PSR) sebagaimana diatur dalam Annex 4-A IC-CEPA. **Wholly Obtained atau Produced** Barang-barang yang dikategorikan sebagai Wholly Obtained atau Produced adalah sebagai berikut: a. tanaman, produk tanaman, dan produk sayuran yang dipanen, dipetik, atau dikumpulkan di satu Negara Anggota; b. binatang hidup yang dilahirkan dan dibesarkan di satu Negara Anggota; c. produk yang diperoleh dari binatang hidup sebagaimana dimaksud pada huruf b; d. produk hasil perburuan, perangkap, pemancingan, budi daya air, pengumpulan atau penangkapan, dan peternakan yang dilakukan di satu Negara Anggota; e. mineral dan produk alam lainnya, tidak termasuk dalam huruf a sampai huruf d, yang diekstraksi atau diambil dari dasar laut di satu Negara Anggota; f. produk yang diambil dari perairan, dasar laut atau bawah laut di luar wilayah perairan Negara Anggota, sepanjang Negara Anggota memiliki hak untuk mengeksploitasi perairan, dasar laut, dan bawah laut tersebut sesuai dengan hukum internasional; g. produk hasil penangkapan ikan di laut, seperti ikan, kerang, dan mahluk hidup atau produk laut lainnya yang diambil dari laut lepas oleh kapal yang terdaftar di Negara Anggota dan berbendera Negara Anggota tersebut; h. produk yang diperoleh, diproses atau dibuat di kapal pengolahan hasil laut (factory ship) yang terdaftar di Negara Anggota dan berbendera Negara Anggota tersebut, hanya dari produk sebagaimana dimaksud pada huruf g; i. produk yang merupakan: 1) limbah atau sisa-sisa produksi dan konsumsi di satu Negara Anggota yang tidak dapat lagi berfungsi sesuai fungsinya semula, tidak dapat dikembalikan kepada fungsi semula atau tidak dapat diperbaiki dan hanya cocok untuk digunakan sebagai bahan baku; atau 2) barang bekas pakai yang dikumpulkan di satu Negara Anggota yang tidak dapat lagi berfungsi sesuai fungsinya semula, tidak dapat dikembalikan kepada fungsi semula atau tidak dapat diperbaiki dan hanya cocok untuk digunakan sebagai bahan baku; dan j. barang yang diperoleh atau diproduksi di wilayah satu Negara Anggota hanya dari barang sebagaimana dimaksud dalam huruf a sampai huruf i. **Produced Exclusively** Barang yang diproduksi di Negara Anggota yang seluruh bahan bakunya menggunakan bahan originating Negara Anggota. **Product Specific Rules (PSR)** PSR sebagaimana diatur dalam Annex 4-A yang mensyaratkan bahan yang digunakan mengalami perubahan klasifikasi (Change in Tariff Classification/CTC) atau suatu pabrikasi atau operasional tertentu diwajibkan hanya untuk bahan non-originating. **Kriteria asal barang yang tercantum dalam Product Specific Rules (PSR) meliputi:** a. Qualifying Value Content (QVC) sebagaimana diatur dalam daftar PSR, dapat dihitung dengan rumus: QVC = (FOB - VNM) / FOB x 100% **Keterangan:** a) QVC adalah besaran qualifying value content suatu barang yang dinyatakan dalam persentase; b) FOB adalah nilai Free-on-Board suatu barang jadi; dan c) VNM adalah nilai CIF dari bahan non-originating pada saat importasi, atau harga pasti yang pertama dibayarkan (the earliest ascertained price paid) di wilayah Negara Anggota di mana pengerjaan atau proses berlangsung untuk seluruh bahan non-originating, bagian, atau barang yang diperoleh oleh produsen untuk produksi barang. Nilai bahan-bahan tersebut tidak termasuk biaya pengangkutan, asuransi, biaya pengemasan dan biaya lainnya yang timbul dalam pengangkutan bahan dari gudang pemasok ke lokasi produsen. **Change in Tariff Classification (CTC)** sebagaimana tercantum dalam daftar PSR meliputi Change in Chapter (CC), Change in Tariff Heading (CTH) dan Change in Tariff Sub Heading (CTSH). **6. Jenis kriteria asal barang dalam daftar PSR terdiri dari:** a. tunggal, yaitu suatu pos atau subpos tarif hanya memiliki 1 (satu) kriteria asal barang. Contoh: 1501.10-1507.10 (A change to subheading 1501.10 through 1507.10 from any other chapter); b. alternatif, yaitu suatu pos atau subpos tarif memiliki lebih dari 1 (satu) kriteria asal barang yang harus dipilih salah satu. Contoh: 1507.90 (A change to subheading 1507.90 from any other subheading or no required change in tariff classification provided that there is a qualifying value content of not less than 40 percent). **I. KRITERIA PENGIRIMAN LANGSUNG**",
DOC631,bn842-2019.txt,,,Pasal 25,1,,"Hal-hal berikut dianggap memenuhi persyaratan kriteria pengiriman langsung: a. barang impor dikirim langsung tanpa melewati wilayah selain Negara Anggota; atau b. barang impor dikirim melalui negara bukan anggota dengan atau tanpa transshipment atau penyimpanan sementara di negara bukan anggota tersebut, dengan syarat barang tersebut tidak mengalami kegiatan selain bongkar muat, pemisahan, atau kegiatan lain yang diperlukan untuk menjaga agar barang tetap dalam kondisi baik. Dalam hal pengiriman barang melalui satu atau lebih negara selain Negara Anggota, wajib dibuktikan dengan dokumen: a. Copy Through Bill of Lading yang diterbitkan di Negara Anggota pengekspor, dokumen pengangkutan, dokumen pergudangan, atau dokumen komersial lain yang berkaitan; atau b. dokumen atau informasi lainnya, apabila ada, yang diberikan oleh otoritas pabean di negara bukan anggota atau entitas relevan lainnya yang membuktikan bahwa barang tidak mengalami kegiatan selain bongkar, muat, dan kegiatan lainnya untuk menjaga agar barang tetap dalam kondisi baik di negara bukan anggota tersebut. **II. KETENTUAN PROSEDURAL**",
DOC631,bn842-2019.txt,,,Pasal 25,1,,"Penelitian atas Pemenuhan Ketentuan Penerbitan Surat Keterangan Asal. Penelitian atas pemenuhan ketentuan penerbitan SKA Form IC-CEPA meliputi: a. kertas ukuran ISO Letter sesuai dengan bentuk dan format SKA Form IC-CEPA dalam lampiran ini; b. penandatanganan SKA Form IC-CEPA oleh pemohon/eksportir; c. penandatanganan SKA Form IC-CEPA dan stempel oleh Instansi Penerbit SKA Form IC-CEPA. Tanda tangan dan stempel dapat dicantumkan secara digital; d. harga pasti yang pertama dibayarkan (the earliest ascertained price paid) untuk semua bahan yang tidak dapat ditentukan keasalannya di wilayah Negara Anggota di mana pengerjaan atau proses berlangsung; e. biaya tenaga kerja langsung meliputi upah, remunerasi, dan tunjangan-tunjangan tenaga kerja lainnya yang terkait dengan proses produksi; f. perhitungan biaya overhead langsung harus meliputi, namun tidak terbatas pada aset tidak bergerak (real property item) yang terkait dengan proses produksi (asuransi, sewa dan leasing pabrik, penyusutan nilai bangunan, perbaikan dan pemeliharaan, pajak-pajak, bunga hipotik); pembayaran bunga dan sewa untuk pabrik dan perlengkapan; keamanan pabrik; asuransi (pabrik, perlengkapan dan bahan-bahan yang digunakan dalam produksi barang); utilitas (energi, listrik, air, dan utilitas lainnya yang secara langsung ditujukan untuk proses produksi barang); penelitian, pengembangan, rancangan dan rekayasa; cetakan (moulds dan dies), perkakas dan penyusutannya, pemeliharaan dan perbaikan pabrik dan perlengkapan, royalti atau lisensi (terkait dengan paten mesin atau proses yang digunakan dalam pembuatan barang atau hak untuk memproduksi barang), pemeriksaan dan pengujian bahan dan barang, penyimpanan dan penanganan di pabrik, pembuangan limbah yang dapat. **www.peraturan.go.id** **PERATURAN MENTERI KEUANGAN REPUBLIK INDONESIA NOMOR 842 TAHUN 2019 TENTANG TATA CARA PENGENALAN TARIF PREFERENSI DALAM RANGKA PERJANJIAN IC-CEPA** **DENGAN RAHMAT TUHAN YANG MAHA ESA** a. bahwa untuk meningkatkan daya saing produk dalam negeri dan memperluas akses pasar, perlu dilakukan pengenalan tarif preferensi dalam rangka perjanjian Indonesia-Chile Comprehensive Economic Partnership Agreement (IC-CEPA); b. bahwa pengenalan tarif preferensi sebagaimana dimaksud pada huruf a perlu diatur dalam suatu peraturan menteri; c. bahwa berdasarkan pertimbangan sebagaimana dimaksud pada huruf a dan huruf b, perlu menetapkan Peraturan Menteri Keuangan tentang Tata Cara Pengenalan Tarif Preferensi dalam Rangka Perjanjian IC-CEPA.",
DOC631,bn842-2019.txt,,,Pasal 25,3,,Peraturan Pemerintah Nomor 20 Tahun 2017 tentang Pengenaan Tarif Bea Masuk atas Barang Impor Berdasarkan Perjanjian atau Kesepakatan Internasional;,
DOC631,bn842-2019.txt,,,Pasal 25,4,,Peraturan Menteri Keuangan Nomor 229/PMK.04/2017 tentang Tata Cara Pengenaan Tarif Bea Masuk atas Barang Impor Berdasarkan Perjanjian atau Kesepakatan Internasional. Menetapkan: PERATURAN MENTERI KEUANGAN TENTANG TATA CARA PENGENALAN TARIF PREFERENSI DALAM RANGKA PERJANJIAN IC-CEPA. **PASAL 1**,
DOC631,bn842-2019.txt,,,Pasal 25,4,1,"Dalam peraturan ini yang dimaksud dengan: a. ""SKA"" adalah Surat Keterangan Asal; b. ""FOB"" adalah Free-on-Board; c. ""Instansi Penerbit SKA"" adalah instansi yang berwenang menerbitkan SKA; d. ""Overleaf Notes"" adalah catatan yang terdapat pada halaman belakang SKA Form IC-CEPA. **PASAL 2**",
DOC631,bn842-2019.txt,,,Pasal 25,4,1,"Penerbitan SKA Form IC-CEPA dilakukan sebagai berikut: a. penerbitan SKA Form IC-CEPA pada tanggal eksportasi atau paling lambat 3 (tiga) hari sejak tanggal pengapalan atau tanggal eksportasi; b. pemberian tanda/stempel/tulisan “ISSUED RETROACTIVELY” pada SKA Form IC-CEPA dalam hal SKA Form IC-CEPA diterbitkan lebih dari 3 (tiga) hari namun tidak lebih dari 1 (satu) tahun terhitung sejak tanggal pengapalan atau tanggal eksportasi; c. pengisian kolom-kolom lainnya pada SKA Form IC-CEPA sesuai Overleaf Notes; d. dalam hal terdapat kesalahan pengisian pada SKA Form IC-CEPA, maka: 1) diterbitkan SKA Form IC-CEPA baru, atau 2) dilakukan perbaikan atau pembetulan kesalahan dalam SKA Form IC-CEPA dengan mencoret data yang salah dan membuat perbaikan atau pembetulan yang diperlukan; e. tanda/tulisan/cap “CERTIFIED COPY” pada SKA Form IC-CEPA pengganti dimuat di kolom 11; dan f. dalam hal Overleaf Notes tidak dicetak dan/atau tidak disampaikan, maka SKA Form IC-CEPA tetap berlaku. **PASAL 3**",
DOC631,bn842-2019.txt,,,Pasal 25,4,1,Penelitian SKA Back-to-Back tidak berlaku untuk skema IC-CEPA. **PASAL 4**,
DOC631,bn842-2019.txt,,,Pasal 25,4,1,"Penelitian penggunaan Third Country Invoicing meliputi: a. nomor invoice pihak ketiga atau nomor invoice asal barang harus dicantumkan pada kolom 10 SKA Form IC-CEPA; dan b. dalam hal invoice pihak ketiga diterbitkan di negara yang berbeda dengan negara tempat diterbitkannya SKA Form IC-CEPA, tanda/tulisan/cap “THIRD COUNTRY INVOICING”, serta nama perusahaan dan negara yang menerbitkan invoice pihak ketiga (jika diketahui) dicantumkan pada kolom 11 SKA Form IC-CEPA. **PASAL 5**",
DOC631,bn842-2019.txt,,,Pasal 25,4,1,"Permintaan Retroactive Check dilaksanakan dengan ketentuan: a. ditujukan kepada Instansi Penerbit SKA dengan melampirkan copy atau pindaian SKA Form IC-CEPA terkait dan mencantumkan alasan yang menyebabkan SKA Form IC-CEPA diragukan disertai dengan permintaan informasi, catatan, bukti atau data-data pendukung yang diperlukan untuk membuktikan keasalan barang; b. jawaban atas Permintaan Retroactive Check harus diterima oleh Pejabat Bea dan Cukai dalam jangka waktu paling lama 3 (tiga) bulan sejak tanggal diterimanya Permintaan Retroactive Check, dengan mempertimbangkan prosedur penetapan tarif bea masuk oleh Direktur Jenderal Bea dan Cukai sesuai Undang-Undang Kepabeanan; c. apabila terdapat permintaan informasi tambahan, Instansi Penerbit SKA Form IC-CEPA, sesuai dengan peraturan perundang-undangan di negaranya, harus memberikan informasi yang diminta dalam jangka waktu paling lama 2 (dua) bulan terhitung sejak tanggal diterimanya permintaan informasi tambahan; d. dalam hal Instansi Penerbit SKA Form IC-CEPA gagal untuk merespon Permintaan Retroactive Check dalam jangka waktu sebagaimana dimaksud pada huruf b dan huruf c atau jawaban yang diterima tidak mencukupi untuk membuktikan pemenuhan Ketentuan Asal Barang atau keabsahan SKA Form IC-CEPA, SKA Form IC-CEPA ditolak dan Tarif Preferensi tidak diberikan. **PASAL 6**",
DOC631,bn842-2019.txt,,,Pasal 25,4,1,"Verification Visit dilaksanakan dengan ketentuan: a. mengirimkan permintaan Verification Visit secara tertulis kepada Instansi Penerbit SKA di Negara Anggota Pengekspor paling lambat 40 (empat puluh) hari sebelum rencana tanggal Verification Visit; b. permintaan sebagaimana dimaksud pada huruf a harus memuat informasi: 1) nama instansi pabean yang membuat permintaan; 2) nama eksportir/produsen barang yang akan dikunjungi; 3) rencana tanggal dan tempat pelaksanaan Verification Visit; 4) tujuan dan ruang lingkup Verification Visit, termasuk referensi khusus terkait barang yang akan diverifikasi; dan 5) nama dan jabatan Pejabat Bea dan Cukai yang akan melaksanakan Verification Visit. c. jawaban atas permintaan Verification Visit harus diterima oleh Pejabat Bea dan Cukai dalam jangka waktu paling lama 30 (tiga puluh) hari terhitung sejak tanggal diterimanya permintaan Verification Visit; d. Instansi Penerbit SKA Form IC-CEPA di Negara Anggota pengekspor, sesuai dengan ketentuan dalam negerinya, wajib memberikan data/informasi tambahan yang diminta dalam jangka waktu paling lama 45 (empat puluh lima) hari atau jangka waktu lain yang disepakati bersama sejak hari terakhir pelaksanaan Verification Visit; e. dalam hal Instansi Penerbit SKA Form IC-CEPA gagal untuk merespon Permintaan Verification Visit dalam jangka waktu sebagaimana dimaksud pada huruf c dan huruf d atau informasi terkait keasalan barang tidak mencukupi untuk membuktikan pemenuhan Ketentuan Asal Barang, SKA Form IC-CEPA ditolak dan Tarif Preferensi tidak diberikan. **PASAL 7**",
DOC631,bn842-2019.txt,,,Pasal 25,4,1,"Pengisian Pemberitahuan Impor Barang BC 2.0 untuk tujuan pengenaan Tarif Preferensi pada PIB wajib diisikan kode Tarif Preferensi, nomor referensi dan tanggal SKA Form IC-CEPA sebagai berikut: a. dalam hal PIB hanya menggunakan skema IC-CEPA, kode 63, nomor referensi, dan tanggal SKA Form IC-CEPA wajib dicantumkan pada kolom 19 dan/atau kolom 33 PIB; b. dalam hal PIB menggunakan skema IC-CEPA dan fasilitas kepabeanan, kode 63 wajib dicantumkan pada kolom 33 PIB, sedangkan nomor referensi dan tanggal SKA Form IC-CEPA wajib dicantumkan pada Lembar Lampiran Dokumen dan Pemenuhan Persyaratan/Fasilitas Impor PIB. **PASAL 8**",
DOC631,bn842-2019.txt,,,Pasal 25,4,1,"Ketentuan lain terkait kriteria asal barang meliputi: a. Akumulasi: Bahan originating dari negara anggota yang digunakan sebagai bahan baku untuk memproduksi barang jadi di negara anggota lain, dianggap sebagai bahan originating negara anggota tempat dilakukan proses produksi; b. De Minimis: Suatu barang yang tidak mengalami perubahan klasifikasi pos tarif harus dianggap originating dalam hal: 1) untuk barang selain yang diatur dalam HS Bab 50 sampai Bab 63, nilai semua bahan non-originating yang digunakan dalam produksi yang tidak mengalami perubahan klasifikasi pos tarif yang dipersyaratkan tidak melebihi 10% (sepuluh persen) dari total FOB barang; 2) untuk barang yang diatur dalam HS Bab 50 sampai Bab 63, berat semua bahan non-originating yang digunakan dalam produksi yang tidak mengalami perubahan klasifikasi pos tarif yang dipersyaratkan tidak melebihi 10% (sepuluh persen) dari total berat barang. **PASAL 9**",
DOC631,bn842-2019.txt,,,Pasal 25,4,1,"Proses dan pengerjaan minimal yang tidak diperhitungkan dalam penentuan originating barang meliputi: a. proses untuk memastikan barang dalam kondisi baik selama pengangkutan dan penyimpanan (misalnya pengeringan, pembekuan, penyimpanan dalam air asin) dan proses sejenis lainnya; b. penyaringan, pemilahan, pencucian, pemotongan, pembelahan, pembengkokan, pengaitan atau pencopotan, peruncingan, penggilingan, pengirisan; c. pembersihan, termasuk penghilangan oksida, minyak, cat, atau pelapis lainnya; d. proses pengecatan dan pemolesan; e. pengujian atau kalibrasi; f. pengemasan dalam botol, kaleng, termos, tas, koper, kotak, pemasangan pada kartu atau papan dan proses pengemasan sederhana lainnya; g. pencampuran produk secara sederhana, baik dari jenis yang berbeda maupun tidak; h. perakitan sederhana bagian untuk menjadi barang jadi atau penguraian produk menjadi bagian-bagiannya; i. perubahan pengemas, pembongkaran atau pengemasan ulang, serta pengiriman sebagian dan konsolidasi pengiriman; j. pembubuhan atau pencetakan tanda, label, logo, dan tanda pembeda lainnya pada barang atau kemasannya; k. pengupasan, pemucatan total maupun parsial, pemolesan, dan pengglasiran serealia dan beras; dan l. pelarutan sederhana dengan air atau senyawa lainnya tanpa mengubah karakteristik barang. **PASAL 10**",
DOC631,bn842-2019.txt,,,Pasal 25,4,1,Dalam rangka penentuan apakah barang dan bahan baku identik dan dapat dipertukarkan merupakan bahan originating harus dilakukan dengan cara pemisahan fisik atau melalui metode manajemen persediaan berdasarkan standar akuntansi yang berlaku di negara anggota tersebut; metode manajemen persediaan yang dipilih oleh eksportir wajib digunakan setidaknya selama 1 (satu) tahun. **PASAL 11**,
