doc_id,nama_dokumen,bab,bagian,pasal,angka,ayat,isi,penjelasan
DOC632,bn848-2013.txt,,,,1,,"Hewan adalah binatang atau satwa yang seluruh atau sebagian dari siklus hidupnya berada di darat, air, dan/atau udara, baik yang dipelihara maupun yang di habitatnya.",
DOC632,bn848-2013.txt,,,,2,,Bibit hewan yang selanjutnya disebut bibit adalah hewan yang mempunyai sifat unggul dan mewariskan serta memenuhi persyaratan tertentu untuk dikembangkan.,
DOC632,bn848-2013.txt,,,,3,,"Benih hewan yang selanjutnya disebut benih adalah bahan reproduksi hewan yang dapat berupa semen, sperma, oval, telur tertunas, dan embrio.",
DOC632,bn848-2013.txt,,,,4,,Bakalan hewan yang selanjutnya disebut bakalan adalah hewan bukan bibit yang mempunyai sifat unggul untuk dipelihara guna tujuan produksi.,
DOC632,bn848-2013.txt,,,,5,,"Produk Hewan adalah semua bahan yang berasal dari hewan yang masih segar dan/atau telah diolah atau diproses untuk keperluan konsumsi, farmakoseutika, pertanian, dan/atau kegunaan lain bagi pemenuhan kebutuhan dan kemaslahatan manusia.",
DOC632,bn848-2013.txt,,,,6,,Zoonosis adalah penyakit yang dapat menular dari hewan kepada manusia atau sebaliknya.,
DOC632,bn848-2013.txt,,,,7,,Impor adalah kegiatan memasukkan barang ke dalam Daerah Pabean.,
DOC632,bn848-2013.txt,,,,8,,Ekspor adalah kegiatan mengeluarkan barang dari Daerah Pabean.,
DOC632,bn848-2013.txt,,,,9,,"Importir Terdaftar Hewan dan Produk Hewan, yang selanjutnya disebut IT-Hewan dan Produk Hewan, adalah perusahaan yang melakukan impor Hewan dan/atau Produk Hewan untuk keperluan kegiatan usaha dengan memperdagangkan atau memindahtangankan kepada pihak lain.",
DOC632,bn848-2013.txt,,,,10,,"Label adalah setiap keterangan mengenai Produk Hewan yang berbentuk gambar, tulisan, kombinasi keduanya, atau bentuk lain yang memuat informasi tentang produk dan keterangan pelaku usaha serta informasi lainnya sesuai dengan ketentuan peraturan perundang-undangan yang berlaku, yang disertakan pada produk, dimasukkan ke dalam, ditempelkan pada, atau merupakan bagian kemasan.",
DOC632,bn848-2013.txt,,,,11,,Logo Tara Pangan adalah penandaan yang menunjukkan bahwa suatu kemasan pangan aman digunakan untuk pangan.,
DOC632,bn848-2013.txt,,,,12,,Kode Daur Ulang adalah penandaan yang menunjukkan bahwa suatu kemasan pangan dapat didaur ulang.,
DOC632,bn848-2013.txt,,,,13,,"Kemasan adalah bahan yang digunakan untuk mewadahi dan/atau membungkus Produk Hewan, baik yang bersentuhan langsung maupun tidak.",
DOC632,bn848-2013.txt,,,,14,,Persetujuan Impor adalah izin impor Hewan dan/atau Produk Hewan.,
DOC632,bn848-2013.txt,,,,15,,Persetujuan Ekspor adalah izin ekspor Hewan dan/atau Produk Hewan.,
DOC632,bn848-2013.txt,,,,16,,Rekomendasi adalah surat keterangan yang diterbitkan oleh pejabat instansi/unit teknis terkait yang berwenang dan merupakan persyaratan diterbitkannya persetujuan impor dan persetujuan ekspor.,
DOC632,bn848-2013.txt,,,,17,,Verifikasi atau penelusuran teknis adalah kegiatan pemeriksaan teknis atas produk impor yang dilakukan oleh surveyor.,
DOC632,bn848-2013.txt,,,,18,,Surveyor adalah perusahaan survey yang mendapat otorisasi untuk melakukan verifikasi atau penelusuran teknis produk impor.,
DOC632,bn848-2013.txt,,,,19,,"Badan Usaha Milik Negara, yang selanjutnya disingkat BUMN adalah Perusahaan Umum Badan Urusan Logistik.",
DOC632,bn848-2013.txt,,,,20,,Menteri adalah menteri yang menyelenggarakan urusan pemerintahan di bidang perdagangan.,
DOC632,bn848-2013.txt,,,,21,,"Direktur Jenderal adalah Direktur Jenderal Perdagangan Luar Negeri, Kementerian Perdagangan.",
DOC632,bn848-2013.txt,,,,22,,"Unit Pelayanan Perdagangan, yang selanjutnya disingkat UPP adalah unit yang menyelenggarakan pelayanan perizinan di sektor perdagangan.",
DOC632,bn848-2013.txt,,,,23,,Koordinator dan Pelaksana UPP adalah pejabat yang ditunjuk oleh Sekretaris Jenderal Kementerian Perdagangan untuk mengoordinasikan dan melaksanakan penyelenggaraan pelayanan perizinan kepada UPP.,
DOC632,bn848-2013.txt,,,,24,,"Tim Penilai adalah tim yang terdiri dari pejabat Kementerian Perdagangan dan pejabat instansi teknis terkait. **Pasal 2** Benih, bibit, dan/atau bakalan dalam Peraturan Menteri ini dikelompokkan ke dalam kategori hewan. Jenis hewan dan produk hewan yang dapat diimpor sebagaimana tercantum dalam Lampiran I dan Lampiran II yang merupakan bagian tidak terpisahkan dari Peraturan Menteri ini. Jenis hewan dan produk hewan yang diatur ekspornya sebagaimana tercantum dalam Lampiran III yang merupakan bagian tidak terpisahkan dari Peraturan Menteri ini. **Pasal 3** Impor hewan sebagaimana dimaksud dalam Pasal 2 ayat (2) dapat dilakukan untuk:",
DOC632,bn848-2013.txt,,,,1,,Meningkatkan mutu dan keragaman genetik;,
DOC632,bn848-2013.txt,,,,2,,Mengembangkan ilmu pengetahuan dan teknologi;,
DOC632,bn848-2013.txt,,,,3,,"Mengatasi kekurangan benih, bibit, dan/atau bakalan/ternak potong di dalam negeri; dan/atau",
DOC632,bn848-2013.txt,,,,4,,"Memenuhi keperluan penelitian dan pengembangan. Ekspor hewan sebagaimana dimaksud dalam Pasal 2 ayat (3) hanya dapat dilakukan apabila kebutuhan benih, bibit, dan/atau bakalan dalam negeri telah terpenuhi dan kelestarian ternak lokal terjamin. **Pasal 4** Impor hewan dan produk hewan sebagaimana tercantum dalam Lampiran I Peraturan Menteri ini hanya dapat dilakukan oleh perusahaan yang telah mendapatkan penetapan sebagai IT-Hewan dan Produk Hewan dari Menteri. Menteri mendelegasikan kewenangan penerbitan penetapan sebagai IT-Hewan dan Produk Hewan sebagaimana dimaksud pada ayat (1) kepada Koordinator dan Pelaksana UPP. **Pasal 5** Untuk memperoleh penetapan sebagai IT-Hewan dan Produk Hewan sebagaimana dimaksud dalam Pasal 4, perusahaan harus mengajukan permohonan secara elektronik kepada Koordinator dan Pelaksana UPP, dengan melampirkan: a. Akte Pendirian Perusahaan; b. Surat Izin Usaha Perdagangan (SIUP) atau Surat Izin Usaha di bidang peternakan dan kesehatan hewan; c. Tanda Daftar Perusahaan (TDP); d. Nomor Pokok Wajib Pajak (NPWP); e. Angka Pengenal Importir (API); dan f. Bukti kepemilikan tempat pemeliharaan dan bukti kepemilikan Rumah Potong Hewan atau kontrak kerja dengan Rumah Potong Hewan yang telah memenuhi standar berdasarkan ketentuan peraturan perundang-undangan, untuk bakalan; atau g. Bukti kepemilikan tempat penyimpanan berpendingin (cold storage) dan bukti kepemilikan alat transportasi berpendingin, untuk produk hewan. Permohonan yang diterima harus segera diperiksa oleh Koordinator dan Pelaksana UPP untuk mengetahui kelengkapan data yang disampaikan. a. Dalam hal data sebagaimana dimaksud pada ayat (1) sudah lengkap, data disampaikan kepada Tim Penilai untuk dilakukan pemeriksaan terhadap kebenaran dokumen dan pemeriksaan lapangan. b. Pemeriksaan sebagaimana dimaksud pada ayat (3) dilakukan paling lambat dimulai 3 (tiga) hari kerja terhitung sejak permohonan diterima secara lengkap dan dilaksanakan paling lama 3 (tiga) hari kerja. c. Dalam hal hasil atas pemeriksaan sebagaimana dimaksud pada ayat (3) ditemukan data yang tidak benar, Koordinator dan Pelaksana UPP menolak menerbitkan penetapan sebagai IT-Hewan dan Produk Hewan. d. Dalam hal hasil atas pemeriksaan sebagaimana dimaksud pada ayat (3) data yang diajukan benar, Koordinator dan Pelaksana UPP menerbitkan penetapan sebagai IT-Hewan dan Produk Hewan paling lambat 2 (dua) hari kerja setelah hasil pemeriksaan sebagaimana dimaksud pada ayat (4). **Pasal 6** Penetapan sebagai IT-Hewan dan Produk Hewan sebagaimana dimaksud dalam Pasal 5 ayat (6) berlaku selama 2 (dua) tahun terhitung sejak tanggal diterbitkan dan dapat diperpanjang. **Pasal 7** Tim Penilai sebagaimana dimaksud dalam Pasal 5 ayat (3) ditetapkan oleh Direktur Jenderal dan terdiri dari pejabat Kementerian Perdagangan dan pejabat instansi teknis terkait. **Pasal 8**",
DOC632,bn848-2013.txt,,,,4,1,IT-Hewan dan Produk Hewan yang akan melakukan impor hewan dan/atau produk hewan sebagaimana dimaksud dalam Pasal 4 ayat (1) harus mendapatkan persetujuan impor dari Menteri.,
DOC632,bn848-2013.txt,,,,4,2,Menteri mendelegasikan kewenangan penerbitan persetujuan impor sebagaimana dimaksud pada ayat (1) kepada Koordinator dan Pelaksana UPP. **Pasal 9**,
DOC632,bn848-2013.txt,,,,4,1,Impor hewan dan produk hewan sebagaimana tercantum dalam Lampiran II Peraturan Menteri ini hanya dapat dilakukan oleh perusahaan yang telah mendapatkan persetujuan impor dari Menteri.,
DOC632,bn848-2013.txt,,,,4,2,"Menteri mendelegasikan kewenangan penerbitan persetujuan impor sebagaimana dimaksud pada ayat (1) kepada Koordinator dan Pelaksana UPP. **Pasal 10** Persetujuan impor sebagaimana dimaksud dalam Pasal 8 dan Pasal 9 diterbitkan setelah IT-Hewan dan Produk Hewan serta perusahaan yang akan melakukan impor hewan dan/atau produk hewan memenuhi ketentuan yang berlaku. **PERATURAN MENTERI PERTANIAN REPUBLIK INDONESIA NOMOR 848 TAHUN 2013 TENTANG IMPOR HEWAN DAN PRODUK HEWAN** DENGAN RAHMAT TUHAN YANG MAHA ESA a. bahwa untuk melaksanakan ketentuan dalam Undang-Undang Nomor 18 Tahun 2009 tentang Peternakan dan Kesehatan Hewan, perlu mengatur ketentuan mengenai impor Hewan dan Produk Hewan; b. bahwa untuk melaksanakan ketentuan sebagaimana dimaksud dalam huruf a, perlu ditetapkan Peraturan Menteri Pertanian tentang Impor Hewan dan Produk Hewan; c. bahwa berdasarkan pertimbangan sebagaimana dimaksud dalam huruf a dan huruf b, perlu menetapkan Peraturan Menteri Pertanian tentang Impor Hewan dan Produk Hewan.",
DOC632,bn848-2013.txt,,,,1,,Undang-Undang Nomor 18 Tahun 2009 tentang Peternakan dan Kesehatan Hewan;,
DOC632,bn848-2013.txt,,,,2,,Peraturan Pemerintah Nomor 82 Tahun 2000 tentang Kesehatan Hewan;,
DOC632,bn848-2013.txt,,,,3,,Peraturan Menteri Pertanian Nomor 26 Tahun 2012 tentang Penetapan Importir Terdaftar Hewan dan Produk Hewan. Menetapkan: PERATURAN MENTERI PERTANIAN TENTANG IMPOR HEWAN DAN PRODUK HEWAN. **Pasal 11**,
DOC632,bn848-2013.txt,,,,3,1,"Untuk mendapatkan Persetujuan Impor sebagaimana dimaksud dalam Pasal 8 dan Pasal 9, IT-Hewan dan Produk Hewan atau perusahaan yang akan melakukan impor Hewan dan/atau Produk Hewan harus mengajukan permohonan secara elektronik kepada Koordinator dan Pelaksana UPP dengan melampirkan: a. Penetapan sebagai IT-Hewan dan Produk Hewan untuk Hewan dan Produk Hewan sebagaimana tercantum dalam Lampiran I Peraturan Menteri ini; b. rekomendasi dari Menteri Pertanian atau pejabat yang ditunjuk oleh Menteri Pertanian, untuk impor Hewan dan Produk Hewan segar sebagaimana tercantum dalam Lampiran I dan Lampiran II Peraturan Menteri ini; atau c. rekomendasi dari Kepala Badan Pengawas Obat dan Makanan atau pejabat yang ditunjuk oleh Kepala Badan Pengawas Obat dan Makanan untuk impor Produk Hewan olahan dan rekomendasi dari Menteri Pertanian atau pejabat yang ditunjuk oleh Menteri Pertanian untuk impor Produk Hewan olahan yang masih mempunyai risiko penyebaran zoonosis sebagaimana tercantum dalam Lampiran II Peraturan Menteri ini.",
DOC632,bn848-2013.txt,,,,3,2,Koordinator dan Pelaksana UPP atas nama Menteri menerbitkan: a. Persetujuan Impor paling lama 2 (dua) hari kerja sejak permohonan diterima secara lengkap dan benar; atau b. penolakan penerbitan Persetujuan Impor paling lama 2 (dua) hari kerja sejak permohonan diterima dalam hal permohonan tidak lengkap dan/atau tidak benar.,
DOC632,bn848-2013.txt,,,,3,3,Persetujuan Impor sebagaimana dimaksud pada ayat (2) huruf a disampaikan kepada IT-Hewan dan Produk Hewan serta perusahaan dan tembusan disampaikan kepada instansi terkait. **Pasal 12** Persetujuan Impor sebagaimana dimaksud dalam Pasal 11 ayat (2) huruf a berlaku 1 (satu) tahun terhitung sejak tanggal diterbitkannya Persetujuan Impor. **Pasal 13**,
DOC632,bn848-2013.txt,,,,3,1,Certificate of Health di negara asal Hewan dan/atau Produk Hewan yang akan diimpor diterbitkan setelah IT-Hewan dan Produk Hewan memiliki Persetujuan Impor.,
DOC632,bn848-2013.txt,,,,3,2,Nomor Persetujuan Impor dicantumkan dalam Certificate of Health sebagaimana dimaksud pada ayat (1). **Pasal 14**,
DOC632,bn848-2013.txt,,,,3,1,Penetapan sebagai IT-Hewan dan Produk Hewan dan Persetujuan Impor diteruskan secara online ke portal Indonesia National Single Window (INSW).,
DOC632,bn848-2013.txt,,,,3,2,"Dalam hal impor Hewan dan Produk Hewan melalui pelabuhan yang belum terkoneksi dengan Indonesia National Single Window (INSW), tembusan penetapan sebagai IT-Hewan dan Produk Hewan dan Persetujuan Impor disampaikan kepada instansi terkait. **Pasal 15** Karkas, daging, dan/atau jeroan sebagaimana tercantum dalam Lampiran I Peraturan Menteri ini hanya dapat diimpor untuk tujuan penggunaan dan distribusi bagi industri, hotel, restoran, katering, dan/atau keperluan khusus lainnya. **Pasal 16**",
DOC632,bn848-2013.txt,,,,3,1,Pemerintah dapat menunjuk BUMN untuk melakukan impor Hewan dan Produk Hewan dalam rangka menjaga ketahanan pangan.,
DOC632,bn848-2013.txt,,,,3,2,BUMN hanya dapat mengimpor Hewan dan Produk Hewan sebagaimana tercantum dalam Lampiran I Peraturan Menteri ini untuk didistribusikan ke pasar ritel.,
DOC632,bn848-2013.txt,,,,3,3,"Impor Hewan dan Produk Hewan oleh BUMN sebagaimana dimaksud pada ayat (2) harus mendapat Persetujuan Impor dengan melampirkan rekomendasi sebagaimana dimaksud dalam Pasal 11 ayat (1) huruf b dan dikecualikan dari ketentuan mendapatkan penetapan sebagai IT-Hewan dan Produk Hewan. **Pasal 17** Impor daging potongan primer (prime cuts) segar dingin sebagaimana tercantum dalam Lampiran I Peraturan Menteri ini hanya dapat dilakukan melalui Bandar Udara Soekarno-Hatta Jakarta, Bandar Udara Ngurah Rai Denpasar, dan Bandar Udara Polonia Medan. **Pasal 18**",
DOC632,bn848-2013.txt,,,,3,1,Produk Hewan yang diimpor wajib mencantumkan label di dalam dan/atau pada kemasan pada saat memasuki wilayah Negara Kesatuan Republik Indonesia.,
DOC632,bn848-2013.txt,,,,3,2,"Pencantuman label di dalam dan/atau pada kemasan sebagaimana dimaksud pada ayat (1) harus dilakukan dengan cara ditulis atau dicetak dengan menggunakan bahasa Indonesia yang jelas dan mudah dimengerti serta memuat paling sedikit keterangan mengenai: a. nama produk; b. daftar bahan yang digunakan; c. berat bersih atau isi bersih; d. nama dan alamat pihak yang memproduksi atau mengimpor; e. kehalalan bagi yang dipersyaratkan; f. tanggal dan kode produksi; g. tanggal, bulan, dan tahun kedaluwarsa; h. nomor izin edar bagi pangan olahan; dan i. asal usul bahan pangan tertentu. Penggunaan bahasa, selain Bahasa Indonesia, angka arab, huruf latin diperbolehkan jika tidak ada padanannya. **Pasal 19** Produk Hewan yang diimpor harus memenuhi persyaratan kemasan: a. Kemasan yang bersentuhan langsung dengan pangan harus menggunakan bahan yang diijinkan untuk pangan sesuai ketentuan peraturan perundang-undangan; b. Kemasan yang menggunakan plastik wajib mencantumkan Logo Tara Pangan dan Kode Daur Ulang sesuai ketentuan peraturan perundang-undangan; atau c. Kemasan yang menggunakan kayu wajib dikeringkan, dan diberi tanda sesuai ketentuan peraturan perundang-undangan. Pemenuhan persyaratan kemasan sebagaimana dimaksud pada ayat (1) harus dibuktikan dengan: a. sertifikat hasil uji yang diterbitkan oleh laboratorium uji yang kompeten dan diakui pemerintah setempat; atau b. surat pernyataan dari importir yang menyatakan bahwa kemasan yang digunakan telah sesuai dengan ketentuan peraturan perundang-undangan dengan mencantumkan kode daur ulang dan tara pangan pada kemasan. **Pasal 20** Setiap pelaksanaan impor daging potongan primer (prime cuts) segar dingin sebagaimana tercantum dalam Lampiran I Peraturan Menteri ini harus terlebih dahulu dilakukan verifikasi atau penelusuran teknis impor di pelabuhan muat negara asal. Pelaksanaan verifikasi atau penelusuran teknis sebagaimana dimaksud pada ayat (1) dilakukan oleh Surveyor yang ditetapkan oleh Menteri. Untuk dapat ditetapkan sebagai pelaksana verifikasi atau penelusuran teknis impor daging potongan primer (prime cuts) segar dingin sebagaimana dimaksud pada ayat (2), Surveyor harus memenuhi persyaratan sebagai berikut: a. memiliki Surat Izin Usaha Jasa Survey (SIUJS); b. berpengalaman sebagai surveyor minimal 5 (lima) tahun; c. memiliki cabang atau perwakilan dan/atau afiliasi di luar negeri dan memiliki jaringan untuk mendukung efektifitas pelayanan verifikasi atau penelusuran teknis; dan d. mempunyai rekam jejak (track records) di bidang pengelolaan kegiatan verifikasi atau penelusuran teknis impor. **Pasal 21** Verifikasi atau penelusuran teknis impor daging potongan primer (prime cuts) segar dingin sebagaimana dimaksud dalam Pasal 20 ayat (1), meliputi data atau keterangan mengenai: a. Negara dan pelabuhan asal muat; b. Pos tarif atau nomor HS dan uraian produk; c. Jenis dan volume; d. Waktu pengapalan; e. Pelabuhan tujuan; f. Certificate of Health; g. Kehalalan produk bagi yang dipersyaratkan; h. Kesesuaian antara harga pasar yang berlaku saat pembelian dengan harga yang tercantum pada invoice; dan i. Kesesuaian karakteristik daging dengan sertifikasinya. Hasil verifikasi atau penelusuran teknis sebagaimana dimaksud pada ayat (1) dituangkan dalam bentuk Laporan Surveyor (LS) untuk digunakan sebagai dokumen pelengkap pabean dalam penyelesaian kepabeanan di bidang impor. Atas pelaksanaan verifikasi atau penelusuran teknis sebagaimana dimaksud pada ayat (1), Surveyor memungut imbalan jasa dari IT-Hewan dan Produk Hewan yang besarannya ditentukan dengan memperhatikan azas manfaat. **Pasal 22** Kegiatan verifikasi atau penelusuran teknis impor daging potongan primer (prime cuts) segar dingin oleh Surveyor tidak mengurangi kewenangan Direktorat Jenderal Bea dan Cukai, Kementerian Keuangan untuk melakukan pemeriksaan pabean. **Pasal 23** Dalam hal di negara asal impor Hewan dan/atau Produk Hewan terjadi risiko penyebaran zoonosis dan dinyatakan dilarang diimpor berdasarkan Keputusan Menteri Pertanian, maka Persetujuan Impor yang telah diterbitkan dinyatakan tidak berlaku. **Pasal 24** Ekspor Hewan dan/atau Produk Hewan sebagaimana dimaksud dalam Pasal 2 ayat (3) hanya dapat dilakukan oleh perusahaan yang telah mendapat Persetujuan Ekspor dari Menteri. Menteri mendelegasikan kewenangan penerbitan Persetujuan Ekspor sebagaimana dimaksud pada ayat (1) kepada Koordinator dan Pelaksana UPP untuk dan atas nama Menteri. **Pasal 25** Untuk mendapatkan Persetujuan Ekspor sebagaimana dimaksud dalam Pasal 24, perusahaan harus mengajukan permohonan secara elektronik kepada Koordinator dan Pelaksana UPP dengan melampirkan: a. Surat Izin Usaha Perdagangan (SIUP) atau Surat Ijin Usaha di bidang peternakan dan kesehatan hewan; b. Tanda Daftar Perusahaan (TDP); c. Nomor Pokok Wajib Pajak (NPWP); dan d. rekomendasi dari Menteri Pertanian atau pejabat yang ditunjuk oleh Menteri Pertanian. Koordinator dan Pelaksana UPP atas nama Menteri menerbitkan: a. Persetujuan Ekspor paling lama 2 (dua) hari kerja sejak permohonan diterima secara lengkap dan benar; atau b. penolakan penerbitan Persetujuan Ekspor paling lama 2 (dua) hari kerja sejak permohonan diterima dalam hal permohonan tidak lengkap dan/atau tidak benar. Persetujuan Ekspor sebagaimana dimaksud pada ayat (2) huruf a disampaikan kepada perusahaan yang bersangkutan dan tembusan disampaikan kepada instansi terkait. **Pasal 26** Pengajuan permohonan untuk memperoleh: a. penetapan sebagai IT-Hewan dan Produk Hewan sebagaimana dimaksud dalam Pasal 5; b. Persetujuan Impor sebagaimana dimaksud dalam Pasal 11; dan c. Persetujuan Ekspor sebagaimana dimaksud dalam Pasal 25, hanya dapat dilayani dengan sistem elektronik melalui INATRADE.",
DOC632,bn848-2013.txt,,,,3,2,"Dalam hal terjadi keadaan yang mengakibatkan sistem elektronik melalui INATRADE tidak berfungsi, pengajuan permohonan sebagaimana dimaksud pada ayat (1) disampaikan secara manual. **Pasal 27**",
DOC632,bn848-2013.txt,,,,3,1,"IT-Hewan dan Produk Hewan atau perusahaan yang telah mendapat Persetujuan Impor dan perusahaan yang telah mendapatkan Persetujuan Ekspor wajib: a. menyampaikan laporan secara tertulis atas pelaksanaan impor Hewan dan/atau Produk Hewan, atau pelaksanaan ekspor Hewan dan/atau Produk Hewan melalui http://inatrade.kemendag.go.id dengan bentuk laporan sebagaimana tercantum dalam Lampiran IV yang merupakan bagian tidak terpisahkan dari Peraturan Menteri ini; dan b. melampirkan fotokopi Kartu Kendali Realisasi Impor atau Ekspor yang telah diparaf dan dicap oleh petugas Bea dan Cukai.",
DOC632,bn848-2013.txt,,,,3,2,"Laporan sebagaimana dimaksud pada ayat (1) disampaikan setiap bulan paling lama tanggal 15 (lima belas) bulan berikutnya kepada Direktur Jenderal dengan tembusan kepada: a. Kepala Badan Pengawas Obat dan Makanan; dan b. Direktur Jenderal Peternakan dan Kesehatan Hewan, Kementerian Pertanian. **Pasal 28** Surveyor sebagaimana dimaksud dalam Pasal 20 ayat (2) wajib menyampaikan laporan tertulis mengenai pelaksanaan verifikasi atau penelusuran teknis impor daging potongan primer (prime cuts) segar dingin kepada Direktur Jenderal setiap bulan paling lambat tanggal 15 (lima belas) bulan berikutnya. **Pasal 29** IT-Hewan dan Produk Hewan, Persetujuan Impor, atau Persetujuan Ekspor dicabut apabila perusahaan: a. terbukti melanggar ketentuan pencantuman label sebagaimana dimaksud dalam Pasal 18 dan/atau ketentuan kemasan sebagaimana dimaksud dalam Pasal 19; b. tidak melaksanakan kewajiban menyampaikan laporan sebagaimana dimaksud dalam Pasal 27 sebanyak 3 (tiga) kali; c. terbukti mengubah informasi yang tercantum dalam dokumen IT-Hewan dan Produk Hewan, Persetujuan Impor, atau Persetujuan Ekspor; dan/atau d. dinyatakan bersalah berdasarkan putusan pengadilan yang telah mempunyai kekuatan hukum tetap atas tindak pidana yang berkaitan dengan penyalahgunaan IT-Hewan dan Produk Hewan, Persetujuan Impor, atau Persetujuan Ekspor. **Pasal 30** Pencabutan IT-Hewan dan Produk Hewan, Persetujuan Impor, atau Persetujuan Ekspor yang diberikan kepada perusahaan ditetapkan oleh Koordinator dan Pelaksana UPP untuk dan atas nama Menteri. **Pasal 31** Penetapan sebagai Surveyor dicabut apabila: a. melakukan pelanggaran dalam pelaksanaan kegiatan verifikasi atau penelusuran teknis impor daging potongan primer (prime cuts) segar dingin; dan/atau b. tidak memenuhi ketentuan kewajiban pelaporan tertulis sebagaimana dimaksud dalam Pasal 28 sebanyak 2 (dua) kali. **Pasal 32** Pencabutan penetapan sebagai Surveyor pelaksana verifikasi atau penelusuran teknis impor daging potongan primer (prime cuts) segar dingin sebagaimana dimaksud dalam Pasal 31 ditetapkan oleh Menteri. **Pasal 33**",
DOC632,bn848-2013.txt,,,,3,1,Importir atau eksportir yang melakukan impor atau ekspor Hewan dan/atau Produk Hewan yang tidak sesuai dengan ketentuan dalam Peraturan Menteri ini dikenakan sanksi sesuai dengan ketentuan peraturan perundang-undangan.,
DOC632,bn848-2013.txt,,,,3,2,"Hewan dan/atau Produk Hewan yang diimpor yang jumlah, jenis, unit usaha, dan/atau negara asal tidak sesuai dengan Persetujuan Impor dan/atau tidak sesuai dengan ketentuan Peraturan Menteri ini harus dilakukan re-ekspor.",
DOC632,bn848-2013.txt,,,,3,3,Biaya atas pelaksanaan re-ekspor sebagaimana dimaksud pada ayat (2) merupakan tanggung jawab importir. **Pasal 34**,
DOC632,bn848-2013.txt,,,,3,1,"Impor Hewan dan/atau Produk Hewan yang merupakan: a. barang pribadi penumpang dan/atau awak sarana pengangkut sesuai dengan ketentuan peraturan perundang-undangan di bidang kepabeanan; b. barang kiriman sesuai dengan ketentuan peraturan perundang-undangan di bidang kepabeanan; c. barang perwakilan negara asing beserta para pejabatnya yang bertugas di Indonesia berdasarkan asas timbal balik; dan/atau d. barang pelintas batas sesuai dengan ketentuan peraturan perundang-undangan di bidang kepabeanan dengan perjanjian bilateral perdagangan lintas batas, dikecualikan dari ketentuan dalam Peraturan Menteri ini.",
DOC632,bn848-2013.txt,,,,3,2,"Impor Hewan dan/atau Produk Hewan yang merupakan: a. barang kiriman hadiah/hibah untuk keperluan ibadah untuk umum, amal, sosial, atau untuk kepentingan penanggulangan bencana alam; b. barang untuk keperluan badan internasional beserta pejabatnya yang bertugas di Indonesia; c. barang untuk keperluan penelitian dan pengembangan ilmu pengetahuan; dan/atau d. barang contoh yang tidak untuk diperdagangkan, harus mendapatkan Persetujuan Impor dengan hanya melampirkan rekomendasi sebagaimana dimaksud dalam Pasal 11 ayat (1) huruf b atau huruf c.",
DOC632,bn848-2013.txt,,,,3,3,"Impor Hewan dan/atau Produk Hewan yang merupakan barang yang telah diekspor kemudian diimpor kembali harus mendapat Persetujuan Impor dengan melampirkan Pemberitahuan Ekspor Barang yang telah ditandatangani oleh petugas/pejabat Bea dan Cukai dan tanpa harus melampirkan rekomendasi sebagaimana dimaksud dalam Pasal 11 ayat (1) huruf b atau huruf c. **PERATURAN MENTERI PERDAGANGAN REPUBLIK INDONESIA NOMOR 24/M-DAG/PER/9/2011 TENTANG KETENTUAN IMPOR DAN EKSPOR HEWAN DAN PRODUK HEWAN** DENGAN RAHMAT TUHAN YANG MAHA ESA MENTERI PERDAGANGAN REPUBLIK INDONESIA, a. bahwa untuk melaksanakan ketentuan Pasal 35 ayat (2) dan ayat (3) Peraturan Menteri ini, perlu diatur mengenai Persetujuan Impor dan Persetujuan Ekspor Hewan dan Produk Hewan; b. bahwa untuk memperoleh Persetujuan Impor sebagaimana dimaksud pada huruf a, pemohon harus mengajukan permohonan tertulis kepada Direktur Impor; c. bahwa untuk memperoleh Persetujuan Ekspor, pemohon juga harus mengajukan permohonan tertulis kepada Direktur Ekspor Produk Pertanian dan Kehutanan.",
DOC632,bn848-2013.txt,,,,1,,Undang-Undang Nomor 17 Tahun 2006 tentang Perdagangan;,
DOC632,bn848-2013.txt,,,,2,,Peraturan Pemerintah Nomor 85 Tahun 2012 tentang Sistem Perizinan Terintegrasi;,
