doc_id,nama_dokumen,bab,bagian,pasal,angka,ayat,isi,penjelasan
DOC631,bn842-2019.txt,,,Pasal 25,1,,"Pengerjaan yang Tidak Diperhitungkan (Non Qualifying Operation) a. Suatu barang originating di wilayah suatu Negara Anggota, tidak dapat dianggap originating dalam hal dilakukan proses di bawah ini baik secara tunggal maupun kombinasi, proses tersebut yaitu: 1) Proses pengawetan untuk memastikan barang dalam kondisi baik selama pengangkutan dan penyimpanan; 2) Perubahan kemasan, pembongkaran dan perakitan kemasan; 3) Pencucian sederhana, pembersihan, penghilangan debu, karat, minyak, cat atau pelapis lainnya; 4) Proses pengecatan dan pemolesan; 5) Pengupasan, pemucatan total maupun parsial, pemolesan, dan pengglasiran serealia dan beras; 6) Proses pewarnaan dan pembentukan gumpalan gula; 7) Pengupasan, pengerasan, atau penghilangan cangkang; 8) Peruncingan, penggilingan atau pemotongan sederhana; 9) Pemilahan, penyaringan, penyortiran, pengklasifikasian, penggolongan, pencocokan; 10) Pengemasan dalam botol, kaleng, termos, tas, koper, kotak, pemasangan pada kartu atau papan dan proses pengemasan sederhana lainnya; 11) Pembubuhan atau pencetakan tanda, label, logo, dan tanda pembeda lainnya pada produk atau kemasannya; 12) Pencampuran produk secara sederhana, baik dari jenis yang berbeda maupun tidak; 13) Perakitan sederhana bagian untuk menjadi barang jadi atau penguraian produk menjadi bagian-bagiannya; 14) Uji dan kalibrasi sederhana; 15) Penyembelihan hewan. b. Istilah “sederhana” secara umum menggambarkan suatu aktivitas yang tidak memerlukan keahlian khusus, mesin, peralatan atau perlengkapan yang diproduksi atau dipasang khusus untuk aktivitas tersebut. d. Penyembelihan berarti membunuh binatang dengan cara tertentu, termasuk proses selanjutnya seperti pemotongan, pendinginan, pembekuan, penggaraman, pengeringan atau pengasapan untuk tujuan pengawetan untuk keperluan penyimpanan dan pengangkutan. e. Keasalan suatu barang tidak berubah sepanjang hanya mengalami proses/pengerjaan sebagaimana dimaksud pada huruf a. **Pasal 6** Pengerjaan yang Tidak Diperhitungkan (Non Qualifying Operation) untuk Tekstil dan Produk Tekstil Barang yang berasal dari HS Bab 50 sampai dengan Bab 63 tidak dapat dianggap originating dari suatu Negara Anggota jika proses di bawah ini dilakukan secara tunggal atau kombinasi, di mana kriteria asal barang RVC dan CTC dipenuhi atau tidak dipenuhi, yaitu: a. Proses kombinasi sederhana, pelekatan label, penyetrikaan atau pressing, pencucian atau pencucian kering, proses pengemasan, atau kombinasi dari proses tersebut; b. Pemotongan panjang atau lebar dan pengeliman, penyulaman atau overlocking kain yang telah teridentifikasi penggunaannya untuk tujuan komersial tertentu; c. Menghias dan/atau menggabungkan bagian aksesoris, seperti tali, pita, manik-manik, kabel, cincin atau lubang tali, dengan cara menjahit, looping, mengaitkan atau melekatkan; d. Pengelantangan, waterproofing, decating, shrinking, mercerizing, atau proses yang sama hanya untuk tujuan proses akhir; e. Penyulaman yang dilakukan kurang dari 5% (lima persen) dari total area barang sulaman atau penyulaman yang dilakukan kurang dari 5% (lima persen) dari total berat barang sulaman. **Pasal 7** De Minimis a. Suatu barang yang tidak mengalami perubahan klasifikasi pos tarif harus dianggap originating dalam hal: 1) Untuk barang selain yang diatur dalam HS Bab 50 sampai Bab 63, nilai semua bahan non-originating yang digunakan dalam produksi yang tidak mengalami perubahan klasifikasi pos tarif yang dipersyaratkan tidak melebihi 10% (sepuluh persen) dari total FOB barang; 2) Untuk barang yang diatur dalam HS Bab 50 sampai Bab 63, berat semua bahan non-originating yang digunakan dalam produksi yang tidak mengalami perubahan klasifikasi pos tarif yang dipersyaratkan tidak melebihi 10% (sepuluh persen) dari total berat barang. b. Nilai bahan non-originating sebagaimana dimaksud pada angka 1) harus dimasukkan dalam komponen bahan non-originating untuk keperluan perhitungan RVC barang. **Pasal 8** Perlakuan terhadap Kemasan a. Dalam hal barang menggunakan kriteria asal barang RVC, nilai pengemas untuk penjualan eceran harus ikut dihitung sebagai komponen barang dalam RVC apabila pengemas tersebut dianggap membentuk keseluruhan barang. b. Dalam hal ketentuan huruf a tidak dapat diterapkan, pengemas untuk penjualan eceran, apabila diklasifikasikan dalam satu pos tarif dengan barangnya, tidak diperhitungkan dalam menentukan asal barang sepanjang kriteria asal barang yang digunakan adalah CTC. c. Kontainer dan pengemas yang khusus digunakan untuk tujuan pengangkutan tidak diperhitungkan untuk penentuan keasalan barang. **Pasal 9** Aksesoris, Spare Part, dan Perlengkapan Keasalan aksesoris, spare parts, peralatan, dan instruksi atau manual informasi yang disertakan dengan barang harus diabaikan dalam menentukan keasalan barang, sepanjang aksesoris, spare parts, peralatan, dan manual informasi tersebut diklasifikasikan menjadi satu dengan barang utamanya. **Pasal 10** Elemen Netral (Neutral Elements) Untuk menentukan keasalan suatu barang, tidak perlu menentukan barang-barang di bawah ini, yang digunakan untuk proses produksi dan tidak tergabung dengan barang: a. Bahan bakar dan energi; b. Tools, dies dan moulds; c. Spare part dan bahan yang digunakan untuk pemeliharaan peralatan dan gedung; d. Pelumas, gemuk, bahan kompon dan bahan lain yang digunakan dalam proses produksi atau digunakan untuk mengoperasikan peralatan dan gedung; e. Sarung tangan, kacamata, alas kaki, pakaian, dan perlengkapan dan peralatan keamanan; f. Perlengkapan, perangkat dan peralatan yang digunakan untuk menguji atau memeriksa barang; dan g. Barang lain yang tidak tergabung dengan barang tetapi digunakan pada produksi barang tersebut, yang cukup dapat ditunjukkan sebagai bagian dari produksi. **Pasal 11** Bahan Baku Identik dan Dapat Dipertukarkan Untuk tujuan penentuan keasalan barang, ketika barang diproduksi menggunakan bahan baku originating dan non-originating, tercampur atau dikombinasikan secara fisik, keasalan suatu bahan baku dapat ditentukan berdasarkan prinsip akuntansi yang berlaku umum atas manajemen persediaan yang berlaku di Negara Anggota pengekspor. Dalam hal keputusan metode manajemen persediaan telah diambil maka metode tersebut wajib digunakan sepanjang tahun fiskal. **Pasal 12** Asas Timbal Balik dalam Rangka AKFTA Dalam rangka AKFTA berlaku asas timbal balik (resiprositas) sehingga atas importasi beberapa jenis barang yang berasal dari negara Korea Selatan diberlakukan tarif resiprositas yang besarnya dapat sebesar tarif bea masuk MFN atau besaran tertentu, sebagaimana tercantum dalam Peraturan Menteri Keuangan mengenai penetapan tarif bea masuk dalam rangka ASEAN-Korea Free Trade Area (AKFTA). **Pasal 13** Bentuk dan Format SKA Form AK",
DOC631,bn842-2019.txt,,,Pasal 25,1,,"Goods consigned to (Consignee's name, address, country)",
DOC631,bn842-2019.txt,,,Pasal 25,2,,"Means of transport and route (as far as known) The undersigned hereby declares that the above mentioned goods are hereby certified, on the basis of control and statement are correct; that all the goods carried out, that the declaration by the exporter is correct, and that they comply with the origin requirements specified for those goods in the ASEAN-Korea Free Trade Area Preferential Tariff for the goods. **Pasal 14** Ketentuan Penutup Peraturan Menteri ini mulai berlaku pada tanggal ditetapkan. MENTERI KEUANGAN REPUBLIK INDONESIA, (Nama Pejabat) NIP. ... **PERATURAN MENTERI KEUANGAN REPUBLIK INDONESIA NOMOR 59 TAHUN 2019 TENTANG KETENTUAN ASAL BARANG DALAM RANGKA INDONESIA-JAPAN ECONOMIC PARTNERSHIP AGREEMENT (IJEPA)** **DENGAN RAHMAT TUHAN YANG MAHA ESA** **MENTERI KEUANGAN REPUBLIK INDONESIA,** a. bahwa untuk melaksanakan ketentuan Pasal 2 ayat (1) Peraturan Menteri Keuangan Nomor 56/PMK.04/2017 tentang Tata Cara Pengenaan Tarif Bea Masuk atas Barang Impor Berdasarkan Perjanjian atau Kesepakatan Internasional, perlu menetapkan ketentuan asal barang dalam rangka Indonesia-Japan Economic Partnership Agreement (IJEPA); b. bahwa berdasarkan pertimbangan sebagaimana dimaksud dalam huruf a, perlu menetapkan Peraturan Menteri Keuangan tentang Ketentuan Asal Barang dalam Rangka Indonesia-Japan Economic Partnership Agreement (IJEPA);",
DOC631,bn842-2019.txt,,,Pasal 25,3,,Peraturan Presiden Nomor 84 Tahun 2011 tentang Pengesahan Indonesia-Japan Economic Partnership Agreement (IJEPA);,
DOC631,bn842-2019.txt,,,Pasal 25,4,,Peraturan Menteri Keuangan Nomor 56/PMK.04/2017 tentang Tata Cara Pengenaan Tarif Bea Masuk atas Barang Impor Berdasarkan Perjanjian atau Kesepakatan Internasional; Menetapkan: PERATURAN MENTERI KEUANGAN TENTANG KETENTUAN ASAL BARANG DALAM RANGKA INDONESIA-JAPAN ECONOMIC PARTNERSHIP AGREEMENT (IJEPA). **I. KRITERIA ASAL BARANG**,
DOC631,bn842-2019.txt,,,Pasal 25,1,,"Kriteria asal barang dalam rangka skema IJEPA meliputi: a. barang yang seluruhnya diperoleh atau diproduksi di satu Negara Anggota (Wholly Obtained atau Produced); b. barang yang diproduksi di Negara Anggota yang seluruh bahan bakunya menggunakan Bahan Originating Negara Anggota (Produced Exclusively); c. barang yang memenuhi Product Specific Rules (PSR) sebagaimana diatur dalam Annex 2 IJEPA, termasuk persyaratan lainnya yang diatur dalam Ketentuan Asal Barang, saat barang yang diproduksi seluruhnya di Negara Anggota, menggunakan Bahan Non-Originating. **Wholly Obtained atau Produced** Barang-barang yang dikategorikan sebagai Wholly Obtained atau Produced adalah sebagai berikut: a. binatang hidup yang lahir dan dibesarkan di satu Negara Anggota; b. hewan hasil perburuan, pemasangan perangkap, pemancingan, pengumpulan atau penangkapan yang dilakukan di satu Negara Anggota; c. barang yang diperoleh dari binatang hidup di satu Negara Anggota; d. tanaman dan produk tanaman, yang dipanen, dipetik, atau dikumpulkan di satu Negara Anggota; e. mineral dan produk alam lainnya, tidak termasuk dalam huruf a sampai huruf d, yang diekstraksi atau diambil di satu Negara Anggota; f. hasil penangkapan ikan di laut dan produk lain yang diambil oleh kapal yang terdaftar di Negara Anggota dari laut di luar wilayah perairan Negara Anggota lainnya; g. produk yang dibuat di kapal pengolahan hasil laut (factory ship) yang terdaftar di Negara Anggota di luar wilayah Negara Anggota lainnya dari barang sebagaimana dimaksud dalam huruf f; h. barang yang diambil dari dasar laut atau lapisan tanah di bawahnya yang berada di luar wilayah Negara Anggota, dengan ketentuan Negara Anggota tersebut memiliki hak eksploitasi atas dasar laut atau lapisan tanah di bawah dasar laut tersebut; i. barang yang dikumpulkan di satu Negara Anggota, yang tidak dapat lagi berfungsi sesuai fungsi semula, tidak dapat dikembalikan kepada fungsi semula maupun diperbaiki dan hanya cocok untuk dibuang atau untuk dimanfaatkan kembali bagian atau bahan bakunya; j. sisa dan scrap yang berasal dari proses produksi atau pengolahan atau konsumsi di satu Negara Anggota dan hanya cocok untuk dibuang atau dimanfaatkan kembali bahan bakunya; k. bagian atau bahan baku yang dimanfaatkan kembali di satu Negara Anggota dari barang yang tidak dapat berfungsi sesuai fungsi semula atau tidak dapat dikembalikan kondisinya maupun diperbaiki kembali; l. barang yang diproduksi atau diperoleh di satu Negara Anggota hanya dari barang sebagaimana dimaksud dalam huruf a sampai huruf k. **Produced Exclusively** Barang yang diproduksi di Negara Anggota yang seluruh bahan bakunya menggunakan Bahan Originating Negara Anggota. **Product Specific Rules** PSR sebagaimana diatur dalam Annex 2 yang mensyaratkan bahwa barang yang mengalami perubahan klasifikasi (Change in Tariff Classification/CTC) atau suatu pabrikasi atau operasional tertentu diwajibkan hanya untuk Bahan Non-Originating. Kriteria asal barang yang tercantum dalam Product Specific Rules (PSR) meliputi: a. Qualifying Value Content (QVC) untuk barang-barang yang diatur dalam daftar PSR, dapat dihitung dengan rumus: QVC = (FOB - VNM) / FOB x 100% Keterangan: a) QVC adalah besaran qualifying value content suatu barang yang dinyatakan dalam persentase; b) FOB adalah nilai Free-on-Board suatu barang yang dibayar oleh pembeli kepada penjual tanpa melihat mode pengiriman, tidak termasuk pengurangan, pembebasan maupun pengembalian pajak pada saat barang diekspor; c) VNM adalah nilai value of non-originating material, yaitu bahan baku yang berasal dari luar Negara Anggota yang digunakan dalam pembuatan barang. Change in Tariff Classification (CTC) sebagaimana tercantum dalam daftar PSR meliputi Change in Chapter (CC), Change in Tariff Heading (CTH) dan Change in Tariff Sub Heading (CTSH); pabrikasi atau operasional tertentu (Specific Manufacturing or Processing Operation) yang diterapkan pada Bahan Non-Originating sebagaimana diatur dalam daftar PSR. **II. KRITERIA PENGIRIMAN LANGSUNG** Dalam hal pengiriman barang melalui satu atau lebih negara selain Negara Anggota, barang tetap dianggap memenuhi kriteria pengiriman, dan wajib dibuktikan dengan dokumen:",
DOC631,bn842-2019.txt,,,Pasal 25,1,,Copy Through Bill of Lading/Airway Bill; atau,
DOC631,bn842-2019.txt,,,Pasal 25,2,,"dokumen atau informasi lainnya yang diberikan oleh otoritas pabean atau entitas relevan lainnya, yang membuktikan bahwa barang tidak mengalami kegiatan selain bongkar, muat, dan kegiatan lainnya untuk menjaga kualitas barang di negara selain Negara Anggota. **III. KETENTUAN PROSEDURAL**",
DOC631,bn842-2019.txt,,,Pasal 25,1,,"Penelitian atas Pemenuhan Ketentuan Penerbitan Surat Keterangan Asal. Penelitian atas pemenuhan ketentuan penerbitan SKA Form JIEPA meliputi: a. kertas ukuran ISO A4 sesuai dengan bentuk dan format SKA Form JIEPA dalam lampiran ini; b. penandatanganan SKA Form JIEPA oleh pemohon/eksportir; c. penandatanganan SKA Form JIEPA dan stempel oleh Instansi Penerbit SKA Form JIEPA sesuai dengan spesimen dan dicantumkan secara manual atau dicetak (printed); d. klasifikasi barang dalam 6 (enam) digit HS 2002 harus dicantumkan dalam SKA Form JIEPA dan deskripsi barang dalam SKA Form JIEPA harus secara substansial sama dengan deskripsi dalam invoice dan, apabila memungkinkan, sama dengan deskripsi dalam HS untuk barang tersebut; e. penerbitan SKA Form JIEPA sebelum, pada saat, atau tidak lebih dari 3 (tiga) hari sejak Tanggal Pengapalan atau Tanggal Eksportasi; f. pemberian cap atau tulisan “ISSUED RETROACTIVELY” pada kolom 8 SKA Form JIEPA dalam hal SKA Form JIEPA diterbitkan lebih dari 3 (tiga) hari, namun tidak lebih dari 12 (dua belas) bulan terhitung sejak Tanggal Pengapalan atau Tanggal Eksportasi; g. SKA “ISSUED RETROACTIVELY” harus mencantumkan Tanggal Pengapalan atau Tanggal Eksportasi; h. pengisian kolom-kolom lainnya pada SKA Form JIEPA sesuai Overleaf Notes; i. koreksi berupa penghapusan, penambahan dan/atau perubahan lainnya pada SKA Form JIEPA tidak diperbolehkan; j. satu SKA Form JIEPA dapat memiliki dua atau lebih invoice sepanjang dikirimkan dalam satu pengiriman.",
DOC631,bn842-2019.txt,,,Pasal 25,2,,Penelitian SKA Back-to-Back. SKA Back-to-Back tidak berlaku untuk skema IJEPA.,
DOC631,bn842-2019.txt,,,Pasal 25,3,,"Penelitian Third Party Invoicing. Penelitian penggunaan Third Party Invoicing meliputi: a. nomor dan tanggal invoice pihak ketiga (Third Party Invoice) yang digunakan untuk importasi ke Indonesia dicantumkan pada kolom 7 SKA Form JIEPA; b. nomor dan tanggal invoice yang diterbitkan oleh eksportir dicantumkan pada kolom 7 SKA Form JIEPA dalam hal nomor invoice pihak ketiga belum diketahui pada saat penerbitan SKA Form JIEPA; dan c. dalam hal invoice pihak ketiga diterbitkan di negara yang berbeda dengan negara tempat diterbitkannya SKA Form JIEPA, nama dan alamat perusahaan yang menerbitkan invoice pihak ketiga (Third Party Invoice) dicantumkan pada kolom 8 SKA Form JIEPA. **IV. PENELITIAN RETROACTIVE CHECK DAN VERIFICATION VISIT**",
DOC631,bn842-2019.txt,,,Pasal 25,1,,"Permintaan Retroactive Check. Pelaksanaan Permintaan Retroactive Check dalam rangka perjanjian IJEPA dilaksanakan dengan ketentuan: a. melampirkan copy atau pindaian SKA Form JIEPA terkait dan mencantumkan alasan yang menyebabkan SKA Form JIEPA diragukan, kecuali dalam hal Permintaan Retroactive Check dilakukan secara acak (random) disertai dengan permintaan informasi, catatan, bukti atau data-data pendukung yang diperlukan untuk membuktikan keasalan barang; b. ditujukan kepada Instansi Penerbit SKA Form JIEPA dan/atau Ministry of Economy, Trade and Industry sebagai competent governmental authority dan harus dikirim melalui Kedutaan Besar Jepang yang ada di Indonesia. Permintaan Retroactive Check dikirimkan dengan metode pengiriman yang memiliki konfirmasi penerimaan; c. komunikasi langsung antara otoritas yang berwenang di negara pengekspor dan otoritas pabean di negara pengimpor dapat dilakukan menggunakan faksimile atau surat elektronik dan dilakukan secara bersamaan dengan Permintaan Retroactive Check yang telah dikirim pada butir a; d. jawaban atas Permintaan Retroactive Check harus diterima dalam jangka waktu tidak lebih dari 6 (enam) bulan sejak tanggal konfirmasi penerimaan; e. apabila terdapat permintaan informasi tambahan, Instansi Penerbit SKA Form JIEPA, sesuai dengan peraturan yang berlaku di negaranya, harus memberikan informasi yang diminta dalam jangka waktu tidak lebih dari 4 (empat) bulan sejak tanggal diterimanya permintaan informasi tambahan; f. dalam hal jawaban atas Permintaan Retroactive Check yang diterima tidak mencukupi untuk membuktikan kebenaran data yang tercantum dalam SKA Form JIEPA dan keabsahan SKA Form JIEPA, SKA Form JIEPA ditolak dan Tarif Preferensi tidak diberikan; g. Retroactive Check dalam rangka IJEPA dilakukan melalui: Embassy of Japan in Indonesia Economic Section Jalan M.H. Thamrin No. 24 Jakarta 10350 Tel : +62-21 3192-4308 Fax : +62-21 3192-5460 +62-21 315-7156 Email : Yepa-20080701@eoj.ntt.net.id",
DOC631,bn842-2019.txt,,,Pasal 25,2,,"Permintaan Retroactive Check dapat dilakukan dalam hal eksportir bukan merupakan produsen dari barang yang diekspor. Dokumen yang diminta adalah: a. pernyataan eksportir kepada Ministry of Economy, Trade and Industry of Japan yang dibuat berdasarkan informasi dari produsen barang; atau b. pemberitahuan yang disediakan oleh produsen barang kepada Ministry of Economy, Trade and Industry of Japan berdasarkan permintaan dari eksportir berdasarkan peraturan perundangan yang berlaku di negara pengekspor. **Verification Visit** a. Dalam hal hasil Permintaan Retroactive Check dianggap tidak mencukupi untuk membuktikan pemenuhan Ketentuan Asal Barang, Pejabat Bea dan Cukai dapat mengajukan permintaan melalui Kedutaan Besar Jepang yang ada di Indonesia untuk: 1) mengumpulkan dan menyediakan informasi terkait keasalan barang dan melakukan kunjungan ke lokasi proses produksi di lokasi eksportir atau produsen barang terkait; dan 2) menyediakan informasi terkait keasalan barang yang dimiliki oleh Instansi Penerbit SKA Form JIEPA pada saat atau setelah dilakukan Verification Visit. b. Permintaan Verification Visit disampaikan secara tertulis melalui Kedutaan Besar Jepang di Indonesia dalam jangka waktu paling lambat 40 (empat puluh) hari sebelum rencana tanggal Verification Visit. Kedutaan Besar Jepang meminta persetujuan tertulis kepada eksportir atau produsen yang lokasinya akan dikunjungi. c. Permintaan sebagaimana dimaksud pada huruf b harus memuat informasi: 1) identitas Kantor Pabean tempat pemasukan barang impor skema IJEPA yang akan diverifikasi; 2) eksportir/produsen barang yang akan dikunjungi; 3) rencana tanggal dan tempat pelaksanaan Verification Visit; 4) tujuan dan ruang lingkup Verification Visit, termasuk referensi khusus terkait barang yang akan diverifikasi; dan 5) nama dan jabatan Pejabat Bea dan Cukai dan/atau pejabat pemerintah lainnya yang memiliki keahlian yang diperlukan dalam pelaksanaan Verification Visit. d. Jawaban atas permintaan Verification Visit harus diterima dalam jangka waktu paling lama 30 (tiga puluh) hari terhitung sejak tanggal Kedutaan Besar Jepang menerima permintaan Verification Visit. e. Dalam hal Verification Visit dilaksanakan, Direktur Jenderal harus menerima informasi sebagaimana dimaksud pada huruf a angka 1) dan angka 2) dari Ministry of Economy, Trade and Industry of Japan dalam jangka waktu paling lambat 45 (empat puluh lima) hari atau dalam jangka waktu yang disetujui sejak hari terakhir pelaksanaan Verification Visit. f. Apabila dianggap perlu, Direktur Jenderal atau Pejabat Bea dan Cukai yang ditunjuk dapat mengajukan permintaan untuk melakukan Verification Visit selama periode dilakukannya Permintaan Retroactive Check atau tanpa didahului Permintaan Retroactive Check. g. Dalam hal jawaban atas permintaan Verification Visit atau permintaan informasi terkait keasalan barang tidak diterima dalam jangka waktu yang diatur dan/atau tidak lengkap, SKA Form JIEPA dinyatakan ditolak dan tarif preferensi tidak diberikan. Hasil keputusan pemeriksaan keasalan barang yang dilakukan melalui prosedur Permintaan Retroactive Check dan/atau Verification Visit harus disampaikan secara tertulis disertai dengan fakta dan dasar hukum keputusan tersebut kepada Ministry of Economy, Trade and Industry of Japan melalui Kedutaan Besar Jepang di Indonesia. **V. KETENTUAN PENGISIAN PEMBERITAHUAN PABEAN IMPOR DALAM RANGKA IJEPA**",
DOC631,bn842-2019.txt,,,Pasal 25,1,,"Pengisian Pemberitahuan Impor Barang BC 2.0. Untuk tujuan pengenaan Tarif Preferensi pada PIB/BC 2.0 wajib diisikan kode Tarif Preferensi, nomor referensi dan tanggal SKA Form JIEPA sebagai berikut: a. dalam hal PIB hanya menggunakan skema IJEPA, kode 56, nomor referensi, dan tanggal SKA Form JIEPA, wajib dicantumkan pada kolom 19 dan/atau kolom 33 PIB; b. dalam hal PIB menggunakan skema IJEPA dan fasilitas kepabeanan, kode 56 wajib dicantumkan pada kolom 33 PIB, sedangkan nomor referensi dan tanggal SKA Form JIEPA wajib dicantumkan pada Lembar Lampiran Dokumen dan Pemenuhan Persyaratan/Fasilitas Impor PIB.",
DOC631,bn842-2019.txt,,,Pasal 25,2,,Pengisian pada PIB untuk ditimbun di TPB dan/atau PIB dari TPB diatur tersendiri dalam Lampiran I huruf B Peraturan Menteri Keuangan Nomor 229/PMK.04/2017 tentang Tata Cara Pengenaan Tarif Bea Masuk atas Barang Impor Berdasarkan Perjanjian atau Kesepakatan Internasional.,
DOC631,bn842-2019.txt,,,Pasal 25,3,,"Pengisian pada Pemberitahuan Pabean Pemasukan Barang Impor untuk ditimbun di PLB dan/atau PIB dari PLB diatur tersendiri dalam Lampiran II huruf B Peraturan Menteri Keuangan Nomor 229/PMK.04/2017 tentang Tata Cara Pengenaan Tarif Bea Masuk atas Barang Impor Berdasarkan Perjanjian atau Kesepakatan Internasional. **PERATURAN MENTERI KEUANGAN REPUBLIK INDONESIA NOMOR 229/PMK.04/2017 TENTANG TATA CARA PENGENAAN TARIF BEA MASUK ATAS BARANG IMPOR BERDASARKAN PERJANJIAN ATAU KESEPAKATAN INTERNASIONAL** **DENGAN RAHMAT TUHAN YANG MAHA ESA** a. bahwa untuk melaksanakan ketentuan dalam Peraturan Menteri Keuangan Nomor 229/PMK.04/2017, perlu menetapkan ketentuan lain terkait kriteria asal barang; b. bahwa kriteria asal barang yang ditetapkan dalam peraturan ini bertujuan untuk memberikan kepastian hukum dalam pengenaan tarif bea masuk; c. bahwa berdasarkan pertimbangan sebagaimana dimaksud dalam huruf a dan b, perlu menetapkan Peraturan Menteri Keuangan tentang Tata Cara Pengenaan Tarif Bea Masuk atas Barang Impor Berdasarkan Perjanjian atau Kesepakatan Internasional.",
DOC631,bn842-2019.txt,,,Pasal 25,2,,Peraturan Pemerintah Nomor 34 Tahun 2011 tentang Pengenaan Tarif Bea Masuk atas Barang Impor Berdasarkan Perjanjian atau Kesepakatan Internasional;,
DOC631,bn842-2019.txt,,,Pasal 25,3,,Peraturan Menteri Keuangan Nomor 229/PMK.04/2017 tentang Tata Cara Pengenaan Tarif Bea Masuk atas Barang Impor Berdasarkan Perjanjian atau Kesepakatan Internasional. Menetapkan: PERATURAN MENTERI KEUANGAN TENTANG TATA CARA PENGENAAN TARIF BEA MASUK ATAS BARANG IMPOR BERDASARKAN PERJANJIAN ATAU KESEPAKATAN INTERNASIONAL. **I. KETENTUAN UMUM**,
DOC631,bn842-2019.txt,,,Pasal 25,1,,Pengisian pada PPFTZ-01 diatur tersendiri dalam Lampiran II huruf C Peraturan Menteri Keuangan Nomor 229/PMK.04/2017 tentang Tata Cara Pengenaan Tarif Bea Masuk atas Barang Impor Berdasarkan Perjanjian atau Kesepakatan Internasional. **II. KETENTUAN LAIN TERKAIT KRITERIA ASAL BARANG**,
DOC631,bn842-2019.txt,,,Pasal 25,1,,"**Akumulasi** a. Dalam penghitungan pemenuhan Ketentuan Asal Barang, bahan originating dari Negara Anggota yang digunakan sebagai bahan baku untuk memproduksi barang jadi di Negara Anggota lain, dianggap sebagai bahan originating Negara Anggota tempat dilakukan proses produksi. b. Dalam perhitungan qualifying value content, untuk menentukan nilai bahan baku non-originating yang digunakan dalam produksi barang jadi, nilai yang diperhitungkan dibatasi hanya dari nilai bahan baku non-originating yang digunakan dalam produksi barang jadi tersebut sepanjang memenuhi kriteria asal barang.",
DOC631,bn842-2019.txt,,,Pasal 25,2,,"**De Minimis** Dalam hal suatu barang jadi menggunakan kriteria asal barang CTC, bahan non-originating yang boleh tidak mengalami perubahan klasifikasi adalah: a. untuk barang dari Bab 28 sampai dengan Bab 49 dan Bab 64 sampai dengan Bab 97, nilainya tidak melebihi 10% (sepuluh persen) dari FOB; b. untuk barang dari Bab 50 sampai dengan Bab 63, beratnya tidak melebihi 7% (tujuh persen) berat barang jadinya.",
