doc_id,nama_dokumen,bab,bagian,pasal,angka,ayat,isi,penjelasan
DOC639,bn865-2016.txt,,,,6,,Peraturan Menteri Perdagangan Nomor 14/M-DAG/PER/3/2007 tentang Standardisasi Jasa Bidang Perdagangan dan Pengawasan Standar Nasional Indonesia (SNI) Wajib terhadap Barang dan Jasa yang Diperdagangkan sebagaimana telah diubah beberapa kali terakhir dengan Peraturan Menteri Perdagangan Nomor 72/M-DAG/PER/9/2015 tentang Perubahan Ketiga atas Peraturan Menteri Perdagangan Nomor 14/M-DAG/PER/3/2007 tentang Standardisasi Jasa Bidang Perdagangan dan Pengawasan Standar Nasional Indonesia (SNI) Wajib terhadap Barang dan Jasa yang Diperdagangkan (Berita Negara Republik Indonesia Tahun 2015 Nomor 1518);,
DOC639,bn865-2016.txt,,,,7,,"Peraturan Menteri Perdagangan Nomor 82/M-DAG/PER/12/2012 tentang Ketentuan Impor Telepon Seluler, Komputer Genggam (Handheld), dan Komputer Tablet (Berita Negara Republik Indonesia Tahun 2012 Nomor 1376) sebagaimana telah diubah beberapa kali terakhir dengan Peraturan Menteri Perdagangan Nomor 48/M-DAG/PER/8/2014 tentang Perubahan Kedua atas Peraturan Menteri Perdagangan Nomor 82/M-DAG/PER/12/2012 tentang Ketentuan Impor Telepon Seluler, Komputer Genggam (Handheld), dan Komputer Tablet (Berita Negara Republik Indonesia Tahun 2014 Nomor 1196);",
DOC639,bn865-2016.txt,,,,8,,Peraturan Menteri Perdagangan Nomor 46/M-DAG/PER/8/2014 tentang Ketentuan Umum Verifikasi atau Penelusuran Teknis di Bidang Perdagangan (Berita Negara Republik Indonesia Tahun 2014 Nomor 1104);,
DOC639,bn865-2016.txt,,,,9,,Peraturan Menteri Perdagangan Nomor 48/M-DAG/PER/7/2015 tentang Ketentuan Umum di Bidang Impor (Berita Negara Republik Indonesia Tahun 2015 Nomor 1006);,
DOC639,bn865-2016.txt,,,,10,,Peraturan Menteri Komunikasi dan Informatika Nomor 27 Tahun 2015 tentang Persyaratan Teknis Alat dan/atau Perangkat Telekomunikasi Berbasis Standar Teknologi Long Term Evolution (Berita Negara Republik Indonesia Tahun 2015 Nomor 1031);,
DOC639,bn865-2016.txt,,,,11,,Peraturan Menteri Perindustrian Nomor 68/M-IND/PER/8/2015 tentang Ketentuan dan Tata Cara Penghitungan Nilai Tingkat Komponen Dalam Negeri Produk Elektronika dan Telematika (Berita Negara Republik Indonesia Tahun 2015 Nomor 1262);,
DOC639,bn865-2016.txt,,,,12,,Peraturan Menteri Perdagangan Nomor 70/M-DAG/PER/9/2015 tentang Angka Pengenal Importir (Berita Negara Republik Indonesia Tahun 2015 Nomor 1516);,
DOC639,bn865-2016.txt,,,,13,,"Peraturan Menteri Perdagangan Nomor 08/M-DAG/PER/2/2016 tentang Organisasi dan Tata Kerja Kementerian Perdagangan (Berita Negara Republik Indonesia Tahun 2016 Nomor 202); **Menetapkan:** PERATURAN MENTERI PERDAGANGAN TENTANG PERUBAHAN KETIGA ATAS PERATURAN MENTERI PERDAGANGAN NOMOR 82/M-DAG/PER/12/2012 TENTANG KETENTUAN IMPOR TELEPON SELULER, KOMPUTER GENGGAM (HANDHELD), DAN KOMPUTER TABLET. **Pasal I** Beberapa ketentuan dalam Peraturan Menteri Perdagangan Nomor 82/M-DAG/PER/12/2012 tentang Ketentuan Impor Telepon Seluler, Komputer Genggam (Handheld), dan Komputer Tablet (Berita Negara Republik Indonesia Tahun 2012 Nomor 1376) sebagaimana telah diubah beberapa kali terakhir dengan Peraturan Menteri Perdagangan Nomor 48/M-DAG/PER/8/2014 tentang Perubahan Kedua Atas Peraturan Menteri Perdagangan Nomor 82/M-DAG/PER/12/2012 tentang Ketentuan Impor Telepon Seluler, Komputer Genggam (Handheld), dan Komputer Tablet (Berita Negara Republik Indonesia Tahun 2014 Nomor 1196) diubah sebagai berikut: **Pasal 4**",
DOC639,bn865-2016.txt,,,Pasal 4,13,1,"Untuk memperoleh penetapan sebagai IT Telepon Seluler, Komputer Genggam (Handheld) dan Komputer Tablet sebagaimana dimaksud dalam Pasal 3, perusahaan harus mengajukan permohonan secara elektronik kepada Menteri dalam hal ini Direktur Jenderal, dengan ketentuan sebagai berikut: a. untuk perangkat yang berada dalam jaringan 3G dan jaringan di bawahnya, melampirkan:",
DOC639,bn865-2016.txt,,,Pasal 4,1,,Angka Pengenal Importir Umum (API-U) atau Angka Pengenal Importir Produsen (API-P);,
DOC639,bn865-2016.txt,,,Pasal 4,2,,"asli penetapan sebagai IT Telepon Seluler, Komputer Genggam (Handheld) dan Komputer Tablet, bagi perusahaan yang telah memiliki IT Telepon Seluler, Komputer Genggam (Handheld) dan Komputer Tablet;",
DOC639,bn865-2016.txt,,,Pasal 4,3,,asli surat pernyataan kerjasama dengan paling sedikit 3 (tiga) distributor; dan,
DOC639,bn865-2016.txt,,,Pasal 4,4,,"rekomendasi dari Direktur Jenderal Industri Logam, Mesin, Alat Transportasi dan Elektronika, Kementerian Perindustrian. b. untuk perangkat yang berada dalam jaringan 4G LTE, melampirkan:",
DOC639,bn865-2016.txt,,,Pasal 4,1,,Angka Pengenal Importir Produsen (API-P);,
DOC639,bn865-2016.txt,,,Pasal 4,2,,"asli penetapan sebagai IT Telepon Seluler, Komputer Genggam (Handheld) dan Komputer Tablet, bagi perusahaan yang telah memiliki IT Telepon Seluler, Komputer Genggam (Handheld) dan Komputer Tablet;",
DOC639,bn865-2016.txt,,,Pasal 4,3,,asli surat pernyataan kerjasama dengan paling sedikit 3 (tiga) distributor; dan,
DOC639,bn865-2016.txt,,,Pasal 4,4,,"rekomendasi investasi industri dari Direktur Jenderal Industri Logam, Mesin, Alat Transportasi dan Elektronika, Kementerian Perindustrian. Rekomendasi sebagaimana dimaksud pada ayat (1) huruf b angka 4 memuat keterangan mengenai: a. bukti pembangunan industri Telepon Seluler, Komputer Genggam (Handheld) dan Komputer Tablet di dalam negeri; atau bukti kerjasama dengan industri Telepon Seluler, Komputer Genggam (Handheld) dan Komputer Tablet di dalam negeri, untuk perusahaan yang melakukan kegiatan usaha berupa manufaktur, design house, dan/atau riset dan pengembangan, di bidang industri telepon seluler, komputer genggam (handheld), dan komputer tablet. Direktur Jenderal dapat membentuk tim yang bertugas melakukan pemeriksaan lapangan untuk mengetahui kebenaran dokumen sebagaimana dimaksud pada ayat (1) dan ayat (2).",
DOC639,bn865-2016.txt,,,Pasal 4,4,4,"Direktur Jenderal atas nama Menteri menerbitkan: a. IT Telepon Seluler, Komputer Genggam (Handheld) dan Komputer Tablet paling lama 5 (lima) hari kerja terhitung sejak permohonan diterima secara lengkap dan benar; atau b. penolakan penetapan sebagai IT Telepon Seluler, Komputer Genggam (Handheld) dan Komputer Tablet paling lama 5 (lima) hari kerja sejak permohonan diterima, dalam hal permohonan tidak lengkap dan/atau tidak benar.",
DOC639,bn865-2016.txt,,,Pasal 4,4,5,"Direktur Jenderal mendelegasikan penolakan penerbitan penetapan sebagai IT Telepon Seluler, Komputer Genggam (Handheld) dan Komputer Tablet sebagaimana dimaksud pada ayat (4) huruf b kepada Direktur Impor. **Pasal 7**",
DOC639,bn865-2016.txt,,,Pasal 7,4,1,"Untuk mendapatkan PI Telepon Seluler, Komputer Genggam (Handheld) dan Komputer Tablet sebagaimana dimaksud dalam Pasal 6, IT Telepon Seluler, Komputer Genggam (Handheld) dan Komputer Tablet harus mengajukan permohonan secara elektronik kepada Menteri dalam hal ini Direktur Jenderal, dengan melampirkan: a. penetapan sebagai IT Telepon Seluler, Komputer Genggam (Handheld) dan Komputer Tablet; b. TPP Impor dari Direktur Jenderal Industri Logam, Mesin, Alat Transportasi dan Elektronika, Kementerian Perindustrian; c. Sertifikat Alat dan Perangkat Telekomunikasi yang diterbitkan oleh Direktorat Jenderal Sumber Daya dan Perangkat Pos dan Informatika, Kementerian Komunikasi dan Informatika; dan d. bukti surat penunjukan dari prinsipal pemegang merek/pabrik/distributor di luar negeri dengan menunjukkan asli surat penunjukan yang telah disahkan oleh Notaris Publik negara setempat dan Atase Perdagangan atau pejabat diplomatik di bidang ekonomi/konsuler di negara setempat.",
DOC639,bn865-2016.txt,,,Pasal 7,4,2,"Direktur Jenderal atas nama Menteri menerbitkan: a. PI Telepon Seluler, Komputer Genggam (Handheld) dan Komputer Tablet paling lama 5 (lima) hari kerja sejak permohonan diterima secara lengkap dan benar; atau b. penolakan penerbitan PI Telepon Seluler, Komputer Genggam (Handheld) dan Komputer Tablet paling lama 5 (lima) hari kerja sejak permohonan diterima, dalam hal permohonan tidak lengkap dan/atau tidak benar.",
DOC639,bn865-2016.txt,,,Pasal 7,4,3,"Direktur Jenderal mendelegasikan penolakan penerbitan PI Telepon Seluler, Komputer Genggam (Handheld) dan Komputer Tablet sebagaimana dimaksud pada ayat (2) huruf b kepada Direktur Impor.",
DOC639,bn865-2016.txt,,,Pasal 7,4,4,"PI Telepon Seluler, Komputer Genggam (Handheld) dan Komputer Tablet sebagaimana dimaksud pada ayat (2) huruf a disampaikan kepada IT Telepon Seluler, Komputer Genggam (Handheld) dan Komputer Tablet, dan tembusan disampaikan kepada instansi terkait.",
DOC639,bn865-2016.txt,,,Pasal 7,4,5,"PI Telepon Seluler, Komputer Genggam (Handheld) dan Komputer Tablet sebagaimana dimaksud pada ayat (2) huruf a diteruskan secara online ke portal Indonesia National Single Window (INSW).",
DOC639,bn865-2016.txt,,,Pasal 7,3,,Ketentuan Pasal 8A dihapus.,
DOC639,bn865-2016.txt,,,Pasal 7,4,,"Di antara Pasal 9 dan Pasal 10 disisipkan 1 (satu) pasal, yakni Pasal 9A yang berbunyi sebagai berikut: **Pasal 9A**",
DOC639,bn865-2016.txt,,,Pasal 7,4,1,"Pengajuan permohonan untuk memperoleh: a. penetapan sebagai IT Telepon Seluler, Komputer Genggam (Handheld) dan Komputer Tablet sebagaimana dimaksud dalam Pasal 4; dan b. PI Telepon Seluler, Komputer Genggam (Handheld) dan Komputer Tablet sebagaimana dimaksud dalam Pasal 7, hanya dapat dilayani dengan sistem elektronik melalui http://inatrade.kemendag.go.id.",
DOC639,bn865-2016.txt,,,Pasal 7,4,2,"Dalam hal terjadi keadaan memaksa (force majeure) yang mengakibatkan sistem elektronik melalui http://inatrade.kemendag.go.id tidak berfungsi, pengajuan permohonan sebagaimana dimaksud pada ayat (1) disampaikan secara manual. **Pasal 13**",
DOC639,bn865-2016.txt,,,Pasal 13,4,1,"Verifikasi atau penelusuran teknis sebagaimana dimaksud dalam Pasal 12 ayat (1) dilakukan terhadap impor Telepon Seluler, Komputer Genggam (Handheld) dan Komputer Tablet, yang meliputi data atau keterangan mengenai: a. negara dan pelabuhan muat; b. waktu pengapalan; c. pelabuhan tujuan; d. Pos Tarif/HS dan uraian barang; dan e. jenis dan volume sesuai dengan surat pernyataan dari prinsipal pemegang merek/pabrik/distributor di luar negeri.",
DOC639,bn865-2016.txt,,,Pasal 13,4,2,"Selain verifikasi atau penelusuran teknis yang dilakukan sebagaimana dimaksud pada ayat (1), verifikasi atau penelusuran teknis juga dilakukan terhadap sampel produk yang diimpor meliputi: a. kesesuaian Sertifikat Alat dan Perangkat Telekomunikasi yang diterbitkan oleh Direktorat Jenderal Sumber Daya dan Perangkat Pos dan Informatika, Kementerian Komunikasi dan Informatika; dan b. kesesuaian nomor International Mobile Equipment Identity (IMEI), Mobile Equipment Identifier (MEID), Electronic Serial Number (ESN) atau sejenisnya sesuai dengan yang tercantum dalam TPP Impor.",
DOC639,bn865-2016.txt,,,Pasal 13,4,3,Hasil verifikasi atau penelusuran teknis sebagaimana dimaksud pada ayat (1) dan ayat (2) dituangkan dalam bentuk Laporan Surveyor (LS) untuk digunakan sebagai dokumen pelengkap pabean dalam penyelesaian kepabeanan di bidang impor.,
DOC639,bn865-2016.txt,,,Pasal 13,4,4,LS sebagaimana dimaksud pada ayat (3) harus memuat pernyataan kebenaran atas hasil verifikasi atau penelusuran teknis dan menjadi tanggung jawab penuh Surveyor.,
DOC639,bn865-2016.txt,,,Pasal 13,4,5,"Atas pelaksanaan verifikasi atau penelusuran teknis sebagaimana dimaksud pada ayat (1) dan ayat (2), Surveyor memungut imbalan jasa dari IT Telepon Seluler, Komputer Genggam (Handheld) dan Komputer Tablet yang besarannya ditentukan dengan memperhatikan azas manfaat. **Pasal 15**",
DOC639,bn865-2016.txt,,,Pasal 15,4,1,"Perusahaan yang telah mendapatkan penetapan sebagai IT Telepon Seluler, Komputer Genggam (Handheld) dan Komputer Tablet wajib menyampaikan laporan secara elektronik atas pelaksanaan impor Telepon Seluler, Komputer Genggam (Handheld) dan Komputer Tablet melalui http://inatrade.kemendag.go.id.",
DOC639,bn865-2016.txt,,,Pasal 15,4,2,"Laporan sebagaimana dimaksud pada ayat (1) disampaikan setiap bulan paling lambat tanggal 15 (lima belas) bulan berikutnya kepada Direktur Jenderal. **PERATURAN MENTERI PERDAGANGAN REPUBLIK INDONESIA NOMOR 2016, NO.865 TAHUN 2016 TENTANG IMPOR TELEPON SELULER, KOMPUTER GENGGAM (HANDHELD), DAN KOMPUTER TABLET** DENGAN RAHMAT TUHAN YANG MAHA ESA, MENTERI PERDAGANGAN REPUBLIK INDONESIA, a. bahwa untuk melaksanakan ketentuan Pasal 17 dan Pasal 24B Peraturan Menteri ini, perlu dilakukan penetapan sebagai IT Telepon Seluler, Komputer Genggam (Handheld), dan Komputer Tablet; b. bahwa penetapan tersebut harus dilakukan dengan memperhatikan ketentuan yang berlaku; c. bahwa untuk itu, perlu menetapkan Peraturan Menteri tentang Impor Telepon Seluler, Komputer Genggam (Handheld), dan Komputer Tablet;",
DOC639,bn865-2016.txt,,,Pasal 15,1,,Undang-Undang Nomor 7 Tahun 2014 tentang Perdagangan;,
DOC639,bn865-2016.txt,,,Pasal 15,2,,Peraturan Presiden Nomor 44 Tahun 2016 tentang Daftar Investasi;,
DOC639,bn865-2016.txt,,,Pasal 15,3,,"Peraturan Menteri Perdagangan Nomor 20 Tahun 2016 tentang Ketentuan Impor Produk; Menetapkan: PERATURAN MENTERI TENTANG IMPOR TELEPON SELULER, KOMPUTER GENGGAM (HANDHELD), DAN KOMPUTER TABLET. **Pasal 1**",
DOC639,bn865-2016.txt,,,Pasal 15,3,1,"Penetapan sebagai IT Telepon Seluler, Komputer Genggam (Handheld), dan Komputer Tablet dicabut apabila perusahaan: a. terbukti memperdagangkan dan/atau memindahtangankan Telepon Seluler, Komputer Genggam (Handheld), dan Komputer Tablet yang diimpornya kepada konsumen atau pengecer (retailer) sebagaimana dimaksud dalam Pasal 9 ayat (2); b. tidak melakukan kewajiban penyampaian laporan sebagaimana dimaksud dalam Pasal 15 sebanyak 2 (dua) kali; c. tidak melakukan impor Telepon Seluler, Komputer Genggam (Handheld), dan Komputer Tablet dalam jangka waktu 6 (enam) bulan berturut-turut; d. terbukti mengubah informasi yang tercantum dalam dokumen impor Telepon Seluler, Komputer Genggam (Handheld), dan Komputer Tablet; e. melakukan pelanggaran di bidang kepabeanan berdasarkan informasi dari Direktorat Jenderal Bea dan Cukai, Kementerian Keuangan; dan/atau f. dinyatakan bersalah berdasarkan putusan pengadilan yang telah mempunyai kekuatan hukum tetap atas tindak pidana yang berkaitan dengan penyalahgunaan dokumen impor Telepon Seluler, Komputer Genggam (Handheld), dan Komputer Tablet. **Pasal 2** Di antara Pasal 24A dan Pasal 25 disisipkan 1 (satu) pasal, yakni Pasal 24B yang berbunyi sebagai berikut: **Pasal 24B** Penetapan sebagai IT Telepon Seluler, Komputer Genggam (Handheld), dan Komputer Tablet yang telah diterbitkan sebelum tanggal 1 Juli 2016 wajib disesuaikan dengan ketentuan Pasal 4 Peraturan Menteri ini paling lambat tanggal 1 September 2016. **Pasal II** Peraturan Menteri ini mulai berlaku pada tanggal 1 Juli 2016. Agar setiap orang mengetahuinya, memerintahkan pengundangan Peraturan Menteri ini dengan penempatannya dalam Berita Negara Republik Indonesia. MENTERI PERDAGANGAN REPUBLIK INDONESIA, ttd THOMAS TRIKASIH LEMBONG Diundangkan di Jakarta pada tanggal 9 Juni 2016 DIREKTUR JENDERAL PERATURAN PERUNDANG-UNDANGAN KEMENTERIAN HUKUM DAN HAK ASASI MANUSIA REPUBLIK INDONESIA, ttd WIDODO EKATJAHJANA",
