doc_id,nama_dokumen,bab,bagian,pasal,angka,ayat,isi,penjelasan
DOC637,bn86-2013.txt,,,,1,,"bahwa berdasarkan pertimbangan sebagaimana dimaksud pada huruf a, huruf b, dan huruf c, perlu mengubah kembali tanggal efektif mulai berlakunya Peraturan Menteri Kebudayaan dan Pariwisata Nomor PM.55/PW.204/MKP/2008 tentang Pemanfaatan Jasa Teknik Film Dalam Negeri Dalam Kegiatan Pembuatan dan Penggandaan Film Nasional Serta Penggandaan Film Impor sebagaimana telah beberapa kali diubah terakhir dengan Peraturan Menteri Pariwisata dan Ekonomi Kreatif Nomor PM.108/PW.204/MPEK/2011;",
DOC637,bn86-2013.txt,,,,5,,"Peraturan Presiden Nomor 24 Tahun 2010 tentang Kedudukan, Tugas, dan Fungsi Kementerian Negara Serta Susunan Organisasi, Tugas, dan Fungsi Eselon I Kementerian Negara sebagaimana telah beberapa kali diubah terakhir dengan Peraturan Presiden Nomor 92 Tahun 2011;",
DOC637,bn86-2013.txt,,,,6,,Surat Keputusan Menteri Penerangan Nomor 215/KEP/MENPEN/1994 tentang Ketentuan dan Tata Cara Penyelenggaraan Usaha Perfilman sebagaimana telah diubah dengan Surat Keputusan Menteri Penerangan Nomor 21A/KEP/MENPEN/1998;,
DOC637,bn86-2013.txt,,,,7,,Peraturan Menteri Kebudayaan dan Pariwisata Nomor PM.55/PW.204/MKP/2008 tentang Pemanfaatan Jasa Teknik Film Dalam Negeri Dalam Kegiatan Pembuatan dan Penggandaan Film Nasional Serta Penggandaan Film Impor sebagaimana telah beberapa kali diubah terakhir dengan Peraturan Menteri Pariwisata dan Ekonomi Kreatif Nomor PM.108/PW.204/MPEK/2011; **Menetapkan:** PERATURAN MENTERI PARIWISATA DAN EKONOMI KREATIF TENTANG PERUBAHAN KEEMPAT ATAS PERATURAN MENTERI KEBUDAYAAN DAN PARIWISATA NOMOR PM.55/PW.204/MKP/2008 TENTANG PEMANFAATAN JASA TEKNIK FILM DALAM NEGERI DALAM KEGIATAN PEMBUATAN DAN PENGGANDAAN FILM NASIONAL SERTA PENGGANDAAN FILM IMPOR. **Pasal I** Ketentuan Pasal 13 ayat (2) Peraturan Menteri Kebudayaan dan Pariwisata Nomor PM.55/PW.204/MKP/2008 Tentang Pemanfaatan Jasa Teknik Film Dalam Negeri Dalam Kegiatan Pembuatan Dan Penggandaan Film Nasional Serta Penggandaan Film Impor yang telah beberapa kali diubah dengan:,
DOC637,bn86-2013.txt,,,,1,,Peraturan Menteri Kebudayaan dan Pariwisata Nomor PM.11/PW.204/MKP/2009;,
DOC637,bn86-2013.txt,,,,2,,Peraturan Menteri Kebudayaan dan Pariwisata Nomor PM.27/PW.204/MKP/2010;,
DOC637,bn86-2013.txt,,,,3,,Peraturan Menteri Pariwisata dan Ekonomi Kreatif Nomor PM.108/PW.204/MPEK/2011; diubah sehingga berbunyi sebagai berikut: **Pasal 13**,
DOC637,bn86-2013.txt,,,,3,2,"Peraturan Menteri ini mulai berlaku pada tanggal 1 Januari 2014. **Pasal II** Peraturan Menteri ini mulai berlaku pada tanggal diundangkan. Agar setiap orang mengetahuinya, memerintahkan pengundangan Peraturan Menteri ini dengan penempatannya dalam Berita Negara Republik Indonesia. pada tanggal 19 Desember 2012 MENTERI PARIWISATA DAN EKONOMI KREATIF REPUBLIK INDONESIA, MARI ELKA PANGESTU **Diundangkan di Jakarta** pada tanggal 15 Januari 2013 MENTERI HUKUM DAN HAK ASASI MANUSIA REPUBLIK INDONESIA, AMIR SYAMSUDIN",
