doc_id,nama_dokumen,bab,bagian,pasal,angka,ayat,isi,penjelasan
DOC078,Keputusan_Presiden_no_15 TH 1994.txt,,,,1,,Pasal 4 ayat (1) Undang-Undang Dasar 1945;,
DOC078,Keputusan_Presiden_no_15 TH 1994.txt,,,,2,,Indische Tariefwet 1873 (Staatsblad 1873 Nomor 35) sebagaimana telah diubah dan ditambah;,
DOC078,Keputusan_Presiden_no_15 TH 1994.txt,,,,3,,Rechten Ordonnantie 1931 (Staatsblad 1931 Nomor 471) sebagaimana telah diubah dan ditambah; Menetapkan: KEPUTUSAN PRESIDEN REPUBLIK INDONESIA TENTANG PEMERIKSAAN PABEAN ATAS BARANG YANG DITMPOR DALAM RANGKA PROYEK PEMERINTAH YANG DIBIAYAI DENGAN BANTUAN LUAR NEGERI.,
DOC078,Keputusan_Presiden_no_15 TH 1994.txt,,,Pasal 1,,1,"Atas barang yang diimpor dalam rangka proyek Pemerintah yang dibiayai dengan bantuan luar negeri, tidak dilakukan Pemeriksaan Pra Pengapalan.",
DOC078,Keputusan_Presiden_no_15 TH 1994.txt,,,Pasal 1,,2,Pemeriksaan terhadap barang sebagaimana dimaksud dalam ayat (1) dilakukan oleh Direktorat Jenderal Bea dan Cukai pada saat barang yang bersangkutan tiba di pelabuhan atau bandar udara tujuan di Indonesia. Ketentuan lebih lanjut Keputusan Presiden ini diatur oleh Menteri Keuangan. Keputusan Presiden ini mulai berlaku pada tanggal ditetapkan. pada tanggal 3 Maret 1994 PRESIDEN REPUBLIK INDONESIA ttd SOEHARTO Diundangkan di Jakarta pada tanggal 3 Maret 1994 MENTERI NEGARA SEKRETARIS NEGARA REPUBLIK INDONESIA ttd MOERDIONO,
