doc_id,nama_dokumen,bab,bagian,pasal,angka,ayat,isi,penjelasan
DOC102,Permendag%20No.%2005%20Tahun%202016.txt,,,Pasal 10,5,1,"Ekspor Hewan dan/atau Produk Hewan yang merupakan: a. barang pribadi penumpang dan/atau awak sarana pengangkut sesuai dengan ketentuan peraturan perundang-undangan di bidang kepabeanan; b. barang kiriman sesuai dengan ketentuan peraturan perundang-undangan di bidang kepabeanan; c. barang perwakilan negara asing beserta para pejabatnya yang bertugas di Indonesia berdasarkan asas timbal balik; dan/atau d. barang pelintas batas sesuai dengan ketentuan peraturan perundang-undangan di bidang kepabeanan dengan perjanjian bilateral perdagangan lintas batas, dikecualikan dari ketentuan dalam Peraturan Menteri ini.",
DOC102,Permendag%20No.%2005%20Tahun%202016.txt,,,Pasal 10,5,2,"Ekspor Hewan dan/atau Produk Hewan yang merupakan: a. barang kiriman hadiah/hibah untuk keperluan ibadah untuk umum, amal, sosial atau untuk kepentingan penanggulangan bencana alam; b. barang untuk keperluan badan internasional beserta pejabatnya yang bertugas di Indonesia; c. barang untuk keperluan penelitian dan pengembangan ilmu pengetahuan; dan/atau d. barang contoh yang tidak untuk diperdagangkan, harus mendapatkan Persetujuan Ekspor dari Direktur Ekspor Produk Pertanian dan Kehutanan.",
DOC102,Permendag%20No.%2005%20Tahun%202016.txt,,,Pasal 10,5,3,"Untuk memperoleh Persetujuan Ekspor sebagaimana dimaksud pada ayat (2), pemohon harus mengajukan permohonan secara tertulis kepada Direktur Ekspor Produk Pertanian dan Kehutanan dengan melampirkan Rekomendasi sebagaimana dimaksud dalam Pasal 5 ayat (1) huruf c. **Pasal 29**",
DOC102,Permendag%20No.%2005%20Tahun%202016.txt,,,Pasal 10,5,1,"Impor Hewan dan/atau Produk Hewan yang merupakan: a. barang pribadi penumpang dan/atau awak sarana pengangkut sesuai dengan ketentuan peraturan perundang-undangan di bidang kepabeanan; b. barang kiriman sesuai dengan ketentuan peraturan perundang-undangan di bidang kepabeanan; c. barang yang telah diekspor kemudian diimpor kembali dengan jumlah paling banyak sama dengan jumlah pada saat diekspor yang dibuktikan dengan Pemberitahuan Ekspor Barang; d. barang perwakilan negara asing beserta para pejabatnya yang bertugas di Indonesia berdasarkan asas timbal balik; dan/atau e. barang pelintas batas sesuai dengan ketentuan peraturan perundang-undangan di bidang kepabeanan dengan perjanjian bilateral perdagangan lintas batas, dikecualikan dari ketentuan dalam Peraturan Menteri ini.",
DOC102,Permendag%20No.%2005%20Tahun%202016.txt,,,Pasal 10,5,2,"Impor Hewan dan/atau Produk Hewan yang merupakan: a. barang kiriman hadiah/hibah untuk keperluan ibadah untuk umum, amal, sosial, atau untuk kepentingan penanggulangan bencana alam; b. barang untuk keperluan badan internasional beserta pejabatnya yang bertugas di Indonesia; c. barang untuk keperluan penelitian dan pengembangan ilmu pengetahuan; dan/atau d. barang contoh yang tidak untuk diperdagangkan, harus mendapatkan Persetujuan Impor dari Direktur Impor.",
DOC102,Permendag%20No.%2005%20Tahun%202016.txt,,,Pasal 10,5,3,"Untuk memperoleh Persetujuan Impor sebagaimana dimaksud pada ayat (2), pemohon harus mengajukan permohonan secara tertulis kepada Direktur Impor dengan melampirkan Rekomendasi sebagaimana dimaksud dalam Pasal 10 ayat (2) huruf e atau huruf f. **Pasal 30** Setiap pelaksanaan Ekspor dan Impor Hewan dan/atau Produk Hewan tetap tunduk pada ketentuan peraturan perundang-undangan. **Pasal 31**",
DOC102,Permendag%20No.%2005%20Tahun%202016.txt,,,Pasal 10,5,1,Pengawasan terhadap Impor dan peredaran Hewan dan Produk Hewan dilakukan sesuai dengan ketentuan peraturan perundang-undangan.,
DOC102,Permendag%20No.%2005%20Tahun%202016.txt,,,Pasal 10,5,2,Menteri dapat membentuk tim terpadu yang terdiri dari wakil instansi terkait untuk melakukan: a. evaluasi pelaksanaan kebijakan Ekspor dan Impor Hewan dan Produk Hewan; dan b. pengawasan peredaran Hewan dan Produk Hewan.,
DOC102,Permendag%20No.%2005%20Tahun%202016.txt,,,Pasal 10,5,3,"Direktorat Jenderal Perdagangan Luar Negeri sewaktu-waktu dapat melakukan penilaian kepatuhan (post audit) terhadap perusahaan yang telah mendapatkan Persetujuan Ekspor dan/atau Persetujuan Impor. **Pasal 32** Petunjuk teknis pelaksanaan Peraturan Menteri ini dapat ditetapkan oleh Direktur Jenderal. **Pasal 33** Pengecualian dari ketentuan yang diatur dalam Peraturan Menteri ini harus dengan persetujuan Menteri setelah berkoordinasi dengan instansi terkait. **Pasal 34** Penetapan sebagai IT-Hewan dan Produk Hewan, Persetujuan Impor, dan Persetujuan Ekspor yang telah diterbitkan berdasarkan Peraturan Menteri Perdagangan Nomor 46/M-DAG/PER/8/2013 tentang Ketentuan Impor dan Ekspor Hewan dan Produk Hewan sebagaimana telah diubah terakhir dengan Peraturan Menteri ini, dinyatakan tetap berlaku sampai dengan ditetapkannya ketentuan baru. Demikianlah Peraturan Menteri ini ditetapkan untuk dipatuhi dan dilaksanakan. pada tanggal ... MENTERI PERDAGANGAN REPUBLIK INDONESIA [**Nama Pejabat**] NIP. ... **PERATURAN MENTERI PERDAGANGAN REPUBLIK INDONESIA NOMOR 05/M-DAG/PER/1/2016 TENTANG KETENTUAN EKSPOR DAN IMPOR HEWAN DAN PRODUK HEWAN** **DENGAN RAHMAT TUHAN YANG MAHA ESA** a. bahwa untuk melaksanakan ketentuan dalam peraturan perundang-undangan terkait ekspor dan impor hewan dan produk hewan, perlu menetapkan Peraturan Menteri Perdagangan tentang Ketentuan Ekspor dan Impor Hewan dan Produk Hewan; b. bahwa berdasarkan pertimbangan sebagaimana dimaksud dalam huruf a, perlu menetapkan Peraturan Menteri Perdagangan;",
DOC102,Permendag%20No.%2005%20Tahun%202016.txt,,,Pasal 10,1,,Undang-Undang Nomor 7 Tahun 2014 tentang Perdagangan;,
DOC102,Permendag%20No.%2005%20Tahun%202016.txt,,,Pasal 10,2,,Peraturan Pemerintah Nomor 28 Tahun 2004 tentang Keamanan Pangan;,
DOC102,Permendag%20No.%2005%20Tahun%202016.txt,,,Pasal 10,3,,Peraturan Menteri Perdagangan Nomor 46/M-DAG/PER/8/2013 tentang Ketentuan Impor dan Ekspor Hewan dan Produk Hewan;,
DOC102,Permendag%20No.%2005%20Tahun%202016.txt,,,Pasal 10,4,,"Peraturan Menteri Perdagangan Nomor 41/M-DAG/PER/6/2015 tentang Perubahan atas Peraturan Menteri Perdagangan Nomor 46/M-DAG/PER/8/2013; Menetapkan Peraturan Menteri Perdagangan tentang Ketentuan Ekspor dan Impor Hewan dan Produk Hewan. **Pasal 35** Persetujuan Impor untuk Hewan dan Produk Hewan sebagaimana tercantum dalam Lampiran III Peraturan Menteri ini yang telah diterbitkan berdasarkan Peraturan Menteri Perdagangan Nomor 46/M-DAG/PER/8/2013 tentang Ketentuan Impor dan Ekspor Hewan dan Produk Hewan, sebagaimana telah diubah beberapa kali terakhir dengan Peraturan Menteri Perdagangan Nomor 41/M-DAG/PER/6/2015, wajib disesuaikan dengan Peraturan Menteri ini paling lambat 1 (satu) bulan sejak berlakunya Peraturan Menteri ini. **Pasal 36**",
DOC102,Permendag%20No.%2005%20Tahun%202016.txt,,,Pasal 10,4,1,"Impor Produk Hewan Olahan yang termasuk dalam Pos Tarif/HS 16.01 dan 16.02 sebagaimana diatur dalam Peraturan Menteri Perdagangan Nomor 87/M-DAG/PER/10/2015 tentang Ketentuan Impor Produk Tertentu, sebagaimana telah diubah dengan Peraturan Menteri Perdagangan Nomor 94/M-DAG/PER/10/2015, tunduk pada ketentuan dalam Peraturan Menteri ini.",
DOC102,Permendag%20No.%2005%20Tahun%202016.txt,,,Pasal 10,4,2,"Pelaksanaan ketentuan sebagaimana dimaksud pada ayat (1) mulai berlaku 1 (satu) bulan sejak berlakunya Peraturan Menteri ini. **Pasal 37** Pada saat Peraturan Menteri ini mulai berlaku, Peraturan Menteri Perdagangan Nomor 46/M-DAG/PER/8/2013 tentang Ketentuan Impor dan Ekspor Hewan dan Produk Hewan, sebagaimana telah diubah beberapa kali terakhir dengan Peraturan Menteri Perdagangan Nomor 41/M-DAG/PER/6/2015, dicabut dan dinyatakan tidak berlaku. **Pasal 38** Peraturan Menteri ini mulai berlaku pada tanggal diundangkan. Agar setiap orang mengetahuinya, memerintahkan pengundangan Peraturan Menteri ini dengan penempatannya dalam Berita Negara Republik Indonesia. **MENTERI PERDAGANGAN REPUBLIK INDONESIA,** **Ttd.** **THOMAS TRIKASIH LEMBONG** **Salinan sesuai dengan aslinya** **Sekretariat Jenderal** **Kementerian Perdagangan** --- **LAMPIRAN I** **PERATURAN MENTERI PERDAGANGAN REPUBLIK INDONESIA NOMOR 05/M-DAG/PER/1/2016 TENTANG KETENTUAN EKSPOR DAN IMPOR HEWAN DAN PRODUK HEWAN** **JENIS HEWAN DAN PRODUK HEWAN YANG DIBATASI EKSPORNYA**",
DOC102,Permendag%20No.%2005%20Tahun%202016.txt,,,Pasal 10,1,,"Kuda, keledai, bagal dan hinnie, hidup - Kuda: - Bibit Pacu, Tunggang, Tarik, Kaveleri, Polo dan Kesayangan",
DOC102,Permendag%20No.%2005%20Tahun%202016.txt,,,Pasal 10,2,,Binatang jenis lembu hidup - Sapi: - Bibit,
DOC102,Permendag%20No.%2005%20Tahun%202016.txt,,,Pasal 10,3,,Babi hidup - Bibit,
DOC102,Permendag%20No.%2005%20Tahun%202016.txt,,,Pasal 10,4,,Biri-biri dan kambing hidup - Bibit,
DOC102,Permendag%20No.%2005%20Tahun%202016.txt,,,Pasal 10,5,,"Unggas hidup, yaitu ayam dari spesies Gallus domesticus, bebek, angsa, kalkun dan ayam guinea - Ayam dari spesies Gallus domesticus - Ayam bibit **MENTERI PERDAGANGAN REPUBLIK INDONESIA,** **Ttd.** **THOMAS TRIKASIH LEMBONG** **Salinan sesuai dengan aslinya** **Sekretariat Jenderal** **Kementerian Perdagangan** --- **LAMPIRAN II** **PERATURAN MENTERI PERDAGANGAN REPUBLIK INDONESIA NOMOR 05/M-DAG/PER/1/2016 TENTANG KETENTUAN EKSPOR DAN IMPOR HEWAN DAN PRODUK HEWAN** **JENIS HEWAN DAN PRODUK HEWAN YANG HANYA DAPAT DIIMPOR OLEH BUMN DAN BUMD** | No | POS TARIF/HS | URAIAN BARANG | KETERANGAN | |----|--------------|----------------|------------| | 1  | 0201.10.00.00 | Daging binatang jenis lembu, segar atau dingin | Karkas dan setengah karkas | | 2  | 0201.20.00.00 | Daging binatang jenis lembu, beku | Karkas dan setengah karkas | | 3  | 0202.10.00.00 | Daging babi, segar atau dingin | Karkas dan setengah karkas | | 4  | 0202.20.00.00 | Daging biri-biri atau kambing, segar atau dingin | Karkas dan setengah karkas | **MENTERI PERDAGANGAN REPUBLIK INDONESIA,** **Ttd.** **THOMAS TRIKASIH LEMBONG** **Salinan sesuai dengan aslinya** **Sekretariat Jenderal** **Kementerian Perdagangan** --- **LAMPIRAN III** **PERATURAN MENTERI PERDAGANGAN REPUBLIK INDONESIA NOMOR 05/M-DAG/PER/1/2016 TENTANG KETENTUAN EKSPOR DAN IMPOR HEWAN DAN PRODUK HEWAN** **JENIS HEWAN DAN PRODUK HEWAN YANG DAPAT DIIMPOR DAN DITENTUKAN PERIODE PERSETUJUAN IMPORNYA** | No | POS TARIF/HS | URAIAN BARANG | KETERANGAN | |----|--------------|----------------|------------| | 1  | 0201.10.00.00 | Daging binatang jenis lembu, segar atau dingin | Karkas dan setengah karkas | | 2  | 0201.20.00.00 | Daging binatang jenis lembu, beku | Karkas dan setengah karkas | | 3  | 0202.10.00.00 | Daging babi, segar atau dingin | Karkas dan setengah karkas | | 4  | 0202.20.00.00 | Daging biri-biri atau kambing, segar atau dingin | Karkas dan setengah karkas | **MENTERI PERDAGANGAN REPUBLIK INDONESIA,** **Ttd.** **THOMAS TRIKASIH LEMBONG** **Salinan sesuai dengan aslinya** **Sekretariat Jenderal** **Kementerian Perdagangan** **MENTERI PERDAGANGAN REPUBLIK INDONESIA** **NOMOR 05/M-DAG/PER/1/2016** **TENTANG** **KETENTUAN EKSPOR DAN IMPOR HEWAN DAN PRODUK HEWAN** **DENGAN RAHMAT TUHAN YANG MAHA ESA** a. bahwa untuk melaksanakan ketentuan dalam peraturan perundang-undangan mengenai ekspor dan impor hewan dan produk hewan, perlu menetapkan peraturan menteri perdagangan tentang ketentuan ekspor dan impor hewan dan produk hewan; b. bahwa berdasarkan pertimbangan sebagaimana dimaksud dalam huruf a, perlu menetapkan peraturan menteri perdagangan.",
DOC102,Permendag%20No.%2005%20Tahun%202016.txt,,,Pasal 10,1,,Undang-Undang Nomor 7 Tahun 2014 tentang Perdagangan;,
DOC102,Permendag%20No.%2005%20Tahun%202016.txt,,,Pasal 10,2,,Undang-Undang Nomor 18 Tahun 2009 tentang Peternakan dan Kesehatan Hewan;,
DOC102,Permendag%20No.%2005%20Tahun%202016.txt,,,Pasal 10,3,,Peraturan Pemerintah Nomor 28 Tahun 2004 tentang Keamanan Pangan;,
DOC102,Permendag%20No.%2005%20Tahun%202016.txt,,,Pasal 10,4,,Peraturan Menteri Perdagangan Nomor 20/M-DAG/PER/4/2014 tentang Ketentuan Umum Ekspor dan Impor. Menetapkan: PERATURAN MENTERI PERDAGANGAN TENTANG KETENTUAN EKSPOR DAN IMPOR HEWAN DAN PRODUK HEWAN. **BAB I** **KETENTUAN UMUM** Dalam peraturan ini yang dimaksud dengan:,
DOC102,Permendag%20No.%2005%20Tahun%202016.txt,,,Pasal 1,1,,"Hewan adalah hewan ternak, hewan peliharaan, dan hewan liar.",
DOC102,Permendag%20No.%2005%20Tahun%202016.txt,,,Pasal 1,2,,"Produk hewan adalah semua produk yang berasal dari hewan, termasuk daging, susu, telur, dan produk olahan lainnya.",
DOC102,Permendag%20No.%2005%20Tahun%202016.txt,,,Pasal 1,3,,Importir adalah orang atau badan hukum yang melakukan kegiatan impor. **BAB II** **KETENTUAN IMPOR**,
DOC102,Permendag%20No.%2005%20Tahun%202016.txt,,,Pasal 2,,1,Importir wajib memiliki izin impor dari kementerian yang menyelenggarakan urusan pemerintahan di bidang perdagangan.,
DOC102,Permendag%20No.%2005%20Tahun%202016.txt,,,Pasal 2,,2,Izin impor sebagaimana dimaksud pada ayat (1) berlaku untuk jangka waktu tertentu dan dapat diperpanjang.,
DOC102,Permendag%20No.%2005%20Tahun%202016.txt,,,Pasal 3,,1,Importir wajib memenuhi persyaratan teknis dan administratif yang ditetapkan oleh kementerian yang menyelenggarakan urusan pemerintahan di bidang pertanian.,
DOC102,Permendag%20No.%2005%20Tahun%202016.txt,,,Pasal 3,,2,Importir wajib melaporkan realisasi impor kepada kementerian yang menyelenggarakan urusan pemerintahan di bidang perdagangan. **BAB III** **KETENTUAN EKSPOR**,
DOC102,Permendag%20No.%2005%20Tahun%202016.txt,,,Pasal 4,,1,Ekspor produk hewan hanya dapat dilakukan oleh eksportir yang memiliki izin ekspor.,
DOC102,Permendag%20No.%2005%20Tahun%202016.txt,,,Pasal 4,,2,Izin ekspor sebagaimana dimaksud pada ayat (1) berlaku untuk jangka waktu tertentu dan dapat diperpanjang.,
DOC102,Permendag%20No.%2005%20Tahun%202016.txt,,,Pasal 5,,1,Eksportir wajib memenuhi persyaratan teknis dan administratif yang ditetapkan oleh kementerian yang menyelenggarakan urusan pemerintahan di bidang pertanian.,
DOC102,Permendag%20No.%2005%20Tahun%202016.txt,,,Pasal 5,,2,"Eksportir wajib melaporkan realisasi ekspor kepada kementerian yang menyelenggarakan urusan pemerintahan di bidang perdagangan. **BAB IV** **PENUTUP** Peraturan ini mulai berlaku pada tanggal ditetapkan. **MENTERI PERDAGANGAN REPUBLIK INDONESIA,** Ttd. **THOMAS TRIKASIH LEMBONG** --- **LAMPIRAN V** **LAPORAN DISTRIBUSI SAPI** **POSISI LAPORAN TANGGAL:** Pemotongan Sapi Kedatangan Distribusi --- **LAMPIRAN VI** **LAPORAN DISTRIBUSI DAGING SAPI** **POSISI LAPORAN TANGGAL:** Realisasi Impor Distribusi Industri dan Horeka --- Salinan sesuai dengan aslinya Sekretariat Jenderal Kementerian Perdagangan **MENTERI PERDAGANGAN REPUBLIK INDONESIA,** Ttd. **THOMAS TRIKASIH LEMBONG**",
