doc_id,nama_dokumen,bab,bagian,pasal,angka,ayat,isi,penjelasan
DOC001,132~PMK.010~2015Per.txt,,,Pasal 2,,1,"Ketentuan lebih lanjut mengenai pelaksanaan peraturan ini akan diatur dalam keputusan menteri keuangan. MENTERI KEUANGAN REPUBLIK INDONESIA [Nama Pejabat] Berita Negara Republik Indonesia Tahun [Tahun] Nomor [Nomor]. Dengan Rahmat Tuhan Yang Maha Esa a. Undang-Undang Nomor 10 Tahun 1995 tentang Kepabeanan; b. Peraturan Pemerintah Nomor 20 Tahun 1997 tentang Penerimaan Negara Bukan Pajak; c. Peraturan Menteri Keuangan Nomor 123/PMK.04/2018 tentang Tarif Bea Masuk. Menetapkan: Kebijakan Tarif Bea Masuk atas Barang Impor. - Kopi (HS Code: 09.01) termasuk kopi yang digongseng atau dihilangkan kafeinnya. - Kopi yang digongseng dan tidak dihilangkan kafeinnya dikenakan tarif bea masuk sebesar 20%, dengan rincian: - Kopi yang tidak ditumbuk dikenakan tarif 20%. - Kopi yang ditumbuk dikenakan tarif 20%. - Barang perabot lainnya, tidak termasuk yang dimaksud dalam pos 94.04. - Penutup tempat tidur dikenakan tarif bea masuk sebesar 25%. - Terpal, awning dan kerai matahari; tenda; layar untuk perahu, barang keperluan berkemah dikenakan tarif bea masuk sebesar 20%. - Tenda dari serat sintetik dikenakan tarif 20%. - Tenda dari bahan tekstil lainnya dikenakan tarif 25%. - Alas kaki dengan sol luar dari karet, plastik, kulit samak atau kulit komposisi dan bagian atas sepatu dari kulit samak dikenakan tarif bea masuk sebesar 25%. - Alas kaki olah raga dikenakan tarif 20%. - Alas kaki lainnya dikenakan tarif 30%. - Tutup kepala lainnya dikenakan tarif bea masuk sebesar 15%. - Wig, jenggot, alis dan bulu mata palsu dikenakan tarif bea masuk sebesar 15%. - Batu giling, batu asah, roda gerinda dan sejenisnya dikenakan tarif bea masuk sebesar 10%. MENTERI KEUANGAN REPUBLIK INDONESIA [Pejabat yang berwenang] MENTERI KEUANGAN REPUBLIK INDONESIA Dengan Rahmat Tuhan Yang Maha Esa a. Undang-Undang Nomor 10 Tahun 1995 tentang Kepabeanan; b. Undang-Undang Nomor 17 Tahun 2006 tentang Perubahan atas Undang-Undang Nomor 10 Tahun 1995 tentang Kepabeanan; c. Peraturan Pemerintah Nomor 10 Tahun 2021 tentang Tarif Bea Masuk; d. Peraturan Menteri Keuangan Nomor 182/PMK.04/2021 tentang Ketentuan Umum dan Tata Cara Pengenaan Bea Masuk. Menetapkan: Peraturan Menteri Keuangan tentang Tarif Bea Masuk atas Barang Impor. I. PRODUK KERAMIK LAINNYA - Gelas minum stemware, selain keramik kaca: - Dari kristal timbal: dikenakan tarif bea masuk sebesar 10%. - Lain-lain: dikenakan tarif bea masuk sebesar 10%. - Barang kaca dari jenis yang digunakan untuk meja (selain gelas minum) atau keperluan dapur selain keramik kaca: - Dari kristal timbal: dikenakan tarif bea masuk sebesar 10%. - Dari kaca yang mempunyai koefisien linier perluasan tidak melebihi 5x10^-6 per Kelvin dalam suhu antara 0°C sampai 300°C: dikenakan tarif bea masuk sebesar 10%. - Lain-lain: dikenakan tarif bea masuk sebesar 10%. II. PERHIASAN, BARANG HASIL TEMPAAN PANDAI EMAS DAN PERAK SERTA BARANG LAINNYA - Dari logam mulia, disepuh atau dipalut dengan logam mulia maupun tidak: - Dari perak, disepuh atau dipalut dengan logam mulia lainnya: - Bagian: dikenakan tarif bea masuk sebesar 15%. - Lain-lain: dikenakan tarif bea masuk sebesar 15%. - Dari logam mulia lainnya, disepuh atau dipalut dengan logam mulia maupun tidak: - Bagian: dikenakan tarif bea masuk sebesar 15%. - Lain-lain: dikenakan tarif bea masuk sebesar 15%. III. PERALATAN MASAK DAN PERALATAN RUMAH TANGGA - Peralatan masak dan piring pemanas: - Dengan bahan bakar gas atau gabungan gas dan bahan bakar lainnya: dikenakan tarif bea masuk sebesar 20%. - Dengan bahan bakar cair: dikenakan tarif bea masuk sebesar 20%. - Lain-lain, termasuk peralatan dengan bahan bakar padat: dikenakan tarif bea masuk sebesar 20%. IV. PERALATAN PENDINGIN - Kombinasi lemari pendingin-pembeku, dilengkapi dengan pintu luar terpisah: - Tipe rumah tangga: dikenakan tarif bea masuk sebesar 15%. - Lain-lain: dikenakan tarif bea masuk sebesar 15%. MENTERI KEUANGAN REPUBLIK INDONESIA (Nama Pejabat) Berita Negara Republik Indonesia Tahun 2023 Nomor 1. Dengan Rahmat Tuhan Yang Maha Esa MENTERI KEUANGAN REPUBLIK INDONESIA a. Undang-Undang Nomor 10 Tahun 1995 tentang Kepabeanan; b. Undang-Undang Nomor 17 Tahun 2006 tentang Perubahan atas Undang-Undang Nomor 10 Tahun 1995 tentang Kepabeanan; c. Peraturan Pemerintah Nomor 10 Tahun 2012 tentang Pengenaan Tarif Bea Masuk; d. Peraturan Menteri Keuangan Nomor 182/PMK.011/2016 tentang Pengenaan Tarif Bea Masuk. Menetapkan: - Mangan dioksida (HS Code: 8079) dikenakan tarif bea masuk sebesar 15%. - Merkuri oksida (HS Code: 8506.30) dikenakan tarif bea masuk sebesar 15%. - Perak oksida (HS Code: 8506.40) dikenakan tarif bea masuk sebesar 15%. - Litium (HS Code: 8506.50.00.00) dikenakan tarif bea masuk sebesar 15%. - Air-zine (HS Code: 8506.60) dikenakan tarif bea masuk sebesar 15%. - Sel primer dan baterai primer lainnya (HS Code: 8506.80) dikenakan tarif bea masuk sebesar 15%. - Alat cukur, alat pangkas rambut dan peralatan penghilang rambut (HS Code: 8510.20.00.00) dikenakan tarif bea masuk sebesar 15%. - Pemanas air instan atau pemanas air dengan tempat penyimpanan dan pemanas celup listrik (HS Code: 8516.10) dikenakan tarif bea masuk sebesar 15%. - Monitor dan proyektor, tidak digabung dengan aparatus penerima televisi (HS Code: 8528.71) dikenakan tarif bea masuk sebesar 15%. - Lampu pijar atau lampu tabung listrik, termasuk unit lampu sealed beam (HS Code: 8539.21) dikenakan tarif bea masuk sebesar 15%. Tanggal Penetapan: [Tanggal] Nama Pejabat: [Nama Pejabat] Berita Negara: [Jika ada] Demikianlah, agar menjadi perhatian dan dilaksanakan sebagaimana mestinya. Dengan Rahmat Tuhan Yang Maha Esa MENTERI KEUANGAN REPUBLIK INDONESIA a. Undang-Undang Nomor 10 Tahun 1995 tentang Kepabeanan; b. Undang-Undang Nomor 17 Tahun 2006 tentang Perubahan atas Undang-Undang Nomor 10 Tahun 1995 tentang Kepabeanan; c. Peraturan Pemerintah Nomor 20 Tahun 2017 tentang Perubahan atas Peraturan Pemerintah Nomor 1 Tahun 2012 tentang Kebijakan dan Strategi Nasional Pengembangan Ekspor; d. Peraturan Menteri Keuangan Nomor 203/PMK.04/2019 tentang Penetapan Tarif Bea Masuk. Menetapkan: Peraturan Menteri Keuangan tentang Tarif Bea Masuk atas Barang Impor. - Lampu tabung, selain lampu ultra-violet: - Discharge lamps, other than ultra-violet lamps: - Fluoresensi, katoda pijar: - Tabung untuk lampu fluoresensi kompak dikenakan tarif bea masuk sebesar 15%. - Lain-lain dikenakan tarif bea masuk sebesar 15%. - Dengan mesin piston pembakaran dalam nyala kompresi (diesel atau semi diesel): - Dalam keadaan terbongkar lengkap dikenakan tarif bea masuk sebesar 50%. - Lain-lain dikenakan tarif bea masuk sebesar 50%. - Mobil (termasuk limousin panjang tetapi tidak termasuk coach, bus, minibus atau van) dikenakan tarif bea masuk sebesar 50%. - Untuk pengangkutan lebih dari 30 orang dan dirancang khusus untuk digunakan di bandara dikenakan tarif bea masuk sebesar 50%. - Kendaraan dirancang secara khusus untuk perjalanan di atas salju; mobil golf dan kendaraan semacam itu dikenakan tarif bea masuk sebesar 50%. - Kendaraan lainnya, dengan mesin piston pembakaran dalam bolak balik cetus api: - Dengan kapasitas silinder tidak melebihi 1.000 cc dikenakan tarif bea masuk sebesar 50%. - Mobil (termasuk station wagon, SUV dan mobil sport, tetapi tidak termasuk van) dikenakan tarif bea masuk sebesar 50%. - Lain-lain dikenakan tarif bea masuk sebesar 50%. Tanggal Penetapan: [Tanggal] Nama Pejabat: [Nama Pejabat] Berita Negara: [Berita Negara] Dokumen ini telah disusun sesuai dengan ketentuan yang berlaku dan tidak ada bagian yang hilang, serta informasi yang disajikan dalam format deskriptif yang jelas. Dengan Rahmat Tuhan Yang Maha Esa, a. Undang-Undang Nomor 10 Tahun 1995 tentang Kepabeanan; b. Undang-Undang Nomor 17 Tahun 2006 tentang Perubahan atas Undang-Undang Nomor 10 Tahun 1995 tentang Kepabeanan; c. Peraturan Pemerintah Nomor 10 Tahun 2021 tentang Perubahan atas Peraturan Pemerintah Nomor 1 Tahun 2012 tentang Ketentuan Umum dan Tata Cara Perpajakan; d. Peraturan Menteri Keuangan Nomor 182/PMK.04/2016 tentang Penetapan Tarif Bea Masuk. Menetapkan: Peraturan Menteri Keuangan tentang Tarif Bea Masuk atas Barang Impor.",
DOC001,132~PMK.010~2015Per.txt,,,Pasal 1,,1,Barang impor yang dikenakan tarif bea masuk adalah sebagai berikut: - Kendaraan bermotor untuk pengangkutan barang. - Kendaraan bermotor untuk pengangkutan orang. - Kendaraan lainnya.,
DOC001,132~PMK.010~2015Per.txt,,,Pasal 1,,2,Tarif bea masuk untuk setiap kategori barang adalah sebagai berikut: - Kendaraan bermotor dengan kapasitas silinder tidak melebihi 1.500 cc dikenakan tarif 50%. - Kendaraan bermotor dengan kapasitas silinder melebihi 1.500 cc tetapi tidak melebihi 2.500 cc dikenakan tarif 50%. - Kendaraan bermotor dengan kapasitas silinder melebihi 2.500 cc dikenakan tarif 50%.,
DOC001,132~PMK.010~2015Per.txt,,,Pasal 2,,1,Kendaraan dalam keadaan terurai lengkap (CKD) dikenakan tarif bea masuk sebagai berikut: - Kendaraan penggerak empat roda dikenakan tarif 50%. - Kendaraan lainnya dikenakan tarif 50%.,
DOC001,132~PMK.010~2015Per.txt,,,Pasal 2,,2,Rincian tarif bea masuk untuk kendaraan bermotor adalah sebagai berikut: - Lori (truk) pendingin dikenakan tarif 50%. - Kendaraan pengumpul sampah dengan alat pemadat dikenakan tarif 50%. - Kendaraan tangki; lori (truk) semen curah dikenakan tarif 50%. - Kendaraan kargo berlapis baja untuk pengangkutan barang berharga dikenakan tarif 50%. - Lori (truk) Hooklift dikenakan tarif 50%.,
DOC001,132~PMK.010~2015Per.txt,,,Pasal 3,,1,Kendaraan bermotor dengan g.v.w. tidak melebihi 5 t dikenakan tarif bea masuk sebagai berikut: - Lori (truk) pendingin dikenakan tarif 50%. - Kendaraan pengumpul sampah dengan alat pemadat dikenakan tarif 50%. - Kendaraan tangki; lori (truk) semen curah dikenakan tarif 50%. - Kendaraan kargo berlapis baja untuk pengangkutan barang berharga dikenakan tarif 50%.,
DOC001,132~PMK.010~2015Per.txt,,,Pasal 3,,2,"Kendaraan bermotor dengan g.v.w. melebihi 5 t tetapi tidak melebihi 20 t dikenakan tarif bea masuk sebagai berikut: - Lori (truk) pendingin dikenakan tarif 50%. - Kendaraan pengumpul sampah dengan alat pemadat dikenakan tarif 50%. - Kendaraan tangki; lori (truk) semen curah dikenakan tarif 50%. - Kendaraan kargo berlapis baja untuk pengangkutan barang berharga dikenakan tarif 50%. Peraturan ini mulai berlaku pada tanggal ditetapkan. MENTERI KEUANGAN REPUBLIK INDONESIA [Nama Pejabat] Dengan Rahmat Tuhan Yang Maha Esa a. Undang-Undang Nomor 10 Tahun 1995 tentang Kepabeanan; b. Peraturan Pemerintah Nomor 10 Tahun 2021 tentang Perubahan atas Peraturan Pemerintah Nomor 10 Tahun 1995 tentang Kepabeanan; c. Peraturan Menteri Keuangan Nomor 182/PMK.04/2016 tentang Ketentuan Umum dan Tata Cara Kepabeanan; d. Peraturan Menteri Keuangan Nomor 191/PMK.04/2016 tentang Tarif Bea Masuk. Menetapkan: Peraturan Menteri Keuangan tentang Tarif Bea Masuk atas Barang Impor. Berikut adalah rincian tarif bea masuk untuk berbagai jenis barang: - Sepeda motor (termasuk moped) dan sepeda yang dilengkapi dengan motor bantu, dengan atau tanpa kereta samping dikenakan tarif bea masuk sebesar 30%. - Sepeda motor dengan mesin piston pembakaran dalam bolak-balik dengan kapasitas silinder tidak melebihi 50 cc dikenakan tarif 30%. - Sepeda motor lainnya dan skuter dikenakan tarif 30%. - Sepeda roda dua dan sepeda lainnya (termasuk sepeda roda tiga untuk pengantar), tidak bermotor dikenakan tarif 25%. - Kendaraan pengumpul sampah yang mempunyai alat untuk memadatkan sampah dikenakan tarif bea masuk sebesar 50%. - Kendaraan tangki; lori (truk) semen curah dikenakan tarif bea masuk sebesar 50%. - Kendaraan kargo berlapis baja untuk pengangkutan barang berharga dikenakan tarif bea masuk sebesar 50%. - Lori (truk) Hooklift dikenakan tarif bea masuk sebesar 50%. - Alat bantu dengar, tidak termasuk bagian dan aksesori dikenakan tarif bea masuk sebesar 10%. - Piano, termasuk piano otomatis; harpsichord dan instrumen keyboard bersenar lainnya dikenakan tarif bea masuk sebesar 15%. - Perabotan kayu dari jenis yang digunakan di dapur dikenakan tarif bea masuk sebesar 20%. - Perabotan kayu dari jenis yang digunakan di kamar tidur dikenakan tarif bea masuk sebesar 20%. Tanggal Penetapan: [Tanggal] Nama Pejabat: [Nama Pejabat] Berita Negara: [Berita Negara] Dokumen ini telah disusun dengan memperhatikan ketentuan yang berlaku dan menjaga struktur asli dokumen agar tetap utuh. Dengan Rahmat Tuhan Yang Maha Esa MENTERI KEUANGAN REPUBLIK INDONESIA a. Undang-Undang Nomor 10 Tahun 1995 tentang Kepabeanan; b. Peraturan Pemerintah Nomor 10 Tahun 2012 tentang Tarif Bea Masuk; c. Peraturan Menteri Keuangan Nomor 182/PMK.04/2016 tentang Ketentuan Umum dan Tata Cara Kepabeanan. Menetapkan: KEPUTUSAN MENTERI KEUANGAN TENTANG TARIF BEA MASUK ATAS BARANG IMPOR. Berikut adalah rincian barang dan tarif bea masuk yang berlaku: - Baby walker (HS Code: 9403.70.10.00) dikenakan tarif bea masuk sebesar 20%. - Fume cupboard (HS Code: 9403.70.90.00) dikenakan tarif bea masuk sebesar 20%. - Alas kasur (HS Code: 9404.10) dikenakan tarif bea masuk sebesar 15% dengan rincian: - Dari karet atau plastik seluler, disarungi maupun tidak (HS Code: 9404.21.00.00) dikenakan tarif bea masuk sebesar 15%. - Dari bahan lainnya (HS Code: 9404.29.10.00) dikenakan tarif bea masuk sebesar 15%. - Lampu dan alat kelengkapan penerangan (HS Code: 9405.20) dikenakan tarif bea masuk sebesar 15%. - Sepeda roda tiga, skuter, mobil berpedal dan mainan beroda (HS Code: 9503.00.10.00) dikenakan tarif bea masuk sebesar 20%. - Konsol dan mesin video game (HS Code: 9504.50.00.00) dikenakan tarif bea masuk sebesar 15%. - Bolpoin (HS Code: 9608.10.10.00) dikenakan tarif bea masuk sebesar 20%. - Pensil (HS Code: 9609.10) dikenakan tarif bea masuk sebesar 15%. - Handuk dan tampon saniter (HS Code: 9619.00.11.00) dikenakan tarif bea masuk sebesar 20%. MENTERI KEUANGAN REPUBLIK INDONESIA, ttd. BAMBANG P. S. BRODJONEGORO Salinan sesuai dengan aslinya KEPALA BIRO UMUM NIP 198904201984021001",
