doc_id,nama_dokumen,bab,bagian,pasal,angka,ayat,isi,penjelasan
DOC006,2011 PMK 254.txt,BAB VI,,Pasal 17,,1,Perusahaan wajib mempertanggungjawabkan pelaksanaan Ekspor sebagaimana dimaksud dalam Pasal 15 dengan menyerahkan laporan pertanggungjawaban kepada Kepala Kantor Wilayah atau KPU secara berkala paling lama 6 (enam) bulan sekali selama dalam periode Pembebasan.,
DOC006,2011 PMK 254.txt,BAB VI,,Pasal 17,,2,"Laporan pertanggungjawaban sebagaimana dimaksud pada ayat (1) harus dilampiri dengan: a. dokumen pemberitahuan pabean impor yang telah mendapatkan persetujuan keluar pejabat bea dan cukai; b. dokumen pemberitahuan pabean ekspor yang telah mendapat persetujuan Ekspor; c. salinan bukti penerimaan transaksi Ekspor berupa buku piutang, letter of credit, rekening koran, telegraphic transfer dan/atau dokumen yang membuktikan adanya transaksi Ekspor; d. laporan pemeriksaan Ekspor; dan e. daftar konversi dari pemakaian Bahan Baku yang dimintakan Pembebasan sebagaimana dimaksud dalam Pasal 6 ayat (1) huruf e dan Pasal 13 ayat (1).",
DOC006,2011 PMK 254.txt,BAB VI,,Pasal 17,,3,"Terhadap Perusahaan yang tidak menyerahkan konversi sebagaimana dimaksud dalam Pasal 13 ayat (1), Bahan Baku yang digunakan oleh Perusahaan untuk memproduksi Hasil Produksi dimaksud tidak diberi Pembebasan.",
DOC006,2011 PMK 254.txt,BAB VI,,Pasal 17,,4,Ketentuan sebagaimana dimaksud pada ayat (2) huruf a dan huruf b tidak berlaku bagi Perusahaan yang melakukan Impor dan Ekspor barang melalui Kantor Pabean yang telah menerapkan ketentuan Pertukaran Data Elektronik (PDE).,
DOC006,2011 PMK 254.txt,BAB VI,,Pasal 17,,5,"Atas penyampaian laporan pertanggungjawaban sebagaimana dimaksud pada ayat (1), Kepala Kantor Wilayah atau KPU atau pejabat yang ditunjuk melakukan penelitian terhadap: a. kelengkapan dokumen sebagaimana dimaksud pada ayat (2); b. pemenuhan periode Pembebasan, Impor, dan kebenaran pengisian laporan pertanggungjawaban; dan c. kesesuaian konversi dengan jumlah pemakaian Bahan Baku, jumlah Hasil Produksi yang dilaporkan, dan sisa proses produksi (waste/scrap).",
DOC006,2011 PMK 254.txt,BAB VI,,Pasal 17,,6,"Terhadap Hasil Produksi yang wajib diekspor sebagaimana dimaksud dalam Pasal 15, diberikan Pembebasan.",
DOC006,2011 PMK 254.txt,BAB VI,,Pasal 17,,7,"Terhadap sisa proses produksi (waste/scrap) dari Hasil Produksi sebagaimana dimaksud pada ayat (6), dikenakan bea masuk sebesar: a. 5% (lima persen) dikalikan harga jual, apabila tarif bea masuk umum (Most Favoured Nation) Bahan Bakunya 5% (lima persen) atau lebih; atau b. tarif yang berlaku dikalikan harga jual, apabila tarif bea masuk umum (Most Favoured Nation) Bahan Bakunya kurang dari 5% (lima persen).",
DOC006,2011 PMK 254.txt,BAB VI,,Pasal 17,,8,"Terhadap Hasil Produksi, termasuk Hasil Produksi rusak atau reject, yang tidak diekspor atau tidak dilaporkan sampai dengan periode Pembebasan selesai, berlaku ketentuan sebagai berikut: a. jaminan dicairkan sebesar bea masuk atas Bahan Baku yang terkandung dalam Hasil Produksi dimaksud; dan b. Perusahaan dikenai sanksi administrasi berupa denda sesuai peraturan perundang-undangan di bidang kepabeanan.",
DOC006,2011 PMK 254.txt,BAB VI,,Pasal 17,,9,"Terhadap Bahan Baku, termasuk Bahan Baku rusak atau reject, yang sampai periode Pembebasan selesai tidak diolah, tidak dirakit, tidak dipasang, tidak diekspor, atau tidak dilaporkan dalam laporan pertanggungjawaban, berlaku ketentuan sebagai berikut: a. jaminan dicairkan sebesar bea masuk atas Bahan Baku dimaksud; dan b. Perusahaan dikenai sanksi administrasi berupa denda sesuai peraturan perundang-undangan di bidang kepabeanan.",
DOC006,2011 PMK 254.txt,BAB VI,,Pasal 17,,10,"Atas penyampaian laporan pertanggungjawaban sebagaimana dimaksud pada ayat (1), Kepala Kantor Wilayah atau KPU atau pejabat yang ditunjuk menyetujui atau menolak dalam jangka waktu paling lama 45 (empat puluh lima) hari kerja sejak laporan pertanggungjawaban diterima.",
DOC006,2011 PMK 254.txt,BAB VI,,Pasal 17,,11,"Dalam hal laporan pertanggungjawaban sebagaimana dimaksud pada ayat (1) disetujui, jaminan dikembalikan sebesar bea masuk dari Bahan Baku yang hasil produksinya diekspor.",
DOC006,2011 PMK 254.txt,BAB VI,,Pasal 17,,12,"Dalam hal laporan pertanggungjawaban sebagaimana dimaksud pada ayat (1) tidak diserahkan dalam jangka waktu periode Pembebasan sebagaimana dimaksud dalam Pasal 7 atau laporan pertanggungjawaban sebagaimana dimaksud pada ayat (1) ditolak, berlaku ketentuan sebagai berikut: a. jaminan dicairkan sebesar bea masuk atas Bahan Baku yang belum dipertanggungjawabkan atau yang ditolak pertanggungjawabannya; dan b. Perusahaan dikenai sanksi administrasi berupa denda sesuai peraturan perundang-undangan di bidang kepabeanan. MONITORING DAN EVALUASI",
DOC006,2011 PMK 254.txt,BAB VII,,Pasal 18,,1,Kepala Kantor Wilayah atau KPU atau pejabat yang ditunjuk melakukan monitoring dan evaluasi terhadap penerbitan NIPER Pembebasan secara periodik paling sedikit sekali dalam 1 (satu) tahun sejak tanggal Surat Keputusan Penerbitan NIPER.,
DOC006,2011 PMK 254.txt,BAB VII,,Pasal 18,,2,"Berdasarkan manajemen risiko, Kepala Kantor Wilayah atau KPU atau pejabat yang ditunjuk dapat melakukan pemeriksaan lapangan terhadap persediaan Bahan Baku, barang dalam proses, Hasil Produksi dan sisa proses produksi.",
DOC006,2011 PMK 254.txt,BAB VII,,Pasal 18,,3,"Dalam rangka pengawasan dan pelayanan fasilitas Pembebasan, Direktur Jenderal Bea dan Cukai dapat menentukan Kantor Wilayah atau KPU tempat pengawasan dan pelayanan fasilitas Pembebasan.",
DOC006,2011 PMK 254.txt,BAB VII,,Pasal 19,,1,Hasil pemeriksaan lapangan sebagaimana dimaksud dalam Pasal 18 ayat (2) dan laporan hasil audit kepabeanan dapat dijadikan dasar untuk melakukan evaluasi atas fasilitas Pembebasan yang telah diberikan dan pertanggungjawaban penyelesaian Bahan Baku.,
DOC006,2011 PMK 254.txt,BAB VII,,Pasal 19,,2,"Dalam hal berdasarkan hasil audit ditemukan selisih fisik Bahan Baku yang melebihi jumlah bahan baku sebagaimana tercantum dalam laporan Bahan Baku yang sudah dipertanggungjawabkan sebagaimana dimaksud dalam Pasal 17, Perusahaan wajib membayar bea masuk dan sanksi administrasi berupa denda sesuai peraturan perundang-undangan di bidang kepabeanan.",
DOC006,2011 PMK 254.txt,BAB VII,,Pasal 19,,3,Pelaksanaan audit dalam periode tertentu tidak menghilangkan: a. kewajiban Perusahaan untuk menyampaikan laporan pertanggungjawaban pada periode audit dimaksud; dan b. tidak menghilangkan proses pencairan jaminan atas pemberitahuan pabean impor yang diluar periode audit dimaksud. SANKSI Bagian Pertama Pembekuan dan Pencabutan NIPER Pembebasan,
DOC006,2011 PMK 254.txt,BAB VIII,,Pasal 20,,1,"NIPER Pembebasan dibekukan dalam hal Perusahaan: a. tidak mengajukan permohonan perubahan data NIPER Pembebasan sebagaimana dimaksud dalam Pasal 5; b. tidak melunasi utang bea masuk, pajak dalam rangka impor, dan/atau sanksi administrasi berupa denda sampai dengan jatuh tempo; c. tidak menyampaikan laporan pertanggungjawaban sebagaimana dimaksud dalam Pasal 17; d. tidak menyerahkan dokumen yang diperlukan dalam pelaksanaan monitoring dan evaluasi sebagaimana dimaksud dalam Pasal 18; dan/atau e. diduga melakukan tindak pidana di bidang kepabeanan dengan bukti permulaan yang cukup.",
DOC006,2011 PMK 254.txt,BAB VIII,,Pasal 20,,2,"Dalam hal NIPER Pembebasan dibekukan, Perusahaan tidak dapat memperoleh fasilitas Pembebasan atas Impor Bahan Baku sebagaimana dimaksud dalam Pasal 2 ayat (1). NIPER Pembebasan yang dibekukan sebagaimana dimaksud dalam Pasal 20 dapat diberlakukan kembali, dalam hal Perusahaan: a. telah mendapatkan persetujuan perubahan data NIPER Pembebasan; b. telah melunasi seluruh utang bea masuk, pajak dalam rangka impor, dan/atau sanksi administrasi berupa denda; c. telah menyampaikan laporan pertanggungjawaban sebagaimana dimaksud dalam Pasal 16; d. telah menyerahkan dokumen yang diperlukan dalam pelaksanaan monitoring dan evaluasi; dan/atau e. tidak terbukti melakukan tindak pidana kepabeanan.",
DOC006,2011 PMK 254.txt,BAB VIII,,Pasal 22,,1,"NIPER Pembebasan dicabut dalam hal Perusahaan: a. tidak mengajukan permohonan perubahan data NIPER Pembebasan sebagaimana dimaksud dalam Pasal 5 dalam jangka waktu 30 (tiga puluh) hari sejak tanggal pembekuan NIPER Pembebasan sebagaimana dimaksud dalam Pasal 20 ayat (1) huruf a; b. tidak melunasi seluruh utang bea masuk, pajak dalam rangka impor, dan/atau sanksi administrasi berupa denda sebagaimana dimaksud dalam Pasal 20 ayat (1) huruf b sampai dengan diterbitkannya surat paksa; c. tidak melakukan Impor atau Ekspor dengan fasilitas Pembebasan secara berturut-turut dalam jangka waktu sebagaimana dimaksud dalam Pasal 7 ayat (2) huruf a dan Pasal 7 ayat (2) huruf b; d. melakukan pembongkaran dan/atau penimbunan Bahan Baku di luar lokasi yang tercantum dalam NIPER Pembebasan sebagaimana dimaksud dalam Pasal 12 ayat (1) dan tidak diberikan persetujuan oleh Kepala Kantor Wilayah atau KPU sebagaimana dimaksud dalam Pasal 12 ayat (2); e. tidak melakukan sendiri kegiatan pengolahan, perakitan, dan/atau pemasangan sebagaimana dimaksud dalam Pasal 13; f. melakukan subkontrak tanpa memenuhi kriteria sebagaimana dimaksud dalam Pasal 14 ayat (1); g. melakukan subkontrak tanpa memenuhi persyaratan sebagaimana dimaksud dalam Pasal 14 ayat (2); h. bertindak tidak jujur dalam usahanya, antara lain membuat konversi yang tidak benar dan mengakibatkan kerugian negara; i. terbukti telah melakukan tindak pidana di bidang kepabeanan berdasarkan putusan pengadilan; j. berubah status menjadi Pengusaha Kawasan Berikat atau Pengusaha di Kawasan Berikat; k. dinyatakan pailit berdasarkan putusan pengadilan; l. tidak menyelenggarakan pembukuan berdasarkan prinsip-prinsip akuntansi yang berlaku umum di Indonesia; m. mempunyai laporan keuangan yang dinyatakan oleh Kantor Akuntan Publik dengan opini disclaimer atau adverse; n. tidak menyimpan dan memelihara dengan baik pada tempat usahanya buku dan catatan serta dokumen yang berkaitan dengan kegiatan usahanya selama 10 (sepuluh) tahun; o. tidak menyerahkan buku, catatan, dan/atau dokumen yang berkaitan dengan kegiatan usahanya berdasarkan Laporan Hasil Audit Kepabeanan dan/atau Cukai; p. tidak memenuhi persyaratan mempunyai reputasi yang sangat baik sebagaimana dimaksud dalam Pasal 3 ayat (2) huruf a; q. tidak memenuhi persyaratan untuk memperoleh NIPER Pembebasan sebagaimana dimaksud dalam Pasal 3 ayat (2) berdasarkan hasil evaluasi dan monitoring sebagaimana dimaksud dalam Pasal 18 ayat (1); dan/atau r. mengajukan permohonan untuk dilakukan pencabutan NIPER Pembebasan. Dalam hal NIPER Pembebasan dicabut, badan usaha wajib melunasi seluruh tagihan yang terutang sesuai peraturan perundang-undangan di bidang kepabeanan.",
DOC006,2011 PMK 254.txt,BAB VIII,,Pasal 22,,3,"Dalam hal NIPER Pembebasan dicabut karena perubahan status menjadi Pengusaha Kawasan Berikat atau Pengusaha di Kawasan Berikat sebagaimana dimaksud pada ayat (1) huruf j, atas Bahan Baku yang belum diselesaikan kewajiban kepabeanannya, sepanjang masih dalam periode Pembebasan, dapat dijadikan saldo awal Kawasan Berikat dan diperlakukan sebagai barang Impor dengan mendapat penangguhan Bea Masuk.",
DOC006,2011 PMK 254.txt,BAB VIII,,Pasal 22,,4,"Dalam rangka pencabutan NIPER Pembebasan, dapat terlebih dahulu dilakukan audit kepabeanan. Bagian Kedua Denda Perusahaan dikenai sanksi administrasi berupa denda sebesar paling sedikit 100% (seratus persen) dan paling banyak 500% (lima ratus persen) dari bea masuk yang seharusnya dibayar, dalam hal Perusahaan: a. tidak membongkar dan/atau menimbun Bahan Baku yang mendapat Pembebasan di lokasi yang tercantum dalam NIPER Pembebasan atau di lokasi lain yang telah mendapat persetujuan Kepala Kantor Wilayah atau KPU, sebagaimana dimaksud dalam Pasal 12 ayat (1) dan Pasal 12 ayat (2); b. tidak melakukan sendiri seluruh pengolahan, perakitan, dan/atau pemasangan sebagaimana dimaksud dalam Pasal 13; c. tidak mengekspor Hasil Produksi sebagaimana dimaksud dalam Pasal 15 atau tidak melaporkan sampai dengan periode pembebasan sebagaimana dimaksud dalam Pasal 17 ayat (8); d. tidak mengolah Bahan Baku dengan mendapatkan Pembebasan sesuai ketentuan sebagaimana dimaksud dalam Pasal 17 ayat (9); e. sampai dengan batas periode Pembebasan, laporan pertanggungjawaban Ekspor tidak disampaikan atau ditolak sebagaimana dimaksud dalam Pasal 17 ayat (12); f. tidak memenuhi ketentuan subkontrak sebagaimana dimaksud dalam Pasal 14; dan/atau g. ditemukan selisih fisik Bahan Baku melebihi laporan Bahan Baku yang sudah dipertanggungjawabkan sebagaimana dimaksud dalam Pasal 19 ayat (2). Denda sebagaimana dimaksud dalam Pasal 23 merupakan denda yang ditetapkan secara berjenjang sesuai peraturan perundang-undangan yang mengatur mengenai sanksi administrasi berupa denda di bidang kepabeanan. KETENTUAN LAIN-LAIN",
DOC006,2011 PMK 254.txt,BAB IX,,Pasal 25,,1,Perlakuan perpajakan atas Impor Bahan Baku oleh Perusahaan yang memperoleh NIPER Pembebasan sesuai peraturan perundang-undangan di bidang perpajakan.,
DOC006,2011 PMK 254.txt,BAB IX,,Pasal 25,,2,"Perlakuan cukai atas Impor barang kena cukai oleh Perusahaan yang memperoleh NIPER Pembebasan sesuai peraturan perundang-undangan di bidang perpajakan. Dengan Rahmat Tuhan Yang Maha Esa a. Undang-Undang Nomor 10 Tahun 1995 tentang Kepabeanan (Lembaran Negara Republik Indonesia Tahun 1995 Nomor 75, Tambahan Lembaran Negara Nomor 3612); b. Undang-Undang Nomor 17 Tahun 2006 tentang Perubahan atas Undang-Undang Nomor 10 Tahun 1995 tentang Kepabeanan (Lembaran Negara Republik Indonesia Tahun 2006 Nomor 93, Tambahan Lembaran Negara Nomor 4661); c. Peraturan Pemerintah Nomor 28 Tahun 2008 tentang Pengenaan Sanksi Administrasi Berupa Denda di Bidang Kepabeanan (Lembaran Negara Republik Indonesia Tahun 2008 Nomor 53, Tambahan Lembaran Negara Republik Indonesia Nomor 4838); d. Keputusan Presiden Nomor 56/P Tahun 2010; Menetapkan: PERATURAN MENTERI KEUANGAN TENTANG PEMBEBASAN BEA MASUK ATAS IMPOR BARANG DAN BAHAN UNTUK DIOLAH, DIRAKIT, ATAU DIPASANG PADA BARANG LAIN DENGAN TUJUAN UNTUK DIEKSPOR. KETENTUAN UMUM Dalam Peraturan Menteri ini yang dimaksud dengan:",
DOC006,2011 PMK 254.txt,BAB I,,Pasal 2,,1,"Terhadap impor Bahan Baku untuk diolah, dirakit, atau dipasang pada barang lain dengan tujuan untuk diekspor dapat diberikan Pembebasan.",
DOC006,2011 PMK 254.txt,BAB I,,Pasal 2,,2,"Pengertian diolah sebagaimana dimaksud pada ayat (1) adalah serangkaian kegiatan yang terdiri lebih dari satu tahapan kegiatan yang bertujuan untuk mengubah sifat dan fungsi awal suatu Bahan Baku, sehingga menjadi barang Hasil Produksi yang mempunyai nilai tambah.",
DOC006,2011 PMK 254.txt,BAB I,,Pasal 2,,3,Pengertian dirakit sebagaimana dimaksud pada ayat (1) adalah kegiatan berupa merangkai beberapa komponen bahan dan/atau barang sehingga menghasilkan Hasil Produksi atau alat/barang yang memiliki fungsi yang berbeda dengan Bahan Baku dan/atau barang komponen awal.,
DOC006,2011 PMK 254.txt,BAB I,,Pasal 2,,4,"Pengertian dipasang sebagaimana dimaksud pada ayat (1) adalah kegiatan untuk menyatukan beberapa komponen bahan dan/atau barang pada bagian utama barang jadi yang tanpa ada penyatuan komponen bahan dan/atau barang tersebut, Hasil Produksi tersebut tidak dapat berfungsi.",
DOC006,2011 PMK 254.txt,BAB I,,Pasal 2,,5,"Tidak termasuk dalam pengertian diolah sebagaimana dimaksud pada ayat (2) adalah kegiatan yang semata-mata hanya melakukan pemotongan, penyortiran, pengepakan, dan/atau kegiatan sejenis lainnya.",
DOC006,2011 PMK 254.txt,BAB I,,Pasal 2,,6,Pembebasan sebagaimana dimaksud pada ayat (1) tidak diberikan terhadap: a. Bahan Baku yang habis terpakai dalam proses produksi; dan/atau b. Bahan penolong yang dipergunakan dalam proses produksi yang tidak menjadi bagian integral dari hasil produksi. PENETAPAN NIPER PEMBEBASAN,
DOC006,2011 PMK 254.txt,BAB II,,Pasal 3,,1,Pembebasan sebagaimana dimaksud dalam Pasal 2 ayat (1) dapat diberikan kepada badan usaha yang telah memperoleh NIPER Pembebasan.,
DOC006,2011 PMK 254.txt,BAB II,,Pasal 3,,2,"Untuk memperoleh NIPER Pembebasan, badan usaha harus memenuhi persyaratan sebagai berikut: a. mempunyai reputasi yang sangat baik; b. tidak pernah menyalahgunakan fasilitas di bidang kepabeanan selama 1 (satu) tahun terakhir; c. tidak pernah melakukan kesalahan dalam memberitahukan jumlah dan/atau jenis barang selama 1 (satu) tahun terakhir dalam kegiatan Impor dan Ekspor; d. tidak mempunyai tunggakan utang bea masuk dan pajak dalam rangka impor; e. melakukan pengolahan, perakitan, dan/atau pemasangan pada barang lain sebagaimana dimaksud dalam Pasal 2 yang hasil produksinya untuk tujuan Ekspor; f. memiliki atau menguasai lokasi untuk kegiatan produksi, tempat penimbunan Bahan Baku, dan tempat penimbunan Hasil Produksi; g. menyelenggarakan pembukuan berdasarkan prinsip-prinsip akuntansi yang berlaku umum di Indonesia; h. mempunyai laporan keuangan yang telah diaudit oleh kantor akuntan publik dengan hasil audit yang menyatakan bahwa badan usaha tersebut tidak mendapatkan opini disclaimer atau adverse; dan i. mendayagunakan sistem informasi berbasis komputer untuk pengelolaan atas pemakaian Bahan Baku dalam proses produksi badan usaha yang bersangkutan yang dapat diakses untuk kepentingan pemeriksaan oleh Direktorat Jenderal Bea dan Cukai.",
DOC006,2011 PMK 254.txt,BAB II,,Pasal 3,,3,"Untuk memperoleh NIPER Pembebasan sebagaimana dimaksud pada ayat (1), badan usaha mengajukan permohonan kepada Kepala Kantor Wilayah atau KPU yang memiliki wilayah kerja yang mengawasi lokasi pabrik badan usaha yang bersangkutan, dengan melampirkan: a. copy nomor identitas kepabeanan; b. copy bukti kepemilikan atau penguasaan lokasi atas gudang penimbunan Bahan Baku, pabrik tempat proses produksi, dan gudang penimbunan barang hasil produksi; c. copy izin usaha industri beserta perubahannya; d. daftar badan usaha penerima sub kontrak; dan e. daftar rencana Hasil Produksi dan Bahan Baku.",
DOC006,2011 PMK 254.txt,BAB II,,Pasal 3,,4,"Dalam hal badan usaha mempunyai lebih dari 1 (satu) lokasi pabrik, pengajuan permohonan untuk memperoleh NIPER Pembebasan ditujukan kepada Kepala Kantor Wilayah atau KPU yang mengawasi lokasi pabrik yang mempunyai volume kegiatan Impor terbesar.",
DOC006,2011 PMK 254.txt,BAB II,,Pasal 3,,5,"Atas permohonan sebagaimana dimaksud pada ayat (3), Kepala Kantor Wilayah atau KPU atau pejabat yang ditunjuk melakukan penelitian administratif dan pemeriksaan lapangan.",
DOC006,2011 PMK 254.txt,BAB II,,Pasal 3,,6,"Kepala Kantor Wilayah atau KPU memberikan persetujuan atau penolakan atas permohonan sebagaimana dimaksud pada ayat (3), dalam jangka waktu paling lama 45 (empat puluh lima) hari kerja terhitung sejak permohonan diterima secara lengkap.",
DOC006,2011 PMK 254.txt,BAB II,,Pasal 3,,7,"Dalam hal permohonan sebagaimana dimaksud pada ayat (3) disetujui, Kepala Kantor Wilayah atau KPU atas nama Menteri menerbitkan NIPER Pembebasan.",
DOC006,2011 PMK 254.txt,BAB II,,Pasal 3,,8,"Dalam hal permohonan sebagaimana dimaksud pada ayat (3) ditolak, Kepala Kantor Wilayah atau KPU menyampaikan surat pemberitahuan dengan menyebutkan alasan penolakan. Badan usaha yang pernah melakukan tindak pidana kepabeanan dan/atau cukai yang telah mempunyai kekuatan hukum yang tetap dan/atau yang telah dinyatakan pailit oleh pengadilan dan/atau Orang yang bertanggungjawab terhadap badan usaha yang pernah melakukan tindak pidana kepabeanan dan/atau cukai yang telah mempunyai kekuatan hukum yang tetap dan/atau yang telah dinyatakan pailit oleh pengadilan, tidak dapat diberikan NIPER Pembebasan untuk jangka waktu selama 10 (sepuluh) tahun terhitung sejak selesai menjalani hukuman pidana dan/atau penetapan pailit. Dalam hal terdapat perubahan data dalam NIPER Pembebasan, Perusahaan harus mengajukan permohonan kepada Kepala Kantor Wilayah atau KPU untuk dilakukan perubahan data NIPER Pembebasan dimaksud. PEMBEBASAN Bagian Pertama Permohonan Pembebasan",
DOC006,2011 PMK 254.txt,BAB III,,Pasal 6,,1,"Untuk memperoleh Pembebasan sebagaimana dimaksud dalam Pasal 2 ayat (1), Perusahaan harus mengajukan permohonan kepada Kepala Kantor Wilayah atau KPU yang menerbitkan NIPER Pembebasan dengan melampirkan: a. rencana Impor yang mencantumkan perkiraan jumlah dan nilai kebutuhan Bahan Baku yang diperlukan dalam periode Pembebasan dan daftar pelabuhan tempat pembongkaran; b. rencana Ekspor yang mencantumkan perkiraan jumlah dan nilai Hasil Produksi yang dihasilkan dalam periode Pembebasan; c. penjelasan tertulis mengenai masa produksi, yaitu jangka waktu yang dibutuhkan oleh Perusahaan untuk melakukan produksi; d. izin Impor dari instansi terkait dalam hal atas pemasukan Bahan Baku tersebut diberlakukan ketentuan pembatasan; e. konversi, berupa suatu pernyataan tertulis dari Perusahaan mengenai komposisi pemakaian bahan baku untuk setiap satuan Hasil Produksi; dan f. kontrak Ekspor.",
DOC006,2011 PMK 254.txt,BAB III,,Pasal 6,,2,"Dalam hal tertentu berdasarkan manajemen risiko, Kepala Kantor Wilayah atau KPU dapat meminta pengesahan konversi sebagaimana dimaksud pada ayat (1) huruf e kepada instansi teknis terkait atau oleh lembaga profesional yang diakui oleh instansi teknis terkait.",
DOC006,2011 PMK 254.txt,BAB III,,Pasal 6,,3,Segala biaya yang timbul akibat permintaan pengesahan konversi sebagaimana dimaksud pada ayat (2) dibebankan kepada Perusahaan.,
DOC006,2011 PMK 254.txt,BAB III,,Pasal 6,,4,"Atas permohonan untuk memperoleh Pembebasan sebagaimana dimaksud pada ayat (1), Kepala Kantor Wilayah atau KPU memberikan persetujuan atau penolakan dalam jangka waktu paling lama 14 (empat belas) hari kerja terhitung sejak permohonan diterima secara lengkap.",
DOC006,2011 PMK 254.txt,BAB III,,Pasal 6,,5,"Dalam hal permohonan sebagaimana dimaksud pada ayat (1) disetujui, Kepala Kantor Wilayah atau KPU atas nama Menteri menerbitkan keputusan mengenai Pembebasan yang menetapkan rincian jenis dan jumlah Bahan Baku yang diberikan Pembebasan, periode Pembebasan, pelabuhan tempat pembongkaran, dan jangka waktu berlakunya keputusan mengenai Pembebasan. PERLAKUAN BEA KELUAR",
DOC006,2011 PMK 254.txt,BAB IV,,Pasal 26,,1,"Perusahaan yang telah menerima fasilitas Pembebasan, tidak dapat memanfaatkan fasilitas kepabeanan untuk kawasan berikat.",
DOC006,2011 PMK 254.txt,BAB IV,,Pasal 26,,2,"Dalam hal Perusahaan akan memanfaatkan fasilitas kepabeanan untuk kawasan berikat, Perusahaan harus beralih dari penerima fasilitas Pembebasan menjadi perusahaan penerima fasilitas kepabeanan untuk kawasan berikat.",
