doc_id,nama_dokumen,bab,bagian,pasal,angka,ayat,isi,penjelasan
DOC056,bn1006-2015.txt,,,Pasal 6,,1,Importir harus mengetahui peraturan perundang-undangan di bidang Impor yang berlaku di Negara Kesatuan Republik Indonesia sebelum melakukan Impor.,
DOC056,bn1006-2015.txt,,,Pasal 6,,2,Informasi mengenai peraturan perundang-undangan di bidang Impor sebagaimana dimaksud pada ayat (1) dapat diakses oleh Importir melalui portal http://inatrade.kemendag.go.id.,
DOC056,bn1006-2015.txt,,,Pasal 7,,1,Importir wajib memiliki perizinan Impor atas Barang yang dibatasi impornya sebagaimana dimaksud dalam Pasal 5 sebelum Barang masuk ke dalam daerah pabean.,
DOC056,bn1006-2015.txt,,,Pasal 7,,2,Importir yang tidak memiliki perizinan Impor sebagaimana dimaksud pada ayat (1) pada saat Barang yang diimpor masuk ke dalam daerah pabean dikenai sanksi pembekuan API dan sanksi lain sesuai peraturan perundang-undangan yang berlaku.,
DOC056,bn1006-2015.txt,,,Pasal 7,,3,Terhadap Barang yang diimpor tidak memiliki perizinan sebagaimana dimaksud pada ayat (1) wajib diekspor kembali oleh Importir.,
DOC056,bn1006-2015.txt,,,Pasal 8,,1,Perizinan di bidang Impor diterbitkan oleh Menteri atau pejabat yang diberi wewenang untuk menerbitkan perizinan.,
DOC056,bn1006-2015.txt,,,Pasal 8,,2,"Menteri dapat melimpahkan atau mendelegasikan penerbitan perizinan sebagaimana dimaksud pada ayat (1) kepada instansi atau dinas teknis terkait. Pada saat Peraturan Menteri ini mulai berlaku, Peraturan Menteri Perdagangan Nomor 54/M-DAG/PER/10/2009 tentang Ketentuan Umum di Bidang Impor dicabut dan dinyatakan tidak berlaku. Peraturan Menteri ini mulai berlaku pada tanggal 1 Januari 2016. Agar setiap orang mengetahuinya, memerintahkan pengundangan Peraturan Menteri ini dengan penempatannya dalam Berita Negara Republik Indonesia. MENTERI PERDAGANGAN REPUBLIK INDONESIA, RACHMAT GOBEL Diundangkan di Jakarta pada tanggal 6 Juli 2015 MENTERI HUKUM DAN HAK ASASI MANUSIA REPUBLIK INDONESIA, YASONNA H. LAOLY",
