doc_id,nama_dokumen,bab,bagian,pasal,angka,ayat,isi,penjelasan
DOC116,bn1186-2022.txt,,,Pasal 1,,1,"Terhadap impor produk I dan H section dari baja paduan lainnya, dikenakan Bea Masuk Tindakan Pengamanan.",
DOC116,bn1186-2022.txt,,,Pasal 1,,2,"Produk impor berupa I dan H section dari baja paduan lainnya sebagaimana dimaksud pada ayat (1), yakni: a. I section dengan tinggi 100 mm (seratus milimeter) sampai dengan 600 mm (enam ratus milimeter) dan H section dengan tinggi 100 mm (seratus milimeter) sampai dengan 350 mm (tiga ratus lima puluh milimeter), dari baja paduan lainnya, yang tidak dikerjakan lebih lanjut selain dicanai panas, ditarik panas atau diekstrusi, yang termasuk dalam pos tarif HS ex7228.70.10; dan b. I section dengan tinggi 100 mm (seratus milimeter) sampai dengan 600 mm (enam ratus milimeter) dan H section dengan tinggi 100 mm (seratus milimeter) sampai dengan 350 mm (tiga ratus lima puluh milimeter), dari baja paduan lainnya, dicanai panas, ditarik panas atau diekstrusi yang dikerjakan lebih lanjut, yang termasuk dalam pos tarif HS ex7228.70.90. Bea Masuk Tindakan Pengamanan sebagaimana dimaksud dalam Pasal 1 dikenakan selama 2 (dua) tahun dengan ketentuan sebagai berikut: - Tahun pertama, dengan periode 1 (satu) tahun terhitung sejak tanggal berlakunya Peraturan Menteri ini, dikenakan tarif 17,00%. - Tahun kedua, dengan periode 1 (satu) tahun terhitung setelah tanggal berakhirnya tahun pertama, dikenakan tarif 16,75%. Pengenaan Bea Masuk Tindakan Pengamanan sebagaimana dimaksud dalam Pasal 1 merupakan tambahan dari: a. bea masuk umum (Most Favoured Nation); atau b. bea masuk preferensi berdasarkan perjanjian atau kesepakatan internasional, yang telah dikenakan.",
DOC116,bn1186-2022.txt,,,Pasal 4,,1,Bea Masuk Tindakan Pengamanan sebagaimana dimaksud dalam Pasal 1 dikenakan terhadap importasi produk I dan H section dari baja paduan lainnya dari semua negara.,
DOC116,bn1186-2022.txt,,,Pasal 4,,2,"Pengenaan Bea Masuk Tindakan Pengamanan sebagaimana dimaksud pada ayat (1), dikecualikan terhadap importasi produk I dan H section dari baja paduan lainnya yang berasal dari negara sebagaimana tercantum dalam Lampiran yang merupakan bagian tidak terpisahkan dari Peraturan Menteri ini.",
DOC116,bn1186-2022.txt,,,Pasal 5,,1,"Terhadap impor produk I dan H section dari baja paduan lainnya yang berasal dari negara yang dikecualikan dari pengenaan Bea Masuk Tindakan Pengamanan sebagaimana dimaksud dalam Pasal 4 ayat (2), importir wajib menyerahkan dokumen surat keterangan asal (certificate of origin).",
DOC116,bn1186-2022.txt,,,Pasal 5,,2,"Dalam hal importasi sebagaimana dimaksud pada ayat (1) menggunakan surat keterangan asal (certificate of origin) preferensi, barang impor wajib memenuhi ketentuan asal barang berdasarkan perjanjian atau kesepakatan internasional.",
DOC116,bn1186-2022.txt,,,Pasal 5,,3,Ketentuan asal barang sebagaimana dimaksud pada ayat (2) harus memenuhi: a. kriteria asal barang (origin criteria); b. kriteria pengiriman (consignment criteria); dan c. ketentuan prosedural (procedural provisions).,
DOC116,bn1186-2022.txt,,,Pasal 5,,4,"Penelitian terhadap surat keterangan asal (certificate of origin) preferensi sebagaimana dimaksud pada ayat (2), dilaksanakan sesuai dengan ketentuan peraturan perundang-undangan mengenai pengenaan tarif bea masuk atas barang impor berdasarkan perjanjian atau kesepakatan internasional.",
DOC116,bn1186-2022.txt,,,Pasal 5,,5,"Dalam hal surat keterangan asal (certificate of origin) sebagaimana dimaksud pada ayat (1) menggunakan surat keterangan asal (certificate of origin) non-preferensi, penelitian surat keterangan asal (certificate of origin) dilakukan berdasarkan ketentuan peraturan perundang-undangan di bidang perdagangan. Dalam hal importasi produk I dan H section dari baja paduan lainnya berasal dari negara yang dikecualikan dari pengenaan Bea Masuk Tindakan Pengamanan sebagaimana dimaksud pada Pasal 4 ayat (2) tidak memenuhi ketentuan sebagaimana dimaksud dalam Pasal 5, atas importasi tersebut dipungut Bea Masuk Tindakan Pengamanan. Dalam hal surat keterangan asal sebagaimana dimaksud pada Pasal 5 ayat (2) sedang dilakukan permintaan retroactive check, atas importasi produk I dan H section dari baja paduan lainnya yang berasal dari negara yang dikecualikan dari pengenaan Bea Masuk Tindakan Pengamanan sebagaimana dimaksud pada Pasal 4 ayat (2) dipungut Bea Masuk Tindakan Pengamanan. Besaran Bea Masuk Tindakan Pengamanan sebagaimana dimaksud dalam Pasal 2 berlaku terhadap barang impor produk I dan H section dari baja paduan lainnya yang: a. dokumen pemberitahuan pabean impornya telah mendapat nomor pendaftaran dari kantor pabean tempat penyelesaian kewajiban pabean, dalam hal penyelesaian kewajiban pabean dilakukan dengan pengajuan pemberitahuan pabean; atau b. tarif dan nilai pabeannya ditetapkan oleh kantor pabean tempat penyelesaian kewajiban pabean, dalam hal penyelesaian kewajiban pabean dilakukan tanpa pengajuan pemberitahuan pabean. Terhadap pemasukan dan/atau pengeluaran barang ke dan dari kawasan perdagangan bebas dan pelabuhan bebas, tempat penimbunan berikat, atau kawasan ekonomi khusus, dilaksanakan sesuai dengan ketentuan peraturan perundang-undangan mengenai pemasukan dan/atau pengeluaran barang ke dan dari kawasan perdagangan bebas dan pelabuhan bebas, tempat penimbunan berikat, atau kawasan ekonomi khusus. Peraturan Menteri ini mulai berlaku setelah 14 (empat belas) hari kerja terhitung sejak tanggal diundangkan. Agar setiap orang mengetahuinya, memerintahkan pengundangan Peraturan Menteri ini dengan penempatannya dalam Berita Negara Republik Indonesia. Menteri Keuangan Republik Indonesia, ttd Sri Mulyani Indrawati Diundangkan di Jakarta pada tanggal 2 Desember 2022 Menteri Hukum dan Hak Asasi Manusia Republik Indonesia, ttd Yasonna H. Laoly Lampiran Peraturan Menteri Keuangan Republik Indonesia Nomor 169/PMK.010/2022 Tentang Pengenaan Bea Masuk Tindakan Pengamanan Terhadap Impor Produk I dan H Section dari Baja Paduan Lainnya Daftar Negara yang Dikecualikan dari Pengenaan Bea Masuk Tindakan Pengamanan Terhadap Impor Produk I dan H Section dari Baja Paduan Lainnya No. | Nama Negara Menteri Keuangan Republik Indonesia, ttd Sri Mulyani Indrawati",
