doc_id,nama_dokumen,bab,bagian,pasal,angka,ayat,isi,penjelasan
DOC156,bn1375-2016.txt,,,Pasal 1,,1,Barang yang diimpor ke dalam wilayah Indonesia dikenakan tarif bea masuk sesuai dengan ketentuan yang berlaku.,
DOC156,bn1375-2016.txt,,,Pasal 1,,2,"Daftar barang dan tarif bea masuknya sebagaimana tercantum dalam lampiran yang merupakan bagian tidak terpisahkan dari peraturan ini. Tarif bea masuk untuk barang-barang tertentu adalah sebagai berikut: - Mesin, instalasi, dan perlengkapan lainnya: - Untuk membuat minuman panas atau untuk memasak atau memanaskan makanan: - Mesin yang dioperasikan secara elektrik dikenakan tarif bea masuk sebesar 20%. - Mesin yang tidak dioperasikan secara elektrik dikenakan tarif bea masuk sebesar 20%.",
DOC156,bn1375-2016.txt,,,Pasal 3,,1,Ketentuan lebih lanjut mengenai pelaksanaan peraturan ini diatur dalam keputusan Direktur Jenderal Bea dan Cukai.,
DOC156,bn1375-2016.txt,,,Pasal 3,,2,"Peraturan ini mulai berlaku pada tanggal ditetapkan. Menteri Keuangan Republik Indonesia Berita Negara Republik Indonesia Tahun 2023 Nomor 1234. Dengan Rahmat Tuhan Yang Maha Esa a. bahwa untuk melaksanakan ketentuan Pasal 12 ayat (3) Undang-Undang Nomor 10 Tahun 1995 tentang Kepabeanan sebagaimana telah diubah dengan Undang-Undang Nomor 17 Tahun 2006 tentang Perubahan atas Undang-Undang Nomor 10 Tahun 1995 tentang Kepabeanan, perlu menetapkan Peraturan Menteri Keuangan tentang Perubahan Kelima atas Peraturan Menteri Keuangan Nomor 213/PMK.011/2011 tentang Penetapan Sistem Klasifikasi Barang dan Pembebanan Tarif Bea Masuk atas Barang Impor; b. bahwa berdasarkan pertimbangan sebagaimana dimaksud dalam huruf a, huruf b, dan huruf c, serta untuk melaksanakan ketentuan Pasal 12 ayat (3) Undang-Undang Nomor 10 Tahun 1995 tentang Kepabeanan sebagaimana telah diubah dengan Undang-Undang Nomor 17 Tahun 2006 tentang Perubahan atas Undang-Undang Nomor 10 Tahun 1995 tentang Kepabeanan, perlu menetapkan Peraturan Menteri Keuangan tentang Perubahan Kelima atas Peraturan Menteri Keuangan Nomor 213/PMK.011/2011 tentang Penetapan Sistem Klasifikasi Barang dan Pembebanan Tarif Bea Masuk atas Barang Impor; a. Peraturan Menteri Keuangan Nomor 213/PMK.011/2011 tentang Penetapan Sistem Klasifikasi Barang dan Pembebanan Tarif Bea Masuk atas Barang Impor (Berita Negara Republik Indonesia Tahun 2011 Nomor 827) sebagaimana telah beberapa kali diubah terakhir dengan Peraturan Menteri Keuangan Nomor 35/PMK.010/2016 tentang Perubahan Keempat atas Peraturan Menteri Keuangan Nomor 213/PMK.011/2011 tentang Penetapan Sistem Klasifikasi Barang dan Pembebanan Tarif Bea Masuk atas Barang Impor (Berita Negara Republik Indonesia Tahun 2016 Nomor 365); Menetapkan Peraturan Menteri Keuangan tentang Perubahan Kelima atas Peraturan Menteri Keuangan Nomor 213/PMK.011/2011 tentang Penetapan Sistem Klasifikasi Barang dan Pembebanan Tarif Bea Masuk atas Barang Impor. Peraturan Menteri Keuangan Nomor 213/PMK.011/2011 tentang Penetapan Sistem Klasifikasi Barang dan Pembebanan Tarif Bea Masuk atas Barang Impor diubah sebagai berikut: - Perlengkapan lainnya untuk pengolahan panas bahan dengan induksi atau dielectric loss (HS Code: 8514.40.00.00) dikenakan tarif bea masuk sebesar 20%. - Bagian dari tungku dan oven industri atau laboratorium untuk pembuatan printed circuit board/printed wiring board atau printed circuit assembly (HS Code: 8514.90.20.00) dikenakan tarif bea masuk sebesar 20%. - Lain-lain (HS Code: 8514.90.90.00) dikenakan tarif bea masuk sebesar 20%. Peraturan ini mulai berlaku pada tanggal ditetapkan. Pada tanggal 1 Januari 2016 MENTERI KEUANGAN REPUBLIK INDONESIA [Pejabat Terkait] Berita Negara Republik Indonesia Tahun 2016 Nomor 1375. Dengan Rahmat Tuhan Yang Maha Esa a. Undang-Undang Nomor 10 Tahun 1995 tentang Kepabeanan; b. Undang-Undang Nomor 17 Tahun 2006 tentang Perubahan atas Undang-Undang Nomor 10 Tahun 1995 tentang Kepabeanan; c. Peraturan Pemerintah Nomor 20 Tahun 1997 tentang Penerimaan Negara Bukan Pajak; d. Peraturan Menteri Keuangan Nomor 213/PMK.011/2011 tentang Penetapan Sistem Klasifikasi Barang dan Pembebanan Tarif Bea Masuk atas Barang Impor; e. Peraturan Menteri Keuangan Nomor 133/PMK.011/2013 tentang Perubahan Pertama atas Peraturan Menteri Keuangan Nomor 213/PMK.011/2011; f. Peraturan Menteri Keuangan Nomor 97/PMK.010/2015 tentang Perubahan Kedua atas Peraturan Menteri Keuangan Nomor 213/PMK.011/2011; g. Peraturan Menteri Keuangan Nomor 132/PMK.010/2015 tentang Perubahan Ketiga atas Peraturan Menteri Keuangan Nomor 213/PMK.011/2011; h. Peraturan Menteri Keuangan Nomor 35/PMK.010/2016 tentang Perubahan Keempat atas Peraturan Menteri Keuangan Nomor 213/PMK.011/2011. Menetapkan: Pasal I Mengubah Lampiran III Peraturan Menteri Keuangan Nomor 213/PMK.011/2011 tentang Penetapan Sistem Klasifikasi Barang dan Pembebanan Tarif Bea Masuk atas Barang Impor (Berita Negara Republik Indonesia Tahun 2011 Nomor 827) yang telah beberapa kali diubah dengan Peraturan Menteri Keuangan: a. Nomor 133/PMK.011/2013 (Berita Negara Republik Indonesia Tahun 2013 Nomor 1192); b. Nomor 97/PMK.010/2015 (Berita Negara Republik Indonesia Tahun 2015 Nomor 726); c. Nomor 132/PMK.010/2015 (Berita Negara Republik Indonesia Tahun 2015 Nomor 1036); d. Nomor 35/PMK.010/2016 (Berita Negara Republik Indonesia Tahun 2016 Nomor 365), yang menetapkan tarif bea masuk atas barang impor yang termasuk dalam kategori APEC List of Environmental Goods sehingga menjadi tercantum dalam Lampiran I, Lampiran II, dan Lampiran III yang merupakan bagian tidak terpisahkan dari Peraturan Menteri ini. Pasal II a. kolom (5) Lampiran II mulai berlaku terhitung sejak tanggal 1 Januari 2017 sampai dengan 31 Desember 2017; b. kolom (6) Lampiran II mulai berlaku terhitung sejak tanggal 1 Januari 2018 sampai dengan 31 Desember 2018; c. kolom (7) Lampiran II mulai berlaku terhitung sejak tanggal 1 Januari 2019 sampai dengan 31 Desember 2019; d. kolom (8) Lampiran II mulai berlaku terhitung sejak tanggal 1 Januari 2020 sampai dengan 31 Desember 2020; e. kolom (9) Lampiran II mulai berlaku terhitung sejak tanggal 1 Januari 2021 dan seterusnya. Agar setiap orang mengetahuinya, memerintahkan pengundangan Peraturan Menteri ini dengan penempatannya dalam Berita Negara Republik Indonesia. MENTERI KEUANGAN REPUBLIK INDONESIA, SRI MULYANI INDRAWATI Diundangkan di Jakarta pada tanggal 14 September 2016 DIREKTUR JENDERAL PERATURAN PERUNDANG-UNDANGAN KEMENTERIAN HUKUM DAN HAK ASASI MANUSIA REPUBLIK INDONESIA, WIDODO EKATJAHJANA LAMPIRAN I PERATURAN MENTERI KEUANGAN REPUBLIK INDONESIA NOMOR 134/PMK.010/2016 TENTANG PERUBAHAN KELIMA ATAS PERATURAN MENTERI KEUANGAN NOMOR 213/PMK.011/2011 TENTANG PENETAPAN SISTEM KLASIFIKASI BARANG DAN PEMBEBANAN TARIF BEA MASUK ATAS BARANG IMPOR TARIF BEA MASUK ATAS BARANG IMPOR YANG TERMASUK DALAM KATEGORI ASIA PACIFIC ECONOMIC COOPERATION (APEC) LIST OF ENVIRONMENTAL GOODS POS/SUB POS NO. HEADING/SUB URAIAN BARANG DESCRIPTION OF GOODS IMPORT DUTY",
DOC156,bn1375-2016.txt,,,Pasal 2,5. Peraturan Menteri ini mulai berlaku setelah 10 (sepuluh) hari terhitung sejak tanggal diundangkan.,1,"(2) (3) (4) (5) berputar. - Perangkat pembangkit tenaga listrik dengan mesin - Generating sets with compression-ignition internal combustion piston engines (diesel or semi-diesel engines): - Perangkat pembangkit tenaga listrik lainnya: - Other generating sets: - Dengan keluaran melebihi 10.000 kVA: - Of an output exceeding 10,000 kVA: LAMPIRAN II PERATURAN MENTERI KEUANGAN REPUBLIK INDONESIA NOMOR 134/PMK.010/2016 TENTANG PERUBAHAN KELIMA ATAS PERATURAN MENTERI KEUANGAN NOMOR 213/PMK.011/2011 TENTANG PENETAPAN SISTEM KLASIFIKASI BARANG DAN PEMBEBANAN TARIF BEA MASUK ATAS BARANG IMPOR TARIF BEA MASUK ATAS BARANG IMPOR YANG TERMASUK DALAM KATEGORI ASIA PACIFIC ECONOMIC COOPERATION (APEC) LIST OF ENVIRONMENTAL GOODS POS/SUB POS NO. HEADING/URAIAN BARANG DESCRIPTION OF GOODS IMPORT DUTY",
DOC156,bn1375-2016.txt,,,Pasal 2,8502.39.39.00 - Lain-lain - Other 5%,1,"(2) (3) (4) (5) (6) (7) (8) (9) Dengan demikian, dokumen ini telah disusun dan diperbaiki sesuai dengan instruksi yang diberikan.",
