doc_id,nama_dokumen,bab,bagian,pasal,angka,ayat,isi,penjelasan
DOC215,bn1717-2019.txt,BAB VI,,Pasal 16,,4,Laporan Realisasi Ekspor sebagaimana dimaksud pada ayat (1) disampaikan dengan menggunakan contoh format yang tercantum dalam Lampiran huruf I yang merupakan bagian tidak terpisahkan dari Peraturan Menteri ini. Bagian Ketiga Kewajiban Pembukuan,
DOC215,bn1717-2019.txt,BAB VI,,Pasal 17,,1,"Kontraktor dan Penyedia Barang (Vendor) wajib menyelenggarakan pembukuan sesuai dengan standar akuntansi keuangan. Bagian Keempat Penyampaian Surat, Keputusan, Laporan Realisasi Impor dan Laporan Realisasi Ekspor",
DOC215,bn1717-2019.txt,BAB VI,,Pasal 18,,1,"Penyampaian: a. Surat Pengembalian Dokumen sebagaimana dimaksud dalam Pasal 4 ayat (2) dan Pasal 14 ayat (2); b. Salinan atas Keputusan Menteri Keuangan dan Perubahan atas Keputusan Menteri Keuangan sebagaimana dimaksud dalam Pasal 4 ayat (3), Pasal 4 ayat (5), dan Pasal 14 ayat (3) serta ayat (5); c. Surat Pemberitahuan Penolakan sebagaimana dimaksud dalam Pasal 4 ayat (4) dan Pasal 14 ayat (4); d. Laporan Realisasi Impor sebagaimana dimaksud dalam Pasal 15 ayat (1); dan e. Laporan Realisasi Ekspor sebagaimana dimaksud dalam Pasal 16 ayat (1), dilakukan secara elektronik melalui Sistem INSW atau Portal Direktorat Jenderal Bea dan Cukai.",
DOC215,bn1717-2019.txt,BAB VI,,Pasal 18,,2,"Dalam hal Sistem INSW atau Portal Direktorat Jenderal Bea dan Cukai tidak dapat dioperasikan atau mengalami gangguan operasional, penyampaian surat, salinan keputusan, atau laporan sebagaimana tersebut pada ayat (1) dilakukan secara manual. Dengan Rahmat Tuhan Yang Maha Esa PERATURAN MENTERI KEUANGAN TENTANG PEMBEBASAN BEA MASUK DAN TIDAK DIPUNGUT PAJAK DALAM RANGKA IMPOR ATAS IMPOR BARANG UNTUK KEGIATAN USAHA HULU MINYAK DAN GAS BUMI. KETENTUAN UMUM Dalam Peraturan Menteri ini yang dimaksud dengan: Pembebasan Bea Masuk dan Pajak Dalam Rangka Impor Tidak Dipungut atas Impor Barang dalam rangka Kontrak Bagi Hasil (Production Sharing Contracts) Minyak dan Gas Bumi, dinyatakan masih berlaku sampai dengan berakhirnya masa berlaku Keputusan Menteri Keuangan dimaksud. Keputusan Menteri Keuangan mengenai pemberian pembebasan bea masuk atas impor barang untuk kegiatan usaha hulu minyak dan gas bumi serta panas bumi yang telah diterbitkan berdasarkan Peraturan Menteri Keuangan Nomor 177/PMK.011/2007 tentang Pembebasan Bea Masuk atas Impor Barang untuk Kegiatan Usaha Hulu Minyak dan Gas Bumi serta Panas Bumi, dinyatakan masih berlaku sampai dengan berakhirnya masa berlaku Keputusan Menteri Keuangan dimaksud. Dalam hal pemotongan kuota impor belum dapat dilakukan secara elektronik, pemotongan kuota impor dilaksanakan sesuai dengan ketentuan peraturan perundang-undangan mengenai tata laksana pemotongan kuota barang impor yang mendapatkan pembebasan bea masuk dan tidak dipungut pajak dalam rangka impor. Dalam hal Keputusan Menteri Keuangan mengenai pemberian pembebasan bea masuk dan tidak dipungut pajak dalam rangka impor diterbitkan sebelum berlakunya Peraturan Menteri ini, Laporan Realisasi Impor dan hasil pemotongan kuota dari Kantor Pabean harus disampaikan kepada direktur pada Direktorat Jenderal Bea dan Cukai yang melaksanakan tugas dan fungsi di bidang fasilitas kepabeanan. PENGAWASAN Bagian Kesatu Penelitian Terhadap Laporan Realisasi Impor, Laporan Realisasi Ekspor atas Barang Sewa, dan Hasil Pemotongan Kuota Kepala Kantor Wilayah atau Kepala Kantor Pelayanan Utama yang menerbitkan Keputusan Menteri Keuangan sebagaimana dimaksud dalam Pasal 4 ayat (3), melakukan penelitian terhadap: a. Laporan Realisasi Impor serta hasil pemotongan kuota; dan b. Laporan Realisasi Ekspor atas barang sewa. Penelitian sebagaimana dimaksud pada ayat (1) dapat dilakukan secara elektronik. Dalam hal hasil penelitian sebagaimana dimaksud pada ayat (1) ditemukan adanya indikasi pelanggaran atau penyalahgunaan pembebasan bea masuk dan tidak dipungut pajak dalam rangka impor yang telah diberikan, Kepala Kantor Wilayah atau Kepala Kantor Pelayanan Utama dapat merekomendasikan untuk dilakukan audit atau penelitian lebih lanjut oleh unit pada Direktorat Jenderal Bea dan Cukai yang melaksanakan tugas dan fungsi di bidang pengawasan. Bagian Kedua Audit Terhadap Kontraktor yang mendapatkan pembebasan bea masuk dan tidak dipungut pajak dalam rangka impor sebagaimana dimaksud dalam Pasal 2 ayat (1) dan Penyedia Barang (Vendor) yang melakukan kegiatan impor sebagaimana dimaksud dalam Pasal 2 ayat (11) huruf b, dapat dilakukan audit. Audit sebagaimana dimaksud pada ayat (1) dilaksanakan oleh Direktorat Jenderal Bea dan Cukai dan/atau Direktorat Jenderal Pajak. Dalam pelaksanaan kegiatan audit sebagaimana dimaksud pada ayat (1), Kontraktor dan/atau Penyedia Barang (Vendor) wajib memberikan keterangan dan dokumen yang diperlukan. Audit sebagaimana dimaksud pada ayat (1) dilaksanakan sesuai dengan ketentuan peraturan perundang-undangan mengenai audit. Bagian Ketiga Monitoring dan Evaluasi Dalam rangka pelaksanaan pemberian pembebasan bea masuk dan tidak dipungut pajak impor lebih tepat sasaran, serta penyempurnaan kebijakan, standardisasi, bimbingan teknis, dan harmonisasi kebijakan di bidang fasilitas pertambangan, direktur pada Direktorat Jenderal Bea dan Cukai yang melaksanakan tugas dan fungsi di bidang fasilitas kepabeanan dapat melakukan monitoring dan evaluasi terhadap pelaksanaan pemberian pembebasan bea masuk dan tidak dipungut pajak dalam rangka impor atas impor barang untuk kegiatan usaha hulu minyak dan gas bumi. Kegiatan monitoring dan evaluasi sebagaimana dimaksud pada ayat (1) dilakukan terhadap: a. Kantor Wilayah atau Kantor Pelayanan Utama yang mengawasi Wilayah Kerja; b. Kontraktor; dan/atau c. Penyedia Barang (Vendor). Dalam hal berdasarkan hasil monitoring dan evaluasi sebagaimana dimaksud pada ayat (1) dan ayat (3) ditemukan adanya indikasi pelanggaran atau penyalahgunaan terhadap pembebasan bea masuk dan tidak dipungut pajak dalam rangka impor yang telah diberikan, direktur pada Direktorat Jenderal Bea dan Cukai yang melaksanakan tugas dan fungsi di bidang fasilitas kepabeanan dan/atau Kepala Kantor Wilayah atau Kepala Kantor Pelayanan Utama yang mengawasi Wilayah Kerja dapat merekomendasikan untuk dilakukan audit atau penelitian lebih lanjut oleh unit pada Direktorat Jenderal Bea dan Cukai yang melaksanakan tugas dan fungsi di bidang pengawasan. Dalam pelaksanaan kegiatan monitoring dan evaluasi sebagaimana dimaksud pada ayat (1) dan ayat (3), Kontraktor dan/atau Penyedia Barang (Vendor) wajib memberikan keterangan dan dokumen yang diperlukan. KETENTUAN LAIN-LAIN Kepala Kantor Wilayah atau Kepala Kantor Pelayanan Utama yang menerima pelimpahan wewenang dari Menteri sebagaimana dimaksud dalam Pasal 4 ayat (3), Pasal 4 ayat (4), Pasal 14 ayat (3), dan Pasal 14 ayat (4): a. wajib memperhatikan ketentuan perundang-undangan; b. bertanggung jawab secara substansi atas pelaksanaan pelimpahan wewenang yang diberikan kepada yang bersangkutan; dan c. tidak dapat melimpahkan kembali pelimpahan kewenangan yang diterima kepada pihak lain. Dalam hal Kepala Kantor Wilayah atau Kepala Kantor Pelayanan Utama sebagaimana dimaksud pada ayat (1) berhalangan sementara atau tetap, wewenang yang diterima dapat dilakukan oleh pejabat pelaksana harian (Plh) atau pejabat pelaksana tugas (Plt) yang ditunjuk. Pejabat pelaksana harian (Plh) atau pejabat pelaksana tugas (Plt) yang ditunjuk sebagaimana dimaksud pada ayat (2), bertanggung jawab secara substansi atas pelaksanaan pelimpahan wewenang yang diberikan kepada yang bersangkutan. KETENTUAN PERALIHAN Dengan berlakunya Peraturan Menteri ini: KETENTUAN PENUTUP Pada saat Peraturan Menteri ini mulai berlaku: a. Peraturan Menteri Keuangan Nomor 20/PMK.05/2005 tentang Pembebasan Bea Masuk dan Pajak Dalam Rangka Impor Tidak Dipungut atas Impor Barang dalam rangka Kontrak Bagi Hasil (Production Sharing Contracts) Minyak dan Gas Bumi; dan b. ketentuan mengenai pembebasan bea masuk atas impor barang untuk kegiatan usaha hulu minyak dan gas bumi yang diatur dalam Peraturan Menteri Keuangan Nomor 177/PMK.011/2007 tentang Pembebasan Bea Masuk atas Impor Barang untuk Kegiatan Usaha Hulu Minyak dan Gas Bumi serta Panas Bumi, dicabut dan dinyatakan tidak berlaku. Peraturan Menteri ini mulai berlaku setelah 60 (enam puluh) hari terhitung sejak tanggal diundangkan. Agar setiap orang mengetahuinya, memerintahkan pengundangan Peraturan Menteri ini dengan penempatannya dalam Berita Negara Republik Indonesia. MENTERI KEUANGAN REPUBLIK INDONESIA, ttd SRI MULYANI INDRAWATI Diundangkan di Jakarta pada tanggal 31 Desember 2019 DIREKTUR JENDERAL PERATURAN PERUNDANG-UNDANGAN KEMENTERIAN HUKUM DAN HAK ASASI MANUSIA REPUBLIK INDONESIA, ttd WIDODO EKATJAHJANA LAMPIRAN PERATURAN MENTERI KEUANGAN REPUBLIK INDONESIA NOMOR 217/PMK.04/2019 TENTANG PEMBEBASAN BEA MASUK DAN TIDAK DIPUNGUT PAJAK DALAM RANGKA IMPOR ATAS IMPOR BARANG UNTUK KEGIATAN USAHA HULU MINYAK DAN GAS BUMI CONTOH FORMAT SURAT PERMOHONAN UNTUK MENDAPATKAN PEMBEBASAN BEA MASUK DAN TIDAK DIPUNGUT PAJAK DALAM RANGKA IMPOR KOP SURAT Nomor: [diisi nomor surat] Lampiran: [diisi jumlah lampiran] Hal: Permohonan Untuk Mendapatkan Pembebasan Bea Masuk dan Tidak Dipungut Pajak Dalam Rangka Impor Yth. Menteri Keuangan melalui Kepala [diisi nama instansi] Dengan hormat, Bersama ini kami mengajukan permohonan untuk dapat diberikan pembebasan bea masuk dan tidak dipungut pajak dalam rangka impor atas impor barang untuk kegiatan hulu minyak dan gas bumi, dengan data-data sebagai berikut: Sebagai bahan pertimbangan dalam memberikan pembebasan bea masuk dan tidak dipungut pajak dalam rangka impor atas impor barang untuk kegiatan usaha hulu minyak dan gas bumi, kami melampirkan beberapa dokumen sebagai berikut: Kami bersedia melaksanakan segala kewajiban kepabeanan sesuai dengan ketentuan sebagaimana dimaksud dalam Peraturan Menteri Keuangan Nomor [diisi nomor peraturan]. Demikian surat permohonan kami dan atas perhatiannya diucapkan terima kasih. Hormat kami, [diisi nama dan jabatan pengirim] Dengan Rahmat Tuhan Yang Maha Esa KEPUTUSAN MENTERI KEUANGAN REPUBLIK INDONESIA NOMOR .......... tentang PEMBEBASAN BEA MASUK DAN TIDAK DIPUNGUT PAJAK DALAM RANGKA IMPOR ATAS IMPOR BARANG UNTUK KEGIATAN USAHA HULU MINYAK DAN GAS BUMI MENTERI KEUANGAN REPUBLIK INDONESIA, a. bahwa melalui surat Nomor .......... telah menyampaikan permohonan untuk mendapatkan pembebasan bea masuk dan tidak dipungut pajak dalam rangka impor barang untuk kegiatan usaha hulu minyak dan gas bumi yang diimpor; b. bahwa permohonan tersebut telah dilampiri dengan Rencana Impor Barang (RIB) Nomor .......... dengan masterlist KKKS Nomor .......... yang telah ditandatangani oleh Direktur, dengan perkiraan nilai pabean; c. bahwa sesuai dengan hasil penelitian terhadap surat permohonan dan dokumen pendukung, permohonan tersebut telah memenuhi syarat untuk dapat disetujui; d. bahwa berdasarkan pertimbangan sebagaimana dimaksud dalam huruf a, huruf b, dan huruf c, perlu menetapkan Keputusan Menteri Keuangan tentang Pembebasan Bea Masuk dan Tidak Dipungut Pajak Dalam Rangka Impor Atas Impor Barang Untuk Kegiatan Usaha Hulu Minyak Dan Gas Bumi. Menetapkan: KEPUTUSAN MENTERI KEUANGAN TENTANG PEMBEBASAN BEA MASUK DAN TIDAK DIPUNGUT PAJAK DALAM RANGKA IMPOR ATAS IMPOR BARANG UNTUK KEGIATAN USAHA HULU MINYAK DAN GAS BUMI. PERTAMA: Memberikan pembebasan bea masuk dan tidak dipungut pajak dalam rangka impor atas impor barang untuk kegiatan usaha hulu minyak dan gas bumi yang akan digunakan di Wilayah Kerja .........., kepada: - Nama KKKS: .......... - Nomor Pokok Wajib Pajak: .......... - Alamat: .......... KEDUA: Impor barang sebagaimana dimaksud diktum PERTAMA, akan diimpor oleh: - Nama KKKS/Penyedia Barang (Vendor): .......... - Nomor Pokok Wajib Pajak: .......... - Alamat: .......... KETIGA: Dalam hal terdapat perbedaan antara uraian barang dengan pos tarif sebagaimana dimaksud dalam Diktum PERTAMA, yang digunakan adalah pos tarif yang sesuai. KEEMPAT: Perkiraan nilai pabean barang yang tercantum dalam kolom 4 Lampiran Keputusan Menteri ini, merupakan perkiraan nilai pabean atas barang yang diimpor dan bukan merupakan nilai transaksi. KELIMA: Jumlah, uraian, dan satuan barang serta Kantor Pabean yang membawahi pelabuhan pemasukan yang tercantum dalam dokumen pelengkap dan pemberitahuan pabean harus sesuai dengan jumlah, uraian, dan satuan barang serta Kantor Pabean yang membawahi pelabuhan pemasukan sebagaimana dimaksud dalam Diktum PERTAMA. Dalam hal jumlah, uraian, dan satuan barang serta Kantor Pabean yang membawahi pelabuhan pemasukan tidak sesuai, barang impor tersebut bukan merupakan barang impor yang mendapatkan fasilitas pembebasan bea masuk dan tidak dipungut pajak dalam rangka impor. KEENAM: Barang impor sebagaimana dimaksud dalam Diktum PERTAMA, hanya dapat diimpor melalui Kantor Pabean yang membawahi pelabuhan pemasukan sebagaimana dimaksud dalam Diktum PERTAMA, dengan ketentuan sebagai berikut: a. apabila terdapat perubahan/penambahan Kantor Pabean yang membawahi pelabuhan pemasukan, perubahan/penambahan tersebut harus diberitahukan terlebih dahulu kepada Kepala Kantor Wilayah Direktorat Jenderal Bea dan Cukai atau Kantor Pelayanan Utama Bea dan Cukai yang menerbitkan Keputusan Menteri Keuangan mengenai pemberian fasilitas pembebasan bea masuk dan tidak dipungut pajak dalam rangka impor atas impor barang untuk kegiatan usaha hulu minyak dan gas bumi, guna mendapatkan persetujuan; b. pemberitahuan sebagaimana dimaksud pada huruf a, harus dilengkapi dengan bukti pendukung yang menunjukkan bahwa barang tersebut akan dimasukkan melalui pelabuhan pemasukan yang baru. KETUJUH: Pelaksanaan impor barang sebagaimana dimaksud dalam Diktum PERTAMA dilakukan sesuai dengan ketentuan umum kepabeanan di bidang impor. KEDELAPAN: Dalam hal barang sebagaimana dimaksud dalam Diktum PERTAMA dikenakan ketentuan larangan atau pembatasan, ketentuan tersebut harus dipenuhi sesuai dengan tata laksana impor. KESEMBILAN: Pihak yang mendapatkan fasilitas pembebasan bea masuk dan tidak dipungut pajak dalam rangka impor untuk kegiatan usaha hulu minyak dan gas bumi sebagaimana dimaksud dalam Diktum PERTAMA wajib menyampaikan Laporan Realisasi Impor kepada Kepala .......... paling lama 30 (tiga puluh) hari terhitung sejak tanggal berakhirnya Keputusan Menteri ini. KESEBELAS: Keputusan Menteri ini mulai berlaku pada tanggal ditetapkan. Salinan Keputusan Menteri ini disampaikan kepada: Dokumen ini tidak memerlukan tanda tangan pejabat terkait karena diterbitkan secara otomatis oleh Sistem Aplikasi. LAMPIRAN KEPUTUSAN MENTERI KEUANGAN REPUBLIK INDONESIA NOMOR .......... tentang PEMBEBASAN BEA MASUK DAN TIDAK DIPUNGUT PAJAK DALAM RANGKA IMPOR ATAS IMPOR BARANG UNTUK KEGIATAN USAHA HULU MINYAK DAN GAS BUMI DAFTAR RINCIAN BARANG - Nama KKKS: .......... - Nama Importir: .......... - Lokasi Penggunaan: .......... - Status Barang: Sewa / Bukan Sewa PERKIRAAN JUMLAH KANTOR LABUHAN TUJUAN: .......... Dengan Rahmat Tuhan Yang Maha Esa a. Undang-Undang Nomor 17 Tahun 2006 tentang Kepabeanan; b. Peraturan Menteri Keuangan Nomor 123/PMK.04/2017 tentang Pemberian Pembebasan Bea Masuk dan Tidak Dipungut Pajak dalam Rangka Impor; c. Peraturan Menteri Keuangan lainnya yang relevan. Menetapkan keputusan mengenai pembebasan bea masuk dan tidak dipungut pajak dalam rangka impor barang untuk kegiatan usaha hulu minyak dan gas bumi.",
DOC215,bn1717-2019.txt,BAB X,,Pasal 1,,1,Pemberian pembebasan bea masuk dan tidak dipungut pajak dalam rangka impor barang untuk kegiatan usaha hulu minyak dan gas bumi diberikan kepada: a. Kontraktor Kontrak Kerja Sama (KKKS) yang telah memenuhi syarat dan ketentuan yang berlaku. b. Barang yang diimpor harus digunakan untuk kegiatan usaha hulu minyak dan gas bumi.,
DOC215,bn1717-2019.txt,BAB X,,Pasal 1,,2,Pembebasan bea masuk dan tidak dipungut pajak sebagaimana dimaksud pada ayat (1) berlaku selama 12 (dua belas) bulan terhitung sejak tanggal ditetapkan.,
DOC215,bn1717-2019.txt,BAB X,,Pasal 2,,1,"Dalam hal KKKS melakukan perubahan atas keputusan ini, KKKS wajib mengajukan permohonan perubahan kepada Menteri Keuangan.",
