doc_id,nama_dokumen,bab,bagian,pasal,angka,ayat,isi,penjelasan
DOC280,bn231-2009.txt,,,Pasal 20,,1,Pengakuan sebagai IP-Tekstil yang telah dikeluarkan berdasarkan Peraturan Menteri Perdagangan Nomor 15/M-DAG/PER/S5/2008 dinyatakan tetap berlaku sampai dengan berakhir masa berlakunya pengakuan tersebut.,
DOC280,bn231-2009.txt,,,Pasal 20,,2,"Laporan Surveyor (LS) yang telah diterbitkan berdasarkan Peraturan Menteri Perdagangan Nomor 15/M-DAG/PER/S5/2008 dinyatakan tetap berlaku sampai dengan diselesaikannya kewajiban pabean (customs clearance) pelaksanaan impor TPT yang bersangkutan. Penunjukkan sebagai Surveyor yang telah dikeluarkan berdasarkan Keputusan Menteri Perindustrian dan Perdagangan Nomor 307/MPP/Kep/11/2003 tentang Penunjukan Surveyor Sebagai Pelaksana Verifikasi Atau Penelusuran Teknis Impor Tekstil dan Produk Tekstil (TPT) masih tetap berlaku untuk jangka waktu 30 (tiga puluh) hari sejak tanggal penetapan Peraturan Menteri ini. Pada saat Peraturan Menteri ini berlaku, Peraturan Menteri Perdagangan Nomor 15/M-DAG/PER/5/2008 tentang Ketentuan Impor Tekstil dan Produk Tekstil, dicabut dan dinyatakan tidak berlaku. Ketentuan lebih lanjut pelaksanaan dari Peraturan Menteri ini dapat ditetapkan oleh Direktur Jenderal. Peraturan Menteri ini mulai berlaku pada tanggal ditetapkan. Agar setiap orang mengetahuinya, memerintahkan pengumuman Peraturan Menteri ini dengan penempatannya dalam Berita Negara Republik Indonesia. MENTERI PERDAGANGAN REPUBLIK INDONESIA, MARI ELKA PANGESTU Diundangkan di Jakarta pada tanggal 3 Agustus 2009 MENTERI HUKUM DAN HAK ASASI MANUSIA REPUBLIK INDONESIA, ANDI MATTALATTA LAMPIRAN PERATURAN MENTERI PERDAGANGAN REPUBLIK INDONESIA NOMOR: 23/M-DAG/PER/6/2009 TANGGAL: 19 Juni 2009 DAFTAR LAMPIRAN LAMPIRAN I PERATURAN MENTERI PERDAGANGAN R.I. NOMOR: 23/M-DAG/PER/6/2009 TANGGAL: 19 Juni 2009 DAFTAR TEKSTIL DAN PRODUK TEKSTIL - POS 52.08 s/d 52.11: Kain tenunan dari kapas - POS 52.12: Kain tenunan lainnya dari kapas. - POS 54.07: Kain tenunan dari benang filamen sintetik, termasuk kain tenunan yang diperoleh dari bahan pada pos 54.04. Dikecualikan dari kewajiban verifikasi. - POS 55.12 s/d 55.14: Kain tenunan dari serat stapel sintetik, mengandung serat stapel sintetik 85% atau lebih menurut beratnya. Dikecualikan dari kewajiban verifikasi. - POS 55.15: Kain tenunan lainnya dari serat stapel sintetik. - POS 55.16: Kain tenunan dari serat stapel tiruan. - POS 58.01: Kain tenunan berbulu dan kain chenille, selain kain dari pos 58.02 atau 58.06. - POS 60.01: Kain berbulu, termasuk kain ""berbulu panjangâ€ dan kain terry, rajutan atau kaitan. - POS 60.05: Kain rajut lusi (termasuk kain yang dibuat dengan mesin rajut gallon), selain yang dimaksud dalam pos 60.01 sampai dengan 60.04. - POS 60.06: Kain rajutan atau kaitan lainnya. - POS 50.07: Kain tenunan dari sutra atau sisa sutra. - POS 51.11: Kain tenunan dari wol atau bulu hewan halus digaruk. - POS 51.12: Kain tenunan dari wol atau bulu hewan halus disisir. - POS 51.13: Kain tenunan dari bulu hewan kasar atau bulu kuda. - POS 53.09: Kain tenunan dari lena. - POS 53.10: Kain tenunan dari serat jute atau dari serat tekstil kulit pohon lainnya dari pos 53.03. - POS 53.11: Kain tenunan dari serat tekstil nabati lainnya; kain tenunan dari benang kertas. - POS 57.01 s/d 57.05: Karpet dan penutup lantai tekstil lainnya, rajutan, sudah jadi maupun belum. - POS 58.02: Terry towelling dan kain tenunan terry semacam itu, selain kain pita dari pos 58.06; kain tekstil berumbai, selain produk dari pos 57.03. - POS 58.04: Kain tule dan kain jaring lainnya, tidak termasuk kain tenunan, rajutan atau kaitan; renda dalam lembaran, strip atau motif, selain kain dari pos 60.02 sampai dengan 60.06. - POS 58.05: Permadani dinding tenunan tangan dari tipe Gobelin, lander, Aubusson, Beauvais dan sejenisnya, dan permadani dinding dikerjakan dengan jarum (misalnya, bintik kecil, jeratan silang), sudah jadi maupun belum. - POS 58.06: Kain pita tenunan, selain barang dari pos 5807; kain pita terdiri dari benang lusi tanpa benang pakan yang digabungkan dengan adhesif (bolduc). Dikecualikan dari kewajiban verifikasi. - POS 58.07: Label, lencana dan barang semacam itu dari bahan tekstil, dalam bentuk lembaran, strip atau dipotong menjadi berbentuk atau berukuran, tidak disulam. - POS 58.08: Kain jalinan dalam lembaran; kain perapih hiasan dalam lembaran, tanpa sulaman, selain rajutan atau kaitan; jumbai, pompon dan barang semacam itu. - POS 58.09: Kain tenunan dari benang logam dan kain tenunan dari benang dilapisi logam dari pos 56.05, dari jenis yang digunakan dalam pakaian, sebagai kain perabotan rumah atau untuk keperluan atau termasuk dalam semacam itu, tidak dirinci pos lainnya. - POS 58.10: Kain sulaman dalam lembaran, strip atau motif. - POS 58.11: Produk tekstil dilapisi dalam lembaran, disusun dari satu atau lebih lapisan bahan tekstil disatukan dengan cara dijalin atau secara lain, selain kain sulaman dari pos 58.10. - POS 59.01: Kain tekstil dilapisi dengan perekat atau zat mengandung pati, dari jenis yang digunakan untuk kulit buku atau sejenisnya; kain kalkir; kanvas lukis siap dipakai; buckram dan kain tekstil kaku semacam itu jenis yang digunakan untuk dasar topi. - POS 59.02: Kain untuk ban dari benang nilon atau poliester lainnya, poliester atau rayon berkekuatan tinggi. Dikecualikan dari kewajiban verifikasi. - POS 59.03: Kain tekstil diresapi, dilaminasi dengan plastik, ditutupi selain yang dimaksud pada pos 59.02. Dikecualikan dari kewajiban verifikasi. - POS 59.07: Kain tekstil selain diresapi, dilapisi atau ditutupi; kanvas dilukis menjadi layar pentas, kain latar belakang studio atau sejenisnya. - POS 59.11: Produk dan barang tekstil untuk penggunaan teknis, dirinci dalam Catatan 7 pada Bab ini. Dikecualikan dari kewajiban verifikasi. - POS 61.01: Mantel panjang, car-coat, jubah bertopi, jubah, anorak (termasuk jaket-ski), wind-cheater, wind-jaket dan barang semacam itu, untuk pria atau anak laki-laki, rajutan atau kaitan, selain yang dimaksud dalam pos 61.03. - POS 61.02: Mantel panjang, car-coat, jubah bertopi, jubah, anorak (termasuk jaket-ski), wind-cheater, wind-jacket dan barang semacam itu, untuk wanita dan anak perempuan, rajutan atau kaitan, selain yang dimaksud dalam pos 61.04. - POS 61.03: Setelan, ensemble, jas, blazer, celana panjang, pakaian terusan berpenutup di depan dan bertali, celana panjang sampai lutut dan celana pendek (selain pakaian renang), untuk pria atau anak laki-laki, rajutan atau kaitan. - POS 61.04: Setelan, ensemble, jas, blazer, gaun, rok, rok terpisah, celana panjang, pakaian terusan berpenutup di depan dan bertali, celana panjang sampai lutut dan celana pendek (selain pakaian renang), untuk wanita atau anak perempuan, rajutan atau kaitan. - POS 61.10: Jersey, pulover, cardigan, rompi dan barang semacam itu, rajutan atau kaitan. - POS 61.13: Garmen, dibuat dari kain rajutan atau kaitan dari pos 59.03, 59.06 atau 59.07. - POS 61.15: Panty hose, tight, kaus kaki dan kaus lainnya, termasuk kaus kaki panjang untuk penderita varises dan alas kaki tanpa sol, rajutan atau kaitan. - POS 61.16: Sarung tangan, mitten dan mitt, rajutan atau kaitan. - POS 61.17: Aksesori pakaian jadi lainnya, rajutan atau kaitan; bagian dari garmen atau bagian dari pakaian, rajutan atau kaitan. Dengan Rahmat Tuhan Yang Maha Esa a. Undang-Undang Nomor 7 Tahun 1994 tentang Pengesahan Agreement Establishing The World Trade Organization (Persetujuan Pembentukan Organisasi Perdagangan Dunia), (Lembaran Negara Republik Indonesia Tahun 1994 Nomor 57, Tambahan Lembaran Negara Republik Indonesia Nomor 3564); b. Undang-Undang Nomor 10 Tahun 1995 tentang Kepabeanan (Lembaran Negara Republik Indonesia Tahun 1995 Nomor 75, Tambahan Lembaran Negara Republik Indonesia Nomor 3612) sebagaimana telah diubah dengan Undang-Undang Nomor 17 Tahun 2006 (Lembaran Negara Republik Indonesia Tahun 2006 Nomor 93, Tambahan Lembaran Negara Republik Indonesia Nomor 4661); c. Undang-Undang Nomor 5 Tahun 1999 tentang Larangan Praktek Monopoli Dan Persaingan Usaha Tidak Sehat (Lembaran Negara Republik Indonesia Tahun 1999 Nomor 33, Tambahan Lembaran Negara Republik Indonesia Nomor 3806); d. Undang-Undang Nomor 8 Tahun 1999 tentang Perlindungan Konsumen (Lembaran Negara Republik Indonesia Tahun 1999 Nomor 42, Tambahan Lembaran Negara Republik Indonesia Nomor 3821); e. Keputusan Presiden Nomor 260 Tahun 1967 tentang Penegasan Tugas Dan Tanggung Jawab Menteri Perdagangan Dalam Bidang Perdagangan Luar Negeri; f. Keputusan Presiden Nomor 187/M Tahun 2004 tentang Pembentukan Kabinet Indonesia Bersatu, sebagaimana telah diubah dengan Keputusan Presiden Nomor 171/M Tahun 2005; g. Peraturan Presiden Nomor 9 Tahun 2005 tentang Kedudukan, Tugas, Fungsi, Susunan Organisasi, Dan Tata Kerja Kementerian Negara Republik Indonesia sebagaimana telah diubah terakhir dengan Peraturan Presiden Nomor 20 Tahun 2008; h. Peraturan Presiden Nomor 10 Tahun 2005 tentang Unit Organisasi Dan Tugas Eselon I Kementerian Negara Republik Indonesia sebagaimana telah diubah terakhir dengan Peraturan Presiden Nomor 50 Tahun 2008; i. Keputusan Menteri Perindustrian dan Perdagangan Nomor 229/MPP/Kep/7/1997 tentang Ketentuan Umum Di Bidang Impor; j. Keputusan Menteri Perindustrian dan Perdagangan Nomor 141/MPP/Kep/3/2002 tentang Nomor Pengenal Importir Khusus (NPIK) sebagaimana telah diubah dengan Peraturan Menteri Perdagangan Nomor 07/M-DAG/PER/3/2008; k. Peraturan Menteri Perdagangan Nomor 01/M-DAG/PER/3/2005 tentang Organisasi Dan Tata Kerja Departemen Perdagangan sebagaimana telah diubah dengan Peraturan Menteri Perdagangan Nomor 34/M-DAG/PER/8/2007; l. Peraturan Menteri Perdagangan Nomor 31/M-DAG/PER/7/2007 tentang Angka Pengenal Importir (API); m. Peraturan Menteri Perdagangan Nomor 56/M-DAG/PER/12/2008 tentang Ketentuan Impor Produk Tertentu; Menetapkan: PERATURAN MENTERI PERDAGANGAN TENTANG KETENTUAN IMPOR TEKSTIL DAN PRODUK TEKSTIL. Dalam Peraturan Menteri ini, yang dimaksud dengan: TPT yang diatur dalam Peraturan Menteri ini sebagaimana tercantum dalam Lampiran I yang menjadi bagian tidak terpisahkan dalam Peraturan Menteri ini. TPT yang tercantum pada daftar urut 1 sampai dengan 10 dalam Lampiran I Peraturan Menteri ini hanya dapat diimpor oleh perusahaan yang telah mendapat Pengakuan sebagai IP-Tekstil. TPT yang diimpor oleh IP-Tekstil sebagaimana dimaksud pada ayat (1) hanya untuk dipergunakan sebagai bahan baku atau bahan penolong untuk proses produksi dari industri yang dimiliki oleh IP-Tekstil yang bersangkutan dan dilarang untuk diperjualbelikan atau dipindahtangankan. Setiap importasi TPT yang tercantum dalam Lampiran I Peraturan Menteri ini, wajib terlebih dahulu dilakukan verifikasi atau penelusuran teknis di negara muat barang. Kewajiban verifikasi atau penelusuran teknis sebagaimana dimaksud pada ayat (1) tidak berlaku jika Lampiran I Peraturan Menteri ini menyatakan pengecualian dari kewajiban verifikasi. Kewajiban verifikasi atau penelusuran teknis sebagaimana dimaksud pada ayat (1) tidak berlaku terhadap IP-Tekstil yang mendapatkan fasilitas Kemudahan Impor Tujuan Ekspor (KITE). Untuk mendapatkan Pengakuan sebagai IP-Tekstil sebagaimana dimaksud dalam Pasal 3 ayat (1), perusahaan yang bersangkutan harus mengajukan permohonan tertulis kepada Direktur dengan melampirkan: a. Izin Usaha Industri/Tanda Daftar Industri atau Izin Usaha lain yang setara dari Departemen Teknis/Lembaga Pemerintah Non Departemen yang membidangi usaha tersebut; b. Nomor Pengenal Importir Khusus Tekstil dan Produk Tekstil (NPIK-TPT); c. Angka Pengenal Importir Produsen (API-P) atau Angka Pengenal Importir Terbatas (API-T); d. Nomor Pokok Wajib Pajak (NPWP); e. Nomor Identitas Kepabeanan (NIK); dan f. Rekomendasi dari Direktur Jenderal Industri, Logam, Mesin, Tekstil dan Aneka, Departemen Perindustrian yang memuat keterangan mengenai jenis dan volume TPT sesuai kapasitas industri yang bersangkutan. Direktur menerbitkan Pengakuan sebagai IP-Tekstil paling lama 5 (lima) hari kerja sejak permohonan diterima. Pengakuan sebagai IP-Tekstil sebagaimana dimaksud dalam Pasal 5 berlaku paling lama 1 (satu) tahun dan dapat diperpanjang kembali. Untuk mendapat perpanjangan kembali Pengakuan sebagai IP-Tekstil sebagaimana dimaksud pada ayat (1), IP-Tekstil yang bersangkutan harus mengajukan permohonan perpanjangan kepada Direktur dengan melampirkan dokumen-dokumen sebagai berikut: a. rekomendasi dari Direktur Jenderal Industri, Logam, Mesin, Tekstil dan Aneka, Departemen Perindustrian yang memuat keterangan mengenai jenis dan volume TPT sesuai kapasitas industri yang bersangkutan; dan b. asli pengakuan sebagai IP-Tekstil yang telah habis masa berlakunya. Rekomendasi sebagaimana dimaksud pada ayat (2) huruf a diperlukan apabila volume TPT yang akan diimpor melebihi tahun sebelumnya.",
DOC280,bn231-2009.txt,,,Pasal 7,,1,IP-Tekstil wajib menyampaikan laporan secara tertulis kepada Direktur setiap periode triwulanan terhitung sejak tanggal diterbitkannya Pengakuan sebagai IP-Tekstil.,
DOC280,bn231-2009.txt,,,Pasal 7,,2,Penyampaian laporan sebagaimana dimaksud pada ayat (1) dilakukan baik importasinya terealisasi maupun tidak terealisasi.,
DOC280,bn231-2009.txt,,,Pasal 7,,3,"Laporan sebagaimana dimaksud pada ayat (1) disampaikan paling lama tanggal 15 pada bulan pertama triwulan berikutnya melalui http://inatrade.depdag.go.id dengan bentuk laporan sebagaimana tercantum dalam Lampiran II yang menjadi bagian tidak terpisahkan dalam Peraturan Menteri ini. Pelaksanaan verifikasi atau penelusuran teknis sebagaimana dimaksud dalam Pasal 4 ayat (1) dilakukan oleh surveyor yang ditetapkan oleh Menteri. Verifikasi atau penelusuran teknis sebagaimana dimaksud pada ayat (1) meliputi antara lain: a. data atau keterangan mengenai negara pembuat barang; b. spesifikasi barang yang mencakup nomor Pos Tarif/HS; c. uraian barang; d. komposisi bahan; e. jumlah; dan f. jenis barang. Hasil dari verifikasi atau penelusuran teknis sebagaimana dimaksud pada ayat (1) oleh surveyor dituangkan ke dalam bentuk Laporan Surveyor (LS) untuk digunakan sebagai dokumen pelengkap pabean dalam penyelesaian kepabeanan di bidang impor. Atas pelaksanaan verifikasi atau penelusuran teknis sebagaimana dimaksud pada ayat (1) surveyor memungut biaya dari importir. Untuk dapat ditetapkan sebagai pelaksana verifikasi atau penelusuran teknis importasi TPT sebagaimana dimaksud dalam Pasal 8 ayat (1), surveyor harus memenuhi persyaratan sebagai berikut: a. memiliki Surat Izin Usaha Jasa Survey (SIUJS); b. berpengalaman sebagai surveyor minimal 5 (lima) tahun; dan c. memiliki cabang atau perwakilan atau afiliasi di luar negeri. Surveyor yang ditetapkan sebagai pelaksana verifikasi atau penelusuran teknis pelaksanaan impor TPT, wajib menyampaikan laporan tertulis tentang kegiatan verifikasi atau penelusuran teknis TPT secara periodik 1 (satu) kali dalam sebulan. Laporan tertulis sebagaimana dimaksud pada ayat (2) disampaikan kepada Direktur Jenderal dalam hal ini Direktur, pada minggu pertama bulan berikutnya. TPT hasil olahan dari Kawasan Berikat yang dimasukkan ke tempat lain dalam Daerah Pabean tidak berlaku ketentuan kewajiban IP-Tekstil. TPT hasil olahan dari Kawasan Berikat yang dimasukkan ke tempat lain dalam Daerah Pabean berlaku kewajiban verifikasi atau penelusuran teknis sebagaimana dimaksud dalam Pasal 4. TPT hasil olahan sebagaimana dimaksud pada ayat (1) harus dilakukan verifikasi atau penelusuran teknis oleh surveyor di Kawasan Berikat. TPT asal impor di Kawasan Perdagangan Bebas dan Pelabuhan Bebas serta TPT asal impor di Gudang Berikat yang dikeluarkan ke tempat lain dalam Daerah Pabean berlaku ketentuan Peraturan Menteri ini. TPT asal impor sebagaimana dimaksud pada ayat (1) harus dilakukan verifikasi atau penelusuran teknis oleh surveyor di: a. Kawasan Perdagangan Bebas dan Pelabuhan Bebas; atau b. Gudang Berikat. Selain IP-Tekstil sebagaimana dimaksud dalam Pasal 3, Menteri atau pejabat yang ditunjuk Menteri dapat menetapkan perusahaan lain untuk melaksanakan impor TPT yang tercantum pada daftar urut 1 sampai dengan 10 dalam Lampiran I Peraturan Menteri ini. Perusahaan lain sebagaimana dimaksud pada ayat (1) hanya dapat mengimpor TPT untuk memenuhi kebutuhan industri kecil dan/atau industri yang tidak melaksanakan importasi TPT sendiri. Untuk mendapatkan penetapan sebagai pelaksana impor TPT sebagaimana dimaksud pada ayat (1), perusahaan yang bersangkutan harus memiliki: a. Rekomendasi dari Direktur Jenderal Industri, Logam, Mesin, Tekstil dan Aneka, Departemen Perindustrian; dan b. Rencana distribusi atas TPT yang akan diimpor untuk memenuhi kebutuhan industri kecil dan/atau industri yang tidak melaksanakan importasi TPT sendiri. Rencana distribusi sebagaimana dimaksud pada ayat (3) huruf b disusun berdasarkan pesanan kebutuhan TPT dari industri kecil dan/atau industri yang tidak melaksanakan importasi TPT sendiri kepada perusahaan sebagaimana dimaksud pada ayat (1). Importasi TPT oleh perusahaan yang telah mendapatkan penetapan sebagai pelaksana impor TPT sebagaimana dimaksud pada ayat (1) wajib memenuhi ketentuan verifikasi atau penelusuran teknis sebagaimana dimaksud dalam Pasal 4. Kegiatan verifikasi atau penelusuran teknis importasi TPT oleh surveyor sebagaimana dimaksud dalam Pasal 4, Pasal 10, Pasal 11, dan Pasal 12 tidak mengurangi kewenangan Direktorat Jenderal Bea dan Cukai, Departemen Keuangan untuk melakukan pemeriksaan pabean. Ketentuan dalam Peraturan Menteri ini tidak berlaku terhadap impor TPT yang dimasukkan ke dalam: a. Kawasan Berikat atau Gudang Berikat yang ditetapkan berdasarkan Keputusan Menteri Keuangan; atau b. Kawasan Perdagangan Bebas dan Pelabuhan Bebas; Ketentuan dalam Peraturan Menteri ini tidak berlaku terhadap impor TPT yang merupakan: a. barang keperluan Pemerintah dan Lembaga Negara lainnya; b. barang keperluan penelitian dan pengembangan teknologi; c. barang bantuan teknik dan bantuan proyek berdasarkan Peraturan Pemerintah Nomor 19 Tahun 1955 tentang Peraturan Pembebasan Dari Bea Masuk Dan Bea Keluar Golongan Pejabat Dan Ahli Bangsa Asing Tertentu; d. barang perwakilan negara asing beserta para pejabatnya yang bertugas di Indonesia;",
