doc_id,nama_dokumen,bab,bagian,pasal,angka,ayat,isi,penjelasan
DOC372,bn415-2011.txt,,,Pasal 2,,1,Bea Masuk Ditanggung Pemerintah diberikan atas impor Barang dan Bahan sebagaimana tercantum dalam Lampiran Peraturan Menteri Keuangan ini yang merupakan bagian tidak terpisahkan dari Peraturan Menteri Keuangan ini.,
DOC372,bn415-2011.txt,,,Pasal 2,,2,Bea Masuk Ditanggung Pemerintah sebagaimana dimaksud pada ayat (1) merupakan belanja subsidi pajak ditanggung pemerintah sebagaimana dimaksud dalam Peraturan Menteri Keuangan mengenai mekanisme pelaksanaan dan pertanggungjawaban atas bea masuk ditanggung pemerintah.,
DOC372,bn415-2011.txt,,,Pasal 2,,3,"Bea Masuk Ditanggung Pemerintah tidak diberikan terhadap: a. Barang dan Bahan yang dikenakan tarif umum bea masuk sebesar 0% (nol persen); b. Barang dan Bahan yang dikenakan tarif bea masuk sebesar 0% (nol persen) berdasarkan perjanjian atau kesepakatan internasional; c. Barang dan Bahan yang dikenakan Bea Masuk Anti Dumping/Bea Masuk Anti Dumping Sementara, Bea Masuk Tindakan Pengamanan/Bea Masuk Tindakan Pengamanan Sementara, Bea Masuk Imbalan, Bea Masuk Tindakan Pembalasan; d. Barang dan Bahan yang diimpor ke dalam Kawasan Berikat menggunakan dokumen Pemberitahuan Pabean Impor dengan mendapat penangguhan bea masuk dan pajak dalam rangka impor; dan/atau e. Barang dan Bahan yang diimpor dalam rangka pemanfaatan fasilitas Kemudahan Impor Tujuan Ekspor.",
DOC372,bn415-2011.txt,,,Pasal 2,,4,"Bea Masuk Ditanggung Pemerintah sebagaimana dimaksud pada ayat (1), diberikan dengan pagu anggaran sebesar Rp880.000.000,00 (delapan ratus delapan puluh juta rupiah).",
DOC372,bn415-2011.txt,,,Pasal 2,,5,"Menteri Keuangan selaku Bendahara Umum Negara sebagai Pengguna Anggaran Bagian Anggaran Bendahara Umum Negara menetapkan Direktur Jenderal Basis Industri Manufaktur, Kementerian Perindustrian selaku Kuasa Pengguna Anggaran untuk melaksanakan pembayaran belanja subsidi pajak ditanggung pemerintah.",
DOC372,bn415-2011.txt,,,Pasal 2,,6,"Alokasi anggaran Bea Masuk Ditanggung Pemerintah dengan pagu sebagaimana dimaksud pada ayat (4) untuk Perusahaan, ditetapkan oleh Kuasa Pengguna Anggaran sebagaimana dimaksud pada ayat (5).",
DOC372,bn415-2011.txt,,,Pasal 3,,1,"Untuk memperoleh Bea Masuk Ditanggung Pemerintah sebagaimana dimaksud dalam Pasal 2 ayat (1), Perusahaan mengajukan permohonan kepada Direktur Jenderal Bea dan Cukai dengan dilampiri Rencana Impor Barang yang telah disetujui dan ditandatangani oleh Direktur Jenderal Basis Industri Manufaktur, Kementerian Perindustrian.",
DOC372,bn415-2011.txt,,,Pasal 3,,2,"Rencana Impor Barang sebagaimana dimaksud pada ayat (1), paling sedikit memuat elemen data sebagai berikut: a. nomor dan tanggal Rencana Impor Barang; b. nama Perusahaan; c. Nomor Pokok Wajib Pajak; d. alamat; e. kantor pabean tempat pemasukan barang; f. uraian, jenis dan spesifikasi teknis barang; g. pos tarif (HS); h. jumlah/satuan barang; i. perkiraan harga impor; j. negara asal; k. perkiraan bea masuk yang ditanggung pemerintah; dan l. pimpinan Perusahaan.",
DOC372,bn415-2011.txt,,,Pasal 4,,1,"Atas permohonan sebagaimana dimaksud dalam Pasal 3 ayat (1), Direktur Jenderal Bea dan Cukai memberikan persetujuan atau penolakan dalam jangka waktu paling lama 14 (empat belas) hari terhitung sejak permohonan diterima secara lengkap.",
DOC372,bn415-2011.txt,,,Pasal 4,,2,Persetujuan sebagaimana dimaksud pada ayat (1) dapat berupa persetujuan sebagian atau persetujuan seluruhnya atas Barang dan Bahan yang tercantum dalam Rencana Impor Barang yang dilampirkan pada permohonan yang diajukan Perusahaan sebagaimana dimaksud dalam Pasal 3.,
DOC372,bn415-2011.txt,,,Pasal 4,,3,"Dalam hal permohonan sebagaimana dimaksud dalam Pasal 3 ayat (1) disetujui sebagian atau seluruhnya, Direktur Jenderal Bea dan Cukai atas nama Menteri Keuangan menerbitkan Keputusan Menteri Keuangan mengenai Bea Masuk Ditanggung Pemerintah atas impor Barang dan Bahan guna pembuatan alat tulis berupa ballpoint oleh industri pembuatan alat tulis berupa ballpoint.",
DOC372,bn415-2011.txt,,,Pasal 4,,4,"Dalam hal permohonan sebagaimana dimaksud dalam Pasal 3 ayat (1) ditolak, Direktur Jenderal Bea dan Cukai atas nama Menteri Keuangan menyampaikan surat pemberitahuan penolakan kepada Perusahaan dengan menyebutkan alasan penolakan.",
DOC372,bn415-2011.txt,,,Pasal 5,,1,"Atas realisasi impor Bea Masuk Ditanggung Pemerintah yang pelaksanaannya didasarkan pada Keputusan Menteri Keuangan sebagaimana dimaksud dalam Pasal 4 ayat (3), Kantor Pengawasan dan Pelayanan Bea dan Cukai atau Kantor Pelayanan Utama Bea dan Cukai setempat membubuhkan cap ""BEA MASUK DITANGGUNG PEMERINTAH BERDASARKAN PERATURAN MENTERI KEUANGAN NOMOR 105/PMK.011/2011"" pada semua lembar Pemberitahuan Pabean Impor.",
DOC372,bn415-2011.txt,,,Pasal 5,,2,"Pemberitahuan Pabean Impor sebagaimana dimaksud pada ayat (1), dipakai sebagai dasar untuk pencatatan penerimaan Bea Masuk Ditanggung Pemerintah dan dialokasikan sebagai belanja subsidi pajak dalam jumlah yang sama.",
DOC372,bn415-2011.txt,,,Pasal 6,,1,"Dalam hal terdapat perbedaan antara Barang dan Bahan yang akan diimpor dengan daftar Barang dan Bahan yang terdapat dalam Keputusan Menteri Keuangan sebagaimana dimaksud dalam Pasal 4 ayat (3), Perusahaan dapat mengajukan permohonan perubahan Keputusan Menteri Keuangan.",
DOC372,bn415-2011.txt,,,Pasal 6,,2,"Permohonan sebagaimana dimaksud pada ayat (1), diajukan kepada Direktur Jenderal Bea dan Cukai dilampiri dengan Rencana Impor Barang Perubahan yang telah disetujui dan ditandatangani oleh Direktorat Jenderal Basis Industri Manufaktur, Kementerian Perindustrian.",
DOC372,bn415-2011.txt,,,Pasal 7,,1,"Atas permohonan sebagaimana dimaksud dalam Pasal 6, Direktur Jenderal Bea dan Cukai memberikan persetujuan atau penolakan dalam jangka waktu paling lama 14 (empat belas) hari terhitung sejak permohonan diterima secara lengkap.",
DOC372,bn415-2011.txt,,,Pasal 7,,2,Persetujuan atas permohonan perubahan Keputusan Menteri Keuangan sebagaimana dimaksud pada ayat (1) dapat berupa persetujuan sebagian atau persetujuan seluruhnya.,
DOC372,bn415-2011.txt,,,Pasal 7,,3,"Dalam hal permohonan sebagaimana dimaksud dalam Pasal 6 disetujui sebagian atau seluruhnya, Direktur Jenderal Bea dan Cukai atas nama Menteri Keuangan menerbitkan Keputusan Menteri Keuangan mengenai Bea Masuk Ditanggung Pemerintah atas impor Barang dan Bahan guna pembuatan alat tulis berupa ballpoint oleh industri pembuatan alat tulis berupa ballpoint.",
DOC372,bn415-2011.txt,,,Pasal 7,,4,"Dalam hal permohonan sebagaimana dimaksud dalam Pasal 6 ditolak, Direktur Jenderal Bea dan Cukai atas nama Menteri Keuangan menyampaikan surat pemberitahuan penolakan kepada Perusahaan dengan menyebutkan alasan penolakan. Pelaksanaan dan pertanggungjawaban atas Bea Masuk Ditanggung Pemerintah sebagaimana dimaksud dalam Pasal 2, dilaksanakan sesuai dengan ketentuan dalam Peraturan Menteri Keuangan yang mengatur mengenai mekanisme pelaksanaan dan pertanggungjawaban atas Bea Masuk Ditanggung Pemerintah.",
DOC372,bn415-2011.txt,,,Pasal 9,,1,"Terhadap Barang dan Bahan yang memperoleh Bea Masuk Ditanggung Pemerintah, wajib digunakan oleh Perusahaan yang bersangkutan guna pembuatan alat tulis berupa ballpoint dan tidak dapat dipindahtangankan kepada pihak lain.",
DOC372,bn415-2011.txt,,,Pasal 9,,2,"Atas penyalahgunaan ketentuan sebagaimana dimaksud pada ayat (1), Perusahaan wajib membayar bea masuk yang seharusnya dibayar ditambah dengan bunga sebesar 2% (dua persen) per bulan paling lama 24 (dua puluh empat) bulan sejak dilakukan realisasi impor Bea Masuk Ditanggung Pemerintah sebagaimana dimaksud dalam Pasal 5 ayat (1). Peraturan Menteri Keuangan ini mulai berlaku pada tanggal diundangkan sampai dengan tanggal 31 Desember 2011. Agar setiap orang mengetahuinya, memerintahkan pengundangan Peraturan Menteri Keuangan ini dengan penempatannya dalam Berita Negara Republik Indonesia. Diundangkan di Jakarta pada tanggal 18 Juli 2011 MENTERI HUKUM DAN HAK ASASI MANUSIA REPUBLIK INDONESIA, PATRIALIS AKBAR LAMPIRAN PERATURAN MENTERI KEUANGAN NOMOR 105/PMK.011/2011 TENTANG BEA MASUK DITANGGUNG PEMERINTAH ATAS IMPOR BARANG DAN BAHAN GUNA PEMBUATAN ALAT TULIS BERUPA BALLPOINT UNTUK TAHUN ANGGARAN 2011. DAFTAR BARANG DAN BAHAN GUNA PEMBUATAN ALAT TULIS BERUPA BALLPOINT YANG MENDAPAT BEA MASUK DITANGGUNG PEMERINTAH UNTUK TAHUN ANGGARAN 2011 TERMASUK MENTERI KEUANGAN, AGUS D.W. MARTOWARDOJO",
