doc_id,nama_dokumen,bab,bagian,pasal,angka,ayat,isi,penjelasan
DOC437,bn54-2010.txt,,,Pasal 1,,1,Terhadap impor barang berupa Uncoated Paper and Writing Paper dikenakan Bea Masuk Anti Dumping.,
DOC437,bn54-2010.txt,,,Pasal 1,,2,"Barang berupa Uncoated Paper and Writing Paper sebagaimana dimaksud pada ayat (1) meliputi: a. Kertas cetak, tulis atau fotocopy lainnya, dan kertas dari jenis yang digunakan untuk keperluan grafik, dengan berat 40g/m² atau lebih tetapi tidak lebih dari 150g/m², dalam gulungan, kecuali carbonising base paper yang beratnya 20g/m² atau lebih, kertas untuk pencetakan uang kertas, digunakan dalam pembuatan papan gips dan kartu, atau kertas komputer, aluminium base paper, termasuk dalam pos tarif 4802.55.90.00; b. Kertas cetak, tulis atau fotocopy lainnya, dan kertas dari jenis yang digunakan untuk keperluan grafik, dalam lembaran dengan berat 40g/m² atau lebih tetapi tidak lebih dari 150g/m² dengan satu sisinya tidak melebihi 435mm dan sisi lainnya tidak melebihi 297mm dalam keadaan tidak dilipat, kecuali carbonising base paper yang beratnya 20g/m² atau lebih, kertas untuk pencetakan uang kertas, digunakan dalam pembuatan papan gips dan kartu atau kertas komputer, aluminium base paper, termasuk dalam pos tarif 4802.56.90.00; dan c. Kertas cetak, tulis atau fotocopy lainnya, dan kertas dari jenis yang digunakan untuk keperluan grafik, selain gulungan dan lembaran yang satu sisinya melebihi 435mm dan sisi lainnya melebihi 297mm dalam keadaan tidak dilipat dengan berat 40g/m² atau lebih tetapi tidak lebih dari 150g/m², kecuali carbonising base paper yang beratnya 20g/m² atau lebih, kertas untuk pencetakan uang kertas, yang digunakan dalam pembuatan papan gips dan kartu atau kertas komputer, aluminium base paper, dan kertas dan kertas karton hias termasuk dengan tanda air, granitized felt finish, serat atau blend of speck, dan vellum antique finish, termasuk dalam pos tarif 4802.57.00.00. Negara asal dan nama produsen/eksportir barang yang dikenakan Bea Masuk Anti Dumping dan besaran Bea Masuk Anti Dumping sebagaimana dimaksud dalam Pasal 1 adalah sebagai berikut: - Negara Asal: Finlandia - Nama Produsen/Eksportir: UPM Kymmene Group - Bea Masuk Anti Dumping: 22,44% - Bea Masuk Anti Dumping untuk Produsen/Eksportir Lainnya: 60,40% - Negara Asal: Republik Korea - Nama Produsen/Eksportir: Semua Produsen/Eksportir - Bea Masuk Anti Dumping: 59,64% - Negara Asal: India - Nama Produsen/Eksportir: Tamil Nadu Newsprint and Papers Ltd. - Bea Masuk Anti Dumping: 7,41% - Nama Produsen/Eksportir: Seshasayee Paper and Board Ltd. - Bea Masuk Anti Dumping: 6,19% - Bea Masuk Anti Dumping untuk Produsen/Eksportir Lainnya: 40,13% - Negara Asal: Malaysia - Nama Produsen/Eksportir: Sabah Forest Industries SDN BHD - Bea Masuk Anti Dumping: 6,20% - Bea Masuk Anti Dumping untuk Produsen/Eksportir Lainnya: 24,33%",
DOC437,bn54-2010.txt,,,Pasal 3,,1,Pengenaan Bea Masuk Anti Dumping sebagaimana dimaksud dalam Pasal 1 merupakan tambahan Bea Masuk yang dipungut berdasarkan skema Tarif Bea Masuk Umum/Most Favoured Nation (MFN) atau berdasarkan skema Tarif Bea Masuk Preferensi untuk Produsen/Eksportir yang berasal dari negara-negara yang memiliki kerjasama perdagangan dengan Indonesia.,
DOC437,bn54-2010.txt,,,Pasal 3,,2,"Dalam hal ketentuan dalam skema Tarif Bea Masuk Preferensi tidak dipenuhi, Bea Masuk Anti Dumping sebagaimana dimaksud dalam Pasal 1 merupakan tambahan Bea Masuk Umum/Most Favoured Nation (MFN). Ketentuan mengenai pengenaan tarif Bea Masuk Anti Dumping sebagaimana dimaksud dalam Pasal 2, berlaku terhadap impor barang yang dokumen Pemberitahuan Pabean Impor mendapatkan Nomor Pendaftaran dari Kantor Pabean di pelabuhan pemasukan sejak tanggal berlakunya Peraturan Menteri Keuangan ini.",
DOC437,bn54-2010.txt,,,Pasal 5,,1,Peraturan Menteri Keuangan ini mulai berlaku pada tanggal diundangkan.,
DOC437,bn54-2010.txt,,,Pasal 5,,2,"Peraturan Menteri Keuangan ini berlaku selama 12 (dua belas) bulan terhitung sejak tanggal berlakunya Peraturan Menteri Keuangan ini sebagaimana dimaksud pada angka 1. Agar setiap orang mengetahuinya, memerintahkan pengundangan Peraturan Menteri Keuangan ini dengan penempatannya dalam Berita Negara Republik Indonesia. MENTERI KEUANGAN REPUBLIK INDONESIA, SRI MULYANI INDRAWATI Diundangkan di Jakarta pada tanggal 1 Februari 2010 MENTERI HUKUM DAN HAK ASASI MANUSIA REPUBLIK INDONESIA, PATRIALIS AKBAR",
