doc_id,nama_dokumen,bab,bagian,pasal,angka,ayat,isi,penjelasan
DOC467,bn621-2010.txt,,,Pasal 4,,1,Perusahaan yang telah memperoleh penetapan sebagai IT-Produk Tertentu wajib menyampaikan laporan tertulis pelaksanaan impor Produk Tertentu.,
DOC467,bn621-2010.txt,,,Pasal 4,,2,Penyampaian laporan sebagaimana dimaksud pada ayat (1) dilakukan baik importasinya terealisasi maupun tidak terealisasi.,
DOC467,bn621-2010.txt,,,Pasal 4,,3,"Laporan sebagaimana dimaksud pada ayat (1) disampaikan kepada Direktur setiap 3 (tiga) bulan sekali paling lambat pada tanggal 15 bulan berikutnya melalui http://inatrade.depdag.go.id, dengan bentuk laporan sebagaimana tercantum dalam Lampiran II yang merupakan bagian tidak terpisahkan dari Peraturan Menteri ini.",
DOC467,bn621-2010.txt,,,Pasal 5,,1,"Setiap impor Produk Tertentu oleh IT-Produk Tertentu hanya dapat dilakukan melalui pelabuhan tujuan: a. pelabuhan laut: Belawan di Medan, Tanjung Priok di Jakarta, Tanjung Emas di Semarang, Tanjung Perak di Surabaya, Soekarno Hatta di Makassar, Dumai di Dumai, dan Jayapura di Jayapura; dan/atau b. seluruh pelabuhan udara internasional.",
DOC467,bn621-2010.txt,,,Pasal 5,,2,Impor Produk Tertentu oleh IT-Produk Tertentu yang dilakukan melalui pelabuhan laut Dumai dan pelabuhan laut Jayapura hanya untuk produk makanan dan minuman.,
DOC467,bn621-2010.txt,,,Pasal 5,,3,Impor Produk Tertentu untuk kebutuhan Kawasan Perdagangan Bebas dan Pelabuhan Bebas diatur sesuai ketentuan peraturan perundang-undangan mengenai Kawasan Perdagangan Bebas dan Pelabuhan Bebas.,
DOC467,bn621-2010.txt,,,Pasal 8,,1,"Penetapan sebagai IT-Produk Tertentu dicabut dalam hal: a. perusahaan tidak melakukan kewajiban penyampaian laporan sebagaimana dimaksud dalam Pasal 4; b. perusahaan tidak melakukan impor Produk Tertentu dalam jangka waktu 6 (enam) bulan berturut-turut; dan/atau c. adanya rekomendasi dari Direktorat Jenderal Bea dan Cukai Kementerian Keuangan, perusahaan telah melakukan pelanggaran di bidang kepabeanan.",
DOC467,bn621-2010.txt,,,Pasal 8,,2,"Perusahaan yang telah dicabut penetapannya sebagai IT-Produk Tertentu sebagaimana dimaksud pada ayat (1) dapat mengajukan permohonan sebagai IT-Produk Tertentu yang baru setelah 6 (enam) bulan sejak berlaku tanggal pencabutan. Ketentuan kewajiban Verifikasi dan Penelusuran Teknis Impor sebagaimana dimaksud dalam Pasal 6 tidak berlaku bagi impor obat tradisional dan herbal serta kosmetik. Pasal II Peraturan Menteri ini mulai berlaku setelah 30 (tiga puluh) hari sejak tanggal ditetapkan. Agar setiap orang mengetahuinya, memerintahkan pengundangan Peraturan Menteri ini dengan penempatannya dalam Berita Negara Republik Indonesia. MENTERI PERDAGANGAN REPUBLIK INDONESIA, MARI ELKA PANGESTU Diundangkan di Jakarta pada tanggal 17 Desember 2010 MENTERI HUKUM DAN HAK ASASI MANUSIA REPUBLIK INDONESIA, PATRIALIS AKBAR BERITA NEGARA REPUBLIK INDONESIA TAHUN 2010 NOMOR 621 LAMPIRAN PERATURAN MENTERI PERDAGANGAN R.I NOMOR: 23/M-DAG/PER/5/2010 TANGGAL: 21 Mei 2010 DAFTAR TAMBAHAN PRODUK TERTENTU YANG DAPAT DIIMPOR NO URAIAN BARANG POS TARIF / HS OBAT TRADISIONAL DAN HERBAL KOSMETIK Sabun; produk dan preparat aktif permukaan organik digunakan sebagai sabun, dalam bentuk batangan, cake, potongan atau bentukan yang dicetak, mengandung sabun maupun tidak; produk dan preparat aktif permukaan organik untuk membersihkan kulit dalam bentuk cair atau krim dan disiapkan untuk penjualan eceran, mengandung sabun maupun tidak; kertas, gumpalan, kain kempa dan bukan tenunan, diresapi, dilapisi, atau ditutupi dengan sabun atau deterjen 3401.11.10.00 ELEKTRONIKA MENTERI PERDAGANGAN R.I., ttd MARI ELKA PANGESTU Salinan sesuai dengan aslinya Sekretariat Jenderal Kementerian Perdagangan Kepala Biro Hukum, ttd WIDODO",
