doc_id,nama_dokumen,bab,bagian,pasal,angka,ayat,isi,penjelasan
DOC516,peraturan-bpom-no-1-tahun-2024.txt,BAB II,,Pasal 2,,1,"Setiap permohonan analisis hasil pengawasan (AHP) dalam rangka impor dan ekspor narkotika, psikotropika, dan prekursor farmasi harus diajukan oleh pemohon yang telah memenuhi persyaratan administratif dan teknis.",
DOC516,peraturan-bpom-no-1-tahun-2024.txt,BAB II,,Pasal 2,,2,Persyaratan administratif dan teknis sebagaimana dimaksud pada ayat (1) meliputi dokumen-dokumen yang ditentukan dalam lampiran peraturan ini. DOKUMEN PERSYARATAN,
DOC516,peraturan-bpom-no-1-tahun-2024.txt,BAB III,,Pasal 3,,1,"Dokumen persyaratan dalam permohonan AHP untuk keperluan impor dengan tujuan kepentingan pelayanan kesehatan adalah sebagai berikut: - Rencana kebutuhan tahunan dari Industri Farmasi yang telah diterbitkan Kementerian Kesehatan pada periode tahun berjalan. - Surat pernyataan belum pernah melakukan impor narkotika, psikotropika, atau prekursor farmasi atau informasi nomor SPI terakhir. - Laporan realisasi impor terakhir pada sistem SINSW. - Laporan realisasi penggunaan bahan baku, produk jadi, dan baku pembanding dari Industri Farmasi pada periode satu tahun sebelumnya dan pada tahun berjalan yang dilaporkan secara daring melalui laman resmi pelaporan kegiatan Industri Farmasi BPOM. - Rencana produksi Industri Farmasi periode tahun berjalan dan satu tahun ke depan yang dilaporkan secara daring melalui laman resmi pelaporan kegiatan Industri Farmasi BPOM. - Rencana kebutuhan periode tahun berjalan dan satu tahun ke depan untuk pengembangan produk yang ditandatangani oleh apoteker penanggung jawab produksi di Industri Farmasi atau pengguna akhir, bila impor dalam rangka pengembangan obat. - Rencana kebutuhan baku pembanding periode tahun berjalan dan satu tahun ke depan yang ditandatangani oleh apoteker penanggung jawab produksi, bila yang impor berupa baku pembanding. - Surat pesanan (purchasing order) dari Industri Farmasi sebagai pengguna akhir. - Surat pesanan (purchasing order) kepada eksportir di negara pengekspor. - Surat keterangan dari BPOM tentang persetujuan penggunaan bahan baku dan/atau baku pembanding untuk keperluan pengembangan produk.",
DOC516,peraturan-bpom-no-1-tahun-2024.txt,BAB III,,Pasal 3,,2,"Bila belum pernah melakukan impor narkotika, psikotropika, atau prekursor farmasi, maka dokumen persyaratan tidak dipersyaratkan. KETENTUAN PENUTUP Pada saat Peraturan Badan ini mulai berlaku, Peraturan Badan Pengawas Obat dan Makanan Nomor 26 Tahun 2020 tentang Persyaratan dan Tata Cara Permohonan Analisa Hasil Pengawasan dalam rangka Impor dan Ekspor Narkotika, Psikotropika, dan Prekursor Farmasi (Berita Negara Republik Indonesia Tahun 2020 Nomor 1122), dicabut dan dinyatakan tidak berlaku. Peraturan Badan ini mulai berlaku setelah enam bulan terhitung sejak tanggal diundangkan. Agar setiap orang mengetahuinya, memerintahkan pengundangan Peraturan Badan ini dengan penempatannya dalam Berita Negara Republik Indonesia. Plt. KEPALA BADAN PENGAWAS OBAT DAN MAKANAN, ttd. LUCIA RIZKA ANDALUSIA Diundangkan di Jakarta pada tanggal 29 Januari 2024 DIREKTUR JENDERAL PERATURAN PERUNDANG-UNDANGAN KEMENTERIAN HUKUM DAN HAK ASASI MANUSIA REPUBLIK INDONESIA, ttd. ASEP N. MULYANA BERITA NEGARA REPUBLIK INDONESIA TAHUN 2024 NOMOR 63 LAMPIRAN I PERATURAN BADAN PENGAWAS OBAT DAN MAKANAN NOMOR 1 TAHUN 2024 TENTANG PERSYARATAN DAN TATA CARA PERMOHONAN ANALISIS HASIL PENGAWASAN DALAM RANGKA IMPOR DAN EKSPOR NARKOTIKA, PSIKOTROPIKA, DAN PREKURSOR FARMASI A. KETENTUAN PERUBAHAN DATA PEMOHON AHP B. DOKUMEN PERSYARATAN DALAM PERMOHONAN AHP UNTUK KEPERLUAN IMPOR DENGAN TUJUAN KEPENTINGAN PELAYANAN KESEHATAN C. DOKUMEN PERSYARATAN DALAM PERMOHONAN AHP UNTUK KEPERLUAN EKSPOR D. DOKUMEN PERSYARATAN DALAM PERMOHONAN AHP UNTUK KEPERLUAN IMPOR DENGAN TUJUAN PENGEMBANGAN ILMU PENGETAHUAN Plt. KEPALA BADAN PENGAWAS OBAT DAN MAKANAN, ttd. LUCIA RIZKA ANDALUSIA LAMPIRAN II PERATURAN BADAN PENGAWAS OBAT DAN MAKANAN NOMOR 1 TAHUN 2024 TENTANG PERSYARATAN DAN TATA CARA PERMOHONAN ANALISIS HASIL PENGAWASAN DALAM RANGKA IMPOR DAN EKSPOR NARKOTIKA, PSIKOTROPIKA, DAN PREKURSOR FARMASI FORMAT KEPUTUSAN PERSETUJUAN AHP ANALISIS HASIL PENGAWASAN NARKOTIKA/PSIKOTROPIKA/PREKURSOR BADAN POM RI Analisis Hasil Pengawasan (Narkotika / Psikotropika / Prekursor Farmasi) ini merupakan bagian yang tidak terpisahkan dari Surat Persetujuan (Impor / Ekspor) yang diterbitkan oleh Menteri Kesehatan RI. Berlaku sampai dengan tanggal ..... dan hanya untuk satu kali pengiriman. Yang bertandatangan di bawah ini Direktur Pengawasan Keamanan, Mutu dan Ekspor Impor Obat, Narkotika, Psikotropika, Prekursor, dan Zat Adiktif dengan ini menerangkan bahwa permohonan AHP (Narkotika / Psikotropika / Prekursor Farmasi) dari perusahaan ...... telah memenuhi syarat dengan data-data sebagai berikut: Importir: ......... Eksportir: ......... Pengguna akhir: .......... Tujuan (Impor/Ekspor): .... Bahan baku atau obat jadi yang (diimpor/diekspor): .... Jumlah Barang: .... Jumlah Kemasan: .... Zat khasiat (narkotika/psikotropika/Prekursor Farmasi): .... Tanggal: .... Direktur Pengawasan Keamanan, Mutu dan Ekspor Impor Obat, Narkotika, Psikotropika, Prekursor, dan Zat Adiktif NIP: ... Jalan Percetakan Negara No. 23 Jakarta Pusat 10560 Indonesia Telp. (021) 4245139, 4245523, 42883309, 42883462, 42883278, Ext: 1075 Fax: 4243605, 42884208, 4253857 E-mail: halobpom@pom.go.id; ditwaskmeionappza@pom.go.id; Website: www.pom.go.id Plt. KEPALA BADAN PENGAWAS OBAT DAN MAKANAN, ttd. LUCIA RIZKA ANDALUSIA Dengan Rahmat Tuhan Yang Maha Esa a. bahwa untuk melaksanakan ketentuan dalam peraturan perundang-undangan di bidang Narkotika, Psikotropika, dan Prekursor Farmasi, perlu adanya pengaturan mengenai impor dan ekspor Narkotika, Psikotropika, dan Prekursor Farmasi; b. bahwa untuk menjamin ketersediaan Narkotika, Psikotropika, dan Prekursor Farmasi yang diperlukan untuk kepentingan pelayanan kesehatan dan pengembangan ilmu pengetahuan dan teknologi, perlu ditetapkan peraturan mengenai persyaratan dan tata cara pengajuan permohonan AHP; c. bahwa berdasarkan pertimbangan sebagaimana dimaksud dalam huruf a dan b, perlu menetapkan Peraturan Badan tentang Persyaratan dan Tata Cara Pengajuan Permohonan AHP. a. Undang-Undang Nomor 35 Tahun 2009 tentang Narkotika; b. Undang-Undang Nomor 5 Tahun 1997 tentang Psikotropika; c. Undang-Undang Nomor 36 Tahun 2009 tentang Kesehatan; d. Peraturan Pemerintah Nomor 72 Tahun 1998 tentang Pengawasan Terhadap Obat dan Makanan; e. Peraturan Menteri Kesehatan Nomor 1010/MENKES/PER/X/2008 tentang Pengawasan Narkotika dan Psikotropika; f. Peraturan Menteri Kesehatan Nomor 4 Tahun 2018 tentang Pengawasan Prekursor Farmasi; g. Peraturan Badan Pengawas Obat dan Makanan Nomor 12 Tahun 2019 tentang Tata Cara Pengajuan dan Evaluasi Permohonan AHP. Menetapkan: Peraturan Badan tentang Persyaratan dan Tata Cara Pengajuan Permohonan AHP. Dalam Peraturan ini yang dimaksud dengan: Narkotika, Psikotropika, dan Prekursor Farmasi hanya dapat diimpor atau diekspor dengan tujuan untuk: a. kepentingan pelayanan kesehatan; dan/atau b. pengembangan ilmu pengetahuan dan teknologi. Narkotika, Psikotropika, dan Prekursor Farmasi sebagaimana dimaksud pada ayat (1) hanya dapat diimpor atau diekspor setelah mendapatkan SPI dan/atau SPE yang diterbitkan oleh Menteri sesuai dengan ketentuan peraturan perundang-undangan. Importir atau eksportir harus memiliki AHP sebelum mengajukan permohonan SPI dan/atau SPE. AHP sebagaimana dimaksud pada ayat (3) diterbitkan oleh Kepala Badan. AHP sebagaimana dimaksud pada ayat (4) hanya dapat digunakan untuk 1 (satu) kali pengajuan permohonan SPI dan/atau SPE. Pemohon AHP untuk keperluan Impor Narkotika harus memiliki perizinan berusaha sebagai importir Narkotika dari Menteri sesuai dengan ketentuan peraturan perundang-undangan. Pemohon AHP untuk keperluan Impor Psikotropika meliputi IP Psikotropika, IT Psikotropika, atau Lembaga Ilmu Pengetahuan. Pemohon AHP untuk keperluan Impor Prekursor Farmasi meliputi IP Prekursor Farmasi, IT Prekursor Farmasi, atau Lembaga Ilmu Pengetahuan. Pemohon AHP untuk keperluan Ekspor Narkotika harus memiliki perizinan berusaha sebagai eksportir Narkotika dari Menteri. Pemohon AHP untuk keperluan Ekspor Psikotropika harus memiliki perizinan berusaha sebagai EP Psikotropika atau ET Psikotropika dari Menteri. Pemohon AHP untuk keperluan Ekspor Prekursor Farmasi harus memiliki perizinan berusaha sebagai EP Prekursor Farmasi atau ET Prekursor Farmasi dari Menteri. Perizinan berusaha sebagaimana dimaksud pada ayat (1), ayat (2), dan ayat (3) dilaksanakan sesuai dengan ketentuan peraturan perundang-undangan. PERSYARATAN DAN TATA CARA Bagian Kesatu Permohonan Akun Pemohon AHP harus melakukan pendaftaran untuk mendapatkan nama pengguna dan kata sandi melalui laman resmi pelayanan AHP BPOM. Pendaftaran sebagaimana dimaksud pada ayat (1) dilengkapi dengan entry data secara elektronik dan mengunggah dokumen persyaratan pada laman resmi pelayanan AHP BPOM. Dokumen persyaratan sebagaimana dimaksud pada ayat (2) untuk Industri Farmasi dan PBF meliputi: a. perizinan berusaha Industri Farmasi atau perizinan berusaha PBF sesuai dengan ketentuan peraturan perundang-undangan; b. nomor pokok wajib pajak; c. izin khusus importir Narkotika; d. izin sebagai IP Psikotropika dan/atau izin sebagai IP Prekursor Farmasi; e. izin sebagai IT Psikotropika dan/atau izin sebagai IT Prekursor Farmasi; f. izin khusus eksportir Narkotika; g. izin sebagai EP Psikotropika dan/atau EP Prekursor Farmasi; dan/atau h. izin sebagai ET Psikotropika dan/atau ET Prekursor Farmasi. Dokumen persyaratan sebagaimana dimaksud pada ayat (2) untuk Lembaga Ilmu Pengetahuan meliputi: a. dokumen perizinan berusaha sesuai dengan ketentuan peraturan perundang-undangan; dan b. nomor pokok wajib pajak. BPOM melakukan verifikasi terhadap permohonan pendaftaran sebagaimana dimaksud pada ayat (1) sampai dengan ayat (4). Dalam hal hasil verifikasi sebagaimana dimaksud pada ayat (5) dinyatakan lengkap dan benar, pemohon AHP mendapatkan persetujuan pendaftaran berupa nama pengguna dan kata sandi untuk login ke laman resmi pelayanan AHP BPOM. Pendaftaran sebagaimana dimaksud dalam Pasal 5 hanya dilakukan untuk 1 (satu) kali sepanjang tidak terjadi perubahan data pemohon. Dalam hal terjadi perubahan data yang termasuk dalam ketentuan perubahan sebagaimana tercantum dalam Lampiran I, pemohon harus: a. mengajukan perubahan data pemohon; atau b. mengajukan pendaftaran kembali sebagai pemohon. Pengajuan perubahan data pemohon sebagaimana dimaksud pada ayat (2) huruf a dilakukan dengan mengubah data melalui laman resmi pelayanan AHP BPOM dengan melampirkan dokumen persyaratan sebagaimana tercantum dalam Lampiran I yang merupakan bagian tidak terpisahkan dari Peraturan Badan ini. Pengajuan pendaftaran kembali sebagai pemohon sebagaimana dimaksud pada ayat (2) huruf b dilaksanakan sesuai dengan ketentuan pendaftaran sebagaimana dimaksud dalam Pasal 5. BPOM melakukan verifikasi terhadap pengajuan perubahan data pemohon sebagaimana dimaksud pada ayat (3). BPOM memberikan persetujuan atau penolakan perubahan data yang diajukan oleh Pemohon AHP. Dalam hal pemohon AHP tidak dapat login ke laman resmi pelayanan AHP BPOM atau SINSW, dapat menggunakan fasilitas “lupa kata sandi”. Dalam hal pemohon AHP tidak dapat menggunakan fasilitas “lupa kata sandi” sebagaimana dimaksud pada ayat (1), pemohon AHP harus mengajukan surat permohonan perubahan identitas kepada BPOM. Pelaksanaan pendaftaran pemohon AHP dan perubahan data pemohon AHP sebagaimana dimaksud dalam Pasal 5 dan Pasal 6, sesuai dengan petunjuk penggunaan secara elektronik pada laman resmi pelayanan AHP BPOM. Bagian Kedua Pengajuan dan Evaluasi Permohonan Paragraf 1 Pengajuan Permohonan Pengajuan dan evaluasi permohonan dilaksanakan melalui laman resmi pelayanan AHP BPOM yang terintegrasi dengan SINSW sesuai dengan ketentuan peraturan perundang-undangan. Pemohon AHP yang telah memiliki nama pengguna dan kata sandi sebagaimana dimaksud dalam Pasal 5 ayat (6) dapat mengajukan permohonan AHP. Pengajuan permohonan AHP sebagaimana dimaksud pada ayat (1) dilakukan untuk setiap 1 (satu) item Narkotika, Psikotropika, atau Prekursor Farmasi untuk 1 (satu) kali Impor atau Ekspor. Pemohon AHP sebagaimana dimaksud pada ayat (1) yang mengajukan permohonan AHP harus menyampaikan dokumen persyaratan secara elektronik. Dokumen persyaratan sebagaimana dimaksud pada ayat (3) tercantum dalam Lampiran I yang merupakan bagian tidak terpisahkan dari Peraturan Badan ini. Paragraf 2 Evaluasi Permohonan dan Penerbitan Keputusan BPOM melakukan evaluasi melalui pemeriksaan terhadap kelengkapan dan kebenaran dokumen persyaratan yang disampaikan oleh pemohon AHP sebagaimana dimaksud dalam Pasal 10. Evaluasi sebagaimana dimaksud pada ayat (1) dilaksanakan dengan menggunakan mekanisme dilanjutkan (clock on) dan dihentikan (clock off) paling lama 3 (tiga) Hari terhitung sejak pembayaran sebagai penerimaan negara bukan pajak diterima oleh BPOM. Dalam hal diperlukan pemastian kesahihan informasi dan/atau data dalam dokumen persyaratan yang disampaikan oleh pemohon AHP, BPOM dapat melakukan pemeriksaan setempat sebagai bagian dari evaluasi sebagaimana dimaksud pada ayat (2). Dalam hal hasil evaluasi sebagaimana dimaksud pada ayat (2) diperlukan tambahan data dan/atau dilakukan pemeriksaan setempat sebagaimana dimaksud pada ayat (3), perhitungan jangka waktu sebagaimana dimaksud pada ayat (2) dihentikan (clock off) sampai dengan pemohon AHP menyampaikan tambahan data dan/atau tindak lanjut sesuai dengan hasil pemeriksaan BPOM. Pemohon AHP menyampaikan tambahan data dan/atau tindak lanjut terhadap hasil pemeriksaan sebagaimana dimaksud pada ayat (4) paling banyak 3 (tiga) kali dalam batas waktu paling lambat 7 (tujuh) hari kalender untuk masing-masing perbaikan terhitung sejak tanggal permintaan tambahan data dan/atau tindak lanjut terhadap hasil pemeriksaan. Perhitungan waktu evaluasi dilanjutkan (clock on) setelah pemohon AHP menyampaikan: a. tambahan data secara lengkap dan benar; dan/atau b. bukti tindak lanjut terhadap hasil pemeriksaan, sesuai dengan batas waktu sebagaimana dimaksud pada ayat (5). BPOM menerbitkan keputusan terhadap hasil evaluasi sebagaimana dimaksud dalam Pasal 11 berupa: a. persetujuan; atau b. penolakan. Persetujuan permohonan AHP sebagaimana dimaksud pada ayat (1) huruf a diterbitkan secara elektronik. AHP sebagaimana dimaksud pada ayat (2) diterbitkan paling lama 3 (tiga) Hari terhitung sejak tanggal permohonan diterima secara lengkap dan memenuhi persyaratan. BPOM menerbitkan keputusan penolakan sebagaimana dimaksud pada ayat (1) huruf b secara elektronik kepada pemohon AHP, berdasarkan: a. hasil evaluasi tidak memenuhi syarat; dan/atau b. pemohon AHP tidak menyerahkan tambahan data dan/atau tindak lanjut hasil pemeriksaan sesuai dengan ketentuan sebagaimana dimaksud dalam Pasal 11 ayat (5). Dalam hal pemohon AHP mendapatkan keputusan penolakan sebagaimana dimaksud pada ayat (4) maka: a. permohonan dianggap batal dan biaya yang telah dibayarkan tidak dapat ditarik kembali; dan b. pemohon AHP harus mengajukan permohonan baru dengan melakukan pembayaran penerimaan negara bukan pajak. Format keputusan berupa persetujuan AHP sebagaimana dimaksud dalam Pasal 12 ayat (1) huruf a tercantum dalam Lampiran II yang merupakan bagian tidak terpisahkan dari Peraturan Badan ini. BIAYA Pemohon AHP dikenai biaya untuk setiap kali pengajuan permohonan sebagai penerimaan negara bukan pajak sesuai dengan ketentuan peraturan perundang-undangan. Pembayaran penerimaan negara bukan pajak sebagaimana dimaksud pada ayat (1) dilakukan dengan mekanisme pembayaran secara elektronik. Pembayaran penerimaan negara bukan pajak dilakukan paling lambat 7 (tujuh) hari kalender terhitung sejak surat perintah pembayaran diterbitkan. MASA BERLAKU DAN PELAPORAN Bagian Kesatu Masa Berlaku AHP memiliki masa berlaku selama 6 (enam) bulan terhitung sejak tanggal diterbitkan. Bagian Kedua Pelaporan",
DOC516,peraturan-bpom-no-1-tahun-2024.txt,BAB IV,,Pasal 17,,1,"Pemohon AHP melakukan pelaporan realisasi Impor dan/atau Ekspor kepada Kepala Badan untuk penggunaan setiap AHP. Dengan Rahmat Tuhan Yang Maha Esa a. Undang-Undang Nomor 36 Tahun 2009 tentang Kesehatan; b. Undang-Undang Nomor 11 Tahun 2020 tentang Cipta Kerja; c. Peraturan Pemerintah Nomor 51 Tahun 2009 tentang Pekerjaan Kesehatan; d. Peraturan Badan Pengawas Obat dan Makanan Nomor 26 Tahun 2020 tentang Persyaratan dan Tata Cara Permohonan Analisa Hasil Pengawasan dalam rangka Impor dan Ekspor Narkotika, Psikotropika, dan Prekursor Farmasi; Menetapkan: Peraturan Badan Pengawas Obat dan Makanan tentang Pelaporan Kegiatan Industri Farmasi dan PBF. KEADAAN KAHAR",
DOC516,peraturan-bpom-no-1-tahun-2024.txt,BAB V,,Pasal 18,,1,"Dalam hal terjadi keadaan kahar, pengajuan permohonan, penerbitan keputusan, dan/atau pembayaran penerimaan negara bukan pajak AHP dapat dilakukan secara manual.",
DOC516,peraturan-bpom-no-1-tahun-2024.txt,BAB V,,Pasal 18,,2,"Keadaan kahar sebagaimana dimaksud pada ayat (1) dapat berupa sistem elektronik tidak berfungsi, kerusuhan, kebakaran, dan/atau bencana alam.",
DOC516,peraturan-bpom-no-1-tahun-2024.txt,BAB V,,Pasal 18,,3,"Dalam hal terjadi keadaan kahar sebagaimana dimaksud pada ayat (2), perhitungan jangka waktu sebagaimana dimaksud dalam Pasal 11 ayat (2) dihentikan. KETENTUAN PERALIHAN",
DOC516,peraturan-bpom-no-1-tahun-2024.txt,BAB VI,,Pasal 19,,1,"Permohonan AHP yang telah diajukan sebelum berlakunya Peraturan Badan ini, tetap diproses berdasarkan Peraturan Badan Pengawas Obat dan Makanan Nomor 26 Tahun 2020 tentang Persyaratan dan Tata Cara Permohonan Analisa Hasil Pengawasan dalam rangka Impor dan Ekspor Narkotika, Psikotropika, dan Prekursor Farmasi.",
